snapshot	board_exact	non_empty_accuracy	macro_f1	move_recall	false_change_rate	status	description
autoresearch/snapshots/20260420T040454Z_hybrid_p8_m8_w3_v1224.py	0.071006	0.799339	0.749250	0.375000	0.020699	discard	Restore the compact props8 + minsep8 hybrid shelf anchored at lwindow3, beam3, top4, boardcands2, secsep1, radius0, drop1, props8, total150, and lmargin9.935836791992188. The latest executed bracket is harmful at 142.339380900065108903618238400667905807495117187499999999999999999999999999999999999999999999999999999999999999999805207171296986210373159609353691273203205188319069098565708440220932171203154136908467885704305432437997290273515851366978060055879330067907545077404356330214596775170232678675574788940139114856719970703125 and exact-flat at 142.33938090006510890361823840066790580749511718750000000000000000000000000000000000000000000000000000000000000000031418198177905449939812924564666833186687553265501203457143799964365778838200945659924534563821704445484308020400669134358377410342043537434266922999297366094419874972543116342649227590300142765045166015625. This run re-prepares their midpoint, 142.3393809000651089036182384006679058074951171875000000000000000000000000000000000000000000000000000000000000000000596945765380203548856444275001798025350403604870405665685732199322949797925817967538566156712612384464201852387612713552809170796498827211251071536986649955793977624478319210510335324215702712535858154296875, with a short experiment name to avoid filename-too-long failures.
autoresearch/snapshots/20260420T040601Z_hybrid_p8_m8_w3_v1225.py	0.071006	0.789778	0.739821	0.375000	0.024580	discard	Restore the compact props8 + minsep8 hybrid shelf anchored at lwindow3, beam3, top4, boardcands2, secsep1, radius0, drop1, props8, total150, and lmargin9.935836791992188. The latest executed bracket is harmful at 142.339380900065108903618238400667905807495117187499999999999999999999999999999999999999999999999999999999999999999805207171296986210373159609353691273203205188319069098565708440220932171203154136908467885704305432437997290273515851366978060055879330067907545077404356330214596775170232678675574788940139114856719970703125 and exact-flat at 142.3393809000651089036182384006679058074951171875000000000000000000000000000000000000000000000000000000000000000000596945765380203548856444275001798025350403604870405665685732199322949797925817967538566156712612384464201852387612713552809170796498827211251071536986649955793977624478319210510335324215702712535858154296875. This run re-prepares their midpoint, 142.33938090006510890361823840066790580749511718749999999999999999999999999999999999999999999999999999999999999999993245087391750328262940201842693553786912277440305483256714083007661357549786796683116225068778333544220873775613856136112948856776460639451632611555151066289699726880903229986330416068085469305515289306640625, with a short experiment name to avoid filename-too-long failures.
autoresearch/snapshots/20260420T040705Z_hybrid_p8_m8_w3_v1226.py	0.071006	0.789778	0.739821	0.375000	0.024580	discard	Restore the compact props8 + minsep8 hybrid shelf anchored at lwindow3, beam3, top4, boardcands2, secsep1, radius0, drop1, props8, total150, and lmargin9.935836791992188. The latest executed bracket is harmful at 142.33938090006510890361823840066790580749511718749999999999999999999999999999999999999999999999999999999999999999993245087391750328262940201842693553786912277440305483256714083007661357549786796683116225068778333544220873775613856136112948856776460639451632611555151066289699726880903229986330416068085469305515289306640625 and exact-flat at 142.3393809000651089036182384006679058074951171875000000000000000000000000000000000000000000000000000000000000000000596945765380203548856444275001798025350403604870405665685732199322949797925817967538566156712612384464201852387612713552809170796498827211251071536986649955793977624478319210510335324215702712535858154296875. This run re-prepares their midpoint, 142.339380900065108903618238400667905807495117187499999999999999999999999999999999999999999999999999999999999999999996072725227761818757523222963557670202081567445047699567857025004454277645224881792509433179522286944314461497449916358205202823707244557820716634625087829238197515628432110457168846551212482154369354248046875, with a short experiment name to avoid filename-too-long failures.
autoresearch/snapshots/20260420T040811Z_hybrid_p8_m8_w3_v1227.py	0.071006	0.789778	0.739821	0.375000	0.024580	discard	Restore the compact props8 + minsep8 hybrid shelf anchored at lwindow3, beam3, top4, boardcands2, secsep1, radius0, drop1, props8, total150, and lmargin9.935836791992188. The latest executed bracket is harmful at 142.33938090006510890361823840066790580749511718749999999999999999999999999999999999999999999999999999999999999999993245087391750328262940201842693553786912277440305483256714083007661357549786796683116225068778333544220873775613856136112948856776460639451632611555151066289699726880903229986330416068085469305515289306640625 and exact-flat at 142.3393809000651089036182384006679058074951171874999999999999999999999999999999999999999999999999999999999999999990596945765380203548856444275001798025350403604870405665685732199322949797925817967538566156712612384464201852387612713552809170796498827211251071536986649955793977624478319210510335324215702712535858154296875. This run re-prepares their midpoint, 142.339380900065108903618238400667905807495117187499999999999999999999999999999999999999999999999999999999999999999496072725227761818757523222963557670202081567445047699567857025004454277645224881792509433179522286944314461497449916358205202823707244557820716634625087829238197515628432110457168846551212482154369354248046875, with a short experiment name to avoid filename-too-long failures.
autoresearch/snapshots/20260420T040931Z_hybrid_p8_m8_w3_v1228.py	0.071006	0.789778	0.739821	0.375000	0.024580	discard	Restore the compact props8 + minsep8 hybrid shelf anchored at lwindow3, beam3, top4, boardcands2, secsep1, radius0, drop1, props8, total150, and lmargin9.935836791992188. The latest executed bracket is harmful at 142.339380900065108903618238400667905807495117187499999999999999999999999999999999999999999999999999999999999999999496072725227761818757523222963557670202081567445047699567857025004454277645224881792509433179522286944314461497449916358205202823707244557820716634625087829238197515628432110457168846551212482154369354248046875 and exact-flat at 142.3393809000651089036182384006679058074951171875000000000000000000000000000000000000000000000000000000000000000000596945765380203548856444275001798025350403604870405665685732199322949797925817967538566156712612384464201852387612713552809170796498827211251071536986649955793977624478319210510335324215702712535858154296875. This run re-prepares their midpoint, 142.3393809000651089036182384006679058074951171874999999999999999999999999999999999999999999999999999999999999999997778836508828910868215838252318687363685609639660441330682151224683746287189033392731830244253917626953673233681055938567430599516785636394729118941618764124087976390381320157541011894863913767039775848388671875, with a short experiment name to avoid filename-too-long failures.
autoresearch/snapshots/20260420T041045Z_hybrid_p8_m8_w3_v1229.py	0.071006	0.789778	0.739821	0.375000	0.024580	discard	Restore the compact props8 + minsep8 hybrid shelf anchored at lwindow3, beam3, top4, boardcands2, secsep1, radius0, drop1, props8, total150, and lmargin9.935836791992188. The latest executed bracket is harmful at 142.3393809000651089036182384006679058074951171874999999999999999999999999999999999999999999999999999999999999999997778836508828910868215838252318687363685609639660441330682151224683746287189033392731830244253917626953673233681055938567430599516785636394729118941618764124087976390381320157541011894863913767039775848388671875 and exact-flat at 142.3393809000651089036182384006679058074951171874999999999999999999999999999999999999999999999999999999999999999990596945765380203548856444275001798025350403604870405665685732199322949797925817967538566156712612384464201852387612713552809170796498827211251071536986649955793977624478319210510335324215702712535858154296875. This run re-prepares their midpoint, 142.33938090006510890361823840066790580749511718749999999999999999999999999999999999999999999999999999999999999999941878911371045572085361412636602426945180066222654234981839417120033480425574256801351982004832650057089375430343343260601198851566422318029900952393027070399409770074298196840256736095398082397878170013427734375, with a short experiment name to avoid filename-too-long failures.
autoresearch/snapshots/20260420T041200Z_hybrid_p8_m8_w3_v1230.py	0.071006	0.789778	0.739821	0.375000	0.024580	discard	Restore the compact props8 + minsep8 hybrid shelf anchored at lwindow3, beam3, top4, boardcands2, secsep1, radius0, drop1, props8, total150, and lmargin9.935836791992188. The latest executed bracket is harmful at 142.33938090006510890361823840066790580749511718749999999999999999999999999999999999999999999999999999999999999999941878911371045572085361412636602426945180066222654234981839417120033480425574256801351982004832650057089375430343343260601198851566422318029900952393027070399409770074298196840256736095398082397878170013427734375 and exact-flat at 142.3393809000651089036182384006679058074951171875000000000000000000000000000000000000000000000000000000000000000000596945765380203548856444275001798025350403604870405665685732199322949797925817967538566156712612384464201852387612713552809170796498827211251071536986649955793977624478319210510335324215702712535858154296875. This run re-prepares their midpoint, 142.339380900065108903618238400667905807495117187499999999999999999999999999999999999999999999999999999999999999999739241845124238037869629276933102035993420511356791458193483695566314892024162182383688217859793869508656969771097351980646452797657052950712058338814467849786747731595406944726800446687775547616183757781982421875, with a short experiment name to avoid filename-too-long failures.
autoresearch/snapshots/20260420T041318Z_hybrid_p8_m8_w3_v1231.py	0.071006	0.789778	0.739821	0.375000	0.024580	discard	Restore the compact props8 + minsep8 hybrid shelf anchored at lwindow3, beam3, top4, boardcands2, secsep1, radius0, drop1, props8, total150, and lmargin9.935836791992188. The latest executed bracket is harmful at 142.339380900065108903618238400667905807495117187499999999999999999999999999999999999999999999999999999999999999999739241845124238037869629276933102035993420511356791458193483695566314892024162182383688217859793869508656969771097351980646452797657052950712058338814467849786747731595406944726800446687775547616183757781982421875 and exact-flat at 142.3393809000651089036182384006679058074951171875000000000000000000000000000000000000000000000000000000000000000000596945765380203548856444275001798025350403604870405665685732199322949797925817967538566156712612384464201852387612713552809170796498827211251071536986649955793977624478319210510335324215702712535858154296875. This run re-prepares their midpoint, 142.3393809000651089036182384006679058074951171874999999999999999999999999999999999999999999999999999999999999999998994682108311291963776368522166409192642304359219160123810284577493049359083719895687724167655275539775385775049293116679636849386534678359185827462565664226830727470216194328889169895546729094348847866058349609375, with a short experiment name to avoid filename-too-long failures.
autoresearch/snapshots/20260420T041431Z_hybrid_p8_m8_w3_v1232.py	0.071006	0.789778	0.739821	0.375000	0.024580	discard	Restore the compact props8 + minsep8 hybrid shelf anchored at lwindow3, beam3, top4, boardcands2, secsep1, radius0, drop1, props8, total150, and lmargin9.935836791992188. The latest executed bracket is harmful at 142.3393809000651089036182384006679058074951171874999999999999999999999999999999999999999999999999999999999999999998994682108311291963776368522166409192642304359219160123810284577493049359083719895687724167655275539775385775049293116679636849386534678359185827462565664226830727470216194328889169895546729094348847866058349609375 and exact-flat at 142.3393809000651089036182384006679058074951171875000000000000000000000000000000000000000000000000000000000000000000596945765380203548856444275001798025350403604870405665685732199322949797925817967538566156712612384464201852387612713552809170796498827211251071536986649955793977624478319210510335324215702712535858154296875. This run re-prepares their midpoint, 142.33938090006510890361823840066790580749511718749999999999999999999999999999999999999999999999999999999999999999997958139368457477563164063985841036089963539820447828947480083884079995785047689316131451621839439621197938137184529151162230100915167527852184494997761570913123525473472567696997526098812159034423530101776123046875, with a short experiment name to avoid filename-too-long failures.
autoresearch/snapshots/20260420T041549Z_hybrid_p8_m8_w3_v1233.py	0.071006	0.799339	0.749250	0.375000	0.020699	discard	Restore the compact props8 + minsep8 hybrid shelf anchored at lwindow3, beam3, top4, boardcands2, secsep1, radius0, drop1, props8, total150, and lmargin9.935836791992188. The latest executed bracket is harmful at 142.33938090006510890361823840066790580749511718749999999999999999999999999999999999999999999999999999999999999999997958139368457477563164063985841036089963539820447828947480083884079995785047689316131451621839439621197938137184529151162230100915167527852184494997761570913123525473472567696997526098812159034423530101776123046875 and exact-flat at 142.3393809000651089036182384006679058074951171875000000000000000000000000000000000000000000000000000000000000000000596945765380203548856444275001798025350403604870405665685732199322949797925817967538566156712612384464201852387612713552809170796498827211251071536986649955793977624478319210510335324215702712535858154296875. This run re-prepares their midpoint, 142.339380900065108903618238400667905807495117187500000000000000000000000000000000000000000000000000000000000000000019637985111297565258642533679295081717337879345759428021687029386547468821529344957585565944827817329199783305303281433451609044400778999823476051838140352355316508591278799010504396704845930798910558223724365234375, with a short experiment name to avoid filename-too-long failures.
autoresearch/snapshots/20260420T041754Z_hybrid_p8_m8_w3_v1234.py	0.071006	0.789778	0.739821	0.375000	0.024580	discard	Restore the compact props8 + minsep8 hybrid shelf anchored at lwindow3, beam3, top4, boardcands2, secsep1, radius0, drop1, props8, total150, and lmargin9.935836791992188. The latest executed bracket is harmful at 142.33938090006510890361823840066790580749511718749999999999999999999999999999999999999999999999999999999999999999997958139368457477563164063985841036089963539820447828947480083884079995785047689316131451621839439621197938137184529151162230100915167527852184494997761570913123525473472567696997526098812159034423530101776123046875 and exact-flat at 142.339380900065108903618238400667905807495117187500000000000000000000000000000000000000000000000000000000000000000019637985111297565258642533679295081717337879345759428021687029386547468821529344957585565944827817329199783305303281433451609044400778999823476051838140352355316508591278799010504396704845930798910558223724365234375. This run re-prepares their midpoint, 142.3393809000651089036182384006679058074951171874999999999999999999999999999999999999999999999999999999999999999999996096893979361704451415867688527213084866387751188587482439341136737133360031190594500410816111067705895823385742864725369550267762271391726605009078780307432758816630022379902398288464837605715729296207427978515625, with a short experiment name to avoid filename-too-long failures.
autoresearch/snapshots/20260420T041920Z_hybrid_p8_m8_w3_v1235.py	0.071006	0.799339	0.749250	0.375000	0.020699	discard	Restore the compact props8 + minsep8 hybrid shelf anchored at lwindow3, beam3, top4, boardcands2, secsep1, radius0, drop1, props8, total150, and lmargin9.935836791992188. The latest executed bracket is harmful at 142.3393809000651089036182384006679058074951171874999999999999999999999999999999999999999999999999999999999999999999996096893979361704451415867688527213084866387751188587482439341136737133360031190594500410816111067705895823385742864725369550267762271391726605009078780307432758816630022379902398288464837605715729296207427978515625 and exact-flat at 142.339380900065108903618238400667905807495117187500000000000000000000000000000000000000000000000000000000000000000019637985111297565258642533679295081717337879345759428021687029386547468821529344957585565944827817329199783305303281433451609044400778999823476051838140352355316508591278799010504396704845930798910558223724365234375. This run re-prepares their midpoint, 142.33938090006510890361823840066790580749511718750000000000000000000000000000000000000000000000000000000000000000000962383725461686785189206022407390151291225906043914338496548175011059107876623200851780351321946204989468282193878395299428203558850306949806827637300919154929619512714051850037211277566484568524174392223358154296875, with a short experiment name to avoid filename-too-long failures.
autoresearch/snapshots/20260420T042035Z_hybrid_p8_m8_w3_v1236.py	0.071006	0.799339	0.749250	0.375000	0.020699	discard	Restore the compact props8 + minsep8 hybrid shelf anchored at lwindow3, beam3, top4, boardcands2, secsep1, radius0, drop1, props8, total150, and lmargin9.935836791992188. The latest executed bracket is harmful at 142.3393809000651089036182384006679058074951171874999999999999999999999999999999999999999999999999999999999999999999996096893979361704451415867688527213084866387751188587482439341136737133360031190594500410816111067705895823385742864725369550267762271391726605009078780307432758816630022379902398288464837605715729296207427978515625 and exact-flat at 142.339380900065108903618238400667905807495117187500000000000000000000000000000000000000000000000000000000000000000019637985111297565258642533679295081717337879345759428021687029386547468821529344957585565944827817329199783305303281433451609044400778999823476051838140352355316508591278799010504396704845930798910558223724365234375. This run re-prepares their midpoint, 142.33938090006510890361823840066790580749511718750000000000000000000000000000000000000000000000000000000000000000000962383725461686785189206022407390151291225906043914338496548175011059107876623200851780351321946204989468282193878395299428203558850306949806827637300919154929619512714051850037211277566484568524174392223358154296875, with a short experiment name to avoid filename-too-long failures.
autoresearch/snapshots/20260420T042201Z_hybrid_p8_m8_w3_v1237.py	0.071006	0.799339	0.749250	0.375000	0.020699	discard	Restore the compact props8 + minsep8 hybrid shelf anchored at lwindow3, beam3, top4, boardcands2, secsep1, radius0, drop1, props8, total150, and lmargin9.935836791992188. The latest executed bracket is harmful at 142.3393809000651089036182384006679058074951171874999999999999999999999999999999999999999999999999999999999999999999996096893979361704451415867688527213084866387751188587482439341136737133360031190594500410816111067705895823385742864725369550267762271391726605009078780307432758816630022379902398288464837605715729296207427978515625 and exact-flat at 142.33938090006510890361823840066790580749511718750000000000000000000000000000000000000000000000000000000000000000000962383725461686785189206022407390151291225906043914338496548175011059107876623200851780351321946204989468282193878395299428203558850306949806827637300919154929619512714051850037211277566484568524174392223358154296875. This run re-prepares their midpoint, 142.339380900065108903618238400667905807495117187500000000000000000000000000000000000000000000000000000000000000000004616763326276519148516823496463311410699448917779001066604707931892152207384675533983922297415284410242132580256535212765618531182365104335364388640443611146286038395071378245305970811074303128407336771488189697265625, with a short experiment name to avoid filename-too-long failures.
autoresearch/snapshots/20260420T042713Z_hybrid_p8_m8_w3_v1238.py	0.071006	0.799339	0.749250	0.375000	0.020699	discard	Restore the compact props8 + minsep8 hybrid shelf anchored at lwindow3, beam3, top4, boardcands2, secsep1, radius0, drop1, props8, total150, and lmargin9.935836791992188. The latest executed bracket is harmful at 142.3393809000651089036182384006679058074951171874999999999999999999999999999999999999999999999999999999999999999999996096893979361704451415867688527213084866387751188587482439341136737133360031190594500410816111067705895823385742864725369550267762271391726605009078780307432758816630022379902398288464837605715729296207427978515625 and exact-flat at 142.339380900065108903618238400667905807495117187500000000000000000000000000000000000000000000000000000000000000000004616763326276519148516823496463311410699448917779001066604707931892152207384675533983922297415284410242132580256535212765618531182365104335364388640443611146286038395071378245305970811074303128407336771488189697265625. This run re-prepares their midpoint, 142.3393809000651089036182384006679058074951171875000000000000000000000000000000000000000000000000000000000000000000021132263621063447968292051326580163595930438464489299074243210227829327716938972967169816895131955904158574594154108426512867789792961217540124447741608209447809600290368081177728998287790318499901331961154937744140625, with a short experiment name to avoid filename-too-long failures.
