snapshot	board_exact	non_empty_accuracy	macro_f1	move_recall	false_change_rate	status	description
autoresearch/snapshots/20260419T022457Z_hybrid_lookahead_segmental_drop1_boardcands4_ratio95_props16_top4_detect12p5_minsep4_thresh3_total150_permove125_m9p8957061767578125_r0_beam4_v409.py	0.074556	0.764405	0.723227	0.312500	0.019405	discard	Hybrid decoder keeps the baseline lookahead path unless a conservative board-only segmental pass wins the current score-gain gates, while following up the restored beam4 minsep4 best surface after both lower and higher hybrid total-gain probes were exact no-ops, the per-move gate showed only a tight lower-side cliff, nearby move-score-margin probes were exact no-ops, and the segmental board-change peak threshold proved asymmetric with stricter settings degrading while a looser setting was a no-op, and raising only the segmental detect peak threshold from 0.1 to 0.125 on the restored baseline branch to test whether that stricter-threshold sensitivity is specific to board-change proposals or whether the broader event-proposal gate also has a similar upper-side cliff.
autoresearch/snapshots/20260419T022548Z_hybrid_lookahead_segmental_drop1_boardcands4_ratio95_props16_top4_detect7p5_minsep4_thresh3_total150_permove125_m9p8957061767578125_r0_beam4_v410.py	0.074556	0.764405	0.723227	0.312500	0.019405	discard	Hybrid decoder keeps the baseline lookahead path unless a conservative board-only segmental pass wins the current score-gain gates, while following up the restored beam4 minsep4 best surface after both lower and higher hybrid total-gain probes were exact no-ops, the per-move gate showed only a tight lower-side cliff, the segmental board-change peak threshold proved asymmetric with stricter settings degrading while a looser setting was a no-op, and raising the segmental detect peak threshold from 0.1 to 0.125 was also an exact no-op, and lowering only the segmental detect peak threshold from 0.1 to 0.075 on the restored baseline branch to test whether that broader event-proposal gate also has a lower-side cliff or instead sits on a local plateau.
autoresearch/snapshots/20260419T022642Z_hybrid_lookahead_segmental_drop1_boardcands4_ratio95_props16_top4_detect10_minsep4_thresh3_total150_permove125_m9p8957061767578125_anom30_r0_beam4_v411.py	0.074556	0.764405	0.723227	0.312500	0.019405	discard	Hybrid decoder keeps the baseline lookahead path unless a conservative board-only segmental pass wins the current score-gain gates, while following up the restored beam4 minsep4 best surface after both lower and higher hybrid total-gain probes were exact no-ops, the per-move gate showed only a tight lower-side cliff, the segmental board-change threshold proved asymmetric with stricter settings degrading while a looser setting was a no-op, and both stricter and looser detect-peak probes were exact no-ops, and raising only anomaly change evidence threshold from 0.25 to 0.30 on the restored baseline branch to test whether the remaining decoder sensitivity now sits in the anomaly gating path rather than the event-proposal thresholds.
autoresearch/snapshots/20260419T022728Z_hybrid_lookahead_segmental_drop1_boardcands4_ratio95_props16_top4_detect10_minsep4_thresh3_total150_permove125_m9p8957061767578125_anom20_r0_beam4_v412.py	0.074556	0.764405	0.723227	0.312500	0.019405	discard	Hybrid decoder keeps the baseline lookahead path unless a conservative board-only segmental pass wins the current score-gain gates, while following up the restored beam4 minsep4 best surface after both lower and higher hybrid total-gain probes were exact no-ops, the per-move gate showed only a tight lower-side cliff, the segmental board-change threshold proved asymmetric with stricter settings degrading while a looser setting was a no-op, and both stricter and looser detect-peak probes were exact no-ops, and raising anomaly change evidence threshold from 0.25 to 0.30 was also an exact no-op, and lowering only anomaly change evidence threshold from 0.25 to 0.20 on the restored baseline branch to test whether the anomaly gating path also sits on a local plateau or has a lower-side cliff.
autoresearch/snapshots/20260419T022822Z_hybrid_lookahead_segmental_drop1_boardcands4_ratio95_props16_top4_detect10_minsep4_thresh3_total150_permove125_m9p8957061767578125_anomsettle5_r0_beam4_v413.py	0.074556	0.764405	0.723227	0.312500	0.019405	discard	Hybrid decoder keeps the baseline lookahead path unless a conservative board-only segmental pass wins the current score-gain gates, while following up the restored beam4 minsep4 best surface after both lower and higher hybrid total-gain probes were exact no-ops, the per-move gate showed only a tight lower-side cliff, the segmental board-change threshold proved asymmetric with stricter settings degrading while a looser setting was a no-op, both stricter and looser detect-peak probes were exact no-ops, and anomaly change evidence threshold was also flat in both directions, and raising only anomaly settled gain threshold from 0.0 to 0.05 on the restored baseline branch to test whether the remaining decoder sensitivity now sits in the anomaly settled-gain gate rather than the already-flat threshold knobs.
autoresearch/snapshots/20260419T022909Z_hybrid_lookahead_segmental_drop0_boardcands4_ratio95_props16_top4_detect10_minsep4_thresh3_total150_permove125_m9p8957061767578125_r0_beam4_v414.py	0.074556	0.759651	0.717250	0.343750	0.021992	discard	Hybrid decoder keeps the baseline lookahead path unless a conservative board-only segmental pass wins the current score-gain gates, while following up the restored beam4 minsep4 best surface after both lower and higher hybrid total-gain probes were exact no-ops, the per-move gate showed only a tight lower-side cliff, the segmental board-change threshold proved asymmetric with stricter settings degrading while a looser setting was a no-op, detect-peak probes were flat in both directions, and both anomaly thresholds tried so far were also exact no-ops, and lowering only segment_board_drop_worst_frames from 1 to 0 on the restored baseline branch to test whether the remaining decoder sensitivity sits in worst-frame suppression rather than the now-flat gating thresholds.
autoresearch/snapshots/20260419T022957Z_hybrid_lookahead_segmental_drop2_boardcands4_ratio95_props16_top4_detect10_minsep4_thresh3_total150_permove125_m9p8957061767578125_r0_beam4_v415.py	0.067456	0.758824	0.716237	0.328125	0.023286	discard	Hybrid decoder keeps the baseline lookahead path unless a conservative board-only segmental pass wins the current score-gain gates, while following up the restored beam4 minsep4 best surface after both lower and higher hybrid total-gain probes were exact no-ops, the per-move gate showed only a tight lower-side cliff, most recent gating thresholds stayed flat aside from a stricter-side board-change-threshold cliff, and lowering segment_board_drop_worst_frames from 1 to 0 reopened a worse higher-recall and higher-false-change regime, and raising only segment_board_drop_worst_frames from 1 to 2 on the restored baseline branch to test whether worst-frame suppression has a broader upper-side plateau or whether that decoder path is also sensitive on the stricter side.
autoresearch/snapshots/20260419T023104Z_hybrid_lookahead_segmental_drop0_boardcands4_ratio95_props16_top4_detect10_minsep4_thresh3_total150_permove137p5_m9p8957061767578125_r0_beam4_v416.py	0.074556	0.759651	0.717250	0.343750	0.021992	discard	Hybrid decoder keeps the baseline lookahead path unless a conservative board-only segmental pass wins the current score-gain gates, while following up the restored beam4 minsep4 best surface after most recent threshold probes stayed flat, segment_board_drop_worst_frames showed a local optimum at 1 with both 0 and 2 degrading the branch, and raising only the hybrid minimum score gain per added move from 125 to 137.5 was an exact no-op on the baseline branch, and combining only drop0 with that stricter per-move handoff gate to test whether the drop0 regression is simply excess segmental takeovers that a stricter handoff can recover.
autoresearch/snapshots/20260419T023219Z_hybrid_lookahead_segmental_drop0_boardcands1_ratio95_props16_top4_detect10_minsep4_thresh3_total150_permove125_m9p8957061767578125_r0_beam4_v417.py	0.074556	0.758462	0.710426	0.312500	0.020699	discard	Hybrid decoder keeps the baseline lookahead path unless a conservative board-only segmental pass wins the current score-gain gates, while following up the restored beam4 minsep4 best surface after most recent threshold probes stayed flat, segment_board_drop_worst_frames showed a local optimum at 1 with both 0 and 2 degrading the branch, and combining drop0 with a stricter per-move handoff did not recover that regression, and lowering only top-board breadth from 4 to 1 alongside drop0 on the restored baseline branch to test whether the drop0 regression is driven by overly broad board candidate search rather than worst-frame suppression alone.
autoresearch/snapshots/20260419T023334Z_hybrid_lookahead_segmental_drop0_boardcands4_ratio95_props16_top4_detect10_minsep4_thresh3p25_total150_permove125_m9p8957061767578125_r0_beam4_v418.py	0.074556	0.759651	0.717250	0.343750	0.021992	discard	Hybrid decoder keeps the baseline lookahead path unless a conservative board-only segmental pass wins the current score-gain gates, while following up the restored beam4 minsep4 best surface after most recent threshold probes stayed flat on the baseline branch, segment_board_drop_worst_frames showed a local optimum at 1 with both 0 and 2 degrading the branch, and neither a stricter per-move handoff nor narrower board-candidate breadth recovered the drop0 regression, and lowering segment_board_drop_worst_frames from 1 to 0 while also raising board-change peak threshold from 3.0/64.0 to 3.25/64.0 to test whether the drop0 regression is driven by excess noisy board-change proposals that a mildly stricter proposal gate can trim back.
autoresearch/snapshots/20260419T023441Z_hybrid_lookahead_segmental_drop0_boardcands2_ratio95_props16_top4_detect10_minsep4_thresh3_total150_permove125_m9p8957061767578125_r0_beam4_v419.py	0.074556	0.757429	0.714054	0.328125	0.020699	discard	Hybrid decoder keeps the baseline lookahead path unless a conservative board-only segmental pass wins the current score-gain gates, while following up the restored beam4 minsep4 best surface after most recent threshold probes stayed flat on the baseline branch, segment_board_drop_worst_frames showed a local optimum at 1 with both 0 and 2 degrading the branch, and pairing drop0 with a stricter per-move handoff or a mildly stricter board-change gate did not recover that regression, while pairing drop0 with boardcands1 recovered the baseline recall and reduced false-change but gave back too much secondary quality, and lowering only top-board breadth from 4 to 2 alongside drop0 on the restored baseline branch to test whether a moderate board-menu trim is the local sweet spot for that drop0 regime.
autoresearch/snapshots/20260419T023528Z_hybrid_lookahead_segmental_drop0_boardcands3_ratio95_props16_top4_detect10_minsep4_thresh3_total150_permove125_m9p8957061767578125_r0_beam4_v420.py	0.074556	0.759651	0.717250	0.343750	0.021992	discard	Hybrid decoder keeps the baseline lookahead path unless a conservative board-only segmental pass wins the current score-gain gates, while following up the restored beam4 minsep4 best surface after most recent threshold probes stayed flat on the baseline branch, segment_board_drop_worst_frames showed a local optimum at 1 with both 0 and 2 degrading the branch, and pairing drop0 with a stricter per-move handoff or a mildly stricter board-change gate did not recover that regression, while drop0 plus boardcands1 reduced false-change but gave back too much secondary quality and drop0 plus boardcands2 landed between those outcomes, and lowering only top-board breadth from 4 to 3 alongside drop0 on the restored baseline branch to complete the local board-width curve and test whether boardcands3 is the sweet spot for that drop0 regime.
autoresearch/snapshots/20260419T023723Z_hybrid_lookahead_segmental_drop0_boardcands1_ratio95_props16_top4_detect10_minsep4_thresh2p75_total150_permove125_m9p8957061767578125_r0_beam4_v421.py	0.074556	0.758462	0.710426	0.312500	0.020699	discard	Hybrid decoder keeps the baseline lookahead path unless a conservative board-only segmental pass wins the current score-gain gates, while following up the restored beam4 minsep4 best surface after most recent threshold probes stayed flat on the baseline branch, segment_board_drop_worst_frames showed a local optimum at 1 with both 0 and 2 degrading the branch, and pairing drop0 with boardcands1 recovered the baseline recall and reduced false-change but gave back too much secondary quality, and lowering only board-change peak threshold from 3.0/64.0 to 2.75/64.0 alongside that drop0 + boardcands1 surface to test whether a looser proposal gate can recover some of those secondaries without reopening the broader noisy-search regime.
autoresearch/snapshots/20260419T023836Z_hybrid_lookahead_segmental_drop1_boardcands4_ratio95_props16_top4_detect10_minsep4_thresh2p5_total150_permove125_m9p8957061767578125_r0_beam4_v422.py	0.074556	0.764405	0.723227	0.312500	0.019405	discard	Hybrid decoder keeps the baseline lookahead path unless a conservative board-only segmental pass wins the current score-gain gates, while following up the restored beam4 minsep4 best surface after most recent hybrid handoff, margin, detect-peak, and anomaly-threshold probes were exact no-ops on the baseline branch, stricter board-change peak thresholds 3.25/64.0 and 3.5/64.0 materially degraded the branch, and looser 2.75/64.0 was still an exact no-op, and lowering only the segmental board-change peak threshold further from 2.75/64.0 to 2.5/64.0 on the restored baseline branch to test whether that proposal-threshold sensitivity is a broad one-sided plateau or eventually reopens a worse looser-threshold regime.
autoresearch/snapshots/20260419T023942Z_hybrid_lookahead_segmental_drop0_boardcands4_ratio95_props16_top1_detect10_minsep4_thresh3_total150_permove125_m9p8957061767578125_r0_beam4_v423.py	0.074556	0.759651	0.717250	0.343750	0.021992	discard	Hybrid decoder keeps the baseline lookahead path unless a conservative board-only segmental pass wins the current score-gain gates, while following up the restored beam4 minsep4 best surface after most recent baseline probes stayed flat, segment_board_drop_worst_frames showed a local optimum at 1 with both 0 and 2 degrading the branch, narrowing board breadth only partly changed the drop0 tradeoff, and raising only top-move breadth from 1 to 4 was an exact no-op on the baseline branch, and lowering only top-move breadth from 4 to 1 alongside drop0 on the restored baseline branch to test whether the drop0 regression is driven by overly broad move-menu search rather than worst-frame suppression alone.
autoresearch/snapshots/20260419T024139Z_hybrid_lookahead_segmental_drop1_boardcands4_ratio95_props16_top4_detect10_minsep4_thresh2_total150_permove125_m9p8957061767578125_r0_beam4_v424.py	0.074556	0.764095	0.723030	0.296875	0.020699	discard	Hybrid decoder keeps the baseline lookahead path unless a conservative board-only segmental pass wins the current score-gain gates, while following up the restored beam4 minsep4 best surface after most recent hybrid handoff, margin, detect-peak, and anomaly-threshold probes were exact no-ops on the baseline branch, stricter board-change peak thresholds 3.25/64.0 and 3.5/64.0 materially degraded the branch, and looser 2.75/64.0 plus 2.5/64.0 were still exact no-ops, and lowering only the segmental board-change peak threshold further from 2.5/64.0 to 2.0/64.0 on the restored baseline branch to test whether that proposal-threshold sensitivity is a broad one-sided plateau or eventually reopens a worse looser-threshold regime.
autoresearch/snapshots/20260419T024302Z_hybrid_lookahead_segmental_drop1_boardcands4_ratio95_props16_top4_detect10_minsep4_thresh3_total150_permove125_movew5_m9p8957061767578125_r0_beam4_v425.py	0.074556	0.764405	0.723227	0.312500	0.019405	discard	Hybrid decoder keeps the baseline lookahead path unless a conservative board-only segmental pass wins the current score-gain gates, while following up the restored beam4 minsep4 best surface after recent hybrid handoff, move-menu, board-width, detect/anomaly-threshold, and looser board-change-threshold probes mostly stayed flat on the baseline branch, and the worst-frame-suppression side branch did not produce a better tradeoff, and adding only a small non-zero move-score contribution on the restored baseline branch to test whether temporal ambiguity can benefit from a slight move prior without leaving the current board-dominant decoder regime.
autoresearch/snapshots/20260419T024842Z_hybrid_lookahead_segmental_drop1_boardcands4_ratio95_props16_top4_detect10_detectw5_minsep4_thresh3_total150_permove125_m9p8957061767578125_r0_beam4_v426.py	0.074556	0.764405	0.723227	0.312500	0.019405	discard	Hybrid decoder keeps the baseline lookahead path unless a conservative board-only segmental pass wins the current score-gain gates, while following up the restored beam4 minsep4 best surface after recent hybrid handoff, move-menu, board-width, detect/anomaly-threshold, and looser board-change-threshold probes mostly stayed flat on the baseline branch, and adding a small non-zero move-score contribution was also an exact no-op, and adding only a small non-zero detect-score contribution on the restored baseline branch to test whether temporal ambiguity can benefit from a slight detection prior without leaving the current board-dominant decoder regime.
autoresearch/snapshots/20260419T024935Z_hybrid_lookahead_segmental_drop1_boardcands4_ratio95_props16_top4_detect10_minsep4_thresh3_total150_permove125_lmargin9p5_m9p8957061767578125_r0_beam4_v427.py	0.074556	0.764353	0.723159	0.328125	0.019405	keep	Hybrid decoder keeps the baseline lookahead path unless a conservative board-only segmental pass wins the current score-gain gates, while following up the restored beam4 minsep4 best surface after recent hybrid handoff, move-menu, board-width, detect/anomaly-threshold, looser board-change-threshold, and tiny move and detect prior probes mostly stayed flat on the baseline branch, and lowering only the baseline lookahead margin from 10.0 to 9.5 on the restored baseline branch to test whether a slightly less conservative lookahead path helps temporal ambiguity resolution without changing the current segmental search surface.
autoresearch/snapshots/20260419T025028Z_hybrid_lookahead_segmental_drop1_boardcands4_ratio95_props16_top4_detect10_minsep4_thresh3_total150_permove125_lmargin9_m9p8957061767578125_r0_beam4_v428.py	0.074556	0.764302	0.723065	0.328125	0.020699	discard	Hybrid decoder keeps the baseline lookahead path unless a conservative board-only segmental pass wins the current score-gain gates, while following up the new kept beam4 minsep4 best surface after recent hybrid handoff, move-menu, board-width, detect/anomaly-threshold, looser board-change-threshold, and tiny move and detect prior probes mostly stayed flat on the baseline branch, and lowering the baseline lookahead margin from 10.0 to 9.5 improved move-detection recall at unchanged board_exact and false-change, and lowering only that lookahead margin further from 9.5 to 9.0 on the restored baseline branch to test whether the new lookahead improvement continues on the looser side or whether 9.5 is already the local sweet spot.
autoresearch/snapshots/20260419T025114Z_hybrid_lookahead_segmental_drop1_boardcands4_ratio95_props16_top4_detect10_minsep4_thresh3_total150_permove125_lmargin9p75_m9p8957061767578125_r0_beam4_v429.py	0.074556	0.764353	0.723159	0.328125	0.019405	discard	Hybrid decoder keeps the baseline lookahead path unless a conservative board-only segmental pass wins the current score-gain gates, while following up the new kept beam4 minsep4 best surface after lowering the baseline lookahead margin from 10.0 to 9.5 improved move-detection recall at unchanged board_exact and false-change, and lowering it further to 9.0 kept the recall gain but worsened false-change and secondary metrics, and raising only that lookahead margin from 9.5 to 9.75 on the restored baseline branch to test whether the recall improvement already appears closer to the original margin or whether 9.5 is the local sweet spot.
autoresearch/snapshots/20260419T025213Z_hybrid_lookahead_segmental_drop1_boardcands4_ratio95_props16_top4_detect10_lwindow3_minsep4_thresh3_total150_permove125_lmargin9p5_m9p8957061767578125_r0_beam4_v430.py	0.049704	0.756860	0.711660	0.359375	0.028461	discard	Hybrid decoder keeps the baseline lookahead path unless a conservative board-only segmental pass wins the current score-gain gates, while following up the new kept beam4 minsep4 best surface after lowering the baseline lookahead margin from 10.0 to 9.5 improved move-detection recall at unchanged board_exact and false-change, lowering it further to 9.0 worsened false-change, and raising it back toward 10.0 to 9.75 was an exact no-op against the new best, and raising only the baseline lookahead window from 2 to 3 on the restored 9.5-margin branch to test whether a bit more temporal context improves ambiguity resolution without changing the current segmental search surface.
