snapshot	board_exact	non_empty_accuracy	macro_f1	move_recall	false_change_rate	status	description
autoresearch/snapshots/20260420T061748Z_hybrid_p8_m8_w3_v1318.py	0.071006	0.789778	0.739821	0.375000	0.024580	discard	Restore the compact props8 + minsep8 hybrid shelf anchored at lwindow3, beam3, top4, boardcands2, secsep1, radius0, drop1, props8, total150, and lmargin9.935836791992188. The latest executed bracket is harmful at 142.3393809000651089036182384006679058074951171874999999999999999999999999999999999999999999999999999999999999999999999999999999999999997457867826101762505858238516552685182527951672684132048716456143419012764288571484944574214224609999870173959283560640042953050098464106595748974228491985980743376898627605532739660244748038636645433206552348627904383548450613448249635339910379261709749698638916015625 and exact-flat at 142.3393809000651089036182384006679058074951171875000000000000000000000000000000000000000000000000000000000000000000000000000000000000000672393766177256330424074910784602972537574462765183853337335879374953431025283528634012829948374834542454748128890711862627399509325778964496254531069103972031261514815116229303364279925342200461123252360892122311763738665927464532856561123901046812534332275390625. This run prepares their exact midpoint, 142.33938090006510890361823840066790580749511718749999999999999999999999999999999999999999999999999999999999999999999999999999999999999990651307961395094181411567136686440775327630677246579510268960113969830976569275067892935220864924172063143537062256759527902248038949427801226143797805449763873192067213608810215122623366904185532782294566203751080736435582704563912459505171401542611420154571533203125, with a short experiment name to avoid filename-too-long failures.
autoresearch/snapshots/20260420T061857Z_hybrid_p8_m8_w3_v1319.py	0.071006	0.789778	0.739821	0.375000	0.024580	discard	Restore the compact props8 + minsep8 hybrid shelf anchored at lwindow3, beam3, top4, boardcands2, secsep1, radius0, drop1, props8, total150, and lmargin9.935836791992188. The latest executed bracket is harmful at 142.33938090006510890361823840066790580749511718749999999999999999999999999999999999999999999999999999999999999999999999999999999999999990651307961395094181411567136686440775327630677246579510268960113969830976569275067892935220864924172063143537062256759527902248038949427801226143797805449763873192067213608810215122623366904185532782294566203751080736435582704563912459505171401542611420154571533203125 and exact-flat at 142.3393809000651089036182384006679058074951171875000000000000000000000000000000000000000000000000000000000000000000000000000000000000000672393766177256330424074910784602972537574462765183853337335879374953431025283528634012829948374834542454748128890711862627399509325778964496254531069103972031261514815116229303364279925342200461123252360892122311763738665927464532856561123901046812534332275390625. This run prepares their exact midpoint, 142.339380900065108903618238400667905807495117187499999999999999999999999999999999999999999999999999999999999999999999999999999999999999986876228115838287428261581222662352503516876524492090218211594538596826434110551771165317601743362587438455091755819390770881215661036087230943445542482447420929036076823855516243827113101630950720074090875624870991869111209896046205125582052060053683817386627197265625, with a short experiment name to avoid filename-too-long failures.
autoresearch/snapshots/20260420T062024Z_hybrid_p8_m8_w3_v1320.py	0.071006	0.799339	0.749250	0.375000	0.020699	discard	Restore the compact props8 + minsep8 hybrid shelf anchored at lwindow3, beam3, top4, boardcands2, secsep1, radius0, drop1, props8, total150, and lmargin9.935836791992188. The latest executed bracket is harmful at 142.339380900065108903618238400667905807495117187499999999999999999999999999999999999999999999999999999999999999999999999999999999999999986876228115838287428261581222662352503516876524492090218211594538596826434110551771165317601743362587438455091755819390770881215661036087230943445542482447420929036076823855516243827113101630950720074090875624870991869111209896046205125582052060053683817386627197265625 and exact-flat at 142.3393809000651089036182384006679058074951171875000000000000000000000000000000000000000000000000000000000000000000000000000000000000000672393766177256330424074910784602972537574462765183853337335879374953431025283528634012829948374834542454748128890711862627399509325778964496254531069103972031261514815116229303364279925342200461123252360892122311763738665927464532856561123901046812534332275390625. This run prepares their exact midpoint, 142.3393809000651089036182384006679058074951171875000000000000000000000000000000000000000000000000000000000000000000000000000000000000000270578023667819602353345361505613248786371614005052377759725912380460847683194523172833002982904230208419649523224452885168105832968069918402844493246964223120275937791677392232901275528179254984161996634824185510841214889013212497453908472210823674686253070831298828125, with a short experiment name to avoid filename-too-long failures.
autoresearch/snapshots/20260420T062140Z_hybrid_p8_m8_w3_v1321.py	0.071006	0.799339	0.749250	0.375000	0.020699	discard	Restore the compact props8 + minsep8 hybrid shelf anchored at lwindow3, beam3, top4, boardcands2, secsep1, radius0, drop1, props8, total150, and lmargin9.935836791992188. The latest executed bracket is harmful at 142.339380900065108903618238400667905807495117187499999999999999999999999999999999999999999999999999999999999999999999999999999999999999986876228115838287428261581222662352503516876524492090218211594538596826434110551771165317601743362587438455091755819390770881215661036087230943445542482447420929036076823855516243827113101630950720074090875624870991869111209896046205125582052060053683817386627197265625 and exact-flat at 142.3393809000651089036182384006679058074951171875000000000000000000000000000000000000000000000000000000000000000000000000000000000000000270578023667819602353345361505613248786371614005052377759725912380460847683194523172833002982904230208419649523224452885168105832968069918402844493246964223120275937791677392232901275528179254984161996634824185510841214889013212497453908472210823674686253070831298828125. This run prepares their exact midpoint, 142.33938090006510890361823840066790580749511718750000000000000000000000000000000000000000000000000000000000000000000000000000000000000000696701524131012383179805868661183869107701896249866399709209288832145560121500204422430895001689280414021002203913233964384589947892153953561394743358943486647831492799579736976697733295977822456813687717902171103799530005560864797525821463657121057622134685516357421875, with a short experiment name to avoid filename-too-long failures.
autoresearch/snapshots/20260420T062302Z_hybrid_p8_m8_w3_v1322.py	0.071006	0.789778	0.739821	0.375000	0.024580	discard	Restore the compact props8 + minsep8 hybrid shelf anchored at lwindow3, beam3, top4, boardcands2, secsep1, radius0, drop1, props8, total150, and lmargin9.935836791992188. The latest executed bracket is harmful at 142.339380900065108903618238400667905807495117187499999999999999999999999999999999999999999999999999999999999999999999999999999999999999986876228115838287428261581222662352503516876524492090218211594538596826434110551771165317601743362587438455091755819390770881215661036087230943445542482447420929036076823855516243827113101630950720074090875624870991869111209896046205125582052060053683817386627197265625 and exact-flat at 142.33938090006510890361823840066790580749511718750000000000000000000000000000000000000000000000000000000000000000000000000000000000000000696701524131012383179805868661183869107701896249866399709209288832145560121500204422430895001689280414021002203913233964384589947892153953561394743358943486647831492799579736976697733295977822456813687717902171103799530005560864797525821463657121057622134685516357421875. This run prepares their exact midpoint, 142.339380900065108903618238400667905807495117187499999999999999999999999999999999999999999999999999999999999999999999999999999999999999996921621678574205630029819954637095597296947743495377107651843713459141017662776907694813275880127695789332556897475865207363557569978813383278696488035941143703675502409826443005402223030704587644105484027323291014932205632752347090191898344315632130019366741180419921875, with a short experiment name to avoid filename-too-long failures.
autoresearch/snapshots/20260420T062422Z_hybrid_p8_m8_w3_v1323.py	0.071006	0.799339	0.749250	0.375000	0.020699	discard	Restore the compact props8 + minsep8 hybrid shelf anchored at lwindow3, beam3, top4, boardcands2, secsep1, radius0, drop1, props8, total150, and lmargin9.935836791992188. The latest executed bracket is harmful at 142.339380900065108903618238400667905807495117187499999999999999999999999999999999999999999999999999999999999999999999999999999999999999996921621678574205630029819954637095597296947743495377107651843713459141017662776907694813275880127695789332556897475865207363557569978813383278696488035941143703675502409826443005402223030704587644105484027323291014932205632752347090191898344315632130019366741180419921875 and exact-flat at 142.33938090006510890361823840066790580749511718750000000000000000000000000000000000000000000000000000000000000000000000000000000000000000696701524131012383179805868661183869107701896249866399709209288832145560121500204422430895001689280414021002203913233964384589947892153953561394743358943486647831492799579736976697733295977822456813687717902171103799530005560864797525821463657121057622134685516357421875. This run prepares their exact midpoint, 142.3393809000651089036182384006679058074951171875000000000000000000000000000000000000000000000000000000000000000000000000000000000000000019443184599421647309139393206244671441869833529970205523719683008902983094388894759595611129485102499647712894683041024256047285244501764594463219608126880050909952152028119063861897779952414061061211806031725010264637528441804975327250564904434213531203567981719970703125, with a short experiment name to avoid filename-too-long failures.
autoresearch/snapshots/20260420T062541Z_hybrid_p8_m8_w3_v1324.py	0.071006	0.789778	0.739821	0.375000	0.024580	discard	Restore the compact props8 + minsep8 hybrid shelf anchored at lwindow3, beam3, top4, boardcands2, secsep1, radius0, drop1, props8, total150, and lmargin9.935836791992188. The latest executed bracket is harmful at 142.339380900065108903618238400667905807495117187499999999999999999999999999999999999999999999999999999999999999999999999999999999999999996921621678574205630029819954637095597296947743495377107651843713459141017662776907694813275880127695789332556897475865207363557569978813383278696488035941143703675502409826443005402223030704587644105484027323291014932205632752347090191898344315632130019366741180419921875 and exact-flat at 142.3393809000651089036182384006679058074951171875000000000000000000000000000000000000000000000000000000000000000000000000000000000000000019443184599421647309139393206244671441869833529970205523719683008902983094388894759595611129485102499647712894683041024256047285244501764594463219608126880050909952152028119063861897779952414061061211806031725010264637528441804975327250564904434213531203567981719970703125. This run prepares their exact midpoint, 142.33938090006510890361823840066790580749511718749999999999999999999999999999999999999999999999999999999999999999999999999999999999999999943297006925818518047187963763078137074196554824619883001190600717471966355083319182718719441431897287705192318288998381648414304721449492136250922442431457439733535880631917469579600051297299687511333231524789602069797923846642231145847741737952674156986176967620849609375, with a short experiment name to avoid filename-too-long failures.
autoresearch/snapshots/20260420T062654Z_hybrid_p8_m8_w3_v1325.py	0.071006	0.789778	0.739821	0.375000	0.024580	discard	Restore the compact props8 + minsep8 hybrid shelf anchored at lwindow3, beam3, top4, boardcands2, secsep1, radius0, drop1, props8, total150, and lmargin9.935836791992188. The latest executed bracket is harmful at 142.339380900065108903618238400667905807495117187499999999999999999999999999999999999999999999999999999999999999999999999999999999999999996921621678574205630029819954637095597296947743495377107651843713459141017662776907694813275880127695789332556897475865207363557569978813383278696488035941143703675502409826443005402223030704587644105484027323291014932205632752347090191898344315632130019366741180419921875 and exact-flat at 142.3393809000651089036182384006679058074951171875000000000000000000000000000000000000000000000000000000000000000000000000000000000000000019443184599421647309139393206244671441869833529970205523719683008902983094388894759595611129485102499647712894683041024256047285244501764594463219608126880050909952152028119063861897779952414061061211806031725010264637528441804975327250564904434213531203567981719970703125. This run prepares their exact midpoint, 142.33938090006510890361823840066790580749511718749999999999999999999999999999999999999999999999999999999999999999999999999999999999999999943297006925818518047187963763078137074196554824619883001190600717471966355083319182718719441431897287705192318288998381648414304721449492136250922442431457439733535880631917469579600051297299687511333231524789602069797923846642231145847741737952674156986176967620849609375, with a short experiment name to avoid filename-too-long failures.
autoresearch/snapshots/20260420T062812Z_hybrid_p8_m8_w3_v1326.py	0.071006	0.799339	0.749250	0.375000	0.020699	discard	Restore the compact props8 + minsep8 hybrid shelf anchored at lwindow3, beam3, top4, boardcands2, secsep1, radius0, drop1, props8, total150, and lmargin9.935836791992188. The latest executed bracket is harmful at 142.33938090006510890361823840066790580749511718749999999999999999999999999999999999999999999999999999999999999999999999999999999999999999943297006925818518047187963763078137074196554824619883001190600717471966355083319182718719441431897287705192318288998381648414304721449492136250922442431457439733535880631917469579600051297299687511333231524789602069797923846642231145847741737952674156986176967620849609375 and exact-flat at 142.3393809000651089036182384006679058074951171875000000000000000000000000000000000000000000000000000000000000000000000000000000000000000019443184599421647309139393206244671441869833529970205523719683008902983094388894759595611129485102499647712894683041024256047285244501764594463219608126880050909952152028119063861897779952414061061211806031725010264637528441804975327250564904434213531203567981719970703125. This run prepares their exact midpoint, 142.339380900065108903618238400667905807495117187500000000000000000000000000000000000000000000000000000000000000000000000000000000000000000688644264600174955692909479127624257464474450621609691191937154032508986494861333893374153681414611420911606325597043121044435785832335690404415592618501289744165287004565540540992889254107201490617256459210198523580866041323459922091766953911474047345109283924102783203125, with a short experiment name to avoid filename-too-long failures.
autoresearch/snapshots/20260420T062925Z_hybrid_p8_m8_w3_v1327.py	0.071006	0.799339	0.749250	0.375000	0.020699	discard	Restore the compact props8 + minsep8 hybrid shelf anchored at lwindow3, beam3, top4, boardcands2, secsep1, radius0, drop1, props8, total150, and lmargin9.935836791992188. The latest executed bracket is harmful at 142.33938090006510890361823840066790580749511718749999999999999999999999999999999999999999999999999999999999999999999999999999999999999999943297006925818518047187963763078137074196554824619883001190600717471966355083319182718719441431897287705192318288998381648414304721449492136250922442431457439733535880631917469579600051297299687511333231524789602069797923846642231145847741737952674156986176967620849609375 and exact-flat at 142.339380900065108903618238400667905807495117187500000000000000000000000000000000000000000000000000000000000000000000000000000000000000000688644264600174955692909479127624257464474450621609691191937154032508986494861333893374153681414611420911606325597043121044435785832335690404415592618501289744165287004565540540992889254107201490617256459210198523580866041323459922091766953911474047345109283924102783203125. This run prepares their exact midpoint, 142.3393809000651089036182384006679058074951171875000000000000000000000000000000000000000000000000000000000000000000000000000000000000000000608071669291800680823945583792028141032199994339042606019215806036143250228472628602806740478667921489817647542435134687642894165234153058834624085214079320707503229054423576183944448835400991828652943872290472721394226398949411167751221856455003944574855268001556396484375, with a short experiment name to avoid filename-too-long failures.
autoresearch/snapshots/20260420T063047Z_hybrid_p8_m8_w3_v1328.py	0.071006	0.789778	0.739821	0.375000	0.024580	discard	Restore the compact props8 + minsep8 hybrid shelf anchored at lwindow3, beam3, top4, boardcands2, secsep1, radius0, drop1, props8, total150, and lmargin9.935836791992188. The latest executed bracket is harmful at 142.339380900065108903618238400667905807495117187499999999999999999999999999999999999999999999999999999999999999999999999999999999999999996921621678574205630029819954637095597296947743495377107651843713459141017662776907694813275880127695789332556897475865207363557569978813383278696488035941143703675502409826443005402223030704587644105484027323291014932205632752347090191898344315632130019366741180419921875 and exact-flat at 142.339380900065108903618238400667905807495117187500000000000000000000000000000000000000000000000000000000000000000000000000000000000000000688644264600174955692909479127624257464474450621609691191937154032508986494861333893374153681414611420911606325597043121044435785832335690404415592618501289744165287004565540540992889254107201490617256459210198523580866041323459922091766953911474047345109283924102783203125. This run prepares their exact midpoint, 142.3393809000651089036182384006679058074951171874999999999999999999999999999999999999999999999999999999999999999999999999999999999999999988051329715871902928613647168823599273807110970584933994218904337458250020788191207940937147807711536051220816115364541642039966779055745368415560403272212167239203947071959917731975561424058945673613702432667447692565358370379035061418326491135530886822380125522613525390625, with a short experiment name to avoid filename-too-long failures.
autoresearch/snapshots/20260420T063205Z_hybrid_p8_m8_w3_v1329.py	0.071006	0.789778	0.739821	0.375000	0.024580	discard	Restore the compact props8 + minsep8 hybrid shelf anchored at lwindow3, beam3, top4, boardcands2, secsep1, radius0, drop1, props8, total150, and lmargin9.935836791992188. The latest executed bracket is harmful at 142.3393809000651089036182384006679058074951171874999999999999999999999999999999999999999999999999999999999999999999999999999999999999999988051329715871902928613647168823599273807110970584933994218904337458250020788191207940937147807711536051220816115364541642039966779055745368415560403272212167239203947071959917731975561424058945673613702432667447692565358370379035061418326491135530886822380125522613525390625 and exact-flat at 142.339380900065108903618238400667905807495117187500000000000000000000000000000000000000000000000000000000000000000000000000000000000000000688644264600174955692909479127624257464474450621609691191937154032508986494861333893374153681414611420911606325597043121044435785832335690404415592618501289744165287004565540540992889254107201490617256459210198523580866041323459922091766953911474047345109283924102783203125. This run prepares their exact midpoint, 142.33938090006510890361823840066790580749511718749999999999999999999999999999999999999999999999999999999999999999999999999999999999999999974688861809368262427713709800499209242259277384005154530691379388916699428684022734373393423109288251301684396856674864262421623186895511362298581647286125323404284085588076615709522269825654802898931335123847164641870093918068171411679980151251356801367364823818206787109375, with a short experiment name to avoid filename-too-long failures.
