snapshot	board_exact	non_empty_accuracy	macro_f1	move_recall	false_change_rate	status	description
autoresearch/snapshots/20260420T032716Z_hybrid_p8_m8_w3_v1193.py	0.071006	0.789778	0.739821	0.375000	0.024580	discard	Restore the compact props8 + minsep8 hybrid shelf anchored at lwindow3, beam3, top4, boardcands2, secsep1, radius0, drop1, props8, total150, and lmargin9.935836791992188. The latest executed bracket is harmful at 142.3393809000651089036182384006679058074951171874999999999999999999999999999999999999999999999999999999990014430108172048401897030658637036401172591485785166947158783077207343073618496655661972980306947442743364080667958268604646291842725561635463714382776601041769026778638362884521484375 and exact-flat at 142.33938090006510890361823840066790580749511718750000000000000000000000000000000000000000000000000000000009445809357134548809016322349937921083662794470248356844929297089128188984414935595995430964574509175783304248016796232401010264473097441696182972881157269284813082776963710784912109375. This run re-prepares their midpoint, 142.339380900065108903618238400667905807495117187499999999999999999999999999999999999999999999999999999999547950552194275164139933144681541425476943546640500131582585639306008098602999510763075803838219918016084725273481894592237365914501765290254100583544616398512516752816736698150634765625, with a short experiment name to avoid filename-too-long failures.
autoresearch/snapshots/20260420T032815Z_hybrid_p8_m8_w3_v1194.py	0.071006	0.789778	0.739821	0.375000	0.024580	discard	Restore the compact props8 + minsep8 hybrid shelf anchored at lwindow3, beam3, top4, boardcands2, secsep1, radius0, drop1, props8, total150, and lmargin9.935836791992188. The latest executed bracket is harmful at 142.339380900065108903618238400667905807495117187499999999999999999999999999999999999999999999999999999999547950552194275164139933144681541425476943546640500131582585639306008098602999510763075803838219918016084725273481894592237365914501765290254100583544616398512516752816736698150634765625 and exact-flat at 142.33938090006510890361823840066790580749511718750000000000000000000000000000000000000000000000000000000009445809357134548809016322349937921083662794470248356844929297089128188984414935595995430964574509175783304248016796232401010264473097441696182972881157269284813082776963710784912109375. This run re-prepares their midpoint, 142.3393809000651089036182384006679058074951171874999999999999999999999999999999999999999999999999999999998212043228828103261150481840904603181567857456714918500159393050986449942235744333615150567419825048869588838768249284581237342796163698536079651561780945456803237902931869029998779296875, with a short experiment name to avoid filename-too-long failures.
autoresearch/snapshots/20260420T032922Z_hybrid_p8_m8_w3_v1195.py	0.071006	0.789778	0.739821	0.375000	0.024580	discard	Restore the compact props8 + minsep8 hybrid shelf anchored at lwindow3, beam3, top4, boardcands2, secsep1, radius0, drop1, props8, total150, and lmargin9.935836791992188. The latest executed bracket is harmful at 142.3393809000651089036182384006679058074951171874999999999999999999999999999999999999999999999999999999998212043228828103261150481840904603181567857456714918500159393050986449942235744333615150567419825048869588838768249284581237342796163698536079651561780945456803237902931869029998779296875 and exact-flat at 142.33938090006510890361823840066790580749511718750000000000000000000000000000000000000000000000000000000009445809357134548809016322349937921083662794470248356844929297089128188984414935595995430964574509175783304248016796232401010264473097441696182972881157269284813082776963710784912109375. This run re-prepares their midpoint, 142.33938090006510890361823840066790580749511718749999999999999999999999999999999999999999999999999999999995783120822707790710260570379491976449670684518698770923261613799496344203386189466073468319386379832239596317849644539106691846217367213528489744249483361926422730903141200542449951171875, with a short experiment name to avoid filename-too-long failures.
autoresearch/snapshots/20260420T033023Z_hybrid_p8_m8_w3_v1196.py	0.071006	0.799339	0.749250	0.375000	0.020699	discard	Restore the compact props8 + minsep8 hybrid shelf anchored at lwindow3, beam3, top4, boardcands2, secsep1, radius0, drop1, props8, total150, and lmargin9.935836791992188. The latest executed bracket is harmful at 142.33938090006510890361823840066790580749511718749999999999999999999999999999999999999999999999999999999995783120822707790710260570379491976449670684518698770923261613799496344203386189466073468319386379832239596317849644539106691846217367213528489744249483361926422730903141200542449951171875 and exact-flat at 142.33938090006510890361823840066790580749511718750000000000000000000000000000000000000000000000000000000009445809357134548809016322349937921083662794470248356844929297089128188984414935595995430964574509175783304248016796232401010264473097441696182972881157269284813082776963710784912109375. This run re-prepares their midpoint, 142.339380900065108903618238400667905807495117187500000000000000000000000000000000000000000000000000000000026144650899211697596384463647149487666667394944735638840954554443122665939005625310344496419804445040114502829332203857538510553452323276123363585653203156056179068400524556636810302734375, with a short experiment name to avoid filename-too-long failures.
autoresearch/snapshots/20260420T033121Z_hybrid_p8_m8_w3_v1197.py	0.071006	0.789778	0.739821	0.375000	0.024580	discard	Restore the compact props8 + minsep8 hybrid shelf anchored at lwindow3, beam3, top4, boardcands2, secsep1, radius0, drop1, props8, total150, and lmargin9.935836791992188. The latest executed bracket is harmful at 142.33938090006510890361823840066790580749511718749999999999999999999999999999999999999999999999999999999995783120822707790710260570379491976449670684518698770923261613799496344203386189466073468319386379832239596317849644539106691846217367213528489744249483361926422730903141200542449951171875 and exact-flat at 142.339380900065108903618238400667905807495117187500000000000000000000000000000000000000000000000000000000026144650899211697596384463647149487666667394944735638840954554443122665939005625310344496419804445040114502829332203857538510553452323276123363585653203156056179068400524556636810302734375. This run re-prepares their midpoint, 142.3393809000651089036182384006679058074951171874999999999999999999999999999999999999999999999999999999999919879295631448023494950837210346260816871200658616740367853462190430539864337599855395898068341216812552330039143246243027145078129977057041305140740183876602031887159682810306549072265625, with a short experiment name to avoid filename-too-long failures.
autoresearch/snapshots/20260420T033222Z_hybrid_p8_m8_w3_v1198.py	0.071006	0.799339	0.749250	0.375000	0.020699	discard	Restore the compact props8 + minsep8 hybrid shelf anchored at lwindow3, beam3, top4, boardcands2, secsep1, radius0, drop1, props8, total150, and lmargin9.935836791992188. The latest executed bracket is harmful at 142.3393809000651089036182384006679058074951171874999999999999999999999999999999999999999999999999999999999919879295631448023494950837210346260816871200658616740367853462190430539864337599855395898068341216812552330039143246243027145078129977057041305140740183876602031887159682810306549072265625 and exact-flat at 142.339380900065108903618238400667905807495117187500000000000000000000000000000000000000000000000000000000026144650899211697596384463647149487666667394944735638840954554443122665939005625310344496419804445040114502829332203857538510553452323276123363585653203156056179068400524556636810302734375. This run re-prepares their midpoint, 142.33938090006510890361823840066790580749511718750000000000000000000000000000000000000000000000000000000000906629023117824997293977368409205687417725750529865643886995033108285996271969264794204311331928336068486791662326424092061253063266049091374704986361077185819112855824641883373260498046875, with a short experiment name to avoid filename-too-long failures.
autoresearch/snapshots/20260420T033323Z_hybrid_p8_m8_w3_v1199.py	0.071006	0.799339	0.749250	0.375000	0.020699	discard	Restore the compact props8 + minsep8 hybrid shelf anchored at lwindow3, beam3, top4, boardcands2, secsep1, radius0, drop1, props8, total150, and lmargin9.935836791992188. The latest executed bracket is harmful at 142.3393809000651089036182384006679058074951171874999999999999999999999999999999999999999999999999999999999919879295631448023494950837210346260816871200658616740367853462190430539864337599855395898068341216812552330039143246243027145078129977057041305140740183876602031887159682810306549072265625 and exact-flat at 142.33938090006510890361823840066790580749511718750000000000000000000000000000000000000000000000000000000000906629023117824997293977368409205687417725750529865643886995033108285996271969264794204311331928336068486791662326424092061253063266049091374704986361077185819112855824641883373260498046875. This run re-prepares their midpoint, 142.339380900065108903618238400667905807495117187500000000000000000000000000000000000000000000000000000000000527109897161526161217428702563341477932188785580165237827648275062956974576726316740816460076702520970050460268794432611663519222829098308938781968814579759197158637107349932193756103515625, with a short experiment name to avoid filename-too-long failures.
autoresearch/snapshots/20260420T033429Z_hybrid_p8_m8_w3_v1200.py	0.071006	0.789778	0.739821	0.375000	0.024580	discard	Restore the compact props8 + minsep8 hybrid shelf anchored at lwindow3, beam3, top4, boardcands2, secsep1, radius0, drop1, props8, total150, and lmargin9.935836791992188. The latest executed bracket is harmful at 142.3393809000651089036182384006679058074951171874999999999999999999999999999999999999999999999999999999999919879295631448023494950837210346260816871200658616740367853462190430539864337599855395898068341216812552330039143246243027145078129977057041305140740183876602031887159682810306549072265625 and exact-flat at 142.339380900065108903618238400667905807495117187500000000000000000000000000000000000000000000000000000000000527109897161526161217428702563341477932188785580165237827648275062956974576726316740816460076702520970050460268794432611663519222829098308938781968814579759197158637107349932193756103515625. This run re-prepares their midpoint, 142.3393809000651089036182384006679058074951171874999999999999999999999999999999999999999999999999999999999962575197301531642553562562117989837798096544257209196373064972470530054805052431511402031334554121011126417320915595284571890135179134020065346480214164837097001736765378154814243316650390625, with a short experiment name to avoid filename-too-long failures.
autoresearch/snapshots/20260420T033538Z_hybrid_p8_m8_w3_v1201.py	0.071006	0.789778	0.739821	0.375000	0.024580	discard	Restore the compact props8 + minsep8 hybrid shelf anchored at lwindow3, beam3, top4, boardcands2, secsep1, radius0, drop1, props8, total150, and lmargin9.935836791992188. The latest executed bracket is harmful at 142.3393809000651089036182384006679058074951171874999999999999999999999999999999999999999999999999999999999962575197301531642553562562117989837798096544257209196373064972470530054805052431511402031334554121011126417320915595284571890135179134020065346480214164837097001736765378154814243316650390625 and exact-flat at 142.339380900065108903618238400667905807495117187500000000000000000000000000000000000000000000000000000000000527109897161526161217428702563341477932188785580165237827648275062956974576726316740816460076702520970050460268794432611663519222829098308938781968814579759197158637107349932193756103515625. This run re-prepares their midpoint, 142.33938090006510890361823840066790580749511718749999999999999999999999999999999999999999999999999999999999839231481365734520828684245718116262887092160565054243756707276105798122754098473394050979676605731104134609618017698053442626637037125015773671499511553173444866615682258270680904388427734375, with a short experiment name to avoid filename-too-long failures.
autoresearch/snapshots/20260420T033641Z_hybrid_p8_m8_w3_v1202.py	0.071006	0.789778	0.739821	0.375000	0.024580	discard	Restore the compact props8 + minsep8 hybrid shelf anchored at lwindow3, beam3, top4, boardcands2, secsep1, radius0, drop1, props8, total150, and lmargin9.935836791992188. The latest executed bracket is harmful at 142.33938090006510890361823840066790580749511718749999999999999999999999999999999999999999999999999999999999839231481365734520828684245718116262887092160565054243756707276105798122754098473394050979676605731104134609618017698053442626637037125015773671499511553173444866615682258270680904388427734375 and exact-flat at 142.339380900065108903618238400667905807495117187500000000000000000000000000000000000000000000000000000000000527109897161526161217428702563341477932188785580165237827648275062956974576726316740816460076702520970050460268794432611663519222829098308938781968814579759197158637107349932193756103515625. This run re-prepares their midpoint, 142.339380900065108903618238400667905807495117187499999999999999999999999999999999999999999999999999999999999459712355409435684752135579872252053401555195615353837697360518060469101058855525340663128421379916005698278224485706573044892796600174233337748481965055746822912396964966319501399993896484375, with a short experiment name to avoid filename-too-long failures.
autoresearch/snapshots/20260420T033744Z_hybrid_p8_m8_w3_v1203.py	0.071006	0.789778	0.739821	0.375000	0.024580	discard	Restore the compact props8 + minsep8 hybrid shelf anchored at lwindow3, beam3, top4, boardcands2, secsep1, radius0, drop1, props8, total150, and lmargin9.935836791992188. The latest executed bracket is harmful at 142.339380900065108903618238400667905807495117187499999999999999999999999999999999999999999999999999999999999459712355409435684752135579872252053401555195615353837697360518060469101058855525340663128421379916005698278224485706573044892796600174233337748481965055746822912396964966319501399993896484375 and exact-flat at 142.339380900065108903618238400667905807495117187500000000000000000000000000000000000000000000000000000000000527109897161526161217428702563341477932188785580165237827648275062956974576726316740816460076702520970050460268794432611663519222829098308938781968814579759197158637107349932193756103515625. This run re-prepares their midpoint, 142.3393809000651089036182384006679058074951171874999999999999999999999999999999999999999999999999999999999999934111262854809229847821412177967656668719905977595377625043965617130378177909210407397942490412184878743692466400695923542060097146362711382652253898177530100355170361581258475780487060546875, with a short experiment name to avoid filename-too-long failures.
autoresearch/snapshots/20260420T033857Z_hybrid_p8_m8_w3_v1204.py	0.071006	0.799339	0.749250	0.375000	0.020699	discard	Restore the compact props8 + minsep8 hybrid shelf anchored at lwindow3, beam3, top4, boardcands2, secsep1, radius0, drop1, props8, total150, and lmargin9.935836791992188. The latest executed bracket is harmful at 142.3393809000651089036182384006679058074951171874999999999999999999999999999999999999999999999999999999999999934111262854809229847821412177967656668719905977595377625043965617130378177909210407397942490412184878743692466400695923542060097146362711382652253898177530100355170361581258475780487060546875 and exact-flat at 142.339380900065108903618238400667905807495117187500000000000000000000000000000000000000000000000000000000000527109897161526161217428702563341477932188785580165237827648275062956974576726316740816460076702520970050460268794432611663519222829098308938781968814579759197158637107349932193756103515625. This run re-prepares their midpoint, 142.33938090006510890361823840066790580749511718750000000000000000000000000000000000000000000000000000000000026026051172350354210110542189056912179953038808896238779507633581233500619725861889077812716287186972896241475771725110200886261627186729003852359710219875610359707707175402902066707611083984375, with a short experiment name to avoid filename-too-long failures.
autoresearch/snapshots/20260420T034016Z_hybrid_p8_m8_w3_v1205.py	0.071006	0.799339	0.749250	0.375000	0.020699	discard	Restore the compact props8 + minsep8 hybrid shelf anchored at lwindow3, beam3, top4, boardcands2, secsep1, radius0, drop1, props8, total150, and lmargin9.935836791992188. The latest executed bracket is harmful at 142.3393809000651089036182384006679058074951171874999999999999999999999999999999999999999999999999999999999999934111262854809229847821412177967656668719905977595377625043965617130378177909210407397942490412184878743692466400695923542060097146362711382652253898177530100355170361581258475780487060546875 and exact-flat at 142.33938090006510890361823840066790580749511718750000000000000000000000000000000000000000000000000000000000026026051172350354210110542189056912179953038808896238779507633581233500619725861889077812716287186972896241475771725110200886261627186729003852359710219875610359707707175402902066707611083984375. This run re-prepares their midpoint, 142.339380900065108903618238400667905807495117187500000000000000000000000000000000000000000000000000000000000126835819004492232542943781554182943733201189343360962778790366187024022007524769965758960705956544108418392002178660347181534312993251780588394411246008254556816297053956077434122562408447265625, with a short experiment name to avoid filename-too-long failures.
autoresearch/snapshots/20260420T034125Z_hybrid_p8_m8_w3_v1206.py	0.071006	0.799339	0.749250	0.375000	0.020699	discard	Restore the compact props8 + minsep8 hybrid shelf anchored at lwindow3, beam3, top4, boardcands2, secsep1, radius0, drop1, props8, total150, and lmargin9.935836791992188. The latest executed bracket is harmful at 142.3393809000651089036182384006679058074951171874999999999999999999999999999999999999999999999999999999999999934111262854809229847821412177967656668719905977595377625043965617130378177909210407397942490412184878743692466400695923542060097146362711382652253898177530100355170361581258475780487060546875 and exact-flat at 142.339380900065108903618238400667905807495117187500000000000000000000000000000000000000000000000000000000000126835819004492232542943781554182943733201189343360962778790366187024022007524769965758960705956544108418392002178660347181534312993251780588394411246008254556816297053956077434122562408447265625. This run re-prepares their midpoint, 142.3393809000651089036182384006679058074951171875000000000000000000000000000000000000000000000000000000000000601234726449865777638629613859898547000365899705602502706473813743685299126578455032493774774988812981463806244093649697678701613539440258633298183179130037834259070450571016408503055572509765625, with a short experiment name to avoid filename-too-long failures.
autoresearch/snapshots/20260420T034230Z_hybrid_p8_m8_w3_v1207.py	0.071006	0.799339	0.749250	0.375000	0.020699	discard	Restore the compact props8 + minsep8 hybrid shelf anchored at lwindow3, beam3, top4, boardcands2, secsep1, radius0, drop1, props8, total150, and lmargin9.935836791992188. The latest executed bracket is harmful at 142.3393809000651089036182384006679058074951171874999999999999999999999999999999999999999999999999999999999999934111262854809229847821412177967656668719905977595377625043965617130378177909210407397942490412184878743692466400695923542060097146362711382652253898177530100355170361581258475780487060546875 and exact-flat at 142.3393809000651089036182384006679058074951171875000000000000000000000000000000000000000000000000000000000000601234726449865777638629613859898547000365899705602502706473813743685299126578455032493774774988812981463806244093649697678701613539440258633298183179130037834259070450571016408503055572509765625. This run re-prepares their midpoint, 142.33938090006510890361823840066790580749511718750000000000000000000000000000000000000000000000000000000000002676729946523375037432255130189331018345429028415989401657588896804078386522438327199458586327004989301037493552471728106103808553429014850079752185386537839673071204060761374421417713165283203125, with a short experiment name to avoid filename-too-long failures.
autoresearch/snapshots/20260420T034335Z_hybrid_p8_m8_w3_v1208.py	0.071006	0.799339	0.749250	0.375000	0.020699	discard	Restore the compact props8 + minsep8 hybrid shelf anchored at lwindow3, beam3, top4, boardcands2, secsep1, radius0, drop1, props8, total150, and lmargin9.935836791992188. The latest executed bracket is harmful at 142.3393809000651089036182384006679058074951171874999999999999999999999999999999999999999999999999999999999999934111262854809229847821412177967656668719905977595377625043965617130378177909210407397942490412184878743692466400695923542060097146362711382652253898177530100355170361581258475780487060546875 and exact-flat at 142.33938090006510890361823840066790580749511718750000000000000000000000000000000000000000000000000000000000002676729946523375037432255130189331018345429028415989401657588896804078386522438327199458586327004989301037493552471728106103808553429014850079752185386537839673071204060761374421417713165283203125. This run re-prepares their midpoint, 142.339380900065108903618238400667905807495117187500000000000000000000000000000000000000000000000000000000000010089212875357336679552346259845037925163140440959715889540142764876910841507652156367190056155634190442372091082393436707622047624463209819531373621841565703383114538382869795896112918853759765625, with a short experiment name to avoid filename-too-long failures.
