snapshot	board_exact	non_empty_accuracy	macro_f1	move_recall	false_change_rate	status	description
autoresearch/snapshots/20260420T044440Z_hybrid_p8_m8_w3_v1253.py	0.071006	0.799339	0.749250	0.375000	0.020699	discard	Restore the compact props8 + minsep8 hybrid shelf anchored at lwindow3, beam3, top4, boardcands2, secsep1, radius0, drop1, props8, total150, and lmargin9.935836791992188. The latest executed bracket is harmful at 142.33938090006510890361823840066790580749511718749999999999999999999999999999999999999999999999999999999999999999999999995022596904552413390716076914730705388478050075582713472440700043125829036561816462642783803150483252097740657600142318569664479636411850845407160399791702124116903570308458305780698071631162893169175731600262224674224853515625 and exact-flat at 142.3393809000651089036182384006679058074951171875000000000000000000000000000000000000000000000000000000000000000000000002558335086170786201971532451977581099280428385646737117727940742971298035114651174178024239570527841599270062880527378969187825164653126712167600642375154345108319221819139443289338096097773611603543031378649175167083740234375. This run re-prepares their midpoint, 142.339380900065108903618238400667905807495117187500000000000000000000000000000000000000000000000000000000000000000000000103029738831301377052157007172532581906411669660250423248600537364194046938541641022115130994278808340452206432027080541307713656414715589835415834117716227876000478942499263693370395163044495046023030226933769881725311279296875, with a short experiment name to avoid filename-too-long failures.
autoresearch/snapshots/20260420T044605Z_hybrid_p8_m8_w3_v1254.py	0.071006	0.799339	0.749250	0.375000	0.020699	discard	Restore the compact props8 + minsep8 hybrid shelf anchored at lwindow3, beam3, top4, boardcands2, secsep1, radius0, drop1, props8, total150, and lmargin9.935836791992188. The latest executed bracket is harmful at 142.33938090006510890361823840066790580749511718749999999999999999999999999999999999999999999999999999999999999999999999995022596904552413390716076914730705388478050075582713472440700043125829036561816462642783803150483252097740657600142318569664479636411850845407160399791702124116903570308458305780698071631162893169175731600262224674224853515625 and exact-flat at 142.339380900065108903618238400667905807495117187500000000000000000000000000000000000000000000000000000000000000000000000103029738831301377052157007172532581906411669660250423248600537364194046938541641022115130994278808340452206432027080541307713656414715589835415834117716227876000478942499263693370395163044495046023030226933769881725311279296875. This run re-prepares their midpoint, 142.3393809000651089036182384006679058074951171875000000000000000000000000000000000000000000000000000000000000000000000000266278539384127554796588881599198178955960852080387789865037688977261686520799028242714845128918204307148065040142518635021792263894170491447437190578166245585847573227919233755886879396780619888573937714681960642337799072265625, with a short experiment name to avoid filename-too-long failures.
autoresearch/snapshots/20260420T044740Z_hybrid_p8_m8_w3_v1255.py	0.071006	0.789778	0.739821	0.375000	0.024580	discard	Restore the compact props8 + minsep8 hybrid shelf anchored at lwindow3, beam3, top4, boardcands2, secsep1, radius0, drop1, props8, total150, and lmargin9.935836791992188. The latest executed bracket is harmful at 142.339380900065108903618238400667905807495117187499999999999999999999999999999999999999999999999999999999999999999999999644618429473969647617168293096855997841518162946980557676019926565386777219771211835053252105956880882027806863950108474474507076262924345691383143758318607971506149224255221786680151822845896703029211494140326976776123046875 and exact-flat at 142.3393809000651089036182384006679058074951171875000000000000000000000000000000000000000000000000000000000000000000000000266278539384127554796588881599198178955960852080387789865037688977261686520799028242714845128918204307148065040142518635021792263894170491447437190578166245585847573227919233755886879396780619888573937714681960642337799072265625. This run re-prepares their midpoint, 142.33938090006510890361823840066790580749511718749999999999999999999999999999999999999999999999999999999999999999999999983562314170619120154841359062838790786855712407750966833126184773155647293592555732966236830942435065637130668398218016898834315132617069741806343140806761626504545327352357258113441988126197934594330263280426152050495147705078125, with a short experiment name to avoid filename-too-long failures.
autoresearch/snapshots/20260420T044849Z_hybrid_p8_m8_w3_v1256.py	0.071006	0.789778	0.739821	0.375000	0.024580	discard	Restore the compact props8 + minsep8 hybrid shelf anchored at lwindow3, beam3, top4, boardcands2, secsep1, radius0, drop1, props8, total150, and lmargin9.935836791992188. The latest executed bracket is harmful at 142.33938090006510890361823840066790580749511718749999999999999999999999999999999999999999999999999999999999999999999999983562314170619120154841359062838790786855712407750966833126184773155647293592555732966236830942435065637130668398218016898834315132617069741806343140806761626504545327352357258113441988126197934594330263280426152050495147705078125 and exact-flat at 142.3393809000651089036182384006679058074951171875000000000000000000000000000000000000000000000000000000000000000000000000266278539384127554796588881599198178955960852080387789865037688977261686520799028242714845128918204307148065040142518635021792263894170491447437190578166245585847573227919233755886879396780619888573937714681960642337799072265625. This run re-prepares their midpoint, 142.339380900065108903618238400667905807495117187499999999999999999999999999999999999999999999999999999999999999999999999931125497822301978514036239394153862882076604642774223658882808314641320794002730076966926411158085543543056593998216016245261188857793873281403575232942120411815105298157747978361553910470020667400348202136228792369365692138671875, with a short experiment name to avoid filename-too-long failures.
autoresearch/snapshots/20260420T045012Z_hybrid_p8_m8_w3_v1257.py	0.071006	0.789778	0.739821	0.375000	0.024580	discard	Restore the compact props8 + minsep8 hybrid shelf anchored at lwindow3, beam3, top4, boardcands2, secsep1, radius0, drop1, props8, total150, and lmargin9.935836791992188. The latest executed bracket is harmful at 142.339380900065108903618238400667905807495117187499999999999999999999999999999999999999999999999999999999999999999999999931125497822301978514036239394153862882076604642774223658882808314641320794002730076966926411158085543543056593998216016245261188857793873281403575232942120411815105298157747978361553910470020667400348202136228792369365692138671875 and exact-flat at 142.3393809000651089036182384006679058074951171875000000000000000000000000000000000000000000000000000000000000000000000000266278539384127554796588881599198178955960852080387789865037688977261686520799028242714845128918204307148065040142518635021792263894170491447437190578166245585847573227919233755886879396780619888573937714681960642337799072265625. This run re-prepares their midpoint, 142.3393809000651089036182384006679058074951171874999999999999999999999999999999999999999999999999999999999999999999999999788766758803573669968475637770368403888363449254065013226932886061837447230413164506192054620249529871289315490062339398737202076236054612130736471453793724851999313104748356769751209250740413281288709868022124283015727996826171875, with a short experiment name to avoid filename-too-long failures.
autoresearch/snapshots/20260420T045135Z_hybrid_p8_m8_w3_v1258.py	0.071006	0.799339	0.749250	0.375000	0.020699	discard	Restore the compact props8 + minsep8 hybrid shelf anchored at lwindow3, beam3, top4, boardcands2, secsep1, radius0, drop1, props8, total150, and lmargin9.935836791992188. The latest executed bracket is harmful at 142.3393809000651089036182384006679058074951171874999999999999999999999999999999999999999999999999999999999999999999999999788766758803573669968475637770368403888363449254065013226932886061837447230413164506192054620249529871289315490062339398737202076236054612130736471453793724851999313104748356769751209250740413281288709868022124283015727996826171875 and exact-flat at 142.3393809000651089036182384006679058074951171875000000000000000000000000000000000000000000000000000000000000000000000000266278539384127554796588881599198178955960852080387789865037688977261686520799028242714845128918204307148065040142518635021792263894170491447437190578166245585847573227919233755886879396780619888573937714681960642337799072265625. This run re-prepares their midpoint, 142.33938090006510890361823840066790580749511718750000000000000000000000000000000000000000000000000000000000000000000000000275226490938506123825322596847832914221621506672264015459852875195495668756060963744534498745838670892186902651024290168794971700651125517890868310159799852189234431663337952628190443237605165849313237913520424626767635345458984375, with a short experiment name to avoid filename-too-long failures.
autoresearch/snapshots/20260420T045252Z_hybrid_p8_m8_w3_v1259.py	0.071006	0.789778	0.739821	0.375000	0.024580	discard	Restore the compact props8 + minsep8 hybrid shelf anchored at lwindow3, beam3, top4, boardcands2, secsep1, radius0, drop1, props8, total150, and lmargin9.935836791992188. The latest executed bracket is harmful at 142.3393809000651089036182384006679058074951171874999999999999999999999999999999999999999999999999999999999999999999999999788766758803573669968475637770368403888363449254065013226932886061837447230413164506192054620249529871289315490062339398737202076236054612130736471453793724851999313104748356769751209250740413288709868022124283015727996826171875 and exact-flat at 142.33938090006510890361823840066790580749511718750000000000000000000000000000000000000000000000000000000000000000000000000275226490938506123825322596847832914221621506672264015459852875195495668756060963744534498745838670892186902651024290168794971700651125517890868310159799852189234431663337952628190443237605165849313237913520424626767635345458984375. This run re-prepares their midpoint, 142.339380900065108903618238400667905807495117187499999999999999999999999999999999999999999999999999999999999999999999999990814470394871214117550394872757584765526279996064570738645908679069350705300963044032275224741669848025400287758238420780834962315058358195991165123488685503546137813554107601628512678725046493311001682968708337284624576568603515625, with a short experiment name to avoid filename-too-long failures.
autoresearch/snapshots/20260420T045407Z_hybrid_p8_m8_w3_v1260.py	0.071006	0.789778	0.739821	0.375000	0.024580	discard	Restore the compact props8 + minsep8 hybrid shelf anchored at lwindow3, beam3, top4, boardcands2, secsep1, radius0, drop1, props8, total150, and lmargin9.935836791992188. The latest executed bracket is harmful at 142.3393809000651089036182384006679058074951171874999999999999999999999999999999999999999999999999999999999999999999999999788766758803573669968475637770368403888363449254065013226932886061837447230413164506192054620249529871289315490062339398737202076236054612130736471453793724851999313104748356769751209250740413288709868022124283015727996826171875 and exact-flat at 142.33938090006510890361823840066790580749511718750000000000000000000000000000000000000000000000000000000000000000000000000275226490938506123825322596847832914221621506672264015459852875195495668756060963744534498745838670892186902651024290168794971700651125517890868310159799852189234431663337952628190443237605165849313237913520424626767635345458984375. This run re-prepares their midpoint, 142.339380900065108903618238400667905807495117187499999999999999999999999999999999999999999999999999999999999999999999999990814470394871214117550394872757584765526279996064570738645908679069350705300963044032275224741669848025400287758238420780834962315058358195991165123488685503546137813554107601628512678725046493311001682968708337284624576568603515625, with a short experiment name to avoid filename-too-long failures.
autoresearch/snapshots/20260420T045529Z_hybrid_p8_m8_w3_v1261.py	0.071006	0.789778	0.739821	0.375000	0.024580	discard	Restore the compact props8 + minsep8 hybrid shelf anchored at lwindow3, beam3, top4, boardcands2, secsep1, radius0, drop1, props8, total150, and lmargin9.935836791992188. The latest executed bracket is harmful at 142.339380900065108903618238400667905807495117187499999999999999999999999999999999999999999999999999999999999999999999999990814470394871214117550394872757584765526279996064570738645908679069350705300963044032275224741669848025400287758238420780834962315058358195991165123488685503546137813554107601628512678725046493311001682968708337284624576568603515625 and exact-flat at 142.33938090006510890361823840066790580749511718750000000000000000000000000000000000000000000000000000000000000000000000000275226490938506123825322596847832914221621506672264015459852875195495668756060963744534498745838670892186902651024290168794971700651125517890868310159799852189234431663337952628190443237605165849313237913520424626767635345458984375. This run re-prepares their midpoint, 142.3393809000651089036182384006679058074951171874999999999999999999999999999999999999999999999999999999999999999999999999967833676521281376779018104206179569538712475313936054466222187155121536964307863407388101061000282784736346571342406612343923396607848066874499241125433420127192410650937435639552085555505490759020670310519562917761504650115966796875, with a short experiment name to avoid filename-too-long failures.
autoresearch/snapshots/20260420T045640Z_hybrid_p8_m8_w3_v1262.py	0.071006	0.789778	0.739821	0.375000	0.024580	discard	Restore the compact props8 + minsep8 hybrid shelf anchored at lwindow3, beam3, top4, boardcands2, secsep1, radius0, drop1, props8, total150, and lmargin9.935836791992188. The latest executed bracket is harmful at 142.3393809000651089036182384006679058074951171874999999999999999999999999999999999999999999999999999999999999999999999999967833676521281376779018104206179569538712475313936054466222187155121536964307863407388101061000282784736346571342406612343923396607848066874499241125433420127192410650937435639552085555505490759020670310519562917761504650115966796875 and exact-flat at 142.33938090006510890361823840066790580749511718750000000000000000000000000000000000000000000000000000000000000000000000000275226490938506123825322596847832914221621506672264015459852875195495668756060963744534498745838670892186902651024290168794971700651125517890868310159799852189234431663337952628190443237605165849313237913520424626767635345458984375. This run re-prepares their midpoint, 142.33938090006510890361823840066790580749511718749999999999999999999999999999999999999999999999999999999999999999999999999976781628075659945807751819454814304804373129905812280061037373373355519199569798909207754677920749369775184182224178146117102833364803093317930360707067026730579269086356154511855649396330036719759970509358026902191340923309326171875, with a short experiment name to avoid filename-too-long failures.
autoresearch/snapshots/20260420T045756Z_hybrid_p8_m8_w3_v1263.py	0.071006	0.789778	0.739821	0.375000	0.024580	discard	Restore the compact props8 + minsep8 hybrid shelf anchored at lwindow3, beam3, top4, boardcands2, secsep1, radius0, drop1, props8, total150, and lmargin9.935836791992188. The latest executed bracket is harmful at 142.3393809000651089036182384006679058074951171874999999999999999999999999999999999999999999999999999999999999999999999999967833676521281376779018104206179569538712475313936054466222187155121536964307863407388101061000282784736346571342406612343923396607848066874499241125433420127192410650937435639552085555505490759020670319562917761504650115966796875 and exact-flat at 142.33938090006510890361823840066790580749511718750000000000000000000000000000000000000000000000000000000000000000000000000275226490938506123825322596847832914221621506672264015459852875195495668756060963744534498745838670892186902651024290168794971700651125517890868310159799852189234431663337952628190443237605165849313237913520424626767635345458984375. This run re-prepares their midpoint, 142.33938090006510890361823840066790580749511718749999999999999999999999999999999999999999999999999999999999999999999999999976781628075659945807751819454814304804373129905812280061037373373355519199569798909207754677920749369775184182224178146117102833364803093317930360707067026730579269086356154511855649330036719759970509358026902191340923309326171875, with a short experiment name to avoid filename-too-long failures.
autoresearch/snapshots/20260420T050236Z_hybrid_p8_m8_w3_v1264.py	0.071006	0.789778	0.739821	0.375000	0.024580	discard	Restore the compact props8 + minsep8 hybrid shelf anchored at lwindow3, beam3, top4, boardcands2, secsep1, radius0, drop1, props8, total150, and lmargin9.935836791992188. The latest executed bracket is harmful at 142.3393809000651089036182384006679058074951171874999999999999999999999999999999999999999999999999999999999999999999999999967833676521281376779018104206179569538712475313936054466222187155121536964307863407388101061000282784736346571342406612343923396607848066874499241125433420127192410650937435639552085555505490759020670319562917761504650115966796875 and exact-flat at 142.33938090006510890361823840066790580749511718750000000000000000000000000000000000000000000000000000000000000000000000000275226490938506123825322596847832914221621506672264015459852875195495668756060963744534498745838670892186902651024290168794971700651125517890868310159799852189234431663337952628190443237605165849313237913520424626767635345458984375. This run re-prepares their midpoint, 142.33938090006510890361823840066790580749511718749999999999999999999999999999999999999999999999999999999999999999999999999976781628075659945807751819454814304804373129905812280061037373373355519199569798909207754677920749369775184182224178146117102833364803093317930360707067026730579269086356154511855649396330036719759970509358026902191340923309326171875, with a short experiment name to avoid filename-too-long failures.
autoresearch/snapshots/20260420T050355Z_hybrid_p8_m8_w3_v1265.py	0.071006	0.799339	0.749250	0.375000	0.020699	discard	Restore the compact props8 + minsep8 hybrid shelf anchored at lwindow3, beam3, top4, boardcands2, secsep1, radius0, drop1, props8, total150, and lmargin9.935836791992188. The latest executed bracket is harmful at 142.33938090006510890361823840066790580749511718749999999999999999999999999999999999999999999999999999999999999999999999999976781628075659945807751819454814304804373129905812280061037373373355519199569798909207754677920749369775184182224178146117102833364803093317930360707067026730579269086356154511855649396330036719759970509358026902191340923309326171875 and exact-flat at 142.33938090006510890361823840066790580749511718750000000000000000000000000000000000000000000000000000000000000000000000000275226490938506123825322596847832914221621506672264015459852875195495668756060963744534498745838670892186902651024290168794971700651125517890868310159799852189234431663337952628190443237605165849313237913520424626767635345458984375. This run prepares their exact midpoint, 142.339380900065108903618238400667905807495117187500000000000000000000000000000000000000000000000000000000000000000000000001260040595070830348165372081513236095129973182890381477604451242844255939778153813268711267118797101309810434166242341574560372670079643056043993354334334394599068503748470535700230463169676012845366042114392257644794881343841552734375, with a short experiment name to avoid filename-too-long failures.
autoresearch/snapshots/20260420T050511Z_hybrid_p8_m8_w3_v1266.py	0.071006	0.799339	0.749250	0.375000	0.020699	discard	Restore the compact props8 + minsep8 hybrid shelf anchored at lwindow3, beam3, top4, boardcands2, secsep1, radius0, drop1, props8, total150, and lmargin9.935836791992188. The latest executed bracket is harmful at 142.33938090006510890361823840066790580749511718749999999999999999999999999999999999999999999999999999999999999999999999999976781628075659945807751819454814304804373129905812280061037373373355519199569798909207754677920749369775184182224178146117102833364803093317930360707067026730579269086356154511855649396330036719759970509358026902191340923309326171875 and exact-flat at 142.339380900065108903618238400667905807495117187500000000000000000000000000000000000000000000000000000000000000000000000001260040595070830348165372081513236095129973182890381477604451242844255939778153813268711267118797101309810434166242341574560372670079643056043993354334334394599068503748470535700230463169676012845366042114392257644794881343841552734375. This run prepares their exact midpoint, 142.3393809000651089036182384006679058074951171875000000000000000000000000000000000000000000000000000000000000000000000000005139284379137149031214451380306895715868522409742521391074124882889055658869259011803944069490022975037811379942420615178657005018638369946116484807025023309524305973060160404093934785664881900214828736039862633333541452884674072265625, with a short experiment name to avoid filename-too-long failures.
