snapshot	board_exact	non_empty_accuracy	macro_f1	move_recall	false_change_rate	status	description
autoresearch/snapshots/20260419T133608Z_hybrid_lookahead_segmental_drop1_boardcands3_ratio95_props8_top4_detect10_lwindow3_minsep8_secsep1_thresh3_total150_permove150_lmargin9p935836791992188_m9p8957061767578125_r0_beam3_v811.py	0.071006	0.799339	0.749250	0.375000	0.020699	discard	Restore the recovered compact props8 sibling after recent local mapping showed the props7 shelf is saturated across top_move_candidates=5..16, beam_size=4 is an exact no-op, beam_size=2 is slightly worse, beam_size=1 is much worse, both hybrid acceptance gates are exact-flat down to 125.0, event_window_radius=1..2, segment_board_drop_worst_frames=0, and secondary_peak_ratio=0.98 are exact no-ops on the adjacent props7 shelf, secondary_min_event_separation=2 is worse there, and min_event_separation=8 and 6 are both worse than 7 there. On the compact props8 top4 anchor, top_board_candidates=2..4 are exact no-ops, top_move_candidates=4 is exact-flat while 5 is worse, secondary_min_event_separation=2 is worse, event_window_radius=1..2, segment_board_drop_worst_frames=0, and secondary_peak_ratio=0.98 are exact no-ops, and raising min_event_separation from 7 to 8 opened a lower-noise shelf that remained exact-flat at 9 before breaking sharply at 10. Lowering top_move_candidates from 4 to 3 on that minsep8 shelf was an exact no-op, while 2 and 1 only slightly weakened secondary metrics. This run keeps the stable minsep8 shelf anchor and raises only top_board_candidates from 2 to 3 to test whether the lower-noise shelf also preserves the earlier upward board-breadth flatness.
autoresearch/snapshots/20260419T133836Z_hybrid_lookahead_segmental_drop1_boardcands4_ratio95_props8_top4_detect10_lwindow3_minsep8_secsep1_thresh3_total150_permove150_lmargin9p935836791992188_m9p8957061767578125_r0_beam3_v812.py	0.071006	0.799339	0.749250	0.375000	0.020699	discard	Restore the recovered compact props8 sibling after recent local mapping showed the props7 shelf is saturated across top_move_candidates=5..16, beam_size=4 is an exact no-op, beam_size=2 is slightly worse, beam_size=1 is much worse, both hybrid acceptance gates are exact-flat down to 125.0, event_window_radius=1..2, segment_board_drop_worst_frames=0, and secondary_peak_ratio=0.98 are exact no-ops on the adjacent props7 shelf, secondary_min_event_separation=2 is worse there, and min_event_separation=8 and 6 are both worse than 7 there. On the compact props8 top4 anchor, top_board_candidates=2..4 are exact no-ops, top_move_candidates=4 is exact-flat while 5 is worse, secondary_min_event_separation=2 is worse, event_window_radius=1..2, segment_board_drop_worst_frames=0, and secondary_peak_ratio=0.98 are exact no-ops, and raising min_event_separation from 7 to 8 opened a lower-noise shelf that remained exact-flat at 9 before breaking sharply at 10. Lowering top_move_candidates from 4 to 3 on that minsep8 shelf was an exact no-op, while 2 and 1 only slightly weakened secondary metrics, and raising top_board_candidates from 2 to 3 was an exact no-op. This run keeps the stable minsep8 shelf anchor and raises only top_board_candidates from 3 to 4 to test whether the lower-noise shelf also preserves the full upward board-breadth plateau.
autoresearch/snapshots/20260419T134115Z_hybrid_lookahead_segmental_drop1_boardcands1_ratio95_props8_top4_detect10_lwindow3_minsep8_secsep1_thresh3_total150_permove150_lmargin9p935836791992188_m9p8957061767578125_r0_beam3_v813.py	0.071006	0.782957	0.734671	0.375000	0.020699	discard	Restore the recovered compact props8 sibling after recent local mapping showed the props7 shelf is saturated across top_move_candidates=5..16, beam_size=4 is an exact no-op, beam_size=2 is slightly worse, beam_size=1 is much worse, both hybrid acceptance gates are exact-flat down to 125.0, event_window_radius=1..2, segment_board_drop_worst_frames=0, and secondary_peak_ratio=0.98 are exact no-ops on the adjacent props7 shelf, secondary_min_event_separation=2 is worse there, and min_event_separation=8 and 6 are both worse than 7 there. On the compact props8 top4 anchor, top_board_candidates=2..4 are exact no-ops, top_move_candidates=4 is exact-flat while 5 is worse, secondary_min_event_separation=2 is worse, event_window_radius=1..2, segment_board_drop_worst_frames=0, and secondary_peak_ratio=0.98 are exact no-ops, and raising min_event_separation from 7 to 8 opened a lower-noise shelf that remained exact-flat at 9 before breaking sharply at 10. Lowering top_move_candidates from 4 to 3 on that minsep8 shelf was an exact no-op, while 2 and 1 only slightly weakened secondary metrics, and raising top_board_candidates from 2 to 3 or 4 was also exact-flat. This run keeps the stable minsep8 shelf anchor and lowers only top_board_candidates from 2 to 1 to test whether the lower-noise shelf can trade recall for another false-change reduction or whether board breadth 2 remains the minimum safe width.
autoresearch/snapshots/20260419T134401Z_hybrid_lookahead_segmental_drop1_boardcands2_ratio95_props8_top4_detect10_lwindow3_minsep8_secsep1_thresh3_total150_permove150_lmargin9p935836791992188_m9p8957061767578125_r0_beam2_v814.py	0.071006	0.791794	0.747597	0.375000	0.020699	discard	Restore the recovered compact props8 sibling after recent local mapping showed the props7 shelf is saturated across top_move_candidates=5..16, beam_size=4 is an exact no-op, beam_size=2 is slightly worse, beam_size=1 is much worse, both hybrid acceptance gates are exact-flat down to 125.0, event_window_radius=1..2, segment_board_drop_worst_frames=0, and secondary_peak_ratio=0.98 are exact no-ops on the adjacent props7 shelf, secondary_min_event_separation=2 is worse there, and min_event_separation=8 and 6 are both worse than 7 there. On the compact props8 top4 anchor, top_board_candidates=2..4 are exact no-ops, top_move_candidates=4 is exact-flat while 5 is worse, secondary_min_event_separation=2 is worse, event_window_radius=1..2, segment_board_drop_worst_frames=0, and secondary_peak_ratio=0.98 are exact no-ops, and raising min_event_separation from 7 to 8 opened a lower-noise shelf that remained exact-flat at 9 before breaking sharply at 10. Lowering top_move_candidates from 4 to 3 on that minsep8 shelf was an exact no-op, while 2 and 1 only slightly weakened secondary metrics, and top_board_candidates=2..4 remained exact-flat while 1 was harmful. This run keeps the stable minsep8 shelf anchor and lowers only beam_size from 3 to 2 to test whether the lower-noise shelf preserves the same cheap lower-beam tradeoff previously seen on the props7 shelf.
autoresearch/snapshots/20260419T134700Z_hybrid_lookahead_segmental_drop1_boardcands2_ratio95_props8_top4_detect10_lwindow3_minsep8_secsep2_thresh3_total150_permove150_lmargin9p935836791992188_m9p8957061767578125_r0_beam3_v815.py	0.071006	0.799235	0.749137	0.375000	0.021992	discard	Restore the recovered compact props8 sibling after recent local mapping showed the props7 shelf is saturated across top_move_candidates=5..16, beam_size=4 is an exact no-op, beam_size=2 is slightly worse, beam_size=1 is much worse, both hybrid acceptance gates are exact-flat down to 125.0, event_window_radius=1..2, segment_board_drop_worst_frames=0, and secondary_peak_ratio=0.98 are exact no-ops on the adjacent props7 shelf, secondary_min_event_separation=2 is worse there, and min_event_separation=8 and 6 are both worse than 7 there. On the compact props8 top4 anchor, top_board_candidates=2..4 are exact no-ops, top_move_candidates=4 is exact-flat while 5 is worse, secondary_min_event_separation=2 is worse, event_window_radius=1..2, segment_board_drop_worst_frames=0, and secondary_peak_ratio=0.98 are exact no-ops, and raising min_event_separation from 7 to 8 opened a lower-noise shelf that remained exact-flat at 9 before breaking sharply at 10. On that minsep8 shelf, top_move_candidates=3 is exact-flat, 2 and 1 only slightly weaken secondary metrics, top_board_candidates=2..4 are exact-flat, top_board_candidates=1 is harmful, and beam_size=2 is slightly worse. This run keeps the stable minsep8 shelf anchor and raises only secondary_min_event_separation from 1 to 2 to test whether the lower-noise shelf changes the local secsep preference or keeps the same secsep1 advantage.
autoresearch/snapshots/20260419T134949Z_hybrid_lookahead_segmental_drop1_boardcands2_ratio95_props8_top4_detect10_lwindow3_minsep8_secsep1_thresh3_total150_permove150_lmargin9p935836791992188_m9p8957061767578125_r1_beam3_v816.py	0.071006	0.799339	0.749250	0.375000	0.020699	discard	Restore the recovered compact props8 sibling after recent local mapping showed the props7 shelf is saturated across top_move_candidates=5..16, beam_size=4 is an exact no-op, beam_size=2 is slightly worse, beam_size=1 is much worse, both hybrid acceptance gates are exact-flat down to 125.0, event_window_radius=1..2, segment_board_drop_worst_frames=0, and secondary_peak_ratio=0.98 are exact no-ops on the adjacent props7 shelf, secondary_min_event_separation=2 is worse there, and min_event_separation=8 and 6 are both worse than 7 there. On the compact props8 top4 anchor, top_board_candidates=2..4 are exact no-ops, top_move_candidates=4 is exact-flat while 5 is worse, secondary_min_event_separation=2 is worse, and raising min_event_separation from 7 to 8 opened a lower-noise shelf that remained exact-flat at 9 before breaking sharply at 10. On that minsep8 shelf, top_move_candidates=3 is exact-flat, 2 and 1 only slightly weaken secondary metrics, top_board_candidates=2..4 are exact-flat, top_board_candidates=1 is harmful, beam_size=2 is slightly worse, and secsep2 is worse. This run keeps the stable minsep8 shelf anchor and raises only event_window_radius from 0 to 1 to test whether the lower-noise shelf also preserves the earlier local radius flatness.
autoresearch/snapshots/20260419T135225Z_hybrid_lookahead_segmental_drop1_boardcands2_ratio95_props8_top4_detect10_lwindow3_minsep8_secsep1_thresh3_total150_permove150_lmargin9p935836791992188_m9p8957061767578125_r2_beam3_v817.py	0.071006	0.799339	0.749250	0.375000	0.020699	discard	Restore the recovered compact props8 sibling after recent local mapping showed the props7 shelf is saturated across top_move_candidates=5..16, beam_size=4 is an exact no-op, beam_size=2 is slightly worse, beam_size=1 is much worse, both hybrid acceptance gates are exact-flat down to 125.0, event_window_radius=1..2, segment_board_drop_worst_frames=0, and secondary_peak_ratio=0.98 are exact no-ops on the adjacent props7 shelf, secondary_min_event_separation=2 is worse there, and min_event_separation=8 and 6 are both worse than 7 there. On the compact props8 top4 anchor, top_board_candidates=2..4 are exact no-ops, top_move_candidates=4 is exact-flat while 5 is worse, secondary_min_event_separation=2 is worse, and raising min_event_separation from 7 to 8 opened a lower-noise shelf that remained exact-flat at 9 before breaking sharply at 10. On that minsep8 shelf, top_move_candidates=3 is exact-flat, 2 and 1 only slightly weaken secondary metrics, top_board_candidates=2..4 are exact-flat, top_board_candidates=1 is harmful, beam_size=2 is slightly worse, secsep2 is worse, and event_window_radius=1 is an exact no-op. This run keeps the stable minsep8 shelf anchor and raises only event_window_radius from 1 to 2 to test whether the lower-noise shelf also preserves the full local radius-flat plateau.
autoresearch/snapshots/20260419T135515Z_hybrid_lookahead_segmental_drop0_boardcands2_ratio95_props8_top4_detect10_lwindow3_minsep8_secsep1_thresh3_total150_permove150_lmargin9p935836791992188_m9p8957061767578125_r0_beam3_v818.py	0.071006	0.799339	0.749250	0.375000	0.020699	discard	Restore the recovered compact props8 sibling after recent local mapping showed the props7 shelf is saturated across top_move_candidates=5..16, beam_size=4 is an exact no-op, beam_size=2 is slightly worse, beam_size=1 is much worse, both hybrid acceptance gates are exact-flat down to 125.0, event_window_radius=1..2, segment_board_drop_worst_frames=0, and secondary_peak_ratio=0.98 are exact no-ops on the adjacent props7 shelf, secondary_min_event_separation=2 is worse there, and min_event_separation=8 and 6 are both worse than 7 there. On the compact props8 top4 anchor, top_board_candidates=2..4 are exact no-ops, top_move_candidates=4 is exact-flat while 5 is worse, secondary_min_event_separation=2 is worse, and raising min_event_separation from 7 to 8 opened a lower-noise shelf that remained exact-flat at 9 before breaking sharply at 10. On that minsep8 shelf, top_move_candidates=3 is exact-flat, 2 and 1 only slightly weaken secondary metrics, top_board_candidates=2..4 are exact-flat, top_board_candidates=1 is harmful, beam_size=2 is slightly worse, secsep2 is worse, and event_window_radius=1..2 are exact no-ops. This run keeps the stable minsep8 shelf anchor and lowers only segment_board_drop_worst_frames from 1 to 0 to test whether the lower-noise shelf also preserves the earlier drop-flatness seen on the noisier props8 surface.
autoresearch/snapshots/20260419T135804Z_hybrid_lookahead_segmental_drop1_boardcands2_ratio98_props8_top4_detect10_lwindow3_minsep8_secsep1_thresh3_total150_permove150_lmargin9p935836791992188_m9p8957061767578125_r0_beam3_v819.py	0.071006	0.799339	0.749250	0.375000	0.020699	discard	Restore the recovered compact props8 sibling after recent local mapping showed the props7 shelf is saturated across top_move_candidates=5..16, beam_size=4 is an exact no-op, beam_size=2 is slightly worse, beam_size=1 is much worse, both hybrid acceptance gates are exact-flat down to 125.0, event_window_radius=1..2, segment_board_drop_worst_frames=0, and secondary_peak_ratio=0.98 are exact no-ops on the adjacent props7 shelf, secondary_min_event_separation=2 is worse there, and min_event_separation=8 and 6 are both worse than 7 there. On the compact props8 top4 anchor, top_board_candidates=2..4 are exact no-ops, top_move_candidates=4 is exact-flat while 5 is worse, secondary_min_event_separation=2 is worse, and raising min_event_separation from 7 to 8 opened a lower-noise shelf that remained exact-flat at 9 before breaking sharply at 10. On that minsep8 shelf, top_move_candidates=3 is exact-flat, 2 and 1 only slightly weaken secondary metrics, top_board_candidates=2..4 are exact-flat, top_board_candidates=1 is harmful, beam_size=2 is slightly worse, secsep2 is worse, and event_window_radius=1..2 plus segment_board_drop_worst_frames=0 are exact no-ops. This run keeps the stable minsep8 shelf anchor and raises only secondary_peak_ratio from 0.95 to 0.98 to test whether the lower-noise shelf also preserves the earlier local ratio flatness.
autoresearch/snapshots/20260419T140043Z_hybrid_lookahead_segmental_drop1_boardcands2_ratio95_props8_top4_detect10_lwindow3_minsep8_secsep1_thresh3_total150_permove137p5_lmargin9p935836791992188_m9p8957061767578125_r0_beam3_v820.py	0.071006	0.789778	0.739821	0.375000	0.024580	discard	Restore the recovered compact props8 sibling after recent local mapping showed the props7 shelf is saturated across top_move_candidates=5..16, beam_size=4 is an exact no-op, beam_size=2 is slightly worse, beam_size=1 is much worse, both hybrid acceptance gates are exact-flat down to 125.0, event_window_radius=1..2, segment_board_drop_worst_frames=0, and secondary_peak_ratio=0.98 are exact no-ops on the adjacent props7 shelf, secondary_min_event_separation=2 is worse there, and min_event_separation=8 and 6 are both worse than 7 there. On the compact props8 top4 anchor, top_board_candidates=2..4 are exact no-ops, top_move_candidates=4 is exact-flat while 5 is worse, secondary_min_event_separation=2 is worse, and raising min_event_separation from 7 to 8 opened a lower-noise shelf that remained exact-flat at 9 before breaking sharply at 10. On that minsep8 shelf, top_move_candidates=3 is exact-flat, 2 and 1 only slightly weaken secondary metrics, top_board_candidates=2..4 are exact-flat, top_board_candidates=1 is harmful, beam_size=2 is slightly worse, secsep2 is worse, and event_window_radius=1..2, segment_board_drop_worst_frames=0, and secondary_peak_ratio=0.98 are exact no-ops. This run keeps the stable minsep8 shelf anchor and lowers only min_score_gain_per_added_move from 150.0 to 137.5 to test whether the hybrid per-move acceptance gate is likewise non-binding on the lower-noise shelf.
autoresearch/snapshots/20260419T140306Z_hybrid_lookahead_segmental_drop1_boardcands2_ratio95_props8_top4_detect10_lwindow3_minsep8_secsep1_thresh3_total137p5_permove150_lmargin9p935836791992188_m9p8957061767578125_r0_beam3_v821.py	0.071006	0.799339	0.749250	0.375000	0.020699	discard	Restore the recovered compact props8 sibling after recent local mapping showed the props7 shelf is saturated across top_move_candidates=5..16, beam_size=4 is an exact no-op, beam_size=2 is slightly worse, beam_size=1 is much worse, both hybrid acceptance gates are exact-flat down to 125.0, event_window_radius=1..2, segment_board_drop_worst_frames=0, and secondary_peak_ratio=0.98 are exact no-ops on the adjacent props7 shelf, secondary_min_event_separation=2 is worse there, and min_event_separation=8 and 6 are both worse than 7 there. On the compact props8 top4 anchor, top_board_candidates=2..4 are exact no-ops, top_move_candidates=4 is exact-flat while 5 is worse, secondary_min_event_separation=2 is worse, and raising min_event_separation from 7 to 8 opened a lower-noise shelf that remained exact-flat at 9 before breaking sharply at 10. On that minsep8 shelf, top_move_candidates=3 is exact-flat, 2 and 1 only slightly weaken secondary metrics, top_board_candidates=2..4 are exact-flat, top_board_candidates=1 is harmful, beam_size=2 is slightly worse, secsep2 is worse, and event_window_radius=1..2, segment_board_drop_worst_frames=0, and secondary_peak_ratio=0.98 are exact no-ops. Lowering min_score_gain_per_added_move from 150.0 to 137.5 increased false changes and weakened secondaries, so that gate is binding on this lower-noise shelf. This run keeps the stable minsep8 shelf anchor and lowers only min_total_score_gain from 150.0 to 137.5 to test whether the total-gain gate is still non-binding there or shows the same instability.
autoresearch/snapshots/20260419T141035Z_hybrid_lookahead_segmental_drop1_boardcands2_ratio95_props8_top4_detect10_lwindow3_minsep8_secsep1_thresh3_total125_permove150_lmargin9p935836791992188_m9p8957061767578125_r0_beam3_v822.py	0.071006	0.799339	0.749250	0.375000	0.020699	discard	Restore the recovered compact props8 sibling after recent local mapping showed the props7 shelf is saturated across top_move_candidates=5..16, beam_size=4 is an exact no-op, beam_size=2 is slightly worse, beam_size=1 is much worse, both hybrid acceptance gates are exact-flat down to 125.0, event_window_radius=1..2, segment_board_drop_worst_frames=0, and secondary_peak_ratio=0.98 are exact no-ops on the adjacent props7 shelf, secondary_min_event_separation=2 is worse there, and min_event_separation=8 and 6 are both worse than 7 there. On the compact props8 top4 anchor, top_board_candidates=2..4 are exact no-ops, top_move_candidates=4 is exact-flat while 5 is worse, secondary_min_event_separation=2 is worse, and raising min_event_separation from 7 to 8 opened a lower-noise shelf that remained exact-flat at 9 before breaking sharply at 10. On that minsep8 shelf, top_move_candidates=3 is exact-flat, 2 and 1 only slightly weaken secondary metrics, top_board_candidates=2..4 are exact-flat, top_board_candidates=1 is harmful, beam_size=2 is slightly worse, secsep2 is worse, and event_window_radius=1..2, segment_board_drop_worst_frames=0, and secondary_peak_ratio=0.98 are exact no-ops. Lowering min_score_gain_per_added_move from 150.0 to 137.5 increased false changes and weakened secondaries, while lowering min_total_score_gain from 150.0 to 137.5 was an exact no-op. This run keeps the stable minsep8 shelf anchor and lowers only min_total_score_gain from 137.5 to 125.0 to test whether the total-gain gate stays non-binding across the full previously-flat range on the lower-noise shelf.
