snapshot	board_exact	non_empty_accuracy	macro_f1	move_recall	false_change_rate	status	description
autoresearch/snapshots/20260419T054346Z_hybrid_lookahead_segmental_drop1_boardcands3_ratio95_props14_top4_detect10_lwindow1_minsep4_secsep2_thresh3_total150_permove125_lmargin9p5_m9p8957061767578125_r0_beam4_v562.py	0.074556	0.764870	0.721875	0.265625	0.019405	discard	Hybrid decoder keeps the baseline lookahead path unless a conservative board-only segmental pass wins the current score-gain gates, while following up the kept window1 branch after lowering lookahead window from 2 to 1 on the 9.5-margin baseline opened a lower-false-change but lower-recall tradeoff, lowering only max_event_proposals from 16 to 15 on the restored plain window1 branch improved recall and secondary metrics but worsened false-change, additionally narrowing top-board breadth from 4 to 3 recovered the lower false-change without hurting recall, lowering only max_event_proposals one step further from 15 to 14 on that boardcands3 plain props branch kept that recovered tradeoff, lowering segment_board_drop_worst_frames from 1 to 0 on that stronger props14 branch produced a new kept low-noise / lower-recall tradeoff, lowering secondary minimum event separation from 2 to 1 improved that tradeoff again, raising max_event_proposals from 14 to 15 was worse, raising top-board breadth from 3 to 4 was an exact no-op, lowering top-board breadth from 3 to 2 was worse, raising beam size from 4 to 5, 6, and 7 were exact no-ops, beam8 was worse, lowering max_event_proposals from 14 to 13 was sharply worse, and lowering top-move breadth from 4 to 1 was an exact no-op, and restoring segment_board_drop_worst_frames from 0 back to 1 improved the tradeoff again, and raising only secondary minimum event separation from 1 to 2 on that new secsep1 + drop1 best branch to test whether the stronger drop1 branch still prefers the original secsep2 midpoint once drop1 is restored or whether secsep1 remains the true local optimum.
autoresearch/snapshots/20260419T054501Z_hybrid_lookahead_segmental_drop1_boardcands3_ratio98_props14_top4_detect10_lwindow1_minsep4_secsep1_thresh3_total150_permove125_lmargin9p5_m9p8957061767578125_r0_beam4_v563.py	0.074556	0.792672	0.751719	0.234375	0.009056	discard	Hybrid decoder keeps the baseline lookahead path unless a conservative board-only segmental pass wins the current score-gain gates, while following up the kept window1 branch after lowering lookahead window from 2 to 1 on the 9.5-margin baseline opened a lower-false-change but lower-recall tradeoff, lowering only max_event_proposals from 16 to 15 on the restored plain window1 branch improved recall and secondary metrics but worsened false-change, additionally narrowing top-board breadth from 4 to 3 recovered the lower false-change without hurting recall, lowering only max_event_proposals one step further from 15 to 14 on that boardcands3 plain props branch kept that recovered tradeoff, lowering segment_board_drop_worst_frames from 1 to 0 on that stronger props14 branch produced a new kept low-noise / lower-recall tradeoff, lowering secondary minimum event separation from 2 to 1 improved that tradeoff again, raising max_event_proposals from 14 to 15 was worse, raising top-board breadth from 3 to 4 was an exact no-op, lowering top-board breadth from 3 to 2 was worse, raising beam size from 4 to 5, 6, and 7 were exact no-ops, beam8 was worse, lowering max_event_proposals from 14 to 13 was sharply worse, lowering top-move breadth from 4 to 1 was an exact no-op, raising secondary minimum event separation from 1 to 2 and 3 was worse, and restoring segment_board_drop_worst_frames from 0 back to 1 improved the tradeoff again, and raising only secondary_peak_ratio from 0.95 to 0.98 on that new secsep1 + drop1 best branch to test whether the stronger drop1 secsep1 branch stays saturated on the upper ratio side or whether a stricter secondary-peak gate trims noise without giving back recall.
autoresearch/snapshots/20260419T054633Z_hybrid_lookahead_segmental_drop1_boardcands3_ratio90_props14_top4_detect10_lwindow1_minsep4_secsep1_thresh3_total150_permove125_lmargin9p5_m9p8957061767578125_r0_beam4_v564.py	0.048521	0.757429	0.713453	0.265625	0.020699	discard	Hybrid decoder keeps the baseline lookahead path unless a conservative board-only segmental pass wins the current score-gain gates, while following up the kept window1 branch after lowering lookahead window from 2 to 1 on the 9.5-margin baseline opened a lower-false-change but lower-recall tradeoff, lowering only max_event_proposals from 16 to 15 on the restored plain window1 branch improved recall and secondary metrics but worsened false-change, additionally narrowing top-board breadth from 4 to 3 recovered the lower false-change without hurting recall, lowering only max_event_proposals one step further from 15 to 14 on that boardcands3 plain props branch kept that recovered tradeoff, lowering segment_board_drop_worst_frames from 1 to 0 on that stronger props14 branch produced a new kept low-noise / lower-recall tradeoff, lowering secondary minimum event separation from 2 to 1 improved that tradeoff again, raising max_event_proposals from 14 to 15 was worse, raising top-board breadth from 3 to 4 was an exact no-op, lowering top-board breadth from 3 to 2 was worse, raising beam size from 4 to 5, 6, and 7 were exact no-ops, beam8 was worse, lowering max_event_proposals from 14 to 13 was sharply worse, lowering top-move breadth from 4 to 1 was an exact no-op, raising secondary minimum event separation from 1 to 2 and 3 was worse, restoring segment_board_drop_worst_frames from 0 back to 1 improved the tradeoff again, raising secondary_peak_ratio from 0.95 to 0.98 was an exact no-op, and lowering only secondary_peak_ratio from 0.95 to 0.90 on that new secsep1 + drop1 best branch to test whether the lower ratio side is also saturated on the stronger drop1 secsep1 branch or whether loosening the secondary-peak gate reopens the noisier higher-recall behavior seen on older surfaces.
autoresearch/snapshots/20260419T055544Z_hybrid_lookahead_segmental_drop1_boardcands3_ratio95_props14_top4_detect10_lwindow1_minsep4_secsep1_thresh3_total150_permove125_lmargin9p5_m9p8957061767578125_r1_beam4_v565.py	0.074556	0.792672	0.751719	0.234375	0.009056	discard	Hybrid decoder keeps the baseline lookahead path unless a conservative board-only segmental pass wins the current score-gain gates, while following up the kept window1 branch after lowering lookahead window from 2 to 1 on the 9.5-margin baseline opened a lower-false-change but lower-recall tradeoff, lowering only max_event_proposals from 16 to 15 on the restored plain window1 branch improved recall and secondary metrics but worsened false-change, additionally narrowing top-board breadth from 4 to 3 recovered the lower false-change without hurting recall, lowering only max_event_proposals one step further from 15 to 14 on that boardcands3 plain props branch kept that recovered tradeoff, lowering segment_board_drop_worst_frames from 1 to 0 on that stronger props14 branch produced a new kept low-noise / lower-recall tradeoff, lowering secondary minimum event separation from 2 to 1 improved that tradeoff again, raising max_event_proposals from 14 to 15 was worse, raising top-board breadth from 3 to 4 was an exact no-op, lowering top-board breadth from 3 to 2 was worse, raising beam size from 4 to 5, 6, and 7 were exact no-ops, beam8 was worse, lowering max_event_proposals from 14 to 13 was sharply worse, lowering top-move breadth from 4 to 1 was an exact no-op, raising secondary minimum event separation from 1 to 2 and 3 was worse, raising secondary_peak_ratio from 0.95 to 0.98 was an exact no-op, lowering it to 0.90 was harmful, and raising only event_window_radius from 0 to 1 on that new secsep1 + drop1 best branch to test whether the stronger drop1 secsep1 surface is also flat in local temporal aggregation radius or whether one-step segmental context still changes this best tradeoff.
autoresearch/snapshots/20260419T055645Z_hybrid_lookahead_segmental_drop1_boardcands3_ratio95_props14_top4_detect10_lwindow2_minsep4_secsep1_thresh3_total150_permove125_lmargin9p5_m9p8957061767578125_r0_beam4_v566.py	0.074556	0.762906	0.722947	0.328125	0.021992	discard	Hybrid decoder keeps the baseline lookahead path unless a conservative board-only segmental pass wins the current score-gain gates, while following up the kept window1 branch after lowering lookahead window from 2 to 1 on the 9.5-margin baseline opened a lower-false-change but lower-recall tradeoff, lowering only max_event_proposals from 16 to 15 on the restored plain window1 branch improved recall and secondary metrics but worsened false-change, additionally narrowing top-board breadth from 4 to 3 recovered the lower false-change without hurting recall, lowering only max_event_proposals one step further from 15 to 14 on that boardcands3 plain props branch kept that recovered tradeoff, lowering segment_board_drop_worst_frames from 1 to 0 on that stronger props14 branch produced a new kept low-noise / lower-recall tradeoff, lowering secondary minimum event separation from 2 to 1 improved that tradeoff again, raising max_event_proposals from 14 to 15 was worse, lowering max_event_proposals from 14 to 13 was sharply worse, lowering top-move breadth from 4 to 1 was an exact no-op, raising beam size from 4 to 5, 6, and 7 were exact no-ops, beam8 was worse, raising secondary minimum event separation from 1 to 2 and 3 was worse, raising secondary_peak_ratio from 0.95 to 0.98 was an exact no-op, lowering it to 0.90 was harmful, raising event_window_radius from 0 to 1 was an exact no-op, and restoring segment_board_drop_worst_frames from 0 back to 1 improved the tradeoff again, and raising only LOOKAHEAD_WINDOW from 1 back to 2 on that new secsep1 + drop1 best branch to test whether the best surface truly depends on the shorter lookahead path or whether the older two-step lookahead can now match it once the segmental temporal knobs are tuned.
autoresearch/snapshots/20260419T055749Z_hybrid_lookahead_segmental_drop1_boardcands3_ratio95_props14_top4_detect10_lwindow1_minsep4_secsep1_thresh3_total150_permove125_lmargin9p5_m9p8957061767578125_r2_beam4_v567.py	0.074556	0.792672	0.751719	0.234375	0.009056	discard	Hybrid decoder keeps the baseline lookahead path unless a conservative board-only segmental pass wins the current score-gain gates, while following up the kept window1 branch after lowering lookahead window from 2 to 1 on the 9.5-margin baseline opened a lower-false-change but lower-recall tradeoff, lowering only max_event_proposals from 16 to 15 on the restored plain window1 branch improved recall and secondary metrics but worsened false-change, additionally narrowing top-board breadth from 4 to 3 recovered the lower false-change without hurting recall, lowering only max_event_proposals one step further from 15 to 14 on that boardcands3 plain props branch kept that recovered tradeoff, lowering segment_board_drop_worst_frames from 1 to 0 on that stronger props14 branch produced a new kept low-noise / lower-recall tradeoff, lowering secondary minimum event separation from 2 to 1 improved that tradeoff again, raising max_event_proposals from 14 to 15 was worse, lowering max_event_proposals from 14 to 13 was sharply worse, lowering top-move breadth from 4 to 1 was an exact no-op, raising beam size from 4 to 5, 6, and 7 were exact no-ops, beam8 was worse, raising secondary minimum event separation from 1 to 2 and 3 was worse, raising secondary_peak_ratio from 0.95 to 0.98 was an exact no-op, lowering it to 0.90 was harmful, raising event_window_radius from 0 to 1 was an exact no-op, raising LOOKAHEAD_WINDOW from 1 back to 2 was worse, and restoring segment_board_drop_worst_frames from 0 back to 1 improved the tradeoff again, and raising only event_window_radius from 1 to 2 on that new secsep1 + drop1 best branch to test whether local segmental temporal aggregation is fully flat across the allowed radius range or whether the outer edge reopens a distinct ambiguity tradeoff.
autoresearch/snapshots/20260419T055851Z_hybrid_lookahead_segmental_drop1_boardcands3_ratio95_props14_top4_detect10_lwindow1_minsep5_secsep1_thresh3_total150_permove125_lmargin9p5_m9p8957061767578125_r0_beam4_v568.py	0.048521	0.758979	0.713987	0.265625	0.021992	discard	Hybrid decoder keeps the baseline lookahead path unless a conservative board-only segmental pass wins the current score-gain gates, while following up the kept window1 branch after lowering lookahead window from 2 to 1 on the 9.5-margin baseline opened a lower-false-change but lower-recall tradeoff, lowering only max_event_proposals from 16 to 15 on the restored plain window1 branch improved recall and secondary metrics but worsened false-change, additionally narrowing top-board breadth from 4 to 3 recovered the lower false-change without hurting recall, lowering only max_event_proposals one step further from 15 to 14 on that boardcands3 plain props branch kept that recovered tradeoff, lowering segment_board_drop_worst_frames from 1 to 0 on that stronger props14 branch produced a new kept low-noise / lower-recall tradeoff, lowering secondary minimum event separation from 2 to 1 improved that tradeoff again, raising max_event_proposals from 14 to 15 was worse, lowering max_event_proposals from 14 to 13 was sharply worse, lowering top-move breadth from 4 to 1 was an exact no-op, raising beam size from 4 to 5, 6, and 7 were exact no-ops, beam8 was worse, raising secondary minimum event separation from 1 to 2 and 3 was worse, raising secondary_peak_ratio from 0.95 to 0.98 was an exact no-op, lowering it to 0.90 was harmful, raising event_window_radius from 0 to 1 and 2 were exact no-ops, raising LOOKAHEAD_WINDOW from 1 back to 2 was worse, and restoring segment_board_drop_worst_frames from 0 back to 1 improved the tradeoff again, and raising only min_event_separation from 4 to 5 on that new secsep1 + drop1 best branch to test whether stricter primary event spacing trims residual temporal ambiguity on this stronger surface or whether minsep4 is already the local optimum.
autoresearch/snapshots/20260419T060005Z_hybrid_lookahead_segmental_drop1_boardcands3_ratio95_props14_top4_detect10_lwindow1_minsep3_secsep1_thresh3_total150_permove125_lmargin9p5_m9p8957061767578125_r0_beam4_v569.py	0.042604	0.761098	0.714844	0.218750	0.023286	discard	Hybrid decoder keeps the baseline lookahead path unless a conservative board-only segmental pass wins the current score-gain gates, while following up the kept window1 branch after lowering lookahead window from 2 to 1 on the 9.5-margin baseline opened a lower-false-change but lower-recall tradeoff, lowering only max_event_proposals from 16 to 15 on the restored plain window1 branch improved recall and secondary metrics but worsened false-change, additionally narrowing top-board breadth from 4 to 3 recovered the lower false-change without hurting recall, lowering only max_event_proposals one step further from 15 to 14 on that boardcands3 plain props branch kept that recovered tradeoff, lowering segment_board_drop_worst_frames from 1 to 0 on that stronger props14 branch produced a new kept low-noise / lower-recall tradeoff, lowering secondary minimum event separation from 2 to 1 improved that tradeoff again, raising max_event_proposals from 14 to 15 was worse, lowering max_event_proposals from 14 to 13 was sharply worse, lowering top-move breadth from 4 to 1 was an exact no-op, raising beam size from 4 to 5, 6, and 7 were exact no-ops, beam8 was worse, raising secondary minimum event separation from 1 to 2 and 3 was worse, raising secondary_peak_ratio from 0.95 to 0.98 was an exact no-op, lowering it to 0.90 was harmful, raising event_window_radius from 0 to 1 and 2 were exact no-ops, raising LOOKAHEAD_WINDOW from 1 back to 2 was worse, raising min_event_separation from 4 to 5 was worse, and restoring segment_board_drop_worst_frames from 0 back to 1 improved the tradeoff again, and lowering only min_event_separation from 4 to 3 on that new secsep1 + drop1 best branch to test whether the stronger surface is asymmetric around the current spacing optimum or whether minsep4 remains the clear local center from both sides.
autoresearch/snapshots/20260419T060125Z_hybrid_lookahead_segmental_drop1_boardcands3_ratio92p5_props14_top4_detect10_lwindow1_minsep4_secsep1_thresh3_total150_permove125_lmargin9p5_m9p8957061767578125_r0_beam4_v570.py	0.074556	0.764198	0.722324	0.250000	0.018111	discard	Hybrid decoder keeps the baseline lookahead path unless a conservative board-only segmental pass wins the current score-gain gates, while following up the kept window1 branch after lowering lookahead window from 2 to 1 on the 9.5-margin baseline opened a lower-false-change but lower-recall tradeoff, lowering only max_event_proposals from 16 to 15 on the restored plain window1 branch improved recall and secondary metrics but worsened false-change, additionally narrowing top-board breadth from 4 to 3 recovered the lower false-change without hurting recall, lowering only max_event_proposals one step further from 15 to 14 on that boardcands3 plain props branch kept that recovered tradeoff, lowering segment_board_drop_worst_frames from 1 to 0 on that stronger props14 branch produced a new kept low-noise / lower-recall tradeoff, lowering secondary minimum event separation from 2 to 1 improved that tradeoff again, raising max_event_proposals from 14 to 15 was worse, lowering max_event_proposals from 14 to 13 was sharply worse, lowering top-move breadth from 4 to 1 was an exact no-op, raising beam size from 4 to 5, 6, and 7 were exact no-ops, beam8 was worse, raising secondary minimum event separation from 1 to 2 and 3 was worse, raising event_window_radius from 0 to 1 and 2 were exact no-ops, raising LOOKAHEAD_WINDOW from 1 back to 2 was worse, min_event_separation 3 and 5 were both worse, raising secondary_peak_ratio from 0.95 to 0.98 was an exact no-op, lowering it to 0.90 was harmful, and restoring segment_board_drop_worst_frames from 0 back to 1 improved the tradeoff again, and lowering only secondary_peak_ratio from 0.95 to 0.925 on that new secsep1 + drop1 best branch to test whether the lower ratio side has a narrow internal cliff on this stronger surface or whether the harmful 0.90 result only appears after a much larger drop.
autoresearch/snapshots/20260419T060218Z_hybrid_lookahead_segmental_drop1_boardcands3_ratio93p75_props14_top4_detect10_lwindow1_minsep4_secsep1_thresh3_total150_permove125_lmargin9p5_m9p8957061767578125_r0_beam4_v571.py	0.074556	0.792672	0.751719	0.234375	0.009056	discard	Hybrid decoder keeps the baseline lookahead path unless a conservative board-only segmental pass wins the current score-gain gates, while following up the kept window1 branch after lowering lookahead window from 2 to 1 on the 9.5-margin baseline opened a lower-false-change but lower-recall tradeoff, lowering only max_event_proposals from 16 to 15 on the restored plain window1 branch improved recall and secondary metrics but worsened false-change, additionally narrowing top-board breadth from 4 to 3 recovered the lower false-change without hurting recall, lowering only max_event_proposals one step further from 15 to 14 on that boardcands3 plain props branch kept that recovered tradeoff, lowering segment_board_drop_worst_frames from 1 to 0 on that stronger props14 branch produced a new kept low-noise / lower-recall tradeoff, lowering secondary minimum event separation from 2 to 1 improved that tradeoff again, raising max_event_proposals from 14 to 15 was worse, lowering max_event_proposals from 14 to 13 was sharply worse, lowering top-move breadth from 4 to 1 was an exact no-op, raising beam size from 4 to 5, 6, and 7 were exact no-ops, beam8 was worse, raising event_window_radius from 0 to 1 and 2 were exact no-ops, raising LOOKAHEAD_WINDOW from 1 back to 2 was worse, min_event_separation 3 and 5 were both worse, raising secondary_min_event_separation from 1 to 2 and 3 was worse, raising secondary_peak_ratio from 0.95 to 0.98 was an exact no-op, lowering it to 0.925 reopened a noisier higher-recall tradeoff, lowering it to 0.90 was clearly harmful, and restoring segment_board_drop_worst_frames from 0 back to 1 improved the tradeoff again, and lowering only secondary_peak_ratio from 0.95 to 0.9375 on that new secsep1 + drop1 best branch to localize whether the lower ratio cliff starts near the midpoint between the flat 0.95 surface and the degraded 0.925 tradeoff.
