snapshot	board_exact	non_empty_accuracy	macro_f1	move_recall	false_change_rate	status	description
autoresearch/snapshots/20260417T043213Z_hybrid_lookahead_segmental_drop1_boardcands2_ratio95_props16_top12_detect10_minsep2_thresh3_total150_permove125_m9p8957061767578125_r0_beam2_v249.py	0.236686	0.887809	0.860622	0.437500	0.016818	discard	Hybrid decoder keeps the baseline lookahead path unless a conservative board-only segmental pass wins the current score-gain gates, while following up v221-v248 after beam_size=6 rescued the props16 branch into the best current lower-false-change tradeoff, beam3 through beam6 held that rescue, beam2 plus beam1 established the low-beam failure side, and board-breadth plus total-gain plus detect-threshold plus per-move-gain tweaks were all no-ops on beam2, and widening only move-search breadth from top10 to top12 on the broken beam2 props16 regime to test whether tighter search mainly fails because the low-beam decoder needs a slightly broader legal-move menu to recover lost board_exact and recall.
autoresearch/snapshots/20260417T043318Z_hybrid_lookahead_segmental_drop1_boardcands2_ratio95_props16_top12_detect10_minsep2_thresh3_total150_permove125_m9p8957061767578125_r0_beam2_v249.py	0.236686	0.887809	0.860622	0.437500	0.016818	discard	Hybrid decoder keeps the baseline lookahead path unless a conservative board-only segmental pass wins the current score-gain gates, while following up v221-v248 after beam_size=6 rescued the props16 branch into the best current lower-false-change tradeoff, beam3 through beam6 held that rescue, beam2 plus beam1 established the low-beam failure side, and board-breadth plus total-gain plus detect-threshold plus per-move-gain tweaks were all no-ops on beam2, and widening only move-search breadth from top10 to top12 on the broken beam2 props16 regime to test whether tighter search mainly fails because the low-beam decoder needs a slightly broader legal-move menu to recover lost board_exact and recall.
autoresearch/snapshots/20260417T043445Z_hybrid_lookahead_segmental_drop1_boardcands2_ratio95_props16_top10_detect10_minsep2_secondarysep1_thresh3_total150_permove125_m9p8957061767578125_r0_beam2_v250.py	0.236686	0.887809	0.860622	0.437500	0.016818	discard	Hybrid decoder keeps the baseline lookahead path unless a conservative board-only segmental pass wins the current score-gain gates, while following up v221-v249 after beam_size=6 rescued the props16 branch into the best current lower-false-change tradeoff, beam3 through beam6 held that rescue, beam2 plus beam1 established the low-beam failure side, and board-breadth plus total-gain plus detect-threshold plus per-move-gain plus move-search tweaks were all no-ops on beam2, and lowering only the secondary event separation from 2 to 1 on the broken beam2 props16 regime to test whether tighter search mainly fails because nearby temporal alternatives are being pruned too aggressively before the small beam can consider them.
autoresearch/snapshots/20260417T043544Z_hybrid_lookahead_segmental_drop1_boardcands2_ratio95_props16_top9_detect10_minsep2_thresh3_total150_permove125_m9p8957061767578125_r0_beam2_v251.py	0.236686	0.887809	0.860622	0.437500	0.016818	discard	Hybrid decoder keeps the baseline lookahead path unless a conservative board-only segmental pass wins the current score-gain gates, while following up v221-v250 after beam_size=6 rescued the props16 branch into the best current lower-false-change tradeoff, beam3 through beam6 held that rescue, beam2 plus beam1 established the low-beam failure side, and board-breadth plus total-gain plus detect-threshold plus per-move-gain plus move-search widening plus secondary-separation tweaks were all no-ops on beam2, and narrowing only move-search breadth from top10 to top9 on the broken beam2 props16 regime to test whether tighter search mainly fails because the small beam needs a slightly stricter legal-move menu rather than a broader one.
autoresearch/snapshots/20260417T043655Z_hybrid_lookahead_segmental_drop1_boardcands2_ratio95_props16_top10_detect10_minsep2_thresh3_total150_permove125_m9p8957061767578125_r1_beam2_v252.py	0.236686	0.887809	0.860622	0.437500	0.016818	discard	Hybrid decoder keeps the baseline lookahead path unless a conservative board-only segmental pass wins the current score-gain gates, while following up v221-v251 after beam_size=6 rescued the props16 branch into the best current lower-false-change tradeoff, beam3 through beam6 held that rescue, beam2 plus beam1 established the low-beam failure side, and board-breadth plus total-gain plus detect-threshold plus per-move-gain plus move-search plus secondary-separation tweaks were all no-ops on beam2, and increasing only the event window radius from 0 to 1 on the broken beam2 props16 regime to test whether tighter search mainly fails because the low beam needs a slightly wider temporal aggregation window to preserve the rescued branch.
autoresearch/snapshots/20260417T043816Z_hybrid_lookahead_segmental_drop1_boardcands2_ratio95_props15_top10_detect10_minsep2_thresh3_total150_permove125_m9p8957061767578125_r0_beam3_v253.py	0.254438	0.876337	0.830116	0.484375	0.015524	discard	Hybrid decoder keeps the baseline lookahead path unless a conservative board-only segmental pass wins the current score-gain gates, while following up v221-v252 after beam_size=6 rescued the props16 branch into the best current lower-false-change tradeoff, beam3 through beam6 preserved that rescue exactly, beam2 and beam1 established the failure side, and the broken beam2 regime proved saturated across nearby knobs, and lowering only max_event_proposals from 16 to 15 on the rescued beam3 plateau to test whether the lower-budget props15 tradeoff remains viable once search is tightened without collapsing all the way to the beam2 failure regime.
autoresearch/snapshots/20260417T043910Z_hybrid_lookahead_segmental_drop1_boardcands3_ratio95_props15_top10_detect10_minsep2_thresh3_total150_permove125_m9p8957061767578125_r0_beam3_v254.py	0.254438	0.876337	0.830116	0.484375	0.015524	discard	Hybrid decoder keeps the baseline lookahead path unless a conservative board-only segmental pass wins the current score-gain gates, while following up v221-v253 after beam_size=6 rescued the props16 branch into the best current lower-false-change tradeoff, beam3 through beam6 preserved that rescue exactly, the broken beam2 regime proved saturated across nearby knobs, and lowering only max_event_proposals from 16 to 15 on beam3 produced a much stronger props15 tradeoff than the older beam6 props15 branch, and widening only board-state breadth from 2 to 3 on that active beam3 props15 regime to test whether extra board evidence still improves the lower-budget branch under tighter search without giving back its false-change win.
autoresearch/snapshots/20260417T044007Z_hybrid_lookahead_segmental_drop1_boardcands2_ratio95_props15_top10_detect10_minsep2_thresh3_total150_permove125_m9p8957061767578125_r0_beam4_v255.py	0.254438	0.847708	0.813439	0.468750	0.015524	discard	Hybrid decoder keeps the baseline lookahead path unless a conservative board-only segmental pass wins the current score-gain gates, while following up v221-v254 after beam_size=6 rescued the props16 branch into the best current lower-false-change tradeoff, beam3 through beam6 preserved that rescue exactly, and lowering max_event_proposals from 16 to 15 on beam3 produced a much stronger props15 tradeoff than the older beam6 props15 branch while extra board breadth was a no-op there, and raising only beam_size from 3 to 4 on that active props15 branch to test whether the improved low-false-change profile is specific to beam3 or persists across a wider low-beam plateau.
autoresearch/snapshots/20260417T044102Z_hybrid_lookahead_segmental_drop1_boardcands2_ratio95_props15_top12_detect10_minsep2_thresh3_total150_permove125_m9p8957061767578125_r0_beam3_v256.py	0.254438	0.876337	0.830116	0.484375	0.015524	discard	Hybrid decoder keeps the baseline lookahead path unless a conservative board-only segmental pass wins the current score-gain gates, while following up v221-v255 after beam_size=6 rescued the props16 branch into the best current lower-false-change tradeoff, beam3 through beam6 preserved that rescue exactly, beam3 + props15 produced a much stronger low-false-change branch than the older beam6 props15 family, boardcands3 was a no-op there, and beam4 degraded back toward the weaker family, and widening only move-search breadth from top10 to top12 on the active beam3 props15 regime to test whether that improved branch can recover some non-empty accuracy, macro_f1, or recall without giving back its false-change win.
autoresearch/snapshots/20260417T044200Z_hybrid_lookahead_segmental_drop1_boardcands2_ratio95_props15_top10_detect5_minsep2_thresh3_total150_permove125_m9p8957061767578125_r0_beam3_v257.py	0.254438	0.876337	0.830116	0.484375	0.015524	discard	Hybrid decoder keeps the baseline lookahead path unless a conservative board-only segmental pass wins the current score-gain gates, while following up v221-v256 after beam_size=6 rescued the props16 branch into the best current lower-false-change tradeoff, beam3 through beam6 preserved that rescue exactly, beam3 + props15 produced a much stronger low-false-change branch than the older beam6 props15 family, and both boardcands3 and top12 were no-ops there while beam4 degraded, and lowering only the detect proposal threshold from 0.1 to 0.05 on the active beam3 props15 regime to test whether a slightly broader detect-driven proposal set can recover some non-empty accuracy, macro_f1, or recall without giving back the branch's false-change win.
autoresearch/snapshots/20260417T044305Z_hybrid_lookahead_segmental_drop1_boardcands2_ratio95_props14_top10_detect10_minsep2_thresh3_total150_permove125_m9p8957061767578125_r0_beam3_v258.py	0.220118	0.858405	0.829666	0.468750	0.014230	discard	Hybrid decoder keeps the baseline lookahead path unless a conservative board-only segmental pass wins the current score-gain gates, while following up v221-v257 after beam_size=6 rescued the props16 branch into the best current lower-false-change tradeoff, beam3 through beam6 preserved that rescue exactly, beam3 + props15 produced a much stronger low-false-change branch than the older beam6 props15 family, nearby board-breadth plus move-search plus detect-threshold tweaks were no-ops there, and lowering only max_event_proposals from 15 to 14 on the active beam3 branch to test whether tighter beam search shifts the low-budget proposal cliff below 15 or whether props14 still collapses as it did on the older beam6 branch.
autoresearch/snapshots/20260417T044400Z_hybrid_lookahead_segmental_drop1_boardcands2_ratio95_props15_top10_detect10_minsep2_thresh3_total125_permove125_m9p8957061767578125_r0_beam3_v259.py	0.254438	0.876337	0.830116	0.484375	0.015524	discard	Hybrid decoder keeps the baseline lookahead path unless a conservative board-only segmental pass wins the current score-gain gates, while following up v221-v258 after beam_size=6 rescued the props16 branch into the best current lower-false-change tradeoff, beam3 through beam6 preserved that rescue exactly, beam3 + props15 produced a much stronger low-false-change branch than the older beam6 props15 family, and board-breadth plus move-search plus detect-threshold tweaks were no-ops there while props14 collapsed, and lowering only the total score-gain gate from 150 to 125 on the active beam3 props15 regime to test whether the improved low-budget branch is still hybrid-gate limited under tighter search or already saturated like the older beam6 props15 branch.
autoresearch/snapshots/20260417T044503Z_hybrid_lookahead_segmental_drop1_boardcands2_ratio95_props15_top10_detect10_minsep2_thresh3_total150_permove100_m9p8957061767578125_r0_beam3_v260.py	0.168047	0.857733	0.808167	0.453125	0.021992	discard	Hybrid decoder keeps the baseline lookahead path unless a conservative board-only segmental pass wins the current score-gain gates, while following up v221-v259 after beam_size=6 rescued the props16 branch into the best current lower-false-change tradeoff, beam3 through beam6 preserved that rescue exactly, beam3 + props15 produced a much stronger low-false-change branch than the older beam6 props15 family, nearby board-breadth plus move-search plus detect-threshold plus total-gain tweaks were no-ops there while props14 collapsed, and lowering only the per-added-move score-gain gate from 125 to 100 on the active beam3 props15 regime to test whether the improved low-budget branch is still hybrid-gate limited on per-move quality under tighter search.
autoresearch/snapshots/20260417T044603Z_hybrid_lookahead_segmental_drop1_boardcands2_ratio95_props15_top10_detect10_minsep2_secondarysep1_thresh3_total150_permove125_m9p8957061767578125_r0_beam3_v261.py	0.253254	0.876285	0.830090	0.484375	0.016818	discard	Hybrid decoder keeps the baseline lookahead path unless a conservative board-only segmental pass wins the current score-gain gates, while following up v221-v260 after beam_size=6 rescued the props16 branch into the best current lower-false-change tradeoff, beam3 through beam6 preserved that rescue exactly, beam3 + props15 produced a much stronger low-false-change branch than the older beam6 props15 family, nearby board-breadth plus move-search plus detect-threshold plus total-gain tweaks were no-ops there while props14 collapsed and lowering the per-move gate was catastrophic, and lowering only the secondary event separation from 2 to 1 on the active beam3 props15 regime to test whether the improved low-budget branch still benefits from admitting tighter nearby temporal alternatives under tighter beam search.
autoresearch/snapshots/20260417T044701Z_hybrid_lookahead_segmental_drop1_boardcands2_ratio95_props15_top10_detect10_minsep2_thresh3_total150_permove125_m9p8957061767578125_r1_beam3_v262.py	0.254438	0.876337	0.830116	0.484375	0.015524	discard	Hybrid decoder keeps the baseline lookahead path unless a conservative board-only segmental pass wins the current score-gain gates, while following up v221-v261 after beam_size=6 rescued the props16 branch into the best current lower-false-change tradeoff, beam3 through beam6 preserved that rescue exactly, beam3 + props15 produced a much stronger low-false-change branch than the older beam6 props15 family, nearby board-breadth plus move-search plus detect-threshold plus total-gain tweaks were no-ops there while props14 collapsed, lowering the per-move gate was catastrophic, and tightening secondary separation was slightly harmful, and increasing only the event window radius from 0 to 1 on the active beam3 props15 regime to test whether the improved low-budget branch benefits from a slightly wider temporal aggregation window under tighter beam search.
autoresearch/snapshots/20260417T044817Z_hybrid_lookahead_segmental_drop1_boardcands2_ratio95_props15_top9_detect10_minsep2_thresh3_total150_permove125_m9p8957061767578125_r0_beam3_v263.py	0.254438	0.876337	0.830116	0.484375	0.015524	discard	Hybrid decoder keeps the baseline lookahead path unless a conservative board-only segmental pass wins the current score-gain gates, while following up v221-v262 after beam_size=6 rescued the props16 branch into the best current lower-false-change tradeoff, beam3 through beam6 preserved that rescue exactly, beam3 + props15 produced a much stronger low-false-change branch than the older beam6 props15 family, nearby board-breadth plus move-search widening plus detect-threshold plus total-gain tweaks were no-ops there while props14 collapsed, lowering the per-move gate was catastrophic, and tightening secondary separation was slightly harmful, and narrowing only move-search breadth from top10 to top9 on the active beam3 props15 regime to test whether that stronger low-budget branch still needs the tenth move candidate or whether a slightly stricter move menu preserves quality while keeping its false-change win.
autoresearch/snapshots/20260417T044912Z_hybrid_lookahead_segmental_drop1_boardcands2_ratio95_props15_top10_detect10_minsep2_thresh3_total150_permove125_m9p8957061767578125_r0_beam5_v264.py	0.254438	0.847708	0.813439	0.468750	0.015524	discard	Hybrid decoder keeps the baseline lookahead path unless a conservative board-only segmental pass wins the current score-gain gates, while following up v221-v263 after beam_size=6 rescued the props16 branch into the best current lower-false-change tradeoff, beam3 + props15 produced a much stronger low-false-change branch than the older beam6 props15 family, nearby board-breadth plus move-search plus detect-threshold plus total-gain tweaks were no-ops there, props14 collapsed, per-move-gate loosening was catastrophic, and beam4 fell back to the older weaker props15 regime, and raising only beam_size from 3 to 5 on the active props15 branch to test whether the stronger beam3 profile survives anywhere above beam4 or whether beam3 is a narrow isolated regime.
autoresearch/snapshots/20260417T045036Z_hybrid_lookahead_segmental_drop1_boardcands2_ratio95_props15_top10_detect10_minsep2_thresh3_total150_permove112p5_m9p8957061767578125_r0_beam3_v265.py	0.168047	0.857733	0.808167	0.453125	0.021992	discard	Hybrid decoder keeps the baseline lookahead path unless a conservative board-only segmental pass wins the current score-gain gates, while following up v221-v264 after beam_size=6 rescued the props16 branch into the best current lower-false-change tradeoff, beam3 through beam6 preserved that rescue exactly, beam3 + props15 produced a much stronger low-false-change branch than the older beam6 props15 family, nearby board-breadth plus move-search plus detect-threshold plus total-gain tweaks were no-ops there while props14 collapsed, and lowering the per-added-move gate to 100 was catastrophic, and lowering only the per-added-move score-gain gate from 125 to 112.5 on the active beam3 props15 regime to test whether the improved low-budget branch has any safe room below 125 or whether the beam3 props15 gate shares the same sharp cliff seen at 100.
autoresearch/snapshots/20260417T045203Z_hybrid_lookahead_segmental_drop1_boardcands2_ratio95_props15_top10_detect10_minsep2_thresh3_total150_permove118p75_m9p8957061767578125_r0_beam3_v266.py	0.254438	0.876337	0.830116	0.484375	0.015524	discard	Hybrid decoder keeps the baseline lookahead path unless a conservative board-only segmental pass wins the current score-gain gates, while following up v221-v265 after beam_size=6 rescued the props16 branch into the best current lower-false-change tradeoff, beam3 + props15 produced a much stronger low-false-change branch than the older beam6 props15 family, nearby board-breadth plus move-search plus detect-threshold plus total-gain tweaks were no-ops there, props14 collapsed, and lowering the per-added-move gate to 112.5 and 100 was catastrophic, and lowering only the per-added-move score-gain gate from 125 to 118.75 on the active beam3 props15 regime to test whether the stronger low-budget branch has any safe room below 125 or whether its per-move gate is already a sharp cliff.
autoresearch/snapshots/20260417T045318Z_hybrid_lookahead_segmental_drop1_boardcands2_ratio95_props15_top8_detect10_minsep2_thresh3_total150_permove125_m9p8957061767578125_r0_beam3_v267.py	0.254438	0.876337	0.830116	0.484375	0.015524	discard	Hybrid decoder keeps the baseline lookahead path unless a conservative board-only segmental pass wins the current score-gain gates, while following up v221-v266 after beam_size=6 rescued the props16 branch into the best current lower-false-change tradeoff, beam3 + props15 produced a much stronger low-false-change branch than the older beam6 props15 family, nearby board-breadth plus detect-threshold plus total-gain tweaks were no-ops there, props14 collapsed, lowering the per-move gate was catastrophic, and both top9 and top12 were no-ops, and lowering only move-search breadth from top10 to top8 on the active beam3 props15 regime to test whether the move-search cliff in this tighter-search branch sits below 9 or whether the branch remains tolerant until a sharper drop at 8.
autoresearch/snapshots/20260417T045906Z_hybrid_lookahead_segmental_drop1_boardcands2_ratio95_props15_top6_detect10_minsep2_thresh3_total150_permove125_m9p8957061767578125_r0_beam3_v268.py	0.254438	0.876337	0.830116	0.484375	0.015524	discard	Hybrid decoder keeps the baseline lookahead path unless a conservative board-only segmental pass wins the current score-gain gates, while following up v221-v267 after beam_size=6 rescued the props16 branch into the best current lower-false-change tradeoff, beam3 + props15 produced a much stronger low-false-change branch than the older beam6 props15 family, nearby board-breadth plus detect-threshold plus total-gain tweaks were no-ops there, props14 collapsed, lowering the per-move gate was catastrophic, beam4-beam5 degraded, and top12 plus top9 plus top8 were all no-ops, and lowering only move-search breadth from top10 to top6 on the active beam3 props15 regime to test whether the move-search cliff in this tighter-search branch sits below 8 or whether the stronger branch remains stable even with a much smaller legal-move menu.
