snapshot	board_exact	non_empty_accuracy	macro_f1	move_recall	false_change_rate	status	description
autoresearch/snapshots/20260419T201716Z_hybrid_p8_m8_w3_g142p339380900065108903618238400667905807466695478069595992565155029296875_v969.py	0.071006	0.789778	0.739821	0.375000	0.024580	discard	Restore the compact props8 + minsep8 hybrid shelf anchored at lwindow3, beam3, top4, boardcands2, secsep1, radius0, drop1, props8, total150, and lmargin9.935836791992188. The latest executed bracket is harmful at 142.33938090006510890361823840066790580741553640109486877918243408203125 and exact-flat at 142.3393809000651089036182384006679058075178545550443232059478759765625, so this run restores the same shelf anchor and raises only min_score_gain_per_added_move to 142.339380900065108903618238400667905807466695478069595992565155029296875 to continue binary-searching that lower edge. The experiment name remains shortened to avoid the filename-too-long failure seen with long autogenerated names.
autoresearch/snapshots/20260419T201946Z_hybrid_p8_m8_w3_g142p3393809000651089036182384006679058074922750165569595992565155029296875_v970.py	0.071006	0.789778	0.739821	0.375000	0.024580	discard	Restore the compact props8 + minsep8 hybrid shelf anchored at lwindow3, beam3, top4, boardcands2, secsep1, radius0, drop1, props8, total150, and lmargin9.935836791992188. The latest executed bracket is harmful at 142.339380900065108903618238400667905807466695478069595992565155029296875 and exact-flat at 142.3393809000651089036182384006679058075178545550443232059478759765625, so this run restores the same shelf anchor and raises only min_score_gain_per_added_move to 142.3393809000651089036182384006679058074922750165569595992565155029296875 to continue binary-searching that lower edge. The experiment name remains shortened to avoid the filename-too-long failure seen with long autogenerated names.
autoresearch/snapshots/20260419T202208Z_hybrid_p8_m8_w3_g142p33938090006510890361823840066790580750506478580064140260219573974609375_v971.py	0.071006	0.799339	0.749250	0.375000	0.020699	discard	Restore the compact props8 + minsep8 hybrid shelf anchored at lwindow3, beam3, top4, boardcands2, secsep1, radius0, drop1, props8, total150, and lmargin9.935836791992188. The latest executed bracket is harmful at 142.3393809000651089036182384006679058074922750165569595992565155029296875 and exact-flat at 142.3393809000651089036182384006679058075178545550443232059478759765625, so this run restores the same shelf anchor and raises only min_score_gain_per_added_move to 142.33938090006510890361823840066790580750506478580064140260219573974609375 to continue binary-searching that lower edge. The experiment name remains shortened to avoid the filename-too-long failure seen with long autogenerated names.
autoresearch/snapshots/20260419T202438Z_hybrid_p8_m8_w3_g142p339380900065108903618238400667905807498669901178800500929355621337890625_v972.py	0.071006	0.799339	0.749250	0.375000	0.020699	discard	Restore the compact props8 + minsep8 hybrid shelf anchored at lwindow3, beam3, top4, boardcands2, secsep1, radius0, drop1, props8, total150, and lmargin9.935836791992188. The latest executed bracket is harmful at 142.3393809000651089036182384006679058074922750165569595992565155029296875 and exact-flat at 142.33938090006510890361823840066790580750506478580064140260219573974609375, so this run restores the same shelf anchor and raises only min_score_gain_per_added_move to 142.339380900065108903618238400667905807498669901178800500929355621337890625 to continue binary-searching that lower edge. The experiment name remains shortened to avoid the filename-too-long failure seen with long autogenerated names.
autoresearch/snapshots/20260419T202658Z_hybrid_p8_m8_w3_g142p3393809000651089036182384006679058074954724588678800500929355621337890625_v973.py	0.071006	0.799339	0.749250	0.375000	0.020699	discard	Restore the compact props8 + minsep8 hybrid shelf anchored at lwindow3, beam3, top4, boardcands2, secsep1, radius0, drop1, props8, total150, and lmargin9.935836791992188. The latest executed bracket is harmful at 142.3393809000651089036182384006679058074922750165569595992565155029296875 and exact-flat at 142.339380900065108903618238400667905807498669901178800500929355621337890625, so this run restores the same shelf anchor and raises only min_score_gain_per_added_move to 142.3393809000651089036182384006679058074954724588678800500929355621337890625 to continue binary-searching that lower edge. The experiment name remains shortened to avoid the filename-too-long failure seen with long autogenerated names.
autoresearch/snapshots/20260419T202924Z_hybrid_p8_m8_w3_g142p33938090006510890361823840066790580749387373771241982467472553253173828125_v974.py	0.071006	0.789778	0.739821	0.375000	0.024580	discard	Restore the compact props8 + minsep8 hybrid shelf anchored at lwindow3, beam3, top4, boardcands2, secsep1, radius0, drop1, props8, total150, and lmargin9.935836791992188. The latest executed bracket is harmful at 142.3393809000651089036182384006679058074922750165569595992565155029296875 and exact-flat at 142.3393809000651089036182384006679058074954724588678800500929355621337890625, so this run restores the same shelf anchor and raises only min_score_gain_per_added_move to 142.33938090006510890361823840066790580749387373771241982467472553253173828125 to continue binary-searching that lower edge. The experiment name remains shortened to avoid the filename-too-long failure seen with long autogenerated names.
autoresearch/snapshots/20260419T203158Z_hybrid_p8_m8_w3_g142p339380900065108903618238400667905807494673098290149937383830547332763671875_v975.py	0.071006	0.789778	0.739821	0.375000	0.024580	discard	Restore the compact props8 + minsep8 hybrid shelf anchored at lwindow3, beam3, top4, boardcands2, secsep1, radius0, drop1, props8, total150, and lmargin9.935836791992188. The latest executed bracket is harmful at 142.33938090006510890361823840066790580749387373771241982467472553253173828125 and exact-flat at 142.3393809000651089036182384006679058074954724588678800500929355621337890625, so this run restores the same shelf anchor and raises only min_score_gain_per_added_move to 142.339380900065108903618238400667905807494673098290149937383830547332763671875 to continue binary-searching that lower edge. The experiment name remains shortened to avoid the filename-too-long failure seen with long autogenerated names.
autoresearch/snapshots/20260419T203431Z_hybrid_p8_m8_w3_g142p3393809000651089036182384006679058074950727785790149937383830547332763671875_v976.py	0.071006	0.789778	0.739821	0.375000	0.024580	discard	Restore the compact props8 + minsep8 hybrid shelf anchored at lwindow3, beam3, top4, boardcands2, secsep1, radius0, drop1, props8, total150, and lmargin9.935836791992188. The latest executed bracket is harmful at 142.339380900065108903618238400667905807494673098290149937383830547332763671875 and exact-flat at 142.3393809000651089036182384006679058074954724588678800500929355621337890625, so this run restores the same shelf anchor and raises only min_score_gain_per_added_move to 142.3393809000651089036182384006679058074950727785790149937383830547332763671875 to continue binary-searching that lower edge. The experiment name remains shortened to avoid the filename-too-long failure seen with long autogenerated names.
autoresearch/snapshots/20260419T203650Z_hybrid_p8_m8_w3_g142p33938090006510890361823840066790580749527261872344752191565930843353271484375_v977.py	0.071006	0.799339	0.749250	0.375000	0.020699	discard	Restore the compact props8 + minsep8 hybrid shelf anchored at lwindow3, beam3, top4, boardcands2, secsep1, radius0, drop1, props8, total150, and lmargin9.935836791992188. The latest executed bracket is harmful at 142.3393809000651089036182384006679058074950727785790149937383830547332763671875 and exact-flat at 142.3393809000651089036182384006679058074954724588678800500929355621337890625, so this run restores the same shelf anchor and raises only min_score_gain_per_added_move to 142.33938090006510890361823840066790580749527261872344752191565930843353271484375 to continue binary-searching that lower edge. The experiment name remains shortened to avoid the filename-too-long failure seen with long autogenerated names.
autoresearch/snapshots/20260419T203909Z_hybrid_p8_m8_w3_g142p339380900065108903618238400667905807495172698651231257827021181583404541015625_v978.py	0.071006	0.799339	0.749250	0.375000	0.020699	discard	Restore the compact props8 + minsep8 hybrid shelf anchored at lwindow3, beam3, top4, boardcands2, secsep1, radius0, drop1, props8, total150, and lmargin9.935836791992188. The latest executed bracket is harmful at 142.3393809000651089036182384006679058074950727785790149937383830547332763671875 and exact-flat at 142.33938090006510890361823840066790580749527261872344752191565930843353271484375, so this run restores the same shelf anchor and raises only min_score_gain_per_added_move to 142.339380900065108903618238400667905807495172698651231257827021181583404541015625 to continue binary-searching that lower edge. The experiment name remains shortened to avoid the filename-too-long failure seen with long autogenerated names.
autoresearch/snapshots/20260419T204122Z_hybrid_p8_m8_w3_g142p339380900065108903618238400667905807495172698651231257827021181583404541015625_v978.py	0.071006	0.799339	0.749250	0.375000	0.020699	discard	Restore the compact props8 + minsep8 hybrid shelf anchored at lwindow3, beam3, top4, boardcands2, secsep1, radius0, drop1, props8, total150, and lmargin9.935836791992188. The latest executed bracket is harmful at 142.3393809000651089036182384006679058074950727785790149937383830547332763671875 and exact-flat at 142.33938090006510890361823840066790580749527261872344752191565930843353271484375, so this run restores the same shelf anchor and raises only min_score_gain_per_added_move to 142.339380900065108903618238400667905807495172698651231257827021181583404541015625 to continue binary-searching that lower edge. The experiment name remains shortened to avoid the filename-too-long failure seen with long autogenerated names.
autoresearch/snapshots/20260419T204337Z_hybrid_p8_m8_w3_g142p3393809000651089036182384006679058074951227386151231257827021181583404541015625_v979.py	0.071006	0.799339	0.749250	0.375000	0.020699	discard	Restore the compact props8 + minsep8 hybrid shelf anchored at lwindow3, beam3, top4, boardcands2, secsep1, radius0, drop1, props8, total150, and lmargin9.935836791992188. The latest executed bracket is harmful at 142.3393809000651089036182384006679058074950727785790149937383830547332763671875 and exact-flat at 142.339380900065108903618238400667905807495172698651231257827021181583404541015625, so this run restores the same shelf anchor and raises only min_score_gain_per_added_move to 142.3393809000651089036182384006679058074951227386151231257827021181583404541015625 to continue binary-searching that lower edge. The experiment name remains shortened to avoid the filename-too-long failure seen with long autogenerated names.
autoresearch/snapshots/20260419T204553Z_hybrid_p8_m8_w3_g142p33938090006510890361823840066790580749509775859706905976054258644580841064453125_v980.py	0.071006	0.789778	0.739821	0.375000	0.024580	discard	Restore the compact props8 + minsep8 hybrid shelf anchored at lwindow3, beam3, top4, boardcands2, secsep1, radius0, drop1, props8, total150, and lmargin9.935836791992188. The latest executed bracket is harmful at 142.3393809000651089036182384006679058074950727785790149937383830547332763671875 and exact-flat at 142.3393809000651089036182384006679058074951227386151231257827021181583404541015625, so this run restores the same shelf anchor and raises only min_score_gain_per_added_move to 142.33938090006510890361823840066790580749509775859706905976054258644580841064453125 to continue binary-searching that lower edge. The experiment name remains shortened to avoid the filename-too-long failure seen with long autogenerated names.
autoresearch/snapshots/20260419T204815Z_hybrid_p8_m8_w3_g142p339380900065108903618238400667905807495110248606096092771622352302074432373046875_v981.py	0.071006	0.789778	0.739821	0.375000	0.024580	discard	Restore the compact props8 + minsep8 hybrid shelf anchored at lwindow3, beam3, top4, boardcands2, secsep1, radius0, drop1, props8, total150, and lmargin9.935836791992188. The latest executed bracket is harmful at 142.33938090006510890361823840066790580749509775859706905976054258644580841064453125 and exact-flat at 142.3393809000651089036182384006679058074951227386151231257827021181583404541015625, so this run restores the same shelf anchor and raises only min_score_gain_per_added_move to 142.339380900065108903618238400667905807495110248606096092771622352302074432373046875 to continue binary-searching that lower edge. The experiment name remains shortened to avoid the filename-too-long failure seen with long autogenerated names.
autoresearch/snapshots/20260419T205036Z_hybrid_p8_m8_w3_g142p3393809000651089036182384006679058074951164936106096092771622352302074432373046875_v982.py	0.071006	0.789778	0.739821	0.375000	0.024580	discard	Restore the compact props8 + minsep8 hybrid shelf anchored at lwindow3, beam3, top4, boardcands2, secsep1, radius0, drop1, props8, total150, and lmargin9.935836791992188. The latest executed bracket is harmful at 142.339380900065108903618238400667905807495110248606096092771622352302074432373046875 and exact-flat at 142.3393809000651089036182384006679058074951227386151231257827021181583404541015625, so this run restores the same shelf anchor and raises only min_score_gain_per_added_move to 142.3393809000651089036182384006679058074951164936106096092771622352302074432373046875 to continue binary-searching that lower edge. The experiment name remains shortened to avoid the filename-too-long failure seen with long autogenerated names.
autoresearch/snapshots/20260419T205255Z_hybrid_p8_m8_w3_g142p33938090006510890361823840066790580749511961611286636752993217669427394866943359375_v983.py	0.071006	0.799339	0.749250	0.375000	0.020699	discard	Restore the compact props8 + minsep8 hybrid shelf anchored at lwindow3, beam3, top4, boardcands2, secsep1, radius0, drop1, props8, total150, and lmargin9.935836791992188. The latest executed bracket is harmful at 142.3393809000651089036182384006679058074951164936106096092771622352302074432373046875 and exact-flat at 142.3393809000651089036182384006679058074951227386151231257827021181583404541015625, so this run restores the same shelf anchor and raises only min_score_gain_per_added_move to 142.33938090006510890361823840066790580749511961611286636752993217669427394866943359375 to continue binary-searching that lower edge. The experiment name remains shortened to avoid the filename-too-long failure seen with long autogenerated names.
autoresearch/snapshots/20260419T205522Z_hybrid_p8_m8_w3_g142p339380900065108903618238400667905807495118054861737988403547205962240695953369140625_v984.py	0.071006	0.799339	0.749250	0.375000	0.020699	discard	Restore the compact props8 + minsep8 hybrid shelf anchored at lwindow3, beam3, top4, boardcands2, secsep1, radius0, drop1, props8, total150, and lmargin9.935836791992188. The latest executed bracket is harmful at 142.3393809000651089036182384006679058074951164936106096092771622352302074432373046875 and exact-flat at 142.33938090006510890361823840066790580749511961611286636752993217669427394866943359375, so this run restores the same shelf anchor and raises only min_score_gain_per_added_move to 142.339380900065108903618238400667905807495118054861737988403547205962240695953369140625 to continue binary-searching that lower edge. The experiment name remains shortened to avoid the filename-too-long failure seen with long autogenerated names.
autoresearch/snapshots/20260419T205752Z_hybrid_p8_m8_w3_g142p3393809000651089036182384006679058074951172742361737988403547205962240695953369140625_v985.py	0.071006	0.799339	0.749250	0.375000	0.020699	discard	Restore the compact props8 + minsep8 hybrid shelf anchored at lwindow3, beam3, top4, boardcands2, secsep1, radius0, drop1, props8, total150, and lmargin9.935836791992188. The latest executed bracket is harmful at 142.3393809000651089036182384006679058074951164936106096092771622352302074432373046875 and exact-flat at 142.339380900065108903618238400667905807495118054861737988403547205962240695953369140625, so this run restores the same shelf anchor and raises only min_score_gain_per_added_move to 142.3393809000651089036182384006679058074951172742361737988403547205962240695953369140625 to continue binary-searching that lower edge. The experiment name remains shortened to avoid the filename-too-long failure seen with long autogenerated names.
autoresearch/snapshots/20260419T210016Z_hybrid_p8_m8_w3_g142p33938090006510890361823840066790580749511688392339170405875847791321575641632080078125_v986.py	0.071006	0.789778	0.739821	0.375000	0.024580	discard	Restore the compact props8 + minsep8 hybrid shelf anchored at lwindow3, beam3, top4, boardcands2, secsep1, radius0, drop1, props8, total150, and lmargin9.935836791992188. The latest executed bracket is harmful at 142.3393809000651089036182384006679058074951164936106096092771622352302074432373046875 and exact-flat at 142.3393809000651089036182384006679058074951172742361737988403547205962240695953369140625, so this run restores the same shelf anchor and raises only min_score_gain_per_added_move to 142.33938090006510890361823840066790580749511688392339170405875847791321575641632080078125 to continue binary-searching that lower edge. The experiment name remains shortened to avoid the filename-too-long failure seen with long autogenerated names.
autoresearch/snapshots/20260419T210233Z_hybrid_p8_m8_w3_g142p339380900065108903618238400667905807495117079079782751449556599254719913005828857421875_v987.py	0.071006	0.789778	0.739821	0.375000	0.024580	discard	Restore the compact props8 + minsep8 hybrid shelf anchored at lwindow3, beam3, top4, boardcands2, secsep1, radius0, drop1, props8, total150, and lmargin9.935836791992188. The latest executed bracket is harmful at 142.33938090006510890361823840066790580749511688392339170405875847791321575641632080078125 and exact-flat at 142.3393809000651089036182384006679058074951172742361737988403547205962240695953369140625, so this run restores the same shelf anchor and raises only min_score_gain_per_added_move to 142.339380900065108903618238400667905807495117079079782751449556599254719913005828857421875 to continue binary-searching that lower edge. The experiment name remains shortened to avoid the filename-too-long failure seen with long autogenerated names.
autoresearch/snapshots/20260419T210819Z_hybrid_p8_m8_w3_g142p3393809000651089036182384006679058074951171766579782751449556599254719913005828857421875_v988.py	0.071006	0.789778	0.739821	0.375000	0.024580	discard	Restore the compact props8 + minsep8 hybrid shelf anchored at lwindow3, beam3, top4, boardcands2, secsep1, radius0, drop1, props8, total150, and lmargin9.935836791992188. The latest executed bracket is harmful at 142.339380900065108903618238400667905807495117079079782751449556599254719913005828857421875 and exact-flat at 142.3393809000651089036182384006679058074951172742361737988403547205962240695953369140625, so this run restores the same shelf anchor and raises only min_score_gain_per_added_move to 142.3393809000651089036182384006679058074951171766579782751449556599254719913005828857421875 to continue binary-searching that lower edge. The experiment name remains shortened to avoid the filename-too-long failure seen with long autogenerated names.
autoresearch/snapshots/20260419T211028Z_hybrid_p8_m8_w3_g142p33938090006510890361823840066790580749511722544707603699265519026084803044795989990234375_v989.py	0.071006	0.799339	0.749250	0.375000	0.020699	discard	Restore the compact props8 + minsep8 hybrid shelf anchored at lwindow3, beam3, top4, boardcands2, secsep1, radius0, drop1, props8, total150, and lmargin9.935836791992188. The latest executed bracket is harmful at 142.3393809000651089036182384006679058074951171766579782751449556599254719913005828857421875 and exact-flat at 142.3393809000651089036182384006679058074951172742361737988403547205962240695953369140625, so this run restores the same shelf anchor and raises only min_score_gain_per_added_move to 142.33938090006510890361823840066790580749511722544707603699265519026084803044795989990234375 to continue binary-searching that lower edge. The experiment name remains shortened to avoid the filename-too-long failure seen with long autogenerated names.
autoresearch/snapshots/20260419T211237Z_hybrid_p8_m8_w3_g142p339380900065108903618238400667905807495117201052527156068805425093160010874271392822265625_v990.py	0.071006	0.799339	0.749250	0.375000	0.020699	discard	Restore the compact props8 + minsep8 hybrid shelf anchored at lwindow3, beam3, top4, boardcands2, secsep1, radius0, drop1, props8, total150, and lmargin9.935836791992188. The latest executed bracket is harmful at 142.3393809000651089036182384006679058074951171766579782751449556599254719913005828857421875 and exact-flat at 142.33938090006510890361823840066790580749511722544707603699265519026084803044795989990234375, so this run restores the same shelf anchor and raises only min_score_gain_per_added_move to 142.339380900065108903618238400667905807495117201052527156068805425093160010874271392822265625 to continue binary-searching that lower edge. The experiment name remains shortened to avoid the filename-too-long failure seen with long autogenerated names.
