snapshot	board_exact	non_empty_accuracy	macro_f1	move_recall	false_change_rate	status	description
autoresearch/snapshots/20260417T052227Z_hybrid_lookahead_segmental_drop1_boardcands2_ratio95_props16_top2_detect10_minsep2_thresh3_total125_permove125_m9p8957061767578125_r0_beam8_v290.py	0.254438	0.847191	0.844308	0.484375	0.015524	discard	Hybrid decoder keeps the baseline lookahead path unless a conservative board-only segmental pass wins the current score-gain gates, while following up v221-v289 after beam_size=6 + props16 rescued the old degraded branch into the best current lower-false-change tradeoff, top-move breadth stayed an exact no-op from 12 down through 3 on beam6, top2 plus top1 shifted beam5 through beam7 into the same higher-recall tradeoff, and beam8 + props16 + top2 opened a distinct lower-false-change lower-recall regime while top1 matched it, top3 was worse, boardcands3 snapped back toward the older v120-style tradeoff, boardcands1 was harmful, and props15 at this beam was also worse, and lowering only the total score-gain gate from 150 to 125 on the active beam8 props16 top2 regime to test whether this low-false-change branch is currently limited by total hybrid acceptance rather than decoder search shape.
autoresearch/snapshots/20260417T052341Z_hybrid_lookahead_segmental_drop1_boardcands2_ratio95_props16_top2_detect10_minsep2_thresh3_total150_permove112p5_m9p8957061767578125_r0_beam8_v291.py	0.254438	0.847191	0.844308	0.484375	0.015524	discard	Hybrid decoder keeps the baseline lookahead path unless a conservative board-only segmental pass wins the current score-gain gates, while following up v221-v290 after beam_size=6 + props16 rescued the old degraded branch into the best current lower-false-change tradeoff, top-move breadth stayed an exact no-op from 12 down through 3 on beam6, top2 plus top1 shifted beam5 through beam7 into the same higher-recall tradeoff, and beam8 + props16 + top2 opened a distinct lower-false-change lower-recall regime while top1 matched it, top3 was worse, boardcands3 snapped back toward the older v120-style tradeoff, boardcands1 was harmful, props15 and props17 were both worse there, and lowering only the per-added-move score-gain gate from 125 to 112.5 on the active beam8 props16 top2 regime to test whether that new low-false-change branch has any safe room below 125 or whether its hybrid acceptance is already pinned at the current per-move threshold.
autoresearch/snapshots/20260417T052524Z_hybrid_lookahead_segmental_drop1_boardcands2_ratio95_props16_top2_detect10_minsep2_thresh3_total150_permove100_m9p8957061767578125_r0_beam8_v292.py	0.254438	0.847191	0.844308	0.484375	0.015524	discard	Hybrid decoder keeps the baseline lookahead path unless a conservative board-only segmental pass wins the current score-gain gates, while following up v221-v291 after beam_size=6 + props16 rescued the old degraded branch into the best current lower-false-change tradeoff, top-move breadth stayed an exact no-op from 12 down through 3 on beam6, top2 plus top1 shifted beam5 through beam7 into the same higher-recall tradeoff, and beam8 + props16 + top2 opened a distinct lower-false-change lower-recall regime while top1 matched it, top3 was worse, boardcands3 snapped back toward the older v120-style tradeoff, boardcands1 was harmful, props15 and props17 were both worse there, and lowering only the per-added-move score-gain gate from 125 to 112.5 was a no-op, and lowering only the per-added-move score-gain gate from 125 to 100 on the active beam8 props16 top2 regime to test whether that new low-false-change branch still has safe room below 112.5 or whether its hybrid acceptance cliff starts between 100 and 112.5.
autoresearch/snapshots/20260417T052626Z_hybrid_lookahead_segmental_drop1_boardcands2_ratio95_props16_top2_detect10_minsep2_thresh3_total150_permove50_m9p8957061767578125_r0_beam8_v293.py	0.134911	0.821250	0.820777	0.500000	0.024580	discard	Hybrid decoder keeps the baseline lookahead path unless a conservative board-only segmental pass wins the current score-gain gates, while following up v221-v292 after beam_size=6 + props16 rescued the old degraded branch into the best current lower-false-change tradeoff, top-move breadth stayed an exact no-op from 12 down through 3 on beam6, top2 plus top1 shifted beam5 through beam7 into the same higher-recall tradeoff, and beam8 + props16 + top2 opened a distinct lower-false-change lower-recall regime while top1 matched it, top3 was worse, boardcands3 snapped back toward the older v120-style tradeoff, boardcands1 was harmful, props15 and props17 were both worse there, and lowering only the per-added-move score-gain gate from 125 to 112.5 and 100 was still a no-op, and lowering only the per-added-move score-gain gate from 125 to 50 on the active beam8 props16 top2 regime to test whether that branch remains insensitive deep below 100 or whether its hybrid acceptance cliff finally appears between 50 and 100.
autoresearch/snapshots/20260417T052728Z_hybrid_lookahead_segmental_drop1_boardcands2_ratio95_props16_top2_detect10_minsep2_thresh3_total150_permove75_m9p8957061767578125_r0_beam8_v294.py	0.168047	0.829001	0.823616	0.468750	0.021992	discard	Hybrid decoder keeps the baseline lookahead path unless a conservative board-only segmental pass wins the current score-gain gates, while following up v221-v293 after beam_size=6 + props16 rescued the old degraded branch into the best current lower-false-change tradeoff, top-move breadth stayed an exact no-op from 12 down through 3 on beam6, top2 plus top1 shifted beam5 through beam7 into the same higher-recall tradeoff, and beam8 + props16 + top2 opened a distinct lower-false-change lower-recall regime while top1 matched it, top3 was worse, boardcands3 snapped back toward the older v120-style tradeoff, boardcands1 was harmful, props15 and props17 were both worse there, and lowering the per-added-move score-gain gate from 125 to 112.5 and 100 was still a no-op while 50 was catastrophic, and lowering only the per-added-move score-gain gate from 125 to 75 on the active beam8 props16 top2 regime to localize whether that branch's hybrid-acceptance cliff begins closer to 50 or 100.
autoresearch/snapshots/20260417T053229Z_hybrid_lookahead_segmental_drop1_boardcands2_ratio95_props16_top2_detect10_minsep2_thresh3_total150_permove87p5_m9p8957061767578125_r0_beam8_v295.py	0.168047	0.829001	0.823616	0.468750	0.021992	discard	Hybrid decoder keeps the baseline lookahead path unless a conservative board-only segmental pass wins the current score-gain gates, while following up v221-v294 after beam_size=6 + props16 rescued the old degraded branch into the best current lower-false-change tradeoff, top-move breadth stayed an exact no-op from 12 down through 3 on beam6, top2 plus top1 shifted beam5 through beam7 into the same higher-recall tradeoff, and beam8 + props16 + top2 opened a distinct lower-false-change lower-recall regime while top1 matched it, top3 was worse, boardcands3 snapped back toward the older v120-style tradeoff, boardcands1 was harmful, props15 and props17 were both worse there, and lowering the per-added-move score-gain gate from 125 to 112.5 and 100 was still a no-op while 75 and 50 were harmful, and lowering only the per-added-move score-gain gate from 125 to 87.5 on the active beam8 props16 top2 regime to localize whether that branch's hybrid-acceptance cliff begins between 75 and 100.
autoresearch/snapshots/20260417T053334Z_hybrid_lookahead_segmental_drop1_boardcands2_ratio95_props16_top2_detect10_minsep2_thresh3_total150_permove93p75_m9p8957061767578125_r0_beam8_v296.py	0.254438	0.847191	0.844308	0.484375	0.015524	discard	Hybrid decoder keeps the baseline lookahead path unless a conservative board-only segmental pass wins the current score-gain gates, while following up v221-v295 after beam_size=6 + props16 rescued the old degraded branch into the best current lower-false-change tradeoff, top-move breadth stayed an exact no-op from 12 down through 3 on beam6, top2 plus top1 shifted beam5 through beam7 into the same higher-recall tradeoff, and beam8 + props16 + top2 opened a distinct lower-false-change lower-recall regime while top1 matched it, top3 was worse, boardcands3 snapped back toward the older v120-style tradeoff, boardcands1 was harmful, props15 and props17 were both worse there, and lowering the per-added-move score-gain gate from 125 to 112.5 and 100 was still a no-op while 87.5, 75, and 50 were harmful, and lowering only the per-added-move score-gain gate from 125 to 93.75 on the active beam8 props16 top2 regime to localize whether that branch's hybrid-acceptance cliff begins between 87.5 and 100.
autoresearch/snapshots/20260417T053454Z_hybrid_lookahead_segmental_drop1_boardcands4_ratio95_props16_top2_detect10_minsep2_thresh3_total150_permove125_m9p8957061767578125_r0_beam8_v297.py	0.254438	0.841455	0.824022	0.484375	0.015524	discard	Hybrid decoder keeps the baseline lookahead path unless a conservative board-only segmental pass wins the current score-gain gates, while following up v221-v296 after beam_size=6 + props16 rescued the old degraded branch into the best current lower-false-change tradeoff, top-move breadth stayed an exact no-op from 12 down through 3 on beam6, top2 plus top1 shifted beam5 through beam7 into the same higher-recall tradeoff, beam8 + props16 + top2 opened a distinct lower-false-change lower-recall regime, boardcands3 snapped that beam8 regime back toward the older v120-style tradeoff, boardcands1 was harmful, and recent per-added-move gate bisection localized the beam8 cliff without improving the branch, and widening only board-state breadth from 2 to 4 on the active beam8 props16 top2 regime to test whether the boardcands3 shift keeps improving with more board hypotheses or whether the branch is already past its useful board-width limit.
autoresearch/snapshots/20260417T053655Z_hybrid_lookahead_segmental_drop1_boardcands3_ratio95_props16_top2_detect10_minsep2_thresh3_total150_permove125_m9p8957061767578125_r0_beam7_v298.py	0.254438	0.889670	0.859107	0.500000	0.016818	discard	Hybrid decoder keeps the baseline lookahead path unless a conservative board-only segmental pass wins the current score-gain gates, while following up v221-v297 after beam_size=6 + props16 rescued the old degraded branch into the best current lower-false-change tradeoff, top2 plus top1 shifted beam5 through beam7 into the same higher-recall regime, beam8 + props16 + top2 opened a distinct lower-false-change lower-recall regime, widening board-state breadth to 3 on beam8 snapped back toward the older v120-style tradeoff while boardcands4 was worse and boardcands1 was harmful, and changing only board-state breadth from 2 to 3 on the beam7 + props16 + top2 regime to localize whether that board-breadth transition begins at beam7 or only appears at beam8.
autoresearch/snapshots/20260417T053759Z_hybrid_lookahead_segmental_drop1_boardcands4_ratio95_props16_top2_detect10_minsep2_thresh3_total150_permove125_m9p8957061767578125_r0_beam7_v299.py	0.254438	0.841455	0.824022	0.484375	0.015524	discard	Hybrid decoder keeps the baseline lookahead path unless a conservative board-only segmental pass wins the current score-gain gates, while following up v221-v298 after beam_size=6 + props16 rescued the old degraded branch into the best current lower-false-change tradeoff, top2 plus top1 shifted beam5 through beam7 into the same higher-recall regime, beam8 + props16 + top2 opened a distinct lower-false-change lower-recall regime, widening board-state breadth to 3 on beam7 was an exact no-op while the same change on beam8 snapped back toward the older v120-style tradeoff and boardcands4 on beam8 was worse, and changing only board-state breadth from 2 to 4 on the beam7 + props16 + top2 regime to test whether beam7 remains inert under broader board search or whether the beam8-style transition begins only once board width reaches 4.
autoresearch/snapshots/20260417T053922Z_hybrid_lookahead_segmental_drop1_boardcands3_ratio95_props16_top1_detect10_minsep2_thresh3_total150_permove125_m9p8957061767578125_r0_beam8_v300.py	0.254438	0.884089	0.855756	0.500000	0.016818	discard	Hybrid decoder keeps the baseline lookahead path unless a conservative board-only segmental pass wins the current score-gain gates, while following up v221-v299 after beam_size=6 + props16 rescued the old degraded branch into the best current lower-false-change tradeoff, top2 plus top1 shifted beam5 through beam7 into the same higher-recall regime, beam8 + props16 + top2 opened a distinct lower-false-change lower-recall regime, widening board-state breadth to 3 on beam8 snapped back toward the older v120-style tradeoff while beam7 stayed inert there and boardcands4 on beam7-beam8 was worse, and lowering only top-move breadth from 2 to 1 on the active beam8 + boardcands3 branch to test whether that shifted tradeoff still needs two move candidates or has already become insensitive to move-menu width like the older broader-search family.
autoresearch/snapshots/20260417T054021Z_hybrid_lookahead_segmental_drop1_boardcands3_ratio95_props16_top3_detect10_minsep2_thresh3_total150_permove125_m9p8957061767578125_r0_beam8_v301.py	0.254438	0.884089	0.855756	0.500000	0.016818	discard	Hybrid decoder keeps the baseline lookahead path unless a conservative board-only segmental pass wins the current score-gain gates, while following up v221-v300 after beam_size=6 + props16 rescued the old degraded branch into the best current lower-false-change tradeoff, beam8 + props16 + top2 opened a distinct lower-false-change lower-recall regime, widening board-state breadth to 3 on beam8 snapped that branch back toward the older v120-style tradeoff, beam7 stayed inert under the same board-breadth change, boardcands4 was worse on both beam7 and beam8, and lowering top-move breadth from 2 to 1 on the active beam8 + boardcands3 branch was an exact no-op, and raising only top-move breadth from 2 to 3 on that beam8 + boardcands3 branch to test whether the snapped-back tradeoff is already insensitive to move-menu width or still degrades once one extra move candidate is admitted.
autoresearch/snapshots/20260417T054204Z_hybrid_lookahead_segmental_drop1_boardcands2_ratio95_props16_top2_detect10_minsep2_thresh3_total150_permove112p5_m9p8957061767578125_r0_beam7_v302.py	0.254438	0.889670	0.859107	0.500000	0.016818	discard	Hybrid decoder keeps the baseline lookahead path unless a conservative board-only segmental pass wins the current score-gain gates, while following up v221-v301 after beam_size=6 + props16 rescued the old degraded branch into the best current lower-false-change tradeoff, top2 plus top1 shifted beam5 through beam7 into the same higher-recall regime, beam8 + props16 + top2 opened a distinct lower-false-change lower-recall regime, beam8 + boardcands3 snapped back toward the older v120-style tradeoff while boardcands4 was worse, beam7 stayed on the same higher-recall regime under boardcands3, and lowering only the per-added-move score-gain gate from 125 to 112.5 on the active beam7 + props16 + top2 regime to test whether that higher-recall branch still has safe hybrid-acceptance headroom below the default threshold or is already pinned like the surrounding saturated search-shape probes.
autoresearch/snapshots/20260417T054259Z_hybrid_lookahead_segmental_drop1_boardcands2_ratio95_props16_top2_detect10_minsep2_thresh3_total150_permove100_m9p8957061767578125_r0_beam7_v303.py	0.254438	0.889670	0.859107	0.500000	0.016818	discard	Hybrid decoder keeps the baseline lookahead path unless a conservative board-only segmental pass wins the current score-gain gates, while following up v221-v302 after beam_size=6 + props16 rescued the old degraded branch into the best current lower-false-change tradeoff, top2 plus top1 shifted beam5 through beam7 into the same higher-recall regime, beam8 + props16 + top2 opened a distinct lower-false-change lower-recall regime with a per-added-move cliff only below 93.75, beam7 stayed on the same higher-recall regime under the recent board-breadth probes, and lowering only the per-added-move score-gain gate from 125 to 112.5 on the active beam7 + props16 + top2 regime was still a no-op, and lowering only the per-added-move score-gain gate from 125 to 100 on that same beam7 regime to test whether it also has safe hybrid-acceptance headroom down to 100 or whether its gate cliff starts earlier than the beam8 branch.
autoresearch/snapshots/20260417T054351Z_hybrid_lookahead_segmental_drop1_boardcands2_ratio95_props16_top2_detect10_minsep2_thresh3_total150_permove93p75_m9p8957061767578125_r0_beam7_v304.py	0.254438	0.889670	0.859107	0.500000	0.016818	discard	Hybrid decoder keeps the baseline lookahead path unless a conservative board-only segmental pass wins the current score-gain gates, while following up v221-v303 after beam_size=6 + props16 rescued the old degraded branch into the best current lower-false-change tradeoff, top2 plus top1 shifted beam5 through beam7 into the same higher-recall regime, beam8 + props16 + top2 opened a distinct lower-false-change lower-recall regime with a per-added-move cliff below 93.75, beam7 stayed on the same higher-recall regime under the recent board-breadth probes, and lowering only the per-added-move score-gain gate from 125 to 112.5 and 100 on the active beam7 + props16 + top2 regime was still a no-op, and lowering only the per-added-move score-gain gate from 125 to 93.75 on that same beam7 regime to test whether its hybrid-acceptance cliff aligns with the beam8 branch or starts earlier.
autoresearch/snapshots/20260417T054447Z_hybrid_lookahead_segmental_drop1_boardcands2_ratio95_props16_top2_detect10_minsep2_thresh3_total150_permove87p5_m9p8957061767578125_r0_beam7_v305.py	0.168047	0.871480	0.839078	0.484375	0.023286	discard	Hybrid decoder keeps the baseline lookahead path unless a conservative board-only segmental pass wins the current score-gain gates, while following up v221-v304 after beam_size=6 + props16 rescued the old degraded branch into the best current lower-false-change tradeoff, top2 plus top1 shifted beam5 through beam7 into the same higher-recall regime, beam8 + props16 + top2 opened a distinct lower-false-change lower-recall regime with a per-added-move cliff below 93.75, beam7 stayed on the same higher-recall regime under the recent board-breadth probes, and lowering only the per-added-move score-gain gate from 125 to 112.5, 100, and 93.75 on the active beam7 + props16 + top2 regime was still a no-op, and lowering only the per-added-move score-gain gate from 125 to 87.5 on that same beam7 regime to test whether its hybrid-acceptance cliff aligns with the beam8 branch or remains lower.
autoresearch/snapshots/20260417T054549Z_hybrid_lookahead_segmental_drop1_boardcands2_ratio95_props16_top3_detect10_minsep2_thresh3_total150_permove125_m9p8957061767578125_r0_beam7_v306.py	0.254438	0.884089	0.855756	0.500000	0.016818	discard	Hybrid decoder keeps the baseline lookahead path unless a conservative board-only segmental pass wins the current score-gain gates, while following up v221-v305 after beam_size=6 + props16 rescued the old degraded branch into the best current lower-false-change tradeoff, top2 plus top1 shifted beam5 through beam7 into the same higher-recall regime, beam7's recent board-breadth and per-added-move gate probes stayed inert until the same sharp cliff seen on beam8, and raising only top-move breadth from 2 to 3 on the active beam7 + props16 regime to test whether that higher-recall branch is pinned to the exact top2/top1 move-menu cliff like beam6 or remains stable one step wider at beam7.
autoresearch/snapshots/20260417T054701Z_hybrid_lookahead_segmental_drop1_boardcands2_ratio95_props16_top1_detect10_minsep2_thresh3_total150_permove125_m9p8957061767578125_r0_beam7_v307.py	0.254438	0.889670	0.859107	0.500000	0.016818	discard	Hybrid decoder keeps the baseline lookahead path unless a conservative board-only segmental pass wins the current score-gain gates, while following up v221-v306 after beam_size=6 + props16 rescued the old degraded branch into the best current lower-false-change tradeoff, beam7 + props16 + top2 matched the higher-recall regime, beam7 shared the same sharp per-added-move cliff seen on beam8, and raising top-move breadth from 2 to 3 on beam7 snapped back toward the older v120-style tradeoff, and lowering only top-move breadth from 2 to 1 on the active beam7 + props16 regime to test whether beam7 shares the same top1 equals top2 behavior seen on beam6 and beam8 or whether its move-menu cliff is asymmetric around top2.
autoresearch/snapshots/20260417T054819Z_hybrid_lookahead_segmental_drop1_boardcands2_ratio95_props16_top4_detect10_minsep2_thresh3_total150_permove125_m9p8957061767578125_r0_beam7_v308.py	0.254438	0.884089	0.855756	0.500000	0.016818	discard	Hybrid decoder keeps the baseline lookahead path unless a conservative board-only segmental pass wins the current score-gain gates, while following up v221-v307 after beam_size=6 + props16 rescued the old degraded branch into the best current lower-false-change tradeoff, beam7 + props16 + top1 and top2 matched the same higher-recall regime, beam7 shared the same sharp per-added-move cliff seen on beam8, and raising top-move breadth from 2 to 3 on beam7 snapped back toward the older v120-style tradeoff, and raising only top-move breadth from 2 to 4 on the active beam7 + props16 regime to test whether that transition begins exactly at top3 or whether beam7 stays on the same snapped-back family once move breadth exceeds two candidates.
