snapshot	board_exact	non_empty_accuracy	macro_f1	move_recall	false_change_rate	status	description
autoresearch/snapshots/20260420T055748Z_hybrid_p8_m8_w3_v1306.py	0.071006	0.799339	0.749250	0.375000	0.020699	discard	Restore the compact props8 + minsep8 hybrid shelf anchored at lwindow3, beam3, top4, boardcands2, secsep1, radius0, drop1, props8, total150, and lmargin9.935836791992188. The latest executed bracket is harmful at 142.3393809000651089036182384006679058074951171874999999999999999999999999999999999999999999999999999999999999999999999999999999999999923523771204365404540844001449218576012306627500819940542436222216432377429344194480087486052578018802407715815840968988190443013648645642114561527269218272181122030726314859511774467435670056668884562152955848256534639173498391073735547251999378204345703125 and exact-flat at 142.3393809000651089036182384006679058074951171875000000000000000000000000000000000000000000000000000000000000000000000000000000000001569361052523018242718552235295960484497233496022318464508326647025873998798540760849080057303145614154615479704649965759863709912009821894913169042188702683720518954214320336152390933446449481342517865606930117393113296563739167410744812513322532176971435546875. This run prepares their exact midpoint, 142.33938090006510890361823840066790580749511718750000000000000000000000000000000000000000000000000000000000000000000000000000000000007464424118636918236296981183725895302547700617615692025253814346211531881139424776645837716778618164785115977602454673740270764628292337685138652847289604779508204924703175978320827004410597690057012138799429828248239678686187792422401798826609551906585693359375, with a short experiment name to avoid filename-too-long failures.
autoresearch/snapshots/20260420T055913Z_hybrid_p8_m8_w3_v1307.py	0.071006	0.799339	0.749250	0.375000	0.020699	discard	Restore the compact props8 + minsep8 hybrid shelf anchored at lwindow3, beam3, top4, boardcands2, secsep1, radius0, drop1, props8, total150, and lmargin9.935836791992188. The latest executed bracket is harmful at 142.3393809000651089036182384006679058074951171874999999999999999999999999999999999999999999999999999999999999999999999999999999999999923523771204365404540844001449218576012306627500819940542436222216432377429344194480087486052578018802407715815840968988190443013648645642114561527269218272181122030726314859511774467435670056668884562152955848256534639173498391073735547251999378204345703125 and exact-flat at 142.33938090006510890361823840066790580749511718750000000000000000000000000000000000000000000000000000000000000000000000000000000000007464424118636918236296981183725895302547700617615692025253814346211531881139424776645837716778618164785115977602454673740270764628292337685138652847289604779508204924703175978320827004410597690057012138799429828248239678686187792422401798826609551906585693359375. This run prepares their exact midpoint, 142.339380900065108903618238400667905807495117187500000000000000000000000000000000000000000000000000000000000000000000000000000000000033498309153402861408527105991090405313353834463119457153390882841879278277164333607233562886521991764045965678804321818110875973823893970531421340599908937506597126159831622867192858393836491283729288801644941554067930352105858515798786356733016669750213623046875, with a short experiment name to avoid filename-too-long failures.
autoresearch/snapshots/20260420T060032Z_hybrid_p8_m8_w3_v1308.py	0.071006	0.799339	0.749250	0.375000	0.020699	discard	Restore the compact props8 + minsep8 hybrid shelf anchored at lwindow3, beam3, top4, boardcands2, secsep1, radius0, drop1, props8, total150, and lmargin9.935836791992188. The latest executed bracket is harmful at 142.3393809000651089036182384006679058074951171874999999999999999999999999999999999999999999999999999999999999999999999999999999999999923523771204365404540844001449218576012306627500819940542436222216432377429344194480087486052578018802407715815840968988190443013648645642114561527269218272181122030726314859511774467435670056668884562152955848256534639173498391073735547251999378204345703125 and exact-flat at 142.33938090006510890361823840066790580749511718750000000000000000000000000000000000000000000000000000000000000000000000000000000000007464424118636918236296981183725895302547700617615692025253814346211531881139424776645837716778618164785115977602454673740270764628292337685138652847289604779508204924703175978320827004410597690057012138799429828248239678686187792422401798826609551906585693359375. This run prepares their exact midpoint, 142.339380900065108903618238400667905807495117187500000000000000000000000000000000000000000000000000000000000000000000000000000000000033498309153402861408527105991090405313353834463119457153390882841879278277164333607233562886521991764045965678804321818110875973823893970531421340599908937506597126159831622867192858393836491283729288801644941554067930352105858515798786356733016669750213623046875, with a short experiment name to avoid filename-too-long failures.
autoresearch/snapshots/20260420T060152Z_hybrid_p8_m8_w3_v1309.py	0.071006	0.799339	0.749250	0.375000	0.020699	discard	Restore the compact props8 + minsep8 hybrid shelf anchored at lwindow3, beam3, top4, boardcands2, secsep1, radius0, drop1, props8, total150, and lmargin9.935836791992188. The latest executed bracket is harmful at 142.3393809000651089036182384006679058074951171874999999999999999999999999999999999999999999999999999999999999999999999999999999999999923523771204365404540844001449218576012306627500819940542436222216432377429344194480087486052578018802407715815840968988190443013648645642114561527269218272181122030726314859511774467435670056668884562152955848256534639173498391073735547251999378204345703125 and exact-flat at 142.339380900065108903618238400667905807495117187500000000000000000000000000000000000000000000000000000000000000000000000000000000000033498309153402861408527105991090405313353834463119457153390882841879278277164333607233562886521991764045965678804321818110875973823893970531421340599908937506597126159831622867192858393836491283729288801644941554067930352105858515798786356733016669750213623046875. This run prepares their exact midpoint, 142.3393809000651089036182384006679058074951171875000000000000000000000000000000000000000000000000000000000000000000000000000000000000129253431369197009313057530680061314572922486066007256038172525317612580100493765276211557458898968221433686301942093584649601375943792673714387466634153823623546646162315544091851525687017484753088725084702631898606971347278488115861705409664772450923919677734375, with a short experiment name to avoid filename-too-long failures.
autoresearch/snapshots/20260420T060310Z_hybrid_p8_m8_w3_v1310.py	0.071006	0.799339	0.749250	0.375000	0.020699	discard	Restore the compact props8 + minsep8 hybrid shelf anchored at lwindow3, beam3, top4, boardcands2, secsep1, radius0, drop1, props8, total150, and lmargin9.935836791992188. The latest executed bracket is harmful at 142.3393809000651089036182384006679058074951171874999999999999999999999999999999999999999999999999999999999999999999999999999999999999923523771204365404540844001449218576012306627500819940542436222216432377429344194480087486052578018802407715815840968988190443013648645642114561527269218272181122030726314859511774467435670056668884562152955848256534639173498391073735547251999378204345703125 and exact-flat at 142.3393809000651089036182384006679058074951171875000000000000000000000000000000000000000000000000000000000000000000000000000000000000129253431369197009313057530680061314572922486066007256038172525317612580100493765276211557458898968221433686301942093584649601375943792673714387466634153823623546646162315544091851525687017484753088725084702631898606971347278488115861705409664772450923919677734375. This run prepares their exact midpoint, 142.33938090006510890361823840066790580749511718750000000000000000000000000000000000000000000000000000000000000000000000000000000000000263886012867812069269507660646399452926145567834135982903043737670224787649189798781495217557384935119207010588915312864200221947962191579144744969516860479023343384443152018018129965613437707109866436188292400775708052603884395947986263308320753276348114013671875, with a short experiment name to avoid filename-too-long failures.
autoresearch/snapshots/20260420T060427Z_hybrid_p8_m8_w3_v1311.py	0.071006	0.799339	0.749250	0.375000	0.020699	discard	Restore the compact props8 + minsep8 hybrid shelf anchored at lwindow3, beam3, top4, boardcands2, secsep1, radius0, drop1, props8, total150, and lmargin9.935836791992188. The latest executed bracket is harmful at 142.3393809000651089036182384006679058074951171874999999999999999999999999999999999999999999999999999999999999999999999999999999999999923523771204365404540844001449218576012306627500819940542436222216432377429344194480087486052578018802407715815840968988190443013648645642114561527269218272181122030726314859511774467435670056668884562152955848256534639173498391073735547251999378204345703125 and exact-flat at 142.3393809000651089036182384006679058074951171875000000000000000000000000000000000000000000000000000000000000000000000000000000000000129253431369197009313057530680061314572922486066007256038172525317612580100493765276211557458898968221433686301942093584649601375943792673714387466634153823623546646162315544091851525687017484753088725084702631898606971347278488115861705409664772450923919677734375. This run prepares their exact midpoint, 142.33938090006510890361823840066790580749511718750000000000000000000000000000000000000000000000000000000000000000000000000000000000000263886012867812069269507660646399452926145567834135982903043737670224787649189798781495217557384935119207010588915312864200221947962191579144744969516860479023343384443152018018129965613437707109866436188292400775708052603884395947986263308320753276348114013671875, with a short experiment name to avoid filename-too-long failures.
autoresearch/snapshots/20260420T060942Z_hybrid_p8_m8_w3_v1312.py	0.071006	0.799339	0.749250	0.375000	0.020699	discard	Restore the compact props8 + minsep8 hybrid shelf anchored at lwindow3, beam3, top4, boardcands2, secsep1, radius0, drop1, props8, total150, and lmargin9.935836791992188. The latest executed bracket is harmful at 142.3393809000651089036182384006679058074951171874999999999999999999999999999999999999999999999999999999999999999999999999999999999999923523771204365404540844001449218576012306627500819940542436222216432377429344194480087486052578018802407715815840968988190443013648645642114561527269218272181122030726314859511774467435670056668884562152955848256534639173498391073735547251999378204345703125 and exact-flat at 142.3393809000651089036182384006679058074951171875000000000000000000000000000000000000000000000000000000000000000000000000000000000000129253431369197009313057530680061314572922486066007256038172525317612580100493765276211557458898968221433686301942093584649601375943792673714387466634153823623546646162315544091851525687017484753088725084702631898606971347278488115861705409664772450923919677734375. This run prepares their exact midpoint, 142.33938090006510890361823840066790580749511718750000000000000000000000000000000000000000000000000000000000000000000000000000000000000263886012867812069269507660646399452926145567834135982903043737670224787649189798781495217557384935119207010588915312864200221947962191579144744969516860479023343384443152018018129965613437707109866436188292400775708052603884395947986263308320753276348114013671875, with a short experiment name to avoid filename-too-long failures.
autoresearch/snapshots/20260420T061053Z_hybrid_p8_m8_w3_v1313.py	0.071006	0.789778	0.739821	0.375000	0.024580	discard	Restore the compact props8 + minsep8 hybrid shelf anchored at lwindow3, beam3, top4, boardcands2, secsep1, radius0, drop1, props8, total150, and lmargin9.935836791992188. The latest executed bracket is harmful at 142.3393809000651089036182384006679058074951171874999999999999999999999999999999999999999999999999999999999999999999999999999999999999923523771204365404540844001449218576012306627500819940542436222216432377429344194480087486052578018802407715815840968988190443013648645642114561527269218272181122030726314859511774467435670056668884562152955848256534639173498391073735547251999378204345703125 and exact-flat at 142.33938090006510890361823840066790580749511718750000000000000000000000000000000000000000000000000000000000000000000000000000000000000263886012867812069269507660646399452926145567834135982903043737670224787649189798781495217557384935119207010588915312864200221947962191579144744969516860479023343384443152018018129965613437707109866436188292400775708052603884395947986263308320753276348114013671875. This run prepares their exact midpoint, 142.339380900065108903618238400667905807495117187499999999999999999999999999999999999999999999999999999999999999999999999999999999999997495618624557330573389738375692926065246059214211676941637029799172742809713158717911850390415825615716420843736625013730523260422243240001451801211045216004172818458531503065679373199850691368993560288589254416705272221694341533426708679141572676599025726318359375, with a short experiment name to avoid filename-too-long failures.
autoresearch/snapshots/20260420T061157Z_hybrid_p8_m8_w3_v1314.py	0.071006	0.799339	0.749250	0.375000	0.020699	discard	Restore the compact props8 + minsep8 hybrid shelf anchored at lwindow3, beam3, top4, boardcands2, secsep1, radius0, drop1, props8, total150, and lmargin9.935836791992188. The latest executed bracket is harmful at 142.339380900065108903618238400667905807495117187499999999999999999999999999999999999999999999999999999999999999999999999999999999999997495618624557330573389738375692926065246059214211676941637029799172742809713158717911850390415825615716420843736625013730523260422243240001451801211045216004172818458531503065679373199850691368993560288589254416705272221694341533426708679141572676599025726318359375 and exact-flat at 142.33938090006510890361823840066790580749511718750000000000000000000000000000000000000000000000000000000000000000000000000000000000000263886012867812069269507660646399452926145567834135982903043737670224787649189798781495217557384935119207010588915312864200221947962191579144744969516860479023343384443152018018129965613437707109866436188292400775708052603884395947986263308320753276348114013671875. This run prepares their exact midpoint, 142.3393809000651089036182384006679058074951171875000000000000000000000000000000000000000000000000000000000000000000000000000000000000000672393766177256330424074910784602972537574462765183853337335879374953431025283528634012829948374834542454748128890711862627399509325778964496254531069103972031261514815116229303364279925342200461123252360892122311763738665927464532856561123901046812534332275390625, with a short experiment name to avoid filename-too-long failures.
autoresearch/snapshots/20260420T061313Z_hybrid_p8_m8_w3_v1315.py	0.071006	0.789778	0.739821	0.375000	0.024580	discard	Restore the compact props8 + minsep8 hybrid shelf anchored at lwindow3, beam3, top4, boardcands2, secsep1, radius0, drop1, props8, total150, and lmargin9.935836791992188. The latest executed bracket is harmful at 142.339380900065108903618238400667905807495117187499999999999999999999999999999999999999999999999999999999999999999999999999999999999997495618624557330573389738375692926065246059214211676941637029799172742809713158717911850390415825615716420843736625013730523260422243240001451801211045216004172818458531503065679373199850691368993560288589254416705272221694341533426708679141572676599025726318359375 and exact-flat at 142.3393809000651089036182384006679058074951171875000000000000000000000000000000000000000000000000000000000000000000000000000000000000000672393766177256330424074910784602972537574462765183853337335879374953431025283528634012829948374834542454748128890711862627399509325778964496254531069103972031261514815116229303364279925342200461123252360892122311763738665927464532856561123901046812534332275390625. This run prepares their exact midpoint, 142.33938090006510890361823840066790580749511718749999999999999999999999999999999999999999999999999999999999999999999999999999999999999878142900058752810321607293338569318124990833024409766348538169355511907640784353538762583670533154958533315927475704245839300018658790894895071333207606320068797230500650734430485481392161279451983630691267181446822429778046713993999716762698139064013957977294921875, with a short experiment name to avoid filename-too-long failures.
autoresearch/snapshots/20260420T061424Z_hybrid_p8_m8_w3_v1316.py	0.071006	0.789778	0.739821	0.375000	0.024580	discard	Restore the compact props8 + minsep8 hybrid shelf anchored at lwindow3, beam3, top4, boardcands2, secsep1, radius0, drop1, props8, total150, and lmargin9.935836791992188. The latest executed bracket is harmful at 142.33938090006510890361823840066790580749511718749999999999999999999999999999999999999999999999999999999999999999999999999999999999999878142900058752810321607293338569318124990833024409766348538169355511907640784353538762583670533154958533315927475704245839300018658790894895071333207606320068797230500650734430485481392161279451983630691267181446822429778046713993999716762698139064013957977294921875 and exact-flat at 142.3393809000651089036182384006679058074951171875000000000000000000000000000000000000000000000000000000000000000000000000000000000000000672393766177256330424074910784602972537574462765183853337335879374953431025283528634012829948374834542454748128890711862627399509325778964496254531069103972031261514815116229303364279925342200461123252360892122311763738665927464532856561123901046812534332275390625. This run prepares their exact midpoint, 142.339380900065108903618238400667905807495117187499999999999999999999999999999999999999999999999999999999999999999999999999999999999999424334188602626868129240212232076739251832888260308024409557640746307209755185944125513559850084516519789317043823056822327870068760243422700169392591486798945549228244009483617595620957073507282974316074380513349700335823529943196641411869685747660696506500244140625, with a short experiment name to avoid filename-too-long failures.
autoresearch/snapshots/20260420T061532Z_hybrid_p8_m8_w3_v1317.py	0.071006	0.789778	0.739821	0.375000	0.024580	discard	Restore the compact props8 + minsep8 hybrid shelf anchored at lwindow3, beam3, top4, boardcands2, secsep1, radius0, drop1, props8, total150, and lmargin9.935836791992188. The latest executed bracket is harmful at 142.339380900065108903618238400667905807495117187499999999999999999999999999999999999999999999999999999999999999999999999999999999999999424334188602626868129240212232076739251832888260308024409557640746307209755185944125513559850084516519789317043823056822327870068760243422700169392591486798945549228244009483617595620957073507282974316074380513349700335823529943196641411869685747660696506500244140625 and exact-flat at 142.3393809000651089036182384006679058074951171875000000000000000000000000000000000000000000000000000000000000000000000000000000000000000672393766177256330424074910784602972537574462765183853337335879374953431025283528634012829948374834542454748128890711862627399509325778964496254531069103972031261514815116229303364279925342200461123252360892122311763738665927464532856561123901046812534332275390625. This run prepares their exact midpoint, 142.3393809000651089036182384006679058074951171874999999999999999999999999999999999999999999999999999999999999999999999999999999999999997457867826101762505858238516552685182527951672684132048716456143419012764288571484944574214224609999870173959283560640042953050098464106595748974228491985980743376898627605532739660244748038636645433206552348627904383548450613448249635339910379261709749698638916015625, with a short experiment name to avoid filename-too-long failures.
autoresearch/snapshots/20260420T061637Z_hybrid_p8_m8_w3_v1317.py	0.071006	0.789778	0.739821	0.375000	0.024580	discard	Restore the compact props8 + minsep8 hybrid shelf anchored at lwindow3, beam3, top4, boardcands2, secsep1, radius0, drop1, props8, total150, and lmargin9.935836791992188. The latest executed bracket is harmful at 142.339380900065108903618238400667905807495117187499999999999999999999999999999999999999999999999999999999999999999999999999999999999999424334188602626868129240212232076739251832888260308024409557640746307209755185944125513559850084516519789317043823056822327870068760243422700169392591486798945549228244009483617595620957073507282974316074380513349700335823529943196641411869685747660696506500244140625 and exact-flat at 142.3393809000651089036182384006679058074951171875000000000000000000000000000000000000000000000000000000000000000000000000000000000000000672393766177256330424074910784602972537574462765183853337335879374953431025283528634012829948374834542454748128890711862627399509325778964496254531069103972031261514815116229303364279925342200461123252360892122311763738665927464532856561123901046812534332275390625. This run prepares their exact midpoint, 142.3393809000651089036182384006679058074951171874999999999999999999999999999999999999999999999999999999999999999999999999999999999999997457867826101762505858238516552685182527951672684132048716456143419012764288571484944574214224609999870173959283560640042953050098464106595748974228491985980743376898627605532739660244748038636645433206552348627904383548450613448249635339910379261709749698638916015625, with a short experiment name to avoid filename-too-long failures.
