snapshot	board_exact	non_empty_accuracy	macro_f1	move_recall	false_change_rate	status	description
autoresearch/snapshots/20260416T210330Z_lookahead_w2_m10_baseline.py	0.216568	0.863986	0.816552	0.296875	0.018111	keep	Current rectified realplusmanual tracker baseline.
autoresearch/snapshots/20260416T210342Z_lookahead_w2_m10_baseline.py	0.216568	0.863986	0.816552	0.296875	0.018111	keep	Current rectified realplusmanual tracker baseline.
autoresearch/snapshots/20260416T210730Z_lookahead_w2_m10_baseline.py	0.216568	0.863986	0.816552	0.296875	0.018111	keep	Current rectified realplusmanual tracker baseline.
autoresearch/snapshots/20260416T210957Z_lookahead_w2_m10_baseline.py	0.216568	0.863986	0.816552	0.296875	0.018111	keep	Current rectified realplusmanual tracker baseline.
autoresearch/snapshots/20260416T211809Z_lookahead_w3_m8_temporal_tolerance_v1.py	0.091124	0.839543	0.790079	0.281250	0.043984	discard	Lookahead decoder with one extra future frame and a slightly lower move margin to better tolerate transition-frame misses in temporal move-execution ambiguity.
autoresearch/snapshots/20260416T211852Z_lookahead_w3_m10_temporal_tolerance_v2.py	0.093491	0.844142	0.792162	0.296875	0.032342	discard	Lookahead decoder with one extra future frame but baseline move margin, isolating whether more settled context alone helps temporal move-execution ambiguity.
autoresearch/snapshots/20260416T211928Z_lookahead_w2_m9_temporal_tolerance_v3.py	0.101775	0.840008	0.787779	0.343750	0.020699	discard	Lookahead decoder with baseline window but a slightly lower move margin, testing whether a small increase in move sensitivity helps temporal move-execution ambiguity.
autoresearch/snapshots/20260416T212011Z_segmental_sparse_events_baseline_v1.py	0.104142	0.832515	0.797925	0.343750	0.023286	discard	Segmental decoder with the existing conservative sparse-event settings, testing whether piecewise-constant board segments reduce temporal move-execution ambiguity.
autoresearch/snapshots/20260416T212102Z_lookahead_w1_m10_temporal_latency_v4.py	0.099408	0.842075	0.777293	0.093750	0.005175	discard	Lookahead decoder with a one-frame window and baseline margin, testing whether less future smoothing reduces temporal move-execution lag.
autoresearch/snapshots/20260416T212143Z_lookahead_w2_m11_temporal_conservative_v5.py	0.205917	0.856752	0.802252	0.250000	0.014230	discard	Lookahead decoder with the baseline window but a slightly higher move margin, testing whether more conservative move commits reduce temporal ambiguity desyncs.
autoresearch/snapshots/20260416T212228Z_segmental_sparse_events_drop1_v2.py	0.099408	0.832980	0.799181	0.281250	0.021992	discard	Segmental decoder with conservative sparse-event settings plus one worst-frame drop per segment, testing whether suppressing transition frames helps temporal move-execution ambiguity.
autoresearch/snapshots/20260416T212300Z_lookahead_w2_m10p5_temporal_conservative_v6.py	0.211834	0.863728	0.815058	0.281250	0.020699	discard	Lookahead decoder with the baseline window and a slightly higher move margin, testing whether a milder conservative commit threshold helps temporal ambiguity without the larger m11 regression.
autoresearch/snapshots/20260416T212329Z_lookahead_w2_m10p25_temporal_conservative_v7.py	0.211834	0.863780	0.815340	0.281250	0.019405	discard	Lookahead decoder with the baseline window and a very slightly higher move margin, testing whether a smaller conservative shift than m10.5 can reduce temporal ambiguity without losing baseline fit.
autoresearch/snapshots/20260416T212409Z_lookahead_w2_m10p125_temporal_conservative_v8.py	0.213018	0.863831	0.815471	0.281250	0.018111	discard	Lookahead decoder with the baseline window and an even smaller move-margin increase, testing whether a near-baseline conservative shift can trim temporal ambiguity without the m10.25 regression.
autoresearch/snapshots/20260416T212447Z_segmental_sparse_events_sep2_v3.py	0.071006	0.834686	0.804387	0.406250	0.024580	discard	Segmental decoder with conservative sparse-event settings but denser event proposals, testing whether allowing nearby candidate move frames helps temporal move-execution ambiguity.
autoresearch/snapshots/20260416T212529Z_lookahead_w2_m10p0625_temporal_conservative_v9.py	0.213018	0.863831	0.816317	0.281250	0.018111	discard	Lookahead decoder with the baseline window and an ultra-small move-margin increase, testing whether the least-bad conservative direction helps only at a near-baseline threshold.
autoresearch/snapshots/20260416T212846Z_segmental_sparse_events_boardcands1_v5.py	0.169231	0.823575	0.818186	0.453125	0.041397	discard	Segmental decoder with conservative sparse-event settings plus one board-evidence candidate, testing whether missed transition moves can be recovered without denser event proposal search.
autoresearch/snapshots/20260416T212938Z_segmental_sparse_events_boardcands1_m9_v6.py	0.169231	0.823575	0.818186	0.453125	0.041397	discard	Segmental decoder with one board-evidence candidate and a slightly higher move margin, testing whether the recall gain from board-backed transition recovery can be kept while reducing temporal over-commits.
autoresearch/snapshots/20260416T213027Z_segmental_sparse_events_boardcands1_drop1_v7.py	0.169231	0.824505	0.819060	0.453125	0.037516	discard	Segmental decoder with one board-evidence candidate plus one worst-frame drop per segment, testing whether board-backed transition recovery can keep recall while suppressing transition-frame over-commits.
autoresearch/snapshots/20260416T213136Z_segmental_sparse_events_boardcands1_sep5_v8.py	0.169231	0.825849	0.816023	0.437500	0.041397	discard	Segmental decoder with one board-evidence candidate and stricter temporal proposal spacing, testing whether board-backed transition recovery can help temporal ambiguity without nearby over-commits.
autoresearch/snapshots/20260416T213243Z_segmental_sparse_events_boardcands1_thresh3_v9.py	0.169231	0.823575	0.818186	0.453125	0.041397	discard	Segmental decoder with one board-evidence candidate and a higher board-change proposal threshold, testing whether board-backed transition recovery can keep temporal recall while pruning spurious event commits.
autoresearch/snapshots/20260416T213416Z_segmental_sparse_events_boardcands1_m10_v10.py	0.169231	0.829259	0.830260	0.453125	0.034929	discard	Segmental decoder with one board-evidence candidate and a stronger move margin, testing whether board-backed transition recovery can reduce temporal misses without the boardcands1 over-commit rate.
autoresearch/snapshots/20260416T213507Z_segmental_sparse_events_boardcands1_m10_drop1_v11.py	0.169231	0.829259	0.830260	0.453125	0.034929	discard	Segmental decoder with one board-evidence candidate, stronger move margin, and one worst-frame drop, testing whether board-backed transition recovery can keep temporal recall while further suppressing over-commits.
autoresearch/snapshots/20260416T213609Z_segmental_sparse_events_boardcands1_m12_v12.py	0.169231	0.831120	0.830069	0.437500	0.037516	discard	Segmental decoder with one board-evidence candidate and an even stronger move margin, testing whether board-backed transition recovery can keep temporal recall while suppressing more over-commits.
autoresearch/snapshots/20260416T213725Z_segmental_sparse_events_boardcands2_m10_v13.py	0.113609	0.816237	0.813997	0.453125	0.040103	discard	Segmental decoder with two board-evidence candidates and a stronger move margin, testing whether broader board-backed transition recovery can fix temporal ambiguity misses without reopening excessive over-commit search.
autoresearch/snapshots/20260416T213830Z_segmental_sparse_events_boardcands1_m10_beam4_v14.py	0.149112	0.821405	0.816497	0.468750	0.036223	discard	Segmental decoder with one board-evidence candidate, stronger move margin, and a smaller beam, testing whether board-backed transition recovery can reduce temporal misses without letting wrong trajectories persist.
autoresearch/snapshots/20260416T214536Z_segmental_sparse_events_boardcands1_m10_r2_v16.py	0.169231	0.829259	0.830260	0.453125	0.034929	discard	Segmental decoder with one board-evidence candidate, stronger move margin, and a wider event window, testing whether more transition-frame context helps temporal ambiguity without broadening proposal search.
autoresearch/snapshots/20260416T214633Z_segmental_sparse_events_boardcands1_m10_secondarysep2_v17.py	0.169231	0.869257	0.845637	0.484375	0.033635	discard	Segmental decoder with one board-evidence candidate, stronger move margin, and limited nearby secondary proposals, testing whether temporal ambiguity needs close alternate event frames without opening the full sep2 search.
autoresearch/snapshots/20260416T214724Z_segmental_sparse_events_boardcands1_m10_secondarysep2_drop1_v18.py	0.166864	0.853238	0.837761	0.437500	0.031048	discard	Segmental decoder with one board-evidence candidate, stronger move margin, limited nearby secondary proposals, and one worst-frame drop per segment to test whether temporal ambiguity improves when transition frames are downweighted.
autoresearch/snapshots/20260416T214819Z_segmental_sparse_events_boardcands1_m10_secondarysep2_ratio95_v19.py	0.169231	0.829259	0.830260	0.453125	0.033635	discard	Segmental decoder with one board-evidence candidate, stronger move margin, and stricter nearby secondary proposals, testing whether temporal ambiguity benefits from close alternate event frames only when they are nearly as strong.
autoresearch/snapshots/20260416T214912Z_segmental_sparse_events_boardcands1_m12_secondarysep2_v20.py	0.166864	0.851842	0.837229	0.453125	0.031048	discard	Segmental decoder with one board-evidence candidate, limited nearby secondary proposals, and a stronger move margin to test whether the v17 temporal-recall gain can be kept while trimming over-commits.
autoresearch/snapshots/20260416T215012Z_segmental_sparse_events_boardcands1_m12_secondarysep2_v20.py	0.166864	0.851842	0.837229	0.453125	0.031048	discard	Segmental decoder with one board-evidence candidate, limited nearby secondary proposals, and a stronger move margin to test whether the v17 temporal-recall gain can be kept while trimming over-commits.
autoresearch/snapshots/20260416T215103Z_segmental_sparse_events_boardcands1_m10_secondarysep2_r2_v21.py	0.169231	0.869257	0.845637	0.484375	0.033635	discard	Segmental decoder with one board-evidence candidate, limited nearby secondary proposals, and a wider event window to test whether extra transition-frame context improves the strongest temporal-ambiguity branch.
autoresearch/snapshots/20260416T215143Z_segmental_sparse_events_boardcands1_m10_secondarysep2_detect15_v22.py	0.169231	0.869257	0.845637	0.484375	0.033635	discard	Segmental decoder with one board-evidence candidate, limited nearby secondary proposals, and a slightly higher detect threshold to test whether the strongest temporal-ambiguity branch benefits from stricter event evidence.
autoresearch/snapshots/20260416T215233Z_segmental_sparse_events_boardcands1_m10_secondarysep2_ratio70_v23.py	0.113609	0.863056	0.831964	0.500000	0.040103	discard	Segmental decoder with one board-evidence candidate, limited nearby secondary proposals, and a looser secondary peak ratio to test whether slightly more close alternate event frames help temporal ambiguity.
autoresearch/snapshots/20260416T215329Z_segmental_sparse_events_boardcands1_m11_secondarysep2_v24.py	0.166864	0.869154	0.845479	0.484375	0.033635	discard	Segmental decoder with one board-evidence candidate, limited nearby secondary proposals, and a slightly stronger move margin to test whether the v17 recall gain can be kept with fewer over-commits.
autoresearch/snapshots/20260416T215452Z_segmental_sparse_events_boardcands1_m10_secondarysep2_sep5_v25.py	0.169231	0.870498	0.846340	0.453125	0.033635	discard	Segmental decoder with one board-evidence candidate, limited nearby secondary proposals, and wider primary event spacing to test whether the strongest temporal-ambiguity branch can cut spurious commits.
autoresearch/snapshots/20260416T215742Z_segmental_sparse_events_boardcands1_m10_secondarysep2_top8_v26.py	0.149112	0.868431	0.839651	0.500000	0.034929	discard	Segmental decoder with one board-evidence candidate, limited nearby secondary proposals, and fewer move candidates to test whether the strongest temporal-ambiguity branch over-commits due to move-search breadth.
autoresearch/snapshots/20260416T220240Z_hybrid_lookahead_segmental_scoregain_v1.py	0.230769	0.880368	0.850352	0.468750	0.020699	keep	Hybrid decoder keeps the baseline lookahead path unless a conservative board-only segmental pass earns a large sequence log-probability gain per extra committed move, targeting long temporal desync clips without inheriting segmental over-commits everywhere.
autoresearch/snapshots/20260416T220358Z_hybrid_lookahead_segmental_scoregain_total150_v2.py	0.230769	0.880368	0.850352	0.468750	0.020699	keep	Hybrid decoder keeps the baseline lookahead path unless a conservative board-only segmental pass earns a slightly lower total sequence log-probability gain while keeping the per-added-move gate strict, targeting shorter temporal desync recoveries without reopening broad over-commits.
autoresearch/snapshots/20260416T220441Z_hybrid_lookahead_segmental_scoregain_permove150_v3.py	0.230769	0.880368	0.850352	0.468750	0.020699	keep	Hybrid decoder keeps the baseline lookahead path unless a conservative board-only segmental pass clears the lower total-gain gate and a slightly lower per-added-move gate, targeting shorter temporal desync recoveries that were previously blocked by the stricter move-normalized threshold.
autoresearch/snapshots/20260416T220735Z_hybrid_lookahead_segmental_scoregain_permove150_v3.py	0.230769	0.880368	0.850352	0.468750	0.020699	keep	Hybrid decoder keeps the baseline lookahead path unless a conservative board-only segmental pass clears the lower total-gain gate and a slightly lower per-added-move gate, targeting shorter temporal desync recoveries that were previously blocked by the stricter move-normalized threshold.
autoresearch/snapshots/20260416T225626Z_hybrid_lookahead_segmental_state1_v4.py	0.230769	0.880368	0.850346	0.468750	0.021992	keep	Hybrid decoder keeps the baseline lookahead path unless a conservative board-only segmental pass wins the current score-gain gates, while adding one state-aware proposal refinement pass to test whether missed transition events can be recovered without broadening the default search.
autoresearch/snapshots/20260416T232517Z_hybrid_lookahead_segmental_drop1_v5.py	0.230769	0.866363	0.845882	0.437500	0.020699	keep	Hybrid decoder keeps the baseline lookahead path unless a conservative board-only segmental pass wins the current score-gain gates, while dropping one worst board frame per segment to test whether transition-frame noise can be reduced without giving up the existing hybrid gains.
autoresearch/snapshots/20260416T232625Z_hybrid_lookahead_segmental_drop1_boardcands2_v6.py	0.237870	0.818149	0.813964	0.453125	0.024580	keep	Hybrid decoder keeps the baseline lookahead path unless a conservative board-only segmental pass wins the current score-gain gates, while widening the dropped-frame fallback to two board candidates to test whether a broader board-backed repair can recover temporal ambiguity clips without disturbing the cheap hybrid guardrails.
autoresearch/snapshots/20260416T232721Z_hybrid_lookahead_segmental_drop1_boardcands2_permove200_v7.py	0.237870	0.818149	0.813964	0.453125	0.024580	discard	Hybrid decoder keeps the baseline lookahead path unless a conservative board-only segmental pass from the dropped-frame two-board-candidate fallback clears a stricter per-added-move gain gate, testing whether the v6 board_exact gain can be kept while pruning lower-quality temporal repairs.
autoresearch/snapshots/20260416T232812Z_hybrid_lookahead_segmental_drop1_boardcands2_total200_v8.py	0.237870	0.818149	0.813964	0.453125	0.024580	discard	Hybrid decoder keeps the baseline lookahead path unless a conservative board-only segmental pass from the dropped-frame two-board-candidate fallback clears a stricter total score-gain gate, testing whether the v6 board_exact gain can be kept while pruning shorter lower-value temporal repairs.
autoresearch/snapshots/20260416T232907Z_hybrid_lookahead_segmental_drop1_boardcands2_m11_v9.py	0.237870	0.815720	0.813532	0.437500	0.023286	discard	Hybrid decoder keeps the baseline lookahead path unless a conservative board-only segmental pass wins the current score-gain gates, while making the dropped-frame two-board-candidate fallback slightly more conservative on move commits to test whether the v6 board_exact gain can be kept with less collateral board churn.
autoresearch/snapshots/20260416T232955Z_hybrid_lookahead_segmental_drop1_boardcands2_m10p5_v10.py	0.237870	0.815720	0.813532	0.437500	0.023286	discard	Hybrid decoder keeps the baseline lookahead path unless a conservative board-only segmental pass wins the current score-gain gates, while making the dropped-frame two-board-candidate fallback only slightly more conservative on move commits to test whether the v6 board_exact gain can keep more recall while trimming some collateral board churn.
autoresearch/snapshots/20260416T233043Z_hybrid_lookahead_segmental_drop1_boardcands3_v11.py	0.237870	0.818149	0.813964	0.453125	0.024580	discard	Hybrid decoder keeps the baseline lookahead path unless a conservative board-only segmental pass wins the current score-gain gates, while widening the dropped-frame fallback to three board candidates to test whether the v6 board-backed temporal repair still has headroom before the extra search starts hurting the guarded hybrid path.
autoresearch/snapshots/20260416T233141Z_hybrid_lookahead_segmental_drop1_boardcands2_ratio95_v12.py	0.237870	0.844814	0.840366	0.468750	0.020699	discard	Hybrid decoder keeps the baseline lookahead path unless a conservative board-only segmental pass wins the current score-gain gates, while making the dropped-frame two-board-candidate fallback stricter about nearby secondary proposals to test whether the v6 board_exact gain can be kept with fewer low-value temporal repairs.
autoresearch/snapshots/20260416T233244Z_hybrid_lookahead_segmental_drop1_boardcands2_ratio100_v13.py	0.237870	0.844814	0.840366	0.468750	0.020699	discard	Hybrid decoder keeps the baseline lookahead path unless a conservative board-only segmental pass wins the current score-gain gates, while requiring nearby secondary proposals in the dropped-frame two-board-candidate fallback to be at least as strong as the kept peak to test whether the v12 gain continues when close alternate events are pruned even harder.
autoresearch/snapshots/20260416T233339Z_hybrid_lookahead_segmental_drop1_boardcands2_secondarysep3_v14.py	0.237870	0.844814	0.840366	0.468750	0.021992	discard	Hybrid decoder keeps the baseline lookahead path unless a conservative board-only segmental pass wins the current score-gain gates, while requiring dropped-frame two-board-candidate fallback secondary proposals to be at least three frames apart to test whether the v12/v13 quality gain came from suppressing the closest alternate event frames.
autoresearch/snapshots/20260416T233521Z_hybrid_lookahead_segmental_drop1_boardcands2_nosecondary_v15.py	0.237870	0.844814	0.840366	0.468750	0.021992	discard	Hybrid decoder keeps the baseline lookahead path unless a conservative board-only segmental pass wins the current score-gain gates, while disabling nearby secondary event proposals in the dropped-frame two-board-candidate fallback to test whether the v12/v13 quality gain persists when close alternate move-timing hypotheses are removed entirely.
autoresearch/snapshots/20260416T233645Z_hybrid_lookahead_segmental_boardcands2_ratio95_nodrop_v16.py	0.237870	0.809312	0.824707	0.468750	0.023286	discard	Hybrid decoder keeps the baseline lookahead path unless a conservative board-only segmental pass wins the current score-gain gates, while keeping the stronger two-board fallback and stricter nearby-secondary gating but removing worst-frame dropping to test whether the v6 board_exact gain can keep the v12 quality gains without discarding useful transition evidence.
autoresearch/snapshots/20260416T233803Z_hybrid_lookahead_segmental_drop1_boardcands2_ratio90_v17.py	0.237870	0.819596	0.817010	0.468750	0.023286	discard	Hybrid decoder keeps the baseline lookahead path unless a conservative board-only segmental pass wins the current score-gain gates, while using a moderately stricter nearby-secondary gate in the dropped-frame two-board-candidate fallback to test whether the v12 quality gain still holds at the lightest active pruning threshold.
autoresearch/snapshots/20260416T233916Z_hybrid_lookahead_segmental_drop1_boardcands2_ratio95_props16_v18.py	0.252071	0.884140	0.856280	0.484375	0.019405	keep	Hybrid decoder keeps the baseline lookahead path unless a conservative board-only segmental pass wins the current score-gain gates, while using the stronger nearby-secondary pruning from v12 and a smaller proposal budget to test whether the board_exact gain can be kept with fewer low-value temporal repair hypotheses.
autoresearch/snapshots/20260416T234006Z_hybrid_lookahead_segmental_drop1_boardcands2_ratio95_props12_v19.py	0.217751	0.857837	0.827389	0.453125	0.015524	discard	Hybrid decoder keeps the baseline lookahead path unless a conservative board-only segmental pass wins the current score-gain gates, while keeping the stronger nearby-secondary pruning from v18 and shrinking the proposal budget again to test whether the board_exact gain still improves when low-value temporal repair hypotheses are pruned harder.
