snapshot	board_exact	non_empty_accuracy	macro_f1	move_recall	false_change_rate	status	description
autoresearch/snapshots/20260419T235508Z_hybrid_p8_m8_w3_g142p33938090006510890361823840066790580749511718749999999999999999999641267593132846829843525226677781470392252942879611962430190519324213482832419686019420623779296875_v1064.py	0.071006	0.789778	0.739821	0.375000	0.024580	discard	Restore the compact props8 + minsep8 hybrid shelf anchored at lwindow3, beam3, top4, boardcands2, secsep1, radius0, drop1, props8, total150, and lmargin9.935836791992188. The latest executed bracket is harmful at 142.339380900065108903618238400667905807495117187499999999999999999992538365937163214060745324714897854584158861211895928818547962801943640442914329469203948974609375 and exact-flat at 142.3393809000651089036182384006679058074951171875000000000000000000002869859254937225361251798186577748236861976456963104300558475845406292137340642511844635009765625, so this run restores the same shelf anchor and raises only min_score_gain_per_added_move to 142.33938090006510890361823840066790580749511718749999999999999999999641267593132846829843525226677781470392252942879611962430190519324213482832419686019420623779296875 to continue binary-searching that lower edge. The experiment name remains shortened to avoid the filename-too-long failure seen with long autogenerated names.
autoresearch/snapshots/20260419T235618Z_hybrid_p8_m8_w3_g142p339380900065108903618238400667905807495117187499999999999999999998349830928411095417280216042717794763804363537246215027178876388891382021029130555689334869384765625_v1065.py	0.071006	0.789778	0.739821	0.375000	0.024580	discard	Restore the compact props8 + minsep8 hybrid shelf anchored at lwindow3, beam3, top4, boardcands2, secsep1, radius0, drop1, props8, total150, and lmargin9.935836791992188. The latest executed bracket is harmful at 142.33938090006510890361823840066790580749511718749999999999999999999641267593132846829843525226677781470392252942879611962430190519324213482832419686019420623779296875 and exact-flat at 142.3393809000651089036182384006679058074951171875000000000000000000002869859254937225361251798186577748236861976456963104300558475845406292137340642511844635009765625, so this run restores the same shelf anchor and raises only min_score_gain_per_added_move to 142.339380900065108903618238400667905807495117187499999999999999999998349830928411095417280216042717794763804363537246215027178876388891382021029130555689334869384765625 to continue binary-searching that lower edge. The experiment name remains shortened to avoid the filename-too-long failure seen with long autogenerated names.
autoresearch/snapshots/20260419T235744Z_hybrid_p8_m8_w3_g142p3393809000651089036182384006679058074951171874999999999999999999993184084269524089767026979306877847937452805914712627286173619867160056173815974034368991851806640625_v1066.py	0.071006	0.789778	0.739821	0.375000	0.024580	discard	Restore the compact props8 + minsep8 hybrid shelf anchored at lwindow3, beam3, top4, boardcands2, secsep1, radius0, drop1, props8, total150, and lmargin9.935836791992188. The latest executed bracket is harmful at 142.339380900065108903618238400667905807495117187499999999999999999998349830928411095417280216042717794763804363537246215027178876388891382021029130555689334869384765625 and exact-flat at 142.3393809000651089036182384006679058074951171875000000000000000000002869859254937225361251798186577748236861976456963104300558475845406292137340642511844635009765625, so this run restores the same shelf anchor and raises only min_score_gain_per_added_move to 142.3393809000651089036182384006679058074951171874999999999999999999993184084269524089767026979306877847937452805914712627286173619867160056173815974034368991851806640625 to continue binary-searching that lower edge. The experiment name remains shortened to avoid the filename-too-long failure seen with long autogenerated names.
autoresearch/snapshots/20260419T235901Z_hybrid_p8_m8_w3_g142p33938090006510890361823840066790580749511718749999999999999999999980269717622306575641393887467277980871573911858378657933660478562831741555783082731068134307861328125_v1067.py	0.071006	0.789778	0.739821	0.375000	0.024580	discard	Restore the compact props8 + minsep8 hybrid shelf anchored at lwindow3, beam3, top4, boardcands2, secsep1, radius0, drop1, props8, total150, and lmargin9.935836791992188. The latest executed bracket is harmful at 142.3393809000651089036182384006679058074951171874999999999999999999993184084269524089767026979306877847937452805914712627286173619867160056173815974034368991851806640625 and exact-flat at 142.3393809000651089036182384006679058074951171875000000000000000000002869859254937225361251798186577748236861976456963104300558475845406292137340642511844635009765625, so this run restores the same shelf anchor and raises only min_score_gain_per_added_move to 142.33938090006510890361823840066790580749511718749999999999999999999980269717622306575641393887467277980871573911858378657933660478562831741555783082731068134307861328125 to continue binary-searching that lower edge. The experiment name remains shortened to avoid the filename-too-long failure seen with long autogenerated names.
autoresearch/snapshots/20260420T000015Z_hybrid_p8_m8_w3_g142p339380900065108903618238400667905807495117187500000000000000000000044841550858394146269559346665277316200968382140048504696226185084473314645947539247572422027587890625_v1068.py	0.071006	0.799339	0.749250	0.375000	0.020699	discard	Restore the compact props8 + minsep8 hybrid shelf anchored at lwindow3, beam3, top4, boardcands2, secsep1, radius0, drop1, props8, total150, and lmargin9.935836791992188. The latest executed bracket is harmful at 142.33938090006510890361823840066790580749511718749999999999999999999980269717622306575641393887467277980871573911858378657933660478562831741555783082731068134307861328125 and exact-flat at 142.3393809000651089036182384006679058074951171875000000000000000000002869859254937225361251798186577748236861976456963104300558475845406292137340642511844635009765625, so this run restores the same shelf anchor and raises only min_score_gain_per_added_move to 142.339380900065108903618238400667905807495117187500000000000000000000044841550858394146269559346665277316200968382140048504696226185084473314645947539247572422027587890625 to continue binary-searching that lower edge. The experiment name remains shortened to avoid the filename-too-long failure seen with long autogenerated names.
autoresearch/snapshots/20260420T000133Z_hybrid_p8_m8_w3_g142p3393809000651089036182384006679058074951171874999999999999999999999237693635407299513417491106690285624583537503619175420164154853563953651018891832791268825531005859375_v1069.py	0.071006	0.789778	0.739821	0.375000	0.024580	discard	Restore the compact props8 + minsep8 hybrid shelf anchored at lwindow3, beam3, top4, boardcands2, secsep1, radius0, drop1, props8, total150, and lmargin9.935836791992188. The latest executed bracket is harmful at 142.33938090006510890361823840066790580749511718749999999999999999999980269717622306575641393887467277980871573911858378657933660478562831741555783082731068134307861328125 and exact-flat at 142.339380900065108903618238400667905807495117187500000000000000000000044841550858394146269559346665277316200968382140048504696226185084473314645947539247572422027587890625, so this run restores the same shelf anchor and raises only min_score_gain_per_added_move to 142.3393809000651089036182384006679058074951171874999999999999999999999237693635407299513417491106690285624583537503619175420164154853563953651018891832791268825531005859375 to continue binary-searching that lower edge. The experiment name remains shortened to avoid the filename-too-long failure seen with long autogenerated names.
autoresearch/snapshots/20260420T000248Z_hybrid_p8_m8_w3_g142p33938090006510890361823840066790580749511718749999999999999999999998430545719956204880565422866715293932966106625098302335632083522043433987391836126334965229034423828125_v1070.py	0.071006	0.789778	0.739821	0.375000	0.024580	discard	Restore the compact props8 + minsep8 hybrid shelf anchored at lwindow3, beam3, top4, boardcands2, secsep1, radius0, drop1, props8, total150, and lmargin9.935836791992188. The latest executed bracket is harmful at 142.3393809000651089036182384006679058074951171874999999999999999999999237693635407299513417491106690285624583537503619175420164154853563953651018891832791268825531005859375 and exact-flat at 142.339380900065108903618238400667905807495117187500000000000000000000044841550858394146269559346665277316200968382140048504696226185084473314645947539247572422027587890625, so this run restores the same shelf anchor and raises only min_score_gain_per_added_move to 142.33938090006510890361823840066790580749511718749999999999999999999998430545719956204880565422866715293932966106625098302335632083522043433987391836126334965229034423828125 to continue binary-searching that lower edge. The experiment name remains shortened to avoid the filename-too-long failure seen with long autogenerated names.
autoresearch/snapshots/20260420T000422Z_hybrid_p8_m8_w3_g142p339380900065108903618238400667905807495117187500000000000000000000014573504028978097537606787666215127765314724195515764026273510152453827259932950255461037158966064453125_v1071.py	0.071006	0.799339	0.749250	0.375000	0.020699	discard	Restore the compact props8 + minsep8 hybrid shelf anchored at lwindow3, beam3, top4, boardcands2, secsep1, radius0, drop1, props8, total150, and lmargin9.935836791992188. The latest executed bracket is harmful at 142.33938090006510890361823840066790580749511718749999999999999999999998430545719956204880565422866715293932966106625098302335632083522043433987391836126334965229034423828125 and exact-flat at 142.339380900065108903618238400667905807495117187500000000000000000000044841550858394146269559346665277316200968382140048504696226185084473314645947539247572422027587890625, so this run restores the same shelf anchor and raises only min_score_gain_per_added_move to 142.339380900065108903618238400667905807495117187500000000000000000000014573504028978097537606787666215127765314724195515764026273510152453827259932950255461037158966064453125 to continue binary-searching that lower edge. The experiment name remains shortened to avoid the filename-too-long failure seen with long autogenerated names.
autoresearch/snapshots/20260420T000541Z_hybrid_p8_m8_w3_g142p3393809000651089036182384006679058074951171874999999999999999999999994394806142700731716305081666840335474878952232493936912971726864440835669256557594053447246551513671875_v1072.py	0.071006	0.789778	0.739821	0.375000	0.024580	discard	Restore the compact props8 + minsep8 hybrid shelf anchored at lwindow3, beam3, top4, boardcands2, secsep1, radius0, drop1, props8, total150, and lmargin9.935836791992188. The latest executed bracket is harmful at 142.33938090006510890361823840066790580749511718749999999999999999999998430545719956204880565422866715293932966106625098302335632083522043433987391836126334965229034423828125 and exact-flat at 142.339380900065108903618238400667905807495117187500000000000000000000014573504028978097537606787666215127765314724195515764026273510152453827259932950255461037158966064453125, so this run restores the same shelf anchor and raises only min_score_gain_per_added_move to 142.3393809000651089036182384006679058074951171874999999999999999999999994394806142700731716305081666840335474878952232493936912971726864440835669256557594053447246551513671875 to continue binary-searching that lower edge. The experiment name remains shortened to avoid the filename-too-long failure seen with long autogenerated names.
autoresearch/snapshots/20260420T001100Z_hybrid_p8_m8_w3_g142p33938090006510890361823840066790580749511718750000000000000000000000700649232162408535461864791644958065640130970938257885878534141944895541342930300743319094181060791015625_v1073.py	0.071006	0.799339	0.749250	0.375000	0.020699	discard	Restore the compact props8 + minsep8 hybrid shelf anchored at lwindow3, beam3, top4, boardcands2, secsep1, radius0, drop1, props8, total150, and lmargin9.935836791992188. The latest executed bracket is harmful at 142.3393809000651089036182384006679058074951171874999999999999999999999994394806142700731716305081666840335474878952232493936912971726864440835669256557594053447246551513671875 and exact-flat at 142.339380900065108903618238400667905807495117187500000000000000000000014573504028978097537606787666215127765314724195515764026273510152453827259932950255461037158966064453125, so this run restores the same shelf anchor and raises only min_score_gain_per_added_move to 142.33938090006510890361823840066790580749511718750000000000000000000000700649232162408535461864791644958065640130970938257885878534141944895541342930300743319094181060791015625 to continue binary-searching that lower edge. The experiment name remains shortened to avoid the filename-too-long failure seen with long autogenerated names.
autoresearch/snapshots/20260420T001201Z_hybrid_p8_m8_w3_g142p339380900065108903618238400667905807495117187500000000000000000000003222986467947079263124578041566807101944602466315986275041257052946519490177479383419267833232879638671875_v1074.py	0.071006	0.799339	0.749250	0.375000	0.020699	discard	Restore the compact props8 + minsep8 hybrid shelf anchored at lwindow3, beam3, top4, boardcands2, secsep1, radius0, drop1, props8, total150, and lmargin9.935836791992188. The latest executed bracket is harmful at 142.3393809000651089036182384006679058074951171874999999999999999999999994394806142700731716305081666840335474878952232493936912971726864440835669256557594053447246551513671875 and exact-flat at 142.33938090006510890361823840066790580749511718750000000000000000000000700649232162408535461864791644958065640130970938257885878534141944895541342930300743319094181060791015625, so this run restores the same shelf anchor and raises only min_score_gain_per_added_move to 142.339380900065108903618238400667905807495117187500000000000000000000003222986467947079263124578041566807101944602466315986275041257052946519490177479383419267833232879638671875 to continue binary-searching that lower edge. The experiment name remains shortened to avoid the filename-too-long failure seen with long autogenerated names.
autoresearch/snapshots/20260420T001302Z_hybrid_p8_m8_w3_g142p3393809000651089036182384006679058074951171875000000000000000000000013312335411085762173775431041254203247162488447826899831692148696953015285515675714123062789440155029296875_v1075.py	0.071006	0.799339	0.749250	0.375000	0.020699	discard	Restore the compact props8 + minsep8 hybrid shelf anchored at lwindow3, beam3, top4, boardcands2, secsep1, radius0, drop1, props8, total150, and lmargin9.935836791992188. The latest executed bracket is harmful at 142.3393809000651089036182384006679058074951171874999999999999999999999994394806142700731716305081666840335474878952232493936912971726864440835669256557594053447246551513671875 and exact-flat at 142.339380900065108903618238400667905807495117187500000000000000000000003222986467947079263124578041566807101944602466315986275041257052946519490177479383419267833232879638671875, so this run restores the same shelf anchor and raises only min_score_gain_per_added_move to 142.3393809000651089036182384006679058074951171875000000000000000000000013312335411085762173775431041254203247162488447826899831692148696953015285515675714123062789440155029296875 to continue binary-searching that lower edge. The experiment name remains shortened to avoid the filename-too-long failure seen with long autogenerated names.
autoresearch/snapshots/20260420T001403Z_hybrid_p8_m8_w3_g142p33938090006510890361823840066790580749511718750000000000000000000000038535707768932469450402563540472693610207203401604183723319377806969254773861166540882550179958343505859375_v1076.py	0.071006	0.799339	0.749250	0.375000	0.020699	discard	Restore the compact props8 + minsep8 hybrid shelf anchored at lwindow3, beam3, top4, boardcands2, secsep1, radius0, drop1, props8, total150, and lmargin9.935836791992188. The latest executed bracket is harmful at 142.3393809000651089036182384006679058074951171874999999999999999999999994394806142700731716305081666840335474878952232493936912971726864440835669256557594053447246551513671875 and exact-flat at 142.3393809000651089036182384006679058074951171875000000000000000000000013312335411085762173775431041254203247162488447826899831692148696953015285515675714123062789440155029296875, so this run restores the same shelf anchor and raises only min_score_gain_per_added_move to 142.33938090006510890361823840066790580749511718750000000000000000000000038535707768932469450402563540472693610207203401604183723319377806969254773861166540882550179958343505859375 to continue binary-searching that lower edge. The experiment name remains shortened to avoid the filename-too-long failure seen with long autogenerated names.
autoresearch/snapshots/20260420T001504Z_hybrid_p8_m8_w3_g142p339380900065108903618238400667905807495117187499999999999999999999999912418845979698933067266901044380241794983628632717764265183232256888057332133712407085113227367401123046875_v1077.py	0.071006	0.789778	0.739821	0.375000	0.024580	discard	Restore the compact props8 + minsep8 hybrid shelf anchored at lwindow3, beam3, top4, boardcands2, secsep1, radius0, drop1, props8, total150, and lmargin9.935836791992188. The latest executed bracket is harmful at 142.3393809000651089036182384006679058074951171874999999999999999999999994394806142700731716305081666840335474878952232493936912971726864440835669256557594053447246551513671875 and exact-flat at 142.33938090006510890361823840066790580749511718750000000000000000000000038535707768932469450402563540472693610207203401604183723319377806969254773861166540882550179958343505859375, so this run restores the same shelf anchor and raises only min_score_gain_per_added_move to 142.339380900065108903618238400667905807495117187499999999999999999999999912418845979698933067266901044380241794983628632717764265183232256888057332133712407085113227367401123046875 to continue binary-searching that lower edge. The experiment name remains shortened to avoid the filename-too-long failure seen with long autogenerated names.
autoresearch/snapshots/20260420T001606Z_hybrid_p8_m8_w3_g142p3393809000651089036182384006679058074951171875000000000000000000000001488879618345118137856462682245535889485278313243798007491885051632903025353726889079553075134754180908203125_v1078.py	0.071006	0.799339	0.749250	0.375000	0.020699	discard	Restore the compact props8 + minsep8 hybrid shelf anchored at lwindow3, beam3, top4, boardcands2, secsep1, radius0, drop1, props8, total150, and lmargin9.935836791992188. The latest executed bracket is harmful at 142.339380900065108903618238400667905807495117187499999999999999999999999912418845979698933067266901044380241794983628632717764265183232256888057332133712407085113227367401123046875 and exact-flat at 142.33938090006510890361823840066790580749511718750000000000000000000000038535707768932469450402563540472693610207203401604183723319377806969254773861166540882550179958343505859375, so this run restores the same shelf anchor and raises only min_score_gain_per_added_move to 142.3393809000651089036182384006679058074951171875000000000000000000000001488879618345118137856462682245535889485278313243798007491885051632903025353726889079553075134754180908203125 to continue binary-searching that lower edge. The experiment name remains shortened to avoid the filename-too-long failure seen with long autogenerated names.
autoresearch/snapshots/20260420T001706Z_hybrid_p8_m8_w3_g142p33938090006510890361823840066790580749511718750000000000000000000000003065340390710537342645658463446691537175572997854878250718586871008917993375320065752021037042140960693359375_v1079.py	0.071006	0.799339	0.749250	0.375000	0.020699	discard	Restore the compact props8 + minsep8 hybrid shelf anchored at lwindow3, beam3, top4, boardcands2, secsep1, radius0, drop1, props8, total150, and lmargin9.935836791992188. The latest executed bracket is harmful at 142.339380900065108903618238400667905807495117187499999999999999999999999912418845979698933067266901044380241794983628632717764265183232256888057332133712407085113227367401123046875 and exact-flat at 142.3393809000651089036182384006679058074951171875000000000000000000000001488879618345118137856462682245535889485278313243798007491885051632903025353726889079553075134754180908203125, so this run restores the same shelf anchor and raises only min_score_gain_per_added_move to 142.33938090006510890361823840066790580749511718750000000000000000000000003065340390710537342645658463446691537175572997854878250718586871008917993375320065752021037042140960693359375 to continue binary-searching that lower edge. The experiment name remains shortened to avoid the filename-too-long failure seen with long autogenerated names.
