snapshot	board_exact	non_empty_accuracy	macro_f1	move_recall	false_change_rate	status	description
autoresearch/snapshots/20260420T072909Z_hybrid_p8_m8_w3_v1363.py	0.071006	0.789778	0.739821	0.375000	0.024580	discard	Restore the compact props8 + minsep8 hybrid shelf anchored at lwindow3, beam3, top4, boardcands2, secsep1, radius0, drop1, props8, total150, and lmargin9.935836791992188. The true executed harmful/flat bracket is now harmful at 142.3393809000651089036182384006679058074951171874999999999999999999999999999999999999999999999999999999999999999999999999999999999999999999999999644397202321902120940836579341561343925984225636363709323578311905556132816329727737812581555101757538909886215228749377196697238391796390580545585470636827410903352470462204505157766106312128100286679081086879274416576212111299425363120710347022975387283778847535842260185745544731616973876953125 and flat at 142.3393809000651089036182384006679058074951171875000000000000000000000000000000000000000000000000000000000000000000000000000000000000000000000000024464462779241516660262982616762383486882799027511160690351301395422115681135361099739593314872868519452632607661158039692920483255170782094067899064626701170090855875778070174267614286044220290856667855956235870734592237282483614473946572498484511803094887394394163493416272103786468505859375. This run prepares their exact midpoint, 142.33938090006510890361823840066790580749511718749999999999999999999999999999999999999999999999999999999999999999999999999999999999999999999999998344308325505718188005497809791618637064335123319374350069648066504891242487325444187760874349873130291812594114449537084448088608234835863373067422676317642904971041731201373397126901961781741955716734685215575725755842246968915199185336414227537435951893331209650028768010088242590427398681640625, with a short experiment name to avoid filename-too-long failures.
autoresearch/snapshots/20260420T073934Z_hybrid_p8_m8_w3_v1363.py	0.071006	0.789778	0.739821	0.375000	0.024580	discard	Restore the compact props8 + minsep8 hybrid shelf anchored at lwindow3, beam3, top4, boardcands2, secsep1, radius0, drop1, props8, total150, and lmargin9.935836791992188. The true executed harmful/flat bracket is now harmful at 142.33938090006510890361823840066790580749511718749999999999999999999999999999999999999999999999999999999999999999999999999999999999999999999999998344308325505718188005497809791618637064335123319374350069648066504891242487325444187760874349873130291812594114449537084448088608234835863373067422676317642904971041731201373397126901961781741955716734685215575725755842246968915199185336414227537435951893331209650028768010088242590427398681640625 and flat at 142.3393809000651089036182384006679058074951171875000000000000000000000000000000000000000000000000000000000000000000000000000000000000000000000000024464462779241516660262982616762383486882799027511160690351301395422115681135361099739593314872868519452632607661158039692920483255170782094067899064626701170090855875778070174267614286044220290856667855956235870734592237282483614473946572498484511803094887394394163493416272103786468505859375. This run prepares their exact midpoint, 142.339380900065108903618238400667905807495117187499999999999999999999999999999999999999999999999999999999999999999999999999999999999999999999999992944764766490666773040638179796212359665815567972429784865805402295561996493395275925784037493009077431694600955305587406886467203932718421568732066612923273029398002444910375699015224111119724321417066223889672165508823098968756719624010696061912769914211025767958318510864046402275562286376953125, with a short experiment name to avoid filename-too-long failures.
autoresearch/snapshots/20260420T081512Z_hybrid_p8_m8_w3_v1364.py	0.071006	0.789778	0.739821	0.375000	0.024580	discard	Restore the compact props8 + minsep8 hybrid shelf anchored at lwindow3, beam3, top4, boardcands2, secsep1, radius0, drop1, props8, total150, and lmargin9.935836791992188. The true executed harmful/flat bracket is now harmful at 142.339380900065108903618238400667905807495117187499999999999999999999999999999999999999999999999999999999999999999999999999999999999999999999999992944764766490666773040638179796212359665815567972429784865805402295561996493395275925784037493009077431694600955305587406886467203932718421568732066612923273029398002444910375699015224111119724321417066223889672165508823098968756719624010696061912769914211025767958318510864046402275562286376953125 and flat at 142.3393809000651089036182384006679058074951171875000000000000000000000000000000000000000000000000000000000000000000000000000000000000000000000000024464462779241516660262982616762383486882799027511160690351301395422115681135361099739593314872868519452632607661158039692920483255170782094067899064626701170090855875778070174267614286044220290856667855956235870734592237282483614473946572498484511803094887394394163493416272103786468505859375. This run prepares their exact midpoint, 142.3393809000651089036182384006679058074951171874999999999999999999999999999999999999999999999999999999999999999999999999999999999999999999999999976956055222074092195334682207362253541770477353617729269504677709188867823034656929498716844901479646884789308607106956880892577647248983154877609865377966950192417950113586965628883263577708767035419259097566296194840234136085590835093339729551819751118498826036873339262456283904612064361572265625, with a short experiment name to avoid filename-too-long failures.
