snapshot	board_exact	non_empty_accuracy	macro_f1	move_recall	false_change_rate	status	description
autoresearch/snapshots/20260419T015629Z_hybrid_lookahead_segmental_drop1_boardcands4_ratio925_props16_top4_detect10_minsep4_thresh3_total150_permove125_m9p8957061767578125_r0_beam4_v386.py	0.074556	0.761976	0.721843	0.328125	0.020699	discard	Hybrid decoder keeps the baseline lookahead path unless a conservative board-only segmental pass wins the current score-gain gates, while following up the current beam4 minsep4 best surface after raising secondary peak ratio from 0.95 to 0.98 was an exact no-op on the restored secsep2 baseline branch, lowering it to 0.93 was also an exact no-op, and lowering it to 0.92 reopened a worse regime, and lowering only secondary peak ratio from 0.93 to 0.925 on that restored baseline branch to localize the lower-side ratio cliff more precisely.
autoresearch/snapshots/20260419T015732Z_hybrid_lookahead_segmental_drop1_boardcands4_ratio9275_props16_top4_detect10_minsep4_thresh3_total150_permove125_m9p8957061767578125_r0_beam4_v387.py	0.074556	0.761976	0.721843	0.328125	0.020699	discard	Hybrid decoder keeps the baseline lookahead path unless a conservative board-only segmental pass wins the current score-gain gates, while following up the current beam4 minsep4 best surface after secondary peak ratio 0.98 and 0.93 were exact no-ops on the restored secsep2 baseline branch, 0.925 reopened a worse higher-recall and higher-false-change regime, and lowering only secondary peak ratio from 0.93 to 0.9275 on that restored baseline branch to localize the lower-side ratio cliff more precisely.
autoresearch/snapshots/20260419T015835Z_hybrid_lookahead_segmental_drop1_boardcands4_ratio92875_props16_top4_detect10_minsep4_thresh3_total150_permove125_m9p8957061767578125_r0_beam4_v388.py	0.074556	0.764405	0.723227	0.312500	0.019405	discard	Hybrid decoder keeps the baseline lookahead path unless a conservative board-only segmental pass wins the current score-gain gates, while following up the current beam4 minsep4 best surface after secondary peak ratio 0.98 and 0.93 were exact no-ops on the restored secsep2 baseline branch, 0.9275 reopened a worse higher-recall and higher-false-change regime, and lowering only secondary peak ratio from 0.93 to 0.92875 on that restored baseline branch to localize the lower-side ratio cliff more precisely.
autoresearch/snapshots/20260419T020012Z_hybrid_lookahead_segmental_drop1_boardcands4_ratio95_props16_top8_detect10_minsep4_thresh3_total150_permove125_m9p8957061767578125_r0_beam4_v389.py	0.074556	0.764405	0.723227	0.312500	0.019405	discard	Hybrid decoder keeps the baseline lookahead path unless a conservative board-only segmental pass wins the current score-gain gates, while following up the current beam4 minsep4 best surface after secondary peak-ratio tuning showed a sharp lower-side cliff but no upside over the restored baseline, beam and proposal-budget sweeps on nearby secsep branches stayed flat or worse, and top-move breadth on the restored best surface was only mapped through top4, and raising only top-move breadth from 4 to 8 on that restored baseline branch to test whether the move-menu plateau really extends beyond top4 or whether broader move breadth reopens a different ambiguity regime.
autoresearch/snapshots/20260419T020148Z_hybrid_lookahead_segmental_drop1_boardcands4_ratio95_props16_top16_detect10_minsep4_thresh3_total150_permove125_m9p8957061767578125_r0_beam4_v390.py	0.074556	0.764405	0.723227	0.312500	0.019405	discard	Hybrid decoder keeps the baseline lookahead path unless a conservative board-only segmental pass wins the current score-gain gates, while following up the current beam4 minsep4 best surface after secondary peak-ratio tuning showed a sharp lower-side cliff but no upside over the restored baseline, nearby secsep, beam, budget, and radius sweeps stayed flat or worse, and broadening top-move breadth from 4 to 8 on that restored baseline branch was also an exact no-op, and raising only top-move breadth from 8 to 16 on the restored baseline branch to test whether the move-menu plateau really extends to the search cap or eventually reopens a different ambiguity regime.
autoresearch/snapshots/20260419T020238Z_hybrid_lookahead_segmental_drop1_boardcands4_ratio95_props16_top16_detect10_minsep4_thresh3_total150_permove125_m9p8957061767578125_r0_beam4_v390.py	0.074556	0.764405	0.723227	0.312500	0.019405	discard	Hybrid decoder keeps the baseline lookahead path unless a conservative board-only segmental pass wins the current score-gain gates, while following up the current beam4 minsep4 best surface after secondary peak-ratio tuning showed a sharp lower-side cliff but no upside over the restored baseline, nearby secsep, beam, budget, and radius sweeps stayed flat or worse, and broadening top-move breadth from 4 to 8 on that restored baseline branch was also an exact no-op, and raising only top-move breadth from 8 to 16 on the restored baseline branch to test whether the move-menu plateau really extends to the search cap or eventually reopens a different ambiguity regime.
autoresearch/snapshots/20260419T020405Z_hybrid_lookahead_segmental_drop1_boardcands4_ratio928125_props16_top4_detect10_minsep4_thresh3_total150_permove125_m9p8957061767578125_r0_beam4_v391.py	0.074556	0.761976	0.721843	0.328125	0.020699	discard	Hybrid decoder keeps the baseline lookahead path unless a conservative board-only segmental pass wins the current score-gain gates, while following up the current beam4 minsep4 best surface after broadening top-move breadth to 16 stayed an exact no-op, secondary peak ratio 0.98 and 0.93 were exact no-ops on the restored secsep2 baseline branch, and 0.9275 reopened a worse higher-recall and higher-false-change regime while 0.92875 still held the baseline surface, and lowering only secondary peak ratio from 0.92875 to 0.928125 on that restored baseline branch to localize the lower-side ratio cliff more precisely.
autoresearch/snapshots/20260419T020456Z_hybrid_lookahead_segmental_drop1_boardcands4_ratio9284375_props16_top4_detect10_minsep4_thresh3_total150_permove125_m9p8957061767578125_r0_beam4_v392.py	0.074556	0.761976	0.721843	0.328125	0.020699	discard	Hybrid decoder keeps the baseline lookahead path unless a conservative board-only segmental pass wins the current score-gain gates, while following up the current beam4 minsep4 best surface after secondary peak ratio 0.98 and 0.93 were exact no-ops on the restored secsep2 baseline branch, 0.92875 still held the baseline surface, and 0.928125 reopened a worse higher-recall and higher-false-change regime, and lowering only secondary peak ratio from 0.92875 to 0.9284375 on that restored baseline branch to localize the lower-side ratio cliff more precisely.
autoresearch/snapshots/20260419T021030Z_hybrid_lookahead_segmental_drop1_boardcands4_ratio92859375_props16_top4_detect10_minsep4_thresh3_total150_permove125_m9p8957061767578125_r0_beam4_v393.py	0.074556	0.764405	0.723227	0.312500	0.019405	discard	Hybrid decoder keeps the baseline lookahead path unless a conservative board-only segmental pass wins the current score-gain gates, while following up the current beam4 minsep4 best surface after secondary peak ratio 0.98 and 0.93 were exact no-ops on the restored secsep2 baseline branch, 0.92875 still held the baseline surface, and 0.9284375 reopened a worse higher-recall and higher-false-change regime, and lowering only secondary peak ratio from 0.92875 to 0.92859375 on that restored baseline branch to localize the lower-side ratio cliff more precisely.
autoresearch/snapshots/20260419T021141Z_hybrid_lookahead_segmental_drop1_boardcands4_ratio95_props16_top4_detect10_minsep4_thresh3_total150_permove125_m9p8957061767578125_r1_beam4_v394.py	0.074556	0.764405	0.723227	0.312500	0.019405	discard	Hybrid decoder keeps the baseline lookahead path unless a conservative board-only segmental pass wins the current score-gain gates, while following up the restored beam4 minsep4 best surface after top-move breadth was flat through top16 and the lower-side secondary-peak-ratio cliff was localized to a very narrow interval just below 0.92859375, and raising only event window radius from 0 to 1 on that restored baseline branch to test whether the best surface is also radius-insensitive at beam4 or reopens a different temporal-aggregation tradeoff.
autoresearch/snapshots/20260419T021259Z_hybrid_lookahead_segmental_drop1_boardcands4_ratio95_props16_top4_detect10_minsep4_thresh3_total140_permove125_m9p8957061767578125_r0_beam4_v395.py	0.074556	0.764405	0.723227	0.312500	0.019405	discard	Hybrid decoder keeps the baseline lookahead path unless a conservative board-only segmental pass wins the current score-gain gates, while following up the restored beam4 minsep4 best surface after secondary-peak-ratio tuning localized a very narrow lower-side cliff and event window radius 1 was an exact no-op on that branch, and lowering only the hybrid minimum total score gain from 150 to 140 on the restored baseline branch to test whether a slightly looser segmental handoff improves temporal ambiguity resolution or just reopens worse spillover.
autoresearch/snapshots/20260419T021349Z_hybrid_lookahead_segmental_drop1_boardcands4_ratio95_props16_top4_detect10_minsep4_thresh3_total150_permove112p5_m9p8957061767578125_r0_beam4_v396.py	0.056805	0.751124	0.707456	0.359375	0.028461	discard	Hybrid decoder keeps the baseline lookahead path unless a conservative board-only segmental pass wins the current score-gain gates, while following up the restored beam4 minsep4 best surface after secondary-peak-ratio tuning localized a very narrow lower-side cliff, event window radius 1 was an exact no-op, and lowering the hybrid minimum total score gain from 150 to 140 was also an exact no-op on that branch, and lowering only the hybrid minimum score gain per added move from 125 to 112.5 on the restored baseline branch to test whether the handoff is actually constrained by the per-move gate rather than the total-gain gate.
autoresearch/snapshots/20260419T021432Z_hybrid_lookahead_segmental_drop1_boardcands4_ratio95_props16_top4_detect10_minsep4_thresh3_total150_permove118p75_m9p8957061767578125_r0_beam4_v397.py	0.074556	0.764405	0.723227	0.312500	0.019405	discard	Hybrid decoder keeps the baseline lookahead path unless a conservative board-only segmental pass wins the current score-gain gates, while following up the restored beam4 minsep4 best surface after secondary-peak-ratio, radius, and total-gain probes were exact no-ops on that branch, and lowering the hybrid minimum score gain per added move from 125 to 112.5 reopened a much worse higher-recall and higher-false-change regime, and lowering only the hybrid minimum score gain per added move from 125 to 118.75 on the restored baseline branch to localize whether that per-move handoff cliff starts immediately below the baseline or only closer to 112.5.
autoresearch/snapshots/20260419T021516Z_hybrid_lookahead_segmental_drop1_boardcands4_ratio95_props16_top4_detect10_minsep4_thresh3_total150_permove115p625_m9p8957061767578125_r0_beam4_v398.py	0.074556	0.764405	0.723227	0.312500	0.019405	discard	Hybrid decoder keeps the baseline lookahead path unless a conservative board-only segmental pass wins the current score-gain gates, while following up the restored beam4 minsep4 best surface after secondary-peak-ratio, radius, and total-gain probes were exact no-ops on that branch, lowering the hybrid minimum score gain per added move from 125 to 118.75 was also an exact no-op, and lowering it to 112.5 reopened a much worse higher-recall and higher-false-change regime, and lowering only the hybrid minimum score gain per added move from 118.75 to 115.625 on the restored baseline branch to localize that per-move handoff cliff more precisely.
autoresearch/snapshots/20260419T021603Z_hybrid_lookahead_segmental_drop1_boardcands4_ratio95_props16_top4_detect10_minsep4_thresh3_total150_permove114p0625_m9p8957061767578125_r0_beam4_v399.py	0.063905	0.759909	0.717350	0.328125	0.021992	discard	Hybrid decoder keeps the baseline lookahead path unless a conservative board-only segmental pass wins the current score-gain gates, while following up the restored beam4 minsep4 best surface after secondary-peak-ratio, radius, and total-gain probes were exact no-ops on that branch, lowering the hybrid minimum score gain per added move from 125 to 118.75 and 115.625 was also an exact no-op, and lowering it to 112.5 reopened a much worse higher-recall and higher-false-change regime, and lowering only the hybrid minimum score gain per added move from 115.625 to 114.0625 on the restored baseline branch to localize that per-move handoff cliff more precisely.
autoresearch/snapshots/20260419T021651Z_hybrid_lookahead_segmental_drop1_boardcands4_ratio95_props16_top4_detect10_minsep4_thresh3_total150_permove114p84375_m9p8957061767578125_r0_beam4_v400.py	0.063905	0.759909	0.717350	0.328125	0.021992	discard	Hybrid decoder keeps the baseline lookahead path unless a conservative board-only segmental pass wins the current score-gain gates, while following up the restored beam4 minsep4 best surface after secondary-peak-ratio, radius, and total-gain probes were exact no-ops on that branch, lowering the hybrid minimum score gain per added move from 125 to 115.625 was also an exact no-op, and lowering it to 114.0625 reopened a degraded higher-recall and higher-false-change regime, and lowering only the hybrid minimum score gain per added move from 115.625 to 114.84375 on the restored baseline branch to localize that per-move handoff cliff more precisely.
autoresearch/snapshots/20260419T021758Z_hybrid_lookahead_segmental_drop1_boardcands4_ratio95_props16_top4_detect10_minsep4_thresh3_total150_permove137p5_m9p8957061767578125_r0_beam4_v401.py	0.074556	0.764405	0.723227	0.312500	0.019405	discard	Hybrid decoder keeps the baseline lookahead path unless a conservative board-only segmental pass wins the current score-gain gates, while following up the restored beam4 minsep4 best surface after secondary-peak-ratio, radius, and total-gain probes were exact no-ops on that branch, lowering the hybrid minimum score gain per added move from 125 to 115.625 was also an exact no-op, and lowering it to 114.84375 reopened a degraded higher-recall and higher-false-change regime, and raising only the hybrid minimum score gain per added move from 125 to 137.5 on the restored baseline branch to test whether the best surface sits on a broader upper-side plateau or whether the handoff is also sensitive on the stricter side.
autoresearch/snapshots/20260419T021850Z_hybrid_lookahead_segmental_drop1_boardcands4_ratio95_props16_top4_detect10_minsep4_thresh3_total175_permove125_m9p8957061767578125_r0_beam4_v402.py	0.074556	0.764405	0.723227	0.312500	0.019405	discard	Hybrid decoder keeps the baseline lookahead path unless a conservative board-only segmental pass wins the current score-gain gates, while following up the restored beam4 minsep4 best surface after secondary-peak-ratio, radius, and lower total-gain probes were exact no-ops on that branch, lowering the hybrid minimum score gain per added move exposed only a tight lower-side cliff, and raising only the hybrid minimum total score gain from 150 to 175 on the restored baseline branch to test whether the total-gain handoff is also flat on the stricter side or whether it trims segmental takeovers before the per-move gate does.
autoresearch/snapshots/20260419T021941Z_hybrid_lookahead_segmental_drop1_boardcands4_ratio95_props16_top4_detect10_minsep4_thresh3_total175_permove137p5_m9p8957061767578125_r0_beam4_v403.py	0.074556	0.764405	0.723227	0.312500	0.019405	discard	Hybrid decoder keeps the baseline lookahead path unless a conservative board-only segmental pass wins the current score-gain gates, while following up the restored beam4 minsep4 best surface after both lower and higher minimum total score gain probes were exact no-ops, lowering the hybrid minimum score gain per added move exposed only a tight lower-side cliff, and raising it to 137.5 was also an exact no-op, and raising both the hybrid minimum total score gain from 150 to 175 and the minimum score gain per added move from 125 to 137.5 on the restored baseline branch to test whether the handoff remains on the same plateau only when each gate is tightened separately or also when both stricter gates are applied together.
autoresearch/snapshots/20260419T022041Z_hybrid_lookahead_segmental_drop1_boardcands4_ratio95_props16_top4_detect10_minsep4_thresh3_total150_permove125_m10_r0_beam4_v404.py	0.074556	0.764405	0.723227	0.312500	0.019405	discard	Hybrid decoder keeps the baseline lookahead path unless a conservative board-only segmental pass wins the current score-gain gates, while following up the restored beam4 minsep4 best surface after both lower and higher hybrid total-gain probes were exact no-ops, the per-move gate showed only a tight lower-side cliff, and even the combined stricter total-plus-per-move handoff stayed on the same plateau, and raising only the segmental move score margin from 9.8957061767578125 to 10.0 on the restored baseline branch to test whether that best surface also sits on a local board-score-margin plateau or depends on the tuned sub-10 margin.
autoresearch/snapshots/20260419T022129Z_hybrid_lookahead_segmental_drop1_boardcands4_ratio95_props16_top4_detect10_minsep4_thresh3_total150_permove125_m9p75_r0_beam4_v405.py	0.074556	0.764405	0.723227	0.312500	0.019405	discard	Hybrid decoder keeps the baseline lookahead path unless a conservative board-only segmental pass wins the current score-gain gates, while following up the restored beam4 minsep4 best surface after both lower and higher hybrid total-gain probes were exact no-ops, the per-move gate showed only a tight lower-side cliff, and raising the segmental move score margin from 9.8957061767578125 to 10.0 was also an exact no-op, and lowering only the segmental move score margin from 9.8957061767578125 to 9.75 on the restored baseline branch to test whether that best surface also sits on a broader lower-side board-score-margin plateau or whether the tuned margin is only stable on the stricter side.
autoresearch/snapshots/20260419T022221Z_hybrid_lookahead_segmental_drop1_boardcands4_ratio95_props16_top4_detect10_minsep4_thresh3p5_total150_permove125_m9p8957061767578125_r0_beam4_v406.py	0.048521	0.759237	0.716436	0.328125	0.021992	discard	Hybrid decoder keeps the baseline lookahead path unless a conservative board-only segmental pass wins the current score-gain gates, while following up the restored beam4 minsep4 best surface after both lower and higher hybrid total-gain probes were exact no-ops, the per-move gate showed only a tight lower-side cliff, and both nearby move-score-margin probes were also exact no-ops, and raising only the segmental board-change peak threshold from 3.0/64.0 to 3.5/64.0 on the restored baseline branch to test whether that best surface also sits on a local proposal-threshold plateau or whether a slightly stricter board-change gate trims useful temporal event proposals.
autoresearch/snapshots/20260419T022310Z_hybrid_lookahead_segmental_drop1_boardcands4_ratio95_props16_top4_detect10_minsep4_thresh3p25_total150_permove125_m9p8957061767578125_r0_beam4_v407.py	0.048521	0.759237	0.716436	0.328125	0.021992	discard	Hybrid decoder keeps the baseline lookahead path unless a conservative board-only segmental pass wins the current score-gain gates, while following up the restored beam4 minsep4 best surface after both lower and higher hybrid total-gain probes were exact no-ops, the per-move gate showed only a tight lower-side cliff, nearby move-score-margin probes were exact no-ops, and raising the segmental board-change peak threshold from 3.0/64.0 to 3.5/64.0 materially degraded the branch, and raising only the segmental board-change peak threshold from 3.0/64.0 to 3.25/64.0 on the restored baseline branch to localize whether that proposal-threshold cliff starts immediately above the baseline or only closer to the stricter 3.5/64.0 setting.
autoresearch/snapshots/20260419T022404Z_hybrid_lookahead_segmental_drop1_boardcands4_ratio95_props16_top4_detect10_minsep4_thresh2p75_total150_permove125_m9p8957061767578125_r0_beam4_v408.py	0.074556	0.764405	0.723227	0.312500	0.019405	discard	Hybrid decoder keeps the baseline lookahead path unless a conservative board-only segmental pass wins the current score-gain gates, while following up the restored beam4 minsep4 best surface after both lower and higher hybrid total-gain probes were exact no-ops, the per-move gate showed only a tight lower-side cliff, nearby move-score-margin probes were exact no-ops, and raising the segmental board-change peak threshold from 3.0/64.0 to both 3.25/64.0 and 3.5/64.0 materially degraded the branch, and lowering only the segmental board-change peak threshold from 3.0/64.0 to 2.75/64.0 on the restored baseline branch to test whether that proposal-threshold sensitivity is one-sided on the stricter edge or whether a looser board-change gate also reopens a worse regime.
