snapshot	board_exact	non_empty_accuracy	macro_f1	move_recall	false_change_rate	status	description
autoresearch/snapshots/20260419T005614Z_hybrid_lookahead_segmental_drop1_boardcands4_ratio95_props16_top4_detect10_minsep4_thresh3_total150_permove125_m9p8957061767578125_r0_beam7_v342.py	0.074556	0.764405	0.723227	0.312500	0.019405	keep	Hybrid decoder keeps the baseline lookahead path unless a conservative board-only segmental pass wins the current score-gain gates, while following up the new beam8 + props16 + minsep4 + r0 plateau after boardcands1 through boardcands4 all preserved the improved board_exact and false-change surface, top1 through top4 now also preserved that surface on beam8, props15 and props17 both stayed on-branch but gave back some secondary metrics, minsep5 broke the gain, and lowering only beam_size from 8 to 7 on the active boardcands4 + top4 surface to test whether the minsep4 improvement is truly beam8-specific or already extends one step down the beam ladder.
autoresearch/snapshots/20260419T005714Z_hybrid_lookahead_segmental_drop1_boardcands4_ratio95_props16_top4_detect10_minsep4_thresh3_total150_permove125_m9p8957061767578125_r0_beam6_v343.py	0.074556	0.764405	0.723227	0.312500	0.019405	keep	Hybrid decoder keeps the baseline lookahead path unless a conservative board-only segmental pass wins the current score-gain gates, while following up the new beam8 + props16 + minsep4 + r0 plateau after boardcands1 through boardcands4 all preserved the improved board_exact and false-change surface, top1 through top4 now also preserved that surface on beam8, props15 and props17 both stayed on-branch but gave back some secondary metrics, minsep5 broke the gain, beam7 matched the active surface exactly, and lowering only beam_size from 7 to 6 on the active boardcands4 + top4 surface to test whether the minsep4 improvement continues farther down the beam ladder or finally localizes below beam7.
autoresearch/snapshots/20260419T005809Z_hybrid_lookahead_segmental_drop1_boardcands4_ratio95_props16_top4_detect10_minsep4_thresh3_total150_permove125_m9p8957061767578125_r0_beam5_v344.py	0.074556	0.764405	0.723227	0.312500	0.019405	keep	Hybrid decoder keeps the baseline lookahead path unless a conservative board-only segmental pass wins the current score-gain gates, while following up the new beam8 + props16 + minsep4 + r0 plateau after boardcands1 through boardcands4 all preserved the improved board_exact and false-change surface, top1 through top4 now also preserved that surface on beam8, props15 and props17 both stayed on-branch but gave back some secondary metrics, minsep5 broke the gain, and beam7 plus beam6 both matched the active surface exactly, and lowering only beam_size from 6 to 5 on the active boardcands4 + top4 surface to test whether the minsep4 improvement continues farther down the beam ladder or finally localizes at the older beam5 boundary.
autoresearch/snapshots/20260419T005907Z_hybrid_lookahead_segmental_drop1_boardcands4_ratio95_props16_top4_detect10_minsep4_thresh3_total150_permove125_m9p8957061767578125_r0_beam4_v345.py	0.074556	0.764405	0.723227	0.312500	0.019405	keep	Hybrid decoder keeps the baseline lookahead path unless a conservative board-only segmental pass wins the current score-gain gates, while following up the new beam8 + props16 + minsep4 + r0 plateau after boardcands1 through boardcands4 all preserved the improved board_exact and false-change surface, top1 through top4 now also preserved that surface on beam8, props15 and props17 both stayed on-branch but gave back some secondary metrics, minsep5 broke the gain, and beam7 plus beam6 plus beam5 all matched the active surface exactly, and lowering only beam_size from 5 to 4 on the active boardcands4 + top4 surface to test whether the minsep4 improvement continues farther down the beam ladder or finally localizes at beam4.
autoresearch/snapshots/20260419T010444Z_hybrid_lookahead_segmental_drop1_boardcands4_ratio95_props16_top4_detect10_minsep4_thresh3_total150_permove125_m9p8957061767578125_r0_beam3_v346.py	0.074556	0.764405	0.723459	0.296875	0.020699	keep	Hybrid decoder keeps the baseline lookahead path unless a conservative board-only segmental pass wins the current score-gain gates, while following up the new beam8 + props16 + minsep4 + r0 plateau after boardcands1 through boardcands4 all preserved the improved board_exact and false-change surface, top1 through top4 now also preserved that surface on beam8, props15 and props17 both stayed on-branch but gave back some secondary metrics, minsep5 broke the gain, and beam7 plus beam6 plus beam5 plus beam4 all matched the active surface exactly, and lowering only beam_size from 4 to 3 on the active boardcands4 + top4 surface to test whether the minsep4 improvement continues one more step down the beam ladder or finally localizes at beam3.
autoresearch/snapshots/20260419T010445Z_hybrid_lookahead_segmental_drop1_boardcands4_ratio95_props16_top4_detect10_minsep4_thresh3_total150_permove125_m9p8957061767578125_r0_beam3_v346.py	0.074556	0.764405	0.723459	0.296875	0.020699	keep	Hybrid decoder keeps the baseline lookahead path unless a conservative board-only segmental pass wins the current score-gain gates, while following up the new beam8 + props16 + minsep4 + r0 plateau after boardcands1 through boardcands4 all preserved the improved board_exact and false-change surface, top1 through top4 now also preserved that surface on beam8, props15 and props17 both stayed on-branch but gave back some secondary metrics, minsep5 broke the gain, and beam7 plus beam6 plus beam5 plus beam4 all matched the active surface exactly, and lowering only beam_size from 4 to 3 on the active boardcands4 + top4 surface to test whether the minsep4 improvement continues one more step down the beam ladder or finally localizes at beam3.
autoresearch/snapshots/20260419T010553Z_hybrid_lookahead_segmental_drop1_boardcands4_ratio95_props16_top4_detect10_minsep4_thresh3_total150_permove93p75_m9p8957061767578125_r0_beam4_v347.py	0.056805	0.751124	0.707456	0.359375	0.028461	discard	Hybrid decoder keeps the baseline lookahead path unless a conservative board-only segmental pass wins the current score-gain gates, while following up the new minsep4 + boardcands4 + top4 plateau after beam8 through beam4 all preserved the improved board_exact surface and beam3 finally worsened false-change plus recall, and lowering only the per-added-move score-gain gate from 125.0 to 93.75 on the active beam4 branch to test whether the older safe-lower-threshold window still opens more useful move acceptance on the corrected minsep4 cache without collapsing the current precision gains.
autoresearch/snapshots/20260419T010707Z_hybrid_lookahead_segmental_drop2_boardcands4_ratio95_props16_top4_detect10_minsep4_thresh3_total150_permove125_m9p8957061767578125_r0_beam4_v348.py	0.067456	0.758824	0.716237	0.328125	0.023286	discard	Hybrid decoder keeps the baseline lookahead path unless a conservative board-only segmental pass wins the current score-gain gates, while following up the new beam4 minsep4 plateau after beam8 through beam4 all preserved the improved board_exact surface, lowering the per-added-move gate reopened the older false-change-heavy regime, and the remaining failures still look driven by a few noisy segment frames, and raising only segment_board_drop_worst_frames from 1 to 2 on the active boardcands4 + top4 branch to test whether discarding one extra worst frame per segment recovers board exactness on the corrected cache without reopening the broader false-change tradeoff.
autoresearch/snapshots/20260419T010804Z_hybrid_lookahead_segmental_drop1_boardcands4_ratio95_props16_top4_detect10_minsep4_thresh3_total150_permove125_m9p8957061767578125_r0_beam2_v348.py	0.074556	0.760426	0.705743	0.296875	0.020699	keep	Hybrid decoder keeps the baseline lookahead path unless a conservative board-only segmental pass wins the current score-gain gates, while following up the new minsep4 + boardcands4 + top4 plateau after beam8 through beam4 all preserved the improved board_exact and false-change surface, beam3 still preserved board_exact but gave back some recall and false-change, and lowering only beam_size from 4 to 2 on the active beam4 surface to test whether the minsep4 improvement truly survives into a very narrow beam or finally breaks at beam2.
autoresearch/snapshots/20260419T010841Z_hybrid_lookahead_segmental_drop1_boardcands4_ratio95_props16_top4_detect10_minsep4_thresh3_total150_permove125_m9p8957061767578125_r0_beam1_v349.py	0.074556	0.757635	0.698238	0.296875	0.020699	keep	Hybrid decoder keeps the baseline lookahead path unless a conservative board-only segmental pass wins the current score-gain gates, while following up the new minsep4 + boardcands4 + top4 plateau after beam8 through beam4 all preserved the improved board_exact and false-change surface, beam3 and beam2 still preserved board_exact while giving back some secondary metrics, and lowering only beam_size from 2 to 1 on the active beam2 surface to test whether the minsep4 improvement truly survives at the narrowest beam or finally breaks at beam1.
autoresearch/snapshots/20260419T010952Z_hybrid_lookahead_segmental_drop1_boardcands3_ratio95_props16_top4_detect10_minsep4_thresh3_total150_permove125_m9p8957061767578125_r0_beam1_v350.py	0.074556	0.757635	0.698238	0.296875	0.020699	keep	Hybrid decoder keeps the baseline lookahead path unless a conservative board-only segmental pass wins the current score-gain gates, while following up the new minsep4 + boardcands4 + top4 plateau after beam8 through beam1 all preserved the improved board_exact surface, beam3 through beam1 gave back some secondary metrics, and narrowing only top_board_candidates from 4 to 3 on the active beam1 surface to test whether the max-width board search is causing that low-beam degradation or whether the beam1 branch still sits on the same broad board-width plateau.
autoresearch/snapshots/20260419T011038Z_hybrid_lookahead_segmental_drop1_boardcands3_ratio95_props16_top1_detect10_minsep4_thresh3_total150_permove125_m9p8957061767578125_r0_beam1_v351.py	0.074556	0.757635	0.698238	0.296875	0.020699	discard	Hybrid decoder keeps the baseline lookahead path unless a conservative board-only segmental pass wins the current score-gain gates, while following up the new minsep4 + beam1 surface after beam1 with boardcands3 matched the broader-board boardcands4 result exactly, and lowering only top_move_candidates from 4 to 1 on that active beam1 branch to test whether the low-beam secondary-metric drop is coming from unnecessary move-menu breadth or whether the old top-width plateau still survives even at beam1.
autoresearch/snapshots/20260419T011156Z_segmental_drop1_boardcands4_ratio95_props16_top4_detect10_minsep4_thresh3_m9p8957061767578125_r0_beam4_v349.py	0.055621	0.749109	0.704520	0.421875	0.034929	discard	Pure segmental decoder removes the hybrid lookahead-vs-segmental acceptance gate and runs the current best minsep4 + boardcands4 + top4 + beam4 segmental stack directly on every sequence to test whether the present 7.46% board-exact plateau is mainly caused by the hybrid gate rather than the segmental proposal surface itself.
autoresearch/snapshots/20260419T011231Z_hybrid_lookahead_segmental_drop1_boardcands4_ratio95_props16_top4_detect10_minsep4_thresh3_total150_permove150_m9p8957061767578125_r0_beam4_v350.py	0.074556	0.764405	0.723227	0.312500	0.019405	discard	Hybrid decoder keeps the baseline lookahead path unless a conservative board-only segmental pass wins the current score-gain gates, while following up the current beam4 minsep4 plateau after lower thresholds and pure segmental both reopened the false-change regime, and raising only the per-added-move score-gain gate from 125.0 to 150.0 on the active boardcands4 + top4 branch to test whether tighter acceptance can trim residual false positives without giving back the current board-exact plateau.
autoresearch/snapshots/20260419T011312Z_hybrid_lookahead_segmental_drop1_boardcands4_ratio95_props16_top4_detect10_minsep4_thresh4_total150_permove125_m9p8957061767578125_r0_beam4_v351.py	0.048521	0.759237	0.716436	0.328125	0.021992	discard	Hybrid decoder keeps the baseline lookahead path unless a conservative board-only segmental pass wins the current score-gain gates, while following up the current beam4 minsep4 plateau after lower thresholds and pure segmental both reopened the false-change regime, and raising only board_change_peak_threshold from 3/64 to 4/64 on the active boardcands4 + top4 branch to test whether slightly stricter board-change peak filtering trims residual false positives without giving back the current board-exact plateau.
autoresearch/snapshots/20260419T011352Z_hybrid_lookahead_segmental_drop1_boardcands2_ratio95_props16_top4_detect10_minsep4_thresh3_total150_permove125_m9p8957061767578125_r0_beam1_v352.py	0.074556	0.757635	0.698238	0.296875	0.020699	discard	Hybrid decoder keeps the baseline lookahead path unless a conservative board-only segmental pass wins the current score-gain gates, while following up the new minsep4 low-beam surface after beam1 with boardcands3 matched the broader-board boardcands4 result exactly and top1 also matched it exactly, and narrowing only top_board_candidates from that beam1 branch down to 2 to test whether the remaining low-beam secondary-metric drop starts only beyond the older boardcands2 surface or whether beam1 remains flat across the whole board-width range.
autoresearch/snapshots/20260419T011450Z_hybrid_lookahead_segmental_drop1_boardcands1_ratio95_props16_top4_detect10_minsep4_thresh3_total150_permove125_m9p8957061767578125_r0_beam1_v353.py	0.074556	0.757635	0.698238	0.296875	0.020699	discard	Hybrid decoder keeps the baseline lookahead path unless a conservative board-only segmental pass wins the current score-gain gates, while following up the new minsep4 low-beam surface after beam1 with boardcands2, boardcands3, and boardcands4 all matching exactly and top1 also matching that branch, and narrowing only top_board_candidates from that beam1 branch down to 1 to test whether the remaining low-beam secondary-metric drop finally changes at the last board-width edge or whether beam1 stays flat across the full board-width range.
autoresearch/snapshots/20260419T011607Z_hybrid_lookahead_segmental_drop1_boardcands4_ratio95_props16_top4_detect10_minsep4_thresh3_total150_permove125_m9p8957061767578125_r1_beam1_v354.py	0.074556	0.757635	0.698238	0.296875	0.020699	discard	Hybrid decoder keeps the baseline lookahead path unless a conservative board-only segmental pass wins the current score-gain gates, while following up the new minsep4 low-beam surface after beam1 with boardcands1 through boardcands4 all matching exactly and top1 also matching that branch, and lowering beam_size from 4 to 1 while widening only event_window_radius from 0 to 1 on the boardcands4 + top4 surface to test whether slightly broader temporal aggregation can recover the low-beam secondary-metric drop without giving back the preserved board-exact plateau.
autoresearch/snapshots/20260419T011708Z_hybrid_lookahead_segmental_drop1_boardcands4_ratio95_props16_top4_detect10_minsep4_secondarysep1_thresh3_total150_permove125_m9p8957061767578125_r0_beam4_v355.py	0.074556	0.761976	0.721833	0.312500	0.019405	discard	Hybrid decoder keeps the baseline lookahead path unless a conservative board-only segmental pass wins the current score-gain gates, while following up the current beam4 minsep4 plateau after the low-beam beam1 probes preserved board_exact but saturated across board width, top width, and event-window radius, and recent lower-threshold plus pure-segmental probes reopened worse regimes, and lowering only secondary event separation from 2 to 1 on the stable boardcands4 + top4 surface to test whether denser nearby secondary temporal alternatives recover ambiguity cases without reopening the false-change-heavy branch.
autoresearch/snapshots/20260419T011759Z_hybrid_lookahead_segmental_drop1_boardcands4_ratio90_props16_top4_detect10_minsep4_secondarysep1_thresh3_total150_permove125_m9p8957061767578125_r0_beam4_v356.py	0.048521	0.755051	0.715089	0.328125	0.021992	discard	Hybrid decoder keeps the baseline lookahead path unless a conservative board-only segmental pass wins the current score-gain gates, while following up the current beam4 minsep4 plateau after lowering secondary event separation from 2 to 1 preserved board_exact, recall, and false-change while materially improving the secondary metrics, and lowering only the secondary peak ratio from 0.95 to 0.90 on that denser-secondary branch to test whether admitting slightly weaker nearby temporal alternatives extends the new gain or reopens the older ambiguity-heavy failure mode.
autoresearch/snapshots/20260419T011847Z_hybrid_lookahead_segmental_drop1_boardcands4_ratio95_props16_top4_detect10_minsep4_secondarysep3_thresh3_total150_permove125_m9p8957061767578125_r0_beam4_v357.py	0.074556	0.765387	0.734447	0.312500	0.023286	discard	Hybrid decoder keeps the baseline lookahead path unless a conservative board-only segmental pass wins the current score-gain gates, while following up the current beam4 minsep4 plateau after lowering secondary event separation from 2 to 1 preserved board_exact, recall, and false-change while materially improving the secondary metrics, lowering the secondary peak ratio on that denser branch reopened a worse regime, and raising only secondary event separation from 2 to 3 on the stable boardcands4 + top4 surface to test whether sparser nearby secondary temporal alternatives help the same ambiguity cases without reopening the failure mode.
autoresearch/snapshots/20260419T011942Z_hybrid_lookahead_segmental_drop1_boardcands4_ratio98_props16_top4_detect10_minsep4_secondarysep1_thresh3_total150_permove125_m9p8957061767578125_r0_beam4_v358.py	0.074556	0.761976	0.721833	0.312500	0.019405	discard	Hybrid decoder keeps the baseline lookahead path unless a conservative board-only segmental pass wins the current score-gain gates, while following up the current beam4 minsep4 plateau after lowering secondary event separation from 2 to 1 preserved board_exact, recall, and false-change while materially improving the secondary metrics, lowering the secondary peak ratio to 0.90 reopened a worse regime, and raising secondary event separation to 3 worsened false-change, and lowering only secondary event separation from 2 to 1 while raising the secondary peak ratio from 0.95 to 0.98 on the stable boardcands4 + top4 surface to test whether a stricter denser-secondary branch keeps the v355 gain while avoiding the looser ambiguity-heavy failure mode.
autoresearch/snapshots/20260419T012049Z_hybrid_lookahead_segmental_drop1_boardcands4_ratio98_props16_top4_detect10_minsep4_secondarysep3_thresh3_total150_permove125_m9p8957061767578125_r0_beam4_v359.py	0.074556	0.765387	0.734447	0.312500	0.023286	discard	Hybrid decoder keeps the baseline lookahead path unless a conservative board-only segmental pass wins the current score-gain gates, while following up the current beam4 minsep4 plateau after lowering secondary event separation to 1 failed to beat the active surface, raising it to 3 preserved board_exact while improving the secondary metrics at the cost of worse false-change, and raising the secondary peak ratio on the denser-secondary branch to 0.98 was an exact no-op, and raising only the secondary peak ratio from 0.95 to 0.98 on the sparser secondarysep3 branch to test whether that broader-separated regime can keep its secondary-metric lift while trimming back the false-change regression.
autoresearch/snapshots/20260419T012152Z_hybrid_lookahead_segmental_drop1_boardcands4_ratio98_props16_top4_detect10_minsep4_secondarysep3_thresh3_total150_permove125_m9p8957061767578125_r0_beam4_v359.py	0.074556	0.765387	0.734447	0.312500	0.023286	discard	Hybrid decoder keeps the baseline lookahead path unless a conservative board-only segmental pass wins the current score-gain gates, while following up the current beam4 minsep4 plateau after lowering secondary event separation to 1 preserved board_exact, recall, and false-change while materially improving the secondary metrics, lowering the secondary peak ratio on that denser branch reopened a worse regime, and raising only the secondary peak ratio from 0.95 to 0.98 on the sparser secondarysep3 branch to test whether that broader-separated regime can keep its secondary-metric lift while trimming back the false-change regression.
autoresearch/snapshots/20260419T012309Z_hybrid_lookahead_segmental_drop1_boardcands4_ratio95_props16_top4_detect10_minsep4_secondarysep4_thresh3_total150_permove125_m9p8957061767578125_r0_beam4_v360.py	0.074556	0.765387	0.734447	0.312500	0.023286	discard	Hybrid decoder keeps the baseline lookahead path unless a conservative board-only segmental pass wins the current score-gain gates, while following up the current beam4 minsep4 plateau after lowering secondary event separation to 1 preserved board_exact, recall, and false-change while materially improving the secondary metrics, lowering the secondary peak ratio on that denser branch reopened a worse regime, and raising secondary event separation to 3 further improved the secondary metrics but worsened false-change, and raising only secondary event separation from 3 to 4 on that sparse-secondary branch to test whether the broader-separated regime keeps improving ambiguity resolution or finally rolls over.
