snapshot	board_exact	non_empty_accuracy	macro_f1	move_recall	false_change_rate	status	description
autoresearch/snapshots/20260419T034346Z_hybrid_lookahead_segmental_drop1_boardcands3_ratio95_props15_top1_detect10_lwindow1_minsep4_secsep3_thresh3_total150_permove125_lmargin9p5_m9p8957061767578125_r0_beam4_v472.py	0.074556	0.761563	0.720671	0.265625	0.019405	discard	Hybrid decoder keeps the baseline lookahead path unless a conservative board-only segmental pass wins the current score-gain gates, while following up the kept window1 branch after lowering lookahead window from 2 to 1 on the 9.5-margin baseline opened a lower-false-change but lower-recall tradeoff, the secsep3 shelf with props15 improved recall and false-change versus the higher-secondary shelf, boardcands3 and boardcands4 were exact on that props15 branch while boardcands2 and boardcands1 weakened it, and lowering only top-move breadth from 4 to 1 on the boardcands3 + secsep3 + props15 branch to test whether that tighter-budget tradeoff depends on wider move breadth or stays intact with a narrower move menu.
autoresearch/snapshots/20260419T034532Z_hybrid_lookahead_segmental_drop1_boardcands3_ratio95_props15_top1_detect10_lwindow1_minsep4_secsep3_thresh3_total150_permove125_lmargin9p5_m9p8957061767578125_r0_beam4_v472.py	0.074556	0.761563	0.720671	0.265625	0.019405	discard	Hybrid decoder keeps the baseline lookahead path unless a conservative board-only segmental pass wins the current score-gain gates, while following up the kept window1 branch after lowering lookahead window from 2 to 1 on the 9.5-margin baseline opened a lower-false-change but lower-recall tradeoff, the secsep3 shelf with props15 improved recall and false-change versus the higher-secondary shelf, boardcands3 and boardcands4 were exact on that props15 branch while boardcands2 and boardcands1 weakened it, and lowering only top-move breadth from 4 to 1 on the boardcands3 + secsep3 + props15 branch to test whether that tighter-budget tradeoff depends on wider move breadth or stays intact with a narrower move menu.
autoresearch/snapshots/20260419T034646Z_hybrid_lookahead_segmental_drop1_boardcands3_ratio95_props15_top4_detect10_lwindow1_minsep4_secsep4_thresh3_total150_permove125_lmargin9p5_m9p8957061767578125_r0_beam4_v473.py	0.074556	0.761563	0.720671	0.265625	0.019405	discard	Hybrid decoder keeps the baseline lookahead path unless a conservative board-only segmental pass wins the current score-gain gates, while following up the kept window1 branch after lowering lookahead window from 2 to 1 on the 9.5-margin baseline opened a lower-false-change but lower-recall tradeoff, the secsep3 shelf with props15 improved recall and false-change versus the higher-secondary shelf, boardcands3 was the best board-width point on the stronger-secondary branch and also stayed optimal on the tighter props15 tradeoff branch, and raising only secondary minimum event separation from 3 to 4 on that boardcands3 + props15 branch to test whether the tighter-budget tradeoff keeps improving along the upper-side secondary-spacing shelf or whether secsep3 is already the local optimum there.
autoresearch/snapshots/20260419T034813Z_hybrid_lookahead_segmental_drop1_boardcands4_ratio95_props15_top4_detect10_lwindow1_minsep4_thresh3_total150_permove125_lmargin9p5_m9p8957061767578125_r0_beam4_v474.py	0.074556	0.787918	0.754706	0.265625	0.020699	discard	Hybrid decoder keeps the baseline lookahead path unless a conservative board-only segmental pass wins the current score-gain gates, while following up the kept window1 branch after lowering lookahead window from 2 to 1 on the 9.5-margin baseline opened a lower-false-change but lower-recall tradeoff, many nearby margin, handoff, move-width, board-width, temporal-radius, and upper-side beam probes on that branch stayed exact, and on the separate secsep3 side branch lowering max_event_proposals from 16 to 15 improved recall and false-change while giving back some secondary lift, and lowering only max_event_proposals from 16 to 15 on the restored plain window1 branch to test whether that tighter proposal budget alone already improves the kept branch or only helps in combination with the higher-secondary secsep3 shelf.
autoresearch/snapshots/20260419T034906Z_hybrid_lookahead_segmental_drop1_boardcands3_ratio95_props15_top4_detect10_lwindow1_minsep4_thresh3_total150_permove125_lmargin9p5_m9p8957061767578125_r0_beam4_v475.py	0.074556	0.764870	0.721733	0.265625	0.019405	discard	Hybrid decoder keeps the baseline lookahead path unless a conservative board-only segmental pass wins the current score-gain gates, while following up the kept window1 branch after lowering lookahead window from 2 to 1 on the 9.5-margin baseline opened a lower-false-change but lower-recall tradeoff, many nearby margin, handoff, move-width, board-width, temporal-radius, and upper-side beam probes on that branch stayed exact, and lowering only max_event_proposals from 16 to 15 on the restored plain window1 branch improved recall and secondary metrics but worsened false-change, and lowering only top-board breadth from 4 to 3 alongside that plain props15 branch to test whether the tighter proposal budget has a narrower board-width sweet spot that can keep most of the recall gain while recovering some false-change.
autoresearch/snapshots/20260419T035002Z_hybrid_lookahead_segmental_drop1_boardcands4_ratio95_props15_top1_detect10_lwindow1_minsep4_thresh3_total150_permove125_lmargin9p5_m9p8957061767578125_r0_beam4_v476.py	0.074556	0.787918	0.754706	0.265625	0.020699	discard	Hybrid decoder keeps the baseline lookahead path unless a conservative board-only segmental pass wins the current score-gain gates, while following up the kept window1 branch after lowering lookahead window from 2 to 1 on the 9.5-margin baseline opened a lower-false-change but lower-recall tradeoff, many nearby margin, handoff, move-width, board-width, temporal-radius, and upper-side beam probes on that branch stayed exact, and lowering only max_event_proposals from 16 to 15 on the restored plain window1 branch improved recall and secondary metrics but worsened false-change, and lowering only top-move breadth from 4 to 1 alongside that plain props15 branch to test whether the tighter proposal budget depends on wider move breadth or can keep most of its recall gain while trimming false-change with a narrower move menu.
autoresearch/snapshots/20260419T035100Z_hybrid_lookahead_segmental_drop1_boardcands2_ratio95_props15_top4_detect10_lwindow1_minsep4_thresh3_total150_permove125_lmargin9p5_m9p8957061767578125_r0_beam4_v477.py	0.074556	0.763992	0.714037	0.265625	0.019405	discard	Hybrid decoder keeps the baseline lookahead path unless a conservative board-only segmental pass wins the current score-gain gates, while following up the kept window1 branch after lowering lookahead window from 2 to 1 on the 9.5-margin baseline opened a lower-false-change but lower-recall tradeoff, many nearby margin, handoff, move-width, board-width, temporal-radius, and upper-side beam probes on that branch stayed exact, and lowering only max_event_proposals from 16 to 15 on the restored plain window1 branch improved recall and secondary metrics but worsened false-change, while additionally narrowing top-board breadth from 4 to 3 recovered the lower false-change without hurting recall, and lowering only top-board breadth one step further from 3 to 2 on that plain props15 branch to test whether the narrower board menu can preserve the recovered false-change while holding the recall gain or whether boardcands3 is already the local sweet spot.
autoresearch/snapshots/20260419T035216Z_hybrid_lookahead_segmental_drop1_boardcands4_ratio95_props15_top4_detect10_lwindow1_minsep4_thresh3_total150_permove125_lmargin9p5_m9p8957061767578125_r1_beam4_v478.py	0.074556	0.787918	0.754706	0.265625	0.020699	discard	Hybrid decoder keeps the baseline lookahead path unless a conservative board-only segmental pass wins the current score-gain gates, while following up the kept window1 branch after lowering lookahead window from 2 to 1 on the 9.5-margin baseline opened a lower-false-change but lower-recall tradeoff, many nearby margin, handoff, move-width, board-width, and temporal-radius probes on that branch stayed exact, and lowering only max_event_proposals from 16 to 15 on the restored plain window1 branch improved recall and secondary metrics but worsened false-change, and adding only segmental event window radius 1 on that plain props15 branch to test whether a little extra temporal context can keep the recall gain while recovering some of the false-change regression.
autoresearch/snapshots/20260419T035312Z_hybrid_lookahead_segmental_drop1_boardcands1_ratio95_props15_top4_detect10_lwindow1_minsep4_thresh3_total150_permove125_lmargin9p5_m9p8957061767578125_r0_beam4_v479.py	0.074556	0.740220	0.689657	0.250000	0.019405	discard	Hybrid decoder keeps the baseline lookahead path unless a conservative board-only segmental pass wins the current score-gain gates, while following up the kept window1 branch after lowering lookahead window from 2 to 1 on the 9.5-margin baseline opened a lower-false-change but lower-recall tradeoff, many nearby margin, handoff, move-width, board-width, temporal-radius, and upper-side beam probes on that branch stayed exact, and lowering only max_event_proposals from 16 to 15 on the restored plain window1 branch improved recall and secondary metrics but worsened false-change, while narrowing top-board breadth from 4 to 3 recovered the lower false-change without hurting recall and narrowing further to 2 kept that false-change but weakened secondaries, and lowering only top-board breadth one step further from 3 to 1 on that plain props15 branch to complete the local board-width curve and test whether boardcands3 is truly the sweet spot or whether boardcands1 changes the tradeoff again.
autoresearch/snapshots/20260419T035439Z_hybrid_lookahead_segmental_drop1_boardcands3_ratio95_props15_top1_detect10_lwindow1_minsep4_thresh3_total150_permove125_lmargin9p5_m9p8957061767578125_r0_beam4_v480.py	0.074556	0.764870	0.721733	0.265625	0.019405	discard	Hybrid decoder keeps the baseline lookahead path unless a conservative board-only segmental pass wins the current score-gain gates, while following up the kept window1 branch after lowering lookahead window from 2 to 1 on the 9.5-margin baseline opened a lower-false-change but lower-recall tradeoff, many nearby margin, handoff, move-width, board-width, temporal-radius, and upper-side beam probes on that branch stayed exact, and lowering only max_event_proposals from 16 to 15 on the restored plain window1 branch improved recall and secondary metrics but worsened false-change, while narrowing top-board breadth from 4 to 3 recovered the lower false-change without hurting recall, and lowering only top-move breadth from 4 to 1 on that boardcands3 + props15 branch to test whether the recovered lower-false-change tradeoff depends on wider move breadth or stays intact with a narrower move menu.
autoresearch/snapshots/20260419T035545Z_hybrid_lookahead_segmental_drop1_boardcands3_ratio95_props14_top4_detect10_lwindow1_minsep4_thresh3_total150_permove125_lmargin9p5_m9p8957061767578125_r0_beam4_v481.py	0.074556	0.764870	0.721875	0.265625	0.019405	discard	Hybrid decoder keeps the baseline lookahead path unless a conservative board-only segmental pass wins the current score-gain gates, while following up the kept window1 branch after lowering lookahead window from 2 to 1 on the 9.5-margin baseline opened a lower-false-change but lower-recall tradeoff, many nearby margin, handoff, move-width, board-width, temporal-radius, and upper-side beam probes on that branch stayed exact, and lowering only max_event_proposals from 16 to 15 on the restored plain window1 branch improved recall and secondary metrics but worsened false-change, while additionally narrowing top-board breadth from 4 to 3 recovered the lower false-change without hurting recall, and lowering only max_event_proposals one step further from 15 to 14 on that boardcands3 plain props15 branch to test whether the tighter proposal budget can keep part of the recovered tradeoff or collapses back toward the lower-recall regime.
autoresearch/snapshots/20260419T035641Z_hybrid_lookahead_segmental_drop1_boardcands3_ratio95_props13_top4_detect10_lwindow1_minsep4_thresh3_total150_permove125_lmargin9p5_m9p8957061767578125_r0_beam4_v482.py	0.074556	0.766162	0.722185	0.250000	0.019405	discard	Hybrid decoder keeps the baseline lookahead path unless a conservative board-only segmental pass wins the current score-gain gates, while following up the kept window1 branch after lowering lookahead window from 2 to 1 on the 9.5-margin baseline opened a lower-false-change but lower-recall tradeoff, many nearby margin, handoff, move-width, board-width, temporal-radius, and upper-side beam probes on that branch stayed exact, and lowering max_event_proposals from 16 to 15 on the restored plain window1 branch improved recall and secondary metrics but worsened false-change, while additionally narrowing top-board breadth from 4 to 3 recovered the lower false-change without hurting recall and lowering max_event_proposals one step further from 15 to 14 kept that recovered tradeoff with slightly better secondary metrics, and lowering only max_event_proposals one more step from 14 to 13 on that boardcands3 plain props branch to test whether the tighter proposal budget remains on the same recovered tradeoff shelf or collapses below 14.
autoresearch/snapshots/20260419T035730Z_hybrid_lookahead_segmental_drop1_boardcands3_ratio95_props12_top4_detect10_lwindow1_minsep4_thresh3_total150_permove125_lmargin9p5_m9p8957061767578125_r0_beam4_v483.py	0.048521	0.786729	0.742430	0.218750	0.014230	discard	Hybrid decoder keeps the baseline lookahead path unless a conservative board-only segmental pass wins the current score-gain gates, while following up the kept window1 branch after lowering lookahead window from 2 to 1 on the 9.5-margin baseline opened a lower-false-change but lower-recall tradeoff, many nearby margin, handoff, move-width, board-width, temporal-radius, and upper-side beam probes on that branch stayed exact, and lowering max_event_proposals from 16 to 15 on the restored plain window1 branch improved recall and secondary metrics but worsened false-change, while additionally narrowing top-board breadth from 4 to 3 recovered the lower false-change without hurting recall and lowering max_event_proposals from 15 to 14 and then 13 kept that recovered tradeoff while slightly improving secondary metrics, and lowering only max_event_proposals one more step from 13 to 12 on that boardcands3 plain props branch to test whether the tighter proposal budget remains on the same recovered tradeoff shelf or finally collapses below 13.
autoresearch/snapshots/20260419T040350Z_hybrid_lookahead_segmental_drop1_boardcands4_ratio95_props13_top4_detect10_lwindow1_minsep4_thresh3_total150_permove125_lmargin9p5_m9p8957061767578125_r0_beam4_v484.py	0.074556	0.789778	0.755530	0.250000	0.020699	discard	Hybrid decoder keeps the baseline lookahead path unless a conservative board-only segmental pass wins the current score-gain gates, while following up the kept window1 branch after lowering lookahead window from 2 to 1 on the 9.5-margin baseline opened a lower-false-change but lower-recall tradeoff, many nearby margin, handoff, move-width, board-width, temporal-radius, and upper-side beam probes on that branch stayed exact, and lowering max_event_proposals from 16 to 15 on the restored plain window1 branch improved recall and secondary metrics but worsened false-change, while additionally narrowing top-board breadth from 4 to 3 recovered the lower false-change without hurting recall, and lowering max_event_proposals from 15 to 14 and then 13 on that boardcands3 plain props branch kept the recovered false-change but gave back recall before collapsing at 12, and raising only top-board breadth from 3 back to 4 on the props13 branch to test whether wider board breadth can recover some recall there without immediately reopening the worse false-change regime.
autoresearch/snapshots/20260419T040444Z_hybrid_lookahead_segmental_drop1_boardcands2_ratio95_props13_top4_detect10_lwindow1_minsep4_thresh3_total150_permove125_lmargin9p5_m9p8957061767578125_r0_beam4_v485.py	0.074556	0.765283	0.714491	0.250000	0.019405	discard	Hybrid decoder keeps the baseline lookahead path unless a conservative board-only segmental pass wins the current score-gain gates, while following up the kept window1 branch after lowering lookahead window from 2 to 1 on the 9.5-margin baseline opened a lower-false-change but lower-recall tradeoff, many nearby margin, handoff, move-width, board-width, temporal-radius, and upper-side beam probes on that branch stayed exact, and lowering max_event_proposals from 16 to 15 on the restored plain window1 branch improved recall and secondary metrics but worsened false-change, while additionally narrowing top-board breadth from 4 to 3 recovered the lower false-change without hurting recall, lowering max_event_proposals from 15 to 14 and then 13 on that boardcands3 plain props branch kept the recovered false-change but gave back recall, lowering to 12 collapsed, and restoring board breadth from 3 back to 4 at props13 reopened the worse false-change regime without recovering recall, and lowering only top-board breadth from 3 to 2 on the props13 branch to test whether boardcands2 is an intermediate sweet spot that keeps the lower false-change while improving the secondary metrics over boardcands3.
autoresearch/snapshots/20260419T040606Z_hybrid_lookahead_segmental_drop1_boardcands3_ratio95_props14_top1_detect10_lwindow1_minsep4_thresh3_total150_permove125_lmargin9p5_m9p8957061767578125_r0_beam4_v486.py	0.074556	0.764870	0.721875	0.265625	0.019405	discard	Hybrid decoder keeps the baseline lookahead path unless a conservative board-only segmental pass wins the current score-gain gates, while following up the kept window1 branch after lowering lookahead window from 2 to 1 on the 9.5-margin baseline opened a lower-false-change but lower-recall tradeoff, many nearby margin, handoff, move-width, board-width, temporal-radius, and upper-side beam probes on that branch stayed exact, and lowering only max_event_proposals from 16 to 15 on the restored plain window1 branch improved recall and secondary metrics but worsened false-change, while additionally narrowing top-board breadth from 4 to 3 recovered the lower false-change without hurting recall, lowering max_event_proposals one step further from 15 to 14 on that boardcands3 plain props branch kept that recovered tradeoff, lowering to 13 gave back recall, and the follow-up props13 board-width probes showed boardcands3 was still the best local point there, and lowering only top-move breadth from 4 to 1 on the stronger boardcands3 + props14 branch to test whether that recovered lower-false-change tradeoff depends on wider move breadth or stays intact with the narrower move menu.
autoresearch/snapshots/20260419T040654Z_hybrid_lookahead_segmental_drop1_boardcands4_ratio95_props14_top4_detect10_lwindow1_minsep4_thresh3_total150_permove125_lmargin9p5_m9p8957061767578125_r0_beam4_v487.py	0.074556	0.787918	0.754927	0.265625	0.020699	discard	Hybrid decoder keeps the baseline lookahead path unless a conservative board-only segmental pass wins the current score-gain gates, while following up the kept window1 branch after lowering lookahead window from 2 to 1 on the 9.5-margin baseline opened a lower-false-change but lower-recall tradeoff, many nearby margin, handoff, move-width, board-width, temporal-radius, and upper-side beam probes on that branch stayed exact, and lowering only max_event_proposals from 16 to 15 on the restored plain window1 branch improved recall and secondary metrics but worsened false-change, while additionally narrowing top-board breadth from 4 to 3 recovered the lower false-change without hurting recall, lowering only max_event_proposals one step further from 15 to 14 on that boardcands3 plain props branch kept that recovered tradeoff, and lowering top-move breadth from 4 to 1 there was an exact no-op, and restoring only top-board breadth from 3 back to 4 on the stronger props14 branch to test whether the extra proposal-budget tightening changes the plain branch's board-width sweet spot or still reopens the worse false-change regime.
