snapshot	board_exact	non_empty_accuracy	macro_f1	move_recall	false_change_rate	status	description
autoresearch/snapshots/20260419T031509Z_hybrid_lookahead_segmental_drop1_boardcands4_ratio95_props16_top4_detect10_lwindow1_minsep4_secsep3_thresh3_total150_permove125_lmargin9p5_m9p8957061767578125_r0_beam4_v452.py	0.074556	0.765232	0.733716	0.250000	0.021992	discard	Hybrid decoder keeps the baseline lookahead path unless a conservative board-only segmental pass wins the current score-gain gates, while following up the kept window1 branch after lowering lookahead window from 2 to 1 on the 9.5-margin baseline opened a lower-false-change but lower-recall tradeoff, many nearby margin, handoff, move-width, board-width, and segmental temporal probes on that branch stayed exact, and lowering only the secondary minimum event separation from 2 to 3 on the active window1 branch to test whether sparser secondary temporal proposals can recover some secondary quality on that tradeoff without giving up its lower false-change profile.
autoresearch/snapshots/20260419T031615Z_hybrid_lookahead_segmental_drop1_boardcands4_ratio95_props16_top4_detect10_lwindow1_minsep4_secsep4_thresh3_total150_permove125_lmargin9p5_m9p8957061767578125_r0_beam4_v453.py	0.074556	0.765232	0.733716	0.250000	0.021992	discard	Hybrid decoder keeps the baseline lookahead path unless a conservative board-only segmental pass wins the current score-gain gates, while following up the kept window1 branch after lowering lookahead window from 2 to 1 on the 9.5-margin baseline opened a lower-false-change but lower-recall tradeoff, many nearby margin, handoff, move-width, board-width, and segmental temporal probes on that branch stayed exact, and raising secondary minimum event separation from 2 to 3 improved secondary metrics but worsened false-change, and raising only that secondary spacing one step further to 4 on the active window1 branch to test whether the higher-secondary tradeoff is already saturated at 3 or whether the same branch persists at 4.
autoresearch/snapshots/20260419T031719Z_hybrid_lookahead_segmental_drop1_boardcands4_ratio95_props16_top4_detect10_lwindow1_minsep4_secsep5_thresh3_total150_permove125_lmargin9p5_m9p8957061767578125_r0_beam4_v454.py	0.074556	0.765232	0.733716	0.250000	0.021992	discard	Hybrid decoder keeps the baseline lookahead path unless a conservative board-only segmental pass wins the current score-gain gates, while following up the kept window1 branch after lowering lookahead window from 2 to 1 on the 9.5-margin baseline opened a lower-false-change but lower-recall tradeoff, many nearby margin, handoff, move-width, board-width, and segmental temporal probes on that branch stayed exact, and raising secondary minimum event separation from 2 to both 3 and 4 produced the same higher-secondary but higher-false-change tradeoff, and raising only that secondary spacing one step further to 5 on the active window1 branch to test whether that higher-secondary tradeoff is still on an upper-side plateau or breaks beyond the secsep3-4 shelf.
autoresearch/snapshots/20260419T031831Z_hybrid_lookahead_segmental_drop1_boardcands4_ratio95_props16_top4_detect10_lwindow1_minsep4_thresh3_total150_permove125_lmargin9p5_m9p8957061767578125_r2_beam4_v455.py	0.074556	0.764250	0.722490	0.250000	0.018111	discard	Hybrid decoder keeps the baseline lookahead path unless a conservative board-only segmental pass wins the current score-gain gates, while following up the kept window1 branch after lowering lookahead window from 2 to 1 on the 9.5-margin baseline opened a lower-false-change but lower-recall tradeoff, many nearby margin, handoff, move-width, board-width, and segmental temporal probes on that branch stayed exact, event-window radius 1 was also an exact no-op there, and raising only segmental event window radius from 0 to 2 on the active window1 branch to test whether the shorter-lookahead tradeoff stays flat across the full allowed segmental temporal-context range or finally changes at the upper radius cap.
autoresearch/snapshots/20260419T031934Z_hybrid_lookahead_segmental_drop1_boardcands4_ratio95_props16_top4_detect10_lwindow1_minsep4_thresh3_total150_permove125_lmargin9p5_m9p8957061767578125_r0_beam3_v456.py	0.074556	0.764250	0.722722	0.234375	0.019405	discard	Hybrid decoder keeps the baseline lookahead path unless a conservative board-only segmental pass wins the current score-gain gates, while following up the kept window1 branch after lowering lookahead window from 2 to 1 on the 9.5-margin baseline opened a lower-false-change but lower-recall tradeoff, and many nearby margin, handoff, move-width, board-width, and segmental temporal probes on that branch stayed exact, and lowering only beam size from 4 to 3 on the active window1 branch to test whether the shorter-lookahead tradeoff depends on the current beam width or whether the branch persists at a cheaper search depth.
autoresearch/snapshots/20260419T032622Z_hybrid_lookahead_segmental_drop1_boardcands4_ratio95_props16_top4_detect10_lwindow1_minsep4_thresh3_total150_permove125_lmargin9p5_m9p8957061767578125_r0_beam5_v457.py	0.074556	0.764250	0.722490	0.250000	0.018111	discard	Hybrid decoder keeps the baseline lookahead path unless a conservative board-only segmental pass wins the current score-gain gates, while following up the kept window1 branch after lowering lookahead window from 2 to 1 on the 9.5-margin baseline opened a lower-false-change but lower-recall tradeoff, many nearby margin, handoff, move-width, board-width, and segmental temporal probes on that branch stayed exact, and lowering beam size from 4 to 3 degraded recall and false-change, and raising only beam size from 4 to 5 on the active window1 branch to test whether beam4 is already the local optimum or whether the shorter-lookahead tradeoff stays on an upper-side beam plateau.
autoresearch/snapshots/20260419T032706Z_hybrid_lookahead_segmental_drop1_boardcands4_ratio95_props16_top4_detect10_lwindow1_minsep4_thresh3_total150_permove125_lmargin9p5_m9p8957061767578125_r0_beam6_v458.py	0.074556	0.764250	0.722490	0.250000	0.018111	discard	Hybrid decoder keeps the baseline lookahead path unless a conservative board-only segmental pass wins the current score-gain gates, while following up the kept window1 branch after lowering lookahead window from 2 to 1 on the 9.5-margin baseline opened a lower-false-change but lower-recall tradeoff, many nearby margin, handoff, move-width, board-width, and segmental temporal probes on that branch stayed exact, lowering beam size from 4 to 3 degraded recall and false-change, and raising beam size from 4 to 5 stayed exact, and raising only beam size from 4 to 6 on the active window1 branch to test whether the shorter-lookahead tradeoff remains on an upper-side beam plateau beyond beam5 or whether beam5 was the edge of that exact region.
autoresearch/snapshots/20260419T032757Z_hybrid_lookahead_segmental_drop1_boardcands4_ratio96_props16_top4_detect10_lwindow1_minsep4_secsep3_thresh3_total150_permove125_lmargin9p5_m9p8957061767578125_r0_beam4_v459.py	0.074556	0.765232	0.733716	0.250000	0.021992	discard	Hybrid decoder keeps the baseline lookahead path unless a conservative board-only segmental pass wins the current score-gain gates, while following up the kept window1 branch after lowering lookahead window from 2 to 1 on the 9.5-margin baseline opened a lower-false-change but lower-recall tradeoff, many nearby margin, handoff, move-width, board-width, temporal-radius, and upper-side beam probes on that branch stayed exact, and the secsep3-through-secsep5 shelf improved secondary metrics but worsened false-change at the default ratio95, and combining only secondary minimum event separation 3 with a slightly stricter secondary peak ratio of 0.96 on the active window1 branch to test whether that higher-secondary shelf can be nudged back toward the kept false-change profile without giving up its secondary lift.
autoresearch/snapshots/20260419T032911Z_hybrid_lookahead_segmental_drop1_boardcands4_ratio95_props16_top4_detect10_lwindow1_minsep4_secsep6_thresh3_total150_permove125_lmargin9p5_m9p8957061767578125_r0_beam4_v460.py	0.074556	0.765232	0.733716	0.250000	0.021992	discard	Hybrid decoder keeps the baseline lookahead path unless a conservative board-only segmental pass wins the current score-gain gates, while following up the kept window1 branch after lowering lookahead window from 2 to 1 on the 9.5-margin baseline opened a lower-false-change but lower-recall tradeoff, many nearby margin, handoff, move-width, board-width, temporal-radius, and upper-side beam probes on that branch stayed exact, and the secsep3-through-secsep5 shelf stayed on the same higher-secondary but higher-false-change branch even with a slightly stricter secondary peak ratio of 0.96, and raising only secondary minimum event separation from 2 to 6 on the active window1 branch to test whether that upper-side secondary-spacing shelf is still active beyond the currently mapped secsep3-through-secsep5 range or finally breaks at 6.
autoresearch/snapshots/20260419T033103Z_hybrid_lookahead_segmental_drop1_boardcands3_ratio95_props16_top4_detect10_lwindow1_minsep4_secsep3_thresh3_total150_permove125_lmargin9p5_m9p8957061767578125_r0_beam4_v461.py	0.074556	0.780683	0.746087	0.250000	0.021992	discard	Hybrid decoder keeps the baseline lookahead path unless a conservative board-only segmental pass wins the current score-gain gates, while following up the kept window1 branch after lowering lookahead window from 2 to 1 on the 9.5-margin baseline opened a lower-false-change but lower-recall tradeoff, many nearby margin, handoff, move-width, board-width, temporal-radius, and upper-side beam probes on that branch stayed exact, and the secsep3-through-secsep6 shelf stayed on the same higher-secondary but higher-false-change branch, and lowering only top-board breadth from 4 to 3 alongside secondary minimum event separation 3 on the active window1 branch to test whether the higher-secondary shelf has a narrower board-width sweet spot rather than treating boardcands3 and boardcands4 as equivalent there.
autoresearch/snapshots/20260419T033221Z_hybrid_lookahead_segmental_drop1_boardcands4_ratio95_props16_top4_detect10_lwindow1_minsep4_secsep3_thresh3_total150_permove125_lmargin9p5_m9p8957061767578125_r2_beam4_v462.py	0.074556	0.765232	0.733716	0.250000	0.021992	discard	Hybrid decoder keeps the baseline lookahead path unless a conservative board-only segmental pass wins the current score-gain gates, while following up the kept window1 branch after lowering lookahead window from 2 to 1 on the 9.5-margin baseline opened a lower-false-change but lower-recall tradeoff, many nearby margin, handoff, move-width, board-width, temporal-radius, and upper-side beam probes on that branch stayed exact, and the secsep3-through-secsep6 shelf stayed on the same higher-secondary but higher-false-change branch, and combining only secondary minimum event separation 3 with segmental event window radius 2 on the active window1 branch to test whether that higher-secondary shelf is also flat across the full allowed segmental temporal-context range or changes at the upper radius cap.
autoresearch/snapshots/20260419T033311Z_hybrid_lookahead_segmental_drop1_boardcands2_ratio95_props16_top4_detect10_lwindow1_minsep4_secsep3_thresh3_total150_permove125_lmargin9p5_m9p8957061767578125_r0_beam4_v463.py	0.074556	0.750659	0.717681	0.250000	0.021992	discard	Hybrid decoder keeps the baseline lookahead path unless a conservative board-only segmental pass wins the current score-gain gates, while following up the kept window1 branch after lowering lookahead window from 2 to 1 on the 9.5-margin baseline opened a lower-false-change but lower-recall tradeoff, many nearby margin, handoff, move-width, board-width, temporal-radius, and upper-side beam probes on that branch stayed exact, the secsep3-through-secsep6 shelf stayed on the same higher-secondary but higher-false-change branch, and narrowing that shelf from boardcands4 to boardcands3 further improved secondary metrics at unchanged board_exact, recall, and false-change, and lowering only top-board breadth from 4 to 2 alongside secondary minimum event separation 3 on the active window1 branch to test whether that improved secsep3 shelf continues to sharpen at a narrower board menu or whether boardcands3 is the local sweet spot.
autoresearch/snapshots/20260419T033430Z_hybrid_lookahead_segmental_drop1_boardcands1_ratio95_props16_top4_detect10_lwindow1_minsep4_secsep3_thresh3_total150_permove125_lmargin9p5_m9p8957061767578125_r0_beam4_v464.py	0.074556	0.741254	0.708853	0.250000	0.021992	discard	Hybrid decoder keeps the baseline lookahead path unless a conservative board-only segmental pass wins the current score-gain gates, while following up the kept window1 branch after lowering lookahead window from 2 to 1 on the 9.5-margin baseline opened a lower-false-change but lower-recall tradeoff, the secsep3-through-secsep6 shelf stayed on the same higher-secondary but higher-false-change branch, narrowing that shelf from boardcands4 to boardcands3 further improved secondary metrics at unchanged board_exact, recall, and false-change, and narrowing further to boardcands2 broke those secondary gains, and lowering only top-board breadth from 4 to 1 alongside secondary minimum event separation 3 on the active window1 branch to complete the local secsep3 board-width curve and test whether a very narrow board menu can recover any false-change while preserving useful secondary lift or whether boardcands3 is the true sweet spot.
autoresearch/snapshots/20260419T033542Z_hybrid_lookahead_segmental_drop1_boardcands3_ratio96_props16_top4_detect10_lwindow1_minsep4_secsep3_thresh3_total150_permove125_lmargin9p5_m9p8957061767578125_r0_beam4_v465.py	0.074556	0.780683	0.746087	0.250000	0.021992	discard	Hybrid decoder keeps the baseline lookahead path unless a conservative board-only segmental pass wins the current score-gain gates, while following up the kept window1 branch after lowering lookahead window from 2 to 1 on the 9.5-margin baseline opened a lower-false-change but lower-recall tradeoff, the secsep3-through-secsep6 shelf stayed on the same higher-secondary but higher-false-change branch, narrowing that shelf from boardcands4 to boardcands3 further improved secondary metrics at unchanged board_exact, recall, and false-change, while narrowing further to boardcands2 and boardcands1 broke those gains, and combining only that boardcands3 + secsep3 sweet spot with a slightly stricter secondary peak ratio of 0.96 on the active window1 branch to test whether the improved secondary shelf can recover any false-change without giving back its stronger secondary metrics.
autoresearch/snapshots/20260419T033635Z_hybrid_lookahead_segmental_drop1_boardcands3_ratio95_props16_top1_detect10_lwindow1_minsep4_secsep3_thresh3_total150_permove125_lmargin9p5_m9p8957061767578125_r0_beam4_v466.py	0.074556	0.780683	0.746087	0.250000	0.021992	discard	Hybrid decoder keeps the baseline lookahead path unless a conservative board-only segmental pass wins the current score-gain gates, while following up the kept window1 branch after lowering lookahead window from 2 to 1 on the 9.5-margin baseline opened a lower-false-change but lower-recall tradeoff, the secsep3-through-secsep6 shelf stayed on the same higher-secondary but higher-false-change branch, narrowing that shelf from boardcands4 to boardcands3 further improved secondary metrics at unchanged board_exact, recall, and false-change, while boardcands2 and boardcands1 broke those gains and tightening secondary_peak_ratio to 0.96 was an exact no-op, and lowering only top-move breadth from 4 to 1 on that boardcands3 + secsep3 sweet spot to test whether the stronger secondary shelf depends on wider move breadth or persists with a narrower move menu that might trim false-change.
autoresearch/snapshots/20260419T033743Z_hybrid_lookahead_segmental_drop1_boardcands3_ratio95_props15_top4_detect10_lwindow1_minsep4_secsep3_thresh3_total150_permove125_lmargin9p5_m9p8957061767578125_r0_beam4_v467.py	0.074556	0.761563	0.720671	0.265625	0.019405	discard	Hybrid decoder keeps the baseline lookahead path unless a conservative board-only segmental pass wins the current score-gain gates, while following up the kept window1 branch after lowering lookahead window from 2 to 1 on the 9.5-margin baseline opened a lower-false-change but lower-recall tradeoff, the secsep3-through-secsep6 shelf stayed on the same higher-secondary but higher-false-change branch, narrowing that shelf from boardcands4 to boardcands3 further improved secondary metrics at unchanged board_exact, recall, and false-change, while tightening secondary peak ratio and narrowing top-move breadth were exact no-ops there, and lowering only max_event_proposals from 16 to 15 on that boardcands3 + secsep3 sweet spot to test whether a slightly tighter proposal budget can keep most of the stronger secondary metrics while trimming the shelf's higher false-change profile.
autoresearch/snapshots/20260419T033837Z_hybrid_lookahead_segmental_drop1_boardcands3_ratio95_props14_top4_detect10_lwindow1_minsep4_secsep3_thresh3_total150_permove125_lmargin9p5_m9p8957061767578125_r0_beam4_v468.py	0.074556	0.764870	0.721875	0.250000	0.020699	discard	Hybrid decoder keeps the baseline lookahead path unless a conservative board-only segmental pass wins the current score-gain gates, while following up the kept window1 branch after lowering lookahead window from 2 to 1 on the 9.5-margin baseline opened a lower-false-change but lower-recall tradeoff, the secsep3-through-secsep6 shelf stayed on the same higher-secondary but higher-false-change branch, narrowing that shelf from boardcands4 to boardcands3 improved secondaries at unchanged board_exact, recall, and false-change, and lowering max_event_proposals from 16 to 15 on that boardcands3 + secsep3 sweet spot traded away some secondary lift while recovering recall and false-change, and lowering only max_event_proposals one step further from 15 to 14 there to test whether the tighter proposal budget continues that tradeoff smoothly or collapses the branch.
autoresearch/snapshots/20260419T034036Z_hybrid_lookahead_segmental_drop1_boardcands4_ratio95_props15_top4_detect10_lwindow1_minsep4_secsep3_thresh3_total150_permove125_lmargin9p5_m9p8957061767578125_r0_beam4_v469.py	0.074556	0.761563	0.720671	0.265625	0.019405	discard	Hybrid decoder keeps the baseline lookahead path unless a conservative board-only segmental pass wins the current score-gain gates, while following up the kept window1 branch after lowering lookahead window from 2 to 1 on the 9.5-margin baseline opened a lower-false-change but lower-recall tradeoff, the secsep3-through-secsep6 shelf stayed on the same higher-secondary but higher-false-change branch, narrowing that shelf from boardcands4 to boardcands3 improved secondaries at unchanged board_exact, recall, and false-change, and lowering max_event_proposals from 16 to 15 on that boardcands3 + secsep3 sweet spot traded away some secondary lift while improving recall and false-change, and restoring only top-board breadth from 3 back to 4 alongside secsep3 + props15 on the active window1 branch to test whether the tighter proposal budget still prefers the narrower board menu or whether a wider board menu gives a better recall-versus-secondary tradeoff there.
autoresearch/snapshots/20260419T034152Z_hybrid_lookahead_segmental_drop1_boardcands2_ratio95_props15_top4_detect10_lwindow1_minsep4_secsep3_thresh3_total150_permove125_lmargin9p5_m9p8957061767578125_r0_beam4_v470.py	0.074556	0.760684	0.712976	0.265625	0.019405	discard	Hybrid decoder keeps the baseline lookahead path unless a conservative board-only segmental pass wins the current score-gain gates, while following up the kept window1 branch after lowering lookahead window from 2 to 1 on the 9.5-margin baseline opened a lower-false-change but lower-recall tradeoff, the secsep3 shelf with boardcands3 gave the strongest secondary metrics on that branch, tightening max_event_proposals from 16 to 15 traded away some secondary lift while improving recall and false-change, and restoring boardcands4 on that props15 branch was an exact no-op, and lowering only top-board breadth from 3 to 2 alongside secsep3 + props15 on the active window1 branch to test whether the tighter-budget tradeoff still has a narrower board-width sweet spot below 3 or whether the props15 branch stays flat across 2 through 4.
autoresearch/snapshots/20260419T034249Z_hybrid_lookahead_segmental_drop1_boardcands1_ratio95_props15_top4_detect10_lwindow1_minsep4_secsep3_thresh3_total150_permove125_lmargin9p5_m9p8957061767578125_r0_beam4_v471.py	0.074556	0.757687	0.701214	0.250000	0.019405	discard	Hybrid decoder keeps the baseline lookahead path unless a conservative board-only segmental pass wins the current score-gain gates, while following up the kept window1 branch after lowering lookahead window from 2 to 1 on the 9.5-margin baseline opened a lower-false-change but lower-recall tradeoff, the secsep3 shelf with props15 improved recall and false-change versus the higher-secondary shelf, boardcands3 and boardcands4 were exact on that props15 branch, and lowering board width to 2 kept recall and false-change but weakened secondaries, and lowering only top-board breadth from 4 to 1 alongside secsep3 + props15 on the active window1 branch to complete that tighter-budget board-width curve and test whether boardcands1 recovers any further false-change or simply continues the secondary collapse.
