snapshot	board_exact	non_empty_accuracy	macro_f1	move_recall	false_change_rate	status	description
autoresearch/snapshots/20260420T010119Z_hybrid_p8_m8_w3_g142p3393809000651089036182384006679058074951171874999999999999999999999999999999918433694150018443416121323634293155553735446774137918153017044306628459442531422159713798414326646479821647517383098602294921875_v1108.py	0.071006	0.789778	0.739821	0.375000	0.024580	discard	Restore the compact props8 + minsep8 hybrid shelf anchored at lwindow3, beam3, top4, boardcands2, secsep1, radius0, drop1, props8, total150, and lmargin9.935836791992188. The latest executed bracket is harmful at 142.33938090006510890361823840066790580749511718749999999999999999999999999999999977161434362005164156513970617602083555045925096758617082844772405855968643908798204719863556011461014350061304867267608642578125 and exact-flat at 142.339380900065108903618238400667905807495117187500000000000000000000000000000000212072395209952047118084558550837795560287838387241412802155684802766005449418302384744124122750719152463716454803943634033203125, so this run restores the same shelf anchor and raises only min_score_gain_per_added_move to 142.3393809000651089036182384006679058074951171874999999999999999999999999999999999918433694150018443416121323634293155553735446774137918153017044306628459442531422159713798414326646479821647517383098602294921875 to continue binary-searching that lower edge. The experiment name remains shortened to avoid the filename-too-long failure seen with long autogenerated names.
autoresearch/snapshots/20260420T010231Z_hybrid_p8_m8_w3_g142p3393809000651089036182384006679058074951171874999999999999999999999999999999918433694150018443416121323634293155553735446774137918153017044306628459442531422159713798414326646479821647517383098602294921875_v1108.py	0.071006	0.789778	0.739821	0.375000	0.024580	discard	Restore the compact props8 + minsep8 hybrid shelf anchored at lwindow3, beam3, top4, boardcands2, secsep1, radius0, drop1, props8, total150, and lmargin9.935836791992188. The latest executed bracket is harmful at 142.33938090006510890361823840066790580749511718749999999999999999999999999999999977161434362005164156513970617602083555045925096758617082844772405855968643908798204719863556011461014350061304867267608642578125 and exact-flat at 142.339380900065108903618238400667905807495117187500000000000000000000000000000000212072395209952047118084558550837795560287838387241412802155684802766005449418302384744124122750719152463716454803943634033203125, so this run restores the same shelf anchor and raises only min_score_gain_per_added_move to 142.3393809000651089036182384006679058074951171874999999999999999999999999999999999918433694150018443416121323634293155553735446774137918153017044306628459442531422159713798414326646479821647517383098602294921875 to continue binary-searching that lower edge. The experiment name remains shortened to avoid the filename-too-long failure seen with long autogenerated names.
autoresearch/snapshots/20260420T010339Z_hybrid_p8_m8_w3_g142p33938090006510890361823840066790580749511718750000000000000000000000000000010195788231247694572984834545713355555783069153232760230872869461671442569683572230035775198209169190022294060327112674713134765625_v1109.py	0.071006	0.799339	0.749250	0.375000	0.020699	discard	Restore the compact props8 + minsep8 hybrid shelf anchored at lwindow3, beam3, top4, boardcands2, secsep1, radius0, drop1, props8, total150, and lmargin9.935836791992188. The latest executed bracket is harmful at 142.3393809000651089036182384006679058074951171874999999999999999999999999999999999918433694150018443416121323634293155553735446774137918153017044306628459442531422159713798414326646479821647517383098602294921875 and exact-flat at 142.339380900065108903618238400667905807495117187500000000000000000000000000000000212072395209952047118084558550837795560287838387241412802155684802766005449418302384744124122750719152463716454803943634033203125, so this run restores the same shelf anchor and raises only min_score_gain_per_added_move to 142.33938090006510890361823840066790580749511718750000000000000000000000000000000010195788231247694572984834545713355555783069153232760230872869461671442569683572230035775198209169190022294060327112674713134765625 to continue binary-searching that lower edge. The experiment name remains shortened to avoid the filename-too-long failure seen with long autogenerated names.
autoresearch/snapshots/20260420T010610Z_hybrid_p8_m8_w3_v1111.py	0.071006	0.799339	0.749250	0.375000	0.020699	discard	Restore the compact props8 + minsep8 hybrid shelf anchored at lwindow3, beam3, top4, boardcands2, secsep1, radius0, drop1, props8, total150, and lmargin9.935836791992188. The latest executed bracket is harmful at 142.3393809000651089036182384006679058074951171874999999999999999999999999999999999918433694150018443416121323634293155553735446774137918153017044306628459442531422159713798414326646479821647517383098602294921875 and exact-flat at 142.33938090006510890361823840066790580749511718750000000000000000000000000000000010195788231247694572984834545713355555783069153232760230872869461671442569683572230035775198209169190022294060327112674713134765625. This run re-prepares their midpoint, 142.339380900065108903618238400667905807495117187500000000000000000000000000000000046900625863739395035730238910281435556602118104870697062015199523688635820544432258164565911762178274102552677504718303680419921875, with a much shorter experiment name because the prior v1110 attempt failed at report write with OSError 63 file name too long.
autoresearch/snapshots/20260420T010722Z_hybrid_p8_m8_w3_v1112.py	0.071006	0.799339	0.749250	0.375000	0.020699	discard	Restore the compact props8 + minsep8 hybrid shelf anchored at lwindow3, beam3, top4, boardcands2, secsep1, radius0, drop1, props8, total150, and lmargin9.935836791992188. The latest executed bracket is harmful at 142.3393809000651089036182384006679058074951171874999999999999999999999999999999999918433694150018443416121323634293155553735446774137918153017044306628459442531422159713798414326646479821647517383098602294921875 and exact-flat at 142.339380900065108903618238400667905807495117187500000000000000000000000000000000046900625863739395035730238910281435556602118104870697062015199523688635820544432258164565911762178274102552677504718303680419921875. This run re-prepares their midpoint, 142.3393809000651089036182384006679058074951171875000000000000000000000000000000000193719976393706196886711856368553755559878313911422444386584519771757408823987872370679728765974214610423587146215140819549560546875, with a short experiment name to avoid filename-too-long failures.
autoresearch/snapshots/20260420T010834Z_hybrid_p8_m8_w3_v1113.py	0.071006	0.799339	0.749250	0.375000	0.020699	discard	Restore the compact props8 + minsep8 hybrid shelf anchored at lwindow3, beam3, top4, boardcands2, secsep1, radius0, drop1, props8, total150, and lmargin9.935836791992188. The latest executed bracket is harmful at 142.3393809000651089036182384006679058074951171874999999999999999999999999999999999918433694150018443416121323634293155553735446774137918153017044306628459442531422159713798414326646479821647517383098602294921875 and exact-flat at 142.3393809000651089036182384006679058074951171875000000000000000000000000000000000193719976393706196886711856368553755559878313911422444386584519771757408823987872370679728765974214610423587146215140819549560546875. This run re-prepares their midpoint, 142.33938090006510890361823840066790580749511718750000000000000000000000000000000000560768352718623201514165900014234555568068803427801812698007820391929341332596472651967635901504305451226173317991197109222412109375, with a short experiment name to avoid filename-too-long failures.
autoresearch/snapshots/20260420T010943Z_hybrid_p8_m8_w3_v1114.py	0.071006	0.789778	0.739821	0.375000	0.024580	discard	Restore the compact props8 + minsep8 hybrid shelf anchored at lwindow3, beam3, top4, boardcands2, secsep1, radius0, drop1, props8, total150, and lmargin9.935836791992188. The latest executed bracket is harmful at 142.3393809000651089036182384006679058074951171874999999999999999999999999999999999918433694150018443416121323634293155553735446774137918153017044306628459442531422159713798414326646479821647517383098602294921875 and exact-flat at 142.33938090006510890361823840066790580749511718750000000000000000000000000000000000560768352718623201514165900014234555568068803427801812698007820391929341332596472651967635901504305451226173317991197109222412109375. This run re-prepares their midpoint, 142.339380900065108903618238400667905807495117187499999999999999999999999999999999998725526471094038178376895681785830555527116355845904971140891317291069678789553471245528100223853851247213242459110915660858154296875, with a short experiment name to avoid filename-too-long failures.
autoresearch/snapshots/20260420T011054Z_hybrid_p8_m8_w3_v1115.py	0.071006	0.799339	0.749250	0.375000	0.020699	discard	Restore the compact props8 + minsep8 hybrid shelf anchored at lwindow3, beam3, top4, boardcands2, secsep1, radius0, drop1, props8, total150, and lmargin9.935836791992188. The latest executed bracket is harmful at 142.339380900065108903618238400667905807495117187499999999999999999999999999999999998725526471094038178376895681785830555527116355845904971140891317291069678789553471245528100223853851247213242459110915660858154296875 and exact-flat at 142.33938090006510890361823840066790580749511718750000000000000000000000000000000000560768352718623201514165900014234555568068803427801812698007820391929341332596472651967635901504305451226173317991197109222412109375. This run re-prepares their midpoint, 142.3393809000651089036182384006679058074951171875000000000000000000000000000000000021666049991401350967592773409640880556039021950619615490604847606051815460577590988826022296194484528797374878195114433765411376953125, with a short experiment name to avoid filename-too-long failures.
autoresearch/snapshots/20260420T011206Z_hybrid_p8_m8_w3_v1116.py	0.071006	0.799339	0.749250	0.375000	0.020699	discard	Restore the compact props8 + minsep8 hybrid shelf anchored at lwindow3, beam3, top4, boardcands2, secsep1, radius0, drop1, props8, total150, and lmargin9.935836791992188. The latest executed bracket is harmful at 142.339380900065108903618238400667905807495117187499999999999999999999999999999999998725526471094038178376895681785830555527116355845904971140891317291069678789553471245528100223853851247213242459110915660858154296875 and exact-flat at 142.3393809000651089036182384006679058074951171875000000000000000000000000000000000021666049991401350967592773409640880556039021950619615490604847606051815460577590988826022296194484528797374878195114433765411376953125. This run re-prepares their midpoint, 142.33938090006510890361823840066790580749511718750000000000000000000000000000000000044606573511708663756808651137495930556550927545393326010068803894812561242365628506406516492165115206347536513931117951869964599609375, with a short experiment name to avoid filename-too-long failures.
autoresearch/snapshots/20260420T011323Z_hybrid_p8_m8_w3_v1117.py	0.071006	0.789778	0.739821	0.375000	0.024580	discard	Restore the compact props8 + minsep8 hybrid shelf anchored at lwindow3, beam3, top4, boardcands2, secsep1, radius0, drop1, props8, total150, and lmargin9.935836791992188. The latest executed bracket is harmful at 142.339380900065108903618238400667905807495117187499999999999999999999999999999999998725526471094038178376895681785830555527116355845904971140891317291069678789553471245528100223853851247213242459110915660858154296875 and exact-flat at 142.33938090006510890361823840066790580749511718750000000000000000000000000000000000044606573511708663756808651137495930556550927545393326010068803894812561242365628506406516492165115206347536513931117951869964599609375. This run re-prepares their midpoint, 142.339380900065108903618238400667905807495117187499999999999999999999999999999999999585796103105562407972491096580394930546312815649919115620789678119597645606604878154796632572752501655344303799211047589778900146484375, with a short experiment name to avoid filename-too-long failures.
autoresearch/snapshots/20260420T011449Z_hybrid_p8_m8_w3_v1118.py	0.071006	0.789778	0.739821	0.375000	0.024580	discard	Restore the compact props8 + minsep8 hybrid shelf anchored at lwindow3, beam3, top4, boardcands2, secsep1, radius0, drop1, props8, total150, and lmargin9.935836791992188. The latest executed bracket is harmful at 142.339380900065108903618238400667905807495117187499999999999999999999999999999999998725526471094038178376895681785830555527116355845904971140891317291069678789553471245528100223853851247213242459110915660858154296875 and exact-flat at 142.33938090006510890361823840066790580749511718750000000000000000000000000000000000044606573511708663756808651137495930556550927545393326010068803894812561242365628506406516492165115206347536513931117951869964599609375. This run re-prepares their midpoint, 142.339380900065108903618238400667905807495117187499999999999999999999999999999999999585796103105562407972491096580394930546312815649919115620789678119597645606604878154796632572752501655344303799211047589778900146484375, with a short experiment name to avoid filename-too-long failures.
autoresearch/snapshots/20260420T011605Z_hybrid_p8_m8_w3_v1119.py	0.071006	0.799339	0.749250	0.375000	0.020699	discard	Restore the compact props8 + minsep8 hybrid shelf anchored at lwindow3, beam3, top4, boardcands2, secsep1, radius0, drop1, props8, total150, and lmargin9.935836791992188. The latest executed bracket is harmful at 142.339380900065108903618238400667905807495117187499999999999999999999999999999999999585796103105562407972491096580394930546312815649919115620789678119597645606604878154796632572752501655344303799211047589778900146484375 and exact-flat at 142.33938090006510890361823840066790580749511718750000000000000000000000000000000000044606573511708663756808651137495930556550927545393326010068803894812561242365628506406516492165115206347536513931117951869964599609375. This run re-prepares their midpoint, 142.3393809000651089036182384006679058074951171875000000000000000000000000000000000000159309191113245227702888039776771180559110455519261878607388585338616290151305816094308987472018268594098344692611135542392730712890625, with a short experiment name to avoid filename-too-long failures.
autoresearch/snapshots/20260420T011726Z_hybrid_p8_m8_w3_v1120.py	0.071006	0.789778	0.739821	0.375000	0.024580	discard	Restore the compact props8 + minsep8 hybrid shelf anchored at lwindow3, beam3, top4, boardcands2, secsep1, radius0, drop1, props8, total150, and lmargin9.935836791992188. The latest executed bracket is harmful at 142.339380900065108903618238400667905807495117187499999999999999999999999999999999999585796103105562407972491096580394930546312815649919115620789678119597645606604878154796632572752501655344303799211047589778900146484375 and exact-flat at 142.3393809000651089036182384006679058074951171875000000000000000000000000000000000000159309191113245227702888039776771180559110455519261878607388585338616290151305816094308987472018268594098344692611135542392730712890625. This run re-prepares their midpoint, 142.33938090006510890361823840066790580749511718749999999999999999999999999999999999980086351110844346537138995027903602430111193060092265174076426832672963731086772988211376565997716425737706913423608057200908660888671875, with a short experiment name to avoid filename-too-long failures.
autoresearch/snapshots/20260420T012356Z_hybrid_p8_m8_w3_v1121.py	0.071006	0.789778	0.739821	0.375000	0.024580	discard	Restore the compact props8 + minsep8 hybrid shelf anchored at lwindow3, beam3, top4, boardcands2, secsep1, radius0, drop1, props8, total150, and lmargin9.935836791992188. The latest executed bracket is harmful at 142.33938090006510890361823840066790580749511718749999999999999999999999999999999999980086351110844346537138995027903602430111193060092265174076426832672963731086772988211376565997716425737706913423608057200908660888671875 and exact-flat at 142.3393809000651089036182384006679058074951171875000000000000000000000000000000000000159309191113245227702888039776771180559110455519261878607388585338616290151305816094308987472018268594098344692611135542392730712890625. This run re-prepares their midpoint, 142.339380900065108903618238400667905807495117187499999999999999999999999999999999999908397215109883994070839377128356571178511488076424418724312503592631749907020724745772332203589495558393451801748597063124179840087890625, with a short experiment name to avoid filename-too-long failures.
autoresearch/snapshots/20260420T012604Z_hybrid_p8_m8_w3_v1122.py	0.071006	0.789778	0.739821	0.375000	0.024580	discard	Restore the compact props8 + minsep8 hybrid shelf anchored at lwindow3, beam3, top4, boardcands2, secsep1, radius0, drop1, props8, total150, and lmargin9.935836791992188. The latest executed bracket is harmful at 142.339380900065108903618238400667905807495117187499999999999999999999999999999999999908397215109883994070839377128356571178511488076424418724312503592631749907020724745772332203589495558393451801748597063124179840087890625 and exact-flat at 142.3393809000651089036182384006679058074951171875000000000000000000000000000000000000159309191113245227702888039776771180559110455519261878607388585338616290151305816094308987472018268594098344692611135542392730712890625. This run re-prepares their midpoint, 142.3393809000651089036182384006679058074951171874999999999999999999999999999999999999621640671106042584205640905530168446172112668141753032925256810632466894610756531776016154753956612089016431355048553086817264556884765625, with a short experiment name to avoid filename-too-long failures.
autoresearch/snapshots/20260420T012813Z_hybrid_p8_m8_w3_v1123.py	0.071006	0.789778	0.739821	0.375000	0.024580	discard	Restore the compact props8 + minsep8 hybrid shelf anchored at lwindow3, beam3, top4, boardcands2, secsep1, radius0, drop1, props8, total150, and lmargin9.935836791992188. The latest executed bracket is harmful at 142.3393809000651089036182384006679058074951171874999999999999999999999999999999999999621640671106042584205640905530168446172112668141753032925256810632466894610756531776016154753956612089016431355048553086817264556884765625 and exact-flat at 142.3393809000651089036182384006679058074951171875000000000000000000000000000000000000159309191113245227702888039776771180559110455519261878607388585338616290151305816094308987472018268594098344692611135542392730712890625. This run re-prepares their midpoint, 142.33938090006510890361823840066790580749511718749999999999999999999999999999999999998904749311096439059542644726534698133656115618305074557663226979855415923810311739351625711129874403415573880238298443146049976348876953125, with a short experiment name to avoid filename-too-long failures.
autoresearch/snapshots/20260420T013025Z_hybrid_p8_m8_w3_v1124.py	0.071006	0.799339	0.749250	0.375000	0.020699	discard	Restore the compact props8 + minsep8 hybrid shelf anchored at lwindow3, beam3, top4, boardcands2, secsep1, radius0, drop1, props8, total150, and lmargin9.935836791992188. The latest executed bracket is harmful at 142.33938090006510890361823840066790580749511718749999999999999999999999999999999999998904749311096439059542644726534698133656115618305074557663226979855415923810311739351625711129874403415573880238298443146049976348876953125 and exact-flat at 142.3393809000651089036182384006679058074951171875000000000000000000000000000000000000159309191113245227702888039776771180559110455519261878607388585338616290151305816094308987472018268594098344692611135542392730712890625. This run re-prepares their midpoint, 142.339380900065108903618238400667905807495117187500000000000000000000000000000000000002489206111144456682857625621512049696236100867488466718685564166207894126616849501473577929250285446782786635822048992849886417388916015625, with a short experiment name to avoid filename-too-long failures.
autoresearch/snapshots/20260420T013310Z_hybrid_p8_m8_w3_v1124.py	0.071006	0.799339	0.749250	0.375000	0.020699	discard	Restore the compact props8 + minsep8 hybrid shelf anchored at lwindow3, beam3, top4, boardcands2, secsep1, radius0, drop1, props8, total150, and lmargin9.935836791992188. The latest executed bracket is harmful at 142.33938090006510890361823840066790580749511718749999999999999999999999999999999999998904749311096439059542644726534698133656115618305074557663226979855415923810311739351625711129874403415573880238298443146049976348876953125 and exact-flat at 142.3393809000651089036182384006679058074951171875000000000000000000000000000000000000159309191113245227702888039776771180559110455519261878607388585338616290151305816094308987472018268594098344692611135542392730712890625. This run re-prepares their midpoint, 142.339380900065108903618238400667905807495117187500000000000000000000000000000000000002489206111144456682857625621512049696236100867488466718685564166207894126616849501473577929250285446782786635822048992849886417388916015625, with a short experiment name to avoid filename-too-long failures.
