snapshot	board_exact	non_empty_accuracy	macro_f1	move_recall	false_change_rate	status	description
autoresearch/snapshots/20260419T043400Z_hybrid_lookahead_segmental_drop0_boardcands3_ratio95_props14_top1_detect10_lwindow1_minsep4_secsep3_thresh3_total150_permove125_lmargin9p5_m9p8957061767578125_r0_beam4_v515.py	0.074556	0.790088	0.748289	0.234375	0.014230	discard	Hybrid decoder keeps the baseline lookahead path unless a conservative board-only segmental pass wins the current score-gain gates, while following up the kept window1 branch after lowering lookahead window from 2 to 1 on the 9.5-margin baseline opened a lower-false-change but lower-recall tradeoff, lowering only max_event_proposals from 16 to 15 on the restored plain window1 branch improved recall and secondary metrics but worsened false-change, additionally narrowing top-board breadth from 4 to 3 recovered the lower false-change without hurting recall, lowering only max_event_proposals one step further from 15 to 14 on that boardcands3 plain props branch kept that recovered tradeoff, follow-up props14 probes showed top1 through top13 were exact no-ops while top14 and above reopened the worse false-change regime, boardcands3 was the local board-width sweet spot, beam5 through beam7 were exact no-ops while beam3 and beam8 were worse, event_window_radius=1 was an exact no-op, lowering segment_board_drop_worst_frames from 1 to 0 on that stronger props14 branch produced a new kept low-noise / lower-recall tradeoff, and raising secondary minimum event separation from 2 to 3 on that drop0 branch created a recall-recovering but noisier tradeoff that stayed best on the boardcands3/4 plateau while beam5 and narrower board widths were worse, and lowering only top-move breadth from 4 to 1 on that secsep3 drop0 branch to test whether the recall-recovering tradeoff still sits on the same move-width plateau as the parent branch.
autoresearch/snapshots/20260419T043610Z_hybrid_lookahead_segmental_drop0_boardcands3_ratio95_props13_top4_detect10_lwindow1_minsep4_thresh3_total150_permove125_lmargin9p5_m9p8957061767578125_r0_beam4_v516.py	0.074556	0.796910	0.756037	0.203125	0.012937	discard	Hybrid decoder keeps the baseline lookahead path unless a conservative board-only segmental pass wins the current score-gain gates, while following up the kept window1 branch after lowering lookahead window from 2 to 1 on the 9.5-margin baseline opened a lower-false-change but lower-recall tradeoff, lowering only max_event_proposals from 16 to 15 on the restored plain window1 branch improved recall and secondary metrics but worsened false-change, additionally narrowing top-board breadth from 4 to 3 recovered the lower false-change without hurting recall, lowering only max_event_proposals one step further from 15 to 14 on that boardcands3 plain props branch kept that recovered tradeoff, and lowering segment_board_drop_worst_frames from 1 to 0 on that stronger props14 branch produced a new kept low-noise / lower-recall tradeoff whose board-width curve favored boardcands3/4 over 2 and 1, whose top1 probe was an exact no-op, whose beam3/5 probes were both worse, whose event_window_radius=1 probe was an exact no-op, whose secsep3 side branch was a noisier recall-recovering tradeoff, and whose props15 follow-up was materially worse, and lowering only max_event_proposals from 14 to 13 on that new drop0 + boardcands3 branch to test whether the low-noise tradeoff stays intact one step below the kept proposal budget or whether 14 is already the local floor.
autoresearch/snapshots/20260419T043733Z_hybrid_lookahead_segmental_drop0_boardcands3_ratio95_props13_top4_detect10_lwindow1_minsep4_secsep3_thresh3_total150_permove125_lmargin9p5_m9p8957061767578125_r0_beam4_v517.py	0.074556	0.795101	0.755456	0.218750	0.012937	discard	Hybrid decoder keeps the baseline lookahead path unless a conservative board-only segmental pass wins the current score-gain gates, while following up the kept window1 branch after lowering lookahead window from 2 to 1 on the 9.5-margin baseline opened a lower-false-change but lower-recall tradeoff, lowering only max_event_proposals from 16 to 15 on the restored plain window1 branch improved recall and secondary metrics but worsened false-change, additionally narrowing top-board breadth from 4 to 3 recovered the lower false-change without hurting recall, lowering only max_event_proposals one step further from 15 to 14 on that boardcands3 plain props branch kept that recovered tradeoff, and lowering segment_board_drop_worst_frames from 1 to 0 on that stronger props14 branch produced a new kept low-noise / lower-recall tradeoff, while raising secondary minimum event separation from 2 to 3 on that drop0 branch created a recall-recovering but noisier tradeoff that stayed best on the boardcands3/4 plateau and on the same move-width surface, and lowering only max_event_proposals from 14 to 13 on that secsep3 drop0 branch to test whether the recall-recovering tradeoff can keep some of its recall while recovering some of the false-change regression.
autoresearch/snapshots/20260419T043854Z_hybrid_lookahead_segmental_drop0_boardcands3_ratio95_props15_top4_detect10_lwindow1_minsep4_secsep3_thresh3_total150_permove125_lmargin9p5_m9p8957061767578125_r0_beam4_v518.py	0.074556	0.762855	0.729673	0.265625	0.021992	discard	Hybrid decoder keeps the baseline lookahead path unless a conservative board-only segmental pass wins the current score-gain gates, while following up the kept window1 branch after lowering lookahead window from 2 to 1 on the 9.5-margin baseline opened a lower-false-change but lower-recall tradeoff, lowering only max_event_proposals from 16 to 15 on the restored plain window1 branch improved recall and secondary metrics but worsened false-change, additionally narrowing top-board breadth from 4 to 3 recovered the lower false-change without hurting recall, lowering only max_event_proposals one step further from 15 to 14 on that boardcands3 plain props branch kept that recovered tradeoff, and lowering segment_board_drop_worst_frames from 1 to 0 on that stronger props14 branch produced a new kept low-noise / lower-recall tradeoff, while raising secondary minimum event separation from 2 to 3 on that drop0 branch created a recall-recovering but noisier tradeoff that stayed best on the boardcands3/4 plateau and on the same move-width surface, and lowering max_event_proposals from 14 to 13 on that secsep3 drop0 branch collapsed back toward the low-noise tradeoff, and raising only max_event_proposals from 14 to 15 on that secsep3 drop0 branch to test whether the recall-recovering tradeoff improves further or simply becomes too noisy on the upper side.
autoresearch/snapshots/20260419T044621Z_hybrid_lookahead_segmental_drop0_boardcands3_ratio95_props14_top4_detect10_lwindow1_minsep4_secsep3_thresh3_total150_permove125_lmargin9p5_m9p8957061767578125_r0_beam3_v519.py	0.074556	0.794223	0.747999	0.203125	0.014230	discard	Hybrid decoder keeps the baseline lookahead path unless a conservative board-only segmental pass wins the current score-gain gates, while following up the kept window1 branch after lowering lookahead window from 2 to 1 on the 9.5-margin baseline opened a lower-false-change but lower-recall tradeoff, lowering only max_event_proposals from 16 to 15 on the restored plain window1 branch improved recall and secondary metrics but worsened false-change, additionally narrowing top-board breadth from 4 to 3 recovered the lower false-change without hurting recall, lowering only max_event_proposals one step further from 15 to 14 on that boardcands3 plain props branch kept that recovered tradeoff, and lowering segment_board_drop_worst_frames from 1 to 0 on that stronger props14 branch produced a new kept low-noise / lower-recall tradeoff, while raising secondary minimum event separation from 2 to 3 on that drop0 branch created a recall-recovering but noisier tradeoff that stayed best on the boardcands3/4 plateau, stayed on the same move-width surface, got worse at props15 and collapsed at props13, and got worse at beam5, and lowering only beam size from 4 to 3 on that secsep3 drop0 branch to test whether beam4 is a sharp optimum there or whether the recall-recovering tradeoff survives on the cheaper side too.
autoresearch/snapshots/20260419T044732Z_hybrid_lookahead_segmental_drop0_boardcands3_ratio95_props14_top4_detect10_lwindow1_minsep4_secsep4_thresh3_total150_permove125_lmargin9p5_m9p8957061767578125_r0_beam4_v520.py	0.074556	0.790088	0.748289	0.234375	0.014230	discard	Hybrid decoder keeps the baseline lookahead path unless a conservative board-only segmental pass wins the current score-gain gates, while following up the kept window1 branch after lowering lookahead window from 2 to 1 on the 9.5-margin baseline opened a lower-false-change but lower-recall tradeoff, lowering only max_event_proposals from 16 to 15 on the restored plain window1 branch improved recall and secondary metrics but worsened false-change, additionally narrowing top-board breadth from 4 to 3 recovered the lower false-change without hurting recall, lowering only max_event_proposals one step further from 15 to 14 on that boardcands3 plain props branch kept that recovered tradeoff, and lowering segment_board_drop_worst_frames from 1 to 0 on that stronger props14 branch produced a new kept low-noise / lower-recall tradeoff, while raising secondary minimum event separation from 2 to 3 on that drop0 branch created a recall-recovering but noisier tradeoff that preferred the boardcands3/4 plateau, stayed on the same move-width surface, got worse at props15 and collapsed at props13, and got worse at beam5 and beam3, and raising only secondary minimum event separation from 2 to 4 on that drop0 branch to test whether secsep3 is a sharp optimum there or whether the upper secsep shelf is actually a plateau on this branch too.
autoresearch/snapshots/20260419T044831Z_hybrid_lookahead_segmental_drop0_boardcands3_ratio95_props14_top4_detect10_lwindow1_minsep4_secsep5_thresh3_total150_permove125_lmargin9p5_m9p8957061767578125_r0_beam4_v521.py	0.074556	0.790088	0.748289	0.234375	0.014230	discard	Hybrid decoder keeps the baseline lookahead path unless a conservative board-only segmental pass wins the current score-gain gates, while following up the kept window1 branch after lowering lookahead window from 2 to 1 on the 9.5-margin baseline opened a lower-false-change but lower-recall tradeoff, lowering only max_event_proposals from 16 to 15 on the restored plain window1 branch improved recall and secondary metrics but worsened false-change, additionally narrowing top-board breadth from 4 to 3 recovered the lower false-change without hurting recall, lowering only max_event_proposals one step further from 15 to 14 on that boardcands3 plain props branch kept that recovered tradeoff, and lowering segment_board_drop_worst_frames from 1 to 0 on that stronger props14 branch produced a new kept low-noise / lower-recall tradeoff, while raising secondary minimum event separation from 2 to 3 on that drop0 branch created a recall-recovering but noisier tradeoff that preferred the boardcands3/4 plateau, stayed on the same move-width surface, got worse at props15 and collapsed at props13, got worse at beam5 and beam3, and matched exactly at secsep4, and raising only secondary minimum event separation from 2 to 5 on that drop0 branch to test whether the upper secsep side is a broader plateau there or whether the secsep3/4 match was only a two-point shelf.
autoresearch/snapshots/20260419T044955Z_hybrid_lookahead_segmental_drop0_boardcands3_ratio95_props14_top4_detect10_lwindow2_minsep4_thresh3_total150_permove125_lmargin9p5_m9p8957061767578125_r0_beam4_v522.py	0.074556	0.762855	0.719705	0.328125	0.024580	discard	Hybrid decoder keeps the baseline lookahead path unless a conservative board-only segmental pass wins the current score-gain gates, while following up the kept window1 branch after lowering lookahead window from 2 to 1 on the 9.5-margin baseline opened a lower-false-change but lower-recall tradeoff, lowering only max_event_proposals from 16 to 15 on the restored plain window1 branch improved recall and secondary metrics but worsened false-change, additionally narrowing top-board breadth from 4 to 3 recovered the lower false-change without hurting recall, lowering only max_event_proposals one step further from 15 to 14 on that boardcands3 plain props branch kept that recovered tradeoff, and lowering segment_board_drop_worst_frames from 1 to 0 on that stronger props14 branch produced a new kept low-noise / lower-recall tradeoff, while nearby secsep, proposal-budget, and beam probes around that drop0 branch only produced a noisier recall shelf or collapsed back toward the kept tradeoff, and raising only lookahead window from 1 back to 2 on that kept drop0 branch to test whether its gain still depends on the shortened lookahead baseline or whether the segmental handoff now survives the original wider lookahead context too.
autoresearch/snapshots/20260419T045110Z_hybrid_lookahead_segmental_drop0_boardcands3_ratio95_props14_top4_detect10_lwindow1_minsep4_thresh3_total150_permove125_lmargin10_m9p8957061767578125_r0_beam4_v523.py	0.074556	0.795101	0.755456	0.218750	0.012937	discard	Hybrid decoder keeps the baseline lookahead path unless a conservative board-only segmental pass wins the current score-gain gates, while following up the kept window1 branch after lowering lookahead window from 2 to 1 on the 9.5-margin baseline opened a lower-false-change but lower-recall tradeoff, lowering only max_event_proposals from 16 to 15 on the restored plain window1 branch improved recall and secondary metrics but worsened false-change, additionally narrowing top-board breadth from 4 to 3 recovered the lower false-change without hurting recall, lowering only max_event_proposals one step further from 15 to 14 on that boardcands3 plain props branch kept that recovered tradeoff, and lowering segment_board_drop_worst_frames from 1 to 0 on that stronger props14 branch produced a new kept low-noise / lower-recall tradeoff, while nearby secsep, proposal-budget, beam, and wider-lookahead probes around that drop0 branch only produced a noisier recall shelf or collapsed back toward the kept tradeoff, and raising only lookahead margin from 9.5 back to 10.0 on that kept drop0 branch to test whether its gain depends on the relaxed window1 baseline margin or whether the same handoff survives at the original tighter lookahead margin too.
autoresearch/snapshots/20260419T045235Z_hybrid_lookahead_segmental_drop0_boardcands3_ratio95_props14_top4_detect10_lwindow1_minsep4_thresh3_total150_permove125_lmargin9p5_m9p8957061767578125_r2_beam4_v524.py	0.074556	0.795101	0.755456	0.218750	0.012937	discard	Hybrid decoder keeps the baseline lookahead path unless a conservative board-only segmental pass wins the current score-gain gates, while following up the kept window1 branch after lowering lookahead window from 2 to 1 on the 9.5-margin baseline opened a lower-false-change but lower-recall tradeoff, lowering only max_event_proposals from 16 to 15 on the restored plain window1 branch improved recall and secondary metrics but worsened false-change, additionally narrowing top-board breadth from 4 to 3 recovered the lower false-change without hurting recall, lowering only max_event_proposals one step further from 15 to 14 on that boardcands3 plain props branch kept that recovered tradeoff, and follow-up props14 probes showed top1 through top13 were exact no-ops while top14 and above reopened the worse false-change regime, boardcands3 was the local board-width sweet spot, beam5 through beam7 were exact no-ops while beam3 and beam8 were worse, lowering segment_board_drop_worst_frames from 1 to 0 on that stronger props14 branch produced a new kept low-noise / lower-recall tradeoff, and nearby secsep, proposal-budget, beam, wider-lookahead, and lookahead-margin probes around that kept drop0 branch either matched exactly, formed a noisier recall shelf, or collapsed back toward the keep, and raising only event_window_radius from 0 to 2 on that kept drop0 branch to test whether the full allowed temporal aggregation radius is also flat there or whether radius 1 was only a narrow no-op.
autoresearch/snapshots/20260419T045337Z_hybrid_lookahead_segmental_drop0_boardcands3_ratio95_props14_top4_detect10_lwindow1_minsep4_thresh3_total150_permove115p625_lmargin9p5_m9p8957061767578125_r0_beam4_v525.py	0.074556	0.762751	0.719044	0.250000	0.023286	discard	Hybrid decoder keeps the baseline lookahead path unless a conservative board-only segmental pass wins the current score-gain gates, while following up the kept window1 branch after lowering lookahead window from 2 to 1 on the 9.5-margin baseline opened a lower-false-change but lower-recall tradeoff, lowering only max_event_proposals from 16 to 15 on the restored plain window1 branch improved recall and secondary metrics but worsened false-change, additionally narrowing top-board breadth from 4 to 3 recovered the lower false-change without hurting recall, lowering only max_event_proposals one step further from 15 to 14 on that boardcands3 plain props branch kept that recovered tradeoff, and lowering segment_board_drop_worst_frames from 1 to 0 on that stronger props14 branch produced a new kept low-noise / lower-recall tradeoff, while nearby secsep, proposal-budget, beam, lookahead-window, lookahead-margin, and temporal-radius probes around that kept drop0 branch either matched exactly, formed a noisier recall shelf, or collapsed back toward the keep, and lowering only the hybrid minimum score gain per added move from 125.0 to 115.625 on that kept drop0 branch to test whether the stricter handoff gate is still materially supporting the low-noise tradeoff or is flat there like on earlier branches.
autoresearch/snapshots/20260419T045441Z_hybrid_lookahead_segmental_drop0_boardcands3_ratio95_props14_top4_detect10_lwindow1_minsep4_thresh3_total140_permove125_lmargin9p5_m9p8957061767578125_r0_beam4_v526.py	0.074556	0.795101	0.755456	0.218750	0.012937	discard	Hybrid decoder keeps the baseline lookahead path unless a conservative board-only segmental pass wins the current score-gain gates, while following up the kept window1 branch after lowering lookahead window from 2 to 1 on the 9.5-margin baseline opened a lower-false-change but lower-recall tradeoff, lowering only max_event_proposals from 16 to 15 on the restored plain window1 branch improved recall and secondary metrics but worsened false-change, additionally narrowing top-board breadth from 4 to 3 recovered the lower false-change without hurting recall, lowering only max_event_proposals one step further from 15 to 14 on that boardcands3 plain props branch kept that recovered tradeoff, and lowering segment_board_drop_worst_frames from 1 to 0 on that stronger props14 branch produced a new kept low-noise / lower-recall tradeoff, while nearby secsep, proposal-budget, beam, lookahead-window, lookahead-margin, and temporal-radius probes around that kept drop0 branch either matched exactly, formed a noisier recall shelf, or collapsed back toward the keep, and lowering only the hybrid minimum score gain per added move from 125.0 to 115.625 on that kept drop0 branch reopened a noisier higher-recall regime, and lowering only the hybrid minimum total score gain from 150.0 to 140.0 on that kept drop0 branch to test whether the total-gain gate is still flat there or whether it is the remaining handoff threshold holding the low-noise tradeoff in place.
autoresearch/snapshots/20260419T045532Z_hybrid_lookahead_segmental_drop0_boardcands3_ratio95_props14_top4_detect10_lwindow1_minsep4_thresh3_total150_permove137p5_lmargin9p5_m9p8957061767578125_r0_beam4_v527.py	0.074556	0.795101	0.755456	0.218750	0.012937	discard	Hybrid decoder keeps the baseline lookahead path unless a conservative board-only segmental pass wins the current score-gain gates, while following up the kept window1 branch after lowering lookahead window from 2 to 1 on the 9.5-margin baseline opened a lower-false-change but lower-recall tradeoff, lowering only max_event_proposals from 16 to 15 on the restored plain window1 branch improved recall and secondary metrics but worsened false-change, additionally narrowing top-board breadth from 4 to 3 recovered the lower false-change without hurting recall, lowering only max_event_proposals one step further from 15 to 14 on that boardcands3 plain props branch kept that recovered tradeoff, and lowering segment_board_drop_worst_frames from 1 to 0 on that stronger props14 branch produced a new kept low-noise / lower-recall tradeoff, while nearby secsep, proposal-budget, beam, lookahead-window, lookahead-margin, and temporal-radius probes around that kept drop0 branch either matched exactly, formed a noisier recall shelf, or collapsed back toward the keep, and lowering only the hybrid minimum score gain per added move from 125.0 to 115.625 on that kept drop0 branch reopened a noisier higher-recall regime while lowering only the hybrid minimum total score gain from 150.0 to 140.0 was an exact no-op, and raising only the hybrid minimum score gain per added move from 125.0 to 137.5 on that kept drop0 branch to test whether the low-noise tradeoff sits on an upper-side plateau or whether 125.0 is a sharp local optimum for the handoff gate.
