snapshot	board_exact	non_empty_accuracy	macro_f1	move_recall	false_change_rate	status	description
autoresearch/snapshots/20260420T054207Z_hybrid_p8_m8_w3_v1294.py	0.071006	0.799339	0.749250	0.375000	0.020699	discard	Restore the compact props8 + minsep8 hybrid shelf anchored at lwindow3, beam3, top4, boardcands2, secsep1, radius0, drop1, props8, total150, and lmargin9.935836791992188. The latest executed bracket is harmful at 142.339380900065108903618238400667905807495117187499999999999999999999999999999999999999999999999999999999999999999999999999999999997066723265986494828176067829543587547365017668192813547148703879725440097565116684589607389953232924568395656702169218258872470761401681300229722785240018885384212538601671235686622221494796871502975005684805097361245174170107929967343807220458984375 and exact-flat at 142.339380900065108903618238400667905807495117187500000000000000000000000000000000000000000000000000000000000000000000000000000000008184660788474067334900767319055830274989209636576145717650632724108059566302181166687186335259098984319150730905187765208120071916083811837148733567956174885978082022705209261465705363226831298786428477798503733527113457313362232525832951068878173828125. This run prepares their exact midpoint, 142.3393809000651089036182384006679058074951171875000000000000000000000000000000000000000000000000000000000000000000000000000000000026256920272302810815384175742997089111771136523844796323996683019167498319336489256383968626061659544437731938036784917334962713387427465686892281765980968856811472806534402485761637923608140851447017417416544154441793157417350812465883791446685791015625, with a short experiment name to avoid filename-too-long failures.
autoresearch/snapshots/20260420T054310Z_hybrid_p8_m8_w3_v1295.py	0.071006	0.789778	0.739821	0.375000	0.024580	discard	Restore the compact props8 + minsep8 hybrid shelf anchored at lwindow3, beam3, top4, boardcands2, secsep1, radius0, drop1, props8, total150, and lmargin9.935836791992188. The latest executed bracket is harmful at 142.339380900065108903618238400667905807495117187499999999999999999999999999999999999999999999999999999999999999999999999999999999997066723265986494828176067829543587547365017668192813547148703879725440097565116684589607389953232924568395656702169218258872470761401681300229722785240018885384212538601671235686622221494796871502975005684805097361245174170107929967343807220458984375 and exact-flat at 142.3393809000651089036182384006679058074951171875000000000000000000000000000000000000000000000000000000000000000000000000000000000026256920272302810815384175742997089111771136523844796323996683019167498319336489256383968626061659544437731938036784917334962713387427465686892281765980968856811472806534402485761637923608140851447017417416544154441793157417350812465883791446685791015625. This run prepares their exact midpoint, 142.33938090006510890361823840066790580749511718749999999999999999999999999999999999999999999999999999999999999999999999999999999999984620764660838795485724270192164822927106566028864658977418609082109496474938280511400212627969943950608442525292385499618437105007221393445947548091905788553267990962755574213139300692780547832383837371322975640271224495592150560696609318256378173828125, with a short experiment name to avoid filename-too-long failures.
autoresearch/snapshots/20260420T054418Z_hybrid_p8_m8_w3_v1296.py	0.071006	0.789778	0.739821	0.375000	0.024580	discard	Restore the compact props8 + minsep8 hybrid shelf anchored at lwindow3, beam3, top4, boardcands2, secsep1, radius0, drop1, props8, total150, and lmargin9.935836791992188. The latest executed bracket is harmful at 142.33938090006510890361823840066790580749511718749999999999999999999999999999999999999999999999999999999999999999999999999999999999984620764660838795485724270192164822927106566028864658977418609082109496474938280511400212627969943950608442525292385499618437105007221393445947548091905788553267990962755574213139300692780547832383837371322975640271224495592150560696609318256378173828125 and exact-flat at 142.339380900065108903618238400667905807495117187499999999999999999999999999999999999999999999999999999999999999999999999999999999999997066723265986494828176067829543587547365017668192813547148703879725440097565116684589607389953232924568395656702169218258872470761401681300229722785240018885384212538601671235686622221494796871502975005684805097361245174170107929967343807220458984375. This run prepares their exact midpoint, 142.339380900065108903618238400667905807495117187499999999999999999999999999999999999999999999999999999999999999999999999999999999999921637184937187224842709384875595908409215338978419701660667397350410202423473960899295866834826336215326410454813012107221621760416807879852601852148952209032061083078706683539814574650137597670674359457280750036745065045806768466718494892120361328125, with a short experiment name to avoid filename-too-long failures.
autoresearch/snapshots/20260420T054527Z_hybrid_p8_m8_w3_v1297.py	0.071006	0.789778	0.739821	0.375000	0.024580	discard	Restore the compact props8 + minsep8 hybrid shelf anchored at lwindow3, beam3, top4, boardcands2, secsep1, radius0, drop1, props8, total150, and lmargin9.935836791992188. The latest executed bracket is harmful at 142.339380900065108903618238400667905807495117187499999999999999999999999999999999999999999999999999999999999999999999999999999999999921637184937187224842709384875595908409215338978419701660667397350410202423473960899295866834826336215326410454813012107221621760416807807879852601852148952209032061083078706683539814574650137597670674359457280750036745065045806768466718494892120361328125 and exact-flat at 142.339380900065108903618238400667905807495117187499999999999999999999999999999999999999999999999999999999999999999999999999999999999997066723265986494828176067829543587547365017668192813547148703879725440097565116684589607389953232924568395656702169218258872470761401681300229722785240018885384212538601671235686622221494796871502975005684805097361245174170107929967343807220458984375. This run prepares their exact midpoint, 142.3393809000651089036182384006679058074951171874999999999999999999999999999999999999999999999999999999999999999999999999999999999999593519541015868598354427263525697479782901783233062576039080506150678212605195387919427371123897845699474030557575906627402471155891047445900411623186944855472081368108401889596132183980724672345868246825710429236989951196079573492170311510562896728515625, with a short experiment name to avoid filename-too-long failures.
autoresearch/snapshots/20260420T054635Z_hybrid_p8_m8_w3_v1298.py	0.071006	0.789778	0.739821	0.375000	0.024580	discard	Restore the compact props8 + minsep8 hybrid shelf anchored at lwindow3, beam3, top4, boardcands2, secsep1, radius0, drop1, props8, total150, and lmargin9.935836791992188. The latest executed bracket is harmful at 142.3393809000651089036182384006679058074951171874999999999999999999999999999999999999999999999999999999999999999999999999999999999999593519541015868598354427263525697479782901783233062576039080506150678212605195387919427371123897845699474030557575906627402471155891047445900411623186944855472081368108401889596132183980724672345868246825710429236989951196079573492170311510562896728515625 and exact-flat at 142.339380900065108903618238400667905807495117187499999999999999999999999999999999999999999999999999999999999999999999999999999999999997066723265986494828176067829543587547365017668192813547148703879725440097565116684589607389953232924568395656702169218258872470761401681300229722785240018885384212538601671235686622221494796871502975005684805097361245174170107929967343807220458984375. This run prepares their exact midpoint, 142.33938090006510890361823840066790580749511718749999999999999999999999999999999999999999999999999999999999999999999999999999999999997820933868378667733180939709105666776282759799574953557552837724739663067904232773826617225117150874725789935622987994049955979317525321294513544255196725221629617467472093009764992030978363205304489984412792401053012014688903263959218747913837432861328125, with a short experiment name to avoid filename-too-long failures.
autoresearch/snapshots/20260420T054746Z_hybrid_p8_m8_w3_v1299.py	0.071006	0.789778	0.739821	0.375000	0.024580	discard	Restore the compact props8 + minsep8 hybrid shelf anchored at lwindow3, beam3, top4, boardcands2, secsep1, radius0, drop1, props8, total150, and lmargin9.935836791992188. The latest executed bracket is harmful at 142.33938090006510890361823840066790580749511718749999999999999999999999999999999999999999999999999999999999999999999999999999999999997820933868378667733180939709105666776282759799574953557552837724739663067904232773826617225117150874725789935622987994049955979317525321294513544255196725221629617467472093009764992030978363205304489984412792401053012014688903263959218747913837432861328125 and exact-flat at 142.339380900065108903618238400667905807495117187499999999999999999999999999999999999999999999999999999999999999999999999999999999999997066723265986494828176067829543587547365017668192813547148703879725440097565116684589607389953232924568395656702169218258872470761401681300229722785240018885384212538601671235686622221494796871502975005684805097361245174170107929967343807220458984375. This run prepares their exact midpoint, 142.339380900065108903618238400667905807495117187499999999999999999999999999999999999999999999999999999999999999999999999999999999999987638030974886586079992732460300127655096307831971174561338540563561035388303722211427889820562370835913147506466024579379216131968327447122682582668603635550840193606661300666668271265639214462273937424906364553945682660529570284779765643179416656494140625, with a short experiment name to avoid filename-too-long failures.
autoresearch/snapshots/20260420T054900Z_hybrid_p8_m8_w3_v1300.py	0.071006	0.789778	0.739821	0.375000	0.024580	discard	Restore the compact props8 + minsep8 hybrid shelf anchored at lwindow3, beam3, top4, boardcands2, secsep1, radius0, drop1, props8, total150, and lmargin9.935836791992188. The latest executed bracket is harmful at 142.339380900065108903618238400667905807495117187499999999999999999999999999999999999999999999999999999999999999999999999999999999999987638030974886586079992732460300127655096307831971174561338540563561035388303722211427889820562370835913147506466024579379216131968327447122682582668603635550840193606661300666668271265639214462273937424906364553945682660529570284779765643179416656494140625 and exact-flat at 142.339380900065108903618238400667905807495117187499999999999999999999999999999999999999999999999999999999999999999999999999999999999997066723265986494828176067829543587547365017668192813547148703879725440097565116684589607389953232924568395656702169218258872470761401681300229722785240018885384212538601671235686622221494796871502975005684805097361245174170107929967343807220458984375. This run prepares their exact midpoint, 142.3393809000651089036182384006679058074951171874999999999999999999999999999999999999999999999999999999999999999999999999999999999999923523771204365404540844001449218576012306627500819940542436222216432377429344194480087486052578018802407715815840968988190443013648645642114561527269218272181122030726314859511774467435670056668884562152955848256534639173498391073735547251999378204345703125, with a short experiment name to avoid filename-too-long failures.
autoresearch/snapshots/20260420T055017Z_hybrid_p8_m8_w3_v1301.py	0.071006	0.799339	0.749250	0.375000	0.020699	discard	Restore the compact props8 + minsep8 hybrid shelf anchored at lwindow3, beam3, top4, boardcands2, secsep1, radius0, drop1, props8, total150, and lmargin9.935836791992188. The latest executed bracket is harmful at 142.3393809000651089036182384006679058074951171874999999999999999999999999999999999999999999999999999999999999999999999999999999999999923523771204365404540844001449218576012306627500819940542436222216432377429344194480087486052578018802407715815840968988190443013648645642114561527269218272181122030726314859511774467435670056668884562152955848256534639173498391073735547251999378204345703125 and exact-flat at 142.3393809000651089036182384006679058074951171875000000000000000000000000000000000000000000000000000000000000000000000000000000000026256920272302810815384175742997089111771136523844796323996683019167498319336489256383968626061659544437731938036784917334962713387427465686892281765980968856811472806534402485761637923608140851447017416544154441793157417350812465883791446685791015625. This run prepares their exact midpoint, 142.33938090006510890361823840066790580749511718750000000000000000000000000000000000000000000000000000000000000000000000000000000000130902220217535881099625098722231538438917215756728081322695596206919653483829167254320280560571187816200698269263129431615765782005380556645034216466250935644962974186303586726367061955219054540579509897847500013491638982954246017698096693425846099853515625, with a short experiment name to avoid filename-too-long failures.
autoresearch/snapshots/20260420T055130Z_hybrid_p8_m8_w3_v1302.py	0.071006	0.799339	0.749250	0.375000	0.020699	discard	Restore the compact props8 + minsep8 hybrid shelf anchored at lwindow3, beam3, top4, boardcands2, secsep1, radius0, drop1, props8, total150, and lmargin9.935836791992188. The latest executed bracket is harmful at 142.3393809000651089036182384006679058074951171874999999999999999999999999999999999999999999999999999999999999999999999999999999999999923523771204365404540844001449218576012306627500819940542436222216432377429344194480087486052578018802407715815840968988190443013648645642114561527269218272181122030726314859511774467435670056668884562152955848256534639173498391073735547251999378204345703125 and exact-flat at 142.33938090006510890361823840066790580749511718750000000000000000000000000000000000000000000000000000000000000000000000000000000000130902220217535881099625098722231538438917215756728081322695596206919653483829167254320280560571187816200698269263129431615765782005380556645034216466250935644962974186303586726367061955219054540579509897847500013491638982954246017698096693425846099853515625. This run prepares their exact midpoint, 142.33938090006510890361823840066790580749511718750000000000000000000000000000000000000000000000000000000000000000000000000000000000065068728964789767572516769368361862099520141015868140364059979214541988629061304599560577710548484002112387713710769560748835106070933506533089915869471559183387097246783367660742403314787877553634177759688529248028492687344614964217726082972919940948486328125, with a short experiment name to avoid filename-too-long failures.
autoresearch/snapshots/20260420T055241Z_hybrid_p8_m8_w3_v1303.py	0.071006	0.799339	0.749250	0.375000	0.020699	discard	Restore the compact props8 + minsep8 hybrid shelf anchored at lwindow3, beam3, top4, boardcands2, secsep1, radius0, drop1, props8, total150, and lmargin9.935836791992188. The latest executed bracket is harmful at 142.3393809000651089036182384006679058074951171874999999999999999999999999999999999999999999999999999999999999999999999999999999999999923523771204365404540844001449218576012306627500819940542436222216432377429344194480087486052578018802407715815840968988190443013648645642114561527269218272181122030726314859511774467435670056668884562152955848256534639173498391073735547251999378204345703125 and exact-flat at 142.33938090006510890361823840066790580749511718750000000000000000000000000000000000000000000000000000000000000000000000000000000000065068728964789767572516769368361862099520141015868140364059979214541988629061304599560577710548484002112387713710769560748835106070933506533089915869471559183387097246783367660742403314787877553634177759688529248028492687344614964217726082972919940948486328125. This run prepares their exact midpoint, 142.339380900065108903618238400667905807495117187500000000000000000000000000000000000000000000000000000000000000000000000000000000000321519833384167108089626046914270239298216036454381698847421707183531562016773732721807262855371320950682324359345896253153697681037099814771177655710818709525991587770232581279300739945722890601615116906090438652969195395397994374775407777464568614959716796875, with a short experiment name to avoid filename-too-long failures.
autoresearch/snapshots/20260420T055357Z_hybrid_p8_m8_w3_v1303.py	0.071006	0.799339	0.749250	0.375000	0.020699	discard	Restore the compact props8 + minsep8 hybrid shelf anchored at lwindow3, beam3, top4, boardcands2, secsep1, radius0, drop1, props8, total150, and lmargin9.935836791992188. The latest executed bracket is harmful at 142.3393809000651089036182384006679058074951171874999999999999999999999999999999999999999999999999999999999999999999999999999999999999923523771204365404540844001449218576012306627500819940542436222216432377429344194480087486052578018802407715815840968988190443013648645642114561527269218272181122030726314859511774467435670056668884562152955848256534639173498391073735547251999378204345703125 and exact-flat at 142.33938090006510890361823840066790580749511718750000000000000000000000000000000000000000000000000000000000000000000000000000000000065068728964789767572516769368361862099520141015868140364059979214541988629061304599560577710548484002112387713710769560748835106070933506533089915869471559183387097246783367660742403314787877553634177759688529248028492687344614964217726082972919940948486328125. This run prepares their exact midpoint, 142.339380900065108903618238400667905807495117187500000000000000000000000000000000000000000000000000000000000000000000000000000000000321519833384167108089626046914270239298216036454381698847421707183531562016773732721807262855371320950682324359345896253153697681037099814771177655710818709525991587770232581279300739945722890601615116906090438652969195395397994374775407777464568614959716796875, with a short experiment name to avoid filename-too-long failures.
autoresearch/snapshots/20260420T055506Z_hybrid_p8_m8_w3_v1304.py	0.071006	0.799339	0.749250	0.375000	0.020699	discard	Restore the compact props8 + minsep8 hybrid shelf anchored at lwindow3, beam3, top4, boardcands2, secsep1, radius0, drop1, props8, total150, and lmargin9.935836791992188. The latest executed bracket is harmful at 142.3393809000651089036182384006679058074951171874999999999999999999999999999999999999999999999999999999999999999999999999999999999999923523771204365404540844001449218576012306627500819940542436222216432377429344194480087486052578018802407715815840968988190443013648645642114561527269218272181122030726314859511774467435670056668884562152955848256534639173498391073735547251999378204345703125 and exact-flat at 142.339380900065108903618238400667905807495117187500000000000000000000000000000000000000000000000000000000000000000000000000000000000321519833384167108089626046914270239298216036454381698847421707183531562016773732721807262855371320950682324359345896253153697681037099814771177655710818709525991587770232581279300739945722890601615116906090438652969195395397994374775407777464568614959716796875. This run prepares their exact midpoint, 142.3393809000651089036182384006679058074951171875000000000000000000000000000000000000000000000000000000000000000000000000000000000001569361052523018242718552235295960484497233496022318464508326647025873998798540760849080057303145614154615479704649965759863709912009821894913169042188702683720518954214320336152390933446449481342517865606930117393113296563739167410744812513322532176971435546875, with a short experiment name to avoid filename-too-long failures.
autoresearch/snapshots/20260420T055635Z_hybrid_p8_m8_w3_v1305.py	0.071006	0.799339	0.749250	0.375000	0.020699	discard	Restore the compact props8 + minsep8 hybrid shelf anchored at lwindow3, beam3, top4, boardcands2, secsep1, radius0, drop1, props8, total150, and lmargin9.935836791992188. The latest executed bracket is harmful at 142.3393809000651089036182384006679058074951171874999999999999999999999999999999999999999999999999999999999999999999999999999999999999923523771204365404540844001449218576012306627500819940542436222216432377429344194480087486052578018802407715815840968988190443013648645642114561527269218272181122030726314859511774467435670056668884562152955848256534639173498391073735547251999378204345703125 and exact-flat at 142.3393809000651089036182384006679058074951171875000000000000000000000000000000000000000000000000000000000000000000000000000000000001569361052523018242718552235295960484497233496022318464508326647025873998798540760849080057303145614154615479704649965759863709912009821894913169042188702683720518954214320336152390933446449481342517865606930117393113296563739167410744812513322532176971435546875. This run prepares their exact midpoint, 142.33938090006510890361823840066790580749511718750000000000000000000000000000000000000000000000000000000000000000000000000000000000007464424118636918236296981183725895302547700617615692025253814346211531881139424776645837716778618164785115977602454673740270764628292337685138652847289604779508204924703175978320827004410597690057012138799429828248239678686187792422401798826609551906585693359375, with a short experiment name to avoid filename-too-long failures.
