snapshot	board_exact	non_empty_accuracy	macro_f1	move_recall	false_change_rate	status	description
autoresearch/snapshots/20260420T034442Z_hybrid_p8_m8_w3_v1209.py	0.071006	0.799339	0.749250	0.375000	0.020699	discard	Restore the compact props8 + minsep8 hybrid shelf anchored at lwindow3, beam3, top4, boardcands2, secsep1, radius0, drop1, props8, total150, and lmargin9.935836791992188. The latest executed bracket is harmful at 142.3393809000651089036182384006679058074951171874999999999999999999999999999999999999999999999999999999999999934111262854809229847821412177967656668719905977595377625043965617130378177909210407397942490412184878743692466400695923542060097146362711382652253898177530100355170361581258475780487060546875 and exact-flat at 142.339380900065108903618238400667905807495117187500000000000000000000000000000000000000000000000000000000000010089212875357336679552346259845037925163140440959715889540142764876910841507652156367190056155634190442372091082393436707622047624463209819531373621841565703383114538382869795896112918853759765625. This run re-prepares their midpoint, 142.3393809000651089036182384006679058074951171875000000000000000000000000000000000000000000000000000000000000017501695804191298321672437388209017960175655193596268260222696632949743296492865985534921525984263391583706688612315145309140286695497404788982995058296593567093157872704978217370808124542236328125, with a short experiment name to avoid filename-too-long failures.
autoresearch/snapshots/20260420T034601Z_hybrid_p8_m8_w3_v1210.py	0.071006	0.789778	0.739821	0.375000	0.024580	discard	Restore the compact props8 + minsep8 hybrid shelf anchored at lwindow3, beam3, top4, boardcands2, secsep1, radius0, drop1, props8, total150, and lmargin9.935836791992188. The latest executed bracket is harmful at 142.3393809000651089036182384006679058074951171874999999999999999999999999999999999999999999999999999999999999934111262854809229847821412177967656668719905977595377625043965617130378177909210407397942490412184878743692466400695923542060097146362711382652253898177530100355170361581258475780487060546875 and exact-flat at 142.3393809000651089036182384006679058074951171875000000000000000000000000000000000000000000000000000000000000017501695804191298321672437388209017960175655193596268260222696632949743296492865985534921525984263391583706688612315145309140286695497404788982995058296593567093157872704978217370808124542236328125. This run re-prepares their midpoint, 142.33938090006510890361823840066790580749511718749999999999999999999999999999999999999999999999999999999999999758064793295002640847469247830883373144477805855958229426333311250400607372010381964664320081982241351636995775065055344256001919209300580858176244782370618337241641171431183465756475925445556640625, with a short experiment name to avoid filename-too-long failures.
autoresearch/snapshots/20260420T034710Z_hybrid_p8_m8_w3_v1211.py	0.071006	0.789778	0.739821	0.375000	0.024580	discard	Restore the compact props8 + minsep8 hybrid shelf anchored at lwindow3, beam3, top4, boardcands2, secsep1, radius0, drop1, props8, total150, and lmargin9.935836791992188. The latest executed bracket is harmful at 142.33938090006510890361823840066790580749511718749999999999999999999999999999999999999999999999999999999999999758064793295002640847469247830883373144477805855958229426333311250400607372010381964664320081982241351636995775065055344256001919209300580858176244782370618337241641171431183465756475925445556640625 and exact-flat at 142.3393809000651089036182384006679058074951171875000000000000000000000000000000000000000000000000000000000000017501695804191298321672437388209017960175655193596268260222696632949743296492865985534921525984263391583706688612315145309140286695497404788982995058296593567093157872704978217370808124542236328125. This run re-prepares their midpoint, 142.339380900065108903618238400667905807495117187499999999999999999999999999999999999999999999999999999999999999665408756684578120320968108564867763731171788959604560142801387899490201684695209100067676709124376337370313305941033986737023930821373143740030976826682770040866099492404828197322785854339599609375, with a short experiment name to avoid filename-too-long failures.
autoresearch/snapshots/20260420T034820Z_hybrid_p8_m8_w3_v1212.py	0.071006	0.799339	0.749250	0.375000	0.020699	discard	Restore the compact props8 + minsep8 hybrid shelf anchored at lwindow3, beam3, top4, boardcands2, secsep1, radius0, drop1, props8, total150, and lmargin9.935836791992188. The latest executed bracket is harmful at 142.339380900065108903618238400667905807495117187499999999999999999999999999999999999999999999999999999999999999665408756684578120320968108564867763731171788959604560142801387899490201684695209100067676709124376337370313305941033986737023930821373143740030976826682770040866099492404828197322785854339599609375 and exact-flat at 142.3393809000651089036182384006679058074951171875000000000000000000000000000000000000000000000000000000000000017501695804191298321672437388209017960175655193596268260222696632949743296492865985534921525984263391583706688612315145309140286695497404788982995058296593567093157872704978217370808124542236328125. This run re-prepares their midpoint, 142.3393809000651089036182384006679058074951171875000000000000000000000000000000000000000000000000000000000000007077891685518539762441059236928847798743686541596156930825355255972322656669909038267799146537753577478704910835862742588255263001855568113191652413281710633750909433814513249672017991542816162109375, with a short experiment name to avoid filename-too-long failures.
autoresearch/snapshots/20260420T034935Z_hybrid_p8_m8_w3_v1213.py	0.071006	0.799339	0.749250	0.375000	0.020699	discard	Restore the compact props8 + minsep8 hybrid shelf anchored at lwindow3, beam3, top4, boardcands2, secsep1, radius0, drop1, props8, total150, and lmargin9.935836791992188. The latest executed bracket is harmful at 142.339380900065108903618238400667905807495117187499999999999999999999999999999999999999999999999999999999999999665408756684578120320968108564867763731171788959604560142801387899490201684695209100067676709124376337370313305941033986737023930821373143740030976826682770040866099492404828197322785854339599609375 and exact-flat at 142.3393809000651089036182384006679058074951171875000000000000000000000000000000000000000000000000000000000000007077891685518539762441059236928847798743686541596156930825355255972322656669909038267799146537753577478704910835862742588255263001855568113191652413281710633750909433814513249672017991542816162109375. This run re-prepares their midpoint, 142.33938090006510890361823840066790580749511718750000000000000000000000000000000000000000000000000000000000000018659896261821604828253701612887627180277022155961012661266845674836123367584305646342379568144986704262040219476365412278127511550346497752959810907742691670797852143692807658226229250431060791015625, with a short experiment name to avoid filename-too-long failures.
autoresearch/snapshots/20260420T035103Z_hybrid_p8_m8_w3_v1214.py	0.071006	0.789778	0.739821	0.375000	0.024580	discard	Restore the compact props8 + minsep8 hybrid shelf anchored at lwindow3, beam3, top4, boardcands2, secsep1, radius0, drop1, props8, total150, and lmargin9.935836791992188. The latest executed bracket is harmful at 142.339380900065108903618238400667905807495117187499999999999999999999999999999999999999999999999999999999999999665408756684578120320968108564867763731171788959604560142801387899490201684695209100067676709124376337370313305941033986737023930821373143740030976826682770040866099492404828197322785854339599609375 and exact-flat at 142.33938090006510890361823840066790580749511718750000000000000000000000000000000000000000000000000000000000000018659896261821604828253701612887627180277022155961012661266845674836123367584305646342379568144986704262040219476365412278127511550346497752959810907742691670797852143692807658226229250431060791015625. This run re-prepares their midpoint, 142.339380900065108903618238400667905807495117187499999999999999999999999999999999999999999999999999999999999999926003859651397084301752562346872017766971005259607343377734922323925717680269132781745736195287121689995357750352344054759149523162419060634814542952054843374422310464666452389792539179325103759765625, with a short experiment name to avoid filename-too-long failures.
autoresearch/snapshots/20260420T035524Z_hybrid_p8_m8_w3_v1215.py	0.071006	0.799339	0.749250	0.375000	0.020699	discard	Restore the compact props8 + minsep8 hybrid shelf anchored at lwindow3, beam3, top4, boardcands2, secsep1, radius0, drop1, props8, total150, and lmargin9.935836791992188. The latest executed bracket is harmful at 142.339380900065108903618238400667905807495117187499999999999999999999999999999999999999999999999999999999999999926003859651397084301752562346872017766971005259607343377734922323925717680269132781745736195287121689995357750352344054759149523162419060634814542952054843374422310464666452389792539179325103759765625 and exact-flat at 142.33938090006510890361823840066790580749511718750000000000000000000000000000000000000000000000000000000000000018659896261821604828253701612887627180277022155961012661266845674836123367584305646342379568144986704262040219476365412278127511550346497752959810907742691670797852143692807658226229250431060791015625. This run re-prepares their midpoint, 142.3393809000651089036182384006679058074951171875000000000000000000000000000000000000000000000000000000000000000563014111348065662921447892378741447848706134096087349952016895361434756780560946225847659383684943663078799725579990887702123193329420190822063260147408800412004159507972644860274158418178558349609375, with a short experiment name to avoid filename-too-long failures.
autoresearch/snapshots/20260420T035626Z_hybrid_p8_m8_w3_v1216.py	0.071006	0.789778	0.739821	0.375000	0.024580	discard	Restore the compact props8 + minsep8 hybrid shelf anchored at lwindow3, beam3, top4, boardcands2, secsep1, radius0, drop1, props8, total150, and lmargin9.935836791992188. The latest executed bracket is harmful at 142.339380900065108903618238400667905807495117187499999999999999999999999999999999999999999999999999999999999999926003859651397084301752562346872017766971005259607343377734922323925717680269132781745736195287121689995357750352344054759149523162419060634814542952054843374422310464666452389792539179325103759765625 and exact-flat at 142.3393809000651089036182384006679058074951171875000000000000000000000000000000000000000000000000000000000000000563014111348065662921447892378741447848706134096087349952016895361434756780560946225847659383684943663078799725579990887702123193329420190822063260147408800412004159507972644860274158418178558349609375. This run re-prepares their midpoint, 142.33938090006510890361823840066790580749511718749999999999999999999999999999999999999999999999999999999999999999115263539310182529694867579237308127592080933460803918646830593003459667916261370216525106682780802815161886145517157176468092124768053985851043448339786170781136320773185843790997751057147979736328125, with a short experiment name to avoid filename-too-long failures.
autoresearch/snapshots/20260420T035727Z_hybrid_p8_m8_w3_v1217.py	0.071006	0.799339	0.749250	0.375000	0.020699	discard	Restore the compact props8 + minsep8 hybrid shelf anchored at lwindow3, beam3, top4, boardcands2, secsep1, radius0, drop1, props8, total150, and lmargin9.935836791992188. The latest executed bracket is harmful at 142.33938090006510890361823840066790580749511718749999999999999999999999999999999999999999999999999999999999999999115263539310182529694867579237308127592080933460803918646830593003459667916261370216525106682780802815161886145517157176468092124768053985851043448339786170781136320773185843790997751057147979736328125 and exact-flat at 142.3393809000651089036182384006679058074951171875000000000000000000000000000000000000000000000000000000000000000563014111348065662921447892378741447848706134096087349952016895361434756780560946225847659383684943663078799725579990887702123193329420190822063260147408800412004159507972644860274158418178558349609375. This run re-prepares their midpoint, 142.339380900065108903618238400667905807495117187500000000000000000000000000000000000000000000000000000000000000023727023263954195794546732515123613030395711372108387090834997733089036178609354162375008502598151197229749417006585330267446620290311279470358380249069370874505889579264561461968696676194667816162109375, with a short experiment name to avoid filename-too-long failures.
autoresearch/snapshots/20260420T035827Z_hybrid_p8_m8_w3_v1218.py	0.071006	0.799339	0.749250	0.375000	0.020699	discard	Restore the compact props8 + minsep8 hybrid shelf anchored at lwindow3, beam3, top4, boardcands2, secsep1, radius0, drop1, props8, total150, and lmargin9.935836791992188. The latest executed bracket is harmful at 142.33938090006510890361823840066790580749511718749999999999999999999999999999999999999999999999999999999999999999115263539310182529694867579237308127592080933460803918646830593003459667916261370216525106682780802815161886145517157176468092124768053985851043448339786170781136320773185843790997751057147979736328125 and exact-flat at 142.339380900065108903618238400667905807495117187500000000000000000000000000000000000000000000000000000000000000023727023263954195794546732515123613030395711372108387090834997733089036178609354162375008502598151197229749417006585330267446620290311279470358380249069370874505889579264561461968696676194667816162109375. This run re-prepares their midpoint, 142.3393809000651089036182384006679058074951171875000000000000000000000000000000000000000000000000000000000000000074398293285280105457477041537483471531582603533582131386516518315618164288859839322701297847129796126906841392308784510160637707689959096644344073662336162911586263934982099499393370933830738067626953125, with a short experiment name to avoid filename-too-long failures.
autoresearch/snapshots/20260420T035932Z_hybrid_p8_m8_w3_v1219.py	0.071006	0.789778	0.739821	0.375000	0.024580	discard	Restore the compact props8 + minsep8 hybrid shelf anchored at lwindow3, beam3, top4, boardcands2, secsep1, radius0, drop1, props8, total150, and lmargin9.935836791992188. The latest executed bracket is harmful at 142.33938090006510890361823840066790580749511718749999999999999999999999999999999999999999999999999999999999999999115263539310182529694867579237308127592080933460803918646830593003459667916261370216525106682780802815161886145517157176468092124768053985851043448339786170781136320773185843790997751057147979736328125 and exact-flat at 142.3393809000651089036182384006679058074951171875000000000000000000000000000000000000000000000000000000000000000074398293285280105457477041537483471531582603533582131386516518315618164288859839322701297847129796126906841392308784510160637707689959096644344073662336162911586263934982099499393370933830738067626953125. This run re-prepares their midpoint, 142.33938090006510890361823840066790580749511718749999999999999999999999999999999999999999999999999999999999999999929623236081491792134818997306071421453953484398312616255997888079820655402429881721769042577039382042115150034302501139037234600833822476147242092481573899948499480061503419392465730197727680206298828125, with a short experiment name to avoid filename-too-long failures.
autoresearch/snapshots/20260420T040034Z_hybrid_p8_m8_w3_v1220.py	0.071006	0.799339	0.749250	0.375000	0.020699	discard	Restore the compact props8 + minsep8 hybrid shelf anchored at lwindow3, beam3, top4, boardcands2, secsep1, radius0, drop1, props8, total150, and lmargin9.935836791992188. The latest executed bracket is harmful at 142.33938090006510890361823840066790580749511718749999999999999999999999999999999999999999999999999999999999999999929623236081491792134818997306071421453953484398312616255997888079820655402429881721769042577039382042115150034302501139037234600833822476147242092481573899948499480061503419392465730197727680206298828125 and exact-flat at 142.3393809000651089036182384006679058074951171875000000000000000000000000000000000000000000000000000000000000000074398293285280105457477041537483471531582603533582131386516518315618164288859839322701297847129796126906841392308784510160637707689959096644344073662336162911586263934982099499393370933830738067626953125. This run re-prepares their midpoint, 142.339380900065108903618238400667905807495117187500000000000000000000000000000000000000000000000000000000000000003368030844671464233547947063404530683848897598670669650605815356180011491455141374743910105241686716555917819786951731203218058388667067212953414145524677645321810597056622071931997197680175304412841796875, with a short experiment name to avoid filename-too-long failures.
autoresearch/snapshots/20260420T040132Z_hybrid_p8_m8_w3_v1221.py	0.071006	0.799339	0.749250	0.375000	0.020699	discard	Restore the compact props8 + minsep8 hybrid shelf anchored at lwindow3, beam3, top4, boardcands2, secsep1, radius0, drop1, props8, total150, and lmargin9.935836791992188. The latest executed bracket is harmful at 142.33938090006510890361823840066790580749511718749999999999999999999999999999999999999999999999999999999999999999929623236081491792134818997306071421453953484398312616255997888079820655402429881721769042577039382042115150034302501139037234600833822476147242092481573899948499480061503419392465730197727680206298828125 and exact-flat at 142.339380900065108903618238400667905807495117187500000000000000000000000000000000000000000000000000000000000000003368030844671464233547947063404530683848897598670669650605815356180011491455141374743910105241686716555917819786951731203218058388667067212953414145524677645321810597056622071931997197680175304412841796875. This run re-prepares their midpoint, 142.3393809000651089036182384006679058074951171875000000000000000000000000000000000000000000000000000000000000000013321316027431910774480685182326224491942162213268979065828971184891090227397200959808002655060402684885346600649883712967952021985026459872129175351702083224034026988358281329283272498287260532379150390625, with a short experiment name to avoid filename-too-long failures.
autoresearch/snapshots/20260420T040244Z_hybrid_p8_m8_w3_v1222.py	0.071006	0.799339	0.749250	0.375000	0.020699	discard	Restore the compact props8 + minsep8 hybrid shelf anchored at lwindow3, beam3, top4, boardcands2, secsep1, radius0, drop1, props8, total150, and lmargin9.935836791992188. The latest executed bracket is harmful at 142.33938090006510890361823840066790580749511718749999999999999999999999999999999999999999999999999999999999999999929623236081491792134818997306071421453953484398312616255997888079820655402429881721769042577039382042115150034302501139037234600833822476147242092481573899948499480061503419392465730197727680206298828125 and exact-flat at 142.3393809000651089036182384006679058074951171875000000000000000000000000000000000000000000000000000000000000000013321316027431910774480685182326224491942162213268979065828971184891090227397200959808002655060402684885346600649883712967952021985026459872129175351702083224034026988358281329283272498287260532379150390625. This run re-prepares their midpoint, 142.33938090006510890361823840066790580749511718750000000000000000000000000000000000000000000000000000000000000000031418198177905449939812924564666833186687553265501203457143799964365778838200945659924534563821704445484308020400669134358377410342043537434266922999297366094419874972543116342649227590300142765045166015625, with a short experiment name to avoid filename-too-long failures.
autoresearch/snapshots/20260420T040351Z_hybrid_p8_m8_w3_v1223.py	0.071006	0.789778	0.739821	0.375000	0.024580	discard	Restore the compact props8 + minsep8 hybrid shelf anchored at lwindow3, beam3, top4, boardcands2, secsep1, radius0, drop1, props8, total150, and lmargin9.935836791992188. The latest executed bracket is harmful at 142.33938090006510890361823840066790580749511718749999999999999999999999999999999999999999999999999999999999999999929623236081491792134818997306071421453953484398312616255997888079820655402429881721769042577039382042115150034302501139037234600833822476147242092481573899948499480061503419392465730197727680206298828125 and exact-flat at 142.33938090006510890361823840066790580749511718750000000000000000000000000000000000000000000000000000000000000000031418198177905449939812924564666833186687553265501203457143799964365778838200945659924534563821704445484308020400669134358377410342043537434266922999297366094419874972543116342649227590300142765045166015625. This run re-prepares their midpoint, 142.339380900065108903618238400667905807495117187499999999999999999999999999999999999999999999999999999999999999999805207171296986210373159609353691273203205188319069098565708440220932171203154136908467885704305432437997290273515851366978060055879330067907545077404356330214596775170232678675574788940139114856719970703125, with a short experiment name to avoid filename-too-long failures.
