snapshot	board_exact	non_empty_accuracy	macro_f1	move_recall	false_change_rate	status	description
autoresearch/snapshots/20260417T014913Z_hybrid_lookahead_segmental_drop1_boardcands4_ratio95_props16_top10_detect10_minsep2_thresh3_total150_permove125_m9p8957061767578125_r0_v121.py	0.254438	0.841455	0.824022	0.484375	0.015524	discard	Hybrid decoder keeps the baseline lookahead path unless a conservative board-only segmental pass wins the current score-gain gates, while following up the improved low-false-change props16 tradeoff from v120 by widening only board-state breadth from 3 to 4 to test whether the conservative branch still has remaining board-candidate headroom after boardcands3 nearly matched v85's non-empty and macro profile while preserving the lower false-change rate.
autoresearch/snapshots/20260417T015020Z_hybrid_lookahead_segmental_drop1_boardcands3_ratio95_props16_top10_detect10_minsep2_thresh3_total150_permove125_m9p8957061767578125_r0_movew0p25_v122.py	0.254438	0.884089	0.855756	0.500000	0.016818	discard	Hybrid decoder keeps the baseline lookahead path unless a conservative board-only segmental pass wins the current score-gain gates, while following up the promising low-false-change props16 + boardcands3 tradeoff from v120 and adding only a small move-score weight of 0.25 to test whether explicit legal-move evidence can help choose among the newly useful extra board candidates and recover the remaining non-empty and macro gap to v85 without giving back the false-change win.
autoresearch/snapshots/20260417T015137Z_hybrid_lookahead_segmental_drop1_boardcands3_ratio95_props16_top10_detect10_minsep2_thresh3_total150_permove125_m9p8957061767578125_r0_movew0p5_v123.py	0.254438	0.884089	0.855756	0.500000	0.016818	discard	Hybrid decoder keeps the baseline lookahead path unless a conservative board-only segmental pass wins the current score-gain gates, while following up the promising low-false-change props16 + boardcands3 tradeoff from v120 after v122 showed a small move-score weight was inert, and raising only the move-score weight to 0.5 to test whether stronger legal-move evidence can close the remaining non-empty and macro gap to v85 while preserving the lower false-change rate.
autoresearch/snapshots/20260417T015243Z_hybrid_lookahead_segmental_drop1_boardcands3_ratio95_props16_top10_detect10_minsep2_thresh3_total150_permove125_m9p8957061767578125_r0_detectw0p5_v124.py	0.254438	0.884089	0.855756	0.500000	0.016818	discard	Hybrid decoder keeps the baseline lookahead path unless a conservative board-only segmental pass wins the current score-gain gates, while following up the promising low-false-change props16 + boardcands3 tradeoff from v120 after v122-v123 showed added move evidence is inert, and raising only the detect-score weight to 0.5 to test whether stronger move-versus-stay change evidence can close the remaining non-empty and macro gap to v85 while preserving the lower false-change rate.
autoresearch/snapshots/20260417T015403Z_hybrid_lookahead_segmental_drop1_boardcands3_ratio95_props16_top10_detect10_minsep2_thresh3_total150_permove125_m10_r0_v125.py	0.254438	0.884089	0.855756	0.500000	0.016818	discard	Hybrid decoder keeps the baseline lookahead path unless a conservative board-only segmental pass wins the current score-gain gates, while following up the promising low-false-change props16 + boardcands3 tradeoff from v120 after v121-v124 showed board breadth above 3 and added move/detect evidence were inert or harmful, and raising only the move-score margin to 10.0 to test whether the stronger board-candidate branch has reintroduced a useful acceptance-threshold tradeoff like the neighboring props18 family while preserving the lower false-change rate.
autoresearch/snapshots/20260417T015528Z_hybrid_lookahead_segmental_drop1_boardcands3_ratio95_props16_top10_detect10_minsep2_thresh2_total150_permove125_m9p8957061767578125_r0_v126.py	0.254438	0.884089	0.855756	0.500000	0.016818	discard	Hybrid decoder keeps the baseline lookahead path unless a conservative board-only segmental pass wins the current score-gain gates, while following up the promising low-false-change props16 + boardcands3 tradeoff from v120 after v121-v125 showed more board breadth and added move/detect weighting were ineffective, and loosening only the board-change proposal threshold from 3/64 to 2/64 to test whether the conservative branch is still missing a few useful temporal repair proposals even after broadening the initial board candidates.
autoresearch/snapshots/20260417T015632Z_hybrid_lookahead_segmental_drop1_boardcands3_ratio95_props17_top10_detect10_minsep2_thresh3_total150_permove125_m9p8957061767578125_r0_v127.py	0.254438	0.884347	0.856334	0.500000	0.018111	discard	Hybrid decoder keeps the baseline lookahead path unless a conservative board-only segmental pass wins the current score-gain gates, while following up the promising boardcands3 result on the low-false-change props16 branch from v120-v126 and widening only board-state breadth from 2 to 3 on the current best props17 branch to test whether the extra initial board hypothesis helps the main branch too or whether the boardcands3 gain is specific to the lower proposal-budget regime.
autoresearch/snapshots/20260417T015809Z_hybrid_lookahead_segmental_drop1_boardcands3_ratio95_props16_top10_detect10_minsep2_thresh3_total150_permove125_m9p5_r0_v128.py	0.254438	0.884089	0.855756	0.500000	0.016818	discard	Hybrid decoder keeps the baseline lookahead path unless a conservative board-only segmental pass wins the current score-gain gates, while following up the promising low-false-change props16 + boardcands3 tradeoff from v120 after v121-v127 showed added board breadth, thresholds, and score-weight tweaks were inert or harmful, and lowering only the move-score margin from 9.8957061767578125 to 9.5 to test whether the strengthened board-candidate branch still has useful headroom on the more permissive side of the move-acceptance threshold.
autoresearch/snapshots/20260417T015932Z_hybrid_lookahead_segmental_drop1_boardcands3_ratio95_props16_top10_detect10_minsep2_thresh3_total125_permove125_m9p8957061767578125_r0_v129.py	0.254438	0.884089	0.855756	0.500000	0.016818	discard	Hybrid decoder keeps the baseline lookahead path unless a conservative board-only segmental pass wins the current score-gain gates, while following up the promising low-false-change props16 + boardcands3 tradeoff from v120 after v121-v128 showed branch-local score-shaping and proposal-threshold tweaks were inert or harmful, and loosening only the total score-gain gate from 150 to 125 to test whether hybrid selection is still leaving useful conservative repairs on the table in this strengthened board-candidate branch.
autoresearch/snapshots/20260417T020112Z_hybrid_lookahead_segmental_drop1_boardcands3_ratio95_props15_top10_detect10_minsep2_thresh3_total150_permove125_m9p8957061767578125_r0_v130.py	0.254438	0.858147	0.822237	0.468750	0.015524	discard	Hybrid decoder keeps the baseline lookahead path unless a conservative board-only segmental pass wins the current score-gain gates, while following up the promising low-false-change props16 + boardcands3 tradeoff from v120 after v121-v129 showed branch-local score-shaping and threshold tweaks were inert or harmful, and lowering only the proposal budget from 16 to 15 on that stronger board-candidate branch to test whether boardcands3 shifts the proposal-budget floor and can trade a bit more false-change reduction without giving back the current board-exact ceiling.
autoresearch/snapshots/20260417T020628Z_hybrid_lookahead_segmental_drop1_boardcands3_ratio95_props16_top12_detect10_minsep2_thresh3_total150_permove125_m9p8957061767578125_r0_v131.py	0.254438	0.884089	0.855756	0.500000	0.016818	discard	Hybrid decoder keeps the baseline lookahead path unless a conservative board-only segmental pass wins the current score-gain gates, while following up the promising low-false-change props16 + boardcands3 tradeoff from v120 after v121-v130 showed board breadth and proposal-budget shifts are the active levers there, and widening only move-search breadth from 10 to 12 to test whether the stronger board-candidate branch is now limited by legal-move search breadth and can recover some non-empty, macro, and recall without giving back its false-change advantage.
autoresearch/snapshots/20260417T020800Z_hybrid_lookahead_segmental_drop1_boardcands3_ratio95_props18_top10_detect10_minsep2_thresh3_total150_permove125_m9p8957061767578125_r0_v132.py	0.254438	0.898455	0.860396	0.500000	0.019405	discard	Hybrid decoder keeps the baseline lookahead path unless a conservative board-only segmental pass wins the current score-gain gates, while following up v120-v131 by leaving the saturated low-false-change props16 + boardcands3 neighborhood and testing whether the adjacent higher-budget props18 sibling can also benefit from the extra initial board hypothesis, widening board-state breadth from 2 to 3 while raising the proposal budget from 17 to 18 to see whether that interaction can preserve the v89 branch's stronger non-empty and macro profile while improving its false-change tradeoff or confirm that boardcands3 is specific to props16.
autoresearch/snapshots/20260417T020932Z_hybrid_lookahead_segmental_drop1_boardcands3_ratio95_props16_top10_detect10_minsep2_secondarysep1_thresh3_total150_permove125_m9p8957061767578125_r0_v133.py	0.253254	0.884037	0.855731	0.500000	0.018111	discard	Hybrid decoder keeps the baseline lookahead path unless a conservative board-only segmental pass wins the current score-gain gates, while following up v120-v132 by returning to the strongest low-false-change props16 + boardcands3 branch after broader-board and adjacent-budget probes either reproduced known regimes or degraded, and lowering only the secondary event separation from 2 to 1 to test whether allowing tighter nearby timing alternatives can recover additional temporal-ambiguity repairs in the constrained proposal-budget branch without giving back its false-change advantage.
autoresearch/snapshots/20260417T021039Z_hybrid_lookahead_segmental_drop1_boardcands3_ratio100_props16_top10_detect10_minsep2_thresh3_total150_permove125_m9p8957061767578125_r0_v134.py	0.254438	0.884089	0.855756	0.500000	0.016818	discard	Hybrid decoder keeps the baseline lookahead path unless a conservative board-only segmental pass wins the current score-gain gates, while following up v120-v133 by returning to the strongest low-false-change props16 + boardcands3 branch after looser nearby secondary timing in v133 proved harmful, and tightening only the secondary-peak ratio from 0.95 to 1.0 to test whether requiring stronger nearby event alternatives can preserve the branch's false-change advantage while recovering some non-empty and macro quality lost to permissive secondary proposals.
autoresearch/snapshots/20260417T021145Z_hybrid_lookahead_segmental_drop1_boardcands3_ratio95_props16_top10_detect10_minsep2_secondarysep3_thresh3_total150_permove125_m9p8957061767578125_r0_v135.py	0.254438	0.884089	0.855756	0.500000	0.016818	discard	Hybrid decoder keeps the baseline lookahead path unless a conservative board-only segmental pass wins the current score-gain gates, while following up v120-v134 by returning to the strongest low-false-change props16 + boardcands3 branch after looser nearby secondary timing was harmful and a stricter secondary-peak ratio was a no-op, and increasing only the secondary event separation from 2 to 3 to test whether pruning close competing timing peaks can further stabilize the constrained proposal-budget branch without losing its board-exact ceiling.
autoresearch/snapshots/20260417T021317Z_hybrid_lookahead_segmental_drop1_boardcands3_ratio95_props16_top10_detect10_minsep2_thresh3_total150_permove125_m8_r0_v136.py	0.254438	0.884089	0.855756	0.500000	0.016818	discard	Hybrid decoder keeps the baseline lookahead path unless a conservative board-only segmental pass wins the current score-gain gates, while following up v120-v135 by returning to the strongest low-false-change props16 + boardcands3 branch after nearby threshold and secondary-timing probes proved inert or harmful, and lowering only the move-score margin from 9.8957061767578125 to 8.0 to test whether that branch still hides a more permissive move-acceptance threshold farther from the previously no-op 9.5 probe that could recover some non-empty and macro quality without losing the board-exact ceiling.
autoresearch/snapshots/20260417T021447Z_hybrid_lookahead_segmental_drop1_boardcands3_ratio95_props16_top10_detect10_minsep2_thresh3_total150_permove125_m9p8957061767578125_r1_v137.py	0.254438	0.884089	0.855756	0.500000	0.016818	discard	Hybrid decoder keeps the baseline lookahead path unless a conservative board-only segmental pass wins the current score-gain gates, while following up v120-v136 by returning to the strongest low-false-change props16 + boardcands3 branch after nearby proposal-threshold, score-gate, and secondary-timing probes proved inert or harmful, and widening only the event window radius from 0 to 1 to test whether slightly broader local temporal aggregation can resolve remaining move-execution ambiguity in this constrained proposal-budget branch without sacrificing its false-change advantage.
autoresearch/snapshots/20260417T021611Z_hybrid_lookahead_segmental_drop1_boardcands3_ratio95_props16_top10_detect10_minsep3_thresh3_total150_permove125_m9p8957061767578125_r0_v138.py	0.252071	0.884140	0.856280	0.484375	0.019405	discard	Hybrid decoder keeps the baseline lookahead path unless a conservative board-only segmental pass wins the current score-gain gates, while following up v120-v137 by returning to the strongest low-false-change props16 + boardcands3 branch after nearby threshold, timing, and hybrid-gate probes proved inert or harmful, and tightening only the primary event separation from 2 to 3 to test whether the extra initial board breadth can preserve the current board-exact ceiling with a sparser temporal proposal set and potentially improve precision on the move-execution ambiguity cases still driving false changes.
autoresearch/snapshots/20260417T021802Z_hybrid_lookahead_segmental_nodrop_boardcands3_ratio95_props16_top10_detect10_minsep2_thresh3_total150_permove125_m9p8957061767578125_r0_v139.py	0.254438	0.884089	0.855756	0.500000	0.016818	discard	Hybrid decoder keeps the baseline lookahead path unless a conservative board-only segmental pass wins the current score-gain gates, while following up v120-v138 by returning to the strongest low-false-change props16 + boardcands3 branch after nearby timing, threshold, and selection-gate probes proved inert or harmful, and disabling only worst-frame dropping in segment board scoring to test whether the stronger initial board-candidate branch no longer needs that robustness heuristic and can recover some non-empty and macro quality by aggregating full-window board evidence without losing the current board-exact ceiling.
autoresearch/snapshots/20260417T021957Z_hybrid_lookahead_segmental_drop1_boardcands3_ratio95_props16_top10_detect15_minsep2_thresh3_total150_permove125_m9p8957061767578125_r0_v140.py	0.254438	0.884089	0.855756	0.500000	0.016818	discard	Hybrid decoder keeps the baseline lookahead path unless a conservative board-only segmental pass wins the current score-gain gates, while following up v120-v139 by returning to the strongest low-false-change props16 + boardcands3 branch after nearby timing, threshold, and selection-gate probes mostly reproduced the same regime, and raising only the detect peak threshold from 0.1 to 0.15 to test whether filtering weaker detect-driven event proposals can preserve the branch's board-exact ceiling while improving its remaining precision and false-change tradeoff.
autoresearch/snapshots/20260417T022105Z_hybrid_lookahead_segmental_drop1_boardcands3_ratio95_props16_top10_detect15_minsep2_thresh4_total150_permove125_m9p8957061767578125_r0_v141.py	0.254438	0.884089	0.855756	0.500000	0.016818	discard	Hybrid decoder keeps the baseline lookahead path unless a conservative board-only segmental pass wins the current score-gain gates, while following up v120-v140 by returning to the strongest low-false-change props16 + boardcands3 branch after nearby timing, gating, and detect-threshold probes mostly reproduced the same regime, and tightening only the board-change proposal threshold from 3/64 to 4/64 to test whether filtering weaker board-change peaks can preserve the branch's board-exact ceiling while improving its remaining precision and false-change tradeoff.
autoresearch/snapshots/20260417T022217Z_hybrid_lookahead_segmental_drop1_boardcands3_ratio95_props16_top10_detect10_minsep2_thresh3_total150_permove100_m9p8957061767578125_r0_v142.py	0.254438	0.884089	0.855756	0.500000	0.016818	discard	Hybrid decoder keeps the baseline lookahead path unless a conservative board-only segmental pass wins the current score-gain gates, while following up v120-v141 by returning to the strongest low-false-change props16 + boardcands3 branch after proposal-threshold and total-gain gating probes mostly reproduced the same regime, and loosening only the per-added-move score-gain gate from 125 to 100 to test whether hybrid selection is still filtering useful conservative repairs in this branch even though the total score-gain gate appears inactive.
autoresearch/snapshots/20260417T022328Z_hybrid_lookahead_segmental_drop1_boardcands3_ratio95_props16_top9_detect10_minsep2_thresh3_total150_permove125_m9p8957061767578125_r0_v143.py	0.254438	0.884089	0.855756	0.500000	0.016818	discard	Hybrid decoder keeps the baseline lookahead path unless a conservative board-only segmental pass wins the current score-gain gates, while following up v120-v142 by returning to the strongest low-false-change props16 + boardcands3 branch after nearby threshold, timing, and hybrid-selection probes mostly reproduced the same regime, and narrowing only legal-move search breadth from 10 to 9 to test whether the remaining move-search cliff can improve precision or false-change in this branch without giving up its board-exact ceiling.
autoresearch/snapshots/20260417T022431Z_hybrid_lookahead_segmental_drop1_boardcands3_ratio95_props16_top8_detect10_minsep2_thresh3_total150_permove125_m9p8957061767578125_r0_v144.py	0.254438	0.884089	0.855756	0.500000	0.016818	discard	Hybrid decoder keeps the baseline lookahead path unless a conservative board-only segmental pass wins the current score-gain gates, while following up v120-v143 by returning to the strongest low-false-change props16 + boardcands3 branch after nearby threshold, timing, and hybrid-selection probes mostly reproduced the same regime and narrowing legal-move search from 10 to 9 proved inert, and lowering only move-search breadth from 10 to 8 to test whether this branch shares the sharper move-search cliff seen in neighboring families and can trade a bit more search aggression for better precision or false-change without losing the current board-exact ceiling.
autoresearch/snapshots/20260417T022608Z_hybrid_lookahead_segmental_drop1_boardcands3_ratio95_props16_top10_detect10_minsep2_thresh3_total0_permove0_m9p8957061767578125_r0_v145.py	0.134911	0.858509	0.833392	0.531250	0.028461	discard	Hybrid decoder keeps the baseline lookahead path unless a conservative board-only segmental pass wins the current score-gain gates, while following up v120-v144 by returning to the strongest low-false-change props16 + boardcands3 branch after nearby proposal, timing, and one-sided gate relaxations mostly reproduced the same regime, and zeroing both hybrid score-gain gates together to test whether the current branch is already always selecting the same segmental repairs or whether the gates are only jointly filtering useful temporal-ambiguity fixes.
autoresearch/snapshots/20260417T022712Z_hybrid_lookahead_segmental_drop1_boardcands3_ratio95_props16_top10_detect10_minsep2_thresh3_total0_permove125_m9p8957061767578125_r0_v146.py	0.254438	0.884089	0.855756	0.500000	0.016818	discard	Hybrid decoder keeps the baseline lookahead path unless a conservative board-only segmental pass wins the current score-gain gates, while following up v120-v145 by returning to the strongest low-false-change props16 + boardcands3 branch after nearby proposal, timing, and one-sided gate relaxations mostly reproduced the same regime, and zeroing only the total score-gain gate while keeping the per-added-move gate at 125 to test whether the sharp degradation in v145 was driven primarily by admitting low-total-gain repairs or whether the per-move gate is the real selection boundary.
autoresearch/snapshots/20260417T022805Z_hybrid_lookahead_segmental_drop1_boardcands3_ratio95_props16_top10_detect10_minsep2_thresh3_total150_permove0_m9p8957061767578125_r0_v147.py	0.134911	0.858147	0.832719	0.515625	0.025873	discard	Hybrid decoder keeps the baseline lookahead path unless a conservative board-only segmental pass wins the current score-gain gates, while following up v120-v146 by returning to the strongest low-false-change props16 + boardcands3 branch after zeroing only the total-gain gate was a no-op and zeroing both gates was catastrophic, and zeroing only the per-added-move gate while keeping the total score-gain gate at 150 to test whether the per-move gate alone is the real selection boundary that prevents the bad always-segmental regime.
