snapshot	board_exact	non_empty_accuracy	macro_f1	move_recall	false_change_rate	status	description
autoresearch/snapshots/20260419T083705Z_hybrid_lookahead_segmental_drop1_boardcands2_ratio95_props14_top4_detect10_lwindow3_minsep4_secsep1_thresh3_total150_permove150_lmargin9p5_m9p8957061767578125_r2_beam3_v644.py	0.049704	0.765490	0.706758	0.343750	0.025873	discard	Hybrid decoder keeps the baseline lookahead path unless a conservative board-only segmental pass wins the current score-gain gates. The recent lower-beam sweep on the kept v545 branch established beam3 as the last usable lower-beam side branch, while beam2 and beam1 both degrade sharply. On beam3, raising LOOKAHEAD_WINDOW from 1 to 2 reopened a much higher-recall and noisier tradeoff, and tightening min_score_gain_per_added_move from 125.0 to 137.5 reduced that noise materially while preserving most of the recall gain. Narrowing board breadth from 3 to 2 then preserved board_exact while improving recall and false-change at the cost of weaker secondary metrics, while follow-up margin probes localized that narrower-board branch to the same 9.5..9.75 plateau and event-radius, drop, and upper gate follow-ups were non-improving. Lowering min_event_separation from 4 to 3 regressed sharply, while raising LOOKAHEAD_WINDOW from 2 to 3 reopened an even higher-recall and much noisier branch, and tightening min_score_gain_per_added_move from 137.5 to 150.0 was an exact no-op there. On that lwindow3 branch, 9.5625..9.875 all sit on the higher-noise shelf, while 10.0 gives back recall without improving false changes, so 9.5 remains the useful edge. An r1 follow-up on that lwindow3 branch was an exact no-op. This run keeps that lwindow3 + boardcands2 branch and raises only event_window_radius from 1 to 2 to test whether the full allowed proposal neighborhood is also flat there or changes the high-recall noisy surface.
autoresearch/snapshots/20260419T083823Z_hybrid_lookahead_segmental_drop1_boardcands2_ratio95_props14_top4_detect10_lwindow3_minsep4_secsep2_thresh3_total150_permove150_lmargin9p5_m9p8957061767578125_r0_beam3_v645.py	0.049704	0.765490	0.706758	0.343750	0.025873	discard	Hybrid decoder keeps the baseline lookahead path unless a conservative board-only segmental pass wins the current score-gain gates. The recent lower-beam sweep on the kept v545 branch established beam3 as the last usable lower-beam side branch, while beam2 and beam1 both degrade sharply. On beam3, raising LOOKAHEAD_WINDOW from 1 to 2 reopened a much higher-recall and noisier tradeoff, and tightening min_score_gain_per_added_move from 125.0 to 137.5 reduced that noise materially while preserving most of the recall gain. Narrowing board breadth from 3 to 2 then preserved board_exact while improving recall and false-change at the cost of weaker secondary metrics, while follow-up margin probes localized that narrower-board branch to the same 9.5..9.75 plateau and event-radius, drop, and upper gate follow-ups were non-improving. Lowering min_event_separation from 4 to 3 regressed sharply, while raising LOOKAHEAD_WINDOW from 2 to 3 reopened an even higher-recall and much noisier branch. On that lwindow3 branch, tightening min_score_gain_per_added_move and sweeping event_window_radius across 0..2 were exact no-ops, while 9.5625..9.875 all sat on the same higher-noise margin shelf and 10.0 only gave back recall. This run keeps that lwindow3 + boardcands2 branch and raises only secondary_min_event_separation from 1 to 2 to test whether the noisier high-recall branch is also sensitive to secondary spacing or whether secsep1 and secsep2 collapse together there.
autoresearch/snapshots/20260419T083926Z_hybrid_lookahead_segmental_drop1_boardcands2_ratio95_props14_top4_detect10_lwindow3_minsep4_secsep3_thresh3_total150_permove150_lmargin9p5_m9p8957061767578125_r0_beam3_v646.py	0.049704	0.766834	0.711049	0.328125	0.027167	discard	Hybrid decoder keeps the baseline lookahead path unless a conservative board-only segmental pass wins the current score-gain gates. The recent lower-beam sweep on the kept v545 branch established beam3 as the last usable lower-beam side branch, while beam2 and beam1 both degrade sharply. On beam3, raising LOOKAHEAD_WINDOW from 1 to 2 reopened a much higher-recall and noisier tradeoff, and tightening min_score_gain_per_added_move from 125.0 to 137.5 reduced that noise materially while preserving most of the recall gain. Narrowing board breadth from 3 to 2 then preserved board_exact while improving recall and false-change at the cost of weaker secondary metrics, while follow-up margin probes localized that narrower-board branch to the same 9.5..9.75 plateau and event-radius, drop, and upper gate follow-ups were non-improving. Lowering min_event_separation from 4 to 3 regressed sharply, while raising LOOKAHEAD_WINDOW from 2 to 3 reopened an even higher-recall and much noisier branch. On that lwindow3 branch, tightening min_score_gain_per_added_move, sweeping event_window_radius across 0..2, and raising secondary_min_event_separation from 1 to 2 were all exact no-ops, while 9.5625..9.875 all sat on the same higher-noise margin shelf and 10.0 only gave back recall. This run keeps that lwindow3 + boardcands2 branch and raises only secondary_min_event_separation from 2 to 3 to test whether secondary spacing stays flat above secsep2 there or whether a higher-spacing shelf finally appears.
autoresearch/snapshots/20260419T084030Z_hybrid_lookahead_segmental_drop1_boardcands2_ratio95_props14_top4_detect10_lwindow3_minsep4_secsep4_thresh3_total150_permove150_lmargin9p5_m9p8957061767578125_r0_beam3_v647.py	0.049704	0.766834	0.711049	0.328125	0.027167	discard	Hybrid decoder keeps the baseline lookahead path unless a conservative board-only segmental pass wins the current score-gain gates. The recent lower-beam sweep on the kept v545 branch established beam3 as the last usable lower-beam side branch, while beam2 and beam1 both degrade sharply. On beam3, raising LOOKAHEAD_WINDOW from 1 to 2 reopened a much higher-recall and noisier tradeoff, and tightening min_score_gain_per_added_move from 125.0 to 137.5 reduced that noise materially while preserving most of the recall gain. Narrowing board breadth from 3 to 2 then preserved board_exact while improving recall and false-change at the cost of weaker secondary metrics, while follow-up margin probes localized that narrower-board branch to the same 9.5..9.75 plateau and event-radius, drop, and upper gate follow-ups were non-improving. Lowering min_event_separation from 4 to 3 regressed sharply, while raising LOOKAHEAD_WINDOW from 2 to 3 reopened an even higher-recall and much noisier branch. On that lwindow3 branch, tightening min_score_gain_per_added_move, sweeping event_window_radius across 0..2, and raising secondary_min_event_separation from 1 to 2 were exact no-ops, while secsep3 finally changed the branch by giving back some recall and still not improving false changes. This run keeps that lwindow3 + boardcands2 branch and raises only secondary_min_event_separation from 3 to 4 to test whether secsep3 was already the full upper transition or whether a higher-spacing shelf appears above it.
autoresearch/snapshots/20260419T084218Z_hybrid_lookahead_segmental_drop1_boardcands2_ratio95_props14_top4_detect10_lwindow3_minsep4_secsep5_thresh3_total150_permove150_lmargin9p5_m9p8957061767578125_r0_beam3_v648.py	0.049704	0.766834	0.711049	0.328125	0.027167	discard	Hybrid decoder keeps the baseline lookahead path unless a conservative board-only segmental pass wins the current score-gain gates. The recent lower-beam sweep on the kept v545 branch established beam3 as the last usable lower-beam side branch, while beam2 and beam1 both degrade sharply. On beam3, raising LOOKAHEAD_WINDOW from 1 to 2 reopened a much higher-recall and noisier tradeoff, and tightening min_score_gain_per_added_move from 125.0 to 137.5 reduced that noise materially while preserving most of the recall gain. Narrowing board breadth from 3 to 2 then preserved board_exact while improving recall and false-change at the cost of weaker secondary metrics, while follow-up margin probes localized that narrower-board branch to the same 9.5..9.75 plateau and event-radius, drop, and upper gate follow-ups were non-improving. Lowering min_event_separation from 4 to 3 regressed sharply, while raising LOOKAHEAD_WINDOW from 2 to 3 reopened an even higher-recall and much noisier branch. On that lwindow3 branch, tightening min_score_gain_per_added_move, sweeping event_window_radius across 0..2, and raising secondary_min_event_separation from 1 to 2 were exact no-ops, while secsep3 finally changed the branch by giving back some recall and still not improving false changes, and secsep4 matched that shifted branch exactly. This run keeps that lwindow3 + boardcands2 branch and raises only secondary_min_event_separation from 4 to 5 to test whether secsep3/4 were already the full upper shelf or whether the higher-spacing shelf extends further.
autoresearch/snapshots/20260419T084332Z_hybrid_lookahead_segmental_drop1_boardcands2_ratio95_props14_top4_detect10_lwindow3_minsep4_secsep6_thresh3_total150_permove150_lmargin9p5_m9p8957061767578125_r0_beam3_v649.py	0.049704	0.766834	0.711049	0.328125	0.027167	discard	Hybrid decoder keeps the baseline lookahead path unless a conservative board-only segmental pass wins the current score-gain gates. The recent lower-beam sweep on the kept v545 branch established beam3 as the last usable lower-beam side branch, while beam2 and beam1 both degrade sharply. On beam3, raising LOOKAHEAD_WINDOW from 1 to 2 reopened a much higher-recall and noisier tradeoff, and tightening min_score_gain_per_added_move from 125.0 to 137.5 reduced that noise materially while preserving most of the recall gain. Narrowing board breadth from 3 to 2 then preserved board_exact while improving recall and false-change at the cost of weaker secondary metrics, while follow-up margin probes localized that narrower-board branch to the same 9.5..9.75 plateau and event-radius, drop, and upper gate follow-ups were non-improving. Lowering min_event_separation from 4 to 3 regressed sharply, while raising LOOKAHEAD_WINDOW from 2 to 3 reopened an even higher-recall and much noisier branch. On that lwindow3 branch, tightening min_score_gain_per_added_move, sweeping event_window_radius across 0..2, and raising secondary_min_event_separation from 1 to 2 were exact no-ops, while secsep3 finally changed the branch by giving back some recall and still not improving false changes, and secsep4/5 matched that shifted branch exactly. This run keeps that lwindow3 + boardcands2 branch and raises only secondary_min_event_separation from 5 to 6 to test whether secsep3..5 were already the full upper shelf or whether it extends one step further.
autoresearch/snapshots/20260419T084440Z_hybrid_lookahead_segmental_drop1_boardcands2_ratio98_props14_top4_detect10_lwindow3_minsep4_secsep3_thresh3_total150_permove150_lmargin9p5_m9p8957061767578125_r0_beam3_v650.py	0.049704	0.766834	0.711049	0.328125	0.027167	discard	Hybrid decoder keeps the baseline lookahead path unless a conservative board-only segmental pass wins the current score-gain gates. The recent lower-beam sweep on the kept v545 branch established beam3 as the last usable lower-beam side branch, while beam2 and beam1 both degrade sharply. On beam3, raising LOOKAHEAD_WINDOW from 1 to 2 reopened a much higher-recall and noisier tradeoff, and tightening min_score_gain_per_added_move from 125.0 to 137.5 reduced that noise materially while preserving most of the recall gain. Narrowing board breadth from 3 to 2 then preserved board_exact while improving recall and false-change at the cost of weaker secondary metrics, while follow-up margin probes localized that narrower-board branch to the same 9.5..9.75 plateau and event-radius, drop, and upper gate follow-ups were non-improving. Lowering min_event_separation from 4 to 3 regressed sharply, while raising LOOKAHEAD_WINDOW from 2 to 3 reopened an even higher-recall and much noisier branch. On that lwindow3 branch, tightening min_score_gain_per_added_move, sweeping event_window_radius across 0..2, and raising secondary_min_event_separation from 1 to 2 were exact no-ops, while secsep3 finally changed the branch by giving back some recall and still not improving false changes, and secsep4/5/6 matched that shifted branch exactly. This run keeps the representative lwindow3 + boardcands2 + secsep3 upper shelf and raises only secondary_peak_ratio from 0.95 to 0.98 to test whether stricter secondary-peak acceptance can trim noise on that shelf without giving back more recall.
autoresearch/snapshots/20260419T084600Z_hybrid_lookahead_segmental_drop0_boardcands2_ratio98_props14_top4_detect10_lwindow3_minsep4_secsep3_thresh3_total150_permove150_lmargin9p5_m9p8957061767578125_r0_beam3_v651.py	0.049704	0.764353	0.707248	0.343750	0.029754	discard	Hybrid decoder keeps the baseline lookahead path unless a conservative board-only segmental pass wins the current score-gain gates. The recent lower-beam sweep on the kept v545 branch established beam3 as the last usable lower-beam side branch, while beam2 and beam1 both degrade sharply. On beam3, raising LOOKAHEAD_WINDOW from 1 to 2 reopened a much higher-recall and noisier tradeoff, and tightening min_score_gain_per_added_move from 125.0 to 137.5 reduced that noise materially while preserving most of the recall gain. Narrowing board breadth from 3 to 2 then preserved board_exact while improving recall and false-change at the cost of weaker secondary metrics, while follow-up margin probes localized that narrower-board branch to the same 9.5..9.75 plateau and event-radius, drop, and upper gate follow-ups were non-improving. Lowering min_event_separation from 4 to 3 regressed sharply, while raising LOOKAHEAD_WINDOW from 2 to 3 reopened an even higher-recall and much noisier branch. On that lwindow3 branch, tightening min_score_gain_per_added_move, sweeping event_window_radius across 0..2, and raising secondary_min_event_separation from 1 to 2 were exact no-ops, while secsep3 finally changed the branch by giving back some recall and still not improving false changes, and secsep4/5/6 plus secondary_peak_ratio=0.98 all matched that shifted upper shelf exactly. This run keeps that representative upper shelf and lowers only segment_board_drop_worst_frames from 1 to 0 to test whether dropping the worst frame per segment can trim noise on the lwindow3 shelf or whether drop1 remains locally optimal there.
autoresearch/snapshots/20260419T084714Z_hybrid_lookahead_segmental_drop1_boardcands2_ratio95_props14_top4_detect10_lwindow3_minsep5_secsep3_thresh3_total150_permove150_lmargin9p5_m9p8957061767578125_r0_beam3_v652.py	0.049704	0.762183	0.705698	0.343750	0.025873	discard	Hybrid decoder keeps the baseline lookahead path unless a conservative board-only segmental pass wins the current score-gain gates. The recent lower-beam sweep on the kept v545 branch established beam3 as the last usable lower-beam side branch, while beam2 and beam1 both degrade sharply. On beam3, raising LOOKAHEAD_WINDOW from 1 to 2 reopened a much higher-recall and noisier tradeoff, and tightening min_score_gain_per_added_move from 125.0 to 137.5 reduced that noise materially while preserving most of the recall gain. Narrowing board breadth from 3 to 2 then preserved board_exact while improving recall and false-change at the cost of weaker secondary metrics, while follow-up margin probes localized that narrower-board branch to the same 9.5..9.75 plateau and event-radius, drop, and upper gate follow-ups were non-improving. Lowering min_event_separation from 4 to 3 regressed sharply, while raising LOOKAHEAD_WINDOW from 2 to 3 reopened an even higher-recall and much noisier branch. On that lwindow3 branch, tightening min_score_gain_per_added_move and sweeping event_window_radius across 0..2 were exact no-ops; secsep3 opened a shifted upper shelf, secsep4/5/6 matched it exactly, secondary_peak_ratio=0.98 was a no-op there, and drop0 was harmful. This run keeps the representative lwindow3 + boardcands2 + secsep3 upper shelf and raises only min_event_separation from 4 to 5 to test whether stricter primary spacing can tame that noisy high-recall surface or whether it just gives back recall.
autoresearch/snapshots/20260419T084821Z_hybrid_lookahead_segmental_drop1_boardcands2_ratio95_props14_top4_detect10_lwindow3_minsep6_secsep3_thresh3_total150_permove150_lmargin9p5_m9p8957061767578125_r0_beam3_v653.py	0.049704	0.762183	0.705698	0.343750	0.025873	discard	Hybrid decoder keeps the baseline lookahead path unless a conservative board-only segmental pass wins the current score-gain gates. The recent lower-beam sweep on the kept v545 branch established beam3 as the last usable lower-beam side branch, while beam2 and beam1 both degrade sharply. On beam3, raising LOOKAHEAD_WINDOW from 1 to 2 reopened a much higher-recall and noisier tradeoff, and tightening min_score_gain_per_added_move from 125.0 to 137.5 reduced that noise materially while preserving most of the recall gain. Narrowing board breadth from 3 to 2 then preserved board_exact while improving recall and false-change at the cost of weaker secondary metrics, while follow-up margin probes localized that narrower-board branch to the same 9.5..9.75 plateau and event-radius, drop, and upper gate follow-ups were non-improving. Lowering min_event_separation from 4 to 3 regressed sharply, while raising LOOKAHEAD_WINDOW from 2 to 3 reopened an even higher-recall and much noisier branch. On that lwindow3 branch, tightening min_score_gain_per_added_move and sweeping event_window_radius across 0..2 were exact no-ops; secsep3 opened a shifted upper shelf, secsep4/5/6 plus secondary_peak_ratio=0.98 matched it exactly, and drop0 was harmful. Raising min_event_separation from 4 to 5 on that upper shelf then preserved board_exact, recovered the higher recall, and reduced false changes. This run keeps that lwindow3 + boardcands2 + secsep3 branch and raises only min_event_separation from 5 to 6 to test whether that stricter primary-spacing move has reached a new plateau or whether the shelf still shifts one step higher.
autoresearch/snapshots/20260419T084938Z_hybrid_lookahead_segmental_drop1_boardcands2_ratio95_props14_top4_detect10_lwindow3_minsep7_secsep3_thresh3_total150_permove150_lmargin9p5_m9p8957061767578125_r0_beam3_v654.py	0.062722	0.776187	0.738746	0.406250	0.024580	discard	Hybrid decoder keeps the baseline lookahead path unless a conservative board-only segmental pass wins the current score-gain gates. The recent lower-beam sweep on the kept v545 branch established beam3 as the last usable lower-beam side branch, while beam2 and beam1 both degrade sharply. On beam3, raising LOOKAHEAD_WINDOW from 1 to 2 reopened a much higher-recall and noisier tradeoff, and tightening min_score_gain_per_added_move from 125.0 to 137.5 reduced that noise materially while preserving most of the recall gain. Narrowing board breadth from 3 to 2 then preserved board_exact while improving recall and false-change at the cost of weaker secondary metrics, while follow-up margin probes localized that narrower-board branch to the same 9.5..9.75 plateau and event-radius, drop, and upper gate follow-ups were non-improving. Lowering min_event_separation from 4 to 3 regressed sharply, while raising LOOKAHEAD_WINDOW from 2 to 3 reopened an even higher-recall and much noisier branch. On that lwindow3 branch, tightening min_score_gain_per_added_move and sweeping event_window_radius across 0..2 were exact no-ops; secsep3 opened a shifted upper shelf, secsep4/5/6 plus secondary_peak_ratio=0.98 matched it exactly, and drop0 was harmful. Raising min_event_separation from 4 to 5 on that upper shelf then preserved board_exact, recovered the higher recall, and reduced false changes, while 6 was an exact no-op. This run keeps that lwindow3 + boardcands2 + secsep3 branch and raises only min_event_separation from 6 to 7 to test whether the stricter primary-spacing plateau extends one step further or finally shifts again.
