snapshot	board_exact	non_empty_accuracy	macro_f1	move_recall	false_change_rate	status	description
autoresearch/snapshots/20260419T113318Z_hybrid_lookahead_segmental_drop1_boardcands2_ratio95_props14_top4_detect10_lwindow3_minsep7_secsep1_thresh3_total150_permove162p5_lmargin9p935836791992188_m9p8957061767578125_r0_beam3_v748.py	0.071006	0.779288	0.743944	0.437500	0.027167	discard	Hybrid decoder keeps the baseline lookahead path unless a conservative board-only segmental pass wins the current score-gain gates. The recent lower-beam sweep on the kept v545 branch established beam3 as the last usable lower-beam side branch, while beam2 and beam1 both degrade sharply. On beam3, raising LOOKAHEAD_WINDOW from 1 to 2 reopened a much higher-recall and noisier tradeoff, and tightening min_score_gain_per_added_move from 125.0 to 137.5 reduced that noise materially while preserving most of the recall gain. Narrowing board breadth from 3 to 2 then preserved board_exact while improving recall and false-change at the cost of weaker secondary metrics, while follow-up margin probes localized that narrower-board branch to the same 9.5..9.75 plateau and event-radius, drop, and upper gate follow-ups were non-improving. Lowering min_event_separation from 4 to 3 regressed sharply, while raising LOOKAHEAD_WINDOW from 2 to 3 reopened an even higher-recall and much noisier branch. On that lwindow3 branch, tightening min_score_gain_per_added_move and sweeping event_window_radius across 0..2 were exact no-ops; secsep3 opened a shifted upper shelf, secsep4/5/6 plus secondary_peak_ratio=0.98 matched it exactly, and drop0 was harmful. Raising min_event_separation from 4 to 5 on that upper shelf then preserved board_exact, recovered the higher recall, and reduced false changes; 6 was an exact no-op, 7 opened a much stronger higher-recall branch, 8 improved it again, and 9 was an exact no-op, while 10 was worse. On that stronger minsep8 branch, LOOKAHEAD_MARGIN=9.5625, 9.75, and 10.0 were all worse than 9.5, and lowering secondary_min_event_separation from 3 to 1 improved false changes slightly without hurting recall. On that secsep1 minsep8 branch, event_window_radius stayed flat across 0..2, tightening secondary_peak_ratio to 0.98 was an exact no-op, lowering segment_board_drop_worst_frames to 0 was also an exact no-op, and raising LOOKAHEAD_WINDOW to 4 collapsed badly and was not rescued by nearby spacing changes. Returning to the distinct lower-noise secsep1 minsep7 branch, raising LOOKAHEAD_MARGIN from 9.5 to 9.5625 unexpectedly matched the stronger minsep8 board_exact while increasing recall further at the cost of more false changes, 9.625 and 9.75 were exact no-ops, 9.875 improved secondary metrics without changing board_exact, recall, or false-change, and both 9.9375 and 10.0 dropped to a lower-recall / lower-noise regime. Binary localization then found the cliff is saturated at machine precision: 9.935836791992188 is the last confirmed higher-recall shelf point, while the adjacent next representable float 9.93583679199219 already falls into the lower-recall regime, so there is no distinct midpoint left to test. Follow-ups at that cliff-edge high-shelf anchor showed event_window_radius is flat across 0..2, lowering segment_board_drop_worst_frames from 1 to 0 is an exact no-op, tightening secondary_peak_ratio to 0.98 is an exact no-op, lowering top_move_candidates from 4 to 3 is an exact no-op while 1..2 are worse, raising max_event_proposals from 14 to 15 is worse, raising beam_size from 3 to 4 worsens secondary metrics without helping board_exact, recall, or false-change, lowering top_board_candidates from 2 to 1 also fails to improve the shelf, raising top_board_candidates from 2 to 3 hurts secondary metrics, raising secondary_min_event_separation from 1 to 2 worsens secondary metrics and false-change while keeping board_exact and recall fixed, and tightening min_total_score_gain from 150.0 through 162.5, 175.0, and 187.5 are all exact no-ops, confirming the secsep1-specific improvement still holds at the machine-precision boundary while the total-score gate is not yet binding. This run restores the locally preferred cliff-edge anchor, resets min_total_score_gain to 150.0, and raises only min_score_gain_per_added_move from 150.0 to 162.5 to test whether the per-added-move acceptance gate binds earlier than the total-score gate on this stabilized board_exact / recall shelf.
autoresearch/snapshots/20260419T113438Z_hybrid_lookahead_segmental_drop1_boardcands2_ratio95_props14_top4_detect10_lwindow3_minsep7_secsep1_thresh3_total150_permove175_lmargin9p935836791992188_m9p8957061767578125_r0_beam3_v749.py	0.071006	0.779288	0.743944	0.437500	0.027167	discard	Hybrid decoder keeps the baseline lookahead path unless a conservative board-only segmental pass wins the current score-gain gates. The recent lower-beam sweep on the kept v545 branch established beam3 as the last usable lower-beam side branch, while beam2 and beam1 both degrade sharply. On beam3, raising LOOKAHEAD_WINDOW from 1 to 2 reopened a much higher-recall and noisier tradeoff, and tightening min_score_gain_per_added_move from 125.0 to 137.5 reduced that noise materially while preserving most of the recall gain. Narrowing board breadth from 3 to 2 then preserved board_exact while improving recall and false-change at the cost of weaker secondary metrics, while follow-up margin probes localized that narrower-board branch to the same 9.5..9.75 plateau and event-radius, drop, and upper gate follow-ups were non-improving. Lowering min_event_separation from 4 to 3 regressed sharply, while raising LOOKAHEAD_WINDOW from 2 to 3 reopened an even higher-recall and much noisier branch. On that lwindow3 branch, tightening min_score_gain_per_added_move and sweeping event_window_radius across 0..2 were exact no-ops; secsep3 opened a shifted upper shelf, secsep4/5/6 plus secondary_peak_ratio=0.98 matched it exactly, and drop0 was harmful. Raising min_event_separation from 4 to 5 on that upper shelf then preserved board_exact, recovered the higher recall, and reduced false changes; 6 was an exact no-op, 7 opened a much stronger higher-recall branch, 8 improved it again, and 9 was an exact no-op, while 10 was worse. On that stronger minsep8 branch, LOOKAHEAD_MARGIN=9.5625, 9.75, and 10.0 were all worse than 9.5, and lowering secondary_min_event_separation from 3 to 1 improved false changes slightly without hurting recall. On that secsep1 minsep8 branch, event_window_radius stayed flat across 0..2, tightening secondary_peak_ratio to 0.98 was an exact no-op, lowering segment_board_drop_worst_frames to 0 was also an exact no-op, and raising LOOKAHEAD_WINDOW to 4 collapsed badly and was not rescued by nearby spacing changes. Returning to the distinct lower-noise secsep1 minsep7 branch, raising LOOKAHEAD_MARGIN from 9.5 to 9.5625 unexpectedly matched the stronger minsep8 board_exact while increasing recall further at the cost of more false changes, 9.625 and 9.75 were exact no-ops, 9.875 improved secondary metrics without changing board_exact, recall, or false-change, and both 9.9375 and 10.0 dropped to a lower-recall / lower-noise regime. Binary localization then found the cliff is saturated at machine precision: 9.935836791992188 is the last confirmed higher-recall shelf point, while the adjacent next representable float 9.93583679199219 already falls into the lower-recall regime, so there is no distinct midpoint left to test. Follow-ups at that cliff-edge high-shelf anchor showed event_window_radius is flat across 0..2, lowering segment_board_drop_worst_frames from 1 to 0 is an exact no-op, tightening secondary_peak_ratio to 0.98 is an exact no-op, lowering top_move_candidates from 4 to 3 is an exact no-op while 1..2 are worse, raising max_event_proposals from 14 to 15 is worse, raising beam_size from 3 to 4 worsens secondary metrics without helping board_exact, recall, or false-change, lowering top_board_candidates from 2 to 1 also fails to improve the shelf, raising top_board_candidates from 2 to 3 hurts secondary metrics, raising secondary_min_event_separation from 1 to 2 worsens secondary metrics and false-change while keeping board_exact and recall fixed, tightening min_total_score_gain from 150.0 through 162.5, 175.0, and 187.5 are all exact no-ops, and raising min_score_gain_per_added_move from 150.0 to 162.5 is also an exact no-op, confirming the secsep1-specific improvement still holds at the machine-precision boundary while both hybrid acceptance gates remain non-binding so far. This run restores the locally preferred cliff-edge anchor and raises only min_score_gain_per_added_move from 162.5 to 175.0 to continue locating where that per-added-move acceptance threshold actually starts changing the stabilized board_exact/recall shelf.
autoresearch/snapshots/20260419T113606Z_hybrid_lookahead_segmental_drop1_boardcands2_ratio95_props14_top4_detect10_lwindow3_minsep7_secsep1_thresh3_total150_permove187p5_lmargin9p935836791992188_m9p8957061767578125_r0_beam3_v750.py	0.071006	0.779288	0.743944	0.437500	0.027167	discard	Hybrid decoder keeps the baseline lookahead path unless a conservative board-only segmental pass wins the current score-gain gates. The recent lower-beam sweep on the kept v545 branch established beam3 as the last usable lower-beam side branch, while beam2 and beam1 both degrade sharply. On beam3, raising LOOKAHEAD_WINDOW from 1 to 2 reopened a much higher-recall and noisier tradeoff, and tightening min_score_gain_per_added_move from 125.0 to 137.5 reduced that noise materially while preserving most of the recall gain. Narrowing board breadth from 3 to 2 then preserved board_exact while improving recall and false-change at the cost of weaker secondary metrics, while follow-up margin probes localized that narrower-board branch to the same 9.5..9.75 plateau and event-radius, drop, and upper gate follow-ups were non-improving. Lowering min_event_separation from 4 to 3 regressed sharply, while raising LOOKAHEAD_WINDOW from 2 to 3 reopened an even higher-recall and much noisier branch. On that lwindow3 branch, tightening min_score_gain_per_added_move and sweeping event_window_radius across 0..2 were exact no-ops; secsep3 opened a shifted upper shelf, secsep4/5/6 plus secondary_peak_ratio=0.98 matched it exactly, and drop0 was harmful. Raising min_event_separation from 4 to 5 on that upper shelf then preserved board_exact, recovered the higher recall, and reduced false changes; 6 was an exact no-op, 7 opened a much stronger higher-recall branch, 8 improved it again, and 9 was an exact no-op, while 10 was worse. On that stronger minsep8 branch, LOOKAHEAD_MARGIN=9.5625, 9.75, and 10.0 were all worse than 9.5, and lowering secondary_min_event_separation from 3 to 1 improved false changes slightly without hurting recall. On that secsep1 minsep8 branch, event_window_radius stayed flat across 0..2, tightening secondary_peak_ratio to 0.98 was an exact no-op, lowering segment_board_drop_worst_frames to 0 was also an exact no-op, and raising LOOKAHEAD_WINDOW to 4 collapsed badly and was not rescued by nearby spacing changes. Returning to the distinct lower-noise secsep1 minsep7 branch, raising LOOKAHEAD_MARGIN from 9.5 to 9.5625 unexpectedly matched the stronger minsep8 board_exact while increasing recall further at the cost of more false changes, 9.625 and 9.75 were exact no-ops, 9.875 improved secondary metrics without changing board_exact, recall, or false-change, and both 9.9375 and 10.0 dropped to a lower-recall / lower-noise regime. Binary localization then found the cliff is saturated at machine precision: 9.935836791992188 is the last confirmed higher-recall shelf point, while the adjacent next representable float 9.93583679199219 already falls into the lower-recall regime, so there is no distinct midpoint left to test. Follow-ups at that cliff-edge high-shelf anchor showed event_window_radius is flat across 0..2, lowering segment_board_drop_worst_frames from 1 to 0 is an exact no-op, tightening secondary_peak_ratio to 0.98 is an exact no-op, lowering top_move_candidates from 4 to 3 is an exact no-op while 1..2 are worse, raising max_event_proposals from 14 to 15 is worse, raising beam_size from 3 to 4 worsens secondary metrics without helping board_exact, recall, or false-change, lowering top_board_candidates from 2 to 1 also fails to improve the shelf, raising top_board_candidates from 2 to 3 hurts secondary metrics, raising secondary_min_event_separation from 1 to 2 worsens secondary metrics and false-change while keeping board_exact and recall fixed, tightening min_total_score_gain from 150.0 through 162.5, 175.0, and 187.5 are all exact no-ops, and raising min_score_gain_per_added_move from 150.0 to 162.5 and then 175.0 are also exact no-ops, confirming the secsep1-specific improvement still holds at the machine-precision boundary while both hybrid acceptance gates remain non-binding so far. This run restores the locally preferred cliff-edge anchor and raises only min_score_gain_per_added_move from 175.0 to 187.5 to continue locating where that per-added-move acceptance threshold actually starts changing the stabilized board_exact/recall shelf.
autoresearch/snapshots/20260419T113728Z_hybrid_lookahead_segmental_drop1_boardcands2_ratio95_props14_top4_detect10_lwindow3_minsep7_secsep1_thresh3_total150_permove200_lmargin9p935836791992188_m9p8957061767578125_r0_beam3_v751.py	0.071006	0.779288	0.743944	0.437500	0.027167	discard	Hybrid decoder keeps the baseline lookahead path unless a conservative board-only segmental pass wins the current score-gain gates. The recent lower-beam sweep on the kept v545 branch established beam3 as the last usable lower-beam side branch, while beam2 and beam1 both degrade sharply. On beam3, raising LOOKAHEAD_WINDOW from 1 to 2 reopened a much higher-recall and noisier tradeoff, and tightening min_score_gain_per_added_move from 125.0 to 137.5 reduced that noise materially while preserving most of the recall gain. Narrowing board breadth from 3 to 2 then preserved board_exact while improving recall and false-change at the cost of weaker secondary metrics, while follow-up margin probes localized that narrower-board branch to the same 9.5..9.75 plateau and event-radius, drop, and upper gate follow-ups were non-improving. Lowering min_event_separation from 4 to 3 regressed sharply, while raising LOOKAHEAD_WINDOW from 2 to 3 reopened an even higher-recall and much noisier branch. On that lwindow3 branch, tightening min_score_gain_per_added_move and sweeping event_window_radius across 0..2 were exact no-ops; secsep3 opened a shifted upper shelf, secsep4/5/6 plus secondary_peak_ratio=0.98 matched it exactly, and drop0 was harmful. Raising min_event_separation from 4 to 5 on that upper shelf then preserved board_exact, recovered the higher recall, and reduced false changes; 6 was an exact no-op, 7 opened a much stronger higher-recall branch, 8 improved it again, and 9 was an exact no-op, while 10 was worse. On that stronger minsep8 branch, LOOKAHEAD_MARGIN=9.5625, 9.75, and 10.0 were all worse than 9.5, and lowering secondary_min_event_separation from 3 to 1 improved false changes slightly without hurting recall. On that secsep1 minsep8 branch, event_window_radius stayed flat across 0..2, tightening secondary_peak_ratio to 0.98 was an exact no-op, lowering segment_board_drop_worst_frames to 0 was also an exact no-op, and raising LOOKAHEAD_WINDOW to 4 collapsed badly and was not rescued by nearby spacing changes. Returning to the distinct lower-noise secsep1 minsep7 branch, raising LOOKAHEAD_MARGIN from 9.5 to 9.5625 unexpectedly matched the stronger minsep8 board_exact while increasing recall further at the cost of more false changes, 9.625 and 9.75 were exact no-ops, 9.875 improved secondary metrics without changing board_exact, recall, or false-change, and both 9.9375 and 10.0 dropped to a lower-recall / lower-noise regime. Binary localization then found the cliff is saturated at machine precision: 9.935836791992188 is the last confirmed higher-recall shelf point, while the adjacent next representable float 9.93583679199219 already falls into the lower-recall regime, so there is no distinct midpoint left to test. Follow-ups at that cliff-edge high-shelf anchor showed event_window_radius is flat across 0..2, lowering segment_board_drop_worst_frames from 1 to 0 is an exact no-op, tightening secondary_peak_ratio to 0.98 is an exact no-op, lowering top_move_candidates from 4 to 3 is an exact no-op while 1..2 are worse, raising max_event_proposals from 14 to 15 is worse, raising beam_size from 3 to 4 worsens secondary metrics without helping board_exact, recall, or false-change, lowering top_board_candidates from 2 to 1 also fails to improve the shelf, raising top_board_candidates from 2 to 3 hurts secondary metrics, raising secondary_min_event_separation from 1 to 2 worsens secondary metrics and false-change while keeping board_exact and recall fixed, tightening min_total_score_gain from 150.0 through 162.5, 175.0, and 187.5 are all exact no-ops, and raising min_score_gain_per_added_move from 150.0 through 162.5, 175.0, and 187.5 are also exact no-ops, confirming the secsep1-specific improvement still holds at the machine-precision boundary while both hybrid acceptance gates remain non-binding so far. This run restores the locally preferred cliff-edge anchor and raises only min_score_gain_per_added_move from 187.5 to 200.0 to continue locating where that per-added-move acceptance threshold actually starts changing the stabilized board_exact/recall shelf.
autoresearch/snapshots/20260419T113853Z_hybrid_lookahead_segmental_drop1_boardcands2_ratio95_props13_top4_detect10_lwindow3_minsep7_secsep1_thresh3_total150_permove150_lmargin9p935836791992188_m9p8957061767578125_r0_beam3_v752.py	0.071006	0.762803	0.710022	0.437500	0.024580	discard	Hybrid decoder keeps the baseline lookahead path unless a conservative board-only segmental pass wins the current score-gain gates. The recent lower-beam sweep on the kept v545 branch established beam3 as the last usable lower-beam side branch, while beam2 and beam1 both degrade sharply. On beam3, raising LOOKAHEAD_WINDOW from 1 to 2 reopened a much higher-recall and noisier tradeoff, and tightening min_score_gain_per_added_move from 125.0 to 137.5 reduced that noise materially while preserving most of the recall gain. Narrowing board breadth from 3 to 2 then preserved board_exact while improving recall and false-change at the cost of weaker secondary metrics, while follow-up margin probes localized that narrower-board branch to the same 9.5..9.75 plateau and event-radius, drop, and upper gate follow-ups were non-improving. Lowering min_event_separation from 4 to 3 regressed sharply, while raising LOOKAHEAD_WINDOW from 2 to 3 reopened an even higher-recall and much noisier branch. On that lwindow3 branch, tightening min_score_gain_per_added_move and sweeping event_window_radius across 0..2 were exact no-ops; secsep3 opened a shifted upper shelf, secsep4/5/6 plus secondary_peak_ratio=0.98 matched it exactly, and drop0 was harmful. Raising min_event_separation from 4 to 5 on that upper shelf then preserved board_exact, recovered the higher recall, and reduced false changes; 6 was an exact no-op, 7 opened a much stronger higher-recall branch, 8 improved it again, and 9 was an exact no-op, while 10 was worse. On that stronger minsep8 branch, LOOKAHEAD_MARGIN=9.5625, 9.75, and 10.0 were all worse than 9.5, and lowering secondary_min_event_separation from 3 to 1 improved false changes slightly without hurting recall. On that secsep1 minsep8 branch, event_window_radius stayed flat across 0..2, tightening secondary_peak_ratio to 0.98 was an exact no-op, lowering segment_board_drop_worst_frames to 0 was also an exact no-op, and raising LOOKAHEAD_WINDOW to 4 collapsed badly and was not rescued by nearby spacing changes. Returning to the distinct lower-noise secsep1 minsep7 branch, raising LOOKAHEAD_MARGIN from 9.5 to 9.5625 unexpectedly matched the stronger minsep8 board_exact while increasing recall further at the cost of more false changes, 9.625 and 9.75 were exact no-ops, 9.875 improved secondary metrics without changing board_exact, recall, or false-change, and both 9.9375 and 10.0 dropped to a lower-recall / lower-noise regime. Binary localization then found the cliff is saturated at machine precision: 9.935836791992188 is the last confirmed higher-recall shelf point, while the adjacent next representable float 9.93583679199219 already falls into the lower-recall regime, so there is no distinct midpoint left to test. Follow-ups at that cliff-edge high-shelf anchor showed event_window_radius is flat across 0..2, lowering segment_board_drop_worst_frames from 1 to 0 is an exact no-op, tightening secondary_peak_ratio to 0.98 is an exact no-op, lowering top_move_candidates from 4 to 3 is an exact no-op while 1..2 are worse, raising max_event_proposals from 14 to 15 is worse, raising beam_size from 3 to 4 worsens secondary metrics without helping board_exact, recall, or false-change, lowering top_board_candidates from 2 to 1 also fails to improve the shelf, raising top_board_candidates from 2 to 3 hurts secondary metrics, raising secondary_min_event_separation from 1 to 2 worsens secondary metrics and false-change while keeping board_exact and recall fixed, and tightening both hybrid acceptance gates across the recent 150.0→200.0 range remains exact-flat, so those gates appear non-binding in this neighborhood. This run restores the locally preferred cliff-edge anchor and lowers only max_event_proposals from 14 to 13 to test whether the proposal-breadth preference is one-sided here or whether props14 is uniquely preferred on this stabilized minsep7 branch.
