snapshot	board_exact	non_empty_accuracy	macro_f1	move_recall	false_change_rate	status	description
autoresearch/snapshots/20260419T190244Z_hybrid_lookahead_segmental_drop1_boardcands2_ratio95_props8_top4_detect10_lwindow3_minsep8_secsep1_thresh3_total150_permove142p33938090006510890361823840625_lmargin9p935836791992188_m9p8957061767578125_r0_beam3_v929.py	0.071006	0.799339	0.749250	0.375000	0.020699	discard	Restore the recovered compact props8 sibling after recent local mapping showed the props7 shelf is saturated across top_move_candidates=5..16, beam_size=4 is an exact no-op, beam_size=2 is slightly worse, beam_size=1 is much worse, both hybrid acceptance gates are exact-flat down to 125.0, event_window_radius=1..2, segment_board_drop_worst_frames=0, and secondary_peak_ratio=0.98 are exact no-ops on the adjacent props7 shelf, secondary_min_event_separation=2 is worse there, and min_event_separation=8 and 6 are both worse than 7 there. On the compact props8 top4 anchor, top_board_candidates=2..4 are exact no-ops, top_move_candidates=4 is exact-flat while 5 is worse, secondary_min_event_separation=2 is worse, and raising min_event_separation from 7 to 8 opened a lower-noise shelf that remained exact-flat at 9 before breaking sharply at 10. On that minsep8 shelf, top_move_candidates=3 is exact-flat, 2 and 1 only slightly weaken secondary metrics, top_board_candidates=2..4 are exact-flat, top_board_candidates=1 is harmful, beam_size=2 is slightly worse, secsep2 is worse, and event_window_radius=1..2, segment_board_drop_worst_frames=0, and secondary_peak_ratio=0.98 are exact no-ops. Lowering min_score_gain_per_added_move from 150.0 to 137.5 increased false changes and weakened secondaries, while raising it from 150.0 to 162.5, 175.0, 187.5, 200.0, 212.5, 225.0, 237.5, 250.0, 262.5, 275.0, 287.5, and 300.0 were exact no-ops and lowering min_total_score_gain from 150.0 down to 87.5 was also exact-flat. Lowering only min_score_gain_per_added_move to 143.75, 142.96875, 142.578125, and 142.3828125 were exact no-ops, while 142.3393809000651089036182383875, 142.33938090006510890361823835, 142.3393809000651089036182382, 142.3393809000651089036182380, 142.3393809000651089036182374, 142.3393809000651089036182362, 142.3393809000651089036182315, 142.3393809000651089036181570, 142.339380900065108903617859, 142.339380900065108903579712, 142.339380900065108903503418, 142.3393809000651089031982422, 142.3393809000651089025878906, 142.3393809000651089013671875, 142.339380900065108896484375, 142.33938090006510888671875, 142.3393809000651088671875, 142.339380900065108828125, 142.33938090006510875, 142.3393809000651075, 142.339380900065105, 142.33938090006510, 142.33938090006508, 142.33938090006504, 142.33938090006433, 142.3393809000629, 142.33938090005722, 142.33938090001175, 142.33938089964795, 142.33938089892035, 142.33938089746516, 142.33938089455478, 142.339380888734, 142.33938087709248, 142.33938083052635, 142.3393800854683, 142.33937859535217, 142.3393726348877, 142.33932495117188, 142.33856201171875, 142.3370361328125, 142.333984375, 142.28515625, and 142.1875 again increased false changes and weakened secondaries, while 142.339380900065108903618238425, 142.3393809000651089036182385, 142.3393809000651089036182408, 142.3393809000651089036182502, 142.3393809000651089036182688, 142.3393809000651089036183060, 142.3393809000651089036184550, 142.3393809000651089036190511, 142.3393809000651089036202432, 142.3393809000651089036226274, 142.3393809000651089036273957, 142.3393809000651089036369324, 142.3393809000651089036560059, 142.3393809000651089038085938, 142.33938090006510890625, 142.3393809000651090625, 142.339380900065109375, 142.33938090006511, 142.33938090006512, 142.33938090006518, 142.33938090006524, 142.33938090006525, and 142.33938090006532 were exact no-ops, so the lower edge now lies between 142.3393809000651089036182383875 and 142.339380900065108903618238425. This run restores the stable minsep8 shelf anchor and raises only min_score_gain_per_added_move from 142.3393809000651089036182383875 to 142.33938090006510890361823840625 to continue binary-searching that lower edge.
autoresearch/snapshots/20260419T191118Z_hybrid_lookahead_segmental_drop1_boardcands2_ratio95_props8_top4_detect10_lwindow3_minsep8_secsep1_thresh3_total150_permove142p339380900065108903618238396875_lmargin9p935836791992188_m9p8957061767578125_r0_beam3_v930.py	0.071006	0.789778	0.739821	0.375000	0.024580	discard	Restore the recovered compact props8 sibling after recent local mapping showed the props7 shelf is saturated across top_move_candidates=5..16, beam_size=4 is an exact no-op, beam_size=2 is slightly worse, beam_size=1 is much worse, both hybrid acceptance gates are exact-flat down to 125.0, event_window_radius=1..2, segment_board_drop_worst_frames=0, and secondary_peak_ratio=0.98 are exact no-ops on the adjacent props7 shelf, secondary_min_event_separation=2 is worse there, and min_event_separation=8 and 6 are both worse than 7 there. On the compact props8 top4 anchor, top_board_candidates=2..4 are exact no-ops, top_move_candidates=4 is exact-flat while 5 is worse, secondary_min_event_separation=2 is worse, and raising min_event_separation from 7 to 8 opened a lower-noise shelf that remained exact-flat at 9 before breaking sharply at 10. On that minsep8 shelf, top_move_candidates=3 is exact-flat, 2 and 1 only slightly weaken secondary metrics, top_board_candidates=2..4 are exact-flat, top_board_candidates=1 is harmful, beam_size=2 is slightly worse, secsep2 is worse, and event_window_radius=1..2, segment_board_drop_worst_frames=0, and secondary_peak_ratio=0.98 are exact no-ops. Lowering min_score_gain_per_added_move from 150.0 to 137.5 increased false changes and weakened secondaries, while raising it from 150.0 to 162.5, 175.0, 187.5, 200.0, 212.5, 225.0, 237.5, 250.0, 262.5, 275.0, 287.5, and 300.0 were exact no-ops and lowering min_total_score_gain from 150.0 down to 87.5 was also exact-flat. Lowering only min_score_gain_per_added_move to 143.75, 142.96875, 142.578125, and 142.3828125 were exact no-ops, while 142.3393809000651089036182383875, 142.33938090006510890361823835, 142.3393809000651089036182382, 142.3393809000651089036182380, 142.3393809000651089036182374, 142.3393809000651089036182362, 142.3393809000651089036182315, 142.3393809000651089036181570, 142.339380900065108903617859, 142.339380900065108903579712, 142.339380900065108903503418, 142.3393809000651089031982422, 142.3393809000651089025878906, 142.3393809000651089013671875, 142.339380900065108896484375, 142.33938090006510888671875, 142.3393809000651088671875, 142.339380900065108828125, 142.33938090006510875, 142.3393809000651075, 142.339380900065105, 142.33938090006510, 142.33938090006508, 142.33938090006504, 142.33938090006433, 142.3393809000629, 142.33938090005722, 142.33938090001175, 142.33938089964795, 142.33938089892035, 142.33938089746516, 142.33938089455478, 142.339380888734, 142.33938087709248, 142.33938083052635, 142.3393800854683, 142.33937859535217, 142.3393726348877, 142.33932495117188, 142.33856201171875, 142.3370361328125, 142.333984375, 142.28515625, and 142.1875 again increased false changes and weakened secondaries, while 142.33938090006510890361840625, 142.339380900065108903618425, 142.3393809000651089036182385, 142.3393809000651089036182408, 142.3393809000651089036182502, 142.3393809000651089036182688, 142.3393809000651089036183060, 142.3393809000651089036184550, 142.3393809000651089036190511, 142.3393809000651089036202432, 142.3393809000651089036226274, 142.3393809000651089036273957, 142.3393809000651089036369324, 142.3393809000651089036560059, 142.3393809000651089038085938, 142.33938090006510890625, 142.3393809000651090625, 142.339380900065109375, 142.33938090006511, 142.33938090006512, 142.33938090006518, 142.33938090006524, 142.33938090006525, and 142.33938090006532 were exact no-ops, so the lower edge now lies between 142.3393809000651089036182383875 and 142.339380900065108903618238425. This run restores the stable minsep8 shelf anchor and raises only min_score_gain_per_added_move from 142.3393809000651089036182383875 to 142.339380900065108903618238396875 to continue binary-searching that lower edge.
autoresearch/snapshots/20260419T191224Z_hybrid_lookahead_segmental_drop1_boardcands2_ratio95_props8_top4_detect10_lwindow3_minsep8_secsep1_thresh3_total150_permove142p3393809000651089036182384015625_lmargin9p935836791992188_m9p8957061767578125_r0_beam3_v931.py	0.071006	0.799339	0.749250	0.375000	0.020699	discard	Restore the compact props8 + minsep8 hybrid shelf anchored at lwindow3, beam3, top4, boardcands2, secsep1, radius0, drop1, props8, total150, and lmargin9.935836791992188, where nearby breadth and gating knobs are already mapped: top_move_candidates=3 is exact-flat while 5 is worse, top_board_candidates=2..4 are exact no-ops while 1 is harmful, beam_size=2 is slightly worse, secsep2 is worse, event_window_radius=1..2, drop0, and ratio0.98 are exact no-ops, min_event_separation=9 is exact-flat, and 10 breaks sharply. On this shelf min_total_score_gain is exact-flat down to 87.5, while min_score_gain_per_added_move is harmful at 137.5, exact-flat from 150.0 up through 300.0, and now has an extremely sharp lower edge. Recent binary search keeps the two stable regimes unchanged: harmful at 142.33938090006510890361823835, 142.3393809000651089036182383875, and 142.339380900065108903618238396875, but exact-flat at 142.33938090006510890361823840625 and 142.339380900065108903618238425. This run restores the same minsep8 shelf anchor and raises only min_score_gain_per_added_move from 142.339380900065108903618238396875 to 142.3393809000651089036182384015625 to continue binary searching that lower edge.
autoresearch/snapshots/20260419T191330Z_hybrid_lookahead_segmental_drop1_boardcands2_ratio95_props8_top4_detect10_lwindow3_minsep8_secsep1_thresh3_total150_permove142p33938090006510890361823839921875_lmargin9p935836791992188_m9p8957061767578125_r0_beam3_v932.py	0.071006	0.789778	0.739821	0.375000	0.024580	discard	Restore the compact props8 + minsep8 hybrid shelf anchored at lwindow3, beam3, top4, boardcands2, secsep1, radius0, drop1, props8, total150, and lmargin9.935836791992188. This neighborhood is already tightly mapped: top_move_candidates=3 is exact-flat while 5 is worse; top_board_candidates=2..4 are exact no-ops while 1 is harmful; beam_size=2 is slightly worse; secsep2 is worse; radius1..2, drop0, and ratio0.98 are exact no-ops; min_event_separation=9 is exact-flat and 10 breaks sharply. On this shelf, min_total_score_gain is exact-flat down to 87.5, while min_score_gain_per_added_move is harmful at 137.5, exact-flat from 150.0 through 300.0, and now shows an extremely sharp lower edge. Recent binary search keeps the two regimes unchanged: harmful at 142.339380900065108903618238396875 and exact-flat at 142.3393809000651089036182384015625. This run restores the same shelf anchor and raises only min_score_gain_per_added_move to 142.33938090006510890361823839921875 to continue binary-searching that edge.
autoresearch/snapshots/20260419T191438Z_hybrid_lookahead_segmental_drop1_boardcands2_ratio95_props8_top4_detect10_lwindow3_minsep8_secsep1_thresh3_total150_permove142p339380900065108903618238400390625_lmargin9p935836791992188_m9p8957061767578125_r0_beam3_v933.py	0.071006	0.789778	0.739821	0.375000	0.024580	discard	Restore the compact props8 + minsep8 hybrid shelf anchored at lwindow3, beam3, top4, boardcands2, secsep1, radius0, drop1, props8, total150, and lmargin9.935836791992188. This neighborhood remains fully mapped and cheap. Recent binary search keeps the same two regimes: harmful at 142.33938090006510890361823839921875 and exact-flat at 142.3393809000651089036182384015625. This run restores the same shelf anchor and raises only min_score_gain_per_added_move to 142.339380900065108903618238400390625 to continue binary-searching that lower edge.
autoresearch/snapshots/20260419T191539Z_hybrid_lookahead_segmental_drop1_boardcands2_ratio95_props8_top4_detect10_lwindow3_minsep8_secsep1_thresh3_total150_permove142p3393809000651089036182384009765625_lmargin9p935836791992188_m9p8957061767578125_r0_beam3_v934.py	0.071006	0.799339	0.749250	0.375000	0.020699	discard	Restore the compact props8 + minsep8 hybrid shelf anchored at lwindow3, beam3, top4, boardcands2, secsep1, radius0, drop1, props8, total150, and lmargin9.935836791992188. Recent binary search keeps the same two regimes: harmful at 142.339380900065108903618238400390625 and exact-flat at 142.3393809000651089036182384015625. This run restores the same shelf anchor and raises only min_score_gain_per_added_move to 142.3393809000651089036182384009765625 to continue binary-searching that lower edge.
autoresearch/snapshots/20260419T191652Z_hybrid_lookahead_segmental_drop1_boardcands2_ratio95_props8_top4_detect10_lwindow3_minsep8_secsep1_thresh3_total150_permove142p33938090006510890361823840068359375_lmargin9p935836791992188_m9p8957061767578125_r0_beam3_v935.py	0.071006	0.799339	0.749250	0.375000	0.020699	discard	Restore the compact props8 + minsep8 hybrid shelf anchored at lwindow3, beam3, top4, boardcands2, secsep1, radius0, drop1, props8, total150, and lmargin9.935836791992188. Recent binary search keeps the same two regimes: harmful at 142.339380900065108903618238400390625 and exact-flat at 142.3393809000651089036182384009765625. This run restores the same shelf anchor and raises only min_score_gain_per_added_move to 142.33938090006510890361823840068359375 to continue binary-searching that lower edge.
autoresearch/snapshots/20260419T191754Z_hybrid_lookahead_segmental_drop1_boardcands2_ratio95_props8_top4_detect10_lwindow3_minsep8_secsep1_thresh3_total150_permove142p339380900065108903618238400537109375_lmargin9p935836791992188_m9p8957061767578125_r0_beam3_v936.py	0.071006	0.789778	0.739821	0.375000	0.024580	discard	Restore the compact props8 + minsep8 hybrid shelf anchored at lwindow3, beam3, top4, boardcands2, secsep1, radius0, drop1, props8, total150, and lmargin9.935836791992188. Recent binary search keeps the same two regimes: harmful at 142.339380900065108903618238400390625 and exact-flat at 142.33938090006510890361823840068359375. This run restores the same shelf anchor and raises only min_score_gain_per_added_move to 142.339380900065108903618238400537109375 to continue binary-searching that lower edge.
autoresearch/snapshots/20260419T191859Z_hybrid_lookahead_segmental_drop1_boardcands2_ratio95_props8_top4_detect10_lwindow3_minsep8_secsep1_thresh3_total150_permove142p3393809000651089036182384006103515625_lmargin9p935836791992188_m9p8957061767578125_r0_beam3_v937.py	0.071006	0.789778	0.739821	0.375000	0.024580	discard	Restore the compact props8 + minsep8 hybrid shelf anchored at lwindow3, beam3, top4, boardcands2, secsep1, radius0, drop1, props8, total150, and lmargin9.935836791992188. Recent binary search keeps the same two regimes: harmful at 142.339380900065108903618238400537109375 and exact-flat at 142.33938090006510890361823840068359375. This run restores the same shelf anchor and raises only min_score_gain_per_added_move to 142.3393809000651089036182384006103515625 to continue binary-searching that lower edge.
autoresearch/snapshots/20260419T192013Z_hybrid_lookahead_segmental_drop1_boardcands2_ratio95_props8_top4_detect10_lwindow3_minsep8_secsep1_thresh3_total150_permove142p33938090006510890361823840064697265625_lmargin9p935836791992188_m9p8957061767578125_r0_beam3_v938.py	0.071006	0.789778	0.739821	0.375000	0.024580	discard	Restore the compact props8 + minsep8 hybrid shelf anchored at lwindow3, beam3, top4, boardcands2, secsep1, radius0, drop1, props8, total150, and lmargin9.935836791992188. Recent binary search keeps the same two regimes: harmful at 142.3393809000651089036182384006103515625 and exact-flat at 142.33938090006510890361823840068359375. This run restores the same shelf anchor and raises only min_score_gain_per_added_move to 142.33938090006510890361823840064697265625 to continue binary-searching that lower edge.
autoresearch/snapshots/20260419T192129Z_hybrid_lookahead_segmental_drop1_boardcands2_ratio95_props8_top4_detect10_lwindow3_minsep8_secsep1_thresh3_total150_permove142p339380900065108903618238400665283203125_lmargin9p935836791992188_m9p8957061767578125_r0_beam3_v939.py	0.071006	0.789778	0.739821	0.375000	0.024580	discard	Restore the compact props8 + minsep8 hybrid shelf anchored at lwindow3, beam3, top4, boardcands2, secsep1, radius0, drop1, props8, total150, and lmargin9.935836791992188. Recent binary search keeps the same two regimes: harmful at 142.33938090006510890361823840064697265625 and exact-flat at 142.33938090006510890361823840068359375. This run restores the same shelf anchor and raises only min_score_gain_per_added_move to 142.339380900065108903618238400665283203125 to continue binary-searching that lower edge.
autoresearch/snapshots/20260419T192237Z_hybrid_lookahead_segmental_drop1_boardcands2_ratio95_props8_top4_detect10_lwindow3_minsep8_secsep1_thresh3_total150_permove142p3393809000651089036182384006744384765625_lmargin9p935836791992188_m9p8957061767578125_r0_beam3_v940.py	0.071006	0.799339	0.749250	0.375000	0.020699	discard	Restore the compact props8 + minsep8 hybrid shelf anchored at lwindow3, beam3, top4, boardcands2, secsep1, radius0, drop1, props8, total150, and lmargin9.935836791992188. Recent binary search keeps the same two regimes: harmful at 142.339380900065108903618238400665283203125 and exact-flat at 142.33938090006510890361823840068359375. This run restores the same shelf anchor and raises only min_score_gain_per_added_move to 142.3393809000651089036182384006744384765625 to continue binary-searching that lower edge.
autoresearch/snapshots/20260419T192351Z_hybrid_lookahead_segmental_drop1_boardcands2_ratio95_props8_top4_detect10_lwindow3_minsep8_secsep1_thresh3_total150_permove142p3393809000651089036182384006744384765625_lmargin9p935836791992188_m9p8957061767578125_r0_beam3_v940.py	0.071006	0.799339	0.749250	0.375000	0.020699	discard	Restore the compact props8 + minsep8 hybrid shelf anchored at lwindow3, beam3, top4, boardcands2, secsep1, radius0, drop1, props8, total150, and lmargin9.935836791992188. The latest executed bracket is still harmful at 142.339380900065108903618238400665283203125 and exact-flat at 142.33938090006510890361823840068359375, so this run restores the same shelf anchor and raises only min_score_gain_per_added_move to 142.3393809000651089036182384006744384765625 to continue binary-searching that lower edge.
autoresearch/snapshots/20260419T192503Z_hybrid_lookahead_segmental_drop1_boardcands2_ratio95_props8_top4_detect10_lwindow3_minsep8_secsep1_thresh3_total150_permove142p33938090006510890361823840066986083984375_lmargin9p935836791992188_m9p8957061767578125_r0_beam3_v941.py	0.071006	0.799339	0.749250	0.375000	0.020699	discard	Restore the compact props8 + minsep8 hybrid shelf anchored at lwindow3, beam3, top4, boardcands2, secsep1, radius0, drop1, props8, total150, and lmargin9.935836791992188. The latest executed bracket is harmful at 142.339380900065108903618238400665283203125 and exact-flat at 142.3393809000651089036182384006744384765625, so this run restores the same shelf anchor and raises only min_score_gain_per_added_move to 142.33938090006510890361823840066986083984375 to continue binary-searching that lower edge.
autoresearch/snapshots/20260419T192615Z_hybrid_lookahead_segmental_drop1_boardcands2_ratio95_props8_top4_detect10_lwindow3_minsep8_secsep1_thresh3_total150_permove142p339380900065108903618238400667572021484375_lmargin9p935836791992188_m9p8957061767578125_r0_beam3_v942.py	0.071006	0.789778	0.739821	0.375000	0.024580	discard	Restore the compact props8 + minsep8 hybrid shelf anchored at lwindow3, beam3, top4, boardcands2, secsep1, radius0, drop1, props8, total150, and lmargin9.935836791992188. The latest executed bracket is harmful at 142.339380900065108903618238400665283203125 and exact-flat at 142.33938090006510890361823840066986083984375, so this run restores the same shelf anchor and raises only min_score_gain_per_added_move to 142.339380900065108903618238400667572021484375 to continue binary-searching that lower edge.
autoresearch/snapshots/20260419T192726Z_hybrid_lookahead_segmental_drop1_boardcands2_ratio95_props8_top4_detect10_lwindow3_minsep8_secsep1_thresh3_total150_permove142p3393809000651089036182384006687164306640625_lmargin9p935836791992188_m9p8957061767578125_r0_beam3_v943.py	0.071006	0.799339	0.749250	0.375000	0.020699	discard	Restore the compact props8 + minsep8 hybrid shelf anchored at lwindow3, beam3, top4, boardcands2, secsep1, radius0, drop1, props8, total150, and lmargin9.935836791992188. The latest executed bracket is harmful at 142.339380900065108903618238400667572021484375 and exact-flat at 142.33938090006510890361823840066986083984375, so this run restores the same shelf anchor and raises only min_score_gain_per_added_move to 142.3393809000651089036182384006687164306640625 to continue binary-searching that lower edge.
autoresearch/snapshots/20260419T192844Z_hybrid_lookahead_segmental_drop1_boardcands2_ratio95_props8_top4_detect10_lwindow3_minsep8_secsep1_thresh3_total150_permove142p33938090006510890361823840066814422607421875_lmargin9p935836791992188_m9p8957061767578125_r0_beam3_v944.py	0.071006	0.799339	0.749250	0.375000	0.020699	discard	Restore the compact props8 + minsep8 hybrid shelf anchored at lwindow3, beam3, top4, boardcands2, secsep1, radius0, drop1, props8, total150, and lmargin9.935836791992188. The latest executed bracket is harmful at 142.339380900065108903618238400667572021484375 and exact-flat at 142.3393809000651089036182384006687164306640625, so this run restores the same shelf anchor and raises only min_score_gain_per_added_move to 142.33938090006510890361823840066814422607421875 to continue binary-searching that lower edge.
