snapshot	board_exact	non_empty_accuracy	macro_f1	move_recall	false_change_rate	status	description
autoresearch/snapshots/20260420T024108Z_hybrid_p8_m8_w3_v1161.py	0.071006	0.789778	0.739821	0.375000	0.024580	discard	Restore the compact props8 + minsep8 hybrid shelf anchored at lwindow3, beam3, top4, boardcands2, secsep1, radius0, drop1, props8, total150, and lmargin9.935836791992188. The latest executed bracket is harmful at 142.339380900065108903618238400667905807495117187499999999999999999999999999999999999999999999998667004039596707939502657640381317049883531248161465535866280502612328452407570217412610250228164594713503200935499583474654061721054176814504899084568023681640625 and exact-flat at 142.3393809000651089036182384006679058074951171875000000000000000000000000000000000000000000000010142360568285917851610213605794326794364433347191301781024692029745072209942400519686661139568312866310301732012503169214588660818066045976593159139156341552734375. This run re-prepares their midpoint, 142.33938090006510890361823840066790580749511718749999999999999999999999999999999999999999999999984062004821264986233183950048037486465998729144029785698437485279341783670090513469063818209249794067226668706837495019805646390143039070608210749924182891845703125, with a short experiment name to avoid filename-too-long failures.
autoresearch/snapshots/20260420T024214Z_hybrid_p8_m8_w3_v1162.py	0.071006	0.799339	0.749250	0.375000	0.020699	discard	Restore the compact props8 + minsep8 hybrid shelf anchored at lwindow3, beam3, top4, boardcands2, secsep1, radius0, drop1, props8, total150, and lmargin9.935836791992188. The latest executed bracket is harmful at 142.33938090006510890361823840066790580749511718749999999999999999999999999999999999999999999999984062004821264986233183950048037486465998729144029785698437485279341783670090513469063818209249794067226668706837495019805646390143039070608210749924182891845703125 and exact-flat at 142.3393809000651089036182384006679058074951171875000000000000000000000000000000000000000000000010142360568285917851610213605794326794364433347191301781024692029745072209942400519686661139568312866310301732012503169214588660818066045976593159139156341552734375. This run re-prepares their midpoint, 142.339380900065108903618238400667905807495117187500000000000000000000000000000000000000000000000427428052520620823746430430529903772048215313079714017543422027883962528847572593329652148024664613651648430134812633559757664991618497651870711706578731536865234375, with a short experiment name to avoid filename-too-long failures.
autoresearch/snapshots/20260420T024320Z_hybrid_p8_m8_w3_v1163.py	0.071006	0.799339	0.749250	0.375000	0.020699	discard	Restore the compact props8 + minsep8 hybrid shelf anchored at lwindow3, beam3, top4, boardcands2, secsep1, radius0, drop1, props8, total150, and lmargin9.935836791992188. The latest executed bracket is harmful at 142.33938090006510890361823840066790580749511718749999999999999999999999999999999999999999999999984062004821264986233183950048037486465998729144029785698437485279341783670090513469063818209249794067226668706837495019805646390143039070608210749924182891845703125 and exact-flat at 142.339380900065108903618238400667905807495117187500000000000000000000000000000000000000000000000427428052520620823746430430529903772048215313079714017543422027883962528847572593329652148024664613651648430134812633559757664991618497651870711706578731536865234375. This run re-prepares their midpoint, 142.3393809000651089036182384006679058074951171875000000000000000000000000000000000000000000000001340240503666353430391349655051393183541013022600059372638984403386901827742388640101451650585812771619575586015937918789070644465244441789764096029102802276611328125, with a short experiment name to avoid filename-too-long failures.
autoresearch/snapshots/20260420T024432Z_hybrid_p8_m8_w3_v1164.py	0.071006	0.789778	0.739821	0.375000	0.024580	discard	Restore the compact props8 + minsep8 hybrid shelf anchored at lwindow3, beam3, top4, boardcands2, secsep1, radius0, drop1, props8, total150, and lmargin9.935836791992188. The latest executed bracket is harmful at 142.33938090006510890361823840066790580749511718749999999999999999999999999999999999999999999999984062004821264986233183950048037486465998729144029785698437485279341783670090513469063818209249794067226668706837495019805646390143039070608210749924182891845703125 and exact-flat at 142.3393809000651089036182384006679058074951171875000000000000000000000000000000000000000000000001340240503666353430391349655051393183541013022600059372638984403386901827742388640101451650585812771619575586015937918789070644465244441789764096029102802276611328125. This run re-prepares their midpoint, 142.33938090006510890361823840066790580749511718749999999999999999999999999999999999999999999999998732204928964260268548723299275709150704429685015189712413664656605400973757199935039167357553960891711212283498437103848176417397741744252925855107605457305908203125, with a short experiment name to avoid filename-too-long failures.
autoresearch/snapshots/20260420T024542Z_hybrid_p8_m8_w3_v1165.py	0.071006	0.799339	0.749250	0.375000	0.020699	discard	Restore the compact props8 + minsep8 hybrid shelf anchored at lwindow3, beam3, top4, boardcands2, secsep1, radius0, drop1, props8, total150, and lmargin9.935836791992188. The latest executed bracket is harmful at 142.33938090006510890361823840066790580749511718749999999999999999999999999999999999999999999999998732204928964260268548723299275709150704429685015189712413664656605400973757199935039167357553960891711212283498437103848176417397741744252925855107605457305908203125 and exact-flat at 142.3393809000651089036182384006679058074951171875000000000000000000000000000000000000000000000001340240503666353430391349655051393183541013022600059372638984403386901827742388640101451650585812771619575586015937918789070644465244441789764096029102802276611328125. This run re-prepares their midpoint, 142.339380900065108903618238400667905807495117187500000000000000000000000000000000000000000000000060673049828138972862311099248948204930572799555078917194017543452372096255905431680268419317060443039534840718289081458694414310250930810752834076993167400360107421875, with a short experiment name to avoid filename-too-long failures.
autoresearch/snapshots/20260420T024705Z_hybrid_p8_m8_w3_v1165.py	0.071006	0.799339	0.749250	0.375000	0.020699	discard	Restore the compact props8 + minsep8 hybrid shelf anchored at lwindow3, beam3, top4, boardcands2, secsep1, radius0, drop1, props8, total150, and lmargin9.935836791992188. The latest executed bracket is harmful at 142.33938090006510890361823840066790580749511718749999999999999999999999999999999999999999999999998732204928964260268548723299275709150704429685015189712413664656605400973757199935039167357553960891711212283498437103848176417397741744252925855107605457305908203125 and exact-flat at 142.3393809000651089036182384006679058074951171875000000000000000000000000000000000000000000000001340240503666353430391349655051393183541013022600059372638984403386901827742388640101451650585812771619575586015937918789070644465244441789764096029102802276611328125. This run re-prepares their midpoint, 142.339380900065108903618238400667905807495117187500000000000000000000000000000000000000000000000060673049828138972862311099248948204930572799555078917194017543452372096255905431680268419317060443039534840718289081458694414310250930810752834076993167400360107421875, with a short experiment name to avoid filename-too-long failures.
autoresearch/snapshots/20260420T025157Z_hybrid_p8_m8_w3_v1166.py	0.071006	0.799339	0.749250	0.375000	0.020699	discard	Restore the compact props8 + minsep8 hybrid shelf anchored at lwindow3, beam3, top4, boardcands2, secsep1, radius0, drop1, props8, total150, and lmargin9.935836791992188. The latest executed bracket is harmful at 142.33938090006510890361823840066790580749511718749999999999999999999999999999999999999999999999998732204928964260268548723299275709150704429685015189712413664656605400973757199935039167357553960891711212283498437103848176417397741744252925855107605457305908203125 and exact-flat at 142.339380900065108903618238400667905807495117187500000000000000000000000000000000000000000000000060673049828138972862311099248948204930572799555078917194017543452372096255905431680268419317060443039534840718289081458694414310250930810752834076993167400360107421875. This run re-prepares their midpoint, 142.3393809000651089036182384006679058074951171875000000000000000000000000000000000000000000000000239975495588907877738991661208526482188085482026154071590770950092130529967387155153300464463000259783234817766367262485880892421141741266410463140346109867095947265625, with a short experiment name to avoid filename-too-long failures.
autoresearch/snapshots/20260420T025305Z_hybrid_p8_m8_w3_v1167.py	0.071006	0.799339	0.749250	0.375000	0.020699	discard	Restore the compact props8 + minsep8 hybrid shelf anchored at lwindow3, beam3, top4, boardcands2, secsep1, radius0, drop1, props8, total150, and lmargin9.935836791992188. The latest executed bracket is harmful at 142.33938090006510890361823840066790580749511718749999999999999999999999999999999999999999999999998732204928964260268548723299275709150704429685015189712413664656605400973757199935039167357553960891711212283498437103848176417397741744252925855107605457305908203125 and exact-flat at 142.3393809000651089036182384006679058074951171875000000000000000000000000000000000000000000000000239975495588907877738991661208526482188085482026154071590770950092130529967387155153300464463000259783234817766367262485880892421141741266410463140346109867095947265625. This run re-prepares their midpoint, 142.33938090006510890361823840066790580749511718750000000000000000000000000000000000000000000000000565979942426669522969319955680486986292642252638365214160687078763353136715535743286086001091981744771780230581054864353492670804579578458515243255533277988433837890625, with a short experiment name to avoid filename-too-long failures.
autoresearch/snapshots/20260420T025401Z_hybrid_p8_m8_w3_v1168.py	0.071006	0.789778	0.739821	0.375000	0.024580	discard	Restore the compact props8 + minsep8 hybrid shelf anchored at lwindow3, beam3, top4, boardcands2, secsep1, radius0, drop1, props8, total150, and lmargin9.935836791992188. The latest executed bracket is harmful at 142.33938090006510890361823840066790580749511718749999999999999999999999999999999999999999999999998732204928964260268548723299275709150704429685015189712413664656605400973757199935039167357553960891711212283498437103848176417397741744252925855107605457305908203125 and exact-flat at 142.33938090006510890361823840066790580749511718750000000000000000000000000000000000000000000000000565979942426669522969319955680486986292642252638365214160687078763353136715535743286086001091981744771780230581054864353492670804579578458515243255533277988433837890625. This run re-prepares their midpoint, 142.339380900065108903618238400667905807495117187499999999999999999999999999999999999999999999999996490924356954648957590216274780980684985359688267774632871758676843770552363678391626266793229713182414962570397459841008345441011606613557205491815693676471710205078125, with a short experiment name to avoid filename-too-long failures.
autoresearch/snapshots/20260420T025501Z_hybrid_p8_m8_w3_v1169.py	0.071006	0.799339	0.749250	0.375000	0.020699	discard	Restore the compact props8 + minsep8 hybrid shelf anchored at lwindow3, beam3, top4, boardcands2, secsep1, radius0, drop1, props8, total150, and lmargin9.935836791992188. The latest executed bracket is harmful at 142.339380900065108903618238400667905807495117187499999999999999999999999999999999999999999999999996490924356954648957590216274780980684985359688267774632871758676843770552363678391626266793229713182414962570397459841008345441011606613557205491815693676471710205078125 and exact-flat at 142.33938090006510890361823840066790580749511718750000000000000000000000000000000000000000000000000565979942426669522969319955680486986292642252638365214160687078763353136715535743286086001091981744771780230581054864353492670804579578458515243255533277988433837890625. This run re-prepares their midpoint, 142.3393809000651089036182384006679058074951171875000000000000000000000000000000000000000000000000010753618906106720936417079157929252739558911073257133872393147322386509597595179122435634020747653150663824381040042422716360745287011990711789621855132281780242919921875, with a short experiment name to avoid filename-too-long failures.
autoresearch/snapshots/20260420T025606Z_hybrid_p8_m8_w3_v1170.py	0.071006	0.789778	0.739821	0.375000	0.024580	discard	Restore the compact props8 + minsep8 hybrid shelf anchored at lwindow3, beam3, top4, boardcands2, secsep1, radius0, drop1, props8, total150, and lmargin9.935836791992188. The latest executed bracket is harmful at 142.339380900065108903618238400667905807495117187499999999999999999999999999999999999999999999999996490924356954648957590216274780980684985359688267774632871758676843770552363678391626266793229713182414962570397459841008345441011606613557205491815693676471710205078125 and exact-flat at 142.3393809000651089036182384006679058074951171875000000000000000000000000000000000000000000000000010753618906106720936417079157929252739558911073257133872393147322386509597595179122435634020747653150663824381040042422716360745287011990711789621855132281780242919921875. This run re-prepares their midpoint, 142.33938090006510890361823840066790580749511718749999999999999999999999999999999999999999999999999878314312378266052561596209528695297947062539779674401005553670454121075606159815193491509765223924874067250425073204163999075777015390631419222700060345232486724853515625, with a short experiment name to avoid filename-too-long failures.
autoresearch/snapshots/20260420T025707Z_hybrid_p8_m8_w3_v1171.py	0.071006	0.789778	0.739821	0.375000	0.024580	discard	Restore the compact props8 + minsep8 hybrid shelf anchored at lwindow3, beam3, top4, boardcands2, secsep1, radius0, drop1, props8, total150, and lmargin9.935836791992188. The latest executed bracket is harmful at 142.33938090006510890361823840066790580749511718749999999999999999999999999999999999999999999999999878314312378266052561596209528695297947062539779674401005553670454121075606159815193491509765223924874067250425073204163999075777015390631419222700060345232486724853515625 and exact-flat at 142.3393809000651089036182384006679058074951171875000000000000000000000000000000000000000000000000010753618906106720936417079157929252739558911073257133872393147322386509597595179122435634020747653150663824381040042422716360745287011990711789621855132281780242919921875. This run re-prepares their midpoint, 142.339380900065108903618238400667905807495117187499999999999999999999999999999999999999999999999999929252507196666309628835005539939126713258252561228698647425718389930857910558032089239249863502281903527471177368141955813416149427552692685594593058340251445770263671875, with a short experiment name to avoid filename-too-long failures.
autoresearch/snapshots/20260420T025808Z_hybrid_p8_m8_w3_v1172.py	0.071006	0.799339	0.749250	0.375000	0.020699	discard	Restore the compact props8 + minsep8 hybrid shelf anchored at lwindow3, beam3, top4, boardcands2, secsep1, radius0, drop1, props8, total150, and lmargin9.935836791992188. The latest executed bracket is harmful at 142.339380900065108903618238400667905807495117187499999999999999999999999999999999999999999999999999929252507196666309628835005539939126713258252561228698647425718389930857910558032089239249863502281903527471177368141955813416149427552692685594593058340251445770263671875 and exact-flat at 142.3393809000651089036182384006679058074951171875000000000000000000000000000000000000000000000000010753618906106720936417079157929252739558911073257133872393147322386509597595179122435634020747653150663824381040042422716360745287011990711789621855132281780242919921875. This run re-prepares their midpoint, 142.3393809000651089036182384006679058074951171875000000000000000000000000000000000000000000000000005023071989036692016352714606664322003345746799434710429433702253142909088350379721664013259691337984849549546406861921137247453390643758819322783892857842147350311279296875, with a short experiment name to avoid filename-too-long failures.
autoresearch/snapshots/20260420T025909Z_hybrid_p8_m8_w3_v1173.py	0.071006	0.799339	0.749250	0.375000	0.020699	discard	Restore the compact props8 + minsep8 hybrid shelf anchored at lwindow3, beam3, top4, boardcands2, secsep1, radius0, drop1, props8, total150, and lmargin9.935836791992188. The latest executed bracket is harmful at 142.339380900065108903618238400667905807495117187499999999999999999999999999999999999999999999999999929252507196666309628835005539939126713258252561228698647425718389930857910558032089239249863502281903527471177368141955813416149427552692685594593058340251445770263671875 and exact-flat at 142.3393809000651089036182384006679058074951171875000000000000000000000000000000000000000000000000005023071989036692016352714606664322003345746799434710429433702253142909088350379721664013259691337984849549546406861921137247453390643758819322783892857842147350311279296875. This run re-prepares their midpoint, 142.33938090006510890361823840066790580749511718750000000000000000000000000000000000000000000000000021577985305016775563205323310318566352391646625234987079539797185211088337279800212782028791631804019424121290902716703476908074424596428730893649117206223309040069580078125, with a short experiment name to avoid filename-too-long failures.
autoresearch/snapshots/20260420T030015Z_hybrid_p8_m8_w3_v1174.py	0.071006	0.799339	0.749250	0.375000	0.020699	discard	Restore the compact props8 + minsep8 hybrid shelf anchored at lwindow3, beam3, top4, boardcands2, secsep1, radius0, drop1, props8, total150, and lmargin9.935836791992188. The latest executed bracket is harmful at 142.339380900065108903618238400667905807495117187499999999999999999999999999999999999999999999999999929252507196666309628835005539939126713258252561228698647425718389930857910558032089239249863502281903527471177368141955813416149427552692685594593058340251445770263671875 and exact-flat at 142.33938090006510890361823840066790580749511718750000000000000000000000000000000000000000000000000021577985305016775563205323310318566352391646625234987079539797185211088337279800212782028791631804019424121290902716703476908074424596428730893649117206223309040069580078125. This run re-prepares their midpoint, 142.339380900065108903618238400667905807495117187500000000000000000000000000000000000000000000000000072516180123417032630444119321562395118587359406789284721411845121020870641678017108529768889910161048884342043197654495291248446836758489997265542115201242268085479736328125, with a short experiment name to avoid filename-too-long failures.
autoresearch/snapshots/20260420T030117Z_hybrid_p8_m8_w3_v1175.py	0.071006	0.799339	0.749250	0.375000	0.020699	discard	Restore the compact props8 + minsep8 hybrid shelf anchored at lwindow3, beam3, top4, boardcands2, secsep1, radius0, drop1, props8, total150, and lmargin9.935836791992188. The latest executed bracket is harmful at 142.339380900065108903618238400667905807495117187499999999999999999999999999999999999999999999999999929252507196666309628835005539939126713258252561228698647425718389930857910558032089239249863502281903527471177368141955813416149427552692685594593058340251445770263671875 and exact-flat at 142.339380900065108903618238400667905807495117187500000000000000000000000000000000000000000000000000072516180123417032630444119321562395118587359406789284721411845121020870641678017108529768889910161048884342043197654495291248446836758489997265542115201242268085479736328125. This run re-prepares their midpoint, 142.3393809000651089036182384006679058074951171875000000000000000000000000000000000000000000000000000008843436600416711296395624307507609159228059840089916844187817554758642761180245988845093767062214762059066102828982255523322981321555913414300675867707468569278717041015625, with a short experiment name to avoid filename-too-long failures.
autoresearch/snapshots/20260420T030223Z_hybrid_p8_m8_w3_v1176.py	0.071006	0.789778	0.739821	0.375000	0.024580	discard	Restore the compact props8 + minsep8 hybrid shelf anchored at lwindow3, beam3, top4, boardcands2, secsep1, radius0, drop1, props8, total150, and lmargin9.935836791992188. The latest executed bracket is harmful at 142.339380900065108903618238400667905807495117187499999999999999999999999999999999999999999999999999929252507196666309628835005539939126713258252561228698647425718389930857910558032089239249863502281903527471177368141955813416149427552692685594593058340251445770263671875 and exact-flat at 142.3393809000651089036182384006679058074951171875000000000000000000000000000000000000000000000000000008843436600416711296395624307507609159228059840089916844187817554758642761180245988845093767062214762059066102828982255523322981321555913414300675867707468569278717041015625. This run re-prepares their midpoint, 142.33938090006510890361823840066790580749511718749999999999999999999999999999999999999999999999999996506842542835399037923728398534494381459052927261884516592225007270336109333802834406187962010425168986668889382552009068287422377985414201351233032255549915134906768798828125, with a short experiment name to avoid filename-too-long failures.
