snapshot	board_exact	non_empty_accuracy	macro_f1	move_recall	false_change_rate	status	description
autoresearch/snapshots/20260420T001816Z_hybrid_p8_m8_w3_g142p339380900065108903618238400667905807495117187499999999999999999999999971536124943402153246861742839423578583369679305633273386184550483488618632943456532302661798894405364990234375_v1080.py	0.071006	0.789778	0.739821	0.375000	0.024580	discard	Restore the compact props8 + minsep8 hybrid shelf anchored at lwindow3, beam3, top4, boardcands2, secsep1, radius0, drop1, props8, total150, and lmargin9.935836791992188. The latest executed bracket is harmful at 142.339380900065108903618238400667905807495117187499999999999999999999999912418845979698933067266901044380241794983628632717764265183232256888057332133712407085113227367401123046875 and exact-flat at 142.33938090006510890361823840066790580749511718750000000000000000000000003065340390710537342645658463446691537175572997854878250718586871008917993375320065752021037042140960693359375, so this run restores the same shelf anchor and raises only min_score_gain_per_added_move to 142.339380900065108903618238400667905807495117187499999999999999999999999971536124943402153246861742839423578583369679305633273386184550483488618632943456532302661798894405364990234375 to continue binary-searching that lower edge. The experiment name remains shortened to avoid the filename-too-long failure seen with long autogenerated names.
autoresearch/snapshots/20260420T001920Z_hybrid_p8_m8_w3_g142p3393809000651089036182384006679058074951171875000000000000000000000010947644252537633366591637369452469775627046420910279466852095967888992833483285949114360846579074859619140625_v1081.py	0.071006	0.799339	0.749250	0.375000	0.020699	discard	Restore the compact props8 + minsep8 hybrid shelf anchored at lwindow3, beam3, top4, boardcands2, secsep1, radius0, drop1, props8, total150, and lmargin9.935836791992188. The latest executed bracket is harmful at 142.339380900065108903618238400667905807495117187499999999999999999999999971536124943402153246861742839423578583369679305633273386184550483488618632943456532302661798894405364990234375 and exact-flat at 142.33938090006510890361823840066790580749511718750000000000000000000000003065340390710537342645658463446691537175572997854878250718586871008917993375320065752021037042140960693359375, so this run restores the same shelf anchor and raises only min_score_gain_per_added_move to 142.3393809000651089036182384006679058074951171875000000000000000000000000010947644252537633366591637369452469775627046420910279466852095967888992833483285949114360846579074859619140625 to continue binary-searching that lower edge. The experiment name remains shortened to avoid the filename-too-long failure seen with long autogenerated names.
autoresearch/snapshots/20260420T002031Z_hybrid_p8_m8_w3_g142p33938090006510890361823840066790580749511718749999999999999999999999998631544468432795829176045328818441278046619197386215066643488004013875895814589256360704894177615642547607421875_v1082.py	0.071006	0.789778	0.739821	0.375000	0.024580	discard	Restore the compact props8 + minsep8 hybrid shelf anchored at lwindow3, beam3, top4, boardcands2, secsep1, radius0, drop1, props8, total150, and lmargin9.935836791992188. The latest executed bracket is harmful at 142.339380900065108903618238400667905807495117187499999999999999999999999971536124943402153246861742839423578583369679305633273386184550483488618632943456532302661798894405364990234375 and exact-flat at 142.3393809000651089036182384006679058074951171875000000000000000000000000010947644252537633366591637369452469775627046420910279466852095967888992833483285949114360846579074859619140625, so this run restores the same shelf anchor and raises only min_score_gain_per_added_move to 142.33938090006510890361823840066790580749511718749999999999999999999999998631544468432795829176045328818441278046619197386215066643488004013875895814589256360704894177615642547607421875 to continue binary-searching that lower edge. The experiment name remains shortened to avoid the filename-too-long failure seen with long autogenerated names.
autoresearch/snapshots/20260420T002137Z_hybrid_p8_m8_w3_g142p339380900065108903618238400667905807495117187499999999999999999999999993705104554790860814209808512564829879014448307976589306560044818463829120747110579259242513217031955718994140625_v1083.py	0.071006	0.789778	0.739821	0.375000	0.024580	discard	Restore the compact props8 + minsep8 hybrid shelf anchored at lwindow3, beam3, top4, boardcands2, secsep1, radius0, drop1, props8, total150, and lmargin9.935836791992188. The latest executed bracket is harmful at 142.33938090006510890361823840066790580749511718749999999999999999999999998631544468432795829176045328818441278046619197386215066643488004013875895814589256360704894177615642547607421875 and exact-flat at 142.3393809000651089036182384006679058074951171875000000000000000000000000010947644252537633366591637369452469775627046420910279466852095967888992833483285949114360846579074859619140625, so this run restores the same shelf anchor and raises only min_score_gain_per_added_move to 142.339380900065108903618238400667905807495117187499999999999999999999999993705104554790860814209808512564829879014448307976589306560044818463829120747110579259242513217031955718994140625 to continue binary-searching that lower edge. The experiment name remains shortened to avoid the filename-too-long failure seen with long autogenerated names.
autoresearch/snapshots/20260420T002242Z_hybrid_p8_m8_w3_g142p339380900065108903618238400667905807495117187499999999999999999999999993705104554790860814209808512564829879014448307976589306560044818463829120747110579259242513217031955718994140625_v1083.py	0.071006	0.789778	0.739821	0.375000	0.024580	discard	Restore the compact props8 + minsep8 hybrid shelf anchored at lwindow3, beam3, top4, boardcands2, secsep1, radius0, drop1, props8, total150, and lmargin9.935836791992188. The latest executed bracket is harmful at 142.33938090006510890361823840066790580749511718749999999999999999999999998631544468432795829176045328818441278046619197386215066643488004013875895814589256360704894177615642547607421875 and exact-flat at 142.3393809000651089036182384006679058074951171875000000000000000000000000010947644252537633366591637369452469775627046420910279466852095967888992833483285949114360846579074859619140625, so this run restores the same shelf anchor and raises only min_score_gain_per_added_move to 142.339380900065108903618238400667905807495117187499999999999999999999999993705104554790860814209808512564829879014448307976589306560044818463829120747110579259242513217031955718994140625 to continue binary-searching that lower edge. The experiment name remains shortened to avoid the filename-too-long failure seen with long autogenerated names.
autoresearch/snapshots/20260420T002350Z_hybrid_p8_m8_w3_g142p3393809000651089036182384006679058074951171874999999999999999999999999973999344900223120754344861247550384282885764750338086266226272076263642020477195870853392989374697208404541015625_v1084.py	0.071006	0.789778	0.739821	0.375000	0.024580	discard	Restore the compact props8 + minsep8 hybrid shelf anchored at lwindow3, beam3, top4, boardcands2, secsep1, radius0, drop1, props8, total150, and lmargin9.935836791992188. The latest executed bracket is harmful at 142.339380900065108903618238400667905807495117187499999999999999999999999993705104554790860814209808512564829879014448307976589306560044818463829120747110579259242513217031955718994140625 and exact-flat at 142.3393809000651089036182384006679058074951171875000000000000000000000000010947644252537633366591637369452469775627046420910279466852095967888992833483285949114360846579074859619140625, so this run restores the same shelf anchor and raises only min_score_gain_per_added_move to 142.3393809000651089036182384006679058074951171874999999999999999999999999973999344900223120754344861247550384282885764750338086266226272076263642020477195870853392989374697208404541015625 to continue binary-searching that lower edge. The experiment name remains shortened to avoid the filename-too-long failure seen with long autogenerated names.
autoresearch/snapshots/20260420T002458Z_hybrid_p8_m8_w3_g142p33938090006510890361823840066790580749511718749999999999999999999999999924734945763803770604682493085014270292564055856241828665391840220763174269802409099838769179768860340118408203125_v1085.py	0.071006	0.789778	0.739821	0.375000	0.024580	discard	Restore the compact props8 + minsep8 hybrid shelf anchored at lwindow3, beam3, top4, boardcands2, secsep1, radius0, drop1, props8, total150, and lmargin9.935836791992188. The latest executed bracket is harmful at 142.3393809000651089036182384006679058074951171874999999999999999999999999973999344900223120754344861247550384282885764750338086266226272076263642020477195870853392989374697208404541015625 and exact-flat at 142.3393809000651089036182384006679058074951171875000000000000000000000000010947644252537633366591637369452469775627046420910279466852095967888992833483285949114360846579074859619140625, so this run restores the same shelf anchor and raises only min_score_gain_per_added_move to 142.33938090006510890361823840066790580749511718749999999999999999999999999924734945763803770604682493085014270292564055856241828665391840220763174269802409099838769179768860340118408203125 to continue binary-searching that lower edge. The experiment name remains shortened to avoid the filename-too-long failure seen with long autogenerated names.
autoresearch/snapshots/20260420T002607Z_hybrid_p8_m8_w3_g142p339380900065108903618238400667905807495117187500000000000000000000000171056941445900521352994333897694840244172600326723116669563999498265513023176342954911888227798044681549072265625_v1086.py	0.071006	0.799339	0.749250	0.375000	0.020699	discard	Restore the compact props8 + minsep8 hybrid shelf anchored at lwindow3, beam3, top4, boardcands2, secsep1, radius0, drop1, props8, total150, and lmargin9.935836791992188. The latest executed bracket is harmful at 142.33938090006510890361823840066790580749511718749999999999999999999999999924734945763803770604682493085014270292564055856241828665391840220763174269802409099838769179768860340118408203125 and exact-flat at 142.3393809000651089036182384006679058074951171875000000000000000000000000010947644252537633366591637369452469775627046420910279466852095967888992833483285949114360846579074859619140625, so this run restores the same shelf anchor and raises only min_score_gain_per_added_move to 142.339380900065108903618238400667905807495117187500000000000000000000000000171056941445900521352994333897694840244172600326723116669563999498265513023176342954911888227798044681549072265625 to continue binary-searching that lower edge. The experiment name remains shortened to avoid the filename-too-long failure seen with long autogenerated names.
autoresearch/snapshots/20260420T002717Z_hybrid_p8_m8_w3_g142p3393809000651089036182384006679058074951171874999999999999999999999997092031995419691136999096323739187715849065794445707016617412008529486278606002169766497900127433240413665771484375_v1087.py	0.071006	0.789778	0.739821	0.375000	0.024580	discard	Restore the compact props8 + minsep8 hybrid shelf anchored at lwindow3, beam3, top4, boardcands2, secsep1, radius0, drop1, props8, total150, and lmargin9.935836791992188. The latest executed bracket is harmful at 142.33938090006510890361823840066790580749511718749999999999999999999999999924734945763803770604682493085014270292564055856241828665391840220763174269802409099838769179768860340118408203125 and exact-flat at 142.339380900065108903618238400667905807495117187500000000000000000000000000171056941445900521352994333897694840244172600326723116669563999498265513023176342954911888227798044681549072265625, so this run restores the same shelf anchor and raises only min_score_gain_per_added_move to 142.3393809000651089036182384006679058074951171874999999999999999999999999997092031995419691136999096323739187715849065794445707016617412008529486278606002169766497900127433240413665771484375 to continue binary-searching that lower edge. The experiment name remains shortened to avoid the filename-too-long failure seen with long autogenerated names.
autoresearch/snapshots/20260420T002828Z_hybrid_p8_m8_w3_g142p3393809000651089036182384006679058074951171874999999999999999999999997092031995419691136999096323739187715849065794445707016617412008529486278606002169766497900127433240413665771484375_v1087.py	0.071006	0.789778	0.739821	0.375000	0.024580	discard	Restore the compact props8 + minsep8 hybrid shelf anchored at lwindow3, beam3, top4, boardcands2, secsep1, radius0, drop1, props8, total150, and lmargin9.935836791992188. The latest executed bracket is harmful at 142.33938090006510890361823840066790580749511718749999999999999999999999999924734945763803770604682493085014270292564055856241828665391840220763174269802409099838769179768860340118408203125 and exact-flat at 142.339380900065108903618238400667905807495117187500000000000000000000000000171056941445900521352994333897694840244172600326723116669563999498265513023176342954911888227798044681549072265625, so this run restores the same shelf anchor and raises only min_score_gain_per_added_move to 142.3393809000651089036182384006679058074951171874999999999999999999999999997092031995419691136999096323739187715849065794445707016617412008529486278606002169766497900127433240413665771484375 to continue binary-searching that lower edge. The experiment name remains shortened to avoid the filename-too-long failure seen with long autogenerated names.
autoresearch/snapshots/20260420T002941Z_hybrid_p8_m8_w3_g142p33938090006510890361823840066790580749511718749999999999999999999999994013007049393481752645198313580680591453958988564690916565260017560707044188827996578083912027068436145782470703125_v1088.py	0.071006	0.789778	0.739821	0.375000	0.024580	discard	Restore the compact props8 + minsep8 hybrid shelf anchored at lwindow3, beam3, top4, boardcands2, secsep1, radius0, drop1, props8, total150, and lmargin9.935836791992188. The latest executed bracket is harmful at 142.3393809000651089036182384006679058074951171874999999999999999999999999997092031995419691136999096323739187715849065794445707016617412008529486278606002169766497900127433240413665771484375 and exact-flat at 142.339380900065108903618238400667905807495117187500000000000000000000000000171056941445900521352994333897694840244172600326723116669563999498265513023176342954911888227798044681549072265625, so this run restores the same shelf anchor and raises only min_score_gain_per_added_move to 142.33938090006510890361823840066790580749511718749999999999999999999999999994013007049393481752645198313580680591453958988564690916565260017560707044188827996578083912027068436145782470703125 to continue binary-searching that lower edge. The experiment name remains shortened to avoid the filename-too-long failure seen with long autogenerated names.
autoresearch/snapshots/20260420T003053Z_hybrid_p8_m8_w3_g142p339380900065108903618238400667905807495117187500000000000000000000000055593505969917669439723158516750823079356095106185012917608299836936291732532311460346363674034364521503448486328125_v1089.py	0.071006	0.799339	0.749250	0.375000	0.020699	discard	Restore the compact props8 + minsep8 hybrid shelf anchored at lwindow3, beam3, top4, boardcands2, secsep1, radius0, drop1, props8, total150, and lmargin9.935836791992188. The latest executed bracket is harmful at 142.33938090006510890361823840066790580749511718749999999999999999999999999994013007049393481752645198313580680591453958988564690916565260017560707044188827996578083912027068436145782470703125 and exact-flat at 142.339380900065108903618238400667905807495117187500000000000000000000000000171056941445900521352994333897694840244172600326723116669563999498265513023176342954911888227798044681549072265625, so this run restores the same shelf anchor and raises only min_score_gain_per_added_move to 142.339380900065108903618238400667905807495117187500000000000000000000000000055593505969917669439723158516750823079356095106185012917608299836936291732532311460346363674034364521503448486328125 to continue binary-searching that lower edge. The experiment name remains shortened to avoid the filename-too-long failure seen with long autogenerated names.
autoresearch/snapshots/20260420T003206Z_hybrid_p8_m8_w3_g142p3393809000651089036182384006679058074951171874999999999999999999999999978617882319262434830875708262788144969478424959159610416304500062716810872102957130636013971525244414806365966796875_v1090.py	0.071006	0.789778	0.739821	0.375000	0.024580	discard	Restore the compact props8 + minsep8 hybrid shelf anchored at lwindow3, beam3, top4, boardcands2, secsep1, radius0, drop1, props8, total150, and lmargin9.935836791992188. The latest executed bracket is harmful at 142.33938090006510890361823840066790580749511718749999999999999999999999999994013007049393481752645198313580680591453958988564690916565260017560707044188827996578083912027068436145782470703125 and exact-flat at 142.339380900065108903618238400667905807495117187500000000000000000000000000055593505969917669439723158516750823079356095106185012917608299836936291732532311460346363674034364521503448486328125, so this run restores the same shelf anchor and raises only min_score_gain_per_added_move to 142.3393809000651089036182384006679058074951171874999999999999999999999999999978617882319262434830875708262788144969478424959159610416304500062716810872102957130636013971525244414806365966796875 to continue binary-searching that lower edge. The experiment name remains shortened to avoid the filename-too-long failure seen with long autogenerated names.
autoresearch/snapshots/20260420T003326Z_hybrid_p8_m8_w3_g142p33938090006510890361823840066790580749511718750000000000000000000000002672764710092195646140536467151481878815196880105048697961937492160398640987130358670498253559344448149204254150390625_v1091.py	0.071006	0.799339	0.749250	0.375000	0.020699	discard	Restore the compact props8 + minsep8 hybrid shelf anchored at lwindow3, beam3, top4, boardcands2, secsep1, radius0, drop1, props8, total150, and lmargin9.935836791992188. The latest executed bracket is harmful at 142.3393809000651089036182384006679058074951171874999999999999999999999999999978617882319262434830875708262788144969478424959159610416304500062716810872102957130636013971525244414806365966796875 and exact-flat at 142.339380900065108903618238400667905807495117187500000000000000000000000000055593505969917669439723158516750823079356095106185012917608299836936291732532311460346363674034364521503448486328125, so this run restores the same shelf anchor and raises only min_score_gain_per_added_move to 142.33938090006510890361823840066790580749511718750000000000000000000000000002672764710092195646140536467151481878815196880105048697961937492160398640987130358670498253559344448149204254150390625 to continue binary-searching that lower edge. The experiment name remains shortened to avoid the filename-too-long failure seen with long autogenerated names.
autoresearch/snapshots/20260420T003457Z_hybrid_p8_m8_w3_g142p339380900065108903618238400667905807495117187500000000000000000000000012294717666424099972246467748896816642549905648483224010624912463937833748540799649884291966372984461486339569091796875_v1092.py	0.071006	0.799339	0.749250	0.375000	0.020699	discard	Restore the compact props8 + minsep8 hybrid shelf anchored at lwindow3, beam3, top4, boardcands2, secsep1, radius0, drop1, props8, total150, and lmargin9.935836791992188. The latest executed bracket is harmful at 142.3393809000651089036182384006679058074951171874999999999999999999999999999978617882319262434830875708262788144969478424959159610416304500062716810872102957130636013971525244414806365966796875 and exact-flat at 142.33938090006510890361823840066790580749511718750000000000000000000000000002672764710092195646140536467151481878815196880105048697961937492160398640987130358670498253559344448149204254150390625, so this run restores the same shelf anchor and raises only min_score_gain_per_added_move to 142.339380900065108903618238400667905807495117187500000000000000000000000000012294717666424099972246467748896816642549905648483224010624912463937833748540799649884291966372984461486339569091796875 to continue binary-searching that lower edge. The experiment name remains shortened to avoid the filename-too-long failure seen with long autogenerated names.
autoresearch/snapshots/20260420T003617Z_hybrid_p8_m8_w3_g142p3393809000651089036182384006679058074951171875000000000000000000000000050782529491751717276670192875878155697488740721995925261276812351047574178755476814739466817627544514834880828857421875_v1093.py	0.071006	0.799339	0.749250	0.375000	0.020699	discard	Restore the compact props8 + minsep8 hybrid shelf anchored at lwindow3, beam3, top4, boardcands2, secsep1, radius0, drop1, props8, total150, and lmargin9.935836791992188. The latest executed bracket is harmful at 142.3393809000651089036182384006679058074951171874999999999999999999999999999978617882319262434830875708262788144969478424959159610416304500062716810872102957130636013971525244414806365966796875 and exact-flat at 142.339380900065108903618238400667905807495117187500000000000000000000000000012294717666424099972246467748896816642549905648483224010624912463937833748540799649884291966372984461486339569091796875, so this run restores the same shelf anchor and raises only min_score_gain_per_added_move to 142.3393809000651089036182384006679058074951171875000000000000000000000000000050782529491751717276670192875878155697488740721995925261276812351047574178755476814739466817627544514834880828857421875 to continue binary-searching that lower edge. The experiment name remains shortened to avoid the filename-too-long failure seen with long autogenerated names.
