snapshot	board_exact	non_empty_accuracy	macro_f1	move_recall	false_change_rate	status	description
autoresearch/snapshots/20260419T012429Z_hybrid_lookahead_segmental_drop1_boardcands4_ratio95_props15_top4_detect10_minsep4_secondarysep1_thresh3_total150_permove125_m9p8957061767578125_r0_beam4_v361.py	0.074556	0.788331	0.755947	0.312500	0.020699	discard	Hybrid decoder keeps the baseline lookahead path unless a conservative board-only segmental pass wins the current score-gain gates, while following up the current beam4 minsep4 plateau after lowering secondary event separation from 2 to 1 preserved board_exact, recall, and false-change while materially improving the secondary metrics, lowering the secondary peak ratio on that denser branch reopened a worse regime, and raising secondary event separation beyond 1 traded more secondary lift for worse false-change, and lowering only max event proposals from 16 to 15 on the secsep1 branch to test whether a slightly tighter proposal budget keeps the v355 gain while avoiding denser-search spillover.
autoresearch/snapshots/20260419T012531Z_hybrid_lookahead_segmental_drop1_boardcands4_ratio95_props16_top1_detect10_minsep4_secondarysep1_thresh3_total150_permove125_m9p8957061767578125_r0_beam4_v362.py	0.074556	0.761976	0.721833	0.312500	0.019405	discard	Hybrid decoder keeps the baseline lookahead path unless a conservative board-only segmental pass wins the current score-gain gates, while following up the current beam4 minsep4 plateau after lowering secondary event separation from 2 to 1 preserved board_exact, recall, and false-change while materially improving the secondary metrics, lowering the proposal budget on that denser branch improved the secondary metrics even further but worsened false-change, and lowering only top-move breadth from 4 to 1 on the secsep1 branch to test whether a narrower move menu keeps the secsep1 gain while trimming denser-search spillover.
autoresearch/snapshots/20260419T013114Z_hybrid_lookahead_segmental_drop1_boardcands4_ratio95_props14_top4_detect10_minsep4_secondarysep1_thresh3_total150_permove125_m9p8957061767578125_r0_beam4_v363.py	0.074556	0.786006	0.755888	0.312500	0.023286	discard	Hybrid decoder keeps the baseline lookahead path unless a conservative board-only segmental pass wins the current score-gain gates, while following up the current beam4 minsep4 plateau after lowering secondary event separation from 2 to 1 preserved board_exact, recall, and false-change while materially improving the secondary metrics, and lowering the proposal budget from 16 to 15 on that denser branch improved the secondary metrics further but worsened false-change, and lowering only max event proposals from 15 to 14 on the secsep1 branch to test whether that false-change regression is a sharp proposal-budget cliff or a smoother tradeoff.
autoresearch/snapshots/20260419T013211Z_hybrid_lookahead_segmental_drop1_boardcands4_ratio95_props15_top4_detect10_minsep4_secondarysep3_thresh3_total150_permove125_m9p8957061767578125_r0_beam4_v364.py	0.074556	0.761718	0.721403	0.328125	0.020699	discard	Hybrid decoder keeps the baseline lookahead path unless a conservative board-only segmental pass wins the current score-gain gates, while following up the current beam4 minsep4 plateau after lowering secondary event separation from 2 to 1 proved saturated under top-width and proposal-budget trims, raising secondary event separation to 3 materially improved the secondary metrics but worsened false-change, and lowering only max event proposals from 16 to 15 on the secsep3 branch to test whether a slightly tighter proposal budget can keep some of that secondary lift while reducing the false-change penalty.
autoresearch/snapshots/20260419T013327Z_hybrid_lookahead_segmental_drop1_boardcands4_ratio95_props14_top4_detect10_minsep4_secondarysep3_thresh3_total150_permove125_m9p8957061767578125_r0_beam4_v365.py	0.074556	0.765025	0.722606	0.312500	0.021992	discard	Hybrid decoder keeps the baseline lookahead path unless a conservative board-only segmental pass wins the current score-gain gates, while following up the current beam4 minsep4 plateau after lowering secondary event separation from 2 to 1 proved saturated under local trims, raising secondary event separation to 3 improved the secondary metrics but worsened false-change, and then lowering max event proposals from 16 to 15 on that secsep3 branch recovered false-change and recall while giving back those secondary gains, and lowering only max event proposals from 15 to 14 on the secsep3 branch to test whether that props15 tradeoff is a narrow sweet spot or part of a smoother proposal-budget curve.
autoresearch/snapshots/20260419T013506Z_hybrid_lookahead_segmental_drop1_boardcands4_ratio95_props13_top4_detect10_minsep4_secondarysep3_thresh3_total150_permove125_m9p8957061767578125_r0_beam4_v366.py	0.048521	0.759857	0.715815	0.328125	0.024580	discard	Hybrid decoder keeps the baseline lookahead path unless a conservative board-only segmental pass wins the current score-gain gates, while following up the current beam4 minsep4 plateau after the secsep3 branch showed a smooth proposal-budget tradeoff from props16 through props14, with props15 recovering false-change and recall but losing secsep3's secondary-metric lift and props14 landing between those surfaces, and lowering only max event proposals from 14 to 13 on the secsep3 branch to test whether that budget curve continues smoothly or whether props15 was the real floor before the branch collapses.
autoresearch/snapshots/20260419T013559Z_hybrid_lookahead_segmental_drop1_boardcands4_ratio95_props16_top1_detect10_minsep4_secondarysep3_thresh3_total150_permove125_m9p8957061767578125_r0_beam4_v367.py	0.074556	0.765387	0.734447	0.312500	0.023286	discard	Hybrid decoder keeps the baseline lookahead path unless a conservative board-only segmental pass wins the current score-gain gates, while following up the current beam4 minsep4 plateau after the secsep3 branch showed a smooth proposal-budget tradeoff from props16 down to a collapse at props13, and lowering only top-move breadth from 4 to 1 on the secsep3 branch to test whether a narrower move menu preserves secsep3's secondary-metric lift while trimming its false-change spillover.
autoresearch/snapshots/20260419T013712Z_hybrid_lookahead_segmental_drop1_boardcands1_ratio95_props16_top4_detect10_minsep4_secondarysep3_thresh3_total150_permove125_m9p8957061767578125_r0_beam4_v368.py	0.074556	0.741409	0.709559	0.312500	0.023286	discard	Hybrid decoder keeps the baseline lookahead path unless a conservative board-only segmental pass wins the current score-gain gates, while following up the current beam4 minsep4 plateau after the secsep3 branch saturated under top-width trims and showed a budget curve that recovered some false-change before collapsing, and lowering only top-board breadth from 4 to 1 on the secsep3 branch to test whether a narrower board menu preserves some of secsep3's secondary-metric lift while trimming its false-change penalty.
autoresearch/snapshots/20260419T013758Z_hybrid_lookahead_segmental_drop1_boardcands3_ratio95_props16_top4_detect10_minsep4_secondarysep3_thresh3_total150_permove125_m9p8957061767578125_r0_beam4_v369.py	0.074556	0.780838	0.746798	0.312500	0.023286	discard	Hybrid decoder keeps the baseline lookahead path unless a conservative board-only segmental pass wins the current score-gain gates, while following up the current beam4 minsep4 plateau after the secsep3 branch kept its secondary-metric lift under top-width trims, lost too much quality at boardcands1, and failed to beat the base branch under proposal-budget sweeps, and lowering only top-board breadth from 4 to 3 on the secsep3 branch to test whether a modest board-menu trim preserves the secsep3 lift while reducing its false-change penalty.
autoresearch/snapshots/20260419T013905Z_hybrid_lookahead_segmental_drop1_boardcands2_ratio95_props16_top4_detect10_minsep4_secondarysep3_thresh3_total150_permove125_m9p8957061767578125_r0_beam4_v370.py	0.074556	0.750814	0.718392	0.312500	0.023286	discard	Hybrid decoder keeps the baseline lookahead path unless a conservative board-only segmental pass wins the current score-gain gates, while following up the current beam4 minsep4 plateau after the secsep3 branch improved secondary metrics without fixing false-change, boardcands1 lost too much quality, and boardcands3 strengthened the secondary lift while keeping the same false-change penalty, and lowering only top-board breadth from 4 to 2 on the secsep3 branch to test whether an intermediate board menu is the local sweet spot between boardcands1 and boardcands3.
autoresearch/snapshots/20260419T014017Z_hybrid_lookahead_segmental_drop1_boardcands3_ratio95_props16_top4_detect10_minsep4_secondarysep1_thresh3_total150_permove125_m9p8957061767578125_r0_beam4_v371.py	0.074556	0.761976	0.721833	0.312500	0.019405	discard	Hybrid decoder keeps the baseline lookahead path unless a conservative board-only segmental pass wins the current score-gain gates, while following up the current beam4 minsep4 plateau after lowering secondary event separation from 2 to 1 preserved the main metrics but did not beat the base branch under top-width or proposal-budget trims, and the secsep3 branch showed that lowering board breadth to 3 can lift secondary metrics without changing the false-change penalty, and lowering only top-board breadth from 4 to 3 on the secsep1 branch to test whether that milder board-menu trim helps the denser secondary branch without reopening the worse false-change regime.
autoresearch/snapshots/20260419T014129Z_hybrid_lookahead_segmental_drop1_boardcands2_ratio95_props16_top4_detect10_minsep4_secondarysep1_thresh3_total150_permove125_m9p8957061767578125_r0_beam4_v372.py	0.074556	0.761098	0.714127	0.312500	0.019405	discard	Hybrid decoder keeps the baseline lookahead path unless a conservative board-only segmental pass wins the current score-gain gates, while following up the current beam4 minsep4 plateau after lowering secondary event separation from 2 to 1 preserved the main metrics but did not beat the base branch under top-width or proposal-budget trims, and lowering board breadth from 4 to 3 on that secsep1 branch was an exact no-op, and lowering only top-board breadth from 3 to 2 on the secsep1 branch to test whether board-menu effects stay inert there or start to change the denser secondary tradeoff before the aggressive boardcands1 edge.
autoresearch/snapshots/20260419T014221Z_hybrid_lookahead_segmental_drop1_boardcands3_ratio95_props15_top4_detect10_minsep4_secondarysep3_thresh3_total150_permove125_m9p8957061767578125_r0_beam4_v373.py	0.074556	0.761718	0.721403	0.328125	0.020699	discard	Hybrid decoder keeps the baseline lookahead path unless a conservative board-only segmental pass wins the current score-gain gates, while following up the current beam4 minsep4 plateau after the secsep3 branch showed its best secondary lift at boardcands3, and lowering proposals from 16 to 15 on the secsep3 branch recovered some false-change at the cost of those secondary gains, and combining only boardcands3 with props15 on the secsep3 branch to test whether that narrower board menu can preserve more of the secsep3 lift while still benefiting from the tighter proposal budget.
autoresearch/snapshots/20260419T014332Z_hybrid_lookahead_segmental_drop1_boardcands1_ratio95_props16_top4_detect10_minsep4_secondarysep1_thresh3_total150_permove125_m9p8957061767578125_r0_beam4_v374.py	0.074556	0.760219	0.709820	0.312500	0.020699	discard	Hybrid decoder keeps the baseline lookahead path unless a conservative board-only segmental pass wins the current score-gain gates, while following up the current beam4 minsep4 plateau after lowering secondary event separation from 2 to 1 preserved the main metrics but did not beat the base branch under top-width or proposal-budget trims, and lowering board breadth from 4 to 3 on that secsep1 branch was an exact no-op while lowering it to 2 only weakened secondary metrics, and lowering only top-board breadth from 2 to 1 on the secsep1 branch to test whether board-menu effects stay smooth there or finally hit a sharper edge at the narrowest board menu.
autoresearch/snapshots/20260419T014457Z_hybrid_lookahead_segmental_drop1_boardcands4_ratio95_props16_top4_detect10_minsep4_secondarysep3_thresh3_total150_permove125_m9p8957061767578125_r0_beam3_v375.py	0.074556	0.780838	0.747020	0.296875	0.024580	discard	Hybrid decoder keeps the baseline lookahead path unless a conservative board-only segmental pass wins the current score-gain gates, while following up the current beam4 minsep4 plateau after raising secondary event separation to 3 improved the secondary metrics but worsened false-change, and the base minsep4 family stayed on-surface when lowering beam size from 4 to 3 with only modest quality tradeoffs, and lowering only beam size from 4 to 3 on the secsep3 branch to test whether that sparse-secondary tradeoff depends on the beam4 search width or persists at the cheaper beam3 setting.
autoresearch/snapshots/20260419T014600Z_hybrid_lookahead_segmental_drop1_boardcands4_ratio95_props16_top4_detect10_minsep4_secondarysep3_thresh3_total150_permove125_m9p8957061767578125_r0_beam5_v376.py	0.074556	0.720635	0.708921	0.312500	0.023286	discard	Hybrid decoder keeps the baseline lookahead path unless a conservative board-only segmental pass wins the current score-gain gates, while following up the current beam4 minsep4 plateau after raising secondary event separation to 3 improved the secondary metrics but worsened false-change, and lowering beam size from 4 to 3 on that secsep3 branch kept the secondary lift while further hurting recall and false-change, and raising only beam size from 4 to 5 on the secsep3 branch to test whether the sparse-secondary tradeoff improves again with slightly wider search or is simply beam-insensitive above beam4.
autoresearch/snapshots/20260419T014653Z_hybrid_lookahead_segmental_drop1_boardcands4_ratio95_props16_top4_detect10_minsep4_secondarysep1_thresh3_total150_permove125_m9p8957061767578125_r0_beam3_v377.py	0.074556	0.761976	0.722065	0.296875	0.020699	discard	Hybrid decoder keeps the baseline lookahead path unless a conservative board-only segmental pass wins the current score-gain gates, while following up the current beam4 minsep4 plateau after lowering secondary event separation to 1 preserved board_exact, recall, and false-change while materially improving the secondary metrics, and board-width trims on that secsep1 branch stayed flat or only weakened secondary metrics, and lowering only beam size from 4 to 3 on the secsep1 branch to test whether that cheaper search width preserves the secsep1 false-change gain or reverts toward the weaker low-beam tradeoff.
autoresearch/snapshots/20260419T014757Z_hybrid_lookahead_segmental_drop1_boardcands4_ratio95_props16_top4_detect10_minsep4_secondarysep1_thresh3_total150_permove125_m9p8957061767578125_r0_beam5_v378.py	0.074556	0.761976	0.721833	0.312500	0.019405	discard	Hybrid decoder keeps the baseline lookahead path unless a conservative board-only segmental pass wins the current score-gain gates, while following up the current beam4 minsep4 plateau after lowering secondary event separation to 1 preserved board_exact, recall, and false-change while materially improving the secondary metrics, and lowering beam size from 4 to 3 on that secsep1 branch weakened recall and false-change, and raising only beam size from 4 to 5 on the secsep1 branch to test whether the better secsep1 tradeoff is specific to beam4 or remains stable on the next wider search width.
autoresearch/snapshots/20260419T014916Z_hybrid_lookahead_segmental_drop1_boardcands4_ratio95_props17_top4_detect10_minsep4_secondarysep1_thresh3_total150_permove125_m9p8957061767578125_r0_beam4_v379.py	0.074556	0.728231	0.715463	0.328125	0.021992	discard	Hybrid decoder keeps the baseline lookahead path unless a conservative board-only segmental pass wins the current score-gain gates, while following up the current beam4 minsep4 plateau after lowering secondary event separation to 1 preserved board_exact, recall, and false-change while materially improving the secondary metrics, lowering beam size from 4 to 3 weakened that branch while raising it to 5 was an exact no-op, and lowering the proposal budget from 16 to 15 improved the secondary metrics further but worsened false-change, and raising only max event proposals from 16 to 17 on the secsep1 branch to test whether the budget tradeoff around secsep1 is asymmetric or simply degrades away from props16 in both directions.
autoresearch/snapshots/20260419T015038Z_hybrid_lookahead_segmental_drop1_boardcands4_ratio95_props16_top8_detect10_minsep4_secondarysep1_thresh3_total150_permove125_m9p8957061767578125_r0_beam4_v380.py	0.074556	0.761976	0.721833	0.312500	0.019405	discard	Hybrid decoder keeps the baseline lookahead path unless a conservative board-only segmental pass wins the current score-gain gates, while following up the current beam4 minsep4 plateau after lowering secondary event separation to 1 preserved board_exact, recall, and false-change while materially improving the secondary metrics, narrowing that secsep1 branch to top1 was an exact no-op, proposal-budget sweeps worsened the tradeoff away from props16, and beam4 through beam5 stayed stable while beam3 got worse, and raising only top-move breadth from 4 to 8 on the secsep1 branch to test whether a broader move menu helps ambiguity resolution there or simply reopens denser-search spillover.
autoresearch/snapshots/20260419T015132Z_hybrid_lookahead_segmental_drop1_boardcands4_ratio95_props16_top4_detect10_minsep4_secondarysep1_thresh3_total150_permove125_m9p8957061767578125_r1_beam4_v381.py	0.074556	0.761976	0.721833	0.312500	0.019405	discard	Hybrid decoder keeps the baseline lookahead path unless a conservative board-only segmental pass wins the current score-gain gates, while following up the current beam4 minsep4 plateau after lowering secondary event separation to 1 preserved board_exact, recall, and false-change while materially improving the secondary metrics, and local beam, width, and proposal-budget sweeps on that secsep1 branch all either held flat or worsened the tradeoff, and raising only event window radius from 0 to 1 on the secsep1 branch to test whether a slightly wider temporal aggregation changes that otherwise saturated low-false-change surface.
autoresearch/snapshots/20260419T015246Z_hybrid_lookahead_segmental_drop1_boardcands4_ratio98_props16_top4_detect10_minsep4_thresh3_total150_permove125_m9p8957061767578125_r0_beam4_v382.py	0.074556	0.764405	0.723227	0.312500	0.019405	discard	Hybrid decoder keeps the baseline lookahead path unless a conservative board-only segmental pass wins the current score-gain gates, while following up the current beam4 minsep4 best surface after the secsep1 branch stayed saturated under local beam, width, budget, and radius sweeps and the sparser secsep3 family remained a tradeoff rather than an upgrade, and raising only secondary peak ratio from 0.95 to 0.98 on the restored secsep2 baseline branch to test whether a slightly stricter secondary proposal gate improves that best surface or is inert there too.
autoresearch/snapshots/20260419T015350Z_hybrid_lookahead_segmental_drop1_boardcands4_ratio90_props16_top4_detect10_minsep4_thresh3_total150_permove125_m9p8957061767578125_r0_beam4_v383.py	0.048521	0.756653	0.715000	0.343750	0.021992	discard	Hybrid decoder keeps the baseline lookahead path unless a conservative board-only segmental pass wins the current score-gain gates, while following up the current beam4 minsep4 best surface after raising secondary peak ratio from 0.95 to 0.98 was an exact no-op on the restored secsep2 baseline branch, the denser secsep1 branch remained saturated under local sweeps, and lowering only secondary peak ratio from 0.95 to 0.90 on the restored secsep2 baseline branch to test whether that best surface is actually ratio-insensitive or whether a looser secondary gate reopens a different regime.
autoresearch/snapshots/20260419T015454Z_hybrid_lookahead_segmental_drop1_boardcands4_ratio93_props16_top4_detect10_minsep4_thresh3_total150_permove125_m9p8957061767578125_r0_beam4_v384.py	0.074556	0.764405	0.723227	0.312500	0.019405	discard	Hybrid decoder keeps the baseline lookahead path unless a conservative board-only segmental pass wins the current score-gain gates, while following up the current beam4 minsep4 best surface after raising secondary peak ratio from 0.95 to 0.98 was an exact no-op on the restored secsep2 baseline branch, lowering it to 0.90 reopened a much worse regime, and lowering only secondary peak ratio from 0.95 to 0.93 on that restored baseline branch to localize whether the lower-side ratio cliff starts immediately below the current best surface or only much closer to 0.90.
autoresearch/snapshots/20260419T015541Z_hybrid_lookahead_segmental_drop1_boardcands4_ratio92_props16_top4_detect10_minsep4_thresh3_total150_permove125_m9p8957061767578125_r0_beam4_v385.py	0.063905	0.757325	0.715915	0.343750	0.021992	discard	Hybrid decoder keeps the baseline lookahead path unless a conservative board-only segmental pass wins the current score-gain gates, while following up the current beam4 minsep4 best surface after raising secondary peak ratio from 0.95 to 0.98 was an exact no-op on the restored secsep2 baseline branch, lowering it to 0.93 was also an exact no-op, and lowering it to 0.90 reopened a much worse regime, and lowering only secondary peak ratio from 0.93 to 0.92 on that restored baseline branch to localize the lower-side ratio cliff more precisely.
