snapshot	board_exact	non_empty_accuracy	macro_f1	move_recall	false_change_rate	status	description
autoresearch/snapshots/20260419T115815Z_hybrid_lookahead_segmental_drop1_boardcands4_ratio95_props7_top3_detect10_lwindow3_minsep7_secsep1_thresh3_total150_permove150_lmargin9p935836791992188_m9p8957061767578125_r0_beam3_v765.py	0.071006	0.799442	0.751518	0.375000	0.021992	discard	Hybrid decoder keeps the baseline lookahead path unless a conservative board-only segmental pass wins the current score-gain gates. The recent lower-beam sweep on the kept v545 branch established beam3 as the last usable lower-beam side branch, while beam2 and beam1 both degrade sharply. On beam3, raising LOOKAHEAD_WINDOW from 1 to 2 reopened a much higher-recall and noisier tradeoff, and tightening min_score_gain_per_added_move from 125.0 to 137.5 reduced that noise materially while preserving most of the recall gain. Narrowing board breadth from 3 to 2 then preserved board_exact while improving recall and false-change at the cost of weaker secondary metrics, while follow-up margin probes localized that narrower-board branch to the same 9.5..9.75 plateau and event-radius, drop, and upper gate follow-ups were non-improving. Lowering min_event_separation from 4 to 3 regressed sharply, while raising LOOKAHEAD_WINDOW from 2 to 3 reopened an even higher-recall and much noisier branch. On that lwindow3 branch, tightening min_score_gain_per_added_move and sweeping event_window_radius across 0..2 were exact no-ops; secsep3 opened a shifted upper shelf, secsep4/5/6 plus secondary_peak_ratio=0.98 matched it exactly, and drop0 was harmful. Raising min_event_separation from 4 to 5 on that upper shelf then preserved board_exact, recovered the higher recall, and reduced false changes; 6 was an exact no-op, 7 opened a much stronger higher-recall branch, 8 improved it again, and 9 was an exact no-op, while 10 was worse. On that stronger minsep8 branch, LOOKAHEAD_MARGIN=9.5625, 9.75, and 10.0 were all worse than 9.5, and lowering secondary_min_event_separation from 3 to 1 improved false changes slightly without hurting recall. On that secsep1 minsep8 branch, event_window_radius stayed flat across 0..2, tightening secondary_peak_ratio to 0.98 was an exact no-op, lowering segment_board_drop_worst_frames to 0 was also an exact no-op, and raising LOOKAHEAD_WINDOW to 4 collapsed badly and was not rescued by nearby spacing changes. Returning to the distinct lower-noise secsep1 minsep7 branch, raising LOOKAHEAD_MARGIN from 9.5 to 9.5625 unexpectedly matched the stronger minsep8 board_exact while increasing recall further at the cost of more false changes, 9.625 and 9.75 were exact no-ops, 9.875 improved secondary metrics without changing board_exact, recall, or false-change, and both 9.9375 and 10.0 dropped to a lower-recall / lower-noise regime. Binary localization then found the cliff is saturated at machine precision: 9.935836791992188 is the last confirmed higher-recall shelf point, while the adjacent next representable float 9.93583679199219 already falls into the lower-recall regime, so there is no distinct midpoint left to test. Follow-ups at that cliff-edge high-shelf anchor showed event_window_radius is flat across 0..2, lowering segment_board_drop_worst_frames from 1 to 0 is an exact no-op, tightening secondary_peak_ratio to 0.98 is an exact no-op, lowering top_move_candidates from 4 to 3 is an exact no-op while 1..2 are worse, raising max_event_proposals from 14 to 15 is worse, raising beam_size from 3 to 4 worsens secondary metrics without helping board_exact, recall, or false-change, lowering top_board_candidates from 2 to 1 also fails to improve the shelf, raising secondary_min_event_separation from 1 to 2 worsens secondary metrics and false-change while keeping board_exact and recall fixed, and tightening both hybrid acceptance gates across the recent 150.0→200.0 range remains exact-flat, so those gates appear non-binding in this neighborhood. Lowering max_event_proposals from 14 to 13 on this same cliff-edge anchor then preserved board_exact, recall, and false-change but sharply degraded secondary metrics, while lowering again from 13 to 12 partially recovered secondaries but also dropped recall and raised false-change, lowering once more to 11 dropped recall further without recovering false-change, and lowering to 10 again reduced recall while secondaries and false-change stayed in the same degraded regime. Lowering to 9 kept that same recall but reduced false-change further, lowering again to 8 preserved that lower recall while sharply improving secondary metrics and reducing false change again, and lowering to 7 preserved board_exact while improving secondaries again. Lowering to 6 then broke the shelf sharply, dropping board_exact and recall well below the new low-noise regime. On that props7 shelf, lowering top_move_candidates from 4 to 3 was an exact no-op, and lowering further to 2 or 1 preserved board_exact, recall, and false-change while only slightly weakening secondary metrics. Narrowing board breadth from 2 to 1 on the same shelf, however, reduced recall sharply and weakened secondaries, so boardcands2 still appears locally required there, while raising to 3 was an exact no-op. This run restores the strongest low-noise shelf point at props7 top3 and raises only top_board_candidates from 3 to 4 to test whether the board-breadth plateau extends one more step or whether the wider side finally degrades on this shelf.
autoresearch/snapshots/20260419T120327Z_hybrid_lookahead_segmental_drop1_boardcands2_ratio95_props7_top3_detect10_lwindow3_minsep7_secsep2_thresh3_total150_permove150_lmargin9p935836791992188_m9p8957061767578125_r0_beam3_v766.py	0.071006	0.797995	0.750998	0.375000	0.023286	discard	Hybrid decoder keeps the baseline lookahead path unless a conservative board-only segmental pass wins the current score-gain gates. The recent lower-beam sweep on the kept v545 branch established beam3 as the last usable lower-beam side branch, while beam2 and beam1 both degrade sharply. On beam3, raising LOOKAHEAD_WINDOW from 1 to 2 reopened a much higher-recall and noisier tradeoff, and tightening min_score_gain_per_added_move from 125.0 to 137.5 reduced that noise materially while preserving most of the recall gain. Narrowing board breadth from 3 to 2 then preserved board_exact while improving recall and false-change at the cost of weaker secondary metrics, while follow-up margin probes localized that narrower-board branch to the same 9.5..9.75 plateau and event-radius, drop, and upper gate follow-ups were non-improving. Lowering min_event_separation from 4 to 3 regressed sharply, while raising LOOKAHEAD_WINDOW from 2 to 3 reopened an even higher-recall and much noisier branch. On that lwindow3 branch, tightening min_score_gain_per_added_move and sweeping event_window_radius across 0..2 were exact no-ops; secsep3 opened a shifted upper shelf, secsep4/5/6 plus secondary_peak_ratio=0.98 matched it exactly, and drop0 was harmful. Raising min_event_separation from 4 to 5 on that upper shelf then preserved board_exact, recovered the higher recall, and reduced false changes; 6 was an exact no-op, 7 opened a much stronger higher-recall branch, 8 improved it again, and 9 was an exact no-op, while 10 was worse. On that stronger minsep8 branch, LOOKAHEAD_MARGIN=9.5625, 9.75, and 10.0 were all worse than 9.5, and lowering secondary_min_event_separation from 3 to 1 improved false changes slightly without hurting recall. On that secsep1 minsep8 branch, event_window_radius stayed flat across 0..2, tightening secondary_peak_ratio to 0.98 was an exact no-op, lowering segment_board_drop_worst_frames to 0 was also an exact no-op, and raising LOOKAHEAD_WINDOW to 4 collapsed badly and was not rescued by nearby spacing changes. Returning to the distinct lower-noise secsep1 minsep7 branch, raising LOOKAHEAD_MARGIN from 9.5 to 9.5625 unexpectedly matched the stronger minsep8 board_exact while increasing recall further at the cost of more false changes, 9.625 and 9.75 were exact no-ops, 9.875 improved secondary metrics without changing board_exact, recall, or false-change, and both 9.9375 and 10.0 dropped to a lower-recall / lower-noise regime. Binary localization then found the cliff is saturated at machine precision: 9.935836791992188 is the last confirmed higher-recall shelf point, while the adjacent next representable float 9.93583679199219 already falls into the lower-recall regime, so there is no distinct midpoint left to test. Follow-ups at that cliff-edge high-shelf anchor showed event_window_radius is flat across 0..2, lowering segment_board_drop_worst_frames from 1 to 0 is an exact no-op, tightening secondary_peak_ratio to 0.98 is an exact no-op, lowering top_move_candidates from 4 to 3 is an exact no-op while 1..2 are worse, raising max_event_proposals from 14 to 15 is worse, raising beam_size from 3 to 4 worsens secondary metrics without helping board_exact, recall, or false-change, lowering top_board_candidates from 2 to 1 also fails to improve the shelf, raising secondary_min_event_separation from 1 to 2 worsens secondary metrics and false-change while keeping board_exact and recall fixed, and tightening both hybrid acceptance gates across the recent 150.0→200.0 range remains exact-flat, so those gates appear non-binding in this neighborhood. Lowering max_event_proposals from 14 to 13 on this same cliff-edge anchor then preserved board_exact, recall, and false-change but sharply degraded secondary metrics, while lowering again from 13 to 12 partially recovered secondaries but also dropped recall and raised false-change, lowering once more to 11 dropped recall further without recovering false-change, and lowering to 10 again reduced recall while secondaries and false-change stayed in the same degraded regime. Lowering to 9 kept that same recall but reduced false-change further, lowering again to 8 preserved that lower recall while sharply improving secondary metrics and reducing false change again, and lowering to 7 preserved board_exact while improving secondaries again. Lowering to 6 then broke the shelf sharply, dropping board_exact and recall well below the new low-noise regime. On that props7 shelf, lowering top_move_candidates from 4 to 3 was an exact no-op, and lowering further to 2 or 1 preserved board_exact, recall, and false-change while only slightly weakening secondary metrics. Narrowing board breadth from 2 to 1 on the same shelf, however, reduced recall sharply and weakened secondaries, while raising to 3 or 4 was an exact no-op, so boardcands2 appears to be the minimum locally safe width and the wider board plateau is flat through 4. This run restores the strongest low-noise shelf point at props7 top3 boardcands2 and raises only secondary_min_event_separation from 1 to 2 to test whether the secsep1-specific gain still matters on this narrowed-proposal shelf or whether the lower-noise regime has become spacing-insensitive.
autoresearch/snapshots/20260419T120559Z_hybrid_lookahead_segmental_drop0_boardcands2_ratio95_props7_top3_detect10_lwindow3_minsep7_secsep1_thresh3_total150_permove150_lmargin9p935836791992188_m9p8957061767578125_r0_beam3_v767.py	0.071006	0.799442	0.751518	0.375000	0.021992	discard	Restore the strongest current props7 low-noise shelf point after v765 showed top_board_candidates=4 is still an exact no-op and v766 showed secondary_min_event_separation=2 is worse, then lower only segment_board_drop_worst_frames from 1 to 0 to test whether this narrowed-proposal minsep7/secsep1 shelf has any remaining drop sensitivity or is already saturated.
autoresearch/snapshots/20260419T120824Z_hybrid_lookahead_segmental_drop1_boardcands2_ratio95_props7_top3_detect10_lwindow3_minsep7_secsep1_thresh3_total150_permove150_lmargin9p935836791992188_m9p8957061767578125_r1_beam3_v768.py	0.071006	0.799442	0.751518	0.375000	0.021992	discard	Restore the strongest current props7 low-noise shelf point after v765 showed top_board_candidates=4 is still an exact no-op, v766 showed secondary_min_event_separation=2 is worse, and v767 showed segment_board_drop_worst_frames=0 is also an exact no-op, then raise only event_window_radius from 0 to 1 to test whether this narrowed-proposal minsep7/secsep1 shelf is also locally flat in radius or whether a small temporal window changes the low-noise tradeoff.
autoresearch/snapshots/20260419T121044Z_hybrid_lookahead_segmental_drop1_boardcands2_ratio95_props7_top3_detect10_lwindow3_minsep7_secsep1_thresh3_total150_permove150_lmargin9p935836791992188_m9p8957061767578125_r2_beam3_v769.py	0.071006	0.799442	0.751518	0.375000	0.021992	discard	Restore the strongest current props7 low-noise shelf point after v765 showed top_board_candidates=4 is still an exact no-op, v766 showed secondary_min_event_separation=2 is worse, v767 showed segment_board_drop_worst_frames=0 is also an exact no-op, and v768 showed event_window_radius=1 is still an exact no-op, then raise only event_window_radius from 0 to 2 to close the remaining cheap local radius probe on this narrowed-proposal minsep7/secsep1 shelf.
autoresearch/snapshots/20260419T121325Z_hybrid_lookahead_segmental_drop1_boardcands2_ratio98_props7_top3_detect10_lwindow3_minsep7_secsep1_thresh3_total150_permove150_lmargin9p935836791992188_m9p8957061767578125_r0_beam3_v770.py	0.071006	0.799442	0.751518	0.375000	0.021992	discard	Restore the strongest current props7 low-noise shelf point after v765 showed top_board_candidates=4 is still an exact no-op, v766 showed secondary_min_event_separation=2 is worse, v767 showed segment_board_drop_worst_frames=0 is also an exact no-op, and v768/v769 showed event_window_radius=1..2 are still exact no-ops, then raise only secondary_peak_ratio from 0.95 to 0.98 to test whether this narrowed-proposal minsep7/secsep1 shelf is also locally flat in peak filtering or whether the tighter secondary gate changes the low-noise tradeoff.
autoresearch/snapshots/20260419T121551Z_hybrid_lookahead_segmental_drop1_boardcands2_ratio95_props7_top3_detect10_lwindow3_minsep7_secsep1_thresh3_total150_permove137p5_lmargin9p935836791992188_m9p8957061767578125_r0_beam3_v771.py	0.071006	0.799442	0.751518	0.375000	0.021992	discard	Restore the strongest current props7 low-noise shelf point after v765 showed top_board_candidates=4 is still an exact no-op, v766 showed secondary_min_event_separation=2 is worse, v767 showed segment_board_drop_worst_frames=0 is also an exact no-op, v768/v769 showed event_window_radius=1..2 are still exact no-ops, and v770 showed secondary_peak_ratio=0.98 is also an exact no-op, then lower only min_score_gain_per_added_move from 150.0 to 137.5 to test whether the props7 low-noise shelf is also selection-gate flat or whether a slightly looser hybrid acceptance threshold changes recall/noise without leaving this local basin.
autoresearch/snapshots/20260419T121824Z_hybrid_lookahead_segmental_drop1_boardcands2_ratio95_props7_top3_detect10_lwindow3_minsep7_secsep1_thresh3_total150_permove150_lmargin9p935836791992188_m9p8957061767578125_r0_beam4_v772.py	0.071006	0.799442	0.751518	0.375000	0.021992	discard	Restore the strongest current props7 low-noise shelf point after v765 showed top_board_candidates=4 is still an exact no-op, v766 showed secondary_min_event_separation=2 is worse, v767 showed segment_board_drop_worst_frames=0 is also an exact no-op, v768/v769 showed event_window_radius=1..2 are still exact no-ops, and v770/v771 showed both the secondary_peak_ratio and per-added-move hybrid gate are also exact-flat here, then raise only beam_size from 3 to 4 to test whether extra beam breadth can still change this narrowed-proposal minsep7/secsep1 shelf or whether it is also saturated on beam.
autoresearch/snapshots/20260419T122110Z_hybrid_lookahead_segmental_drop1_boardcands2_ratio95_props7_top3_detect10_lwindow3_minsep7_secsep1_thresh3_total137p5_permove150_lmargin9p935836791992188_m9p8957061767578125_r0_beam3_v773.py	0.071006	0.799442	0.751518	0.375000	0.021992	discard	Restore the strongest current props7 low-noise shelf point after v765 showed top_board_candidates=4 is still an exact no-op, v766 showed secondary_min_event_separation=2 is worse, v767 showed segment_board_drop_worst_frames=0 is also an exact no-op, v768/v769 showed event_window_radius=1..2 are still exact no-ops, v770 showed secondary_peak_ratio=0.98 is also an exact no-op, v771 showed the per-added-move hybrid gate is exact-flat here, and v772 showed beam_size=4 is also an exact no-op, then lower only min_total_score_gain from 150.0 to 137.5 to test whether the props7 low-noise shelf is also flat in the remaining hybrid acceptance gate.
autoresearch/snapshots/20260419T122355Z_hybrid_lookahead_segmental_drop1_boardcands2_ratio95_props7_top3_detect10_lwindow3_minsep7_secsep1_thresh3_total125_permove150_lmargin9p935836791992188_m9p8957061767578125_r0_beam3_v774.py	0.071006	0.799442	0.751518	0.375000	0.021992	discard	Restore the strongest current props7 low-noise shelf point after v765 showed top_board_candidates=4 is still an exact no-op, v766 showed secondary_min_event_separation=2 is worse, v767 showed segment_board_drop_worst_frames=0 is also an exact no-op, v768/v769 showed event_window_radius=1..2 are still exact no-ops, v770 showed secondary_peak_ratio=0.98 is also an exact no-op, v771 showed the per-added-move hybrid gate is exact-flat here, v772 showed beam_size=4 is also an exact no-op, and v773 showed min_total_score_gain=137.5 is also an exact no-op, then lower only min_total_score_gain from 137.5 to 125.0 to test whether the props7 low-noise shelf remains flat down to the older baseline gate level or whether looser total-gain acceptance finally changes the tradeoff.
autoresearch/snapshots/20260419T122551Z_hybrid_lookahead_segmental_drop1_boardcands2_ratio95_props7_top3_detect10_lwindow3_minsep7_secsep1_thresh3_total150_permove150_lmargin9p935836791992188_m9p8957061767578125_r0_beam2_v775.py	0.071006	0.797116	0.750684	0.375000	0.021992	discard	Restore the strongest current props7 low-noise shelf point after v765 showed top_board_candidates=4 is still an exact no-op, v766 showed secondary_min_event_separation=2 is worse, v767 showed segment_board_drop_worst_frames=0 is also an exact no-op, v768/v769 showed event_window_radius=1..2 are still exact no-ops, v770 showed secondary_peak_ratio=0.98 is also an exact no-op, v771 showed the per-added-move hybrid gate is exact-flat here, v772 showed beam_size=4 is also an exact no-op, and v773/v774 showed the total-gain gate is also exact-flat down to 125.0, then lower only beam_size from 3 to 2 to test whether this narrowed-proposal minsep7/secsep1 shelf still depends on beam3 or whether the low-noise regime survives one more beam step down.
autoresearch/snapshots/20260419T122707Z_hybrid_lookahead_segmental_drop1_boardcands2_ratio95_props7_top3_detect10_lwindow3_minsep7_secsep1_thresh3_total150_permove150_lmargin9p935836791992188_m9p8957061767578125_r0_beam1_v776.py	0.071006	0.772260	0.703105	0.328125	0.019405	discard	Restore the strongest current props7 low-noise shelf point after v765 showed top_board_candidates=4 is still an exact no-op, v766 showed secondary_min_event_separation=2 is worse, v767 showed segment_board_drop_worst_frames=0 is also an exact no-op, v768/v769 showed event_window_radius=1..2 are still exact no-ops, v770 showed secondary_peak_ratio=0.98 is also an exact no-op, v771 showed the per-added-move hybrid gate is exact-flat here, v772 showed beam_size=4 is also an exact no-op, v773/v774 showed the total-gain gate is also exact-flat down to 125.0, and v775 showed beam_size=2 slightly weakens secondaries without changing board_exact, recall, or false-change, then lower only beam_size from 2 to 1 to measure whether this shelf fully collapses below beam2 or just continues the same gentle degradation.
autoresearch/snapshots/20260419T122823Z_hybrid_lookahead_segmental_drop1_boardcands2_ratio95_props7_top3_detect10_lwindow3_minsep7_secsep1_thresh3_total150_permove125_lmargin9p935836791992188_m9p8957061767578125_r0_beam3_v777.py	0.071006	0.799442	0.751518	0.375000	0.021992	discard	Restore the strongest current props7 low-noise shelf point after v765 showed top_board_candidates=4 is still an exact no-op, v766 showed secondary_min_event_separation=2 is worse, v767 showed segment_board_drop_worst_frames=0 is also an exact no-op, v768/v769 showed event_window_radius=1..2 are still exact no-ops, v770 showed secondary_peak_ratio=0.98 is also an exact no-op, v771 showed the per-added-move hybrid gate is exact-flat at 137.5, v772 showed beam_size=4 is also an exact no-op, v773/v774 showed the total-gain gate is exact-flat down to 125.0, and v775/v776 mapped the lower-beam side: beam2 only weakens secondaries slightly while beam1 drops recall sharply. This run restores beam3 and lowers only min_score_gain_per_added_move from 150.0 to 125.0 to test whether the props7 shelf stays flat all the way down to the older baseline per-move gate.
