snapshot	board_exact	non_empty_accuracy	macro_f1	move_recall	false_change_rate	status	description
autoresearch/snapshots/20260419T114538Z_hybrid_lookahead_segmental_drop1_boardcands2_ratio95_props8_top4_detect10_lwindow3_minsep7_secsep1_thresh3_total150_permove150_lmargin9p935836791992188_m9p8957061767578125_r0_beam3_v757.py	0.071006	0.797892	0.748744	0.390625	0.021992	discard	Hybrid decoder keeps the baseline lookahead path unless a conservative board-only segmental pass wins the current score-gain gates. The recent lower-beam sweep on the kept v545 branch established beam3 as the last usable lower-beam side branch, while beam2 and beam1 both degrade sharply. On beam3, raising LOOKAHEAD_WINDOW from 1 to 2 reopened a much higher-recall and noisier tradeoff, and tightening min_score_gain_per_added_move from 125.0 to 137.5 reduced that noise materially while preserving most of the recall gain. Narrowing board breadth from 3 to 2 then preserved board_exact while improving recall and false-change at the cost of weaker secondary metrics, while follow-up margin probes localized that narrower-board branch to the same 9.5..9.75 plateau and event-radius, drop, and upper gate follow-ups were non-improving. Lowering min_event_separation from 4 to 3 regressed sharply, while raising LOOKAHEAD_WINDOW from 2 to 3 reopened an even higher-recall and much noisier branch. On that lwindow3 branch, tightening min_score_gain_per_added_move and sweeping event_window_radius across 0..2 were exact no-ops; secsep3 opened a shifted upper shelf, secsep4/5/6 plus secondary_peak_ratio=0.98 matched it exactly, and drop0 was harmful. Raising min_event_separation from 4 to 5 on that upper shelf then preserved board_exact, recovered the higher recall, and reduced false changes; 6 was an exact no-op, 7 opened a much stronger higher-recall branch, 8 improved it again, and 9 was an exact no-op, while 10 was worse. On that stronger minsep8 branch, LOOKAHEAD_MARGIN=9.5625, 9.75, and 10.0 were all worse than 9.5, and lowering secondary_min_event_separation from 3 to 1 improved false changes slightly without hurting recall. On that secsep1 minsep8 branch, event_window_radius stayed flat across 0..2, tightening secondary_peak_ratio to 0.98 was an exact no-op, lowering segment_board_drop_worst_frames to 0 was also an exact no-op, and raising LOOKAHEAD_WINDOW to 4 collapsed badly and was not rescued by nearby spacing changes. Returning to the distinct lower-noise secsep1 minsep7 branch, raising LOOKAHEAD_MARGIN from 9.5 to 9.5625 unexpectedly matched the stronger minsep8 board_exact while increasing recall further at the cost of more false changes, 9.625 and 9.75 were exact no-ops, 9.875 improved secondary metrics without changing board_exact, recall, or false-change, and both 9.9375 and 10.0 dropped to a lower-recall / lower-noise regime. Binary localization then found the cliff is saturated at machine precision: 9.935836791992188 is the last confirmed higher-recall shelf point, while the adjacent next representable float 9.93583679199219 already falls into the lower-recall regime, so there is no distinct midpoint left to test. Follow-ups at that cliff-edge high-shelf anchor showed event_window_radius is flat across 0..2, lowering segment_board_drop_worst_frames from 1 to 0 is an exact no-op, tightening secondary_peak_ratio to 0.98 is an exact no-op, lowering top_move_candidates from 4 to 3 is an exact no-op while 1..2 are worse, raising max_event_proposals from 14 to 15 is worse, raising beam_size from 3 to 4 worsens secondary metrics without helping board_exact, recall, or false-change, lowering top_board_candidates from 2 to 1 also fails to improve the shelf, raising top_board_candidates from 2 to 3 hurts secondary metrics, raising secondary_min_event_separation from 1 to 2 worsens secondary metrics and false-change while keeping board_exact and recall fixed, and tightening both hybrid acceptance gates across the recent 150.0→200.0 range remains exact-flat, so those gates appear non-binding in this neighborhood. Lowering max_event_proposals from 14 to 13 on this same cliff-edge anchor then preserved board_exact, recall, and false-change but sharply degraded secondary metrics, while lowering again from 13 to 12 partially recovered secondaries but also dropped recall and raised false-change, lowering once more to 11 dropped recall further without recovering false-change, and lowering to 10 again reduced recall while secondaries and false-change stayed in the same degraded regime. Lowering to 9 kept that same recall but reduced false-change further, suggesting the narrow-proposal side may be approaching a lower-recall / lower-noise shelf rather than collapsing outright. This run keeps the same stabilized anchor and lowers only max_event_proposals from 9 to 8 to test whether that apparent shelf persists one step further down.
autoresearch/snapshots/20260419T114656Z_hybrid_lookahead_segmental_drop1_boardcands2_ratio95_props7_top4_detect10_lwindow3_minsep7_secsep1_thresh3_total150_permove150_lmargin9p935836791992188_m9p8957061767578125_r0_beam3_v758.py	0.071006	0.799442	0.751518	0.375000	0.021992	discard	Hybrid decoder keeps the baseline lookahead path unless a conservative board-only segmental pass wins the current score-gain gates. The recent lower-beam sweep on the kept v545 branch established beam3 as the last usable lower-beam side branch, while beam2 and beam1 both degrade sharply. On beam3, raising LOOKAHEAD_WINDOW from 1 to 2 reopened a much higher-recall and noisier tradeoff, and tightening min_score_gain_per_added_move from 125.0 to 137.5 reduced that noise materially while preserving most of the recall gain. Narrowing board breadth from 3 to 2 then preserved board_exact while improving recall and false-change at the cost of weaker secondary metrics, while follow-up margin probes localized that narrower-board branch to the same 9.5..9.75 plateau and event-radius, drop, and upper gate follow-ups were non-improving. Lowering min_event_separation from 4 to 3 regressed sharply, while raising LOOKAHEAD_WINDOW from 2 to 3 reopened an even higher-recall and much noisier branch. On that lwindow3 branch, tightening min_score_gain_per_added_move and sweeping event_window_radius across 0..2 were exact no-ops; secsep3 opened a shifted upper shelf, secsep4/5/6 plus secondary_peak_ratio=0.98 matched it exactly, and drop0 was harmful. Raising min_event_separation from 4 to 5 on that upper shelf then preserved board_exact, recovered the higher recall, and reduced false changes; 6 was an exact no-op, 7 opened a much stronger higher-recall branch, 8 improved it again, and 9 was an exact no-op, while 10 was worse. On that stronger minsep8 branch, LOOKAHEAD_MARGIN=9.5625, 9.75, and 10.0 were all worse than 9.5, and lowering secondary_min_event_separation from 3 to 1 improved false changes slightly without hurting recall. On that secsep1 minsep8 branch, event_window_radius stayed flat across 0..2, tightening secondary_peak_ratio to 0.98 was an exact no-op, lowering segment_board_drop_worst_frames to 0 was also an exact no-op, and raising LOOKAHEAD_WINDOW to 4 collapsed badly and was not rescued by nearby spacing changes. Returning to the distinct lower-noise secsep1 minsep7 branch, raising LOOKAHEAD_MARGIN from 9.5 to 9.5625 unexpectedly matched the stronger minsep8 board_exact while increasing recall further at the cost of more false changes, 9.625 and 9.75 were exact no-ops, 9.875 improved secondary metrics without changing board_exact, recall, or false-change, and both 9.9375 and 10.0 dropped to a lower-recall / lower-noise regime. Binary localization then found the cliff is saturated at machine precision: 9.935836791992188 is the last confirmed higher-recall shelf point, while the adjacent next representable float 9.93583679199219 already falls into the lower-recall regime, so there is no distinct midpoint left to test. Follow-ups at that cliff-edge high-shelf anchor showed event_window_radius is flat across 0..2, lowering segment_board_drop_worst_frames from 1 to 0 is an exact no-op, tightening secondary_peak_ratio to 0.98 is an exact no-op, lowering top_move_candidates from 4 to 3 is an exact no-op while 1..2 are worse, raising max_event_proposals from 14 to 15 is worse, raising beam_size from 3 to 4 worsens secondary metrics without helping board_exact, recall, or false-change, lowering top_board_candidates from 2 to 1 also fails to improve the shelf, raising top_board_candidates from 2 to 3 hurts secondary metrics, raising secondary_min_event_separation from 1 to 2 worsens secondary metrics and false-change while keeping board_exact and recall fixed, and tightening both hybrid acceptance gates across the recent 150.0→200.0 range remains exact-flat, so those gates appear non-binding in this neighborhood. Lowering max_event_proposals from 14 to 13 on this same cliff-edge anchor then preserved board_exact, recall, and false-change but sharply degraded secondary metrics, while lowering again from 13 to 12 partially recovered secondaries but also dropped recall and raised false-change, lowering once more to 11 dropped recall further without recovering false-change, and lowering to 10 again reduced recall while secondaries and false-change stayed in the same degraded regime. Lowering to 9 kept that same recall but reduced false-change further, and lowering again to 8 preserved that lower recall while sharply improving secondary metrics and reducing false-change again, suggesting the narrow-proposal side may be settling onto a distinct lower-recall / lower-noise shelf rather than simply collapsing. This run keeps the same stabilized anchor and lowers only max_event_proposals from 8 to 7 to test whether that apparent shelf persists one more step down.
autoresearch/snapshots/20260419T114825Z_hybrid_lookahead_segmental_drop1_boardcands2_ratio95_props6_top4_detect10_lwindow3_minsep7_secsep1_thresh3_total150_permove150_lmargin9p935836791992188_m9p8957061767578125_r0_beam3_v759.py	0.049704	0.780890	0.709798	0.218750	0.023286	discard	Hybrid decoder keeps the baseline lookahead path unless a conservative board-only segmental pass wins the current score-gain gates. The recent lower-beam sweep on the kept v545 branch established beam3 as the last usable lower-beam side branch, while beam2 and beam1 both degrade sharply. On beam3, raising LOOKAHEAD_WINDOW from 1 to 2 reopened a much higher-recall and noisier tradeoff, and tightening min_score_gain_per_added_move from 125.0 to 137.5 reduced that noise materially while preserving most of the recall gain. Narrowing board breadth from 3 to 2 then preserved board_exact while improving recall and false-change at the cost of weaker secondary metrics, while follow-up margin probes localized that narrower-board branch to the same 9.5..9.75 plateau and event-radius, drop, and upper gate follow-ups were non-improving. Lowering min_event_separation from 4 to 3 regressed sharply, while raising LOOKAHEAD_WINDOW from 2 to 3 reopened an even higher-recall and much noisier branch. On that lwindow3 branch, tightening min_score_gain_per_added_move and sweeping event_window_radius across 0..2 were exact no-ops; secsep3 opened a shifted upper shelf, secsep4/5/6 plus secondary_peak_ratio=0.98 matched it exactly, and drop0 was harmful. Raising min_event_separation from 4 to 5 on that upper shelf then preserved board_exact, recovered the higher recall, and reduced false changes; 6 was an exact no-op, 7 opened a much stronger higher-recall branch, 8 improved it again, and 9 was an exact no-op, while 10 was worse. On that stronger minsep8 branch, LOOKAHEAD_MARGIN=9.5625, 9.75, and 10.0 were all worse than 9.5, and lowering secondary_min_event_separation from 3 to 1 improved false changes slightly without hurting recall. On that secsep1 minsep8 branch, event_window_radius stayed flat across 0..2, tightening secondary_peak_ratio to 0.98 was an exact no-op, lowering segment_board_drop_worst_frames to 0 was also an exact no-op, and raising LOOKAHEAD_WINDOW to 4 collapsed badly and was not rescued by nearby spacing changes. Returning to the distinct lower-noise secsep1 minsep7 branch, raising LOOKAHEAD_MARGIN from 9.5 to 9.5625 unexpectedly matched the stronger minsep8 board_exact while increasing recall further at the cost of more false changes, 9.625 and 9.75 were exact no-ops, 9.875 improved secondary metrics without changing board_exact, recall, or false-change, and both 9.9375 and 10.0 dropped to a lower-recall / lower-noise regime. Binary localization then found the cliff is saturated at machine precision: 9.935836791992188 is the last confirmed higher-recall shelf point, while the adjacent next representable float 9.93583679199219 already falls into the lower-recall regime, so there is no distinct midpoint left to test. Follow-ups at that cliff-edge high-shelf anchor showed event_window_radius is flat across 0..2, lowering segment_board_drop_worst_frames from 1 to 0 is an exact no-op, tightening secondary_peak_ratio to 0.98 is an exact no-op, lowering top_move_candidates from 4 to 3 is an exact no-op while 1..2 are worse, raising max_event_proposals from 14 to 15 is worse, raising beam_size from 3 to 4 worsens secondary metrics without helping board_exact, recall, or false-change, lowering top_board_candidates from 2 to 1 also fails to improve the shelf, raising top_board_candidates from 2 to 3 hurts secondary metrics, raising secondary_min_event_separation from 1 to 2 worsens secondary metrics and false-change while keeping board_exact and recall fixed, and tightening both hybrid acceptance gates across the recent 150.0→200.0 range remains exact-flat, so those gates appear non-binding in this neighborhood. Lowering max_event_proposals from 14 to 13 on this same cliff-edge anchor then preserved board_exact, recall, and false-change but sharply degraded secondary metrics, while lowering again from 13 to 12 partially recovered secondaries but also dropped recall and raised false-change, lowering once more to 11 dropped recall further without recovering false-change, and lowering to 10 again reduced recall while secondaries and false-change stayed in the same degraded regime. Lowering to 9 kept that same recall but reduced false-change further, and lowering again to 8 preserved that lower recall while sharply improving secondary metrics and reducing false-change again. Lowering to 7 preserved board_exact and the lower recall shelf while improving secondaries again, suggesting this narrower proposal regime is still viable and may not have bottomed out yet. This run keeps the same stabilized anchor and lowers only max_event_proposals from 7 to 6 to test whether that apparent low-recall / lower-noise shelf persists one more step down or finally breaks.
autoresearch/snapshots/20260419T115004Z_hybrid_lookahead_segmental_drop1_boardcands2_ratio95_props7_top3_detect10_lwindow3_minsep7_secsep1_thresh3_total150_permove150_lmargin9p935836791992188_m9p8957061767578125_r0_beam3_v760.py	0.071006	0.799442	0.751518	0.375000	0.021992	discard	Hybrid decoder keeps the baseline lookahead path unless a conservative board-only segmental pass wins the current score-gain gates. The recent lower-beam sweep on the kept v545 branch established beam3 as the last usable lower-beam side branch, while beam2 and beam1 both degrade sharply. On beam3, raising LOOKAHEAD_WINDOW from 1 to 2 reopened a much higher-recall and noisier tradeoff, and tightening min_score_gain_per_added_move from 125.0 to 137.5 reduced that noise materially while preserving most of the recall gain. Narrowing board breadth from 3 to 2 then preserved board_exact while improving recall and false-change at the cost of weaker secondary metrics, while follow-up margin probes localized that narrower-board branch to the same 9.5..9.75 plateau and event-radius, drop, and upper gate follow-ups were non-improving. Lowering min_event_separation from 4 to 3 regressed sharply, while raising LOOKAHEAD_WINDOW from 2 to 3 reopened an even higher-recall and much noisier branch. On that lwindow3 branch, tightening min_score_gain_per_added_move and sweeping event_window_radius across 0..2 were exact no-ops; secsep3 opened a shifted upper shelf, secsep4/5/6 plus secondary_peak_ratio=0.98 matched it exactly, and drop0 was harmful. Raising min_event_separation from 4 to 5 on that upper shelf then preserved board_exact, recovered the higher recall, and reduced false changes; 6 was an exact no-op, 7 opened a much stronger higher-recall branch, 8 improved it again, and 9 was an exact no-op, while 10 was worse. On that stronger minsep8 branch, LOOKAHEAD_MARGIN=9.5625, 9.75, and 10.0 were all worse than 9.5, and lowering secondary_min_event_separation from 3 to 1 improved false changes slightly without hurting recall. On that secsep1 minsep8 branch, event_window_radius stayed flat across 0..2, tightening secondary_peak_ratio to 0.98 was an exact no-op, lowering segment_board_drop_worst_frames to 0 was also an exact no-op, and raising LOOKAHEAD_WINDOW to 4 collapsed badly and was not rescued by nearby spacing changes. Returning to the distinct lower-noise secsep1 minsep7 branch, raising LOOKAHEAD_MARGIN from 9.5 to 9.5625 unexpectedly matched the stronger minsep8 board_exact while increasing recall further at the cost of more false changes, 9.625 and 9.75 were exact no-ops, 9.875 improved secondary metrics without changing board_exact, recall, or false-change, and both 9.9375 and 10.0 dropped to a lower-recall / lower-noise regime. Binary localization then found the cliff is saturated at machine precision: 9.935836791992188 is the last confirmed higher-recall shelf point, while the adjacent next representable float 9.93583679199219 already falls into the lower-recall regime, so there is no distinct midpoint left to test. Follow-ups at that cliff-edge high-shelf anchor showed event_window_radius is flat across 0..2, lowering segment_board_drop_worst_frames from 1 to 0 is an exact no-op, tightening secondary_peak_ratio to 0.98 is an exact no-op, lowering top_move_candidates from 4 to 3 is an exact no-op while 1..2 are worse, raising max_event_proposals from 14 to 15 is worse, raising beam_size from 3 to 4 worsens secondary metrics without helping board_exact, recall, or false-change, lowering top_board_candidates from 2 to 1 also fails to improve the shelf, raising top_board_candidates from 2 to 3 hurts secondary metrics, raising secondary_min_event_separation from 1 to 2 worsens secondary metrics and false-change while keeping board_exact and recall fixed, and tightening both hybrid acceptance gates across the recent 150.0→200.0 range remains exact-flat, so those gates appear non-binding in this neighborhood. Lowering max_event_proposals from 14 to 13 on this same cliff-edge anchor then preserved board_exact, recall, and false-change but sharply degraded secondary metrics, while lowering again from 13 to 12 partially recovered secondaries but also dropped recall and raised false-change, lowering once more to 11 dropped recall further without recovering false-change, and lowering to 10 again reduced recall while secondaries and false-change stayed in the same degraded regime. Lowering to 9 kept that same recall but reduced false-change further, lowering again to 8 preserved that lower recall while sharply improving secondary metrics and reducing false change again, and lowering to 7 preserved board_exact while improving secondaries again. Lowering to 6 then broke the shelf sharply, dropping board_exact and recall well below the new low-noise regime. This run restores the strongest low-noise shelf point at props7 and lowers only top_move_candidates from 4 to 3 to test whether the earlier top3 no-op also holds on this narrowed-proposal shelf or whether top4 is now locally required.
