snapshot	board_exact	non_empty_accuracy	macro_f1	move_recall	false_change_rate	status	description
autoresearch/snapshots/20260420T030329Z_hybrid_p8_m8_w3_v1177.py	0.071006	0.789778	0.739821	0.375000	0.024580	discard	Restore the compact props8 + minsep8 hybrid shelf anchored at lwindow3, beam3, top4, boardcands2, secsep1, radius0, drop1, props8, total150, and lmargin9.935836791992188. The latest executed bracket is harmful at 142.33938090006510890361823840066790580749511718749999999999999999999999999999999999999999999999999996506842542835399037923728398534494381459052927261884516592225007270336109333802834406187962010425168986668889382552009068287422377985414201351233032255549915134906768798828125 and exact-flat at 142.3393809000651089036182384006679058074951171875000000000000000000000000000000000000000000000000000008843436600416711296395624307507609159228059840089916844187817554758642761180245988845093767062214762059066102828982255523322981321555913414300675867707468569278717041015625. This run re-prepares their midpoint, 142.339380900065108903618238400667905807495117187499999999999999999999999999999999999999999999999999982976384544197830754438423208047852365256667628313918425170515914089612684728026471473194498405236583036297752054209158117603260956004866677471198954663123004138469696044921875, with a short experiment name to avoid filename-too-long failures.
autoresearch/snapshots/20260420T030435Z_hybrid_p8_m8_w3_v1178.py	0.071006	0.789778	0.739821	0.375000	0.024580	discard	Restore the compact props8 + minsep8 hybrid shelf anchored at lwindow3, beam3, top4, boardcands2, secsep1, radius0, drop1, props8, total150, and lmargin9.935836791992188. The latest executed bracket is harmful at 142.339380900065108903618238400667905807495117187499999999999999999999999999999999999999999999999999982976384544197830754438423208047852365256667628313918425170515914089612684728026471473194498405236583036297752054209158117603260956004866677471198954663123004138469696044921875 and exact-flat at 142.3393809000651089036182384006679058074951171875000000000000000000000000000000000000000000000000000008843436600416711296395624307507609159228059840089916844187817554758642761180245988845093767062214762059066102828982255523322981321555913414300675867707468569278717041015625. This run re-prepares their midpoint, 142.3393809000651089036182384006679058074951171874999999999999999999999999999999999999999999999999999919303641021197509420389928193993066405897368061614550547946488347827384804230255351788519375557290296211021811685536918349677795440802290094506332707169349305331707000732421875, with a short experiment name to avoid filename-too-long failures.
autoresearch/snapshots/20260420T030543Z_hybrid_p8_m8_w3_v1179.py	0.071006	0.789778	0.739821	0.375000	0.024580	discard	Restore the compact props8 + minsep8 hybrid shelf anchored at lwindow3, beam3, top4, boardcands2, secsep1, radius0, drop1, props8, total150, and lmargin9.935836791992188. The latest executed bracket is harmful at 142.3393809000651089036182384006679058074951171874999999999999999999999999999999999999999999999999999919303641021197509420389928193993066405897368061614550547946488347827384804230255351788519375557290296211021811685536918349677795440802290094506332707169349305331707000732421875 and exact-flat at 142.3393809000651089036182384006679058074951171875000000000000000000000000000000000000000000000000000008843436600416711296395624307507609159228059840089916844187817554758642761180245988845093767062214762059066102828982255523322981321555913414300675867707468569278717041015625. This run re-prepares their midpoint, 142.33938090006510890361823840066790580749511718749999999999999999999999999999999999999999999999999999640735388108071103583927762507503377825627139508522336960671529512930137827052506703168065713097525291350439572572595869365003883811791017544035042874384089373052120208740234375, with a short experiment name to avoid filename-too-long failures.
autoresearch/snapshots/20260420T030647Z_hybrid_p8_m8_w3_v1180.py	0.071006	0.789778	0.739821	0.375000	0.024580	discard	Restore the compact props8 + minsep8 hybrid shelf anchored at lwindow3, beam3, top4, boardcands2, secsep1, radius0, drop1, props8, total150, and lmargin9.935836791992188. The latest executed bracket is harmful at 142.33938090006510890361823840066790580749511718749999999999999999999999999999999999999999999999999999640735388108071103583927762507503377825627139508522336960671529512930137827052506703168065713097525291350439572572595869365003883811791017544035042874384089373052120208740234375 and exact-flat at 142.3393809000651089036182384006679058074951171875000000000000000000000000000000000000000000000000000008843436600416711296395624307507609159228059840089916844187817554758642761180245988845093767062214762059066102828982255523322981321555913414300675867707468569278717041015625. This run re-prepares their midpoint, 142.339380900065108903618238400667905807495117187499999999999999999999999999999999999999999999999999998645848770561191082739420027912897347089538689547107527012748525302582827194274832958095016918598364559705503004312092122991168485136750758435209007757293875329196453094482421875, with a short experiment name to avoid filename-too-long failures.
autoresearch/snapshots/20260420T030851Z_hybrid_p8_m8_w3_v1181.py	0.071006	0.789778	0.739821	0.375000	0.024580	discard	Restore the compact props8 + minsep8 hybrid shelf anchored at lwindow3, beam3, top4, boardcands2, secsep1, radius0, drop1, props8, total150, and lmargin9.935836791992188. The latest executed bracket is harmful at 142.339380900065108903618238400667905807495117187499999999999999999999999999999999999999999999999999998645848770561191082739420027912897347089538689547107527012748525302582827194274832958095016918598364559705503004312092122991168485136750758435209007757293875329196453094482421875 and exact-flat at 142.3393809000651089036182384006679058074951171875000000000000000000000000000000000000000000000000000008843436600416711296395624307507609159228059840089916844187817554758642761180245988845093767062214762059066102828982255523322981321555913414300675867707468569278717041015625. This run re-prepares their midpoint, 142.3393809000651089036182384006679058074951171874999999999999999999999999999999999999999999999999999997650962153014311061894912293318291315061723367780496057157651403892235516561497159213021968124099203828060566436051588376617333086461710499326382972640203661285340785980224609375, with a short experiment name to avoid filename-too-long failures.
autoresearch/snapshots/20260420T031013Z_hybrid_p8_m8_w3_v1182.py	0.071006	0.799339	0.749250	0.375000	0.020699	discard	Restore the compact props8 + minsep8 hybrid shelf anchored at lwindow3, beam3, top4, boardcands2, secsep1, radius0, drop1, props8, total150, and lmargin9.935836791992188. The latest executed bracket is harmful at 142.3393809000651089036182384006679058074951171874999999999999999999999999999999999999999999999999999997650962153014311061894912293318291315061723367780496057157651403892235516561497159213021968124099203828060566436051588376617333086461710499326382972640203661285340785980224609375 and exact-flat at 142.3393809000651089036182384006679058074951171875000000000000000000000000000000000000000000000000000008843436600416711296395624307507609159228059840089916844187817554758642761180245988845093767062214762059066102828982255523322981321555913414300675867707468569278717041015625. This run re-prepares their midpoint, 142.33938090006510890361823840066790580749511718750000000000000000000000000000000000000000000000000000032471993767155111791452683004129502371448916039352064506727344793254391388708715740290578675931569829435633346325169219499701572040088119568135294201738361152820289134979248046875, with a short experiment name to avoid filename-too-long failures.
autoresearch/snapshots/20260420T031121Z_hybrid_p8_m8_w3_v1183.py	0.071006	0.799339	0.749250	0.375000	0.020699	discard	Restore the compact props8 + minsep8 hybrid shelf anchored at lwindow3, beam3, top4, boardcands2, secsep1, radius0, drop1, props8, total150, and lmargin9.935836791992188. The latest executed bracket is harmful at 142.3393809000651089036182384006679058074951171874999999999999999999999999999999999999999999999999999997650962153014311061894912293318291315061723367780496057157651403892235516561497159213021968124099203828060566436051588376617333086461710499326382972640203661285340785980224609375 and exact-flat at 142.33938090006510890361823840066790580749511718750000000000000000000000000000000000000000000000000000032471993767155111791452683004129502371448916039352064506727344793254391388708715740290578675931569829435633346325169219499701572040088119568135294201738361152820289134979248046875. This run re-prepares their midpoint, 142.339380900065108903618238400667905807495117187500000000000000000000000000000000000000000000000000000044908076486491112052009029686562077610330748585785125391519294160883732771618436662103991785862809338581195053428425516329374514523526122806995619640701988828368484973907470703125, with a short experiment name to avoid filename-too-long failures.
autoresearch/snapshots/20260420T031225Z_hybrid_p8_m8_w3_v1184.py	0.071006	0.789778	0.739821	0.375000	0.024580	discard	Restore the compact props8 + minsep8 hybrid shelf anchored at lwindow3, beam3, top4, boardcands2, secsep1, radius0, drop1, props8, total150, and lmargin9.935836791992188. The latest executed bracket is harmful at 142.3393809000651089036182384006679058074951171874999999999999999999999999999999999999999999999999999997650962153014311061894912293318291315061723367780496057157651403892235516561497159213021968124099203828060566436051588376617333086461710499326382972640203661285340785980224609375 and exact-flat at 142.339380900065108903618238400667905807495117187500000000000000000000000000000000000000000000000000000044908076486491112052009029686562077610330748585785125391519294160883732771618436662103991785862809338581195053428425516329374514523526122806995619640701988828368484973907470703125. This run re-prepares their midpoint, 142.3393809000651089036182384006679058074951171874999999999999999999999999999999999999999999999999999999050021458939611091207501295091956045582515426819173655536422172750536422138840762917030942991363648606936258485167921769955539115848485863698169584523611774784512817859649658203125, with a short experiment name to avoid filename-too-long failures.
autoresearch/snapshots/20260420T031335Z_hybrid_p8_m8_w3_v1185.py	0.071006	0.789778	0.739821	0.375000	0.024580	discard	Restore the compact props8 + minsep8 hybrid shelf anchored at lwindow3, beam3, top4, boardcands2, secsep1, radius0, drop1, props8, total150, and lmargin9.935836791992188. The latest executed bracket is harmful at 142.3393809000651089036182384006679058074951171874999999999999999999999999999999999999999999999999999999050021458939611091207501295091956045582515426819173655536422172750536422138840762917030942991363648606936258485167921769955539115848485863698169584523611774784512817859649658203125 and exact-flat at 142.339380900065108903618238400667905807495117187500000000000000000000000000000000000000000000000000000044908076486491112052009029686562077610330748585785125391519294160883732771618436662103991785862809338581195053428425516329374514523526122806995619640701988828368484973907470703125. This run re-prepares their midpoint, 142.33938090006510890361823840066790580749511718749999999999999999999999999999999999999999999999999999997495511119022611058637957959787884108429114563385124547258075571796868749275125647690354304249958709963741045097260884666246421305418735458840628904653158315340988337993621826171875, with a short experiment name to avoid filename-too-long failures.
autoresearch/snapshots/20260420T031444Z_hybrid_p8_m8_w3_v1186.py	0.071006	0.799339	0.749250	0.375000	0.020699	discard	Restore the compact props8 + minsep8 hybrid shelf anchored at lwindow3, beam3, top4, boardcands2, secsep1, radius0, drop1, props8, total150, and lmargin9.935836791992188. The latest executed bracket is harmful at 142.33938090006510890361823840066790580749511718749999999999999999999999999999999999999999999999999999997495511119022611058637957959787884108429114563385124547258075571796868749275125647690354304249958709963741045097260884666246421305418735458840628904653158315340988337993621826171875 and exact-flat at 142.339380900065108903618238400667905807495117187500000000000000000000000000000000000000000000000000000044908076486491112052009029686562077610330748585785125391519294160883732771618436662103991785862809338581195053428425516329374514523526122806995619640701988828368484973907470703125. This run re-prepares their midpoint, 142.339380900065108903618238400667905807495117187500000000000000000000000000000000000000000000000000000009931593838358611319194304642220459347310947109818185432050024939426210132184846569503767414181198219109302752200517181495919363788856738697700954343616785990889184176921844482421875, with a short experiment name to avoid filename-too-long failures.
autoresearch/snapshots/20260420T031552Z_hybrid_p8_m8_w3_v1187.py	0.071006	0.789778	0.739821	0.375000	0.024580	discard	Restore the compact props8 + minsep8 hybrid shelf anchored at lwindow3, beam3, top4, boardcands2, secsep1, radius0, drop1, props8, total150, and lmargin9.935836791992188. The latest executed bracket is harmful at 142.33938090006510890361823840066790580749511718749999999999999999999999999999999999999999999999999999997495511119022611058637957959787884108429114563385124547258075571796868749275125647690354304249958709963741045097260884666246421305418735458840628904653158315340988337993621826171875 and exact-flat at 142.339380900065108903618238400667905807495117187500000000000000000000000000000000000000000000000000000009931593838358611319194304642220459347310947109818185432050024939426210132184846569503767414181198219109302752200517181495919363788856738697700954343616785990889184176921844482421875. This run re-prepares their midpoint, 142.3393809000651089036182384006679058074951171874999999999999999999999999999999999999999999999999999999924433525142923609527869421200496502158010463718347154523153903286974488124680515232036552283403926593733566015865630140791917884215220466430536216950741845721495337784290313720703125, with a short experiment name to avoid filename-too-long failures.
autoresearch/snapshots/20260420T031702Z_hybrid_p8_m8_w3_v1188.py	0.071006	0.799339	0.749250	0.375000	0.020699	discard	Restore the compact props8 + minsep8 hybrid shelf anchored at lwindow3, beam3, top4, boardcands2, secsep1, radius0, drop1, props8, total150, and lmargin9.935836791992188. The latest executed bracket is harmful at 142.3393809000651089036182384006679058074951171874999999999999999999999999999999999999999999999999999999924433525142923609527869421200496502158010463718347154523153903286974488124680515232036552283403926593733566015865630140791917884215220466430536216950741845721495337784290313720703125 and exact-flat at 142.339380900065108903618238400667905807495117187500000000000000000000000000000000000000000000000000000009931593838358611319194304642220459347310947109818185432050024939426210132184846569503767414181198219109302752200517181495919363788856738697700954343616785990889184176921844482421875. This run re-prepares their midpoint, 142.33938090006510890361823840066790580749511718750000000000000000000000000000000000000000000000000000000118747317632548613599062338113505478155599674082645044218270763406182947232644904635371132126079543924132967689354009778755557610518939267037728801934548528151935897767543792724609375, with a short experiment name to avoid filename-too-long failures.
autoresearch/snapshots/20260420T031824Z_hybrid_p8_m8_w3_v1189.py	0.071006	0.789778	0.739821	0.375000	0.024580	discard	Restore the compact props8 + minsep8 hybrid shelf anchored at lwindow3, beam3, top4, boardcands2, secsep1, radius0, drop1, props8, total150, and lmargin9.935836791992188. The latest executed bracket is harmful at 142.3393809000651089036182384006679058074951171874999999999999999999999999999999999999999999999999999999924433525142923609527869421200496502158010463718347154523153903286974488124680515232036552283403926593733566015865630140791917884215220466430536216950741845721495337784290313720703125 and exact-flat at 142.33938090006510890361823840066790580749511718750000000000000000000000000000000000000000000000000000000118747317632548613599062338113505478155599674082645044218270763406182947232644904635371132126079543924132967689354009778755557610518939267037728801934548528151935897767543792724609375. This run re-prepares their midpoint, 142.339380900065108903618238400667905807495117187499999999999999999999999999999999999999999999999999999996815412845308923544388782750592352498678521556330582947249048981379639142397250284778683274800594049307343139240051555933373682263355719656715454857209834926834446378052234649658203125, with a short experiment name to avoid filename-too-long failures.
autoresearch/snapshots/20260420T031931Z_hybrid_p8_m8_w3_v1190.py	0.071006	0.789778	0.739821	0.375000	0.024580	discard	Restore the compact props8 + minsep8 hybrid shelf anchored at lwindow3, beam3, top4, boardcands2, secsep1, radius0, drop1, props8, total150, and lmargin9.935836791992188. The latest executed bracket is harmful at 142.3393809000651089036182384006679058074951171874999999999999999999999999999999999999999999999999999999924433525142923609527869421200496502158010463718347154523153903286974488124680515232036552283403926593733566015865630140791917884215220466430536216950741845721495337784290313720703125 and exact-flat at 142.33938090006510890361823840066790580749511718750000000000000000000000000000000000000000000000000000000118747317632548613599062338113505478155599674082645044218270763406182947232644904635371132126079543924132967689354009778755557610518939267037728801934548528151935897767543792724609375. This run re-prepares their midpoint, 142.339380900065108903618238400667905807495117187499999999999999999999999999999999999999999999999999999996815412845308923544388782750592352498678521556330582947249048981379639142397250284778683274800594049307343139240051555933373682263355719656715454857209834926834446378052234649658203125, with a short experiment name to avoid filename-too-long failures.
autoresearch/snapshots/20260420T032045Z_hybrid_p8_m8_w3_v1191.py	0.071006	0.789778	0.739821	0.375000	0.024580	discard	Restore the compact props8 + minsep8 hybrid shelf anchored at lwindow3, beam3, top4, boardcands2, secsep1, radius0, drop1, props8, total150, and lmargin9.935836791992188. The latest executed bracket is harmful at 142.339380900065108903618238400667905807495117187499999999999999999999999999999999999999999999999999999996815412845308923544388782750592352498678521556330582947249048981379639142397250284778683274800594049307343139240051555933373682263355719656715454857209834926834446378052234649658203125 and exact-flat at 142.33938090006510890361823840066790580749511718750000000000000000000000000000000000000000000000000000000118747317632548613599062338113505478155599674082645044218270763406182947232644904635371132126079543924132967689354009778755557610518939267037728801934548528151935897767543792724609375. This run re-prepares their midpoint, 142.3393809000651089036182384006679058074951171874999999999999999999999999999999999999999999999999999999990014430108172048401897030658637036401172591485785166947158783077207343073618496655661972980306947442743364080667958268604646291842725561635463714382776601041769026778638362884521484375, with a short experiment name to avoid filename-too-long failures.
autoresearch/snapshots/20260420T032214Z_hybrid_p8_m8_w3_v1192.py	0.071006	0.799339	0.749250	0.375000	0.020699	discard	Restore the compact props8 + minsep8 hybrid shelf anchored at lwindow3, beam3, top4, boardcands2, secsep1, radius0, drop1, props8, total150, and lmargin9.935836791992188. The latest executed bracket is harmful at 142.3393809000651089036182384006679058074951171874999999999999999999999999999999999999999999999999999999990014430108172048401897030658637036401172591485785166947158783077207343073618496655661972980306947442743364080667958268604646291842725561635463714382776601041769026778638362884521484375 and exact-flat at 142.33938090006510890361823840066790580749511718750000000000000000000000000000000000000000000000000000000118747317632548613599062338113505478155599674082645044218270763406182947232644904635371132126079543924132967689354009778755557610518939267037728801934548528151935897767543792724609375. This run re-prepares their midpoint, 142.33938090006510890361823840066790580749511718750000000000000000000000000000000000000000000000000000000009445809357134548809016322349937921083662794470248356844929297089128188984414935595995430964574509175783304248016796232401010264473097441696182972881157269284813082776963710784912109375, with a short experiment name to avoid filename-too-long failures.
