snapshot	board_exact	non_empty_accuracy	macro_f1	move_recall	false_change_rate	status	description
autoresearch/snapshots/20260419T053128Z_hybrid_lookahead_segmental_drop1_boardcands3_ratio95_props14_top1_detect10_lwindow1_minsep4_secsep1_thresh3_total150_permove125_lmargin9p5_m9p8957061767578125_r0_beam4_v551.py	0.074556	0.792672	0.751719	0.234375	0.009056	discard	Hybrid decoder keeps the baseline lookahead path unless a conservative board-only segmental pass wins the current score-gain gates, while following up the kept window1 branch after lowering lookahead window from 2 to 1 on the 9.5-margin baseline opened a lower-false-change but lower-recall tradeoff, lowering only max_event_proposals from 16 to 15 on the restored plain window1 branch improved recall and secondary metrics but worsened false-change, additionally narrowing top-board breadth from 4 to 3 recovered the lower false-change without hurting recall, lowering only max_event_proposals one step further from 15 to 14 on that boardcands3 plain props branch kept that recovered tradeoff, lowering segment_board_drop_worst_frames from 1 to 0 on that stronger props14 branch produced a new kept low-noise / lower-recall tradeoff, lowering secondary minimum event separation from 2 to 1 improved that tradeoff again, raising max_event_proposals from 14 to 15 was worse, raising top-board breadth from 3 to 4 was an exact no-op, lowering top-board breadth from 3 to 2 was worse, raising beam size from 4 to 5 was an exact no-op, raising beam size from 4 to 6 was worse, lowering max_event_proposals from 14 to 13 was sharply worse, lowering top-move breadth from 4 to 1 was an exact no-op on the nearby drop0 secsep1 branch, and restoring segment_board_drop_worst_frames from 0 back to 1 improved the tradeoff again, and lowering only top-move breadth from 4 to 1 on that new secsep1 + drop1 best branch to test whether the stronger drop1 branch still sits on the same move-width plateau or whether move breadth became active again after the drop1 shift.
autoresearch/snapshots/20260419T053230Z_hybrid_lookahead_segmental_drop1_boardcands3_ratio95_props14_top4_detect10_lwindow1_minsep4_secsep1_thresh3_total150_permove125_lmargin9p5_m9p8957061767578125_r0_beam5_v552.py	0.074556	0.792672	0.751719	0.234375	0.009056	discard	Hybrid decoder keeps the baseline lookahead path unless a conservative board-only segmental pass wins the current score-gain gates, while following up the kept window1 branch after lowering lookahead window from 2 to 1 on the 9.5-margin baseline opened a lower-false-change but lower-recall tradeoff, lowering only max_event_proposals from 16 to 15 on the restored plain window1 branch improved recall and secondary metrics but worsened false-change, additionally narrowing top-board breadth from 4 to 3 recovered the lower false-change without hurting recall, lowering only max_event_proposals one step further from 15 to 14 on that boardcands3 plain props branch kept that recovered tradeoff, lowering segment_board_drop_worst_frames from 1 to 0 on that stronger props14 branch produced a new kept low-noise / lower-recall tradeoff, lowering secondary minimum event separation from 2 to 1 improved that tradeoff again, raising max_event_proposals from 14 to 15 was worse, raising top-board breadth from 3 to 4 was an exact no-op, raising beam size from 4 to 5 was an exact no-op on the nearby drop0 secsep1 surface, raising beam size from 4 to 6 was worse, lowering max_event_proposals from 14 to 13 was sharply worse, and lowering top-move breadth from 4 to 1 was an exact no-op, and restoring segment_board_drop_worst_frames from 0 back to 1 improved the tradeoff again, and raising only beam size from 4 to 5 on that new secsep1 + drop1 best branch to test whether the stronger drop1 branch preserves the same upper-beam plateau as the nearby drop0 secsep1 surface or whether beam4 is now the true local optimum.
autoresearch/snapshots/20260419T053324Z_hybrid_lookahead_segmental_drop1_boardcands3_ratio95_props14_top4_detect10_lwindow1_minsep4_secsep1_thresh3_total150_permove125_lmargin9p5_m9p8957061767578125_r0_beam6_v553.py	0.074556	0.792672	0.751719	0.234375	0.009056	discard	Hybrid decoder keeps the baseline lookahead path unless a conservative board-only segmental pass wins the current score-gain gates, while following up the kept window1 branch after lowering lookahead window from 2 to 1 on the 9.5-margin baseline opened a lower-false-change but lower-recall tradeoff, lowering only max_event_proposals from 16 to 15 on the restored plain window1 branch improved recall and secondary metrics but worsened false-change, additionally narrowing top-board breadth from 4 to 3 recovered the lower false-change without hurting recall, lowering only max_event_proposals one step further from 15 to 14 on that boardcands3 plain props branch kept that recovered tradeoff, lowering segment_board_drop_worst_frames from 1 to 0 on that stronger props14 branch produced a new kept low-noise / lower-recall tradeoff, lowering secondary minimum event separation from 2 to 1 improved that tradeoff again, raising max_event_proposals from 14 to 15 was worse, raising top-board breadth from 3 to 4 was an exact no-op, raising beam size from 4 to 5 was an exact no-op, raising beam size from 4 to 6 was worse on the nearby drop0 secsep1 surface, lowering max_event_proposals from 14 to 13 was sharply worse, and lowering top-move breadth from 4 to 1 was an exact no-op, and restoring segment_board_drop_worst_frames from 0 back to 1 improved the tradeoff again, and raising only beam size from 5 to 6 on that new secsep1 + drop1 branch after beam5 proved an exact no-op to test whether the upper-beam plateau on the stronger drop1 branch extends one more step or whether beam6 reopens the degradation seen on the nearby drop0 secsep1 surface.
autoresearch/snapshots/20260419T053422Z_hybrid_lookahead_segmental_drop1_boardcands3_ratio95_props14_top4_detect10_lwindow1_minsep4_secsep1_thresh3_total150_permove125_lmargin9p5_m9p8957061767578125_r0_beam7_v554.py	0.074556	0.792672	0.751719	0.234375	0.009056	discard	Hybrid decoder keeps the baseline lookahead path unless a conservative board-only segmental pass wins the current score-gain gates, while following up the kept window1 branch after lowering lookahead window from 2 to 1 on the 9.5-margin baseline opened a lower-false-change but lower-recall tradeoff, lowering only max_event_proposals from 16 to 15 on the restored plain window1 branch improved recall and secondary metrics but worsened false-change, additionally narrowing top-board breadth from 4 to 3 recovered the lower false-change without hurting recall, lowering only max_event_proposals one step further from 15 to 14 on that boardcands3 plain props branch kept that recovered tradeoff, lowering segment_board_drop_worst_frames from 1 to 0 on that stronger props14 branch produced a new kept low-noise / lower-recall tradeoff, lowering secondary minimum event separation from 2 to 1 improved that tradeoff again, raising max_event_proposals from 14 to 15 was worse, raising top-board breadth from 3 to 4 was an exact no-op, raising beam size from 4 to 5 was an exact no-op, raising beam size from 4 to 6 was an exact no-op on the stronger drop1 secsep1 branch, lowering max_event_proposals from 14 to 13 was sharply worse, and lowering top-move breadth from 4 to 1 was an exact no-op, and restoring segment_board_drop_worst_frames from 0 back to 1 improved the tradeoff again, and raising only beam size from 6 to 7 on that new secsep1 + drop1 branch after both beam5 and beam6 proved exact no-ops to test whether the upper-beam plateau on the stronger drop1 branch extends another step or whether beam7 is where this surface finally degrades.
autoresearch/snapshots/20260419T053530Z_hybrid_lookahead_segmental_drop1_boardcands4_ratio95_props14_top4_detect10_lwindow1_minsep4_secsep1_thresh3_total150_permove125_lmargin9p5_m9p8957061767578125_r0_beam4_v555.py	0.074556	0.815720	0.784624	0.234375	0.010349	discard	Hybrid decoder keeps the baseline lookahead path unless a conservative board-only segmental pass wins the current score-gain gates, while following up the kept window1 branch after lowering lookahead window from 2 to 1 on the 9.5-margin baseline opened a lower-false-change but lower-recall tradeoff, lowering only max_event_proposals from 16 to 15 on the restored plain window1 branch improved recall and secondary metrics but worsened false-change, additionally narrowing top-board breadth from 4 to 3 recovered the lower false-change without hurting recall, lowering only max_event_proposals one step further from 15 to 14 on that boardcands3 plain props branch kept that recovered tradeoff, lowering segment_board_drop_worst_frames from 1 to 0 on that stronger props14 branch produced a new kept low-noise / lower-recall tradeoff, lowering secondary minimum event separation from 2 to 1 improved that tradeoff again, raising max_event_proposals from 14 to 15 was worse, raising top-board breadth from 3 to 4 was an exact no-op on the nearby drop0 secsep1 surface, lowering top-board breadth from 3 to 2 was worse on the stronger drop1 branch, raising beam size from 4 to 5 was an exact no-op, raising beam size from 4 to 6 was worse, lowering max_event_proposals from 14 to 13 was sharply worse, and lowering top-move breadth from 4 to 1 was an exact no-op, and restoring segment_board_drop_worst_frames from 0 back to 1 improved the tradeoff again, and raising only top-board breadth from 3 to 4 on that new secsep1 + drop1 best branch to test whether the stronger drop1 branch preserves the same harmless upper board-width plateau as the nearby drop0 secsep1 surface or whether boardcands3 is now a sharper local optimum.
autoresearch/snapshots/20260419T053630Z_hybrid_lookahead_segmental_drop1_boardcands4_ratio95_props14_top1_detect10_lwindow1_minsep4_secsep1_thresh3_total150_permove125_lmargin9p5_m9p8957061767578125_r0_beam4_v556.py	0.074556	0.815720	0.784624	0.234375	0.010349	discard	Hybrid decoder keeps the baseline lookahead path unless a conservative board-only segmental pass wins the current score-gain gates, while following up the kept window1 branch after lowering lookahead window from 2 to 1 on the 9.5-margin baseline opened a lower-false-change but lower-recall tradeoff, lowering only max_event_proposals from 16 to 15 on the restored plain window1 branch improved recall and secondary metrics but worsened false-change, additionally narrowing top-board breadth from 4 to 3 recovered the lower false-change without hurting recall, lowering only max_event_proposals one step further from 15 to 14 on that boardcands3 plain props branch kept that recovered tradeoff, lowering segment_board_drop_worst_frames from 1 to 0 on that stronger props14 branch produced a new kept low-noise / lower-recall tradeoff, lowering secondary minimum event separation from 2 to 1 improved that tradeoff again, raising max_event_proposals from 14 to 15 was worse, raising top-board breadth from 3 to 4 was a slight higher-secondary but noisier tradeoff on the stronger drop1 branch, lowering top-board breadth from 3 to 2 was worse, raising beam size from 4 to 5 was an exact no-op, raising beam size from 4 to 6 was worse, lowering max_event_proposals from 14 to 13 was sharply worse, and lowering top-move breadth from 4 to 1 was an exact no-op on the boardcands3 branch, and restoring segment_board_drop_worst_frames from 0 back to 1 improved the tradeoff again, and lowering only top-move breadth from 4 to 1 on that new boardcands4 secsep1 + drop1 side branch to test whether the boardcands4 side branch still sits on the same move-width plateau or whether its secondary lift depends on the wider move menu.
autoresearch/snapshots/20260419T053733Z_hybrid_lookahead_segmental_drop1_boardcands3_ratio95_props14_top4_detect10_lwindow1_minsep4_secsep1_thresh3_total150_permove125_lmargin9p5_m9p8957061767578125_r0_beam8_v557.py	0.074556	0.778771	0.728566	0.234375	0.009056	discard	Hybrid decoder keeps the baseline lookahead path unless a conservative board-only segmental pass wins the current score-gain gates, while following up the kept window1 branch after lowering lookahead window from 2 to 1 on the 9.5-margin baseline opened a lower-false-change but lower-recall tradeoff, lowering only max_event_proposals from 16 to 15 on the restored plain window1 branch improved recall and secondary metrics but worsened false-change, additionally narrowing top-board breadth from 4 to 3 recovered the lower false-change without hurting recall, lowering only max_event_proposals one step further from 15 to 14 on that boardcands3 plain props branch kept that recovered tradeoff, lowering segment_board_drop_worst_frames from 1 to 0 on that stronger props14 branch produced a new kept low-noise / lower-recall tradeoff, lowering secondary minimum event separation from 2 to 1 improved that tradeoff again, raising max_event_proposals from 14 to 15 was worse, raising top-board breadth from 3 to 4 was an exact no-op, lowering top-board breadth from 3 to 2 was worse, raising beam size from 4 to 5 was an exact no-op, raising beam size from 4 to 6 was an exact no-op on the stronger drop1 secsep1 branch, lowering max_event_proposals from 14 to 13 was sharply worse, and lowering top-move breadth from 4 to 1 was an exact no-op, and restoring segment_board_drop_worst_frames from 0 back to 1 improved the tradeoff again, and raising only beam size from 7 to 8 on that new secsep1 + drop1 branch after beam5, beam6, and beam7 all proved exact no-ops to test whether the upper-beam plateau on the stronger drop1 branch extends all the way to the search cap or whether beam8 is where this surface finally degrades.
autoresearch/snapshots/20260419T053837Z_hybrid_lookahead_segmental_drop1_boardcands4_ratio95_props14_top4_detect10_lwindow1_minsep4_secsep1_thresh3_total150_permove125_lmargin9p5_m9p8957061767578125_r0_beam5_v558.py	0.074556	0.792672	0.751719	0.234375	0.009056	discard	Hybrid decoder keeps the baseline lookahead path unless a conservative board-only segmental pass wins the current score-gain gates, while following up the kept window1 branch after lowering lookahead window from 2 to 1 on the 9.5-margin baseline opened a lower-false-change but lower-recall tradeoff, lowering only max_event_proposals from 16 to 15 on the restored plain window1 branch improved recall and secondary metrics but worsened false-change, additionally narrowing top-board breadth from 4 to 3 recovered the lower false-change without hurting recall, lowering only max_event_proposals one step further from 15 to 14 on that boardcands3 plain props branch kept that recovered tradeoff, lowering segment_board_drop_worst_frames from 1 to 0 on that stronger props14 branch produced a new kept low-noise / lower-recall tradeoff, lowering secondary minimum event separation from 2 to 1 improved that tradeoff again, raising max_event_proposals from 14 to 15 was worse, raising top-board breadth from 3 to 4 opened a slightly higher-secondary but noisier side branch on the stronger drop1 surface, lowering top-board breadth from 3 to 2 was worse, raising beam size from 4 to 5 was an exact no-op on the boardcands3 branch, raising beam size from 4 to 6 was worse there, lowering max_event_proposals from 14 to 13 was sharply worse, and lowering top-move breadth from 4 to 1 was an exact no-op on both the boardcands3 best branch and the boardcands4 side branch, and restoring segment_board_drop_worst_frames from 0 back to 1 improved the tradeoff again, and raising only beam size from 4 to 5 on that boardcands4 secsep1 + drop1 side branch to test whether the boardcands4 side branch preserves the same upper-beam plateau as the main branch or whether its secondary lift is beam-sensitive.
autoresearch/snapshots/20260419T053941Z_hybrid_lookahead_segmental_drop1_boardcands4_ratio95_props14_top4_detect10_lwindow1_minsep4_secsep1_thresh3_total150_permove125_lmargin9p5_m9p8957061767578125_r0_beam6_v559.py	0.074556	0.792672	0.751719	0.234375	0.009056	discard	Hybrid decoder keeps the baseline lookahead path unless a conservative board-only segmental pass wins the current score-gain gates, while following up the kept window1 branch after lowering lookahead window from 2 to 1 on the 9.5-margin baseline opened a lower-false-change but lower-recall tradeoff, lowering only max_event_proposals from 16 to 15 on the restored plain window1 branch improved recall and secondary metrics but worsened false-change, additionally narrowing top-board breadth from 4 to 3 recovered the lower false-change without hurting recall, lowering only max_event_proposals one step further from 15 to 14 on that boardcands3 plain props branch kept that recovered tradeoff, lowering segment_board_drop_worst_frames from 1 to 0 on that stronger props14 branch produced a new kept low-noise / lower-recall tradeoff, lowering secondary minimum event separation from 2 to 1 improved that tradeoff again, raising max_event_proposals from 14 to 15 was worse, raising top-board breadth from 3 to 4 opened a slightly higher-secondary but noisier side branch on the stronger drop1 surface, lowering top-board breadth from 3 to 2 was worse, raising beam size from 4 to 5 was an exact no-op on the boardcands3 branch, raising beam size from 4 to 6 was worse there, lowering max_event_proposals from 14 to 13 was sharply worse, and lowering top-move breadth from 4 to 1 was an exact no-op on both the boardcands3 best branch and the boardcands4 side branch, and restoring segment_board_drop_worst_frames from 0 back to 1 improved the tradeoff again, and raising only beam size from 5 to 6 on that boardcands4 secsep1 + drop1 side branch after beam5 collapsed back to the main best tradeoff to test whether the boardcands4 side branch stays collapsed at higher beam sizes or whether beam6 reopens a distinct tradeoff surface.
autoresearch/snapshots/20260419T054043Z_hybrid_lookahead_segmental_drop1_boardcands4_ratio95_props14_top4_detect10_lwindow1_minsep4_secsep1_thresh3_total150_permove125_lmargin9p5_m9p8957061767578125_r0_beam3_v560.py	0.074556	0.815720	0.784846	0.218750	0.011643	discard	Hybrid decoder keeps the baseline lookahead path unless a conservative board-only segmental pass wins the current score-gain gates, while following up the kept window1 branch after lowering lookahead window from 2 to 1 on the 9.5-margin baseline opened a lower-false-change but lower-recall tradeoff, lowering only max_event_proposals from 16 to 15 on the restored plain window1 branch improved recall and secondary metrics but worsened false-change, additionally narrowing top-board breadth from 4 to 3 recovered the lower false-change without hurting recall, lowering only max_event_proposals one step further from 15 to 14 on that boardcands3 plain props branch kept that recovered tradeoff, lowering segment_board_drop_worst_frames from 1 to 0 on that stronger props14 branch produced a new kept low-noise / lower-recall tradeoff, lowering secondary minimum event separation from 2 to 1 improved that tradeoff again, raising max_event_proposals from 14 to 15 was worse, raising top-board breadth from 3 to 4 opened a slightly higher-secondary but noisier side branch on the stronger drop1 surface, lowering top-board breadth from 3 to 2 was worse, raising beam size from 4 to 5 was an exact no-op on the boardcands3 branch, raising beam size from 4 to 6 was worse there, lowering max_event_proposals from 14 to 13 was sharply worse, and lowering top-move breadth from 4 to 1 was an exact no-op on both the boardcands3 best branch and the boardcands4 side branch, and restoring segment_board_drop_worst_frames from 0 back to 1 improved the tradeoff again, and lowering only beam size from 4 to 3 on that boardcands4 secsep1 + drop1 side branch after beam5 and beam6 both collapsed back to the main best tradeoff to test whether the boardcands4 side branch survives on the cheaper beam side or whether its distinct tradeoff exists only at beam4.
autoresearch/snapshots/20260419T054212Z_hybrid_lookahead_segmental_drop1_boardcands3_ratio95_props14_top4_detect10_lwindow1_minsep4_secsep3_thresh3_total150_permove125_lmargin9p5_m9p8957061767578125_r0_beam4_v561.py	0.074556	0.764870	0.721875	0.250000	0.020699	discard	Hybrid decoder keeps the baseline lookahead path unless a conservative board-only segmental pass wins the current score-gain gates, while following up the kept window1 branch after lowering lookahead window from 2 to 1 on the 9.5-margin baseline opened a lower-false-change but lower-recall tradeoff, lowering only max_event_proposals from 16 to 15 on the restored plain window1 branch improved recall and secondary metrics but worsened false-change, additionally narrowing top-board breadth from 4 to 3 recovered the lower false-change without hurting recall, lowering only max_event_proposals one step further from 15 to 14 on that boardcands3 plain props branch kept that recovered tradeoff, lowering segment_board_drop_worst_frames from 1 to 0 on that stronger props14 branch produced a new kept low-noise / lower-recall tradeoff, lowering secondary minimum event separation from 2 to 1 improved that tradeoff again, raising max_event_proposals from 14 to 15 was worse, raising top-board breadth from 3 to 4 opened a slightly higher-secondary but noisier side branch on the stronger drop1 surface, lowering top-board breadth from 3 to 2 was worse, raising beam size from 4 to 5, 6, and 7 were exact no-ops, beam8 was worse, lowering max_event_proposals from 14 to 13 was sharply worse, and lowering top-move breadth from 4 to 1 was an exact no-op, and restoring segment_board_drop_worst_frames from 0 back to 1 improved the tradeoff again, and raising only secondary minimum event separation from 1 to 3 on that new secsep1 + drop1 best branch to test whether the stronger drop1 branch reopens a higher-secondary secsep shelf or whether secsep1 remains the clear local optimum.
