snapshot	board_exact	non_empty_accuracy	macro_f1	move_recall	false_change_rate	status	description
autoresearch/snapshots/20260417T025612Z_hybrid_lookahead_segmental_drop1_boardcands3_ratio95_props16_top10_detect10_minsep2_thresh3_total150_permove91p7342700064182281494140625_m9p8957061767578125_r0_v174.py	0.254438	0.884089	0.855756	0.500000	0.016818	discard	Hybrid decoder keeps the baseline lookahead path unless a conservative board-only segmental pass wins the current score-gain gates, while following up v120-v173 by returning to the strongest low-false-change props16 + boardcands3 branch after localizing the per-added-move gate cliff between the safe 91.7342722415924072265625 regime and the harmful 91.734267771244049072265625 regime, and lowering only the per-added-move score-gain gate to 91.7342700064182281494140625 to bisect that remaining boundary and determine whether any headroom exists below 91.7342722415924072265625 without re-entering the degraded selection regime.
autoresearch/snapshots/20260417T025704Z_hybrid_lookahead_segmental_drop1_boardcands3_ratio95_props16_top10_detect10_minsep2_thresh3_total150_permove91p73426888883113861083984375_m9p8957061767578125_r0_v175.py	0.254438	0.884089	0.855756	0.500000	0.016818	discard	Hybrid decoder keeps the baseline lookahead path unless a conservative board-only segmental pass wins the current score-gain gates, while following up v120-v174 by returning to the strongest low-false-change props16 + boardcands3 branch after localizing the per-added-move gate cliff between the safe 91.7342700064182281494140625 regime and the harmful 91.734267771244049072265625 regime, and lowering only the per-added-move score-gain gate to 91.73426888883113861083984375 to bisect that remaining boundary and determine whether any headroom exists below 91.7342700064182281494140625 without re-entering the degraded selection regime.
autoresearch/snapshots/20260417T025758Z_hybrid_lookahead_segmental_drop1_boardcands3_ratio95_props16_top10_detect10_minsep2_thresh3_total150_permove91p7342683300375938415527344_m9p8957061767578125_r0_v176.py	0.254438	0.884089	0.855756	0.500000	0.016818	discard	Hybrid decoder keeps the baseline lookahead path unless a conservative board-only segmental pass wins the current score-gain gates, while following up v120-v175 by returning to the strongest low-false-change props16 + boardcands3 branch after localizing the per-added-move gate cliff between the safe 91.73426888883113861083984375 regime and the harmful 91.734267771244049072265625 regime, and lowering only the per-added-move score-gain gate to 91.7342683300375938415527344 to bisect that remaining boundary and determine whether any headroom exists below 91.73426888883113861083984375 without re-entering the degraded selection regime.
autoresearch/snapshots/20260417T025855Z_hybrid_lookahead_segmental_drop1_boardcands3_ratio95_props16_top10_detect10_minsep2_thresh3_total150_permove91p7342680506408214569091797_m9p8957061767578125_r0_v177.py	0.168047	0.865898	0.835716	0.484375	0.023286	discard	Hybrid decoder keeps the baseline lookahead path unless a conservative board-only segmental pass wins the current score-gain gates, while following up v120-v176 by returning to the strongest low-false-change props16 + boardcands3 branch after localizing the per-added-move gate cliff between the safe 91.7342683300375938415527344 regime and the harmful 91.734267771244049072265625 regime, and lowering only the per-added-move score-gain gate to 91.7342680506408214569091797 to bisect that remaining boundary and determine whether any headroom exists below 91.7342683300375938415527344 without re-entering the degraded selection regime.
autoresearch/snapshots/20260417T025949Z_hybrid_lookahead_segmental_drop1_boardcands3_ratio95_props16_top10_detect10_minsep2_thresh3_total150_permove91p73426819033920764923095705_m9p8957061767578125_r0_v178.py	0.254438	0.884089	0.855756	0.500000	0.016818	discard	Hybrid decoder keeps the baseline lookahead path unless a conservative board-only segmental pass wins the current score-gain gates, while following up v120-v177 by returning to the strongest low-false-change props16 + boardcands3 branch after localizing the per-added-move gate cliff between the safe 91.7342683300375938415527344 regime and the harmful 91.7342680506408214569091797 regime, and lowering only the per-added-move score-gain gate to 91.73426819033920764923095705 to bisect that remaining boundary and determine whether any headroom exists below 91.7342683300375938415527344 without re-entering the degraded selection regime.
autoresearch/snapshots/20260417T030046Z_hybrid_lookahead_segmental_drop1_boardcands3_ratio95_props16_top10_detect10_minsep2_thresh3_total150_permove91p7342681204900145530700684_m9p8957061767578125_r0_v179.py	0.168047	0.865898	0.835716	0.484375	0.023286	discard	Hybrid decoder keeps the baseline lookahead path unless a conservative board-only segmental pass wins the current score-gain gates, while following up v120-v178 by returning to the strongest low-false-change props16 + boardcands3 branch after localizing the per-added-move gate cliff between the safe 91.73426819033920764923095705 regime and the harmful 91.7342680506408214569091797 regime, and lowering only the per-added-move score-gain gate to 91.7342681204900145530700684 to bisect that remaining boundary and determine whether any headroom exists below 91.73426819033920764923095705 without re-entering the degraded selection regime.
autoresearch/snapshots/20260417T030147Z_hybrid_lookahead_segmental_drop1_boardcands3_ratio95_props16_top10_detect10_minsep2_thresh3_total150_permove91p73426808556541800498962405_m9p8957061767578125_r0_v180.py	0.168047	0.865898	0.835716	0.484375	0.023286	discard	Hybrid decoder keeps the baseline lookahead path unless a conservative board-only segmental pass wins the current score-gain gates, while following up v120-v179 by returning to the strongest low-false-change props16 + boardcands3 branch after localizing the per-added-move gate cliff between the safe 91.7342681204900145530700684 regime and the harmful 91.7342680506408214569091797 regime, and lowering only the per-added-move score-gain gate to 91.73426808556541800498962405 to bisect that remaining boundary and determine whether any headroom exists below 91.7342681204900145530700684 without re-entering the degraded selection regime.
autoresearch/snapshots/20260417T030248Z_hybrid_lookahead_segmental_drop1_boardcands3_ratio95_props16_top10_detect10_minsep2_thresh3_total150_permove91p7342681554146111011505127_m9p8957061767578125_r0_v181.py	0.168047	0.865898	0.835716	0.484375	0.023286	discard	Hybrid decoder keeps the baseline lookahead path unless a conservative board-only segmental pass wins the current score-gain gates, while following up v120-v180 by returning to the strongest low-false-change props16 + boardcands3 branch after localizing the per-added-move gate cliff between the safe 91.73426819033920764923095705 regime and the harmful 91.7342681204900145530700684 regime, and lowering only the per-added-move score-gain gate to 91.7342681554146111011505127 to bisect that remaining boundary and determine whether any headroom exists below 91.73426819033920764923095705 without re-entering the degraded selection regime.
autoresearch/snapshots/20260417T030350Z_hybrid_lookahead_segmental_drop1_boardcands3_ratio95_props16_top10_detect10_minsep2_thresh3_total150_permove91p7342681728769093751907349_m9p8957061767578125_r0_v182.py	0.168047	0.865898	0.835716	0.484375	0.023286	discard	Hybrid decoder keeps the baseline lookahead path unless a conservative board-only segmental pass wins the current score-gain gates, while following up v120-v181 by returning to the strongest low-false-change props16 + boardcands3 branch after localizing the per-added-move gate cliff between the safe 91.73426819033920764923095705 regime and the harmful 91.7342681554146111011505127 regime, and lowering only the per-added-move score-gain gate to 91.7342681728769093751907349 to bisect that remaining boundary and determine whether any headroom exists below 91.73426819033920764923095705 without re-entering the degraded selection regime.
autoresearch/snapshots/20260417T030506Z_hybrid_lookahead_segmental_drop1_boardcands3_ratio95_props16_top10_detect10_minsep2_thresh3_total150_permove91p7342681816080585122108460_m9p8957061767578125_r0_v183.py	0.168047	0.865898	0.835716	0.484375	0.023286	discard	Hybrid decoder keeps the baseline lookahead path unless a conservative board-only segmental pass wins the current score-gain gates, while following up v120-v182 by returning to the strongest low-false-change props16 + boardcands3 branch after localizing the per-added-move gate cliff between the safe 91.73426819033920764923095705 regime and the harmful 91.7342681728769093751907349 regime, and lowering only the per-added-move score-gain gate to 91.7342681816080585122108460 to bisect that remaining boundary and determine whether any headroom exists below 91.73426819033920764923095705 without re-entering the degraded selection regime.
autoresearch/snapshots/20260417T030611Z_hybrid_lookahead_segmental_drop1_boardcands3_ratio95_props16_top10_detect10_minsep2_thresh3_total150_permove91p7342681859736330807209015_m9p8957061767578125_r0_v184.py	0.168047	0.865898	0.835716	0.484375	0.023286	discard	Hybrid decoder keeps the baseline lookahead path unless a conservative board-only segmental pass wins the current score-gain gates, while following up v120-v183 by returning to the strongest low-false-change props16 + boardcands3 branch after localizing the per-added-move gate cliff between the safe 91.73426819033920764923095705 regime and the harmful 91.7342681816080585122108460 regime, and lowering only the per-added-move score-gain gate to 91.7342681859736330807209015 to bisect that remaining boundary and determine whether any headroom exists below 91.73426819033920764923095705 without re-entering the degraded selection regime.
autoresearch/snapshots/20260417T031301Z_hybrid_lookahead_segmental_drop1_boardcands3_ratio95_props16_top10_detect10_minsep2_thresh3_total150_permove91p7342681881564203649759293_m9p8957061767578125_r0_v185.py	0.168047	0.865898	0.835716	0.484375	0.023286	discard	Hybrid decoder keeps the baseline lookahead path unless a conservative board-only segmental pass wins the current score-gain gates, while following up v120-v184 by returning to the strongest low-false-change props16 + boardcands3 branch after localizing the per-added-move gate cliff between the safe 91.73426819033920764923095705 regime and the harmful 91.7342681859736330807209015 regime, and lowering only the per-added-move score-gain gate to 91.7342681881564203649759293 to bisect that remaining boundary and determine whether any headroom exists below 91.73426819033920764923095705 without re-entering the degraded selection regime.
autoresearch/snapshots/20260417T031356Z_hybrid_lookahead_segmental_drop1_boardcands3_ratio95_props16_top10_detect10_minsep2_thresh3_total150_permove91p7342681892478140071034432_m9p8957061767578125_r0_v186.py	0.254438	0.884089	0.855756	0.500000	0.016818	discard	Hybrid decoder keeps the baseline lookahead path unless a conservative board-only segmental pass wins the current score-gain gates, while following up v120-v185 by returning to the strongest low-false-change props16 + boardcands3 branch after localizing the per-added-move gate cliff between the safe 91.73426819033920764923095705 regime and the harmful 91.7342681881564203649759293 regime, and lowering only the per-added-move score-gain gate to 91.7342681892478140071034432 to bisect that remaining boundary and determine whether any headroom exists below 91.73426819033920764923095705 without re-entering the degraded selection regime.
autoresearch/snapshots/20260417T031454Z_hybrid_lookahead_segmental_drop1_boardcands3_ratio95_props16_top10_detect10_minsep2_thresh3_total150_permove91p73426818870211718603968625_m9p8957061767578125_r0_v187.py	0.254438	0.884089	0.855756	0.500000	0.016818	discard	Hybrid decoder keeps the baseline lookahead path unless a conservative board-only segmental pass wins the current score-gain gates, while following up v120-v186 by returning to the strongest low-false-change props16 + boardcands3 branch after localizing the per-added-move gate cliff between the safe 91.7342681892478140071034432 regime and the harmful 91.7342681881564203649759293 regime, and lowering only the per-added-move score-gain gate to 91.73426818870211718603968625 to bisect that remaining boundary and determine whether any headroom exists below 91.7342681892478140071034432 without re-entering the degraded selection regime.
autoresearch/snapshots/20260417T031549Z_hybrid_lookahead_segmental_drop1_boardcands3_ratio95_props16_top10_detect10_minsep2_thresh3_total150_permove91p7342681884292687755078078_m9p8957061767578125_r0_v188.py	0.168047	0.865898	0.835716	0.484375	0.023286	discard	Hybrid decoder keeps the baseline lookahead path unless a conservative board-only segmental pass wins the current score-gain gates, while following up v120-v187 by returning to the strongest low-false-change props16 + boardcands3 branch after localizing the per-added-move gate cliff between the safe 91.73426818870211718603968625 regime and the harmful 91.7342681881564203649759293 regime, and lowering only the per-added-move score-gain gate to 91.7342681884292687755078078 to bisect that remaining boundary and determine whether any headroom exists below 91.73426818870211718603968625 without re-entering the degraded selection regime.
autoresearch/snapshots/20260417T031642Z_hybrid_lookahead_segmental_drop1_boardcands3_ratio95_props16_top10_detect10_minsep2_thresh3_total150_permove91p7342681885656929807737470_m9p8957061767578125_r0_v189.py	0.254438	0.884089	0.855756	0.500000	0.016818	discard	Hybrid decoder keeps the baseline lookahead path unless a conservative board-only segmental pass wins the current score-gain gates, while following up v120-v188 by returning to the strongest low-false-change props16 + boardcands3 branch after localizing the per-added-move gate cliff between the safe 91.73426818870211718603968625 regime and the harmful 91.7342681884292687755078078 regime, and lowering only the per-added-move score-gain gate to 91.7342681885656929807737470 to bisect that remaining boundary and determine whether any headroom exists below 91.73426818870211718603968625 without re-entering the degraded selection regime.
autoresearch/snapshots/20260417T031733Z_hybrid_lookahead_segmental_drop1_boardcands3_ratio95_props16_top10_detect10_minsep2_thresh3_total150_permove91p7342681884974808781407774_m9p8957061767578125_r0_v190.py	0.254438	0.884089	0.855756	0.500000	0.016818	discard	Hybrid decoder keeps the baseline lookahead path unless a conservative board-only segmental pass wins the current score-gain gates, while following up v120-v189 by returning to the strongest low-false-change props16 + boardcands3 branch after localizing the per-added-move gate cliff between the safe 91.7342681885656929807737470 regime and the harmful 91.7342681884292687755078078 regime, and lowering only the per-added-move score-gain gate to 91.7342681884974808781407774 to bisect that remaining boundary and determine whether any headroom exists below 91.7342681885656929807737470 without re-entering the degraded selection regime.
autoresearch/snapshots/20260417T031829Z_hybrid_lookahead_segmental_drop1_boardcands3_ratio95_props16_top10_detect10_minsep2_thresh3_total150_permove91p7342681884633748268242926_m9p8957061767578125_r0_v191.py	0.168047	0.865898	0.835716	0.484375	0.023286	discard	Hybrid decoder keeps the baseline lookahead path unless a conservative board-only segmental pass wins the current score-gain gates, while following up v120-v190 by returning to the strongest low-false-change props16 + boardcands3 branch after localizing the per-added-move gate cliff between the safe 91.7342681884974808781407774 regime and the harmful 91.7342681884292687755078078 regime, and lowering only the per-added-move score-gain gate to 91.7342681884633748268242926 to bisect that remaining boundary and determine whether any headroom exists below 91.7342681884974808781407774 without re-entering the degraded selection regime.
autoresearch/snapshots/20260417T031924Z_hybrid_lookahead_segmental_drop1_boardcands3_ratio95_props16_top10_detect10_minsep2_thresh3_total150_permove91p7342681884804278524825350_m9p8957061767578125_r0_v192.py	0.254438	0.884089	0.855756	0.500000	0.016818	discard	Hybrid decoder keeps the baseline lookahead path unless a conservative board-only segmental pass wins the current score-gain gates, while following up v120-v191 by returning to the strongest low-false-change props16 + boardcands3 branch after localizing the per-added-move gate cliff between the safe 91.7342681884974808781407774 regime and the harmful 91.7342681884633748268242926 regime, and lowering only the per-added-move score-gain gate to 91.7342681884804278524825350 to bisect that remaining boundary and determine whether any headroom exists below 91.7342681884974808781407774 without re-entering the degraded selection regime.
autoresearch/snapshots/20260417T032019Z_hybrid_lookahead_segmental_drop1_boardcands3_ratio95_props16_top10_detect10_minsep2_thresh3_total150_permove91p7342681884719013396534138_m9p8957061767578125_r0_v193.py	0.168047	0.865898	0.835716	0.484375	0.023286	discard	Hybrid decoder keeps the baseline lookahead path unless a conservative board-only segmental pass wins the current score-gain gates, while following up v120-v192 by returning to the strongest low-false-change props16 + boardcands3 branch after localizing the per-added-move gate cliff between the safe 91.7342681884804278524825350 regime and the harmful 91.7342681884633748268242926 regime, and lowering only the per-added-move score-gain gate to 91.7342681884719013396534138 to bisect that remaining boundary and determine whether any headroom exists below 91.7342681884804278524825350 without re-entering the degraded selection regime.
autoresearch/snapshots/20260417T032112Z_hybrid_lookahead_segmental_drop1_boardcands3_ratio95_props16_top10_detect10_minsep2_thresh3_total150_permove91p7342681884761645960679744_m9p8957061767578125_r0_v194.py	0.168047	0.865898	0.835716	0.484375	0.023286	discard	Hybrid decoder keeps the baseline lookahead path unless a conservative board-only segmental pass wins the current score-gain gates, while following up v120-v193 by returning to the strongest low-false-change props16 + boardcands3 branch after localizing the per-added-move gate cliff between the safe 91.7342681884804278524825350 regime and the harmful 91.7342681884719013396534138 regime, and lowering only the per-added-move score-gain gate to 91.7342681884761645960679744 to bisect that remaining boundary and determine whether any headroom exists below 91.7342681884804278524825350 without re-entering the degraded selection regime.
autoresearch/snapshots/20260417T032205Z_hybrid_lookahead_segmental_drop1_boardcands3_ratio95_props16_top10_detect10_minsep2_thresh3_total150_permove91p7342681884782962242752547_m9p8957061767578125_r0_v195.py	0.254438	0.884089	0.855756	0.500000	0.016818	discard	Hybrid decoder keeps the baseline lookahead path unless a conservative board-only segmental pass wins the current score-gain gates, while following up v120-v194 by returning to the strongest low-false-change props16 + boardcands3 branch after localizing the per-added-move gate cliff between the safe 91.7342681884804278524825350 regime and the harmful 91.7342681884761645960679744 regime, and lowering only the per-added-move score-gain gate to 91.7342681884782962242752547 to bisect that remaining boundary and determine whether any headroom exists below 91.7342681884804278524825350 without re-entering the degraded selection regime.
autoresearch/snapshots/20260417T032257Z_hybrid_lookahead_segmental_drop1_boardcands3_ratio95_props16_top10_detect10_minsep2_thresh3_total150_permove91p73426818847723041017161455_m9p8957061767578125_r0_v196.py	0.254438	0.884089	0.855756	0.500000	0.016818	discard	Hybrid decoder keeps the baseline lookahead path unless a conservative board-only segmental pass wins the current score-gain gates, while following up v120-v195 by returning to the strongest low-false-change props16 + boardcands3 branch after localizing the per-added-move gate cliff between the safe 91.7342681884782962242752547 regime and the harmful 91.7342681884761645960679744 regime, and lowering only the per-added-move score-gain gate to 91.73426818847723041017161455 to bisect that remaining boundary and determine whether any headroom exists below 91.7342681884782962242752547 without re-entering the degraded selection regime.
autoresearch/snapshots/20260417T032354Z_hybrid_lookahead_segmental_drop1_boardcands3_ratio95_props16_top10_detect10_minsep2_thresh3_total150_permove91p7342681884766975031197945_m9p8957061767578125_r0_v197.py	0.254438	0.884089	0.855756	0.500000	0.016818	discard	Hybrid decoder keeps the baseline lookahead path unless a conservative board-only segmental pass wins the current score-gain gates, while following up v120-v196 by returning to the strongest low-false-change props16 + boardcands3 branch after localizing the per-added-move gate cliff between the safe 91.73426818847723041017161455 regime and the harmful 91.7342681884761645960679744 regime, and lowering only the per-added-move score-gain gate to 91.7342681884766975031197945 to bisect that remaining boundary and determine whether any headroom exists below 91.73426818847723041017161455 without re-entering the degraded selection regime.
