snapshot	board_exact	non_empty_accuracy	macro_f1	move_recall	false_change_rate	status	description
autoresearch/snapshots/20260419T064852Z_hybrid_lookahead_segmental_drop1_boardcands3_ratio95_props14_top8_detect10_lwindow1_minsep4_secsep1_thresh3_total150_permove125_lmargin9p5_m9p8957061767578125_r0_beam4_v590.py	0.074556	0.792672	0.751719	0.234375	0.009056	discard	Hybrid decoder keeps the baseline lookahead path unless a conservative board-only segmental pass wins the current score-gain gates, while following up the kept window1 branch after lowering lookahead window from 2 to 1 on the 9.5-margin baseline opened a lower-false-change but lower-recall tradeoff, lowering only max_event_proposals from 16 to 15 on the restored plain window1 branch improved recall and secondary metrics but worsened false-change, additionally narrowing top-board breadth from 4 to 3 recovered the lower false-change without hurting recall, lowering only max_event_proposals one step further from 15 to 14 on that boardcands3 plain props branch kept that recovered tradeoff, lowering segment_board_drop_worst_frames from 1 to 0 on that stronger props14 branch produced a new kept low-noise / lower-recall tradeoff, lowering secondary minimum event separation from 2 to 1 improved that tradeoff again, raising max_event_proposals from 14 to 15 was worse, lowering max_event_proposals from 14 to 13 was sharply worse, lowering top-move breadth from 4 to 1 was an exact no-op, raising beam size from 4 to 5, 6, and 7 were exact no-ops, beam8 was worse, raising event_window_radius from 0 to 1 and 2 were exact no-ops, raising LOOKAHEAD_WINDOW from 1 back to 2 was worse, min_event_separation 3 and 5 were both worse, raising secondary_min_event_separation from 1 to 2 and 3 was worse, raising secondary_peak_ratio from 0.95 to 0.98 was an exact no-op, lowering it through 0.92857666015625 stayed exact no-op while 0.928570556640625 reopened the noisier higher-recall tradeoff, lowering LOOKAHEAD_MARGIN from 9.5 to 9.0 was an exact no-op, raising it to 10.0 was also an exact no-op, lowering min_score_gain_per_added_move from 125.0 to 115.625 was worse, raising it to 137.5 was an exact no-op, lowering min_total_score_gain from 150.0 to 140.0 was an exact no-op, raising it to 175.0 was also an exact no-op, raising move_score_margin from 9.8957061767578125 to 10.0 was an exact no-op, and restoring segment_board_drop_worst_frames from 0 back to 1 improved the tradeoff again, and raising only top_move_candidates from 4 to 8 on that new secsep1 + drop1 best branch to test whether the current low-false-change surface still sits on a broad move-menu plateau on the upper side or whether wider move breadth reopens temporal ambiguity.
autoresearch/snapshots/20260419T064957Z_hybrid_lookahead_segmental_drop1_boardcands3_ratio95_props14_top16_detect10_lwindow1_minsep4_secsep1_thresh3_total150_permove125_lmargin9p5_m9p8957061767578125_r0_beam4_v591.py	0.074556	0.815720	0.784624	0.234375	0.010349	discard	Hybrid decoder keeps the baseline lookahead path unless a conservative board-only segmental pass wins the current score-gain gates, while following up the kept window1 branch after lowering lookahead window from 2 to 1 on the 9.5-margin baseline opened a lower-false-change but lower-recall tradeoff, lowering only max_event_proposals from 16 to 15 on the restored plain window1 branch improved recall and secondary metrics but worsened false-change, additionally narrowing top-board breadth from 4 to 3 recovered the lower false-change without hurting recall, lowering only max_event_proposals one step further from 15 to 14 on that boardcands3 plain props branch kept that recovered tradeoff, lowering segment_board_drop_worst_frames from 1 to 0 on that stronger props14 branch produced a new kept low-noise / lower-recall tradeoff, lowering secondary minimum event separation from 2 to 1 improved that tradeoff again, raising max_event_proposals from 14 to 15 was worse, lowering max_event_proposals from 14 to 13 was sharply worse, lowering top-move breadth from 4 to 1 was an exact no-op, raising beam size from 4 to 5, 6, and 7 were exact no-ops, beam8 was worse, raising event_window_radius from 0 to 1 and 2 were exact no-ops, raising LOOKAHEAD_WINDOW from 1 back to 2 was worse, min_event_separation 3 and 5 were both worse, raising secondary_min_event_separation from 1 to 2 and 3 was worse, raising secondary_peak_ratio from 0.95 to 0.98 was an exact no-op, lowering it through 0.92857666015625 stayed exact no-op while 0.928570556640625 reopened the noisier higher-recall tradeoff, lowering LOOKAHEAD_MARGIN from 9.5 to 9.0 was an exact no-op, raising it to 10.0 was also an exact no-op, lowering min_score_gain_per_added_move from 125.0 to 115.625 was worse, raising it to 137.5 was an exact no-op, lowering min_total_score_gain from 150.0 to 140.0 was an exact no-op, raising it to 175.0 was also an exact no-op, raising move_score_margin from 9.8957061767578125 to 10.0 was an exact no-op, raising top_move_candidates from 4 to 8 was also an exact no-op, and restoring segment_board_drop_worst_frames from 0 back to 1 improved the tradeoff again, and raising only top_move_candidates from 8 to 16 on that new secsep1 + drop1 best branch to test whether the current low-false-change surface stays flat through the full allowed move-menu cap or whether a wider move list reopens temporal ambiguity.
autoresearch/snapshots/20260419T065109Z_hybrid_lookahead_segmental_drop1_boardcands3_ratio95_props14_top12_detect10_lwindow1_minsep4_secsep1_thresh3_total150_permove125_lmargin9p5_m9p8957061767578125_r0_beam4_v592.py	0.074556	0.792672	0.751719	0.234375	0.009056	discard	Hybrid decoder keeps the baseline lookahead path unless a conservative board-only segmental pass wins the current score-gain gates, while following up the kept window1 branch after lowering lookahead window from 2 to 1 on the 9.5-margin baseline opened a lower-false-change but lower-recall tradeoff, lowering only max_event_proposals from 16 to 15 on the restored plain window1 branch improved recall and secondary metrics but worsened false-change, additionally narrowing top-board breadth from 4 to 3 recovered the lower false-change without hurting recall, lowering only max_event_proposals one step further from 15 to 14 on that boardcands3 plain props branch kept that recovered tradeoff, lowering segment_board_drop_worst_frames from 1 to 0 on that stronger props14 branch produced a new kept low-noise / lower-recall tradeoff, lowering secondary minimum event separation from 2 to 1 improved that tradeoff again, raising max_event_proposals from 14 to 15 was worse, lowering max_event_proposals from 14 to 13 was sharply worse, lowering top-move breadth from 4 to 1 was an exact no-op, raising beam size from 4 to 5, 6, and 7 were exact no-ops, beam8 was worse, raising event_window_radius from 0 to 1 and 2 were exact no-ops, raising LOOKAHEAD_WINDOW from 1 back to 2 was worse, min_event_separation 3 and 5 were both worse, raising secondary_min_event_separation from 1 to 2 and 3 was worse, raising secondary_peak_ratio from 0.95 to 0.98 was an exact no-op, lowering it through 0.92857666015625 stayed exact no-op while 0.928570556640625 reopened the noisier higher-recall tradeoff, lowering LOOKAHEAD_MARGIN from 9.5 to 9.0 was an exact no-op, raising it to 10.0 was also an exact no-op, lowering min_score_gain_per_added_move from 125.0 to 115.625 was worse, raising it to 137.5 was an exact no-op, lowering min_total_score_gain from 150.0 to 140.0 was an exact no-op, raising it to 175.0 was also an exact no-op, raising move_score_margin from 9.8957061767578125 to 10.0 was an exact no-op, raising top_move_candidates from 4 to 8 was also an exact no-op, while raising it to 16 reopened a distinct higher-secondary but slightly noisier tradeoff, and restoring segment_board_drop_worst_frames from 0 back to 1 improved the tradeoff again, and raising only top_move_candidates from 8 to 12 on that new secsep1 + drop1 best branch to localize where the upper move-menu plateau ends before the wider-menu tradeoff appears.
autoresearch/snapshots/20260419T065216Z_hybrid_lookahead_segmental_drop1_boardcands3_ratio95_props14_top14_detect10_lwindow1_minsep4_secsep1_thresh3_total150_permove125_lmargin9p5_m9p8957061767578125_r0_beam4_v593.py	0.074556	0.815720	0.784624	0.234375	0.010349	discard	Hybrid decoder keeps the baseline lookahead path unless a conservative board-only segmental pass wins the current score-gain gates, while following up the kept window1 branch after lowering lookahead window from 2 to 1 on the 9.5-margin baseline opened a lower-false-change but lower-recall tradeoff, lowering only max_event_proposals from 16 to 15 on the restored plain window1 branch improved recall and secondary metrics but worsened false-change, additionally narrowing top-board breadth from 4 to 3 recovered the lower false-change without hurting recall, lowering only max_event_proposals one step further from 15 to 14 on that boardcands3 plain props branch kept that recovered tradeoff, lowering segment_board_drop_worst_frames from 1 to 0 on that stronger props14 branch produced a new kept low-noise / lower-recall tradeoff, lowering secondary minimum event separation from 2 to 1 improved that tradeoff again, raising max_event_proposals from 14 to 15 was worse, lowering max_event_proposals from 14 to 13 was sharply worse, lowering top-move breadth from 4 to 1 was an exact no-op, raising beam size from 4 to 5, 6, and 7 were exact no-ops, beam8 was worse, raising event_window_radius from 0 to 1 and 2 were exact no-ops, raising LOOKAHEAD_WINDOW from 1 back to 2 was worse, min_event_separation 3 and 5 were both worse, raising secondary_min_event_separation from 1 to 2 and 3 was worse, raising secondary_peak_ratio from 0.95 to 0.98 was an exact no-op, lowering it through 0.92857666015625 stayed exact no-op while 0.928570556640625 reopened the noisier higher-recall tradeoff, lowering LOOKAHEAD_MARGIN from 9.5 to 9.0 was an exact no-op, raising it to 10.0 was also an exact no-op, lowering min_score_gain_per_added_move from 125.0 to 115.625 was worse, raising it to 137.5 was an exact no-op, lowering min_total_score_gain from 150.0 to 140.0 was an exact no-op, raising it to 175.0 was also an exact no-op, raising move_score_margin from 9.8957061767578125 to 10.0 was an exact no-op, raising top_move_candidates from 4 to 8 and 12 were exact no-ops, while 16 reopened a distinct higher-secondary but slightly noisier tradeoff, and restoring segment_board_drop_worst_frames from 0 back to 1 improved the tradeoff again, and raising only top_move_candidates from 12 to 14 on that new secsep1 + drop1 best branch to localize the upper move-menu cliff before the wider-menu tradeoff appears.
autoresearch/snapshots/20260419T065321Z_hybrid_lookahead_segmental_drop1_boardcands3_ratio95_props14_top13_detect10_lwindow1_minsep4_secsep1_thresh3_total150_permove125_lmargin9p5_m9p8957061767578125_r0_beam4_v594.py	0.074556	0.792672	0.751719	0.234375	0.009056	discard	Hybrid decoder keeps the baseline lookahead path unless a conservative board-only segmental pass wins the current score-gain gates, while following up the kept window1 branch after lowering lookahead window from 2 to 1 on the 9.5-margin baseline opened a lower-false-change but lower-recall tradeoff, lowering only max_event_proposals from 16 to 15 on the restored plain window1 branch improved recall and secondary metrics but worsened false-change, additionally narrowing top-board breadth from 4 to 3 recovered the lower false-change without hurting recall, lowering only max_event_proposals one step further from 15 to 14 on that boardcands3 plain props branch kept that recovered tradeoff, lowering segment_board_drop_worst_frames from 1 to 0 on that stronger props14 branch produced a new kept low-noise / lower-recall tradeoff, lowering secondary minimum event separation from 2 to 1 improved that tradeoff again, raising max_event_proposals from 14 to 15 was worse, lowering max_event_proposals from 14 to 13 was sharply worse, lowering top-move breadth from 4 to 1 was an exact no-op, raising beam size from 4 to 5, 6, and 7 were exact no-ops, beam8 was worse, raising event_window_radius from 0 to 1 and 2 were exact no-ops, raising LOOKAHEAD_WINDOW from 1 back to 2 was worse, min_event_separation 3 and 5 were both worse, raising secondary_min_event_separation from 1 to 2 and 3 was worse, raising secondary_peak_ratio from 0.95 to 0.98 was an exact no-op, lowering it through 0.92857666015625 stayed exact no-op while 0.928570556640625 reopened the noisier higher-recall tradeoff, lowering LOOKAHEAD_MARGIN from 9.5 to 9.0 was an exact no-op, raising it to 10.0 was also an exact no-op, lowering min_score_gain_per_added_move from 125.0 to 115.625 was worse, raising it to 137.5 was an exact no-op, lowering min_total_score_gain from 150.0 to 140.0 was an exact no-op, raising it to 175.0 was also an exact no-op, raising move_score_margin from 9.8957061767578125 to 10.0 was an exact no-op, raising top_move_candidates from 4 to 8 and 12 were exact no-ops, while 14 and 16 reopened a distinct higher-secondary but slightly noisier tradeoff, and restoring segment_board_drop_worst_frames from 0 back to 1 improved the tradeoff again, and raising only top_move_candidates from 12 to 13 on that new secsep1 + drop1 best branch to finish localizing where the upper move-menu plateau breaks before the wider-menu tradeoff appears.
autoresearch/snapshots/20260419T065455Z_hybrid_lookahead_segmental_drop1_boardcands3_ratio95_props14_top4_detect10_lwindow1_minsep4_secsep1_thresh3_total150_permove125_lmargin9p5_m9p75_r0_beam4_v595.py	0.074556	0.792672	0.751719	0.234375	0.009056	discard	Hybrid decoder keeps the baseline lookahead path unless a conservative board-only segmental pass wins the current score-gain gates, while following up the kept window1 branch after lowering lookahead window from 2 to 1 on the 9.5-margin baseline opened a lower-false-change but lower-recall tradeoff, lowering only max_event_proposals from 16 to 15 on the restored plain window1 branch improved recall and secondary metrics but worsened false-change, additionally narrowing top-board breadth from 4 to 3 recovered the lower false-change without hurting recall, lowering only max_event_proposals one step further from 15 to 14 on that boardcands3 plain props branch kept that recovered tradeoff, lowering segment_board_drop_worst_frames from 1 to 0 on that stronger props14 branch produced a new kept low-noise / lower-recall tradeoff, lowering secondary minimum event separation from 2 to 1 improved that tradeoff again, raising max_event_proposals from 14 to 15 was worse, lowering max_event_proposals from 14 to 13 was sharply worse, lowering top-move breadth from 4 to 1 was an exact no-op, raising beam size from 4 to 5, 6, and 7 were exact no-ops, beam8 was worse, raising event_window_radius from 0 to 1 and 2 were exact no-ops, raising LOOKAHEAD_WINDOW from 1 back to 2 was worse, min_event_separation 3 and 5 were both worse, raising secondary_min_event_separation from 1 to 2 and 3 was worse, raising secondary_peak_ratio from 0.95 to 0.98 was an exact no-op, lowering it through 0.92857666015625 stayed exact no-op while 0.928570556640625 reopened the noisier higher-recall tradeoff, lowering LOOKAHEAD_MARGIN from 9.5 to 9.0 was an exact no-op, raising it to 10.0 was also an exact no-op, lowering min_score_gain_per_added_move from 125.0 to 115.625 was worse, raising it to 137.5 was an exact no-op, lowering min_total_score_gain from 150.0 to 140.0 was an exact no-op, raising it to 175.0 was also an exact no-op, raising move_score_margin from 9.8957061767578125 to 10.0 was an exact no-op, raising top_move_candidates from 4 to 8, 12, and 13 were exact no-ops, while 14 and 16 reopened a distinct higher-secondary but slightly noisier tradeoff, and restoring segment_board_drop_worst_frames from 0 back to 1 improved the tradeoff again, and lowering only move_score_margin from 9.8957061767578125 to 9.75 on that new secsep1 + drop1 best branch to test the lower side of the local score-margin plateau before pivoting away from acceptance-gate tuning.
autoresearch/snapshots/20260419T065634Z_hybrid_lookahead_segmental_drop1_boardcands3_ratio95_props14_top14_detect10_lwindow1_minsep4_secsep1_thresh3_total150_permove125_lmargin9p5_m9p8957061767578125_r0_beam5_v596.py	0.074556	0.792672	0.751719	0.234375	0.009056	discard	Hybrid decoder keeps the baseline lookahead path unless a conservative board-only segmental pass wins the current score-gain gates, while following up the kept window1 branch after lowering lookahead window from 2 to 1 on the 9.5-margin baseline opened a lower-false-change but lower-recall tradeoff, lowering only max_event_proposals from 16 to 15 on the restored plain window1 branch improved recall and secondary metrics but worsened false-change, additionally narrowing top-board breadth from 4 to 3 recovered the lower false-change without hurting recall, lowering only max_event_proposals one step further from 15 to 14 on that boardcands3 plain props branch kept that recovered tradeoff, lowering segment_board_drop_worst_frames from 1 to 0 on that stronger props14 branch produced a new kept low-noise / lower-recall tradeoff, lowering secondary minimum event separation from 2 to 1 improved that tradeoff again, raising max_event_proposals from 14 to 15 was worse, lowering max_event_proposals from 14 to 13 was sharply worse, lowering top-move breadth from 4 to 1 was an exact no-op, raising beam size from 4 to 5, 6, and 7 were exact no-ops, beam8 was worse, raising event_window_radius from 0 to 1 and 2 were exact no-ops, raising LOOKAHEAD_WINDOW from 1 back to 2 was worse, min_event_separation 3 and 5 were both worse, raising secondary_min_event_separation from 1 to 2 and 3 was worse, raising secondary_peak_ratio from 0.95 to 0.98 was an exact no-op, lowering it through 0.92857666015625 stayed exact no-op while 0.928570556640625 reopened the noisier higher-recall tradeoff, lowering LOOKAHEAD_MARGIN from 9.5 to 9.0 was an exact no-op, raising it to 10.0 was also an exact no-op, lowering min_score_gain_per_added_move from 125.0 to 115.625 was worse, raising it to 137.5 was an exact no-op, lowering min_total_score_gain from 150.0 to 140.0 was an exact no-op, raising it to 175.0 was also an exact no-op, raising move_score_margin from 9.8957061767578125 to 10.0 and lowering it to 9.75 were exact no-ops, raising top_move_candidates from 4 to 8, 12, and 13 were exact no-ops, while 14 and 16 reopened the same slightly noisier higher-secondary tradeoff, and restoring segment_board_drop_worst_frames from 0 back to 1 improved the tradeoff again, and raising beam size from 4 to 5 while also using top_move_candidates=14 on that new secsep1 + drop1 branch to test whether the widened move-menu side branch is the same beam4-only side branch seen at wider board breadth or whether it persists once beam increases.
autoresearch/snapshots/20260419T065806Z_hybrid_lookahead_segmental_drop1_boardcands3_ratio95_props14_top14_detect10_lwindow1_minsep4_secsep1_thresh3_total150_permove125_lmargin9p5_m9p8957061767578125_r0_beam3_v597.py	0.074556	0.815720	0.784846	0.218750	0.011643	discard	Hybrid decoder keeps the baseline lookahead path unless a conservative board-only segmental pass wins the current score-gain gates, while following up the kept window1 branch after lowering lookahead window from 2 to 1 on the 9.5-margin baseline opened a lower-false-change but lower-recall tradeoff, lowering only max_event_proposals from 16 to 15 on the restored plain window1 branch improved recall and secondary metrics but worsened false-change, additionally narrowing top-board breadth from 4 to 3 recovered the lower false-change without hurting recall, lowering only max_event_proposals one step further from 15 to 14 on that boardcands3 plain props branch kept that recovered tradeoff, lowering segment_board_drop_worst_frames from 1 to 0 on that stronger props14 branch produced a new kept low-noise / lower-recall tradeoff, lowering secondary minimum event separation from 2 to 1 improved that tradeoff again, raising max_event_proposals from 14 to 15 was worse, lowering max_event_proposals from 14 to 13 was sharply worse, lowering top-move breadth from 4 to 1 was an exact no-op, raising beam size from 4 to 5, 6, and 7 were exact no-ops, beam8 was worse, raising event_window_radius from 0 to 1 and 2 were exact no-ops, raising LOOKAHEAD_WINDOW from 1 back to 2 was worse, min_event_separation 3 and 5 were both worse, raising secondary_min_event_separation from 1 to 2 and 3 was worse, raising secondary_peak_ratio from 0.95 to 0.98 was an exact no-op, lowering it through 0.92857666015625 stayed exact no-op while 0.928570556640625 reopened the noisier higher-recall tradeoff, lowering LOOKAHEAD_MARGIN from 9.5 to 9.0 was an exact no-op, raising it to 10.0 was also an exact no-op, lowering min_score_gain_per_added_move from 125.0 to 115.625 was worse, raising it to 137.5 was an exact no-op, lowering min_total_score_gain from 150.0 to 140.0 was an exact no-op, raising it to 175.0 was also an exact no-op, raising move_score_margin from 9.8957061767578125 to 10.0 and lowering it to 9.75 were exact no-ops, raising top_move_candidates from 4 to 8, 12, and 13 were exact no-ops, while 14 and 16 reopened the same slightly noisier higher-secondary tradeoff, and restoring segment_board_drop_worst_frames from 0 back to 1 improved the tradeoff again, and lowering only beam_size from 4 to 3 while keeping top_move_candidates=14 on that widened move-menu branch to test whether the branch follows the same beam-sensitive side-path pattern as the earlier boardcands4 beam4-only tradeoff.
