snapshot	board_exact	non_empty_accuracy	macro_f1	move_recall	false_change_rate	status	description
autoresearch/snapshots/20260417T035752Z_hybrid_lookahead_segmental_drop1_boardcands2_ratio95_props15_top10_detect10_minsep2_thresh3_total150_permove125_m9p8957061767578125_r0_beam6_v223.py	0.254438	0.847708	0.813439	0.468750	0.015524	discard	Hybrid decoder keeps the baseline lookahead path unless a conservative board-only segmental pass wins the current score-gain gates, while following up v221-v222 after beam_size=6 rescued the props16 branch into a lower-false-change tradeoff and extra board breadth was a no-op there, and lowering only max_event_proposals from 16 to 15 on that active beam6 branch to test whether the tighter beam can also rescue the otherwise degraded props15 regime into a usable lower-false-change tradeoff or whether the proposal-budget cliff still starts below 16 even with narrower segmental search.
autoresearch/snapshots/20260417T035921Z_hybrid_lookahead_segmental_drop1_boardcands2_ratio95_props17_top10_detect10_minsep2_thresh3_total150_permove125_m9p8957061767578125_r0_beam1_v224.py	0.236686	0.899953	0.863160	0.437500	0.016818	discard	Hybrid decoder keeps the baseline lookahead path unless a conservative board-only segmental pass wins the current score-gain gates, while following up v210-v223 after beam_size=6 emerged as the only active local lever, beam_size=5 through 3 stayed on the same tighter-search plateau, and beam_size=2 finally broke into a worse regime, and lowering only beam_size from 8 to 1 to test whether the beam cliff below the beam3-beam6 plateau steepens further at the smallest possible frontier or whether beam_size=2 already captured the full degraded regime.
autoresearch/snapshots/20260417T040009Z_hybrid_lookahead_segmental_drop1_boardcands3_ratio95_props15_top10_detect10_minsep2_thresh3_total150_permove125_m9p8957061767578125_r0_beam6_v225.py	0.254438	0.858147	0.822237	0.468750	0.015524	discard	Hybrid decoder keeps the baseline lookahead path unless a conservative board-only segmental pass wins the current score-gain gates, while following up v223 after beam_size=6 partially rescued the otherwise degraded props15 regime into a lower-false-change tradeoff, and widening only board-state breadth from 2 to 3 on that beam6 + props15 branch to test whether one extra board hypothesis can recover some of the lost non-empty accuracy, macro_f1, and recall without giving back the branch's strongest false-change win.
autoresearch/snapshots/20260417T040114Z_hybrid_lookahead_segmental_drop1_boardcands4_ratio95_props15_top10_detect10_minsep2_thresh3_total150_permove125_m9p8957061767578125_r0_beam6_v226.py	0.254438	0.858147	0.822237	0.468750	0.015524	discard	Hybrid decoder keeps the baseline lookahead path unless a conservative board-only segmental pass wins the current score-gain gates, while following up v225 after beam_size=6 and boardcands3 partially rescued the otherwise degraded props15 regime into the strongest low-false-change tradeoff seen at that budget, and widening only board-state breadth from 3 to 4 on that beam6 + props15 branch to test whether one more board hypothesis can recover additional non-empty accuracy, macro_f1, or recall without giving back the branch's strongest false-change win.
autoresearch/snapshots/20260417T040227Z_hybrid_lookahead_segmental_drop1_boardcands2_ratio95_props16_top12_detect10_minsep2_thresh3_total150_permove125_m9p8957061767578125_r0_beam6_v227.py	0.254438	0.893339	0.864286	0.484375	0.016818	discard	Hybrid decoder keeps the baseline lookahead path unless a conservative board-only segmental pass wins the current score-gain gates, while following up v221-v226 after beam_size=6 rescued the props16 branch into the best current lower-false-change tradeoff and added board breadth proved inert there, and widening only move-search breadth from top10 to top12 on that beam6 + props16 branch to test whether a slightly broader legal-move menu can recover some of the lost move-detection recall without giving back the branch's false-change win.
autoresearch/snapshots/20260417T040329Z_hybrid_lookahead_segmental_drop1_boardcands2_ratio95_props15_top12_detect10_minsep2_thresh3_total150_permove125_m9p8957061767578125_r0_beam6_v228.py	0.254438	0.847708	0.813439	0.468750	0.015524	discard	Hybrid decoder keeps the baseline lookahead path unless a conservative board-only segmental pass wins the current score-gain gates, while following up v223-v227 after beam_size=6 partially rescued the otherwise degraded props15 regime into the strongest current false-change tradeoff at that budget and extra board breadth proved inert there, and widening only move-search breadth from top10 to top12 on that beam6 + props15 branch to test whether a slightly broader legal-move menu can recover some of the lost non-empty accuracy, macro_f1, or move-detection recall without giving back the branch's false-change win.
autoresearch/snapshots/20260417T040427Z_hybrid_lookahead_segmental_drop1_boardcands3_ratio95_props15_top12_detect10_minsep2_thresh3_total150_permove125_m9p8957061767578125_r0_beam6_v229.py	0.254438	0.858147	0.822237	0.468750	0.015524	discard	Hybrid decoder keeps the baseline lookahead path unless a conservative board-only segmental pass wins the current score-gain gates, while following up v225-v228 after beam_size=6 and boardcands3 produced the strongest current props15 low-false-change tradeoff, boardcands4 was a no-op there, and widening move search to top12 was also a no-op on the beam6 + props15 + boardcands2 branch, and widening only move-search breadth from top10 to top12 on the active beam6 + props15 + boardcands3 branch to test whether the extra board hypothesis needs a broader legal-move menu to recover some of the lost non-empty accuracy, macro_f1, or move-detection recall without giving back the branch's strongest false-change win.
autoresearch/snapshots/20260417T040539Z_hybrid_lookahead_segmental_drop1_boardcands3_ratio95_props15_top10_detect10_minsep2_thresh3_total150_permove100_m9p8957061767578125_r0_beam6_v230.py	0.168047	0.839543	0.800186	0.437500	0.021992	discard	Hybrid decoder keeps the baseline lookahead path unless a conservative board-only segmental pass wins the current score-gain gates, while following up v225-v229 after beam_size=6 and boardcands3 produced the strongest current props15 low-false-change tradeoff and added board breadth plus wider move search were both no-ops there, and lowering only the per-added-move score-gain gate from 125 to 100 on that active branch to test whether hybrid selection is still filtering useful low-budget repairs that could recover some non-empty accuracy, macro_f1, or move-detection recall without giving back the branch's strongest false-change win.
autoresearch/snapshots/20260417T040658Z_hybrid_lookahead_segmental_drop1_boardcands3_ratio95_props15_top10_detect10_minsep2_thresh3_total125_permove125_m9p8957061767578125_r0_beam6_v231.py	0.254438	0.858147	0.822237	0.468750	0.015524	discard	Hybrid decoder keeps the baseline lookahead path unless a conservative board-only segmental pass wins the current score-gain gates, while following up v225-v230 after beam_size=6 and boardcands3 produced the strongest current props15 low-false-change tradeoff, wider move search proved inert there, and lowering the per-added-move gate to 100 was harmful, and lowering only the total score-gain gate from 150 to 125 on that active branch to test whether hybrid selection still leaves useful low-budget repairs on the table when per-added-move quality remains fixed at the last safe setting.
autoresearch/snapshots/20260417T040828Z_hybrid_lookahead_segmental_drop1_boardcands2_ratio95_props16_top10_detect5_minsep2_thresh3_total150_permove125_m9p8957061767578125_r0_beam6_v232.py	0.254438	0.893339	0.864286	0.484375	0.016818	discard	Hybrid decoder keeps the baseline lookahead path unless a conservative board-only segmental pass wins the current score-gain gates, while following up v221-v231 after beam_size=6 rescued the props16 branch into the best current lower-false-change tradeoff and nearby board-breadth plus move-search tweaks were inert there, and lowering only the detect proposal threshold from 0.1 to 0.05 on that active beam6 + props16 branch to test whether a slightly broader detect-driven proposal set can recover some move-detection recall without giving back the branch's false-change advantage.
autoresearch/snapshots/20260417T041031Z_hybrid_lookahead_segmental_drop1_boardcands2_ratio95_props16_top10_detect10_minsep2_thresh3_total125_permove125_m9p8957061767578125_r0_beam6_v233.py	0.254438	0.893339	0.864286	0.484375	0.016818	discard	Hybrid decoder keeps the baseline lookahead path unless a conservative board-only segmental pass wins the current score-gain gates, while following up v221-v232 after beam_size=6 rescued the props16 branch into the best current lower-false-change tradeoff and nearby board-breadth, move-search, and detect-threshold tweaks were inert there, and lowering only the total score-gain gate from 150 to 125 on that active beam6 + props16 branch to test whether hybrid selection still leaves useful conservative repairs on the table when per-added-move quality remains fixed at the last safe setting.
autoresearch/snapshots/20260417T041139Z_hybrid_lookahead_segmental_drop1_boardcands3_ratio95_props14_top10_detect10_minsep2_thresh3_total150_permove125_m9p8957061767578125_r0_beam6_v234.py	0.220118	0.858767	0.827455	0.484375	0.014230	discard	Hybrid decoder keeps the baseline lookahead path unless a conservative board-only segmental pass wins the current score-gain gates, while following up v225-v233 after beam_size=6 and boardcands3 produced the strongest current props15 low-false-change tradeoff and nearby move-search plus hybrid-gate tweaks were inert or harmful, and lowering only max_event_proposals from 15 to 14 on that active branch to test whether the tighter beam and extra board breadth can extend the usable low-false-change regime below 15 proposals or whether the proposal-budget cliff still starts immediately at props14.
autoresearch/snapshots/20260417T041234Z_hybrid_lookahead_segmental_drop1_boardcands3_ratio95_props15_top10_detect10_minsep2_thresh3_total150_permove125_m9p8957061767578125_r0_beam5_v235.py	0.254438	0.858147	0.822237	0.468750	0.015524	discard	Hybrid decoder keeps the baseline lookahead path unless a conservative board-only segmental pass wins the current score-gain gates, while following up v225-v234 after beam_size=6 and boardcands3 produced the strongest current props15 low-false-change tradeoff and nearby board-breadth plus hybrid-gate tweaks were inert or harmful, and lowering only beam_size from 6 to 5 on that active branch to test whether slightly tighter segmental search can improve the rescued props15 tradeoff further without giving back its board-exact ceiling or strongest false-change win.
autoresearch/snapshots/20260417T041920Z_hybrid_lookahead_segmental_drop1_boardcands3_ratio95_props15_top10_detect10_minsep2_secondarysep1_thresh3_total150_permove125_m9p8957061767578125_r0_beam6_v236.py	0.253254	0.858095	0.822211	0.468750	0.016818	discard	Hybrid decoder keeps the baseline lookahead path unless a conservative board-only segmental pass wins the current score-gain gates, while following up v225-v235 after beam_size=6 and boardcands3 produced the strongest current props15 low-false-change tradeoff and nearby move-search plus hybrid-gate tweaks were inert or harmful, and lowering only the secondary event separation from 2 to 1 on that active branch to test whether allowing tighter nearby timing alternatives can recover some of the lost non-empty accuracy, macro_f1, or move-detection recall without giving back the branch's strongest false-change win.
autoresearch/snapshots/20260417T042029Z_hybrid_lookahead_segmental_drop1_boardcands2_ratio95_props16_top10_detect10_minsep2_thresh3_total150_permove125_m9p8957061767578125_r0_beam7_v237.py	0.254438	0.884089	0.855756	0.500000	0.016818	discard	Hybrid decoder keeps the baseline lookahead path unless a conservative board-only segmental pass wins the current score-gain gates, while following up v221-v236 after beam_size=6 rescued the props16 branch into the best current lower-false-change tradeoff, nearby board-breadth plus move-search plus detect-threshold plus total-gain tweaks were inert there, and beam7 was a no-op on the props17 branch, and raising only beam_size from 6 to 7 on the rescued props16 branch to test whether that rescue persists under slightly broader search or collapses back toward the old degraded props16 regime.
autoresearch/snapshots/20260417T042151Z_hybrid_lookahead_segmental_drop1_boardcands3_ratio95_props15_top10_detect5_minsep2_thresh3_total150_permove125_m9p8957061767578125_r0_beam6_v238.py	0.254438	0.858147	0.822237	0.468750	0.015524	discard	Hybrid decoder keeps the baseline lookahead path unless a conservative board-only segmental pass wins the current score-gain gates, while following up v225-v237 after beam_size=6 and boardcands3 produced the strongest current props15 low-false-change tradeoff, nearby board-breadth plus move-search plus total-gain tweaks were inert there, secondary-separation tightening was harmful, and lowering only the detect proposal threshold from 0.1 to 0.05 on that active branch to test whether a slightly broader detect-driven proposal set can recover some non-empty accuracy, macro_f1, or move-detection recall without giving back the branch's strongest false-change win.
autoresearch/snapshots/20260417T042246Z_hybrid_lookahead_segmental_drop1_boardcands2_ratio95_props16_top10_detect10_minsep2_thresh3_total150_permove125_m9p8957061767578125_r0_beam5_v239.py	0.254438	0.893339	0.864286	0.484375	0.016818	discard	Hybrid decoder keeps the baseline lookahead path unless a conservative board-only segmental pass wins the current score-gain gates, while following up v221-v238 after beam_size=6 rescued the props16 branch into the best current lower-false-change tradeoff and beam7 collapsed back to the older weaker props16 regime, and lowering only beam_size from 6 to 5 on that rescued branch to test whether the rescue is a wider low-beam plateau below 6 or a narrower beam6-specific effect.
autoresearch/snapshots/20260417T042337Z_hybrid_lookahead_segmental_drop1_boardcands2_ratio95_props16_top10_detect10_minsep2_thresh3_total150_permove125_m9p8957061767578125_r0_beam4_v240.py	0.254438	0.893339	0.864286	0.484375	0.016818	discard	Hybrid decoder keeps the baseline lookahead path unless a conservative board-only segmental pass wins the current score-gain gates, while following up v221-v239 after beam_size=6 rescued the props16 branch into the best current lower-false-change tradeoff, beam7 collapsed back to the older weaker props16 regime, and beam5 preserved the rescue exactly, and lowering only beam_size from 6 to 4 on that rescued branch to test whether the rescued regime remains a broader low-beam plateau or starts to break below beam5.
autoresearch/snapshots/20260417T042420Z_hybrid_lookahead_segmental_drop1_boardcands2_ratio95_props16_top10_detect10_minsep2_thresh3_total150_permove125_m9p8957061767578125_r0_beam3_v241.py	0.254438	0.893339	0.864286	0.484375	0.016818	discard	Hybrid decoder keeps the baseline lookahead path unless a conservative board-only segmental pass wins the current score-gain gates, while following up v221-v240 after beam_size=6 rescued the props16 branch into the best current lower-false-change tradeoff, beam7 collapsed back to the older weaker props16 regime, and beam5 plus beam4 preserved the rescue exactly, and lowering only beam_size from 6 to 3 on that rescued branch to test whether the rescued regime still holds at beam3 or finally breaks below the confirmed beam4-beam6 plateau.
autoresearch/snapshots/20260417T042505Z_hybrid_lookahead_segmental_drop1_boardcands2_ratio95_props16_top10_detect10_minsep2_thresh3_total150_permove125_m9p8957061767578125_r0_beam2_v242.py	0.236686	0.887809	0.860622	0.437500	0.016818	discard	Hybrid decoder keeps the baseline lookahead path unless a conservative board-only segmental pass wins the current score-gain gates, while following up v221-v241 after beam_size=6 rescued the props16 branch into the best current lower-false-change tradeoff, beam7 collapsed back to the older weaker props16 regime, and beam3 through beam5 preserved the rescue exactly, and lowering only beam_size from 6 to 2 on that rescued branch to test whether the rescued regime finally breaks below the confirmed beam3-beam6 plateau.
autoresearch/snapshots/20260417T042555Z_hybrid_lookahead_segmental_drop1_boardcands2_ratio95_props16_top10_detect10_minsep2_thresh3_total150_permove125_m9p8957061767578125_r0_beam1_v243.py	0.236686	0.861971	0.836282	0.453125	0.016818	discard	Hybrid decoder keeps the baseline lookahead path unless a conservative board-only segmental pass wins the current score-gain gates, while following up v221-v242 after beam_size=6 rescued the props16 branch into the best current lower-false-change tradeoff, beam3 through beam5 preserved that rescue exactly, and beam2 finally broke the plateau, and lowering only beam_size from 6 to 1 on that rescued branch to test whether beam2 already marks the terminal low-beam regime or beam1 creates a distinct final tradeoff.
autoresearch/snapshots/20260417T042647Z_hybrid_lookahead_segmental_drop1_boardcands3_ratio95_props16_top10_detect10_minsep2_thresh3_total150_permove125_m9p8957061767578125_r0_beam2_v244.py	0.236686	0.887809	0.860622	0.437500	0.016818	discard	Hybrid decoder keeps the baseline lookahead path unless a conservative board-only segmental pass wins the current score-gain gates, while following up v221-v243 after beam_size=6 rescued the props16 branch into the best current lower-false-change tradeoff, beam3 through beam6 held that rescue, and beam2 plus beam1 established the low-beam failure side, and widening only board-state breadth from 2 to 3 on the first broken beam2 regime to test whether extra board evidence can recover the rescued props16 tradeoff under tighter search or whether the low-beam collapse is insensitive to board breadth.
autoresearch/snapshots/20260417T042807Z_hybrid_lookahead_segmental_drop1_boardcands2_ratio95_props16_top10_detect10_minsep2_thresh3_total125_permove125_m9p8957061767578125_r0_beam2_v245.py	0.236686	0.887809	0.860622	0.437500	0.016818	discard	Hybrid decoder keeps the baseline lookahead path unless a conservative board-only segmental pass wins the current score-gain gates, while following up v221-v244 after beam_size=6 rescued the props16 branch into the best current lower-false-change tradeoff, beam3 through beam6 held that rescue, beam2 plus beam1 established the low-beam failure side, and extra board breadth was a no-op there, and lowering only the total score-gain gate from 150 to 125 on the broken beam2 regime to test whether tighter search mainly fails because hybrid acceptance becomes too strict once total score gains shrink.
autoresearch/snapshots/20260417T042918Z_hybrid_lookahead_segmental_drop1_boardcands2_ratio95_props15_top10_detect10_minsep2_thresh3_total150_permove125_m9p8957061767578125_r0_beam2_v246.py	0.236686	0.833807	0.813732	0.421875	0.014230	discard	Hybrid decoder keeps the baseline lookahead path unless a conservative board-only segmental pass wins the current score-gain gates, while following up v221-v245 after beam_size=6 rescued the props16 branch into the best current lower-false-change tradeoff, beam3 through beam6 held that rescue, beam2 plus beam1 established the low-beam failure side, and extra board breadth plus lower total-gain gating were both no-ops there, and lowering only max_event_proposals from 16 to 15 on the broken beam2 regime to test whether pruning one more proposal can recover a cleaner low-beam tradeoff or whether the collapse below beam3 is already proposal-budget insensitive.
autoresearch/snapshots/20260417T043012Z_hybrid_lookahead_segmental_drop1_boardcands2_ratio95_props16_top10_detect5_minsep2_thresh3_total150_permove125_m9p8957061767578125_r0_beam2_v247.py	0.236686	0.887809	0.860622	0.437500	0.016818	discard	Hybrid decoder keeps the baseline lookahead path unless a conservative board-only segmental pass wins the current score-gain gates, while following up v221-v246 after beam_size=6 rescued the props16 branch into the best current lower-false-change tradeoff, beam3 through beam6 held that rescue, beam2 plus beam1 established the low-beam failure side, board-breadth and total-gain tweaks were no-ops there, and dropping to props15 only worsened board_exact and recall for extra false-change reduction, and lowering only the detect proposal threshold from 0.1 to 0.05 on the broken beam2 props16 regime to test whether a broader detect-driven proposal set can recover the lost board_exact and move recall under tight search.
autoresearch/snapshots/20260417T043122Z_hybrid_lookahead_segmental_drop1_boardcands2_ratio95_props16_top10_detect10_minsep2_thresh3_total150_permove100_m9p8957061767578125_r0_beam2_v248.py	0.236686	0.887809	0.860622	0.437500	0.016818	discard	Hybrid decoder keeps the baseline lookahead path unless a conservative board-only segmental pass wins the current score-gain gates, while following up v221-v247 after beam_size=6 rescued the props16 branch into the best current lower-false-change tradeoff, beam3 through beam6 held that rescue, beam2 plus beam1 established the low-beam failure side, and board-breadth plus total-gain plus detect-threshold tweaks were all no-ops there, and lowering only the per-added-move score-gain gate from 125 to 100 on the broken beam2 props16 regime to test whether tighter search mainly fails because hybrid acceptance is still too strict on a per-move basis.
