snapshot	board_exact	non_empty_accuracy	macro_f1	move_recall	false_change_rate	status	description
autoresearch/snapshots/20260419T233559Z_hybrid_p8_m8_w3_g142p3393809000651089036182384006679058074951171874999999999999999905960451934216999362501077022220345774506755458232998279299863497726619243621826171875_v1048.py	0.071006	0.789778	0.739821	0.375000	0.024580	discard	Restore the compact props8 + minsep8 hybrid shelf anchored at lwindow3, beam3, top4, boardcands2, secsep1, radius0, drop1, props8, total150, and lmargin9.935836791992188. The latest executed bracket is harmful at 142.339380900065108903618238400667905807495117187499999999999999905960451934216999362501077022220345774506755458232998279299863497726619243621826171875 and exact-flat at 142.3393809000651089036182384006679058074951171875000000000000000752316384526264005099991383822237233803945956334136013765601092018187046051025390625, so this run restores the same shelf anchor and raises only min_score_gain_per_added_move to 142.3393809000651089036182384006679058074951171874999999999999999905960451934216999362501077022220345774506755458232998279299863497726619243621826171875 to continue binary-searching that lower edge. The experiment name remains shortened to avoid the filename-too-long failure seen with long autogenerated names.
autoresearch/snapshots/20260419T233703Z_hybrid_p8_m8_w3_g142p33938090006510890361823840066790580749511718750000000000000003291384182302405022312462304222287897892263558961845060224504777579568326473236083984375_v1049.py	0.071006	0.799339	0.749250	0.375000	0.020699	discard	Restore the compact props8 + minsep8 hybrid shelf anchored at lwindow3, beam3, top4, boardcands2, secsep1, radius0, drop1, props8, total150, and lmargin9.935836791992188. The latest executed bracket is harmful at 142.3393809000651089036182384006679058074951171874999999999999999905960451934216999362501077022220345774506755458232998279299863497726619243621826171875 and exact-flat at 142.3393809000651089036182384006679058074951171875000000000000000752316384526264005099991383822237233803945956334136013765601092018187046051025390625, so this run restores the same shelf anchor and raises only min_score_gain_per_added_move to 142.33938090006510890361823840066790580749511718750000000000000003291384182302405022312462304222287897892263558961845060224504777579568326473236083984375 to continue binary-searching that lower edge. The experiment name remains shortened to avoid the filename-too-long failure seen with long autogenerated names.
autoresearch/snapshots/20260419T233804Z_hybrid_p8_m8_w3_g142p339380900065108903618238400667905807495117187500000000000000011754943508222875079687365372222456778186655567720875215087517062784172594547271728515625_v1050.py	0.071006	0.799339	0.749250	0.375000	0.020699	discard	Restore the compact props8 + minsep8 hybrid shelf anchored at lwindow3, beam3, top4, boardcands2, secsep1, radius0, drop1, props8, total150, and lmargin9.935836791992188. The latest executed bracket is harmful at 142.3393809000651089036182384006679058074951171874999999999999999905960451934216999362501077022220345774506755458232998279299863497726619243621826171875 and exact-flat at 142.33938090006510890361823840066790580749511718750000000000000003291384182302405022312462304222287897892263558961845060224504777579568326473236083984375, so this run restores the same shelf anchor and raises only min_score_gain_per_added_move to 142.339380900065108903618238400667905807495117187500000000000000011754943508222875079687365372222456778186655567720875215087517062784172594547271728515625 to continue binary-searching that lower edge. The experiment name remains shortened to avoid the filename-too-long failure seen with long autogenerated names.
autoresearch/snapshots/20260419T233907Z_hybrid_p8_m8_w3_g142p3393809000651089036182384006679058074951171875000000000000000011754943508222875079687365372222456778186655567720875215087517062784172594547271728515625_v1051.py	0.071006	0.799339	0.749250	0.375000	0.020699	discard	Restore the compact props8 + minsep8 hybrid shelf anchored at lwindow3, beam3, top4, boardcands2, secsep1, radius0, drop1, props8, total150, and lmargin9.935836791992188. The latest executed bracket is harmful at 142.3393809000651089036182384006679058074951171874999999999999999905960451934216999362501077022220345774506755458232998279299863497726619243621826171875 and exact-flat at 142.339380900065108903618238400667905807495117187500000000000000011754943508222875079687365372222456778186655567720875215087517062784172594547271728515625, so this run restores the same shelf anchor and raises only min_score_gain_per_added_move to 142.3393809000651089036182384006679058074951171875000000000000000011754943508222875079687365372222456778186655567720875215087517062784172594547271728515625 to continue binary-searching that lower edge. The experiment name remains shortened to avoid the filename-too-long failure seen with long autogenerated names.
autoresearch/snapshots/20260419T234015Z_hybrid_p8_m8_w3_g142p33938090006510890361823840066790580749511718749999999999999999588576977212199372210942211972214012763467055129769367471936902802553959190845489501953125_v1052.py	0.071006	0.789778	0.739821	0.375000	0.024580	discard	Restore the compact props8 + minsep8 hybrid shelf anchored at lwindow3, beam3, top4, boardcands2, secsep1, radius0, drop1, props8, total150, and lmargin9.935836791992188. The latest executed bracket is harmful at 142.3393809000651089036182384006679058074951171874999999999999999905960451934216999362501077022220345774506755458232998279299863497726619243621826171875 and exact-flat at 142.3393809000651089036182384006679058074951171875000000000000000011754943508222875079687365372222456778186655567720875215087517062784172594547271728515625, so this run restores the same shelf anchor and raises only min_score_gain_per_added_move to 142.33938090006510890361823840066790580749511718749999999999999999588576977212199372210942211972214012763467055129769367471936902802553959190845489501953125 to continue binary-searching that lower edge. The experiment name remains shortened to avoid the filename-too-long failure seen with long autogenerated names.
autoresearch/snapshots/20260419T234126Z_hybrid_p8_m8_w3_g142p339380900065108903618238400667905807495117187499999999999999998530632061472140615039079328472192902726668054034890598114060367151978425681591033935546875_v1053.py	0.071006	0.789778	0.739821	0.375000	0.024580	discard	Restore the compact props8 + minsep8 hybrid shelf anchored at lwindow3, beam3, top4, boardcands2, secsep1, radius0, drop1, props8, total150, and lmargin9.935836791992188. The latest executed bracket is harmful at 142.33938090006510890361823840066790580749511718749999999999999999588576977212199372210942211972214012763467055129769367471936902802553959190845489501953125 and exact-flat at 142.3393809000651089036182384006679058074951171875000000000000000011754943508222875079687365372222456778186655567720875215087517062784172594547271728515625, so this run restores the same shelf anchor and raises only min_score_gain_per_added_move to 142.339380900065108903618238400667905807495117187499999999999999998530632061472140615039079328472192902726668054034890598114060367151978425681591033935546875 to continue binary-searching that lower edge. The experiment name remains shortened to avoid the filename-too-long failure seen with long autogenerated names.
autoresearch/snapshots/20260419T234233Z_hybrid_p8_m8_w3_g142p3393809000651089036182384006679058074951171874999999999999999998530632061472140615039079328472192902726668054034890598114060367151978425681591033935546875_v1054.py	0.071006	0.789778	0.739821	0.375000	0.024580	discard	Restore the compact props8 + minsep8 hybrid shelf anchored at lwindow3, beam3, top4, boardcands2, secsep1, radius0, drop1, props8, total150, and lmargin9.935836791992188. The latest executed bracket is harmful at 142.339380900065108903618238400667905807495117187499999999999999998530632061472140615039079328472192902726668054034890598114060367151978425681591033935546875 and exact-flat at 142.3393809000651089036182384006679058074951171875000000000000000011754943508222875079687365372222456778186655567720875215087517062784172594547271728515625, so this run restores the same shelf anchor and raises only min_score_gain_per_added_move to 142.3393809000651089036182384006679058074951171874999999999999999998530632061472140615039079328472192902726668054034890598114060367151978425681591033935546875 to continue binary-searching that lower edge. The experiment name remains shortened to avoid the filename-too-long failure seen with long autogenerated names.
autoresearch/snapshots/20260419T234338Z_hybrid_p8_m8_w3_g142p33938090006510890361823840066790580749511718750000000000000000051427877848475078473632223503473248404566618108778829066007887149680755101144313812255859375_v1055.py	0.071006	0.799339	0.749250	0.375000	0.020699	discard	Restore the compact props8 + minsep8 hybrid shelf anchored at lwindow3, beam3, top4, boardcands2, secsep1, radius0, drop1, props8, total150, and lmargin9.935836791992188. The latest executed bracket is harmful at 142.3393809000651089036182384006679058074951171874999999999999999998530632061472140615039079328472192902726668054034890598114060367151978425681591033935546875 and exact-flat at 142.3393809000651089036182384006679058074951171875000000000000000011754943508222875079687365372222456778186655567720875215087517062784172594547271728515625, so this run restores the same shelf anchor and raises only min_score_gain_per_added_move to 142.33938090006510890361823840066790580749511718750000000000000000051427877848475078473632223503473248404566618108778829066007887149680755101144313812255859375 to continue binary-searching that lower edge. The experiment name remains shortened to avoid the filename-too-long failure seen with long autogenerated names.
autoresearch/snapshots/20260419T234449Z_hybrid_p8_m8_w3_g142p339380900065108903618238400667905807495117187500000000000000000183670992315982423120115083940975887159166493245638675235742454106002696789801120758056640625_v1056.py	0.071006	0.799339	0.749250	0.375000	0.020699	discard	Restore the compact props8 + minsep8 hybrid shelf anchored at lwindow3, beam3, top4, boardcands2, secsep1, radius0, drop1, props8, total150, and lmargin9.935836791992188. The latest executed bracket is harmful at 142.3393809000651089036182384006679058074951171874999999999999999998530632061472140615039079328472192902726668054034890598114060367151978425681591033935546875 and exact-flat at 142.33938090006510890361823840066790580749511718750000000000000000051427877848475078473632223503473248404566618108778829066007887149680755101144313812255859375, so this run restores the same shelf anchor and raises only min_score_gain_per_added_move to 142.339380900065108903618238400667905807495117187500000000000000000183670992315982423120115083940975887159166493245638675235742454106002696789801120758056640625 to continue binary-searching that lower edge. The experiment name remains shortened to avoid the filename-too-long failure seen with long autogenerated names.
autoresearch/snapshots/20260419T234556Z_hybrid_p8_m8_w3_g142p3393809000651089036182384006679058074951171875000000000000000000183670992315982423120115083940975887159166493245638675235742454106002696789801120758056640625_v1057.py	0.071006	0.799339	0.749250	0.375000	0.020699	discard	Restore the compact props8 + minsep8 hybrid shelf anchored at lwindow3, beam3, top4, boardcands2, secsep1, radius0, drop1, props8, total150, and lmargin9.935836791992188. The latest executed bracket is harmful at 142.3393809000651089036182384006679058074951171874999999999999999998530632061472140615039079328472192902726668054034890598114060367151978425681591033935546875 and exact-flat at 142.339380900065108903618238400667905807495117187500000000000000000183670992315982423120115083940975887159166493245638675235742454106002696789801120758056640625, so this run restores the same shelf anchor and raises only min_score_gain_per_added_move to 142.3393809000651089036182384006679058074951171875000000000000000000183670992315982423120115083940975887159166493245638675235742454106002696789801120758056640625 to continue binary-searching that lower edge. The experiment name remains shortened to avoid the filename-too-long failure seen with long autogenerated names.
autoresearch/snapshots/20260419T234709Z_hybrid_p8_m8_w3_g142p33938090006510890361823840066790580749511718749999999999999999993571515268940615190795972062065843949429172736402646366749014106289905612356960773468017578125_v1058.py	0.071006	0.789778	0.739821	0.375000	0.024580	discard	Restore the compact props8 + minsep8 hybrid shelf anchored at lwindow3, beam3, top4, boardcands2, secsep1, radius0, drop1, props8, total150, and lmargin9.935836791992188. The latest executed bracket is harmful at 142.3393809000651089036182384006679058074951171874999999999999999998530632061472140615039079328472192902726668054034890598114060367151978425681591033935546875 and exact-flat at 142.3393809000651089036182384006679058074951171875000000000000000000183670992315982423120115083940975887159166493245638675235742454106002696789801120758056640625, so this run restores the same shelf anchor and raises only min_score_gain_per_added_move to 142.33938090006510890361823840066790580749511718749999999999999999993571515268940615190795972062065843949429172736402646366749014106289905612356960773468017578125 to continue binary-searching that lower edge. The experiment name remains shortened to avoid the filename-too-long failure seen with long autogenerated names.
autoresearch/snapshots/20260419T234820Z_hybrid_p8_m8_w3_g142p339380900065108903618238400667905807495117187499999999999999999977041125960502197109985614507378014105104188344295165595532193236749662901274859905242919921875_v1059.py	0.071006	0.789778	0.739821	0.375000	0.024580	discard	Restore the compact props8 + minsep8 hybrid shelf anchored at lwindow3, beam3, top4, boardcands2, secsep1, radius0, drop1, props8, total150, and lmargin9.935836791992188. The latest executed bracket is harmful at 142.33938090006510890361823840066790580749511718749999999999999999993571515268940615190795972062065843949429172736402646366749014106289905612356960773468017578125 and exact-flat at 142.3393809000651089036182384006679058074951171875000000000000000000183670992315982423120115083940975887159166493245638675235742454106002696789801120758056640625, so this run restores the same shelf anchor and raises only min_score_gain_per_added_move to 142.339380900065108903618238400667905807495117187499999999999999999977041125960502197109985614507378014105104188344295165595532193236749662901274859905242919921875 to continue binary-searching that lower edge. The experiment name remains shortened to avoid the filename-too-long failure seen with long autogenerated names.
autoresearch/snapshots/20260419T234929Z_hybrid_p8_m8_w3_g142p339380900065108903618238400667905807495117187499999999999999999977041125960502197109985614507378014105104188344295165595532193236749662901274859905242919921875_v1059.py	0.071006	0.789778	0.739821	0.375000	0.024580	discard	Restore the compact props8 + minsep8 hybrid shelf anchored at lwindow3, beam3, top4, boardcands2, secsep1, radius0, drop1, props8, total150, and lmargin9.935836791992188. The latest executed bracket is harmful at 142.33938090006510890361823840066790580749511718749999999999999999993571515268940615190795972062065843949429172736402646366749014106289905612356960773468017578125 and exact-flat at 142.3393809000651089036182384006679058074951171875000000000000000000183670992315982423120115083940975887159166493245638675235742454106002696789801120758056640625, so this run restores the same shelf anchor and raises only min_score_gain_per_added_move to 142.339380900065108903618238400667905807495117187499999999999999999977041125960502197109985614507378014105104188344295165595532193236749662901274859905242919921875 to continue binary-searching that lower edge. The experiment name remains shortened to avoid the filename-too-long failure seen with long autogenerated names.
autoresearch/snapshots/20260419T235035Z_hybrid_p8_m8_w3_g142p3393809000651089036182384006679058074951171874999999999999999999977041125960502197109985614507378014105104188344295165595532193236749662901274859905242919921875_v1060.py	0.071006	0.789778	0.739821	0.375000	0.024580	discard	Restore the compact props8 + minsep8 hybrid shelf anchored at lwindow3, beam3, top4, boardcands2, secsep1, radius0, drop1, props8, total150, and lmargin9.935836791992188. The latest executed bracket is harmful at 142.339380900065108903618238400667905807495117187499999999999999999977041125960502197109985614507378014105104188344295165595532193236749662901274859905242919921875 and exact-flat at 142.3393809000651089036182384006679058074951171875000000000000000000183670992315982423120115083940975887159166493245638675235742454106002696789801120758056640625, so this run restores the same shelf anchor and raises only min_score_gain_per_added_move to 142.3393809000651089036182384006679058074951171874999999999999999999977041125960502197109985614507378014105104188344295165595532193236749662901274859905242919921875 to continue binary-searching that lower edge. The experiment name remains shortened to avoid the filename-too-long failure seen with long autogenerated names.
autoresearch/snapshots/20260419T235140Z_hybrid_p8_m8_w3_g142p33938090006510890361823840066790580749511718750000000000000000000803560591382423101150503492241769506321353407949669204156373236713761798455379903316497802734375_v1061.py	0.071006	0.799339	0.749250	0.375000	0.020699	discard	Restore the compact props8 + minsep8 hybrid shelf anchored at lwindow3, beam3, top4, boardcands2, secsep1, radius0, drop1, props8, total150, and lmargin9.935836791992188. The latest executed bracket is harmful at 142.3393809000651089036182384006679058074951171874999999999999999999977041125960502197109985614507378014105104188344295165595532193236749662901274859905242919921875 and exact-flat at 142.3393809000651089036182384006679058074951171875000000000000000000183670992315982423120115083940975887159166493245638675235742454106002696789801120758056640625, so this run restores the same shelf anchor and raises only min_score_gain_per_added_move to 142.33938090006510890361823840066790580749511718750000000000000000000803560591382423101150503492241769506321353407949669204156373236713761798455379903316497802734375 to continue binary-searching that lower edge. The experiment name remains shortened to avoid the filename-too-long failure seen with long autogenerated names.
autoresearch/snapshots/20260419T235253Z_hybrid_p8_m8_w3_g142p339380900065108903618238400667905807495117187499999999999999999992538365937163214060745324714897854584158861211895928818547962801943640442914329469203948974609375_v1062.py	0.071006	0.789778	0.739821	0.375000	0.024580	discard	Restore the compact props8 + minsep8 hybrid shelf anchored at lwindow3, beam3, top4, boardcands2, secsep1, radius0, drop1, props8, total150, and lmargin9.935836791992188. The latest executed bracket is harmful at 142.339380900065108903618238400667905807495117187499999999999999999977041125960502197109985614507378014105104188344295165595532193236749662901274859905242919921875 and exact-flat at 142.33938090006510890361823840066790580749511718750000000000000000000803560591382423101150503492241769506321353407949669204156373236713761798455379903316497802734375, so this run restores the same shelf anchor and raises only min_score_gain_per_added_move to 142.339380900065108903618238400667905807495117187499999999999999999992538365937163214060745324714897854584158861211895928818547962801943640442914329469203948974609375 to continue binary-searching that lower edge. The experiment name remains shortened to avoid the filename-too-long failure seen with long autogenerated names.
autoresearch/snapshots/20260419T235359Z_hybrid_p8_m8_w3_g142p3393809000651089036182384006679058074951171875000000000000000000002869859254937225361251798186577748236861976456963104300558475845406292137340642511844635009765625_v1063.py	0.071006	0.799339	0.749250	0.375000	0.020699	discard	Restore the compact props8 + minsep8 hybrid shelf anchored at lwindow3, beam3, top4, boardcands2, secsep1, radius0, drop1, props8, total150, and lmargin9.935836791992188. The latest executed bracket is harmful at 142.339380900065108903618238400667905807495117187499999999999999999992538365937163214060745324714897854584158861211895928818547962801943640442914329469203948974609375 and exact-flat at 142.33938090006510890361823840066790580749511718750000000000000000000803560591382423101150503492241769506321353407949669204156373236713761798455379903316497802734375, so this run restores the same shelf anchor and raises only min_score_gain_per_added_move to 142.3393809000651089036182384006679058074951171875000000000000000000002869859254937225361251798186577748236861976456963104300558475845406292137340642511844635009765625 to continue binary-searching that lower edge. The experiment name remains shortened to avoid the filename-too-long failure seen with long autogenerated names.
