snapshot	board_exact	non_empty_accuracy	macro_f1	move_recall	false_change_rate	status	description
autoresearch/snapshots/20260419T042126Z_hybrid_lookahead_segmental_drop0_boardcands4_ratio95_props14_top4_detect10_lwindow1_minsep4_thresh3_total150_permove125_lmargin9p5_m9p8957061767578125_r0_beam4_v503.py	0.074556	0.795101	0.755456	0.218750	0.012937	discard	Hybrid decoder keeps the baseline lookahead path unless a conservative board-only segmental pass wins the current score-gain gates, while following up the kept window1 branch after lowering lookahead window from 2 to 1 on the 9.5-margin baseline opened a lower-false-change but lower-recall tradeoff, lowering only max_event_proposals from 16 to 15 on the restored plain window1 branch improved recall and secondary metrics but worsened false-change, additionally narrowing top-board breadth from 4 to 3 recovered the lower false-change without hurting recall, lowering only max_event_proposals one step further from 15 to 14 on that boardcands3 plain props branch kept that recovered tradeoff, follow-up props14 probes showed top1 through top13 were exact no-ops while top14 and above reopened the worse false-change regime, boardcands3 was the local board-width sweet spot, beam5 through beam7 were exact no-ops while beam3 and beam8 were worse, event_window_radius=1 was an exact no-op, and lowering segment_board_drop_worst_frames from 1 to 0 on that stronger props14 branch produced a new kept low-noise / lower-recall tradeoff, and lowering top-board breadth from 3 to 2 on that new drop0 + props14 branch weakened secondaries without improving the main tradeoff, and restoring only top-board breadth from 3 back to 4 on the new drop0 + props14 branch to test whether the low-noise branch sits on a 3..4 board-width plateau or whether boardcands3 is uniquely best there.
autoresearch/snapshots/20260419T042219Z_hybrid_lookahead_segmental_drop0_boardcands1_ratio95_props14_top4_detect10_lwindow1_minsep4_thresh3_total150_permove125_lmargin9p5_m9p8957061767578125_r0_beam4_v504.py	0.074556	0.747662	0.691863	0.250000	0.020699	discard	Hybrid decoder keeps the baseline lookahead path unless a conservative board-only segmental pass wins the current score-gain gates, while following up the kept window1 branch after lowering lookahead window from 2 to 1 on the 9.5-margin baseline opened a lower-false-change but lower-recall tradeoff, lowering only max_event_proposals from 16 to 15 on the restored plain window1 branch improved recall and secondary metrics but worsened false-change, additionally narrowing top-board breadth from 4 to 3 recovered the lower false-change without hurting recall, lowering only max_event_proposals one step further from 15 to 14 on that boardcands3 plain props branch kept that recovered tradeoff, follow-up props14 probes showed top1 through top13 were exact no-ops while top14 and above reopened the worse false-change regime, boardcands3 was the local board-width sweet spot, beam5 through beam7 were exact no-ops while beam3 and beam8 were worse, event_window_radius=1 was an exact no-op, and lowering segment_board_drop_worst_frames from 1 to 0 on that stronger props14 branch produced a new kept low-noise / lower-recall tradeoff, and follow-up board-width probes showed boardcands2 weakened secondaries while boardcands4 was an exact no-op, and lowering only top-board breadth from 3 to 1 on that new drop0 + props14 branch to complete the local board-width curve and test whether boardcands3 is uniquely best or whether boardcands1 changes the recall/noise tradeoff again.
autoresearch/snapshots/20260419T042317Z_hybrid_lookahead_segmental_drop0_boardcands3_ratio95_props15_top4_detect10_lwindow1_minsep4_thresh3_total150_permove125_lmargin9p5_m9p8957061767578125_r0_beam4_v505.py	0.074556	0.761201	0.714266	0.265625	0.023286	discard	Hybrid decoder keeps the baseline lookahead path unless a conservative board-only segmental pass wins the current score-gain gates, while following up the kept window1 branch after lowering lookahead window from 2 to 1 on the 9.5-margin baseline opened a lower-false-change but lower-recall tradeoff, lowering only max_event_proposals from 16 to 15 on the restored plain window1 branch improved recall and secondary metrics but worsened false-change, additionally narrowing top-board breadth from 4 to 3 recovered the lower false-change without hurting recall, lowering only max_event_proposals one step further from 15 to 14 on that boardcands3 plain props branch kept that recovered tradeoff, follow-up props14 probes showed top1 through top13 were exact no-ops while top14 and above reopened the worse false-change regime, boardcands3 was the local board-width sweet spot, beam5 through beam7 were exact no-ops while beam3 and beam8 were worse, event_window_radius=1 was an exact no-op, and lowering segment_board_drop_worst_frames from 1 to 0 on that stronger props14 branch produced a new kept low-noise / lower-recall tradeoff whose board-width curve favored boardcands3/4 over 2 and 1, and raising only max_event_proposals from 14 back to 15 on that new drop0 + boardcands3 branch to test whether some recall can be recovered without giving back all of the low-noise gain.
autoresearch/snapshots/20260419T042420Z_hybrid_lookahead_segmental_drop0_boardcands3_ratio95_props14_top1_detect10_lwindow1_minsep4_thresh3_total150_permove125_lmargin9p5_m9p8957061767578125_r0_beam4_v506.py	0.074556	0.795101	0.755456	0.218750	0.012937	discard	Hybrid decoder keeps the baseline lookahead path unless a conservative board-only segmental pass wins the current score-gain gates, while following up the kept window1 branch after lowering lookahead window from 2 to 1 on the 9.5-margin baseline opened a lower-false-change but lower-recall tradeoff, lowering only max_event_proposals from 16 to 15 on the restored plain window1 branch improved recall and secondary metrics but worsened false-change, additionally narrowing top-board breadth from 4 to 3 recovered the lower false-change without hurting recall, lowering only max_event_proposals one step further from 15 to 14 on that boardcands3 plain props branch kept that recovered tradeoff, follow-up props14 probes showed top1 through top13 were exact no-ops while top14 and above reopened the worse false-change regime, boardcands3 was the local board-width sweet spot, beam5 through beam7 were exact no-ops while beam3 and beam8 were worse, event_window_radius=1 was an exact no-op, and lowering segment_board_drop_worst_frames from 1 to 0 on that stronger props14 branch produced a new kept low-noise / lower-recall tradeoff whose board-width curve favored boardcands3/4 over 2 and 1, and lowering only top-move breadth from 4 to 1 on that new drop0 + props14 branch to test whether the low-noise branch still sits on the same move-width plateau or depends on the wider move menu.
autoresearch/snapshots/20260419T042516Z_hybrid_lookahead_segmental_drop0_boardcands3_ratio95_props14_top4_detect10_lwindow1_minsep4_thresh3_total150_permove125_lmargin9p5_m9p8957061767578125_r0_beam5_v507.py	0.074556	0.767402	0.725607	0.250000	0.021992	discard	Hybrid decoder keeps the baseline lookahead path unless a conservative board-only segmental pass wins the current score-gain gates, while following up the kept window1 branch after lowering lookahead window from 2 to 1 on the 9.5-margin baseline opened a lower-false-change but lower-recall tradeoff, lowering only max_event_proposals from 16 to 15 on the restored plain window1 branch improved recall and secondary metrics but worsened false-change, additionally narrowing top-board breadth from 4 to 3 recovered the lower false-change without hurting recall, lowering only max_event_proposals one step further from 15 to 14 on that boardcands3 plain props branch kept that recovered tradeoff, follow-up props14 probes showed top1 through top13 were exact no-ops while top14 and above reopened the worse false-change regime, boardcands3 was the local board-width sweet spot, beam5 through beam7 were exact no-ops while beam3 and beam8 were worse, event_window_radius=1 was an exact no-op, and lowering segment_board_drop_worst_frames from 1 to 0 on that stronger props14 branch produced a new kept low-noise / lower-recall tradeoff whose board-width curve favored boardcands3/4 over 2 and 1 and whose top1 probe was an exact no-op, and raising only beam size from 4 to 5 on that new drop0 + props14 branch to test whether the low-noise branch still sits on the same upper-beam plateau as the parent branch or whether it depends more sharply on beam4.
autoresearch/snapshots/20260419T042615Z_hybrid_lookahead_segmental_drop0_boardcands3_ratio95_props14_top4_detect10_lwindow1_minsep4_thresh3_total150_permove125_lmargin9p5_m9p8957061767578125_r0_beam3_v508.py	0.074556	0.815617	0.784735	0.203125	0.014230	discard	Hybrid decoder keeps the baseline lookahead path unless a conservative board-only segmental pass wins the current score-gain gates, while following up the kept window1 branch after lowering lookahead window from 2 to 1 on the 9.5-margin baseline opened a lower-false-change but lower-recall tradeoff, lowering only max_event_proposals from 16 to 15 on the restored plain window1 branch improved recall and secondary metrics but worsened false-change, additionally narrowing top-board breadth from 4 to 3 recovered the lower false-change without hurting recall, lowering only max_event_proposals one step further from 15 to 14 on that boardcands3 plain props branch kept that recovered tradeoff, follow-up props14 probes showed top1 through top13 were exact no-ops while top14 and above reopened the worse false-change regime, boardcands3 was the local board-width sweet spot, beam5 through beam7 were exact no-ops while beam3 and beam8 were worse, event_window_radius=1 was an exact no-op, and lowering segment_board_drop_worst_frames from 1 to 0 on that stronger props14 branch produced a new kept low-noise / lower-recall tradeoff whose board-width curve favored boardcands3/4 over 2 and 1, whose top1 probe was an exact no-op, and whose beam5 follow-up was worse, and lowering only beam size from 4 to 3 on that new drop0 + props14 branch to test whether beam4 is a sharp local optimum there or whether the low-noise tradeoff survives at a cheaper beam.
autoresearch/snapshots/20260419T042710Z_hybrid_lookahead_segmental_drop0_boardcands3_ratio95_props14_top4_detect10_lwindow1_minsep4_thresh3_total150_permove125_lmargin9p5_m9p8957061767578125_r1_beam4_v509.py	0.074556	0.795101	0.755456	0.218750	0.012937	discard	Hybrid decoder keeps the baseline lookahead path unless a conservative board-only segmental pass wins the current score-gain gates, while following up the kept window1 branch after lowering lookahead window from 2 to 1 on the 9.5-margin baseline opened a lower-false-change but lower-recall tradeoff, lowering only max_event_proposals from 16 to 15 on the restored plain window1 branch improved recall and secondary metrics but worsened false-change, additionally narrowing top-board breadth from 4 to 3 recovered the lower false-change without hurting recall, lowering only max_event_proposals one step further from 15 to 14 on that boardcands3 plain props branch kept that recovered tradeoff, follow-up props14 probes showed top1 through top13 were exact no-ops while top14 and above reopened the worse false-change regime, boardcands3 was the local board-width sweet spot, beam5 through beam7 were exact no-ops while beam3 and beam8 were worse, and lowering segment_board_drop_worst_frames from 1 to 0 on that stronger props14 branch produced a new kept low-noise / lower-recall tradeoff whose board-width curve favored boardcands3/4 over 2 and 1, whose top1 probe was an exact no-op, and whose beam3/5 probes were both worse, and adding only segmental event_window_radius=1 on that new drop0 + props14 branch to test whether a little extra local temporal context changes the new low-noise tradeoff.
autoresearch/snapshots/20260419T042811Z_hybrid_lookahead_segmental_drop0_boardcands3_ratio95_props14_top4_detect10_lwindow1_minsep4_secsep3_thresh3_total150_permove125_lmargin9p5_m9p8957061767578125_r0_beam4_v510.py	0.074556	0.790088	0.748289	0.234375	0.014230	discard	Hybrid decoder keeps the baseline lookahead path unless a conservative board-only segmental pass wins the current score-gain gates, while following up the kept window1 branch after lowering lookahead window from 2 to 1 on the 9.5-margin baseline opened a lower-false-change but lower-recall tradeoff, lowering only max_event_proposals from 16 to 15 on the restored plain window1 branch improved recall and secondary metrics but worsened false-change, additionally narrowing top-board breadth from 4 to 3 recovered the lower false-change without hurting recall, lowering only max_event_proposals one step further from 15 to 14 on that boardcands3 plain props branch kept that recovered tradeoff, follow-up props14 probes showed top1 through top13 were exact no-ops while top14 and above reopened the worse false-change regime, boardcands3 was the local board-width sweet spot, beam5 through beam7 were exact no-ops while beam3 and beam8 were worse, event_window_radius=1 was an exact no-op, and lowering segment_board_drop_worst_frames from 1 to 0 on that stronger props14 branch produced a new kept low-noise / lower-recall tradeoff whose board-width curve favored boardcands3/4 over 2 and 1, whose top1 probe was an exact no-op, and whose beam3/5 probes were both worse, and raising only secondary minimum event separation from 2 to 3 on that new drop0 + props14 branch to test whether the old secsep3 shelf changes the low-noise tradeoff in a useful way.
autoresearch/snapshots/20260419T042932Z_hybrid_lookahead_segmental_drop0_boardcands4_ratio95_props14_top4_detect10_lwindow1_minsep4_secsep3_thresh3_total150_permove125_lmargin9p5_m9p8957061767578125_r0_beam4_v511.py	0.074556	0.790088	0.748289	0.234375	0.014230	discard	Hybrid decoder keeps the baseline lookahead path unless a conservative board-only segmental pass wins the current score-gain gates, while following up the kept window1 branch after lowering lookahead window from 2 to 1 on the 9.5-margin baseline opened a lower-false-change but lower-recall tradeoff, lowering only max_event_proposals from 16 to 15 on the restored plain window1 branch improved recall and secondary metrics but worsened false-change, additionally narrowing top-board breadth from 4 to 3 recovered the lower false-change without hurting recall, lowering only max_event_proposals one step further from 15 to 14 on that boardcands3 plain props branch kept that recovered tradeoff, follow-up props14 probes showed top1 through top13 were exact no-ops while top14 and above reopened the worse false-change regime, boardcands3 was the local board-width sweet spot, beam5 through beam7 were exact no-ops while beam3 and beam8 were worse, event_window_radius=1 was an exact no-op, and lowering segment_board_drop_worst_frames from 1 to 0 on that stronger props14 branch produced a new kept low-noise / lower-recall tradeoff whose board-width curve favored boardcands3/4 over 2 and 1, and raising only secondary minimum event separation from 2 to 3 on that new drop0 + props14 branch created a recall-recovering but noisier tradeoff at boardcands3, and restoring only top-board breadth from 3 back to 4 on that secsep3 drop0 branch to test whether the new low-noise secsep3 tradeoff still prefers boardcands3 or falls onto a 3..4 plateau.
autoresearch/snapshots/20260419T043032Z_hybrid_lookahead_segmental_drop0_boardcands2_ratio95_props14_top4_detect10_lwindow1_minsep4_secsep3_thresh3_total150_permove125_lmargin9p5_m9p8957061767578125_r0_beam4_v512.py	0.074556	0.787866	0.745631	0.218750	0.012937	discard	Hybrid decoder keeps the baseline lookahead path unless a conservative board-only segmental pass wins the current score-gain gates, while following up the kept window1 branch after lowering lookahead window from 2 to 1 on the 9.5-margin baseline opened a lower-false-change but lower-recall tradeoff, lowering only max_event_proposals from 16 to 15 on the restored plain window1 branch improved recall and secondary metrics but worsened false-change, additionally narrowing top-board breadth from 4 to 3 recovered the lower false-change without hurting recall, lowering only max_event_proposals one step further from 15 to 14 on that boardcands3 plain props branch kept that recovered tradeoff, follow-up props14 probes showed top1 through top13 were exact no-ops while top14 and above reopened the worse false-change regime, boardcands3 was the local board-width sweet spot, beam5 through beam7 were exact no-ops while beam3 and beam8 were worse, event_window_radius=1 was an exact no-op, and lowering segment_board_drop_worst_frames from 1 to 0 on that stronger props14 branch produced a new kept low-noise / lower-recall tradeoff, and raising secondary minimum event separation from 2 to 3 on that drop0 branch created a recall-recovering but noisier tradeoff at boardcands3 while restoring boardcands4 was an exact no-op, and lowering only top-board breadth from 3 to 2 on that secsep3 drop0 branch to test whether the recall-recovering tradeoff still holds below the 3..4 plateau or whether secondaries collapse there too.
autoresearch/snapshots/20260419T043126Z_hybrid_lookahead_segmental_drop0_boardcands1_ratio95_props14_top4_detect10_lwindow1_minsep4_secsep3_thresh3_total150_permove125_lmargin9p5_m9p8957061767578125_r0_beam4_v513.py	0.074556	0.747662	0.692692	0.250000	0.023286	discard	Hybrid decoder keeps the baseline lookahead path unless a conservative board-only segmental pass wins the current score-gain gates, while following up the kept window1 branch after lowering lookahead window from 2 to 1 on the 9.5-margin baseline opened a lower-false-change but lower-recall tradeoff, lowering only max_event_proposals from 16 to 15 on the restored plain window1 branch improved recall and secondary metrics but worsened false-change, additionally narrowing top-board breadth from 4 to 3 recovered the lower false-change without hurting recall, lowering only max_event_proposals one step further from 15 to 14 on that boardcands3 plain props branch kept that recovered tradeoff, follow-up props14 probes showed top1 through top13 were exact no-ops while top14 and above reopened the worse false-change regime, boardcands3 was the local board-width sweet spot, beam5 through beam7 were exact no-ops while beam3 and beam8 were worse, event_window_radius=1 was an exact no-op, and lowering segment_board_drop_worst_frames from 1 to 0 on that stronger props14 branch produced a new kept low-noise / lower-recall tradeoff, and raising secondary minimum event separation from 2 to 3 on that drop0 branch created a recall-recovering but noisier tradeoff whose board-width surface stayed exact at boardcands4 and weakened at boardcands2, and lowering only top-board breadth from 3 to 1 on that secsep3 drop0 branch to complete the local board-width curve and test whether the recall-recovering tradeoff collapses there too.
autoresearch/snapshots/20260419T043249Z_hybrid_lookahead_segmental_drop0_boardcands3_ratio95_props14_top4_detect10_lwindow1_minsep4_secsep3_thresh3_total150_permove125_lmargin9p5_m9p8957061767578125_r0_beam5_v514.py	0.074556	0.763785	0.720787	0.265625	0.023286	discard	Hybrid decoder keeps the baseline lookahead path unless a conservative board-only segmental pass wins the current score-gain gates, while following up the kept window1 branch after lowering lookahead window from 2 to 1 on the 9.5-margin baseline opened a lower-false-change but lower-recall tradeoff, lowering only max_event_proposals from 16 to 15 on the restored plain window1 branch improved recall and secondary metrics but worsened false-change, additionally narrowing top-board breadth from 4 to 3 recovered the lower false-change without hurting recall, lowering only max_event_proposals one step further from 15 to 14 on that boardcands3 plain props branch kept that recovered tradeoff, follow-up props14 probes showed top1 through top13 were exact no-ops while top14 and above reopened the worse false-change regime, boardcands3 was the local board-width sweet spot, beam5 through beam7 were exact no-ops while beam3 and beam8 were worse, event_window_radius=1 was an exact no-op, and lowering segment_board_drop_worst_frames from 1 to 0 on that stronger props14 branch produced a new kept low-noise / lower-recall tradeoff, and raising secondary minimum event separation from 2 to 3 on that drop0 branch created a recall-recovering but noisier tradeoff whose board-width curve favored boardcands3/4 over 2 and 1, and raising only beam size from 4 to 5 on that secsep3 drop0 branch to test whether the recall-recovering tradeoff still depends on beam4 or extends onto an upper-beam plateau.
