snapshot	board_exact	non_empty_accuracy	macro_f1	move_recall	false_change_rate	status	description
autoresearch/snapshots/20260419T225352Z_hybrid_p8_m8_w3_g142p33938090006510890361823840066790580749511718750000000000862816615085481662169078118278047438705069538400493911467492580413818359375_v1031.py	0.071006	0.799339	0.749250	0.375000	0.020699	discard	Restore the compact props8 + minsep8 hybrid shelf anchored at lwindow3, beam3, top4, boardcands2, secsep1, radius0, drop1, props8, total150, and lmargin9.935836791992188. The latest executed bracket is harmful at 142.3393809000651089036182384006679058074951171874999999999975348096711843381080883482334912930322712298902843031100928783416748046875 and exact-flat at 142.3393809000651089036182384006679058074951171875000000000197215226305252951352932141320696557418301608777255751192569732666015625, so this run restores the same shelf anchor and raises only min_score_gain_per_added_move to 142.33938090006510890361823840066790580749511718750000000000862816615085481662169078118278047438705069538400493911467492580413818359375 to continue binary-searching that lower edge. The experiment name remains shortened to avoid the filename-too-long failure seen with long autogenerated names.
autoresearch/snapshots/20260419T225608Z_hybrid_p8_m8_w3_g142p339380900065108903618238400667905807495117187500000000003081487911019577364889564708135883709660962637144621112383902072906494140625_v1032.py	0.071006	0.799339	0.749250	0.375000	0.020699	discard	Restore the compact props8 + minsep8 hybrid shelf anchored at lwindow3, beam3, top4, boardcands2, secsep1, radius0, drop1, props8, total150, and lmargin9.935836791992188. The latest executed bracket is harmful at 142.3393809000651089036182384006679058074951171874999999999975348096711843381080883482334912930322712298902843031100928783416748046875 and exact-flat at 142.33938090006510890361823840066790580749511718750000000000862816615085481662169078118278047438705069538400493911467492580413818359375, so this run restores the same shelf anchor and raises only min_score_gain_per_added_move to 142.339380900065108903618238400667905807495117187500000000003081487911019577364889564708135883709660962637144621112383902072906494140625 to continue binary-searching that lower edge. The experiment name remains shortened to avoid the filename-too-long failure seen with long autogenerated names.
autoresearch/snapshots/20260419T225836Z_hybrid_p8_m8_w3_g142p3393809000651089036182384006679058074951171875000000000003081487911019577364889564708135883709660962637144621112383902072906494140625_v1033.py	0.071006	0.799339	0.749250	0.375000	0.020699	discard	Restore the compact props8 + minsep8 hybrid shelf anchored at lwindow3, beam3, top4, boardcands2, secsep1, radius0, drop1, props8, total150, and lmargin9.935836791992188. The latest executed bracket is harmful at 142.3393809000651089036182384006679058074951171874999999999975348096711843381080883482334912930322712298902843031100928783416748046875 and exact-flat at 142.339380900065108903618238400667905807495117187500000000003081487911019577364889564708135883709660962637144621112383902072906494140625, so this run restores the same shelf anchor and raises only min_score_gain_per_added_move to 142.3393809000651089036182384006679058074951171875000000000003081487911019577364889564708135883709660962637144621112383902072906494140625 to continue binary-searching that lower edge. The experiment name remains shortened to avoid the filename-too-long failure seen with long autogenerated names.
autoresearch/snapshots/20260419T230058Z_hybrid_p8_m8_w3_g142p33938090006510890361823840066790580749511718749999999999892147923114314792228865235215244070161866307699938261066563427448272705078125_v1034.py	0.071006	0.789778	0.739821	0.375000	0.024580	discard	Restore the compact props8 + minsep8 hybrid shelf anchored at lwindow3, beam3, top4, boardcands2, secsep1, radius0, drop1, props8, total150, and lmargin9.935836791992188. The latest executed bracket is harmful at 142.3393809000651089036182384006679058074951171874999999999975348096711843381080883482334912930322712298902843031100928783416748046875 and exact-flat at 142.3393809000651089036182384006679058074951171875000000000003081487911019577364889564708135883709660962637144621112383902072906494140625, so this run restores the same shelf anchor and raises only min_score_gain_per_added_move to 142.33938090006510890361823840066790580749511718749999999999892147923114314792228865235215244070161866307699938261066563427448272705078125 to continue binary-searching that lower edge. The experiment name remains shortened to avoid the filename-too-long failure seen with long autogenerated names.
autoresearch/snapshots/20260419T230319Z_hybrid_p8_m8_w3_g142p339380900065108903618238400667905807495117187499999999999614814011122552829388804411483014536292379670356922360952012240886688232421875_v1035.py	0.071006	0.789778	0.739821	0.375000	0.024580	discard	Restore the compact props8 + minsep8 hybrid shelf anchored at lwindow3, beam3, top4, boardcands2, secsep1, radius0, drop1, props8, total150, and lmargin9.935836791992188. The latest executed bracket is harmful at 142.33938090006510890361823840066790580749511718749999999999892147923114314792228865235215244070161866307699938261066563427448272705078125 and exact-flat at 142.3393809000651089036182384006679058074951171875000000000003081487911019577364889564708135883709660962637144621112383902072906494140625, so this run restores the same shelf anchor and raises only min_score_gain_per_added_move to 142.339380900065108903618238400667905807495117187499999999999614814011122552829388804411483014536292379670356922360952012240886688232421875 to continue binary-searching that lower edge. The experiment name remains shortened to avoid the filename-too-long failure seen with long autogenerated names.
autoresearch/snapshots/20260419T230545Z_hybrid_p8_m8_w3_g142p3393809000651089036182384006679058074951171874999999999999614814011122552829388804411483014536292379670356922360952012240886688232421875_v1036.py	0.071006	0.789778	0.739821	0.375000	0.024580	discard	Restore the compact props8 + minsep8 hybrid shelf anchored at lwindow3, beam3, top4, boardcands2, secsep1, radius0, drop1, props8, total150, and lmargin9.935836791992188. The latest executed bracket is harmful at 142.339380900065108903618238400667905807495117187499999999999614814011122552829388804411483014536292379670356922360952012240886688232421875 and exact-flat at 142.3393809000651089036182384006679058074951171875000000000003081487911019577364889564708135883709660962637144621112383902072906494140625, so this run restores the same shelf anchor and raises only min_score_gain_per_added_move to 142.3393809000651089036182384006679058074951171874999999999999614814011122552829388804411483014536292379670356922360952012240886688232421875 to continue binary-searching that lower edge. The experiment name remains shortened to avoid the filename-too-long failure seen with long autogenerated names.
autoresearch/snapshots/20260419T230804Z_hybrid_p8_m8_w3_g142p33938090006510890361823840066790580749511718750000000000013481509610710650971391845598094491229766711537507717366679571568965911865234375_v1037.py	0.071006	0.799339	0.749250	0.375000	0.020699	discard	Restore the compact props8 + minsep8 hybrid shelf anchored at lwindow3, beam3, top4, boardcands2, secsep1, radius0, drop1, props8, total150, and lmargin9.935836791992188. The latest executed bracket is harmful at 142.3393809000651089036182384006679058074951171874999999999999614814011122552829388804411483014536292379670356922360952012240886688232421875 and exact-flat at 142.3393809000651089036182384006679058074951171875000000000003081487911019577364889564708135883709660962637144621112383902072906494140625, so this run restores the same shelf anchor and raises only min_score_gain_per_added_move to 142.33938090006510890361823840066790580749511718750000000000013481509610710650971391845598094491229766711537507717366679571568965911865234375 to continue binary-searching that lower edge. The experiment name remains shortened to avoid the filename-too-long failure seen with long autogenerated names.
autoresearch/snapshots/20260419T231028Z_hybrid_p8_m8_w3_g142p339380900065108903618238400667905807495117187500000000000048148248609680896326399448564623182963452541205384704880998469889163970947265625_v1038.py	0.071006	0.799339	0.749250	0.375000	0.020699	discard	Restore the compact props8 + minsep8 hybrid shelf anchored at lwindow3, beam3, top4, boardcands2, secsep1, radius0, drop1, props8, total150, and lmargin9.935836791992188. The latest executed bracket is harmful at 142.3393809000651089036182384006679058074951171874999999999999614814011122552829388804411483014536292379670356922360952012240886688232421875 and exact-flat at 142.33938090006510890361823840066790580749511718750000000000013481509610710650971391845598094491229766711537507717366679571568965911865234375, so this run restores the same shelf anchor and raises only min_score_gain_per_added_move to 142.339380900065108903618238400667905807495117187500000000000048148248609680896326399448564623182963452541205384704880998469889163970947265625 to continue binary-searching that lower edge. The experiment name remains shortened to avoid the filename-too-long failure seen with long autogenerated names.
autoresearch/snapshots/20260419T231252Z_hybrid_p8_m8_w3_g142p3393809000651089036182384006679058074951171875000000000000048148248609680896326399448564623182963452541205384704880998469889163970947265625_v1039.py	0.071006	0.799339	0.749250	0.375000	0.020699	discard	Restore the compact props8 + minsep8 hybrid shelf anchored at lwindow3, beam3, top4, boardcands2, secsep1, radius0, drop1, props8, total150, and lmargin9.935836791992188. The latest executed bracket is harmful at 142.3393809000651089036182384006679058074951171874999999999999614814011122552829388804411483014536292379670356922360952012240886688232421875 and exact-flat at 142.339380900065108903618238400667905807495117187500000000000048148248609680896326399448564623182963452541205384704880998469889163970947265625, so this run restores the same shelf anchor and raises only min_score_gain_per_added_move to 142.3393809000651089036182384006679058074951171875000000000000048148248609680896326399448564623182963452541205384704880998469889163970947265625 to continue binary-searching that lower edge. The experiment name remains shortened to avoid the filename-too-long failure seen with long autogenerated names.
autoresearch/snapshots/20260419T231531Z_hybrid_p8_m8_w3_g142p3393809000651089036182384006679058074951171875000000000000048148248609680896326399448564623182963452541205384704880998469889163970947265625_v1039.py	0.071006	0.799339	0.749250	0.375000	0.020699	discard	Restore the compact props8 + minsep8 hybrid shelf anchored at lwindow3, beam3, top4, boardcands2, secsep1, radius0, drop1, props8, total150, and lmargin9.935836791992188. The latest executed bracket is harmful at 142.3393809000651089036182384006679058074951171874999999999999614814011122552829388804411483014536292379670356922360952012240886688232421875 and exact-flat at 142.339380900065108903618238400667905807495117187500000000000048148248609680896326399448564623182963452541205384704880998469889163970947265625, so this run restores the same shelf anchor and raises only min_score_gain_per_added_move to 142.3393809000651089036182384006679058074951171875000000000000048148248609680896326399448564623182963452541205384704880998469889163970947265625 to continue binary-searching that lower edge. The experiment name remains shortened to avoid the filename-too-long failure seen with long autogenerated names.
autoresearch/snapshots/20260419T231755Z_hybrid_p8_m8_w3_g142p33938090006510890361823840066790580749511718749999999999998314811298661168628576019300238188596279161057811535329165053553879261016845703125_v1040.py	0.071006	0.789778	0.739821	0.375000	0.024580	discard	Restore the compact props8 + minsep8 hybrid shelf anchored at lwindow3, beam3, top4, boardcands2, secsep1, radius0, drop1, props8, total150, and lmargin9.935836791992188. The latest executed bracket is harmful at 142.3393809000651089036182384006679058074951171874999999999999614814011122552829388804411483014536292379670356922360952012240886688232421875 and exact-flat at 142.3393809000651089036182384006679058074951171875000000000000048148248609680896326399448564623182963452541205384704880998469889163970947265625, so this run restores the same shelf anchor and raises only min_score_gain_per_added_move to 142.33938090006510890361823840066790580749511718749999999999998314811298661168628576019300238188596279161057811535329165053553879261016845703125 to continue binary-searching that lower edge. The experiment name remains shortened to avoid the filename-too-long failure seen with long autogenerated names.
autoresearch/snapshots/20260419T232023Z_hybrid_p8_m8_w3_g142p339380900065108903618238400667905807495117187499999999999993981468923789887959200068929422102129568432349326911889875191263854503631591796875_v1041.py	0.071006	0.789778	0.739821	0.375000	0.024580	discard	Restore the compact props8 + minsep8 hybrid shelf anchored at lwindow3, beam3, top4, boardcands2, secsep1, radius0, drop1, props8, total150, and lmargin9.935836791992188. The latest executed bracket is harmful at 142.33938090006510890361823840066790580749511718749999999999998314811298661168628576019300238188596279161057811535329165053553879261016845703125 and exact-flat at 142.3393809000651089036182384006679058074951171875000000000000048148248609680896326399448564623182963452541205384704880998469889163970947265625, so this run restores the same shelf anchor and raises only min_score_gain_per_added_move to 142.339380900065108903618238400667905807495117187499999999999993981468923789887959200068929422102129568432349326911889875191263854503631591796875 to continue binary-searching that lower edge. The experiment name remains shortened to avoid the filename-too-long failure seen with long autogenerated names.
autoresearch/snapshots/20260419T232252Z_hybrid_p8_m8_w3_g142p3393809000651089036182384006679058074951171874999999999999993981468923789887959200068929422102129568432349326911889875191263854503631591796875_v1042.py	0.071006	0.789778	0.739821	0.375000	0.024580	discard	Restore the compact props8 + minsep8 hybrid shelf anchored at lwindow3, beam3, top4, boardcands2, secsep1, radius0, drop1, props8, total150, and lmargin9.935836791992188. The latest executed bracket is harmful at 142.339380900065108903618238400667905807495117187499999999999993981468923789887959200068929422102129568432349326911889875191263854503631591796875 and exact-flat at 142.3393809000651089036182384006679058074951171875000000000000048148248609680896326399448564623182963452541205384704880998469889163970947265625, so this run restores the same shelf anchor and raises only min_score_gain_per_added_move to 142.3393809000651089036182384006679058074951171874999999999999993981468923789887959200068929422102129568432349326911889875191263854503631591796875 to continue binary-searching that lower edge. The experiment name remains shortened to avoid the filename-too-long failure seen with long autogenerated names.
autoresearch/snapshots/20260419T232519Z_hybrid_p8_m8_w3_g142p33938090006510890361823840066790580749511718750000000000000210648587667353921427997587470226425465104867773558083854368305765092372894287109375_v1043.py	0.071006	0.799339	0.749250	0.375000	0.020699	discard	Restore the compact props8 + minsep8 hybrid shelf anchored at lwindow3, beam3, top4, boardcands2, secsep1, radius0, drop1, props8, total150, and lmargin9.935836791992188. The latest executed bracket is harmful at 142.3393809000651089036182384006679058074951171874999999999999993981468923789887959200068929422102129568432349326911889875191263854503631591796875 and exact-flat at 142.3393809000651089036182384006679058074951171875000000000000048148248609680896326399448564623182963452541205384704880998469889163970947265625, so this run restores the same shelf anchor and raises only min_score_gain_per_added_move to 142.33938090006510890361823840066790580749511718750000000000000210648587667353921427997587470226425465104867773558083854368305765092372894287109375 to continue binary-searching that lower edge. The experiment name remains shortened to avoid the filename-too-long failure seen with long autogenerated names.
autoresearch/snapshots/20260419T233142Z_hybrid_p8_m8_w3_g142p339380900065108903618238400667905807495117187500000000000000752316384526264005099991383822237233803945956334136013765601092018187046051025390625_v1044.py	0.071006	0.799339	0.749250	0.375000	0.020699	discard	Restore the compact props8 + minsep8 hybrid shelf anchored at lwindow3, beam3, top4, boardcands2, secsep1, radius0, drop1, props8, total150, and lmargin9.935836791992188. The latest executed bracket is harmful at 142.3393809000651089036182384006679058074951171874999999999999993981468923789887959200068929422102129568432349326911889875191263854503631591796875 and exact-flat at 142.33938090006510890361823840066790580749511718750000000000000210648587667353921427997587470226425465104867773558083854368305765092372894287109375, so this run restores the same shelf anchor and raises only min_score_gain_per_added_move to 142.339380900065108903618238400667905807495117187500000000000000752316384526264005099991383822237233803945956334136013765601092018187046051025390625 to continue binary-searching that lower edge. The experiment name remains shortened to avoid the filename-too-long failure seen with long autogenerated names.
autoresearch/snapshots/20260419T233248Z_hybrid_p8_m8_w3_g142p3393809000651089036182384006679058074951171875000000000000000752316384526264005099991383822237233803945956334136013765601092018187046051025390625_v1045.py	0.071006	0.799339	0.749250	0.375000	0.020699	discard	Restore the compact props8 + minsep8 hybrid shelf anchored at lwindow3, beam3, top4, boardcands2, secsep1, radius0, drop1, props8, total150, and lmargin9.935836791992188. The latest executed bracket is harmful at 142.3393809000651089036182384006679058074951171874999999999999993981468923789887959200068929422102129568432349326911889875191263854503631591796875 and exact-flat at 142.339380900065108903618238400667905807495117187500000000000000752316384526264005099991383822237233803945956334136013765601092018187046051025390625, so this run restores the same shelf anchor and raises only min_score_gain_per_added_move to 142.3393809000651089036182384006679058074951171875000000000000000752316384526264005099991383822237233803945956334136013765601092018187046051025390625 to continue binary-searching that lower edge. The experiment name remains shortened to avoid the filename-too-long failure seen with long autogenerated names.
autoresearch/snapshots/20260419T233351Z_hybrid_p8_m8_w3_g142p33938090006510890361823840066790580749511718749999999999999973668926541580759821500301566221696816861891528305239518203961779363453388214111328125_v1046.py	0.071006	0.789778	0.739821	0.375000	0.024580	discard	Restore the compact props8 + minsep8 hybrid shelf anchored at lwindow3, beam3, top4, boardcands2, secsep1, radius0, drop1, props8, total150, and lmargin9.935836791992188. The latest executed bracket is harmful at 142.3393809000651089036182384006679058074951171874999999999999993981468923789887959200068929422102129568432349326911889875191263854503631591796875 and exact-flat at 142.3393809000651089036182384006679058074951171875000000000000000752316384526264005099991383822237233803945956334136013765601092018187046051025390625, so this run restores the same shelf anchor and raises only min_score_gain_per_added_move to 142.33938090006510890361823840066790580749511718749999999999999973668926541580759821500301566221696816861891528305239518203961779363453388214111328125 to continue binary-searching that lower edge. The experiment name remains shortened to avoid the filename-too-long failure seen with long autogenerated names.
autoresearch/snapshots/20260419T233454Z_hybrid_p8_m8_w3_g142p339380900065108903618238400667905807495117187499999999999999905960451934216999362501077022220345774506755458232998279299863497726619243621826171875_v1047.py	0.071006	0.789778	0.739821	0.375000	0.024580	discard	Restore the compact props8 + minsep8 hybrid shelf anchored at lwindow3, beam3, top4, boardcands2, secsep1, radius0, drop1, props8, total150, and lmargin9.935836791992188. The latest executed bracket is harmful at 142.33938090006510890361823840066790580749511718749999999999999973668926541580759821500301566221696816861891528305239518203961779363453388214111328125 and exact-flat at 142.3393809000651089036182384006679058074951171875000000000000000752316384526264005099991383822237233803945956334136013765601092018187046051025390625, so this run restores the same shelf anchor and raises only min_score_gain_per_added_move to 142.339380900065108903618238400667905807495117187499999999999999905960451934216999362501077022220345774506755458232998279299863497726619243621826171875 to continue binary-searching that lower edge. The experiment name remains shortened to avoid the filename-too-long failure seen with long autogenerated names.
