snapshot	board_exact	non_empty_accuracy	macro_f1	move_recall	false_change_rate	status	description
autoresearch/snapshots/20260419T060318Z_hybrid_lookahead_segmental_drop1_boardcands3_ratio93p125_props14_top4_detect10_lwindow1_minsep4_secsep1_thresh3_total150_permove125_lmargin9p5_m9p8957061767578125_r0_beam4_v572.py	0.074556	0.792672	0.751719	0.234375	0.009056	discard	Hybrid decoder keeps the baseline lookahead path unless a conservative board-only segmental pass wins the current score-gain gates, while following up the kept window1 branch after lowering lookahead window from 2 to 1 on the 9.5-margin baseline opened a lower-false-change but lower-recall tradeoff, lowering only max_event_proposals from 16 to 15 on the restored plain window1 branch improved recall and secondary metrics but worsened false-change, additionally narrowing top-board breadth from 4 to 3 recovered the lower false-change without hurting recall, lowering only max_event_proposals one step further from 15 to 14 on that boardcands3 plain props branch kept that recovered tradeoff, lowering segment_board_drop_worst_frames from 1 to 0 on that stronger props14 branch produced a new kept low-noise / lower-recall tradeoff, lowering secondary minimum event separation from 2 to 1 improved that tradeoff again, raising max_event_proposals from 14 to 15 was worse, lowering max_event_proposals from 14 to 13 was sharply worse, lowering top-move breadth from 4 to 1 was an exact no-op, raising beam size from 4 to 5, 6, and 7 were exact no-ops, beam8 was worse, raising event_window_radius from 0 to 1 and 2 were exact no-ops, raising LOOKAHEAD_WINDOW from 1 back to 2 was worse, min_event_separation 3 and 5 were both worse, raising secondary_min_event_separation from 1 to 2 and 3 was worse, raising secondary_peak_ratio from 0.95 to 0.98 was an exact no-op, lowering it to 0.9375 was still an exact no-op, lowering it to 0.925 reopened a noisier higher-recall tradeoff, lowering it to 0.90 was clearly harmful, and restoring segment_board_drop_worst_frames from 0 back to 1 improved the tradeoff again, and lowering only secondary_peak_ratio from 0.9375 to 0.93125 on that new secsep1 + drop1 best branch to localize the lower ratio cliff between the last exact no-op and the first degraded point.
autoresearch/snapshots/20260419T060415Z_hybrid_lookahead_segmental_drop1_boardcands3_ratio92p8125_props14_top4_detect10_lwindow1_minsep4_secsep1_thresh3_total150_permove125_lmargin9p5_m9p8957061767578125_r0_beam4_v573.py	0.074556	0.764198	0.722324	0.250000	0.018111	discard	Hybrid decoder keeps the baseline lookahead path unless a conservative board-only segmental pass wins the current score-gain gates, while following up the kept window1 branch after lowering lookahead window from 2 to 1 on the 9.5-margin baseline opened a lower-false-change but lower-recall tradeoff, lowering only max_event_proposals from 16 to 15 on the restored plain window1 branch improved recall and secondary metrics but worsened false-change, additionally narrowing top-board breadth from 4 to 3 recovered the lower false-change without hurting recall, lowering only max_event_proposals one step further from 15 to 14 on that boardcands3 plain props branch kept that recovered tradeoff, lowering segment_board_drop_worst_frames from 1 to 0 on that stronger props14 branch produced a new kept low-noise / lower-recall tradeoff, lowering secondary minimum event separation from 2 to 1 improved that tradeoff again, raising max_event_proposals from 14 to 15 was worse, lowering max_event_proposals from 14 to 13 was sharply worse, lowering top-move breadth from 4 to 1 was an exact no-op, raising beam size from 4 to 5, 6, and 7 were exact no-ops, beam8 was worse, raising event_window_radius from 0 to 1 and 2 were exact no-ops, raising LOOKAHEAD_WINDOW from 1 back to 2 was worse, min_event_separation 3 and 5 were both worse, raising secondary_min_event_separation from 1 to 2 and 3 was worse, raising secondary_peak_ratio from 0.95 to 0.98 was an exact no-op, lowering it to 0.9375 and 0.93125 were still exact no-ops, lowering it to 0.925 reopened a noisier higher-recall tradeoff, lowering it to 0.90 was clearly harmful, and restoring segment_board_drop_worst_frames from 0 back to 1 improved the tradeoff again, and lowering only secondary_peak_ratio from 0.93125 to 0.928125 on that new secsep1 + drop1 best branch to keep bisecting the lower ratio cliff between the last exact no-op and the first degraded point.
autoresearch/snapshots/20260419T060512Z_hybrid_lookahead_segmental_drop1_boardcands3_ratio92p96875_props14_top4_detect10_lwindow1_minsep4_secsep1_thresh3_total150_permove125_lmargin9p5_m9p8957061767578125_r0_beam4_v574.py	0.074556	0.792672	0.751719	0.234375	0.009056	discard	Hybrid decoder keeps the baseline lookahead path unless a conservative board-only segmental pass wins the current score-gain gates, while following up the kept window1 branch after lowering lookahead window from 2 to 1 on the 9.5-margin baseline opened a lower-false-change but lower-recall tradeoff, lowering only max_event_proposals from 16 to 15 on the restored plain window1 branch improved recall and secondary metrics but worsened false-change, additionally narrowing top-board breadth from 4 to 3 recovered the lower false-change without hurting recall, lowering only max_event_proposals one step further from 15 to 14 on that boardcands3 plain props branch kept that recovered tradeoff, lowering segment_board_drop_worst_frames from 1 to 0 on that stronger props14 branch produced a new kept low-noise / lower-recall tradeoff, lowering secondary minimum event separation from 2 to 1 improved that tradeoff again, raising max_event_proposals from 14 to 15 was worse, lowering max_event_proposals from 14 to 13 was sharply worse, lowering top-move breadth from 4 to 1 was an exact no-op, raising beam size from 4 to 5, 6, and 7 were exact no-ops, beam8 was worse, raising event_window_radius from 0 to 1 and 2 were exact no-ops, raising LOOKAHEAD_WINDOW from 1 back to 2 was worse, min_event_separation 3 and 5 were both worse, raising secondary_min_event_separation from 1 to 2 and 3 was worse, raising secondary_peak_ratio from 0.95 to 0.98 was an exact no-op, lowering it to 0.9375 and 0.93125 were still exact no-ops, lowering it to 0.928125 reopened the noisier higher-recall tradeoff, lowering it to 0.90 was clearly harmful, and restoring segment_board_drop_worst_frames from 0 back to 1 improved the tradeoff again, and lowering only secondary_peak_ratio from 0.93125 to 0.9296875 on that new secsep1 + drop1 best branch to keep bisecting the lower ratio cliff between the last exact no-op and the first degraded point.
autoresearch/snapshots/20260419T060619Z_hybrid_lookahead_segmental_drop1_boardcands3_ratio92p890625_props14_top4_detect10_lwindow1_minsep4_secsep1_thresh3_total150_permove125_lmargin9p5_m9p8957061767578125_r0_beam4_v575.py	0.074556	0.792672	0.751719	0.234375	0.009056	discard	Hybrid decoder keeps the baseline lookahead path unless a conservative board-only segmental pass wins the current score-gain gates, while following up the kept window1 branch after lowering lookahead window from 2 to 1 on the 9.5-margin baseline opened a lower-false-change but lower-recall tradeoff, lowering only max_event_proposals from 16 to 15 on the restored plain window1 branch improved recall and secondary metrics but worsened false-change, additionally narrowing top-board breadth from 4 to 3 recovered the lower false-change without hurting recall, lowering only max_event_proposals one step further from 15 to 14 on that boardcands3 plain props branch kept that recovered tradeoff, lowering segment_board_drop_worst_frames from 1 to 0 on that stronger props14 branch produced a new kept low-noise / lower-recall tradeoff, lowering secondary minimum event separation from 2 to 1 improved that tradeoff again, raising max_event_proposals from 14 to 15 was worse, lowering max_event_proposals from 14 to 13 was sharply worse, lowering top-move breadth from 4 to 1 was an exact no-op, raising beam size from 4 to 5, 6, and 7 were exact no-ops, beam8 was worse, raising event_window_radius from 0 to 1 and 2 were exact no-ops, raising LOOKAHEAD_WINDOW from 1 back to 2 was worse, min_event_separation 3 and 5 were both worse, raising secondary_min_event_separation from 1 to 2 and 3 was worse, raising secondary_peak_ratio from 0.95 to 0.98 was an exact no-op, lowering it to 0.9375, 0.93125, and 0.9296875 were still exact no-ops, lowering it to 0.928125 reopened the noisier higher-recall tradeoff, lowering it to 0.90 was clearly harmful, and restoring segment_board_drop_worst_frames from 0 back to 1 improved the tradeoff again, and lowering only secondary_peak_ratio from 0.9296875 to 0.92890625 on that new secsep1 + drop1 best branch to keep bisecting the lower ratio cliff between the last exact no-op and the first degraded point.
autoresearch/snapshots/20260419T060717Z_hybrid_lookahead_segmental_drop1_boardcands3_ratio92p8515625_props14_top4_detect10_lwindow1_minsep4_secsep1_thresh3_total150_permove125_lmargin9p5_m9p8957061767578125_r0_beam4_v576.py	0.074556	0.764198	0.722324	0.250000	0.018111	discard	Hybrid decoder keeps the baseline lookahead path unless a conservative board-only segmental pass wins the current score-gain gates, while following up the kept window1 branch after lowering lookahead window from 2 to 1 on the 9.5-margin baseline opened a lower-false-change but lower-recall tradeoff, lowering only max_event_proposals from 16 to 15 on the restored plain window1 branch improved recall and secondary metrics but worsened false-change, additionally narrowing top-board breadth from 4 to 3 recovered the lower false-change without hurting recall, lowering only max_event_proposals one step further from 15 to 14 on that boardcands3 plain props branch kept that recovered tradeoff, lowering segment_board_drop_worst_frames from 1 to 0 on that stronger props14 branch produced a new kept low-noise / lower-recall tradeoff, lowering secondary minimum event separation from 2 to 1 improved that tradeoff again, raising max_event_proposals from 14 to 15 was worse, lowering max_event_proposals from 14 to 13 was sharply worse, lowering top-move breadth from 4 to 1 was an exact no-op, raising beam size from 4 to 5, 6, and 7 were exact no-ops, beam8 was worse, raising event_window_radius from 0 to 1 and 2 were exact no-ops, raising LOOKAHEAD_WINDOW from 1 back to 2 was worse, min_event_separation 3 and 5 were both worse, raising secondary_min_event_separation from 1 to 2 and 3 was worse, raising secondary_peak_ratio from 0.95 to 0.98 was an exact no-op, lowering it to 0.9375, 0.93125, 0.9296875, and 0.92890625 were still exact no-ops, lowering it to 0.928125 reopened the noisier higher-recall tradeoff, lowering it to 0.90 was clearly harmful, and restoring segment_board_drop_worst_frames from 0 back to 1 improved the tradeoff again, and lowering only secondary_peak_ratio from 0.92890625 to 0.928515625 on that new secsep1 + drop1 best branch to keep bisecting the lower ratio cliff between the last exact no-op and the first degraded point.
autoresearch/snapshots/20260419T060822Z_hybrid_lookahead_segmental_drop1_boardcands3_ratio92p87109375_props14_top4_detect10_lwindow1_minsep4_secsep1_thresh3_total150_permove125_lmargin9p5_m9p8957061767578125_r0_beam4_v577.py	0.074556	0.792672	0.751719	0.234375	0.009056	discard	Hybrid decoder keeps the baseline lookahead path unless a conservative board-only segmental pass wins the current score-gain gates, while following up the kept window1 branch after lowering lookahead window from 2 to 1 on the 9.5-margin baseline opened a lower-false-change but lower-recall tradeoff, lowering only max_event_proposals from 16 to 15 on the restored plain window1 branch improved recall and secondary metrics but worsened false-change, additionally narrowing top-board breadth from 4 to 3 recovered the lower false-change without hurting recall, lowering only max_event_proposals one step further from 15 to 14 on that boardcands3 plain props branch kept that recovered tradeoff, lowering segment_board_drop_worst_frames from 1 to 0 on that stronger props14 branch produced a new kept low-noise / lower-recall tradeoff, lowering secondary minimum event separation from 2 to 1 improved that tradeoff again, raising max_event_proposals from 14 to 15 was worse, lowering max_event_proposals from 14 to 13 was sharply worse, lowering top-move breadth from 4 to 1 was an exact no-op, raising beam size from 4 to 5, 6, and 7 were exact no-ops, beam8 was worse, raising event_window_radius from 0 to 1 and 2 were exact no-ops, raising LOOKAHEAD_WINDOW from 1 back to 2 was worse, min_event_separation 3 and 5 were both worse, raising secondary_min_event_separation from 1 to 2 and 3 was worse, raising secondary_peak_ratio from 0.95 to 0.98 was an exact no-op, lowering it to 0.9375, 0.93125, 0.9296875, and 0.92890625 were still exact no-ops, lowering it to 0.928515625 reopened the noisier higher-recall tradeoff, lowering it to 0.90 was clearly harmful, and restoring segment_board_drop_worst_frames from 0 back to 1 improved the tradeoff again, and lowering only secondary_peak_ratio from 0.92890625 to 0.9287109375 on that new secsep1 + drop1 best branch to keep bisecting the lower ratio cliff between the last exact no-op and the first degraded point.
autoresearch/snapshots/20260419T060917Z_hybrid_lookahead_segmental_drop1_boardcands3_ratio92p861328125_props14_top4_detect10_lwindow1_minsep4_secsep1_thresh3_total150_permove125_lmargin9p5_m9p8957061767578125_r0_beam4_v578.py	0.074556	0.792672	0.751719	0.234375	0.009056	discard	Hybrid decoder keeps the baseline lookahead path unless a conservative board-only segmental pass wins the current score-gain gates, while following up the kept window1 branch after lowering lookahead window from 2 to 1 on the 9.5-margin baseline opened a lower-false-change but lower-recall tradeoff, lowering only max_event_proposals from 16 to 15 on the restored plain window1 branch improved recall and secondary metrics but worsened false-change, additionally narrowing top-board breadth from 4 to 3 recovered the lower false-change without hurting recall, lowering only max_event_proposals one step further from 15 to 14 on that boardcands3 plain props branch kept that recovered tradeoff, lowering segment_board_drop_worst_frames from 1 to 0 on that stronger props14 branch produced a new kept low-noise / lower-recall tradeoff, lowering secondary minimum event separation from 2 to 1 improved that tradeoff again, raising max_event_proposals from 14 to 15 was worse, lowering max_event_proposals from 14 to 13 was sharply worse, lowering top-move breadth from 4 to 1 was an exact no-op, raising beam size from 4 to 5, 6, and 7 were exact no-ops, beam8 was worse, raising event_window_radius from 0 to 1 and 2 were exact no-ops, raising LOOKAHEAD_WINDOW from 1 back to 2 was worse, min_event_separation 3 and 5 were both worse, raising secondary_min_event_separation from 1 to 2 and 3 was worse, raising secondary_peak_ratio from 0.95 to 0.98 was an exact no-op, lowering it to 0.9375, 0.93125, 0.9296875, 0.92890625, and 0.9287109375 were still exact no-ops, lowering it to 0.928515625 reopened the noisier higher-recall tradeoff, lowering it to 0.90 was clearly harmful, and restoring segment_board_drop_worst_frames from 0 back to 1 improved the tradeoff again, and lowering only secondary_peak_ratio from 0.9287109375 to 0.92861328125 on that new secsep1 + drop1 best branch to keep bisecting the lower ratio cliff between the last exact no-op and the first degraded point.
autoresearch/snapshots/20260419T061011Z_hybrid_lookahead_segmental_drop1_boardcands3_ratio92p8564453125_props14_top4_detect10_lwindow1_minsep4_secsep1_thresh3_total150_permove125_lmargin9p5_m9p8957061767578125_r0_beam4_v579.py	0.074556	0.764198	0.722324	0.250000	0.018111	discard	Hybrid decoder keeps the baseline lookahead path unless a conservative board-only segmental pass wins the current score-gain gates, while following up the kept window1 branch after lowering lookahead window from 2 to 1 on the 9.5-margin baseline opened a lower-false-change but lower-recall tradeoff, lowering only max_event_proposals from 16 to 15 on the restored plain window1 branch improved recall and secondary metrics but worsened false-change, additionally narrowing top-board breadth from 4 to 3 recovered the lower false-change without hurting recall, lowering only max_event_proposals one step further from 15 to 14 on that boardcands3 plain props branch kept that recovered tradeoff, lowering segment_board_drop_worst_frames from 1 to 0 on that stronger props14 branch produced a new kept low-noise / lower-recall tradeoff, lowering secondary minimum event separation from 2 to 1 improved that tradeoff again, raising max_event_proposals from 14 to 15 was worse, lowering max_event_proposals from 14 to 13 was sharply worse, lowering top-move breadth from 4 to 1 was an exact no-op, raising beam size from 4 to 5, 6, and 7 were exact no-ops, beam8 was worse, raising event_window_radius from 0 to 1 and 2 were exact no-ops, raising LOOKAHEAD_WINDOW from 1 back to 2 was worse, min_event_separation 3 and 5 were both worse, raising secondary_min_event_separation from 1 to 2 and 3 was worse, raising secondary_peak_ratio from 0.95 to 0.98 was an exact no-op, lowering it to 0.9375, 0.93125, 0.9296875, 0.92890625, and 0.9287109375 were still exact no-ops, lowering it to 0.928515625 reopened the noisier higher-recall tradeoff, lowering it to 0.90 was clearly harmful, and restoring segment_board_drop_worst_frames from 0 back to 1 improved the tradeoff again, and lowering only secondary_peak_ratio from 0.92861328125 to 0.928564453125 on that new secsep1 + drop1 best branch to keep bisecting the lower ratio cliff between the last exact no-op and the first degraded point.
autoresearch/snapshots/20260419T061107Z_hybrid_lookahead_segmental_drop1_boardcands3_ratio92p85888671875_props14_top4_detect10_lwindow1_minsep4_secsep1_thresh3_total150_permove125_lmargin9p5_m9p8957061767578125_r0_beam4_v580.py	0.074556	0.792672	0.751719	0.234375	0.009056	discard	Hybrid decoder keeps the baseline lookahead path unless a conservative board-only segmental pass wins the current score-gain gates, while following up the kept window1 branch after lowering lookahead window from 2 to 1 on the 9.5-margin baseline opened a lower-false-change but lower-recall tradeoff, lowering only max_event_proposals from 16 to 15 on the restored plain window1 branch improved recall and secondary metrics but worsened false-change, additionally narrowing top-board breadth from 4 to 3 recovered the lower false-change without hurting recall, lowering only max_event_proposals one step further from 15 to 14 on that boardcands3 plain props branch kept that recovered tradeoff, lowering segment_board_drop_worst_frames from 1 to 0 on that stronger props14 branch produced a new kept low-noise / lower-recall tradeoff, lowering secondary minimum event separation from 2 to 1 improved that tradeoff again, raising max_event_proposals from 14 to 15 was worse, lowering max_event_proposals from 14 to 13 was sharply worse, lowering top-move breadth from 4 to 1 was an exact no-op, raising beam size from 4 to 5, 6, and 7 were exact no-ops, beam8 was worse, raising event_window_radius from 0 to 1 and 2 were exact no-ops, raising LOOKAHEAD_WINDOW from 1 back to 2 was worse, min_event_separation 3 and 5 were both worse, raising secondary_min_event_separation from 1 to 2 and 3 was worse, raising secondary_peak_ratio from 0.95 to 0.98 was an exact no-op, lowering it to 0.9375, 0.93125, 0.9296875, 0.92890625, 0.9287109375, and 0.92861328125 were still exact no-ops, lowering it to 0.928564453125 reopened the noisier higher-recall tradeoff, lowering it to 0.90 was clearly harmful, and restoring segment_board_drop_worst_frames from 0 back to 1 improved the tradeoff again, and lowering only secondary_peak_ratio from 0.92861328125 to 0.9285888671875 on that new secsep1 + drop1 best branch to keep bisecting the lower ratio cliff between the last exact no-op and the first degraded point.
