snapshot	board_exact	non_empty_accuracy	macro_f1	move_recall	false_change_rate	status	description
autoresearch/snapshots/20260419T025300Z_hybrid_lookahead_segmental_drop1_boardcands4_ratio95_props16_top4_detect10_lwindow1_minsep4_thresh3_total150_permove125_lmargin9p5_m9p8957061767578125_r0_beam4_v431.py	0.074556	0.764250	0.722490	0.250000	0.018111	keep	Hybrid decoder keeps the baseline lookahead path unless a conservative board-only segmental pass wins the current score-gain gates, while following up the new kept beam4 minsep4 best surface after lowering the baseline lookahead margin from 10.0 to 9.5 improved move-detection recall at unchanged board_exact and false-change, raising that margin back toward 10.0 to 9.75 was an exact no-op, and raising lookahead window from 2 to 3 was clearly harmful, and lowering only the baseline lookahead window from 2 to 1 on the restored 9.5-margin branch to test whether the new recall gain comes from the looser margin alone or whether the local sweet spot also prefers less temporal context on the baseline path.
autoresearch/snapshots/20260419T025355Z_hybrid_lookahead_segmental_drop1_boardcands4_ratio95_props16_top4_detect10_lwindow1_minsep4_thresh3_total150_permove125_lmargin10_m9p8957061767578125_r0_beam4_v432.py	0.074556	0.764250	0.722490	0.250000	0.018111	discard	Hybrid decoder keeps the baseline lookahead path unless a conservative board-only segmental pass wins the current score-gain gates, while following up the new kept beam4 minsep4 best surface after lowering the baseline lookahead margin from 10.0 to 9.5 improved move-detection recall at unchanged board_exact and false-change, raising that margin back toward 10.0 to 9.75 was an exact no-op on the window2 branch, raising lookahead window from 2 to 3 was clearly harmful, and lowering lookahead window from 2 to 1 on the 9.5-margin branch opened a lower-false-change but lower-recall tradeoff, and raising only the baseline lookahead margin from 9.5 back to 10.0 on that new window1 branch to test whether the lower-false-change tradeoff comes from the shorter lookahead window alone or depends on the looser margin too.
autoresearch/snapshots/20260419T025455Z_hybrid_lookahead_segmental_drop1_boardcands4_ratio95_props16_top4_detect10_lwindow1_minsep4_thresh3_total150_permove125_lmargin9_m9p8957061767578125_r0_beam4_v433.py	0.074556	0.764250	0.722490	0.250000	0.018111	discard	Hybrid decoder keeps the baseline lookahead path unless a conservative board-only segmental pass wins the current score-gain gates, while following up the new kept beam4 minsep4 best surface after lowering the baseline lookahead window from 2 to 1 on the 9.5-margin branch opened a lower-false-change but lower-recall tradeoff, and raising that branch's margin back to 10.0 was an exact no-op, and lowering only the baseline lookahead margin further from 9.5 to 9.0 on the active window1 branch to test whether the lower-false-change tradeoff can recover some recall on the looser side or whether margin is fully flat on the shorter-lookahead branch too.
autoresearch/snapshots/20260419T025545Z_hybrid_lookahead_segmental_drop1_boardcands4_ratio95_props16_top4_detect10_lwindow1_minsep4_thresh3_total150_permove115p625_lmargin9p5_m9p8957061767578125_r0_beam4_v434.py	0.074556	0.764250	0.722490	0.250000	0.018111	discard	Hybrid decoder keeps the baseline lookahead path unless a conservative board-only segmental pass wins the current score-gain gates, while following up the new kept window1 branch after lowering lookahead window from 2 to 1 on the 9.5-margin baseline opened a lower-false-change but lower-recall tradeoff, and that shorter-lookahead branch stayed exact across margin 9.0 through 10.0, and lowering only the hybrid minimum score gain per added move from 125 to 115.625 on the active window1 branch to test whether slightly easier segmental takeovers can recover recall without giving back the branch's lower false-change advantage.
autoresearch/snapshots/20260419T025642Z_hybrid_lookahead_segmental_drop1_boardcands4_ratio95_props16_top4_detect10_lwindow1_minsep4_thresh3_total140_permove125_lmargin9p5_m9p8957061767578125_r0_beam4_v435.py	0.074556	0.764250	0.722490	0.250000	0.018111	discard	Hybrid decoder keeps the baseline lookahead path unless a conservative board-only segmental pass wins the current score-gain gates, while following up the new kept window1 branch after lowering lookahead window from 2 to 1 on the 9.5-margin baseline opened a lower-false-change but lower-recall tradeoff, and that shorter-lookahead branch stayed exact across margin 9.0 through 10.0 and also stayed exact when the per-move hybrid gain gate was lowered to 115.625, and lowering only the hybrid minimum total score gain from 150 to 140 on the active window1 branch to test whether slightly easier segmental takeovers can recover recall there or whether the shorter-lookahead tradeoff is flat across both hybrid handoff gates too.
autoresearch/snapshots/20260419T025740Z_hybrid_lookahead_segmental_drop1_boardcands4_ratio95_props16_top4_detect10_lwindow1_minsep4_thresh3_total150_permove125_lmargin9p5_m9p8957061767578125_r1_beam4_v436.py	0.074556	0.764250	0.722490	0.250000	0.018111	discard	Hybrid decoder keeps the baseline lookahead path unless a conservative board-only segmental pass wins the current score-gain gates, while following up the new kept window1 branch after lowering lookahead window from 2 to 1 on the 9.5-margin baseline opened a lower-false-change but lower-recall tradeoff, and that shorter-lookahead branch stayed exact across margin 9.0 through 10.0 and across both nearby hybrid handoff gates, and raising only the segmental event window radius from 0 to 1 on the active window1 branch to test whether a little extra segmental temporal context can recover recall without giving up the shorter baseline lookahead tradeoff.
autoresearch/snapshots/20260419T025902Z_hybrid_lookahead_segmental_drop1_boardcands4_ratio95_props16_top4_detect10_lwindow1_minsep4_secsep1_thresh3_total150_permove125_lmargin9p5_m9p8957061767578125_r0_beam4_v437.py	0.074556	0.761821	0.721102	0.250000	0.018111	discard	Hybrid decoder keeps the baseline lookahead path unless a conservative board-only segmental pass wins the current score-gain gates, while following up the new kept window1 branch after lowering lookahead window from 2 to 1 on the 9.5-margin baseline opened a lower-false-change but lower-recall tradeoff, and that shorter-lookahead branch stayed exact across margin 9.0 through 10.0, nearby hybrid handoff gates, and segmental event-window radius 0 through 1, and lowering only the secondary minimum event separation from 2 to 1 on the active window1 branch to test whether denser secondary temporal proposals can recover recall without giving up the branch's lower false-change advantage.
autoresearch/snapshots/20260419T030003Z_hybrid_lookahead_segmental_drop0_boardcands4_ratio95_props16_top4_detect10_lwindow1_minsep4_thresh3_total150_permove125_lmargin9p5_m9p8957061767578125_r0_beam4_v438.py	0.074556	0.759496	0.716512	0.281250	0.020699	discard	Hybrid decoder keeps the baseline lookahead path unless a conservative board-only segmental pass wins the current score-gain gates, while following up the new kept window1 branch after lowering lookahead window from 2 to 1 on the 9.5-margin baseline opened a lower-false-change but lower-recall tradeoff, and that shorter-lookahead branch stayed exact across margin 9.0 through 10.0, nearby hybrid handoff gates, and segmental event-window radius, while denser secondary proposals only hurt secondaries, and lowering only segment_board_drop_worst_frames from 1 to 0 on the active window1 branch to test whether relaxing worst-frame suppression can recover some recall without fully giving back the branch's lower false-change profile.
autoresearch/snapshots/20260419T030104Z_hybrid_lookahead_segmental_drop0_boardcands1_ratio95_props16_top4_detect10_lwindow1_minsep4_thresh3_total150_permove125_lmargin9p5_m9p8957061767578125_r0_beam4_v439.py	0.074556	0.758307	0.709753	0.250000	0.019405	discard	Hybrid decoder keeps the baseline lookahead path unless a conservative board-only segmental pass wins the current score-gain gates, while following up the new kept window1 branch after lowering lookahead window from 2 to 1 on the 9.5-margin baseline opened a lower-false-change but lower-recall tradeoff, nearby margin and handoff probes stayed exact on that branch, and relaxing worst-frame suppression to drop0 recovered some recall but gave back false-change and secondaries, and combining only drop0 with a narrower board-candidate menu of 1 on the active window1 branch to test whether the recovered recall can be kept while trimming the noisier search that reopened on the drop0 side branch.
autoresearch/snapshots/20260419T030156Z_hybrid_lookahead_segmental_drop0_boardcands2_ratio95_props16_top4_detect10_lwindow1_minsep4_thresh3_total150_permove125_lmargin9p5_m9p8957061767578125_r0_beam4_v440.py	0.074556	0.757274	0.713329	0.265625	0.019405	discard	Hybrid decoder keeps the baseline lookahead path unless a conservative board-only segmental pass wins the current score-gain gates, while following up the new kept window1 branch after lowering lookahead window from 2 to 1 on the 9.5-margin baseline opened a lower-false-change but lower-recall tradeoff, nearby margin and handoff probes stayed exact on that branch, and relaxing worst-frame suppression to drop0 recovered some recall but gave back false-change and secondaries, while combining drop0 with boardcands1 lost that recall recovery and still hurt secondaries, and combining only drop0 with a narrower board-candidate menu of 2 on the active window1 branch to test whether the local sweet spot is the intermediate board-width tradeoff rather than either boardcands4 or boardcands1.
autoresearch/snapshots/20260419T030252Z_hybrid_lookahead_segmental_drop0_boardcands3_ratio95_props16_top4_detect10_lwindow1_minsep4_thresh3_total150_permove125_lmargin9p5_m9p8957061767578125_r0_beam4_v441.py	0.074556	0.759496	0.716512	0.281250	0.020699	discard	Hybrid decoder keeps the baseline lookahead path unless a conservative board-only segmental pass wins the current score-gain gates, while following up the new kept window1 branch after lowering lookahead window from 2 to 1 on the 9.5-margin baseline opened a lower-false-change but lower-recall tradeoff, nearby margin and handoff probes stayed exact on that branch, and relaxing worst-frame suppression to drop0 recovered some recall but gave back false-change and secondaries, while narrowing the drop0 board menu to 1 removed that recall recovery and narrowing it to 2 only partially recovered recall, and combining only drop0 with a board-candidate menu of 3 on the active window1 branch to test whether the local sweet spot sits nearer the wider drop0 search or whether the drop0 curve already saturates by boardcands2.
autoresearch/snapshots/20260419T030354Z_hybrid_lookahead_segmental_drop0_boardcands4_ratio95_props16_top2_detect10_lwindow1_minsep4_thresh3_total150_permove125_lmargin9p5_m9p8957061767578125_r0_beam4_v442.py	0.074556	0.759496	0.716512	0.281250	0.020699	discard	Hybrid decoder keeps the baseline lookahead path unless a conservative board-only segmental pass wins the current score-gain gates, while following up the new kept window1 branch after lowering lookahead window from 2 to 1 on the 9.5-margin baseline opened a lower-false-change but lower-recall tradeoff, and relaxing worst-frame suppression to drop0 recovered recall but reopened a noisier branch whose board-width curve was now mapped, and lowering only top-move breadth from 4 to 2 alongside drop0 on the active window1 branch to test whether the recovered recall can be kept while trimming move-menu noise rather than board-menu noise.
autoresearch/snapshots/20260419T030459Z_hybrid_lookahead_segmental_drop0_boardcands4_ratio95_props16_top1_detect10_lwindow1_minsep4_thresh3_total150_permove125_lmargin9p5_m9p8957061767578125_r0_beam4_v443.py	0.074556	0.759496	0.716512	0.281250	0.020699	discard	Hybrid decoder keeps the baseline lookahead path unless a conservative board-only segmental pass wins the current score-gain gates, while following up the new kept window1 branch after lowering lookahead window from 2 to 1 on the 9.5-margin baseline opened a lower-false-change but lower-recall tradeoff, and the drop0 side branch recovered recall but gave back false-change and secondaries, while its board-width curve and a top2 trim were already mapped, and lowering only top-move breadth from 4 to 1 alongside drop0 on the active window1 branch to test whether the move-menu curve is also flat on that noisier drop0 branch or whether a stricter move cap can keep the recovered recall while trimming noise.
autoresearch/snapshots/20260419T030600Z_hybrid_lookahead_segmental_drop0_boardcands2_ratio95_props16_top1_detect10_lwindow1_minsep4_thresh3_total150_permove125_lmargin9p5_m9p8957061767578125_r0_beam4_v444.py	0.074556	0.757274	0.713329	0.265625	0.019405	discard	Hybrid decoder keeps the baseline lookahead path unless a conservative board-only segmental pass wins the current score-gain gates, while following up the new kept window1 branch after lowering lookahead window from 2 to 1 on the 9.5-margin baseline opened a lower-false-change but lower-recall tradeoff, and the drop0 side branch recovered recall but reopened noise, with boardcands1 losing that recall recovery, boardcands2 giving an intermediate tradeoff, boardcands3 and boardcands4 matching the noisier drop0 branch, and top1 plus top2 on the wide drop0 branch both staying exact, and combining only the intermediate drop0 + boardcands2 branch with top1 to test whether move-menu narrowing helps only on the narrower-board sweet spot rather than on the saturated wide-board branch.
autoresearch/snapshots/20260419T030709Z_hybrid_lookahead_segmental_drop1_boardcands2_ratio95_props16_top4_detect10_lwindow1_minsep4_thresh3_total150_permove125_lmargin9p5_m9p8957061767578125_r0_beam4_v445.py	0.074556	0.763371	0.714794	0.250000	0.018111	discard	Hybrid decoder keeps the baseline lookahead path unless a conservative board-only segmental pass wins the current score-gain gates, while following up the new kept window1 branch after lowering lookahead window from 2 to 1 on the 9.5-margin baseline opened a lower-false-change but lower-recall tradeoff, many nearby margin, handoff, and segmental temporal probes on that branch stayed exact, and the noisier drop0 side branch showed board-width sensitivity while move-width trims were flat, and lowering only top-board breadth from 4 to 2 on the active window1 branch to test whether the shorter-lookahead tradeoff itself has an intermediate board-width sweet spot without reopening the drop0 noise regime.
autoresearch/snapshots/20260419T030810Z_hybrid_lookahead_segmental_drop1_boardcands3_ratio95_props16_top4_detect10_lwindow1_minsep4_thresh3_total150_permove125_lmargin9p5_m9p8957061767578125_r0_beam4_v446.py	0.074556	0.764250	0.722490	0.250000	0.018111	discard	Hybrid decoder keeps the baseline lookahead path unless a conservative board-only segmental pass wins the current score-gain gates, while following up the kept window1 branch after lowering lookahead window from 2 to 1 on the 9.5-margin baseline opened a lower-false-change but lower-recall tradeoff, many nearby margin, handoff, and segmental temporal probes on that branch stayed exact, and lowering top-board breadth from 4 to 2 hurt secondaries without improving the main tradeoff, and lowering only top-board breadth from 4 to 3 on the active window1 branch to test whether board-width sensitivity starts immediately below 4 or whether the kept branch still has a 3-to-4 plateau.
autoresearch/snapshots/20260419T030901Z_hybrid_lookahead_segmental_drop1_boardcands3_ratio95_props16_top4_detect10_lwindow1_minsep4_thresh3_total150_permove125_lmargin9p5_m9p8957061767578125_r0_beam4_v446.py	0.074556	0.764250	0.722490	0.250000	0.018111	discard	Hybrid decoder keeps the baseline lookahead path unless a conservative board-only segmental pass wins the current score-gain gates, while following up the kept window1 branch after lowering lookahead window from 2 to 1 on the 9.5-margin baseline opened a lower-false-change but lower-recall tradeoff, many nearby margin, handoff, and segmental temporal probes on that branch stayed exact, and lowering top-board breadth from 4 to 2 hurt secondaries without improving the main tradeoff, and lowering only top-board breadth from 4 to 3 on the active window1 branch to test whether board-width sensitivity starts immediately below 4 or whether the kept branch still has a 3-to-4 plateau.
autoresearch/snapshots/20260419T030958Z_hybrid_lookahead_segmental_drop1_boardcands4_ratio95_props16_top1_detect10_lwindow1_minsep4_thresh3_total150_permove125_lmargin9p5_m9p8957061767578125_r0_beam4_v447.py	0.074556	0.764250	0.722490	0.250000	0.018111	discard	Hybrid decoder keeps the baseline lookahead path unless a conservative board-only segmental pass wins the current score-gain gates, while following up the kept window1 branch after lowering lookahead window from 2 to 1 on the 9.5-margin baseline opened a lower-false-change but lower-recall tradeoff, many nearby margin, handoff, and segmental temporal probes on that branch stayed exact, and lowering top-board breadth from 4 to 3 stayed exact while lowering it to 2 hurt secondaries, and lowering only top-move breadth from 4 to 1 on the active window1 branch to test whether the kept branch is also flat across move-menu width or whether a stricter move cap changes that shorter-lookahead tradeoff.
autoresearch/snapshots/20260419T031051Z_hybrid_lookahead_segmental_drop1_boardcands1_ratio95_props16_top4_detect10_lwindow1_minsep4_thresh3_total150_permove125_lmargin9p5_m9p8957061767578125_r0_beam4_v448.py	0.074556	0.758100	0.701787	0.250000	0.019405	discard	Hybrid decoder keeps the baseline lookahead path unless a conservative board-only segmental pass wins the current score-gain gates, while following up the kept window1 branch after lowering lookahead window from 2 to 1 on the 9.5-margin baseline opened a lower-false-change but lower-recall tradeoff, many nearby margin, handoff, move-width, and segmental temporal probes on that branch stayed exact, and lowering top-board breadth from 4 to 3 stayed exact while lowering it to 2 hurt secondaries, and lowering only top-board breadth from 4 to 1 on the active window1 branch to complete the local board-width curve and test whether the kept branch has a sharp cliff below 3 or a lower-width tradeoff surface.
autoresearch/snapshots/20260419T031144Z_hybrid_lookahead_segmental_drop1_boardcands4_ratio95_props16_top4_detect10_lwindow1_minsep4_thresh2p75_total150_permove125_lmargin9p5_m9p8957061767578125_r0_beam4_v449.py	0.074556	0.764250	0.722490	0.250000	0.018111	discard	Hybrid decoder keeps the baseline lookahead path unless a conservative board-only segmental pass wins the current score-gain gates, while following up the kept window1 branch after lowering lookahead window from 2 to 1 on the 9.5-margin baseline opened a lower-false-change but lower-recall tradeoff, many nearby margin, handoff, move-width, and segmental temporal probes on that branch stayed exact, and lowering top-board breadth from 4 to 3 stayed exact while 2 and 1 hurt secondaries, and lowering only the segmental board-change peak threshold from 3.0/64.0 to 2.75/64.0 on the active window1 branch to test whether a slightly looser board-change gate can recover some recall without fully giving up the branch's lower false-change profile.
autoresearch/snapshots/20260419T031244Z_hybrid_lookahead_segmental_drop2_boardcands4_ratio95_props16_top4_detect10_lwindow1_minsep4_thresh3_total150_permove125_lmargin9p5_m9p8957061767578125_r0_beam4_v450.py	0.067456	0.758669	0.715514	0.265625	0.021992	discard	Hybrid decoder keeps the baseline lookahead path unless a conservative board-only segmental pass wins the current score-gain gates, while following up the kept window1 branch after lowering lookahead window from 2 to 1 on the 9.5-margin baseline opened a lower-false-change but lower-recall tradeoff, many nearby margin, handoff, move-width, board-width, and segmental temporal probes on that branch stayed exact, and relaxing worst-frame suppression to drop0 reopened a noisier higher-recall side branch, and raising only segment_board_drop_worst_frames from 1 to 2 on the active window1 branch to test whether stricter worst-frame suppression yields a better low-false-change tradeoff or simply degrades the shorter-lookahead branch.
autoresearch/snapshots/20260419T031354Z_hybrid_lookahead_segmental_drop1_boardcands4_ratio95_props16_top4_detect10_lwindow1_minsep3_thresh3_total150_permove125_lmargin9p5_m9p8957061767578125_r0_beam4_v451.py	0.071006	0.762648	0.721963	0.234375	0.021992	discard	Hybrid decoder keeps the baseline lookahead path unless a conservative board-only segmental pass wins the current score-gain gates, while following up the kept window1 branch after lowering lookahead window from 2 to 1 on the 9.5-margin baseline opened a lower-false-change but lower-recall tradeoff, many nearby margin, handoff, move-width, board-width, and segmental temporal probes on that branch stayed exact, and lowering only primary minimum event separation from 4 to 3 on the active window1 branch to test whether denser temporal proposals can recover recall without fully giving up the branch's lower false-change profile.
