snapshot	board_exact	non_empty_accuracy	macro_f1	move_recall	false_change_rate	status	description
autoresearch/snapshots/20260420T013532Z_hybrid_p8_m8_w3_v1125.py	0.071006	0.789778	0.739821	0.375000	0.024580	discard	Restore the compact props8 + minsep8 hybrid shelf anchored at lwindow3, beam3, top4, boardcands2, secsep1, radius0, drop1, props8, total150, and lmargin9.935836791992188. The latest executed bracket is harmful at 142.33938090006510890361823840066790580749511718749999999999999999999999999999999999998904749311096439059542644726534698133656115618305074557663226979855415923810311739351625711129874403415573880238298443146049976348876953125 and exact-flat at 142.339380900065108903618238400667905807495117187500000000000000000000000000000000000002489206111144456682857625621512049696236100867488466718685564166207894126616849501473577929250285446782786635822048992849886417388916015625. This run re-prepares their midpoint, 142.3393809000651089036182384006679058074951171874999999999999999999999999999999999999957683496110544236391420364434295155163986285252696061476589169823810266823599834474949175202745147404692627191025167121551930904388427734375, with a short experiment name to avoid filename-too-long failures.
autoresearch/snapshots/20260420T013743Z_hybrid_p8_m8_w3_v1126.py	0.071006	0.789778	0.739821	0.375000	0.024580	discard	Restore the compact props8 + minsep8 hybrid shelf anchored at lwindow3, beam3, top4, boardcands2, secsep1, radius0, drop1, props8, total150, and lmargin9.935836791992188. The latest executed bracket is harmful at 142.3393809000651089036182384006679058074951171874999999999999999999999999999999999999957683496110544236391420364434295155163986285252696061476589169823810266823599834474949175202745147404692627191025167121551930904388427734375 and exact-flat at 142.339380900065108903618238400667905807495117187500000000000000000000000000000000000002489206111144456682857625621512049696236100867488466718685564166207894126616849501473577929250285446782786635822048992849886417388916015625. This run re-prepares their midpoint, 142.33938090006510890361823840066790580749511718749999999999999999999999999999999999999912877786109944016099983103247078260631736469637903643317224057429446040448841647448424772476240009362602467746228285250253975391387939453125, with a short experiment name to avoid filename-too-long failures.
autoresearch/snapshots/20260420T013951Z_hybrid_p8_m8_w3_v1127.py	0.071006	0.799339	0.749250	0.375000	0.020699	discard	Restore the compact props8 + minsep8 hybrid shelf anchored at lwindow3, beam3, top4, boardcands2, secsep1, radius0, drop1, props8, total150, and lmargin9.935836791992188. The latest executed bracket is harmful at 142.33938090006510890361823840066790580749511718749999999999999999999999999999999999999912877786109944016099983103247078260631736469637903643317224057429446040448841647448424772476240009362602467746228285250253975391387939453125 and exact-flat at 142.339380900065108903618238400667905807495117187500000000000000000000000000000000000002489206111144456682857625621512049696236100867488466718685564166207894126616849501473577929250285446782786635822048992849886417388916015625. This run re-prepares their midpoint, 142.339380900065108903618238400667905807495117187500000000000000000000000000000000000000808991986121948421928728326991416151276732781933751575928902370251177265552632987978912827006342770204405656642165922676213085651397705078125, with a short experiment name to avoid filename-too-long failures.
autoresearch/snapshots/20260420T014205Z_hybrid_p8_m8_w3_v1128.py	0.071006	0.789778	0.739821	0.375000	0.024580	discard	Restore the compact props8 + minsep8 hybrid shelf anchored at lwindow3, beam3, top4, boardcands2, secsep1, radius0, drop1, props8, total150, and lmargin9.935836791992188. The latest executed bracket is harmful at 142.33938090006510890361823840066790580749511718749999999999999999999999999999999999999912877786109944016099983103247078260631736469637903643317224057429446040448841647448424772476240009362602467746228285250253975391387939453125 and exact-flat at 142.339380900065108903618238400667905807495117187500000000000000000000000000000000000000808991986121948421928728326991416151276732781933751575928902370251177265552632987978912827006342770204405656642165922676213085651397705078125. This run re-prepares their midpoint, 142.3393809000651089036182384006679058074951171874999999999999999999999999999999999999999688849236106942914642796797310993787970487391563940045505714722728188350205247312315802758843714319152151670522243875893764197826385498046875, with a short experiment name to avoid filename-too-long failures.
autoresearch/snapshots/20260420T014319Z_hybrid_p8_m8_w3_v1129.py	0.071006	0.799339	0.749250	0.375000	0.020699	discard	Restore the compact props8 + minsep8 hybrid shelf anchored at lwindow3, beam3, top4, boardcands2, secsep1, radius0, drop1, props8, total150, and lmargin9.935836791992188. The latest executed bracket is harmful at 142.3393809000651089036182384006679058074951171874999999999999999999999999999999999999999688849236106942914642796797310993787970487391563940045505714722728188350205247312315802758843714319152151670522243875893764197826385498046875 and exact-flat at 142.339380900065108903618238400667905807495117187500000000000000000000000000000000000000808991986121948421928728326991416151276732781933751575928902370251177265552632987978912827006342770204405656642165922676213085651397705078125. This run re-prepares their midpoint, 142.33938090006510890361823840066790580749511718750000000000000000000000000000000000000038893845486632135669650400336125776503689076054507279023973692126199805028657885960524655144535710105981041184719515513279475271701812744140625, with a short experiment name to avoid filename-too-long failures.
autoresearch/snapshots/20260420T014429Z_hybrid_p8_m8_w3_v1130.py	0.071006	0.799339	0.749250	0.375000	0.020699	discard	Restore the compact props8 + minsep8 hybrid shelf anchored at lwindow3, beam3, top4, boardcands2, secsep1, radius0, drop1, props8, total150, and lmargin9.935836791992188. The latest executed bracket is harmful at 142.3393809000651089036182384006679058074951171874999999999999999999999999999999999999999688849236106942914642796797310993787970487391563940045505714722728188350205247312315802758843714319152151670522243875893764197826385498046875 and exact-flat at 142.33938090006510890361823840066790580749511718750000000000000000000000000000000000000038893845486632135669650400336125776503689076054507279023973692126199805028657885960524655144535710105981041184719515513279475271701812744140625. This run re-prepares their midpoint, 142.339380900065108903618238400667905807495117187500000000000000000000000000000000000000178911689238507824080391841546178571916969749850733397395154196767408442653551795418413413664864266487512789449709771361085586249828338623046875, with a short experiment name to avoid filename-too-long failures.
autoresearch/snapshots/20260420T014538Z_hybrid_p8_m8_w3_v1131.py	0.071006	0.799339	0.749250	0.375000	0.020699	discard	Restore the compact props8 + minsep8 hybrid shelf anchored at lwindow3, beam3, top4, boardcands2, secsep1, radius0, drop1, props8, total150, and lmargin9.935836791992188. The latest executed bracket is harmful at 142.3393809000651089036182384006679058074951171874999999999999999999999999999999999999999688849236106942914642796797310993787970487391563940045505714722728188350205247312315802758843714319152151670522243875893764197826385498046875 and exact-flat at 142.339380900065108903618238400667905807495117187500000000000000000000000000000000000000178911689238507824080391841546178571916969749850733397395154196767408442653551795418413413664864266487512789449709771361085586249828338623046875. This run re-prepares their midpoint, 142.3393809000651089036182384006679058074951171875000000000000000000000000000000000000000738983064246010577723357606386389753570092445035637009728628345201136388370382633249968447746178492013639782509670794752310030162334442138671875, with a short experiment name to avoid filename-too-long failures.
autoresearch/snapshots/20260420T014653Z_hybrid_p8_m8_w3_v1132.py	0.071006	0.799339	0.749250	0.375000	0.020699	discard	Restore the compact props8 + minsep8 hybrid shelf anchored at lwindow3, beam3, top4, boardcands2, secsep1, radius0, drop1, props8, total150, and lmargin9.935836791992188. The latest executed bracket is harmful at 142.3393809000651089036182384006679058074951171874999999999999999999999999999999999999999688849236106942914642796797310993787970487391563940045505714722728188350205247312315802758843714319152151670522243875893764197826385498046875 and exact-flat at 142.3393809000651089036182384006679058074951171875000000000000000000000000000000000000000738983064246010577723357606386389753570092445035637009728628345201136388370382633249968447746178492013639782509670794752310030162334442138671875. This run re-prepares their midpoint, 142.33938090006510890361823840066790580749511718750000000000000000000000000000000000000002139161501764767461830772018486917707702899182997885276171715339646623692878149727828856032949464055828957265159573353230371139943599700927734375, with a short experiment name to avoid filename-too-long failures.
autoresearch/snapshots/20260420T014805Z_hybrid_p8_m8_w3_v1133.py	0.071006	0.789778	0.739821	0.375000	0.024580	discard	Restore the compact props8 + minsep8 hybrid shelf anchored at lwindow3, beam3, top4, boardcands2, secsep1, radius0, drop1, props8, total150, and lmargin9.935836791992188. The latest executed bracket is harmful at 142.3393809000651089036182384006679058074951171874999999999999999999999999999999999999999688849236106942914642796797310993787970487391563940045505714722728188350205247312315802758843714319152151670522243875893764197826385498046875 and exact-flat at 142.33938090006510890361823840066790580749511718750000000000000000000000000000000000000002139161501764767461830772018486917707702899182997885276171715339646623692878149727828856032949464055828957265159573353230371139943599700927734375. This run re-prepares their midpoint, 142.339380900065108903618238400667905807495117187499999999999999999999999999999999999999995138269314170983041293699957984277937038865493186428656144312834642535974653114254934418106933036236752369851910060560840065591037273406982421875, with a short experiment name to avoid filename-too-long failures.
autoresearch/snapshots/20260420T014910Z_hybrid_p8_m8_w3_v1134.py	0.071006	0.789778	0.739821	0.375000	0.024580	discard	Restore the compact props8 + minsep8 hybrid shelf anchored at lwindow3, beam3, top4, boardcands2, secsep1, radius0, drop1, props8, total150, and lmargin9.935836791992188. The latest executed bracket is harmful at 142.3393809000651089036182384006679058074951171874999999999999999999999999999999999999999688849236106942914642796797310993787970487391563940045505714722728188350205247312315802758843714319152151670522243875893764197826385498046875 and exact-flat at 142.339380900065108903618238400667905807495117187499999999999999999999999999999999999999995138269314170983041293699957984277937038865493186428656144312834642535974653114254934418106933036236752369851910060560840065591037273406982421875. This run re-prepares their midpoint, 142.3393809000651089036182384006679058074951171874999999999999999999999999999999999999999820115964624326372527866898445418283670438023247902166033578925537306854975889227432573469956522340759837684520672240751082426868379116058349609375, with a short experiment name to avoid filename-too-long failures.
autoresearch/snapshots/20260420T015013Z_hybrid_p8_m8_w3_v1135.py	0.071006	0.799339	0.749250	0.375000	0.020699	discard	Restore the compact props8 + minsep8 hybrid shelf anchored at lwindow3, beam3, top4, boardcands2, secsep1, radius0, drop1, props8, total150, and lmargin9.935836791992188. The latest executed bracket is harmful at 142.3393809000651089036182384006679058074951171874999999999999999999999999999999999999999820115964624326372527866898445418283670438023247902166033578925537306854975889227432573469956522340759837684520672240751082426868379116058349609375 and exact-flat at 142.33938090006510890361823840066790580749511718750000000000000000000000000000000000000002139161501764767461830772018486917707702899182997885276171715339646623692878149727828856032949464055828957265159573353230371139943599700927734375. This run re-prepares their midpoint, 142.33938090006510890361823840066790580749511718750000000000000000000000000000000000000000170160574004015593554720501470550272203639707738453468253752297509846121318521001077295366257343731713667055183147880370597704313695430755615234375, with a short experiment name to avoid filename-too-long failures.
autoresearch/snapshots/20260420T015112Z_hybrid_p8_m8_w3_v1136.py	0.071006	0.789778	0.739821	0.375000	0.024580	discard	Restore the compact props8 + minsep8 hybrid shelf anchored at lwindow3, beam3, top4, boardcands2, secsep1, radius0, drop1, props8, total150, and lmargin9.935836791992188. The latest executed bracket is harmful at 142.3393809000651089036182384006679058074951171874999999999999999999999999999999999999999820115964624326372527866898445418283670438023247902166033578925537306854975889227432573469956522340759837684520672240751082426868379116058349609375 and exact-flat at 142.33938090006510890361823840066790580749511718750000000000000000000000000000000000000000170160574004015593554720501470550272203639707738453468253752297509846121318521001077295366257343731713667055183147880370597704313695430755615234375. This run re-prepares their midpoint, 142.339380900065108903618238400667905807495117187499999999999999999999999999999999999999991856601101236396594166947429623665544540099701087375642947707764414573355387066377015150329112835696560219501949351439407109864987432956695556640625, with a short experiment name to avoid filename-too-long failures.
autoresearch/snapshots/20260420T015218Z_hybrid_p8_m8_w3_v1137.py	0.071006	0.789778	0.739821	0.375000	0.024580	discard	Restore the compact props8 + minsep8 hybrid shelf anchored at lwindow3, beam3, top4, boardcands2, secsep1, radius0, drop1, props8, total150, and lmargin9.935836791992188. The latest executed bracket is harmful at 142.339380900065108903618238400667905807495117187499999999999999999999999999999999999999991856601101236396594166947429623665544540099701087375642947707764414573355387066377015150329112835696560219501949351439407109864987432956695556640625 and exact-flat at 142.33938090006510890361823840066790580749511718750000000000000000000000000000000000000000170160574004015593554720501470550272203639707738453468253752297509846121318521001077295366257343731713667055183147880370597704313695430755615234375. This run re-prepares their midpoint, 142.3393809000651089036182384006679058074951171874999999999999999999999999999999999999999967791034206382762648570762221645841332882483892359551627426153697565172842861381938940519958431365068484450268904151215565434540621936321258544921875, with a short experiment name to avoid filename-too-long failures.
autoresearch/snapshots/20260420T015507Z_hybrid_p8_m8_w3_v1138.py	0.071006	0.789778	0.739821	0.375000	0.024580	discard	Restore the compact props8 + minsep8 hybrid shelf anchored at lwindow3, beam3, top4, boardcands2, secsep1, radius0, drop1, props8, total150, and lmargin9.935836791992188. The latest executed bracket is harmful at 142.3393809000651089036182384006679058074951171874999999999999999999999999999999999999999967791034206382762648570762221645841332882483892359551627426153697565172842861381938940519958431365068484450268904151215565434540621936321258544921875 and exact-flat at 142.33938090006510890361823840066790580749511718750000000000000000000000000000000000000000170160574004015593554720501470550272203639707738453468253752297509846121318521001077295366257343731713667055183147880370597704313695430755615234375. This run re-prepares their midpoint, 142.33938090006510890361823840066790580749511718749999999999999999999999999999999999999999924035458033921610020214061843504342766232273331024492264006917242748924873567410233350282920828691199255778936094696263126024859957396984100341796875, with a short experiment name to avoid filename-too-long failures.
autoresearch/snapshots/20260420T015613Z_hybrid_p8_m8_w3_v1139.py	0.071006	0.799339	0.749250	0.375000	0.020699	discard	Restore the compact props8 + minsep8 hybrid shelf anchored at lwindow3, beam3, top4, boardcands2, secsep1, radius0, drop1, props8, total150, and lmargin9.935836791992188. The latest executed bracket is harmful at 142.33938090006510890361823840066790580749511718749999999999999999999999999999999999999999924035458033921610020214061843504342766232273331024492264006917242748924873567410233350282920828691199255778936094696263126024859957396984100341796875 and exact-flat at 142.33938090006510890361823840066790580749511718750000000000000000000000000000000000000000170160574004015593554720501470550272203639707738453468253752297509846121318521001077295366257343731713667055183147880370597704313695430755615234375. This run re-prepares their midpoint, 142.339380900065108903618238400667905807495117187500000000000000000000000000000000000000000470980160189686017874672816570273074849359905347389802588796073762975230960442056553228245890862114564614170596212883168618645868264138698577880859375, with a short experiment name to avoid filename-too-long failures.
autoresearch/snapshots/20260420T015715Z_hybrid_p8_m8_w3_v1140.py	0.071006	0.799339	0.749250	0.375000	0.020699	discard	Restore the compact props8 + minsep8 hybrid shelf anchored at lwindow3, beam3, top4, boardcands2, secsep1, radius0, drop1, props8, total150, and lmargin9.935836791992188. The latest executed bracket is harmful at 142.33938090006510890361823840066790580749511718749999999999999999999999999999999999999999924035458033921610020214061843504342766232273331024492264006917242748924873567410233350282920828691199255778936094696263126024859957396984100341796875 and exact-flat at 142.33938090006510890361823840066790580749511718750000000000000000000000000000000000000000170160574004015593554720501470550272203639707738453468253752297509846121318521001077295366257343731713667055183147880370597704313695430755615234375. This run re-prepares their midpoint, 142.339380900065108903618238400667905807495117187500000000000000000000000000000000000000000470980160189686017874672816570273074849359905347389802588796073762975230960442056553228245890862114564614170596212883168618645868264138698577880859375, with a short experiment name to avoid filename-too-long failures.
autoresearch/snapshots/20260420T015924Z_hybrid_p8_m8_w3_v1141.py	0.071006	0.799339	0.749250	0.375000	0.020699	discard	Restore the compact props8 + minsep8 hybrid shelf anchored at lwindow3, beam3, top4, boardcands2, secsep1, radius0, drop1, props8, total150, and lmargin9.935836791992188. The latest executed bracket is harmful at 142.33938090006510890361823840066790580749511718749999999999999999999999999999999999999999924035458033921610020214061843504342766232273331024492264006917242748924873567410233350282920828691199255778936094696263126024859957396984100341796875 and exact-flat at 142.33938090006510890361823840066790580749511718750000000000000000000000000000000000000000170160574004015593554720501470550272203639707738453468253752297509846121318521001077295366257343731713667055183147880370597704313695430755615234375. This run re-prepares their midpoint, 142.339380900065108903618238400667905807495117187500000000000000000000000000000000000000000470980160189686017874672816570273074849359905347389802588796073762975230960442056553228245890862114564614170596212883168618645868264138698577880859375, with a short experiment name to avoid filename-too-long failures.
autoresearch/snapshots/20260420T020038Z_hybrid_p8_m8_w3_v1142.py	0.071006	0.789778	0.739821	0.375000	0.024580	discard	Restore the compact props8 + minsep8 hybrid shelf anchored at lwindow3, beam3, top4, boardcands2, secsep1, radius0, drop1, props8, total150, and lmargin9.935836791992188. The latest executed bracket is harmful at 142.33938090006510890361823840066790580749511718749999999999999999999999999999999999999999924035458033921610020214061843504342766232273331024492264006917242748924873567410233350282920828691199255778936094696263126024859957396984100341796875 and exact-flat at 142.339380900065108903618238400667905807495117187500000000000000000000000000000000000000000470980160189686017874672816570273074849359905347389802588796073762975230960442056553228245890862114564614170596212883168618645868264138698577880859375. This run re-prepares their midpoint, 142.3393809000651089036182384006679058074951171874999999999999999999999999999999999999999998556673702644510590384067175026582512558413193288173626144326230952322398480580794433655375495745132785859799785799228999394472339190542697906494140625, with a short experiment name to avoid filename-too-long failures.
