snapshot	board_exact	non_empty_accuracy	macro_f1	move_recall	false_change_rate	status	description
autoresearch/snapshots/20260420T050619Z_hybrid_p8_m8_w3_v1267.py	0.071006	0.799339	0.749250	0.375000	0.020699	discard	Restore the compact props8 + minsep8 hybrid shelf anchored at lwindow3, beam3, top4, boardcands2, secsep1, radius0, drop1, props8, total150, and lmargin9.935836791992188. The latest executed bracket is harmful at 142.33938090006510890361823840066790580749511718749999999999999999999999999999999999999999999999999999999999999999999999999976781628075659945807751819454814304804373129905812280061037373373355519199569798909207754677920749369775184182224178146117102833364803093317930360707067026730579269086356154511855649396330036719759970509358026902191340923309326171875 and exact-flat at 142.3393809000651089036182384006679058074951171875000000000000000000000000000000000000000000000000000000000000000000000000005139284379137149031214451380306895715868522409742521391074124882889055658869259011803944069490022975037811379942420615178657005018638369946116484807025023309524305973060160404093934785664881900214828736039862633333541452884674072265625. This run prepares their exact midpoint, 142.33938090006510890361823840066790580749511718750000000000000000000000000000000000000000000000000000000000000000000000000014087235933515718059948166628941630981529177001618746985889311101123037894131194513623597686410489560076648990824192148951836441775593396389547604388658629912911164408478879276397498626489427860954128934878326617763377726078033447265625, with a short experiment name to avoid filename-too-long failures.
autoresearch/snapshots/20260420T050726Z_hybrid_p8_m8_w3_v1268.py	0.071006	0.789778	0.739821	0.375000	0.024580	discard	Restore the compact props8 + minsep8 hybrid shelf anchored at lwindow3, beam3, top4, boardcands2, secsep1, radius0, drop1, props8, total150, and lmargin9.935836791992188. The latest executed bracket is harmful at 142.33938090006510890361823840066790580749511718749999999999999999999999999999999999999999999999999999999999999999999999999976781628075659945807751819454814304804373129905812280061037373373355519199569798909207754677920749369775184182224178146117102833364803093317930360707067026730579269086356154511855649396330036719759970509358026902191340923309326171875 and exact-flat at 142.33938090006510890361823840066790580749511718750000000000000000000000000000000000000000000000000000000000000000000000000014087235933515718059948166628941630981529177001618746985889311101123037894131194513623597686410489560076648990824192148951836441775593396389547604388658629912911164408478879276397498626489427860954128934878326617763377726078033447265625. This run prepares their exact midpoint, 142.339380900065108903618238400667905807495117187499999999999999999999999999999999999999999999999999999999999999999999999999954344320045878319338499930418779678929511534537155135234633422372392785468504967114156761821656194649259165865241851475344696375701982448537389825478628283217452167474175168941265740114097322903570497221181767599773593246936798095703125, with a short experiment name to avoid filename-too-long failures.
autoresearch/snapshots/20260420T050831Z_hybrid_p8_m8_w3_v1269.py	0.071006	0.799339	0.749250	0.375000	0.020699	discard	Restore the compact props8 + minsep8 hybrid shelf anchored at lwindow3, beam3, top4, boardcands2, secsep1, radius0, drop1, props8, total150, and lmargin9.935836791992188. The latest executed bracket is harmful at 142.339380900065108903618238400667905807495117187499999999999999999999999999999999999999999999999999999999999999999999999999954344320045878319338499930418779678929511534537155135234633422372392785468504967114156761821656194649259165865241851475344696375701982448537389825478628283217452167474175168941265740114097322903570497221181767599773593246936798095703125 and exact-flat at 142.33938090006510890361823840066790580749511718750000000000000000000000000000000000000000000000000000000000000000000000000014087235933515718059948166628941630981529177001618746985889311101123037894131194513623597686410489560076648990824192148951836441775593396389547604388658629912911164408478879276397498626489427860954128934878326617763377726078033447265625. This run prepares their exact midpoint, 142.3393809000651089036182384006679058074951171875000000000000000000000000000000000000000000000000000000000000000000000000000476083396905177499689907983540979943724016522766713025467632666918115822049084561251963693428805451250128278867418864824315303967289582062164329346826072911732819057794819808526203631894958007565558932849825168887036852538585662841796875, with a short experiment name to avoid filename-too-long failures.
autoresearch/snapshots/20260420T050939Z_hybrid_p8_m8_w3_v1270.py	0.071006	0.799339	0.749250	0.375000	0.020699	discard	Restore the compact props8 + minsep8 hybrid shelf anchored at lwindow3, beam3, top4, boardcands2, secsep1, radius0, drop1, props8, total150, and lmargin9.935836791992188. The latest executed bracket is harmful at 142.339380900065108903618238400667905807495117187499999999999999999999999999999999999999999999999999999999999999999999999999954344320045878319338499930418779678929511534537155135234633422372392785468504967114156761821656194649259165865241851475344696375701982448537389825478628283217452167474175168941265740114097322903570497221181767599773593246936798095703125 and exact-flat at 142.3393809000651089036182384006679058074951171875000000000000000000000000000000000000000000000000000000000000000000000000000476083396905177499689907983540979943724016522766713025467632666918115822049084561251963693428805451250128278867418864824315303967289582062164329346826072911732819057794819808526203631894958007565558932849825168887036852538585662841796875. This run prepares their exact midpoint, 142.33938090006510890361823840066790580749511718750000000000000000000000000000000000000000000000000000000000000000000000000000097632986819803465374536438643883665095659340691321889069834453210218383670671161967656558226836988713599687599186897888811338621547032737691138008061778719536703662682857489694305165179656183006319525308214224423863925039768218994140625, with a short experiment name to avoid filename-too-long failures.
autoresearch/snapshots/20260420T051046Z_hybrid_p8_m8_w3_v1271.py	0.071006	0.789778	0.739821	0.375000	0.024580	discard	Restore the compact props8 + minsep8 hybrid shelf anchored at lwindow3, beam3, top4, boardcands2, secsep1, radius0, drop1, props8, total150, and lmargin9.935836791992188. The latest executed bracket is harmful at 142.339380900065108903618238400667905807495117187499999999999999999999999999999999999999999999999999999999999999999999999999954344320045878319338499930418779678929511534537155135234633422372392785468504967114156761821656194649259165865241851475344696375701982448537389825478628283217452167474175168941265740114097322903570497221181767599773593246936798095703125 and exact-flat at 142.33938090006510890361823840066790580749511718750000000000000000000000000000000000000000000000000000000000000000000000000000097632986819803465374536438643883665095659340691321889069834453210218383670671161967656558226836988713599687599186897888811338621547032737691138008061778719536703662682857489694305165179656183006319525308214224423863925039768218994140625. This run prepares their exact midpoint, 142.339380900065108903618238400667905807495117187499999999999999999999999999999999999999999999999999999999999999999999999999977660324957038176996122647402609257790234063972034177062665883452247484652605839366916663701962282268197581370616860227116404880958726387957150602779623035206409602050501871919104395882946942366816846237131954922006116248667240142822265625, with a short experiment name to avoid filename-too-long failures.
autoresearch/snapshots/20260420T051151Z_hybrid_p8_m8_w3_v1272.py	0.071006	0.789778	0.739821	0.375000	0.024580	discard	Restore the compact props8 + minsep8 hybrid shelf anchored at lwindow3, beam3, top4, boardcands2, secsep1, radius0, drop1, props8, total150, and lmargin9.935836791992188. The latest executed bracket is harmful at 142.339380900065108903618238400667905807495117187499999999999999999999999999999999999999999999999999999999999999999999999999977660324957038176996122647402609257790234063972034177062665883452247484652605839366916663701962282268197581370616860227116404880958726387957150602779623035206409602050501871919104395882946942366816846237131954922006116248667240142822265625 and exact-flat at 142.33938090006510890361823840066790580749511718750000000000000000000000000000000000000000000000000000000000000000000000000000097632986819803465374536438643883665095659340691321889069834453210218383670671161967656558226836988713599687599186897888811338621547032737691138008061778719536703662682857489694305165179656183006319525308214224423863925039768218994140625. This run prepares their exact midpoint, 142.3393809000651089036182384006679058074951171874999999999999999999999999999999999999999999999999999999999999999999999999999893183274126181058249340058945240472205953286894736979766821139921748342446562754932966146421153260776667891233043646030022591335870983576670309914301204112008883193386652234080237237673717520984400207451070485831223777495324611663818359375, with a short experiment name to avoid filename-too-long failures.
autoresearch/snapshots/20260420T051301Z_hybrid_p8_m8_w3_v1273.py	0.071006	0.789778	0.739821	0.375000	0.024580	discard	Restore the compact props8 + minsep8 hybrid shelf anchored at lwindow3, beam3, top4, boardcands2, secsep1, radius0, drop1, props8, total150, and lmargin9.935836791992188. The latest executed bracket is harmful at 142.3393809000651089036182384006679058074951171874999999999999999999999999999999999999999999999999999999999999999999999999999893183274126181058249340058945240472205953286894736979766821139921748342446562754932966146421153260776667891233043646030022591335870983576670309914301204112008883193386652234080237237673717520984400207451070485831223777495324611663818359375 and exact-flat at 142.33938090006510890361823840066790580749511718750000000000000000000000000000000000000000000000000000000000000000000000000000097632986819803465374536438643883665095659340691321889069834453210218383670671161967656558226836988713599687599186897888811338621547032737691138008061778719536703662682857489694305165179656183006319525308214224423863925039768218994140625. This run prepares their exact midpoint, 142.33938090006510890361823840066790580749511718749999999999999999999999999999999999999999999999999999999999999999999999999999514732864040807023933968514048144193577596104819345843369022926213850904068149355648659011219184798240139299964811679094518625990128434252197118575536909919812767798274689915248338770958415696425160799909459541368050849996507167816162109375, with a short experiment name to avoid filename-too-long failures.
autoresearch/snapshots/20260420T051407Z_hybrid_p8_m8_w3_v1274.py	0.071006	0.789778	0.739821	0.375000	0.024580	discard	Restore the compact props8 + minsep8 hybrid shelf anchored at lwindow3, beam3, top4, boardcands2, secsep1, radius0, drop1, props8, total150, and lmargin9.935836791992188. The latest executed bracket is harmful at 142.33938090006510890361823840066790580749511718749999999999999999999999999999999999999999999999999999999999999999999999999999514732864040807023933968514048144193577596104819345843369022926213850904068149355648659011219184798240139299964811679094518625990128434252197118575536909919812767798274689915248338770958415696425160799909459541368050849996507167816162109375 and exact-flat at 142.33938090006510890361823840066790580749511718750000000000000000000000000000000000000000000000000000000000000000000000000000097632986819803465374536438643883665095659340691321889069834453210218383670671161967656558226836988713599687599186897888811338621547032737691138008061778719536703662682857489694305165179656183006319525308214224423863925039768218994140625. This run prepares their exact midpoint, 142.339380900065108903618238400667905807495117187499999999999999999999999999999999999999999999999999999999999999999999999999998061829254303052446542524763460139293366277227553338662194286897120346438694102588081577847230108934768694937819992884916649823058377334949441282917993443196747357304787737024713219680690359397157401626088368828959573875181376934051513671875, with a short experiment name to avoid filename-too-long failures.
autoresearch/snapshots/20260420T051519Z_hybrid_p8_m8_w3_v1275.py	0.071006	0.789778	0.739821	0.375000	0.024580	discard	Restore the compact props8 + minsep8 hybrid shelf anchored at lwindow3, beam3, top4, boardcands2, secsep1, radius0, drop1, props8, total150, and lmargin9.935836791992188. The latest executed bracket is harmful at 142.339380900065108903618238400667905807495117187499999999999999999999999999999999999999999999999999999999999999999999999999998061829254303052446542524763460139293366277227553338662194286897120346438694102588081577847230108934768694937819992884916649823058377334949441282917993443196747357304787737024713219680690359397157401626088368828959573875181376934051513671875 and exact-flat at 142.33938090006510890361823840066790580749511718750000000000000000000000000000000000000000000000000000000000000000000000000000097632986819803465374536438643883665095659340691321889069834453210218383670671161967656558226836988713599687599186897888811338621547032737691138008061778719536703662682857489694305165179656183006319525308214224423863925039768218994140625. This run prepares their exact midpoint, 142.3393809000651089036182384006679058074951171874999999999999999999999999999999999999999999999999999999999999999999999999999995190795612505435501439445749494879721614353172332787764463157146112651377004071038790717147492394109523459069059309319023816046369238311631763314993056151960571969658081559608281356662434606136102984395852555365991065627895295619964599609375, with a short experiment name to avoid filename-too-long failures.
autoresearch/snapshots/20260420T051628Z_hybrid_p8_m8_w3_v1276.py	0.071006	0.799339	0.749250	0.375000	0.020699	discard	Restore the compact props8 + minsep8 hybrid shelf anchored at lwindow3, beam3, top4, boardcands2, secsep1, radius0, drop1, props8, total150, and lmargin9.935836791992188. The latest executed bracket is harmful at 142.3393809000651089036182384006679058074951171874999999999999999999999999999999999999999999999999999999999999999999999999999995190795612505435501439445749494879721614353172332787764463157146112651377004071038790717147492394109523459069059309319023816046369238311631763314993056151960571969658081559608281356662434606136102984395852555365991065627895295619964599609375 and exact-flat at 142.33938090006510890361823840066790580749511718750000000000000000000000000000000000000000000000000000000000000000000000000000097632986819803465374536438643883665095659340691321889069834453210218383670671161967656558226836988713599687599186897888811338621547032737691138008061778719536703662682857489694305165179656183006319525308214224423863925039768218994140625. This run prepares their exact midpoint, 142.33938090006510890361823840066790580749511718750000000000000000000000000000000000000000000000000000000000000000000000000000024770471472428910194465448069416231155901436207324883357233012335672448720355936177781864850880464904417139144889995539524749542619707927004385578996170119571211679631836542888559365902001122183674684633369889041887290659360587596893310546875, with a short experiment name to avoid filename-too-long failures.
autoresearch/snapshots/20260420T051737Z_hybrid_p8_m8_w3_v1277.py	0.071006	0.789778	0.739821	0.375000	0.024580	discard	Restore the compact props8 + minsep8 hybrid shelf anchored at lwindow3, beam3, top4, boardcands2, secsep1, radius0, drop1, props8, total150, and lmargin9.935836791992188. The latest executed bracket is harmful at 142.3393809000651089036182384006679058074951171874999999999999999999999999999999999999999999999999999999999999999999999999999995190795612505435501439445749494879721614353172332787764463157146112651377004071038790717147492394109523459069059309319023816046369238311631763314993056151960571969658081559608281356662434606136102984395852555365991065627895295619964599609375 and exact-flat at 142.33938090006510890361823840066790580749511718750000000000000000000000000000000000000000000000000000000000000000000000000000024770471472428910194465448069416231155901436207324883357233012335672448720355936177781864850880464904417139144889995539524749542619707927004385578996170119571211679631836542888559365902001122183674684633369889041887290659360587596893310546875. This run prepares their exact midpoint, 142.339380900065108903618238400667905807495117187499999999999999999999999999999999999999999999999999999999999999999999999999999883392137987416326044299527821825141860224839653263805009322918983994812451983232828445181629022029998258649177415443648814550031560455216610093644633658195884656881063260694856864662631735917723522642959477213508989734691567718982696533203125, with a short experiment name to avoid filename-too-long failures.
autoresearch/snapshots/20260420T051845Z_hybrid_p8_m8_w3_v1278.py	0.071006	0.799339	0.749250	0.375000	0.020699	discard	Restore the compact props8 + minsep8 hybrid shelf anchored at lwindow3, beam3, top4, boardcands2, secsep1, radius0, drop1, props8, total150, and lmargin9.935836791992188. The latest executed bracket is harmful at 142.339380900065108903618238400667905807495117187499999999999999999999999999999999999999999999999999999999999999999999999999999883392137987416326044299527821825141860224839653263805009322918983994812451983232828445181629022029998258649177415443648814550031560455216610093644633658195884656881063260694856864662631735917723522642959477213508989734691567718982696533203125 and exact-flat at 142.33938090006510890361823840066790580749511718750000000000000000000000000000000000000000000000000000000000000000000000000000024770471472428910194465448069416231155901436207324883357233012335672448720355936177781864850880464904417139144889995539524749542619707927004385578996170119571211679631836542888559365902001122183674684633369889041887290659360587596893310546875. This run prepares their exact midpoint, 142.3393809000651089036182384006679058074951171875000000000000000000000000000000000000000000000000000000000000000000000000000000655484263558527139944770042579937267096196008632563192908265211703596498277712973031319150689133395212150203131576995220310227288787672433269747172976796957983868386908130618712291608258735697801347446465880519639313206425867974758148193359375, with a short experiment name to avoid filename-too-long failures.
autoresearch/snapshots/20260420T051956Z_hybrid_p8_m8_w3_v1279.py	0.071006	0.789778	0.739821	0.375000	0.024580	discard	Restore the compact props8 + minsep8 hybrid shelf anchored at lwindow3, beam3, top4, boardcands2, secsep1, radius0, drop1, props8, total150, and lmargin9.935836791992188. The latest executed bracket is harmful at 142.339380900065108903618238400667905807495117187499999999999999999999999999999999999999999999999999999999999999999999999999999883392137987416326044299527821825141860224839653263805009322918983994812451983232828445181629022029998258649177415443648814550031560455216610093644633658195884656881063260694856864662631735917723522642959477213508989734691567718982696533203125 and exact-flat at 142.3393809000651089036182384006679058074951171875000000000000000000000000000000000000000000000000000000000000000000000000000000655484263558527139944770042579937267096196008632563192908265211703596498277712973031319150689133395212150203131576995220310227288787672433269747172976796957983868386908130618712291608258735697801347446465880519639313206425867974758148193359375. This run prepares their exact midpoint, 142.33938090006510890361823840066790580749511718749999999999999999999999999999999999999999999999999999999999999999999999999999997447028217163452001938826603990943428492222025826006215007472007717723113987726506578854834896768475973683474528657158542278638021961122996853418096566894584152185987703687836404691172880474375182869380303263273646052766707725822925567626953125, with a short experiment name to avoid filename-too-long failures.
autoresearch/snapshots/20260420T052107Z_hybrid_p8_m8_w3_v1280.py	0.071006	0.799339	0.749250	0.375000	0.020699	discard	Restore the compact props8 + minsep8 hybrid shelf anchored at lwindow3, beam3, top4, boardcands2, secsep1, radius0, drop1, props8, total150, and lmargin9.935836791992188. The latest executed bracket is harmful at 142.33938090006510890361823840066790580749511718749999999999999999999999999999999999999999999999999999999999999999999999999999997447028217163452001938826603990943428492222025826006215007472007717723113987726506578854834896768475973683474528657158542278638021961122996853418096566894584152185987703687836404691172880474375182869380303263273646052766707725822925567626953125 and exact-flat at 142.3393809000651089036182384006679058074951171875000000000000000000000000000000000000000000000000000000000000000000000000000000655484263558527139944770042579937267096196008632563192908265211703596498277712973031319150689133395212150203131576995220310227288787672433269747172976796957983868386908130618712291608258735697801347446465880519639313206425867974758148193359375. This run prepares their exact midpoint, 142.339380900065108903618238400667905807495117187500000000000000000000000000000000000000000000000000000000000000000000000000000020009354263743617006932635148951580497270910560758190720450620623768440483824281184460231708940512140475927529222135553726904554549189236647754449131674320819954349283924970117638036277339156765981719224810342350195924154832027852535247802734375, with a short experiment name to avoid filename-too-long failures.
