snapshot	board_exact	non_empty_accuracy	macro_f1	move_recall	false_change_rate	status	description
autoresearch/snapshots/20260420T065347Z_hybrid_p8_m8_w3_v1341.py	0.071006	0.789778	0.739821	0.375000	0.024580	discard	Restore the compact props8 + minsep8 hybrid shelf anchored at lwindow3, beam3, top4, boardcands2, secsep1, radius0, drop1, props8, total150, and lmargin9.935836791992188. The true executed harmful/flat bracket is now harmful at 142.339380900065108903618238400667905807495117187499999999999999999999999999999999999999999999999999999999999999999999999999999999999999999999801511442594139061646282388511472682863731960098898938145653302662158209892770606576766603005456194336238156245782804309333787864980170864092445808848567726507364968076384277770865572142221566047598853867597516750337075010041096141327112947781274865377554306178353726863861083984375 and flat at 142.33938090006510890361823840066790580749511718750000000000000000000000000000000000000000000000000000000000000000000000000000000000000000000010807252544130453411235412715816284075496948509289573042593434437548568131465247719839427860777446546511014920054526995986120308436929214559681748077097659255883711851540926943229059380753753397130586659805706325982996729589486508923563090103614481307658934383653104305267333984375. This run prepares their exact midpoint, 142.3393809000651089036182384006679058074951171874999999999999999999999999999999999999999999999999999999999999999999999999999999999999999999999547919840177217978793182578348177618093507225958973342857938235188219456037115418875804408066153299006741527231640371345974954746747315048446316448097721595331010432958967736015780829748795500094523602328272900050835211529679806152813719244087098392270718250074423849582672119140625, with a short experiment name to avoid filename-too-long failures.
autoresearch/snapshots/20260420T065503Z_hybrid_p8_m8_w3_v1342.py	0.071006	0.799339	0.749250	0.375000	0.020699	discard	Restore the compact props8 + minsep8 hybrid shelf anchored at lwindow3, beam3, top4, boardcands2, secsep1, radius0, drop1, props8, total150, and lmargin9.935836791992188. The true executed harmful/flat bracket is now harmful at 142.3393809000651089036182384006679058074951171874999999999999999999999999999999999999999999999999999999999999999999999999999999999999999999999547919840177217978793182578348177618093507225958973342857938235188219456037115418875804408066153299006741527231640371345974954746747315048446316448097721595331010432958967736015780829748795500094523602328272900050835211529679806152813719244087098392270718250074423849582672119140625 and flat at 142.33938090006510890361823840066790580749511718750000000000000000000000000000000000000000000000000000000000000000000000000000000000000000000010807252544130453411235412715816284075496948509289573042593434437548568131465247719839427860777446546511014920054526995986120308436929214559681748077097659255883711851540926943229059380753753397130586659805706325982996729589486508923563090103614481307658934383653104305267333984375. This run prepares their exact midpoint, 142.33938090006510890361823840066790580749511718750000000000000000000000000000000000000000000000000000000000000000000000000000000000000000000003143225472951316599583619249649030128216010384439653235586408394715381345918200954298735970719489768289215096185465354722934927952201182522072456279037437604596908090565302151693433839120854199037911341544217663245674422443142285225850141272242732615183058442198671400547027587890625, with a short experiment name to avoid filename-too-long failures.
autoresearch/snapshots/20260420T065613Z_hybrid_p8_m8_w3_v1343.py	0.071006	0.789778	0.739821	0.375000	0.024580	discard	Restore the compact props8 + minsep8 hybrid shelf anchored at lwindow3, beam3, top4, boardcands2, secsep1, radius0, drop1, props8, total150, and lmargin9.935836791992188. The true executed harmful/flat bracket is now harmful at 142.3393809000651089036182384006679058074951171874999999999999999999999999999999999999999999999999999999999999999999999999999999999999999999999547919840177217978793182578348177618093507225958973342857938235188219456037115418875804408066153299006741527231640371345974954746747315048446316448097721595331010432958967736015780829748795500094523602328272900050835211529679806152813719244087098392270718250074423849582672119140625 and flat at 142.33938090006510890361823840066790580749511718750000000000000000000000000000000000000000000000000000000000000000000000000000000000000000000003143225472951316599583619249649030128216010384439653235586408394715381345918200954298735970719489768289215096185465354722934927952201182522072456279037437604596908090565302151693433839120854199037911341544217663245674422443142285225850141272242732615183058442198671400547027587890625. This run prepares their exact midpoint, 142.339380900065108903618238400667905807495117187499999999999999999999999999999999999999999999999999999999999999999999999999999999999999999999993112119373617481937577225165654031545755413220146933320828953732987879531446775715283900256905113791783151842509345340913422377098371665032678103800073267789535062100774897559256210683044045999915736824134733318770132688699701733769936668565568582689451204714714549481868743896484375, with a short experiment name to avoid filename-too-long failures.
autoresearch/snapshots/20260420T065728Z_hybrid_p8_m8_w3_v1344.py	0.071006	0.799339	0.749250	0.375000	0.020699	discard	Restore the compact props8 + minsep8 hybrid shelf anchored at lwindow3, beam3, top4, boardcands2, secsep1, radius0, drop1, props8, total150, and lmargin9.935836791992188. The true executed harmful/flat bracket is now harmful at 142.339380900065108903618238400667905807495117187499999999999999999999999999999999999999999999999999999999999999999999999999999999999999999999993112119373617481937577225165654031545755413220146933320828953732987879531446775715283900256905113791783151842509345340913422377098371665032678103800073267789535062100774897559256210683044045999915736824134733318770132688699701733769936668565568582689451204714714549481868743896484375 and flat at 142.33938090006510890361823840066790580749511718750000000000000000000000000000000000000000000000000000000000000000000000000000000000000000000003143225472951316599583619249649030128216010384439653235586408394715381345918200954298735970719489768289215096185465354722934927952201182522072456279037437604596908090565302151693433839120854199037911341544217663245674422443142285225850141272242732615183058442198671400547027587890625. This run prepares their exact midpoint, 142.3393809000651089036182384006679058074951171875000000000000000000000000000000000000000000000000000000000000000000000000000000000000000000000122721870515653239667067088310721664139577585322717328383465188400708464953143926291356299820500057373376514021819994440713858283101917451267013332952238219177520715032139595380952745371262939951474251197884549756134384565655622930142190406439979544206408945683506317436695098876953125, with a short experiment name to avoid filename-too-long failures.
autoresearch/snapshots/20260420T065852Z_hybrid_p8_m8_w3_v1345.py	0.071006	0.799339	0.749250	0.375000	0.020699	discard	Restore the compact props8 + minsep8 hybrid shelf anchored at lwindow3, beam3, top4, boardcands2, secsep1, radius0, drop1, props8, total150, and lmargin9.935836791992188. The true executed harmful/flat bracket is now harmful at 142.339380900065108903618238400667905807495117187499999999999999999999999999999999999999999999999999999999999999999999999999999999999999999999993112119373617481937577225165654031545755413220146933320828953732987879531446775715283900256905113791783151842509345340913422377098371665032678103800073267789535062100774897559256210683044045999915736824134733318770132688699701733769936668565568582689451204714714549481868743896484375 and flat at 142.3393809000651089036182384006679058074951171875000000000000000000000000000000000000000000000000000000000000000000000000000000000000000000000122721870515653239667067088310721664139577585322717328383465188400708464953143926291356299820500057373376514021819994440713858283101917451267013332952238219177520715032139595380952745371262939951474251197884549756134384565655622930142190406439979544206408945683506317436695098876953125. This run prepares their exact midpoint, 142.33938090006510890361823840066790580749511718750000000000000000000000000000000000000000000000000000000000000000000000000000000000000000000000269215321259140295214196699836309897985658587620933307958773628652936301338058417220976511947755976456040162234567239249240410270428170507968971854764854485364356680199442854867574261008516999753158097196159414719178557263263201339207785460478326855504604964153259061276912689208984375, with a short experiment name to avoid filename-too-long failures.
autoresearch/snapshots/20260420T070008Z_hybrid_p8_m8_w3_v1346.py	0.071006	0.789778	0.739821	0.375000	0.024580	discard	Restore the compact props8 + minsep8 hybrid shelf anchored at lwindow3, beam3, top4, boardcands2, secsep1, radius0, drop1, props8, total150, and lmargin9.935836791992188. The true executed harmful/flat bracket is now harmful at 142.339380900065108903618238400667905807495117187499999999999999999999999999999999999999999999999999999999999999999999999999999999999999999999993112119373617481937577225165654031545755413220146933320828953732987879531446775715283900256905113791783151842509345340913422377098371665032678103800073267789535062100774897559256210683044045999915736824134733318770132688699701733769936668565568582689451204714714549481868743896484375 and flat at 142.33938090006510890361823840066790580749511718750000000000000000000000000000000000000000000000000000000000000000000000000000000000000000000000269215321259140295214196699836309897985658587620933307958773628652936301338058417220976511947755976456040162234567239249240410270428170507968971854764854485364356680199442854867574261008516999753158097196159414719178557263263201339207785460478326855504604964153259061276912689208984375. This run prepares their exact midpoint, 142.339380900065108903618238400667905807495117187499999999999999999999999999999999999999999999999999999999999999999999999999999999999999999999997902136293104442444859596082008565262805999548178133200208345009758621272413679943746832688191336778171776732427508866702913239901326685056183911173860906321589314451384663053965976646564607998723658898048163732980959130666166873581007261585175925622248627178123570047318935394287109375, with a short experiment name to avoid filename-too-long failures.
autoresearch/snapshots/20260420T070130Z_hybrid_p8_m8_w3_v1347.py	0.071006	0.789778	0.739821	0.375000	0.024580	discard	Restore the compact props8 + minsep8 hybrid shelf anchored at lwindow3, beam3, top4, boardcands2, secsep1, radius0, drop1, props8, total150, and lmargin9.935836791992188. The true executed harmful/flat bracket is now harmful at 142.339380900065108903618238400667905807495117187499999999999999999999999999999999999999999999999999999999999999999999999999999999999999999999993112119373617481937577225165654031545755413220146933320828953732987879531446775715283900256905113791783151842509345340913422377098371665032678103800073267789535062100774897559256210683044045999915736824134733318770132688699701733769936668565568582689451204714714549481868743896484375 and flat at 142.33938090006510890361823840066790580749511718750000000000000000000000000000000000000000000000000000000000000000000000000000000000000000000000269215321259140295214196699836309897985658587620933307958773628652936301338058417220976511947755976456040162234567239249240410270428170507968971854764854485364356680199442854867574261008516999753158097196159414719178557263201339207785460478326855504604964153259061276912689208984375. This run prepares their exact midpoint, 142.339380900065108903618238400667905807495117187499999999999999999999999999999999999999999999999999999999999999999999999999999999999999999999997902136293104442444859596082008565262805999548178133200208345009758621272413679943746832688191336778171776732427508866702913239901326685056183911173860906321589314451384663053965976646564607998723658898048163732980959130666166873581007261585175925622248627178123570047318935394287109375, with a short experiment name to avoid filename-too-long failures.
autoresearch/snapshots/20260420T070249Z_hybrid_p8_m8_w3_v1348.py	0.071006	0.799339	0.749250	0.375000	0.020699	discard	Restore the compact props8 + minsep8 hybrid shelf anchored at lwindow3, beam3, top4, boardcands2, secsep1, radius0, drop1, props8, total150, and lmargin9.935836791992188. The true executed harmful/flat bracket is now harmful at 142.339380900065108903618238400667905807495117187499999999999999999999999999999999999999999999999999999999999999999999999999999999999999999999997902136293104442444859596082008565262805999548178133200208345009758621272413679943746832688191336778171776732427508866702913239901326685056183911173860906321589314451384663053965976646564607998723658898048163732980959130666166873581007261585175925622248627178123570047318935394287109375 and flat at 142.33938090006510890361823840066790580749511718750000000000000000000000000000000000000000000000000000000000000000000000000000000000000000000000269215321259140295214196699836309897985658587620933307958773628652936301338058417220976511947755976456040162234567239249240410270428170507968971854764854485364356680199442854867574261008516999753158097196159414719178557263263201339207785460478326855504604964153259061276912689208984375. This run prepares their exact midpoint, 142.3393809000651089036182384006679058074951171875000000000000000000000000000000000000000000000000000000000000000000000000000000000000000000000002971447528479226985007815401858321213312927121937331398980406481439921428971320579782989038344482713660891773865906295976586713028041950679368148607547255876164406266895458013208596283248889981276199350048789400863723516493994434865425580949795970886473384098280803300440311431884765625, with a short experiment name to avoid filename-too-long failures.
autoresearch/snapshots/20260420T070410Z_hybrid_p8_m8_w3_v1348.py	0.071006	0.799339	0.749250	0.375000	0.020699	discard	Restore the compact props8 + minsep8 hybrid shelf anchored at lwindow3, beam3, top4, boardcands2, secsep1, radius0, drop1, props8, total150, and lmargin9.935836791992188. The true executed harmful/flat bracket is now harmful at 142.339380900065108903618238400667905807495117187499999999999999999999999999999999999999999999999999999999999999999999999999999999999999999999997902136293104442444859596082008565262805999548178133200208345009758621272413679943746832688191336778171776732427508866702913239901326685056183911173860906321589314451384663053965976646564607998723658898048163732980959130666166873581007261585175925622248627178123570047318935394287109375 and flat at 142.33938090006510890361823840066790580749511718750000000000000000000000000000000000000000000000000000000000000000000000000000000000000000000000269215321259140295214196699836309897985658587620933307958773628652936301338058417220976511947755976456040162234567239249240410270428170507968971854764854485364356680199442854867574261008516999753158097196159414719178557263201339207785460478326855504604964153259061276912689208984375. This run prepares their exact midpoint, 142.3393809000651089036182384006679058074951171875000000000000000000000000000000000000000000000000000000000000000000000000000000000000000000000002971447528479226985007815401858321213312927121937331398980406481439921428971320579782989038344482713660891773865906295976586713028041950679368148607547255876164406266895458013208596283248889981276199350048789400863723516493994434865425580949795970886473384098280803300440311431884765625, with a short experiment name to avoid filename-too-long failures.
autoresearch/snapshots/20260420T070527Z_hybrid_p8_m8_w3_v1349.py	0.071006	0.789778	0.739821	0.375000	0.024580	discard	Restore the compact props8 + minsep8 hybrid shelf anchored at lwindow3, beam3, top4, boardcands2, secsep1, radius0, drop1, props8, total150, and lmargin9.935836791992188. The true executed harmful/flat bracket is now harmful at 142.339380900065108903618238400667905807495117187499999999999999999999999999999999999999999999999999999999999999999999999999999999999999999999997902136293104442444859596082008565262805999548178133200208345009758621272413679943746832688191336778171776732427508866702913239901326685056183911173860906321589314451384663053965976646564607998723658898048163732980959130666166873581007261585175925622248627178123570047318935394287109375 and flat at 142.3393809000651089036182384006679058074951171875000000000000000000000000000000000000000000000000000000000000000000000000000000000000000000000002971447528479226985007815401858321213312927121937331398980406481439921428971320579782989038344482713660891773865906295976586713028041950679368148607547255876164406266895458013208596283248889981276199350048789400863723516493994434865425580949795970886473384098280803300440311431884765625. This run prepares their exact midpoint, 142.33938090006510890361823840066790580749511718749999999999999999999999999999999999999999999999999999999999999999999999999999999999999999999999909964052297618257168018881109719869206864613018593317005319282895130670765540600086256579601289252476893295490704974815028595560206544006206036301730781595460287753903710442764341813744474849842563941652652133653366574115778315853377490984007776135544798279397582518868148326873779296875, with a short experiment name to avoid filename-too-long failures.
autoresearch/snapshots/20260420T071042Z_hybrid_p8_m8_w3_v1350.py	0.071006	0.789778	0.739821	0.375000	0.024580	discard	Restore the compact props8 + minsep8 hybrid shelf anchored at lwindow3, beam3, top4, boardcands2, secsep1, radius0, drop1, props8, total150, and lmargin9.935836791992188. The true executed harmful/flat bracket is now harmful at 142.33938090006510890361823840066790580749511718749999999999999999999999999999999999999999999999999999999999999999999999999999999999999999999999909964052297618257168018881109719869206864613018593317005319282895130670765540600086256579601289252476893295490704974815028595560206544006206036301730781595460287753903710442764341813744474849842563941652652133653366574115778315853377490984007776135544798279397582518868148326873779296875 and flat at 142.3393809000651089036182384006679058074951171875000000000000000000000000000000000000000000000000000000000000000000000000000000000000000000000002971447528479226985007815401858321213312927121937331398980406481439921428971320579782989038344482713660891773865906295976586713028041950679368148607547255876164406266895458013208596283248889981276199350048789400863723516493994434865425580949795970886473384098280803300440311431884765625. This run prepares their exact midpoint, 142.339380900065108903618238400667905807495117187499999999999999999999999999999999999999999999999999999999999999999999999999999999999999999999999698392637912052635090485175641515406699969421189833154975616738547649425276269029420432349923670398067511066146820188873972313452434817564998588939031270771109659082863325114482138882884818748276629675765700138310019046403591301010158733967528679222047660601901952759362757205963134765625, with a short experiment name to avoid filename-too-long failures.
autoresearch/snapshots/20260420T071151Z_hybrid_p8_m8_w3_v1351.py	0.071006	0.789778	0.739821	0.375000	0.024580	discard	Restore the compact props8 + minsep8 hybrid shelf anchored at lwindow3, beam3, top4, boardcands2, secsep1, radius0, drop1, props8, total150, and lmargin9.935836791992188. The true executed harmful/flat bracket is now harmful at 142.339380900065108903618238400667905807495117187499999999999999999999999999999999999999999999999999999999999999999999999999999999999999999999999698392637912052635090485175641515406699969421189833154975616738547649425276269029420432349923670398067511066146820188873972313452434817564998588939031270771109659082863325114482138882884818748276629675765700138310019046403591301010158733967528679222047660601901952759362757205963134765625 and flat at 142.3393809000651089036182384006679058074951171875000000000000000000000000000000000000000000000000000000000000000000000000000000000000000000000002971447528479226985007815401858321213312927121937331398980406481439921428971320579782989038344482713660891773865906295976586713028041950679368148607547255876164406266895458013208596283248889981276199350048789400863723516493994434865425580949795970886473384098280803300440311431884765625. This run prepares their exact midpoint, 142.3393809000651089036182384006679058074951171874999999999999999999999999999999999999999999999999999999999999999999999999999999999999999999999999977686953799876667956333579136737640156310666917831474368286933458207840867005436993656268790593347168001217667054092358154923776195063164677018998929981793630498547764354579014992556048538732021248053852895391981956990264953722483506460312541381553474995058650165447033941745758056640625, with a short experiment name to avoid filename-too-long failures.
