snapshot	board_exact	non_empty_accuracy	macro_f1	move_recall	false_change_rate	status	description
autoresearch/snapshots/20260416T234051Z_hybrid_lookahead_segmental_drop1_boardcands2_ratio95_props14_v20.py	0.252071	0.847501	0.813385	0.453125	0.016818	keep	Hybrid decoder keeps the baseline lookahead path unless a conservative board-only segmental pass wins the current score-gain gates, while keeping the stronger nearby-secondary pruning from v18 and using a midpoint proposal budget to test whether the v18 gain survives with slightly less search than 16 proposals but without the v19 collapse at 12.
autoresearch/snapshots/20260416T234204Z_hybrid_lookahead_segmental_drop1_boardcands2_ratio95_props20_v21.py	0.237870	0.866674	0.846155	0.453125	0.019405	discard	Hybrid decoder keeps the baseline lookahead path unless a conservative board-only segmental pass wins the current score-gain gates, while keeping the stronger nearby-secondary pruning from v18 and relaxing the proposal budget slightly to test whether useful distant temporal repair hypotheses were lost at 16 proposals.
autoresearch/snapshots/20260416T234529Z_hybrid_lookahead_segmental_drop1_boardcands2_ratio90_props16_v22.py	0.252071	0.884140	0.856280	0.484375	0.019405	keep	Hybrid decoder keeps the baseline lookahead path unless a conservative board-only segmental pass wins the current score-gain gates, while restoring the stronger 16-proposal budget from v18 and slightly relaxing the nearby-secondary gate to test whether some useful close alternate event timings were pruned away at ratio95.
autoresearch/snapshots/20260416T234624Z_hybrid_lookahead_segmental_drop1_boardcands2_ratio90_props16_secondarysep1_v23.py	0.250888	0.884089	0.856255	0.484375	0.020699	discard	Hybrid decoder keeps the baseline lookahead path unless a conservative board-only segmental pass wins the current score-gain gates, while keeping the current strong 16-proposal shape and allowing even closer nearby-secondary events to test whether one-frame transition timing ambiguity is still being pruned away before hybrid selection.
autoresearch/snapshots/20260416T234730Z_hybrid_lookahead_segmental_drop1_boardcands2_ratio90_props16_minsep3_v24.py	0.252071	0.884140	0.856280	0.484375	0.019405	keep	Hybrid decoder keeps the baseline lookahead path unless a conservative board-only segmental pass wins the current score-gain gates, while keeping the current strong 16-proposal shape and slightly relaxing primary event spacing to test whether temporal repair needs denser move-timing hypotheses than min_event_separation=4 without reopening the known-bad sep2 search.
autoresearch/snapshots/20260416T234833Z_hybrid_lookahead_segmental_drop1_boardcands2_ratio90_props16_minsep3_total125_v25.py	0.252071	0.884140	0.856280	0.484375	0.019405	keep	Hybrid decoder keeps the baseline lookahead path unless a conservative board-only segmental pass wins the current score-gain gates, while keeping the current strong 16-proposal shape and lowering only the total score-gain gate to test whether shorter temporal repair segments are being blocked despite still meeting the per-added-move quality bar.
autoresearch/snapshots/20260416T234923Z_hybrid_lookahead_segmental_drop1_boardcands2_ratio90_props16_minsep3_total125_permove125_v26.py	0.252071	0.884140	0.856280	0.484375	0.019405	keep	Hybrid decoder keeps the baseline lookahead path unless a conservative board-only segmental pass wins the current score-gain gates, while keeping the current strong 16-proposal shape and lowering the per-added-move gain gate to test whether useful temporal repairs are being blocked by move-normalized scoring even after the lower total-gain gate proved inactive.
autoresearch/snapshots/20260416T235017Z_hybrid_lookahead_segmental_drop1_boardcands2_ratio90_props16_minsep3_total125_permove125_m9p5_v27.py	0.252071	0.884140	0.856280	0.484375	0.019405	keep	Hybrid decoder keeps the baseline lookahead path unless a conservative board-only segmental pass wins the current score-gain gates, while keeping the current strong 16-proposal shape and slightly lowering the segmental move margin to test whether missed transition-frame repairs still need a bit more move sensitivity now that recent hybrid-gate tweaks were inactive.
autoresearch/snapshots/20260416T235109Z_hybrid_lookahead_segmental_drop1_boardcands2_ratio90_props16_minsep3_total125_permove125_m9p5_r2_v28.py	0.252071	0.884140	0.856280	0.484375	0.019405	keep	Hybrid decoder keeps the baseline lookahead path unless a conservative board-only segmental pass wins the current score-gain gates, while keeping the current strong 16-proposal shape and widening the segment event window to test whether transition-frame ambiguity needs a bit more local temporal context now that recent gate and margin tweaks were inactive.
autoresearch/snapshots/20260416T235220Z_hybrid_lookahead_segmental_drop1_boardcands2_ratio90_props18_minsep3_total125_permove125_m9p5_r2_v29.py	0.252071	0.883210	0.849190	0.468750	0.020699	keep	Hybrid decoder keeps the baseline lookahead path unless a conservative board-only segmental pass wins the current score-gain gates, while keeping the current strong shape and slightly raising the proposal budget to test whether the active proposal-budget lever has additional board_exact headroom between the strong 16-proposal result and the worse 20-proposal run.
autoresearch/snapshots/20260416T235347Z_hybrid_lookahead_segmental_drop1_boardcands2_ratio90_props17_minsep3_total125_permove125_m9p5_r2_v30.py	0.252071	0.898248	0.860342	0.484375	0.020699	keep	Hybrid decoder keeps the baseline lookahead path unless a conservative board-only segmental pass wins the current score-gain gates, while keeping the current strong shape and trimming the proposal budget by one from the weaker 18-proposal run to test whether the secondary-metric degradation starts immediately above the strong 16-proposal setting or only at higher search breadth.
autoresearch/snapshots/20260416T235440Z_hybrid_lookahead_segmental_drop1_boardcands2_ratio90_props17_minsep3_total125_permove125_m10_r2_v31.py	0.252071	0.884140	0.856280	0.484375	0.019405	keep	Hybrid decoder keeps the baseline lookahead path unless a conservative board-only segmental pass wins the current score-gain gates, while keeping the new strong 17-proposal shape and restoring a slightly more conservative move margin to test whether the v30 non-empty and macro gains can be kept while trimming its false-change regression.
autoresearch/snapshots/20260416T235531Z_hybrid_lookahead_segmental_drop1_boardcands2_ratio90_props17_minsep3_total125_permove125_m9p75_r2_v32.py	0.252071	0.898248	0.860342	0.484375	0.020699	keep	Hybrid decoder keeps the baseline lookahead path unless a conservative board-only segmental pass wins the current score-gain gates, while keeping the strong 17-proposal shape and splitting the move-margin difference between v30 and v31 to test whether some of v30's non-empty and macro gains can be kept without fully inheriting its false-change regression.
autoresearch/snapshots/20260416T235616Z_hybrid_lookahead_segmental_drop1_boardcands2_ratio90_props17_minsep3_total125_permove125_m9p875_r2_v33.py	0.252071	0.898248	0.860342	0.484375	0.020699	keep	Hybrid decoder keeps the baseline lookahead path unless a conservative board-only segmental pass wins the current score-gain gates, while keeping the strong 17-proposal shape and bisecting the active move-margin transition between v32 and v31 to test whether the better non-empty and macro profile survives just below the apparent threshold where false-change improves.
autoresearch/snapshots/20260416T235706Z_hybrid_lookahead_segmental_drop1_boardcands2_ratio90_props17_minsep3_total125_permove125_m9p9375_r2_v34.py	0.252071	0.884140	0.856280	0.484375	0.019405	keep	Hybrid decoder keeps the baseline lookahead path unless a conservative board-only segmental pass wins the current score-gain gates, while keeping the strong 17-proposal shape and continuing the move-margin bisection just below 10.0 to locate the smallest conservative shift that preserves the stronger non-empty and macro profile.
autoresearch/snapshots/20260416T235755Z_hybrid_lookahead_segmental_drop1_boardcands2_ratio90_props17_minsep3_total125_permove125_m9p90625_r2_v35.py	0.252071	0.884140	0.856280	0.484375	0.019405	keep	Hybrid decoder keeps the baseline lookahead path unless a conservative board-only segmental pass wins the current score-gain gates, while keeping the strong 17-proposal shape and bisecting the newly narrowed move-margin boundary to locate the smallest conservative shift that still preserves the stronger non-empty and macro profile.
autoresearch/snapshots/20260416T235848Z_hybrid_lookahead_segmental_drop1_boardcands2_ratio90_props17_minsep3_total125_permove125_m9p890625_r2_v36.py	0.252071	0.898248	0.860342	0.484375	0.020699	keep	Hybrid decoder keeps the baseline lookahead path unless a conservative board-only segmental pass wins the current score-gain gates, while keeping the strong 17-proposal shape and further bisecting the move-margin boundary to locate the smallest conservative shift between v33 and v35 that still preserves the stronger non-empty and macro profile.
autoresearch/snapshots/20260416T235933Z_hybrid_lookahead_segmental_drop1_boardcands2_ratio90_props17_minsep3_total125_permove125_m9p8984375_r2_v37.py	0.252071	0.884140	0.856280	0.484375	0.019405	keep	Hybrid decoder keeps the baseline lookahead path unless a conservative board-only segmental pass wins the current score-gain gates, while keeping the strong 17-proposal shape and continuing the move-margin bisection to locate the smallest conservative shift between v36 and v35 that still preserves the stronger non-empty and macro profile.
autoresearch/snapshots/20260417T000019Z_hybrid_lookahead_segmental_drop1_boardcands2_ratio90_props17_minsep3_total125_permove125_m9p89453125_r2_v38.py	0.252071	0.898248	0.860342	0.484375	0.020699	keep	Hybrid decoder keeps the baseline lookahead path unless a conservative board-only segmental pass wins the current score-gain gates, while keeping the strong 17-proposal shape and continuing the move-margin bisection to locate the smallest conservative shift between v36 and v37 that still preserves the stronger non-empty and macro profile.
autoresearch/snapshots/20260417T000141Z_hybrid_lookahead_segmental_drop1_boardcands2_ratio90_props17_minsep3_total125_permove125_m9p89453125_r2_v38.py	0.252071	0.898248	0.860342	0.484375	0.020699	keep	Hybrid decoder keeps the baseline lookahead path unless a conservative board-only segmental pass wins the current score-gain gates, while keeping the strong 17-proposal shape and continuing the move-margin bisection to locate the smallest conservative shift between v36 and v37 that still preserves the stronger non-empty and macro profile.
autoresearch/snapshots/20260417T000230Z_hybrid_lookahead_segmental_drop1_boardcands2_ratio90_props17_minsep3_total125_permove125_m9p896484375_r2_v39.py	0.252071	0.884140	0.856280	0.484375	0.019405	keep	Hybrid decoder keeps the baseline lookahead path unless a conservative board-only segmental pass wins the current score-gain gates, while keeping the strong 17-proposal shape and continuing the move-margin bisection to locate the smallest conservative shift between v38 and v37 that still preserves the stronger non-empty and macro profile.
autoresearch/snapshots/20260417T000549Z_hybrid_lookahead_segmental_drop1_boardcands2_ratio90_props17_minsep3_total125_permove125_m9p8955078125_r2_v40.py	0.252071	0.898248	0.860342	0.484375	0.020699	keep	Hybrid decoder keeps the baseline lookahead path unless a conservative board-only segmental pass wins the current score-gain gates, while keeping the strong 17-proposal shape and continuing the move-margin bisection to locate the smallest conservative shift between v38 and v39 that still preserves the stronger non-empty and macro profile.
autoresearch/snapshots/20260417T000632Z_hybrid_lookahead_segmental_drop1_boardcands2_ratio90_props17_minsep3_total125_permove125_m9p89599609375_r2_v41.py	0.252071	0.884140	0.856280	0.484375	0.019405	keep	Hybrid decoder keeps the baseline lookahead path unless a conservative board-only segmental pass wins the current score-gain gates, while keeping the strong 17-proposal shape and continuing the move-margin bisection to locate the smallest conservative shift between v40 and v39 that still preserves the stronger non-empty and macro profile.
autoresearch/snapshots/20260417T000713Z_hybrid_lookahead_segmental_drop1_boardcands2_ratio90_props17_minsep3_total125_permove125_m9p895751953125_r2_v42.py	0.252071	0.884140	0.856280	0.484375	0.019405	keep	Hybrid decoder keeps the baseline lookahead path unless a conservative board-only segmental pass wins the current score-gain gates, while keeping the strong 17-proposal shape and continuing the move-margin bisection to locate the smallest conservative shift between v40 and v41 that still preserves the stronger non-empty and macro profile.
autoresearch/snapshots/20260417T000757Z_hybrid_lookahead_segmental_drop1_boardcands2_ratio90_props17_minsep3_total125_permove125_m9p8956298828125_r2_v43.py	0.252071	0.898248	0.860342	0.484375	0.020699	keep	Hybrid decoder keeps the baseline lookahead path unless a conservative board-only segmental pass wins the current score-gain gates, while keeping the strong 17-proposal shape and continuing the move-margin bisection to locate the smallest conservative shift between v40 and v42 that still preserves the stronger non-empty and macro profile.
autoresearch/snapshots/20260417T000840Z_hybrid_lookahead_segmental_drop1_boardcands2_ratio90_props17_minsep3_total125_permove125_m9p89569091796875_r2_v44.py	0.252071	0.898248	0.860342	0.484375	0.020699	keep	Hybrid decoder keeps the baseline lookahead path unless a conservative board-only segmental pass wins the current score-gain gates, while keeping the strong 17-proposal shape and continuing the move-margin bisection to locate the smallest conservative shift between v43 and v42 that still preserves the stronger non-empty and macro profile.
autoresearch/snapshots/20260417T000925Z_hybrid_lookahead_segmental_drop1_boardcands2_ratio90_props17_minsep3_total125_permove125_m9p895721435546875_r2_v45.py	0.252071	0.884140	0.856280	0.484375	0.019405	keep	Hybrid decoder keeps the baseline lookahead path unless a conservative board-only segmental pass wins the current score-gain gates, while keeping the strong 17-proposal shape and continuing the move-margin bisection to locate the smallest conservative shift between v44 and v42 that still preserves the stronger non-empty and macro profile.
autoresearch/snapshots/20260417T001010Z_hybrid_lookahead_segmental_drop1_boardcands2_ratio90_props17_minsep3_total125_permove125_m9p8957061767578125_r2_v46.py	0.252071	0.898248	0.860342	0.484375	0.020699	keep	Hybrid decoder keeps the baseline lookahead path unless a conservative board-only segmental pass wins the current score-gain gates, while keeping the strong 17-proposal shape and continuing the move-margin bisection to locate the smallest conservative shift between v44 and v45 that still preserves the stronger non-empty and macro profile.
autoresearch/snapshots/20260417T001053Z_hybrid_lookahead_segmental_drop1_boardcands2_ratio90_props17_minsep3_total125_permove125_m9p895713806152344_r2_v47.py	0.252071	0.884140	0.856280	0.484375	0.019405	keep	Hybrid decoder keeps the baseline lookahead path unless a conservative board-only segmental pass wins the current score-gain gates, while keeping the strong 17-proposal shape and continuing the move-margin bisection to locate the smallest conservative shift between v46 and v45 that still preserves the stronger non-empty and macro profile.
autoresearch/snapshots/20260417T001139Z_hybrid_lookahead_segmental_drop1_boardcands2_ratio90_props17_minsep3_total125_permove125_m9p895709991455078_r2_v48.py	0.252071	0.884140	0.856280	0.484375	0.019405	keep	Hybrid decoder keeps the baseline lookahead path unless a conservative board-only segmental pass wins the current score-gain gates, while keeping the strong 17-proposal shape and continuing the move-margin bisection to locate the smallest conservative shift between v46 and v47 that still preserves the stronger non-empty and macro profile.
autoresearch/snapshots/20260417T001226Z_hybrid_lookahead_segmental_drop1_boardcands2_ratio90_props17_minsep3_total125_permove125_m9p895708084106445_r2_v49.py	0.252071	0.884140	0.856280	0.484375	0.019405	keep	Hybrid decoder keeps the baseline lookahead path unless a conservative board-only segmental pass wins the current score-gain gates, while keeping the strong 17-proposal shape and continuing the move-margin bisection to locate the smallest conservative shift between v46 and v48 that still preserves the stronger non-empty and macro profile.
autoresearch/snapshots/20260417T001312Z_hybrid_lookahead_segmental_drop1_boardcands2_ratio90_props17_minsep3_total125_permove125_m9p895707130432129_r2_v50.py	0.252071	0.884140	0.856280	0.484375	0.019405	keep	Hybrid decoder keeps the baseline lookahead path unless a conservative board-only segmental pass wins the current score-gain gates, while keeping the strong 17-proposal shape and continuing the move-margin bisection to locate the smallest conservative shift between v46 and v49 that still preserves the stronger non-empty and macro profile.
autoresearch/snapshots/20260417T001409Z_hybrid_lookahead_segmental_drop1_boardcands2_ratio90_props17_minsep3_total125_permove125_m9p89570665359497_r2_v51.py	0.252071	0.884140	0.856280	0.484375	0.019405	keep	Hybrid decoder keeps the baseline lookahead path unless a conservative board-only segmental pass wins the current score-gain gates, while keeping the strong 17-proposal shape and continuing the move-margin bisection to locate the smallest conservative shift between v46 and v50 that still preserves the stronger non-empty and macro profile.
autoresearch/snapshots/20260417T001501Z_hybrid_lookahead_segmental_drop1_boardcands2_ratio90_props17_minsep3_total125_permove125_m9p895706415176392_r2_v52.py	0.252071	0.884140	0.856280	0.484375	0.019405	keep	Hybrid decoder keeps the baseline lookahead path unless a conservative board-only segmental pass wins the current score-gain gates, while keeping the strong 17-proposal shape and continuing the move-margin bisection to locate the smallest conservative shift between v46 and v51 that still preserves the stronger non-empty and macro profile.
autoresearch/snapshots/20260417T001555Z_hybrid_lookahead_segmental_drop1_boardcands2_ratio90_props17_minsep3_total125_permove125_m9p895706295967102_r2_v53.py	0.252071	0.884140	0.856280	0.484375	0.019405	keep	Hybrid decoder keeps the baseline lookahead path unless a conservative board-only segmental pass wins the current score-gain gates, while keeping the strong 17-proposal shape and continuing the move-margin bisection to locate the smallest conservative shift between v46 and v52 that still preserves the stronger non-empty and macro profile.
autoresearch/snapshots/20260417T001646Z_hybrid_lookahead_segmental_drop1_boardcands2_ratio90_props17_minsep3_total125_permove125_m9p895706236362457_r2_v54.py	0.252071	0.884140	0.856280	0.484375	0.019405	keep	Hybrid decoder keeps the baseline lookahead path unless a conservative board-only segmental pass wins the current score-gain gates, while keeping the strong 17-proposal shape and continuing the move-margin bisection to locate the smallest conservative shift between v46 and v53 that still preserves the stronger non-empty and macro profile.
autoresearch/snapshots/20260417T001742Z_hybrid_lookahead_segmental_drop1_boardcands2_ratio90_props17_minsep3_total125_permove125_m9p895706206560135_r2_v55.py	0.252071	0.884140	0.856280	0.484375	0.019405	keep	Hybrid decoder keeps the baseline lookahead path unless a conservative board-only segmental pass wins the current score-gain gates, while keeping the strong 17-proposal shape and continuing the move-margin bisection to locate the smallest conservative shift between v46 and v54 that still preserves the stronger non-empty and macro profile.
autoresearch/snapshots/20260417T002130Z_hybrid_lookahead_segmental_drop1_boardcands2_ratio90_props17_minsep3_total125_permove125_m9p895706191658974_r2_v56.py	0.252071	0.884140	0.856280	0.484375	0.019405	keep	Hybrid decoder keeps the baseline lookahead path unless a conservative board-only segmental pass wins the current score-gain gates, while keeping the strong 17-proposal shape and continuing the move-margin bisection to locate the smallest conservative shift between v46 and v55 that still preserves the stronger non-empty and macro profile.
autoresearch/snapshots/20260417T002216Z_hybrid_lookahead_segmental_drop1_boardcands2_ratio90_props17_minsep3_total125_permove125_m9p895706184208393_r2_v57.py	0.252071	0.884140	0.856280	0.484375	0.019405	keep	Hybrid decoder keeps the baseline lookahead path unless a conservative board-only segmental pass wins the current score-gain gates, while keeping the strong 17-proposal shape and continuing the move-margin bisection to locate the smallest conservative shift between v46 and v56 that still preserves the stronger non-empty and macro profile.
autoresearch/snapshots/20260417T002322Z_hybrid_lookahead_segmental_drop1_boardcands2_ratio90_props17_minsep3_total125_permove125_m9p895706180483103_r2_v58.py	0.252071	0.884140	0.856280	0.484375	0.019405	keep	Hybrid decoder keeps the baseline lookahead path unless a conservative board-only segmental pass wins the current score-gain gates, while keeping the strong 17-proposal shape and taking one more move-margin midpoint between v46 and v57 to check whether any practical boundary remains before treating v46 as the usable strong-side setting.
