snapshot	board_exact	non_empty_accuracy	macro_f1	move_recall	false_change_rate	status	description
autoresearch/snapshots/20260417T002430Z_hybrid_lookahead_segmental_drop1_boardcands2_ratio90_props17_minsep3_total125_permove125_m9p8957061767578125_r2_v59.py	0.252071	0.898248	0.860342	0.484375	0.020699	keep	Hybrid decoder keeps the baseline lookahead path unless a conservative board-only segmental pass wins the current score-gain gates, while keeping the strong 17-proposal shape and reverting to the last observed strong-side move margin after v54-v58 all landed on the same conservative profile, to confirm v46 as the practical usable setting before ending the float-boundary search.
autoresearch/snapshots/20260417T002531Z_hybrid_lookahead_segmental_drop1_boardcands2_ratio90_props16_minsep3_total125_permove125_m9p8957061767578125_r2_v60.py	0.252071	0.884140	0.856280	0.484375	0.019405	keep	Hybrid decoder keeps the baseline lookahead path unless a conservative board-only segmental pass wins the current score-gain gates, while holding the now-confirmed practical strong-side move margin from v59 and trimming the proposal budget back to 16 to test whether the stronger non-empty and macro profile depends on the 17th proposal or can be kept while recovering the lower false-change tradeoff of the older 16-proposal branch.
autoresearch/snapshots/20260417T002654Z_hybrid_lookahead_segmental_drop1_boardcands2_ratio90_props17_minsep4_total125_permove125_m9p8957061767578125_r2_v61.py	0.252071	0.898248	0.860342	0.484375	0.020699	keep	Hybrid decoder keeps the baseline lookahead path unless a conservative board-only segmental pass wins the current score-gain gates, while restoring the confirmed strong-side move margin and 17-proposal budget from v59 but tightening primary event spacing back to 4 to test whether the stronger non-empty and macro profile can be kept while trimming the extra false-change cost that appeared in the strong props17 branch.
autoresearch/snapshots/20260417T002806Z_hybrid_lookahead_segmental_drop1_boardcands2_ratio95_props17_minsep3_total125_permove125_m9p8957061767578125_r2_v62.py	0.252071	0.898248	0.860342	0.484375	0.020699	keep	Hybrid decoder keeps the baseline lookahead path unless a conservative board-only segmental pass wins the current score-gain gates, while restoring the cheap strong props17 shape after v61's no-op runtime spike and tightening nearby-secondary pruning from ratio90 to ratio95 to test whether the confirmed strong-side move margin can keep its non-empty and macro gains while dropping back toward the lower false-change tradeoff.
autoresearch/snapshots/20260417T002942Z_hybrid_lookahead_segmental_drop1_boardcands2_ratio95_props17_top12_minsep3_total125_permove125_m9p8957061767578125_r2_v63.py	0.252071	0.898248	0.860342	0.484375	0.020699	keep	Hybrid decoder keeps the baseline lookahead path unless a conservative board-only segmental pass wins the current score-gain gates, while keeping the no-op-equivalent strong props17 shape from v62 and trimming move-search breadth from 16 to 12 candidates to test whether the confirmed strong-side move margin can keep its non-empty and macro gains while reducing spurious legal hypotheses behind the higher false-change profile.
autoresearch/snapshots/20260417T003056Z_hybrid_lookahead_segmental_drop1_boardcands2_ratio95_props17_top8_minsep3_total125_permove125_m9p8957061767578125_r2_v64.py	0.252071	0.840887	0.827666	0.484375	0.020699	keep	Hybrid decoder keeps the baseline lookahead path unless a conservative board-only segmental pass wins the current score-gain gates, while taking the still-no-op strong props17 shape from v63 and trimming move-search breadth further from 12 to 8 candidates to find whether a real legal-hypothesis pruning threshold exists that can keep the stronger non-empty and macro profile while reducing the higher false-change cost.
autoresearch/snapshots/20260417T003258Z_hybrid_lookahead_segmental_drop1_boardcands2_ratio95_props17_top10_minsep3_total125_permove125_m9p8957061767578125_r2_v65.py	0.252071	0.898248	0.860342	0.484375	0.020699	keep	Hybrid decoder keeps the baseline lookahead path unless a conservative board-only segmental pass wins the current score-gain gates, while splitting the new move-search breadth threshold between v63's no-op top12 result and v64's degraded top8 result to determine whether any practical pruning point exists before abandoning this lever as a way to reduce the strong props17 false-change cost.
autoresearch/snapshots/20260417T003442Z_hybrid_lookahead_segmental_drop1_boardcands2_ratio95_props17_top10_minsep3_total125_permove150_m9p8957061767578125_r2_v66.py	0.252071	0.898248	0.860342	0.484375	0.020699	keep	Hybrid decoder keeps the baseline lookahead path unless a conservative board-only segmental pass wins the current score-gain gates, while keeping the no-op top10 strong props17 shape from v65 but restoring a stricter per-added-move gain gate to test whether stronger move-normalized hybrid selection can cut the extra false-change cost without giving up the stronger non-empty and macro profile.
autoresearch/snapshots/20260417T003623Z_hybrid_lookahead_segmental_drop1_boardcands2_ratio95_props15_top10_minsep3_total125_permove150_m9p8957061767578125_r2_v67.py	0.252071	0.828278	0.809589	0.468750	0.018111	keep	Hybrid decoder keeps the baseline lookahead path unless a conservative board-only segmental pass wins the current score-gain gates, while keeping the no-op-equivalent strong props17 shape from v66 and trimming proposal budget from 17 to 15 to test whether a practical budget threshold exists between the degraded low-budget branch and the stronger 16-17 proposal regime.
autoresearch/snapshots/20260417T003721Z_hybrid_lookahead_segmental_drop1_boardcands2_ratio95_props15_top10_minsep3_total125_permove125_m9p8957061767578125_r2_v68.py	0.252071	0.828278	0.809589	0.468750	0.018111	keep	Hybrid decoder keeps the baseline lookahead path unless a conservative board-only segmental pass wins the current score-gain gates, while keeping the new props15 branch from v67 but relaxing the per-added-move gate back to 125 to isolate whether the degraded 15-proposal profile comes from proposal budget itself or from the stricter move-normalized hybrid selection threshold.
autoresearch/snapshots/20260417T003838Z_hybrid_lookahead_segmental_drop1_boardcands2_ratio95_props15_top10_minsep3_total125_permove125_m9p8957061767578125_r2_v68.py	0.252071	0.828278	0.809589	0.468750	0.018111	keep	Hybrid decoder keeps the baseline lookahead path unless a conservative board-only segmental pass wins the current score-gain gates, while keeping the new props15 branch from v67 but relaxing the per-added-move gate back to 125 to isolate whether the degraded 15-proposal profile comes from proposal budget itself or from the stricter move-normalized hybrid selection threshold.
autoresearch/snapshots/20260417T004245Z_hybrid_lookahead_segmental_drop1_boardcands2_ratio95_props16_top10_minsep3_total125_permove125_m9p8957061767578125_r2_v69.py	0.252071	0.884140	0.856280	0.484375	0.019405	keep	Hybrid decoder keeps the baseline lookahead path unless a conservative board-only segmental pass wins the current score-gain gates, while restoring one proposal after v67-v68 showed the props15 branch degrades regardless of the per-added-move gate to test whether the practical proposal-budget threshold in the current ratio95/top10 branch sits exactly between 15 and 16.
autoresearch/snapshots/20260417T004407Z_hybrid_lookahead_segmental_drop1_boardcands2_ratio95_props17_top9_minsep3_total125_permove125_m9p8957061767578125_r2_v70.py	0.252071	0.840887	0.827666	0.484375	0.020699	keep	Hybrid decoder keeps the baseline lookahead path unless a conservative board-only segmental pass wins the current score-gain gates, while restoring the confirmed strong props17 branch after v69 revalidated the 15->16 proposal threshold and trimming move-search breadth from 10 to 9 to test whether the remaining top-move cliff sits exactly between 8 and 10 and can keep the stronger non-empty and macro profile with fewer spurious legal hypotheses.
autoresearch/snapshots/20260417T004557Z_hybrid_lookahead_segmental_drop1_boardcands2_ratio95_props17_top10_minsep3_total150_permove125_m9p8957061767578125_r2_v71.py	0.252071	0.898248	0.860342	0.484375	0.020699	keep	Hybrid decoder keeps the baseline lookahead path unless a conservative board-only segmental pass wins the current score-gain gates, while restoring the confirmed strong props17/top10 branch after v70 localized the move-search cliff at 9 and tightening only the total-gain gate to 150 to test whether a stricter whole-segment score requirement can trim the strong branch's extra false-change cost without giving up its non-empty and macro gains.
autoresearch/snapshots/20260417T004752Z_hybrid_lookahead_segmental_drop1_boardcands2_ratio95_props17_top10_minsep3_thresh3_total150_permove125_m9p8957061767578125_r2_v72.py	0.252071	0.898248	0.860342	0.484375	0.020699	keep	Hybrid decoder keeps the baseline lookahead path unless a conservative board-only segmental pass wins the current score-gain gates, while keeping the still-no-op-equivalent strong props17/top10 branch from v71 and raising only the board-change proposal threshold from 2/64 to 3/64 to test whether the strong branch's extra false-change cost is being driven by weaker board-change peaks that still survive the current proposal filter.
autoresearch/snapshots/20260417T004905Z_hybrid_lookahead_segmental_drop1_boardcands2_ratio95_props17_top10_detect15_minsep3_thresh3_total150_permove125_m9p8957061767578125_r2_v73.py	0.252071	0.898248	0.860342	0.484375	0.020699	keep	Hybrid decoder keeps the baseline lookahead path unless a conservative board-only segmental pass wins the current score-gain gates, while keeping the still-no-op-equivalent strong props17/top10 branch from v72 and raising only the detect proposal threshold from 0.1 to 0.15 to test whether the strong branch's extra false-change cost is being driven by weaker detect-driven proposal peaks after the board-change threshold increase proved inactive.
autoresearch/snapshots/20260417T005032Z_hybrid_lookahead_segmental_drop2_boardcands2_ratio95_props17_top10_detect15_minsep3_thresh3_total150_permove125_m9p8957061767578125_r2_v74.py	0.252071	0.848690	0.846644	0.468750	0.019405	keep	Hybrid decoder keeps the baseline lookahead path unless a conservative board-only segmental pass wins the current score-gain gates, while keeping the still-no-op-equivalent strong props17/top10 branch from v73 and dropping the two worst board frames per segment instead of one to test whether more aggressive transition-frame suppression can cut the strong branch's extra false-change cost without reopening the degraded low-budget or low-breadth regimes.
autoresearch/snapshots/20260417T005150Z_hybrid_lookahead_segmental_drop2_boardcands2_ratio95_props17_top10_detect10_minsep3_thresh3_total150_permove125_m9p8957061767578125_r2_v75.py	0.252071	0.848690	0.846644	0.468750	0.019405	keep	Hybrid decoder keeps the baseline lookahead path unless a conservative board-only segmental pass wins the current score-gain gates, while keeping the newly active drop2 branch from v74 but relaxing only the detect proposal threshold back to 0.1 to test whether the lower-false-change profile from dropping two worst frames can recover recall and board quality if detect-driven proposal breadth was over-pruned by the tighter 0.15 threshold.
autoresearch/snapshots/20260417T005326Z_hybrid_lookahead_segmental_drop1_boardcands2_ratio95_props17_top10_detect10_minsep3_thresh3_total150_permove125_m9p8957061767578125_r1_v76.py	0.252071	0.898248	0.860342	0.484375	0.020699	keep	Hybrid decoder keeps the baseline lookahead path unless a conservative board-only segmental pass wins the current score-gain gates, while restoring the stronger drop1 branch after v74-v75 showed drop2 itself drives the degradation and narrowing the event window from radius 2 to 1 to test whether less local temporal spread can reduce the strong props17 branch's extra false-change cost without giving up its best secondary metrics.
autoresearch/snapshots/20260417T005507Z_hybrid_lookahead_segmental_drop1_boardcands2_ratio95_props17_top10_detect10_minsep3_thresh3_total150_permove125_m10_r1_v77.py	0.252071	0.884140	0.856280	0.484375	0.019405	keep	Hybrid decoder keeps the baseline lookahead path unless a conservative board-only segmental pass wins the current score-gain gates, while keeping the still-no-op-equivalent filtered props17 branch from v76 and raising only the segmental move margin to 10.0 to test whether this branch still has the known strong-to-conservative threshold and can recover the lower false-change tradeoff without a larger quality drop.
autoresearch/snapshots/20260417T005640Z_hybrid_lookahead_segmental_drop1_boardcands2_ratio95_props17_top10_detect10_minsep3_thresh3_total150_permove125_m9p895706180483103_r1_v78.py	0.252071	0.884140	0.856280	0.484375	0.019405	keep	Hybrid decoder keeps the baseline lookahead path unless a conservative board-only segmental pass wins the current score-gain gates, while keeping the filtered props17 branch from v76-v77 and moving only to the first previously conservative-side move margin from the old props17 threshold search to test whether the narrowed event window and inactive proposal filters shifted the strong-to-conservative boundary or whether this branch remains threshold-identical to the original strong family.
autoresearch/snapshots/20260417T005815Z_hybrid_lookahead_segmental_drop1_boardcands2_ratio95_props16_top10_detect10_minsep3_thresh3_total150_permove125_m9p8957061767578125_r1_v79.py	0.252071	0.884140	0.856280	0.484375	0.019405	keep	Hybrid decoder keeps the baseline lookahead path unless a conservative board-only segmental pass wins the current score-gain gates, while restoring the strong-side move margin after v76-v78 showed the narrowed-window branch keeps the old threshold and trimming proposal budget from 17 to 16 to test whether proposal-budget activity is likewise unchanged by the inactive filter tweaks or whether the r1 branch shifts the 16-vs-17 tradeoff.
autoresearch/snapshots/20260417T005939Z_hybrid_lookahead_segmental_drop1_boardcands2_ratio95_props17_top10_detect10_minsep3_thresh3_total150_permove125_m9p8957061767578125_r0_v80.py	0.252071	0.898248	0.860342	0.484375	0.020699	keep	Hybrid decoder keeps the baseline lookahead path unless a conservative board-only segmental pass wins the current score-gain gates, while restoring the confirmed strong props17 branch after v79 showed the narrowed-window path preserves the old 16-vs-17 proposal tradeoff and shrinking the event window from radius 1 to 0 to test whether eliminating extra local temporal spread can reduce the strong branch's false-change cost without losing its best non-empty and macro profile.
autoresearch/snapshots/20260417T010038Z_hybrid_lookahead_segmental_drop1_boardcands2_ratio95_props17_top10_detect10_minsep3_thresh3_total150_permove125_m10_r0_v81.py	0.252071	0.884140	0.856280	0.484375	0.019405	keep	Hybrid decoder keeps the baseline lookahead path unless a conservative board-only segmental pass wins the current score-gain gates, while keeping the still-no-op strong r0 branch from v80 and raising only the segmental move margin to 10.0 to test whether the zero-radius event window also preserves the known strong-to-conservative threshold and can recover the lower false-change tradeoff without a larger quality drop.
autoresearch/snapshots/20260417T010125Z_hybrid_lookahead_segmental_drop1_boardcands2_ratio95_props16_top10_detect10_minsep3_thresh3_total150_permove125_m9p8957061767578125_r0_v82.py	0.252071	0.884140	0.856280	0.484375	0.019405	keep	Hybrid decoder keeps the baseline lookahead path unless a conservative board-only segmental pass wins the current score-gain gates, while restoring the strong-side move margin after v80-v81 showed the zero-radius branch keeps the old threshold and trimming proposal budget from 17 to 16 to test whether proposal-budget activity is likewise unchanged when the segment event window is collapsed to a single frame.
autoresearch/snapshots/20260417T010217Z_hybrid_lookahead_segmental_drop1_boardcands2_ratio95_props15_top10_detect10_minsep3_thresh3_total150_permove125_m9p8957061767578125_r0_v83.py	0.252071	0.828278	0.809589	0.468750	0.018111	keep	Hybrid decoder keeps the baseline lookahead path unless a conservative board-only segmental pass wins the current score-gain gates, while keeping the zero-radius conservative branch from v82 and trimming proposal budget from 16 to 15 to test whether the known low-budget degradation also remains unchanged when the segment event window is collapsed to a single frame.
autoresearch/snapshots/20260417T010338Z_hybrid_lookahead_segmental_drop1_boardcands1_ratio95_props17_top10_detect10_minsep3_thresh3_total150_permove125_m9p8957061767578125_r0_v84.py	0.244970	0.898041	0.860191	0.484375	0.020699	discard	Hybrid decoder keeps the baseline lookahead path unless a conservative board-only segmental pass wins the current score-gain gates, while restoring the confirmed strong zero-radius branch after v82-v83 showed the low-budget degradation is unchanged and trimming board evidence from two candidates to one to test whether the second board candidate is still necessary in the constrained strong family or is now mainly contributing extra false-change opportunities.
autoresearch/snapshots/20260417T010512Z_hybrid_lookahead_segmental_drop1_boardcands2_ratio95_props17_top10_detect10_minsep2_thresh3_total150_permove125_m9p8957061767578125_r0_v85.py	0.254438	0.884347	0.856334	0.500000	0.018111	keep	Hybrid decoder keeps the baseline lookahead path unless a conservative board-only segmental pass wins the current score-gain gates, while restoring the confirmed strong zero-radius branch after v82-v83 revalidated the 16-vs-15 proposal-budget split and relaxing only the primary event spacing from 3 to 2 to test whether denser primary move-timing proposals can recover temporal ambiguity cases that the current secondary-peak mechanism still misses.
autoresearch/snapshots/20260417T010613Z_hybrid_lookahead_segmental_drop1_boardcands2_ratio95_props16_top10_detect10_minsep2_thresh3_total150_permove125_m9p8957061767578125_r0_v86.py	0.254438	0.828484	0.809644	0.484375	0.016818	discard	Hybrid decoder keeps the baseline lookahead path unless a conservative board-only segmental pass wins the current score-gain gates, while keeping the new strong zero-radius minsep2 branch from v85 and trimming proposal budget from 17 to 16 to test whether the additional timing density made the 17th proposal unnecessary or whether proposal-budget activity remains the main active lever in this improved branch.
autoresearch/snapshots/20260417T010706Z_hybrid_lookahead_segmental_drop1_boardcands2_ratio95_props17_top10_detect10_minsep2_thresh3_total150_permove125_m10_r0_v87.py	0.254438	0.884347	0.856334	0.500000	0.018111	discard	Hybrid decoder keeps the baseline lookahead path unless a conservative board-only segmental pass wins the current score-gain gates, while keeping the new best zero-radius minsep2 branch from v85 and raising only the segmental move margin to 10.0 to test whether the improved branch still has a useful strong-to-conservative threshold tradeoff or whether its gain depends on staying at the lower strong-side margin.
autoresearch/snapshots/20260417T010826Z_hybrid_lookahead_segmental_drop1_boardcands2_ratio95_props17_top10_detect10_minsep2_secondarysep1_thresh3_total150_permove125_m9p8957061767578125_r0_v88.py	0.253254	0.884295	0.856308	0.500000	0.019405	discard	Hybrid decoder keeps the baseline lookahead path unless a conservative board-only segmental pass wins the current score-gain gates, while keeping the new best zero-radius minsep2 branch from v85 and relaxing only the nearby-secondary spacing from 2 to 1 to test whether allowing adjacent-frame alternate proposal peaks can recover remaining temporal move-timing ambiguity that the denser primary proposal spacing still leaves unresolved.
autoresearch/snapshots/20260417T010937Z_hybrid_lookahead_segmental_drop1_boardcands2_ratio95_props18_top10_detect10_minsep2_thresh3_total150_permove125_m9p8957061767578125_r0_v89.py	0.254438	0.898455	0.860396	0.500000	0.019405	discard	Hybrid decoder keeps the baseline lookahead path unless a conservative board-only segmental pass wins the current score-gain gates, while keeping the new best zero-radius minsep2 branch from v85 and raising the proposal budget from 17 to 18 to test whether the denser primary timing proposals created useful headroom above the old props17 ceiling or whether extra event hypotheses still mostly add noise.
autoresearch/snapshots/20260417T011046Z_hybrid_lookahead_segmental_drop1_boardcands2_ratio95_props18_top10_detect10_minsep2_thresh3_total150_permove125_m10_r0_v90.py	0.254438	0.884347	0.856334	0.500000	0.018111	discard	Hybrid decoder keeps the baseline lookahead path unless a conservative board-only segmental pass wins the current score-gain gates, while probing the new minsep2 zero-radius branch above the current best by adding an 18th proposal and raising the move margin to 10.0 to test whether the props18 branch's stronger non-empty and macro profile can keep its gains while trimming the false-change regression relative to v85.
