snapshot	board_exact	non_empty_accuracy	macro_f1	move_recall	false_change_rate	status	description
autoresearch/snapshots/20260419T045628Z_hybrid_lookahead_segmental_drop0_boardcands3_ratio95_props14_top14_detect10_lwindow1_minsep4_thresh3_total150_permove125_lmargin9p5_m9p8957061767578125_r0_beam4_v528.py	0.074556	0.795101	0.755456	0.218750	0.012937	discard	Hybrid decoder keeps the baseline lookahead path unless a conservative board-only segmental pass wins the current score-gain gates, while following up the kept window1 branch after lowering lookahead window from 2 to 1 on the 9.5-margin baseline opened a lower-false-change but lower-recall tradeoff, lowering only max_event_proposals from 16 to 15 on the restored plain window1 branch improved recall and secondary metrics but worsened false-change, additionally narrowing top-board breadth from 4 to 3 recovered the lower false-change without hurting recall, lowering only max_event_proposals one step further from 15 to 14 on that boardcands3 plain props branch kept that recovered tradeoff, and lowering segment_board_drop_worst_frames from 1 to 0 on that stronger props14 branch produced a new kept low-noise / lower-recall tradeoff, while nearby secsep, proposal-budget, beam, handoff-gate, lookahead-window, lookahead-margin, and temporal-radius probes around that kept drop0 branch either matched exactly, formed a noisier recall shelf, or collapsed back toward the keep, and earlier props14 probes on the plain parent branch showed top1 through top13 were exact no-ops while top14 and above reopened the worse false-change regime, and raising only top-move breadth from 4 to 14 on that kept drop0 branch to test whether the upper move-width cliff persisted after the drop0 shift or whether this branch sits on a broader top-move plateau.
autoresearch/snapshots/20260419T045719Z_hybrid_lookahead_segmental_drop0_boardcands3_ratio95_props14_top16_detect10_lwindow1_minsep4_thresh3_total150_permove125_lmargin9p5_m9p8957061767578125_r0_beam4_v529.py	0.074556	0.795101	0.755456	0.218750	0.012937	discard	Hybrid decoder keeps the baseline lookahead path unless a conservative board-only segmental pass wins the current score-gain gates, while following up the kept window1 branch after lowering lookahead window from 2 to 1 on the 9.5-margin baseline opened a lower-false-change but lower-recall tradeoff, lowering only max_event_proposals from 16 to 15 on the restored plain window1 branch improved recall and secondary metrics but worsened false-change, additionally narrowing top-board breadth from 4 to 3 recovered the lower false-change without hurting recall, lowering only max_event_proposals one step further from 15 to 14 on that boardcands3 plain props branch kept that recovered tradeoff, and lowering segment_board_drop_worst_frames from 1 to 0 on that stronger props14 branch produced a new kept low-noise / lower-recall tradeoff, while nearby secsep, proposal-budget, beam, handoff-gate, lookahead-window, lookahead-margin, and temporal-radius probes around that kept drop0 branch either matched exactly, formed a noisier recall shelf, or collapsed back toward the keep, and raising top-move breadth from 4 to 14 on that kept drop0 branch was an exact no-op, and raising only top-move breadth from 4 to 16 on that kept drop0 branch to test whether this branch really stays flat through the full allowed move-width cap or whether the old upper-width cliff reappears only at the cap.
autoresearch/snapshots/20260419T045849Z_hybrid_lookahead_segmental_drop0_boardcands3_ratio95_props14_top4_detect10_lwindow1_minsep4_thresh3p25_total150_permove125_lmargin9p5_m9p8957061767578125_r0_beam4_v530.py	0.074556	0.795101	0.755456	0.218750	0.012937	discard	Hybrid decoder keeps the baseline lookahead path unless a conservative board-only segmental pass wins the current score-gain gates, while following up the kept window1 branch after lowering lookahead window from 2 to 1 on the 9.5-margin baseline opened a lower-false-change but lower-recall tradeoff, lowering only max_event_proposals from 16 to 15 on the restored plain window1 branch improved recall and secondary metrics but worsened false-change, additionally narrowing top-board breadth from 4 to 3 recovered the lower false-change without hurting recall, lowering only max_event_proposals one step further from 15 to 14 on that boardcands3 plain props branch kept that recovered tradeoff, and lowering segment_board_drop_worst_frames from 1 to 0 on that stronger props14 branch produced a new kept low-noise / lower-recall tradeoff, while nearby secsep, proposal-budget, beam, handoff-gate, lookahead-window, lookahead-margin, temporal-radius, and upper move-width probes around that kept drop0 branch either matched exactly, formed a noisier recall shelf, or collapsed back toward the keep, and raising only the board-change peak threshold from 3.0/64.0 to 3.25/64.0 on that kept drop0 branch to test whether the low-noise tradeoff can be sharpened further by stricter board-change proposals or whether the older stricter-threshold degradation still holds on this branch too.
autoresearch/snapshots/20260419T045943Z_hybrid_lookahead_segmental_drop0_boardcands3_ratio95_props14_top4_detect10_lwindow1_minsep4_thresh2p75_total150_permove125_lmargin9p5_m9p8957061767578125_r0_beam4_v531.py	0.074556	0.795101	0.755456	0.218750	0.012937	discard	Hybrid decoder keeps the baseline lookahead path unless a conservative board-only segmental pass wins the current score-gain gates, while following up the kept window1 branch after lowering lookahead window from 2 to 1 on the 9.5-margin baseline opened a lower-false-change but lower-recall tradeoff, lowering only max_event_proposals from 16 to 15 on the restored plain window1 branch improved recall and secondary metrics but worsened false-change, additionally narrowing top-board breadth from 4 to 3 recovered the lower false-change without hurting recall, lowering only max_event_proposals one step further from 15 to 14 on that boardcands3 plain props branch kept that recovered tradeoff, and lowering segment_board_drop_worst_frames from 1 to 0 on that stronger props14 branch produced a new kept low-noise / lower-recall tradeoff, while nearby secsep, proposal-budget, beam, handoff-gate, lookahead-window, lookahead-margin, temporal-radius, upper move-width, and stricter board-change-threshold probes around that kept drop0 branch either matched exactly, formed a noisier recall shelf, or collapsed back toward the keep, and lowering only the board-change peak threshold from 3.0/64.0 to 2.75/64.0 on that kept drop0 branch to test whether the looser side of the board-change gate is also flat there or whether only the stricter side sits on a no-op plateau.
autoresearch/snapshots/20260419T050105Z_hybrid_lookahead_segmental_drop0_boardcands3_ratio95_props14_top4_detect10_lwindow1_minsep4_thresh3p5_total150_permove125_lmargin9p5_m9p8957061767578125_r0_beam4_v531.py	0.074556	0.795101	0.755456	0.218750	0.012937	discard	Hybrid decoder keeps the baseline lookahead path unless a conservative board-only segmental pass wins the current score-gain gates, while following up the kept window1 branch after lowering lookahead window from 2 to 1 on the 9.5-margin baseline opened a lower-false-change but lower-recall tradeoff, lowering only max_event_proposals from 16 to 15 on the restored plain window1 branch improved recall and secondary metrics but worsened false-change, additionally narrowing top-board breadth from 4 to 3 recovered the lower false-change without hurting recall, lowering only max_event_proposals one step further from 15 to 14 on that boardcands3 plain props branch kept that recovered tradeoff, and lowering segment_board_drop_worst_frames from 1 to 0 on that stronger props14 branch produced a new kept low-noise / lower-recall tradeoff, while nearby secsep, proposal-budget, beam, handoff-gate, lookahead-window, lookahead-margin, temporal-radius, upper move-width, and moderately stricter board-change-threshold probes around that kept drop0 branch either matched exactly, formed a noisier recall shelf, or collapsed back toward the keep, and raising only the board-change peak threshold from 3.0/64.0 to 3.5/64.0 on that kept drop0 branch to test whether the low-noise tradeoff still hides a stricter-threshold cliff just above the flat 3.25/64.0 probe or whether the no-op plateau extends higher on this branch too.
autoresearch/snapshots/20260419T050202Z_hybrid_lookahead_segmental_drop0_boardcands3_ratio95_props14_top4_detect12p5_lwindow1_minsep4_thresh3_total150_permove125_lmargin9p5_m9p8957061767578125_r0_beam4_v532.py	0.074556	0.795101	0.755456	0.218750	0.012937	discard	Hybrid decoder keeps the baseline lookahead path unless a conservative board-only segmental pass wins the current score-gain gates, while following up the kept window1 branch after lowering lookahead window from 2 to 1 on the 9.5-margin baseline opened a lower-false-change but lower-recall tradeoff, lowering only max_event_proposals from 16 to 15 on the restored plain window1 branch improved recall and secondary metrics but worsened false-change, additionally narrowing top-board breadth from 4 to 3 recovered the lower false-change without hurting recall, lowering only max_event_proposals one step further from 15 to 14 on that boardcands3 plain props branch kept that recovered tradeoff, and lowering segment_board_drop_worst_frames from 1 to 0 on that stronger props14 branch produced a new kept low-noise / lower-recall tradeoff, while nearby secsep, proposal-budget, beam, handoff-gate, lookahead-window, lookahead-margin, temporal-radius, upper move-width, and board-change-threshold probes around that kept drop0 branch either matched exactly, formed a noisier recall shelf, or collapsed back toward the keep, and raising only the detect peak threshold from 0.1 to 0.125 on that kept drop0 branch to test whether the detector gate is also flat there or whether the low-noise tradeoff still depends on the current detect threshold.
autoresearch/snapshots/20260419T050257Z_hybrid_lookahead_segmental_drop0_boardcands3_ratio95_props14_top4_detect7p5_lwindow1_minsep4_thresh3_total150_permove125_lmargin9p5_m9p8957061767578125_r0_beam4_v533.py	0.074556	0.795101	0.755456	0.218750	0.012937	discard	Hybrid decoder keeps the baseline lookahead path unless a conservative board-only segmental pass wins the current score-gain gates, while following up the kept window1 branch after lowering lookahead window from 2 to 1 on the 9.5-margin baseline opened a lower-false-change but lower-recall tradeoff, lowering only max_event_proposals from 16 to 15 on the restored plain window1 branch improved recall and secondary metrics but worsened false-change, additionally narrowing top-board breadth from 4 to 3 recovered the lower false-change without hurting recall, lowering only max_event_proposals one step further from 15 to 14 on that boardcands3 plain props branch kept that recovered tradeoff, and lowering segment_board_drop_worst_frames from 1 to 0 on that stronger props14 branch produced a new kept low-noise / lower-recall tradeoff, while nearby secsep, proposal-budget, beam, handoff-gate, lookahead-window, lookahead-margin, temporal-radius, move-width, board-change-threshold, and stricter detect-threshold probes around that kept drop0 branch either matched exactly, formed a noisier recall shelf, or collapsed back toward the keep, and lowering only the detect peak threshold from 0.1 to 0.075 on that kept drop0 branch to test whether the detector gate is fully flat there or whether only the stricter side sits on the no-op plateau.
autoresearch/snapshots/20260419T050412Z_hybrid_lookahead_segmental_drop0_boardcands3_ratio90_props14_top4_detect10_lwindow1_minsep4_thresh3_total150_permove125_lmargin9p5_m9p8957061767578125_r0_beam4_v534.py	0.074556	0.794998	0.755393	0.203125	0.014230	discard	Hybrid decoder keeps the baseline lookahead path unless a conservative board-only segmental pass wins the current score-gain gates, while following up the kept window1 branch after lowering lookahead window from 2 to 1 on the 9.5-margin baseline opened a lower-false-change but lower-recall tradeoff, lowering only max_event_proposals from 16 to 15 on the restored plain window1 branch improved recall and secondary metrics but worsened false-change, additionally narrowing top-board breadth from 4 to 3 recovered the lower false-change without hurting recall, lowering only max_event_proposals one step further from 15 to 14 on that boardcands3 plain props branch kept that recovered tradeoff, and lowering segment_board_drop_worst_frames from 1 to 0 on that stronger props14 branch produced a new kept low-noise / lower-recall tradeoff, while nearby proposal-budget, beam, handoff-gate, lookahead-window, lookahead-margin, temporal-radius, move-width, board-change-threshold, and detect-threshold probes around that kept drop0 branch either matched exactly, formed a noisier recall shelf, or collapsed back toward the keep, and lowering only the secondary peak ratio from 0.95 to 0.90 on that kept drop0 branch to test whether the low-noise tradeoff depends on the current secondary-proposal filtering or whether that temporal knob is flat here too.
autoresearch/snapshots/20260419T050505Z_hybrid_lookahead_segmental_drop0_boardcands3_ratio98_props14_top4_detect10_lwindow1_minsep4_thresh3_total150_permove125_lmargin9p5_m9p8957061767578125_r0_beam4_v535.py	0.074556	0.795101	0.755456	0.218750	0.012937	discard	Hybrid decoder keeps the baseline lookahead path unless a conservative board-only segmental pass wins the current score-gain gates, while following up the kept window1 branch after lowering lookahead window from 2 to 1 on the 9.5-margin baseline opened a lower-false-change but lower-recall tradeoff, lowering only max_event_proposals from 16 to 15 on the restored plain window1 branch improved recall and secondary metrics but worsened false-change, additionally narrowing top-board breadth from 4 to 3 recovered the lower false-change without hurting recall, lowering only max_event_proposals one step further from 15 to 14 on that boardcands3 plain props branch kept that recovered tradeoff, and lowering segment_board_drop_worst_frames from 1 to 0 on that stronger props14 branch produced a new kept low-noise / lower-recall tradeoff, while nearby proposal-budget, beam, handoff-gate, lookahead-window, lookahead-margin, temporal-radius, move-width, board-change-threshold, and detect-threshold probes around that kept drop0 branch either matched exactly, formed a noisier recall shelf, or collapsed back toward the keep, and lowering only the secondary peak ratio from 0.95 to 0.90 on that kept drop0 branch was harmful, and raising only the secondary peak ratio from 0.95 to 0.98 on that kept drop0 branch to test whether the current secondary-proposal filtering is only lower-side sensitive or whether this knob is flat on the upper side too.
autoresearch/snapshots/20260419T050603Z_hybrid_lookahead_segmental_drop0_boardcands3_ratio95_props14_top4_detect10_lwindow1_minsep4_secsep1_thresh3_total150_permove125_lmargin9p5_m9p8957061767578125_r0_beam4_v536.py	0.074556	0.795204	0.755567	0.218750	0.011643	keep	Hybrid decoder keeps the baseline lookahead path unless a conservative board-only segmental pass wins the current score-gain gates, while following up the kept window1 branch after lowering lookahead window from 2 to 1 on the 9.5-margin baseline opened a lower-false-change but lower-recall tradeoff, lowering only max_event_proposals from 16 to 15 on the restored plain window1 branch improved recall and secondary metrics but worsened false-change, additionally narrowing top-board breadth from 4 to 3 recovered the lower false-change without hurting recall, lowering only max_event_proposals one step further from 15 to 14 on that boardcands3 plain props branch kept that recovered tradeoff, and lowering segment_board_drop_worst_frames from 1 to 0 on that stronger props14 branch produced a new kept low-noise / lower-recall tradeoff, while nearby proposal-budget, beam, handoff-gate, lookahead-window, lookahead-margin, temporal-radius, move-width, board-change-threshold, detect-threshold, and secondary-peak-ratio probes around that kept drop0 branch either matched exactly, formed a noisier recall shelf, or collapsed back toward the keep, and lowering only the secondary minimum event separation from 2 to 1 on that kept drop0 branch to test whether the remaining temporal knob is also lower-side sensitive there or whether secsep can be loosened without disturbing the kept tradeoff.
autoresearch/snapshots/20260419T050737Z_hybrid_lookahead_segmental_drop0_boardcands3_ratio95_props14_top4_detect10_lwindow1_minsep4_secsep1_thresh3_total150_permove125_lmargin9p5_m9p8957061767578125_r0_beam4_v536.py	0.074556	0.795204	0.755567	0.218750	0.011643	discard	Hybrid decoder keeps the baseline lookahead path unless a conservative board-only segmental pass wins the current score-gain gates, while following up the kept window1 branch after lowering lookahead window from 2 to 1 on the 9.5-margin baseline opened a lower-false-change but lower-recall tradeoff, lowering only max_event_proposals from 16 to 15 on the restored plain window1 branch improved recall and secondary metrics but worsened false-change, additionally narrowing top-board breadth from 4 to 3 recovered the lower false-change without hurting recall, lowering only max_event_proposals one step further from 15 to 14 on that boardcands3 plain props branch kept that recovered tradeoff, and lowering segment_board_drop_worst_frames from 1 to 0 on that stronger props14 branch produced a new kept low-noise / lower-recall tradeoff, while nearby proposal-budget, beam, handoff-gate, lookahead-window, lookahead-margin, temporal-radius, move-width, board-change-threshold, and detect-threshold probes around that kept drop0 branch were flat, and secondary-peak-ratio probes were asymmetric with 0.90 harmful and 0.98 flat, and lowering only the secondary minimum event separation from 2 to 1 on that kept drop0 branch to test whether the remaining temporal knob is also lower-side sensitive there or whether secsep can be loosened without disturbing the kept tradeoff.
autoresearch/snapshots/20260419T050845Z_hybrid_lookahead_segmental_drop0_boardcands3_ratio95_props15_top4_detect10_lwindow1_minsep4_secsep1_thresh3_total150_permove125_lmargin9p5_m9p8957061767578125_r0_beam4_v537.py	0.074556	0.790192	0.748400	0.234375	0.012937	discard	Hybrid decoder keeps the baseline lookahead path unless a conservative board-only segmental pass wins the current score-gain gates, while following up the kept window1 branch after lowering lookahead window from 2 to 1 on the 9.5-margin baseline opened a lower-false-change but lower-recall tradeoff, lowering only max_event_proposals from 16 to 15 on the restored plain window1 branch improved recall and secondary metrics but worsened false-change, additionally narrowing top-board breadth from 4 to 3 recovered the lower false-change without hurting recall, lowering only max_event_proposals one step further from 15 to 14 on that boardcands3 plain props branch kept that recovered tradeoff, lowering segment_board_drop_worst_frames from 1 to 0 on that stronger props14 branch produced a new kept low-noise / lower-recall tradeoff, and lowering only the secondary minimum event separation from 2 to 1 on that kept drop0 branch improved the tradeoff again with slightly better secondaries and lower false-change at unchanged recall, while nearby beam, handoff-gate, lookahead-window, lookahead-margin, temporal-radius, move-width, board-change-threshold, and detect-threshold probes were flat and secondary-peak-ratio was asymmetric with 0.90 harmful and 0.98 flat, and raising only max_event_proposals from 14 to 15 on that new secsep1 branch to test whether the improved low-noise tradeoff can recover recall on the upper proposal side without giving back too much of the false-change gain.
autoresearch/snapshots/20260419T050941Z_hybrid_lookahead_segmental_drop0_boardcands4_ratio95_props14_top4_detect10_lwindow1_minsep4_secsep1_thresh3_total150_permove125_lmargin9p5_m9p8957061767578125_r0_beam4_v538.py	0.074556	0.795204	0.755567	0.218750	0.011643	discard	Hybrid decoder keeps the baseline lookahead path unless a conservative board-only segmental pass wins the current score-gain gates, while following up the kept window1 branch after lowering lookahead window from 2 to 1 on the 9.5-margin baseline opened a lower-false-change but lower-recall tradeoff, lowering only max_event_proposals from 16 to 15 on the restored plain window1 branch improved recall and secondary metrics but worsened false-change, additionally narrowing top-board breadth from 4 to 3 recovered the lower false-change without hurting recall, lowering only max_event_proposals one step further from 15 to 14 on that boardcands3 plain props branch kept that recovered tradeoff, lowering segment_board_drop_worst_frames from 1 to 0 on that stronger props14 branch produced a new kept low-noise / lower-recall tradeoff, lowering secondary minimum event separation from 2 to 1 improved that tradeoff again, and raising max_event_proposals from 14 to 15 on the new secsep1 branch recovered recall but gave back too much false-change and secondary quality, and raising only top-board breadth from 3 to 4 on the new secsep1 best branch to test whether boardcands3 is still the local sweet spot there or whether secsep1 opens the same 3..4 plateau seen on earlier branches.
