snapshot	board_exact	non_empty_accuracy	macro_f1	move_recall	false_change_rate	status	description
autoresearch/snapshots/20260419T153602Z_hybrid_lookahead_segmental_drop1_boardcands2_ratio95_props8_top4_detect10_lwindow3_minsep8_secsep1_thresh3_total150_permove142p33951568603516_lmargin9p935836791992188_m9p8957061767578125_r0_beam3_v853.py	0.071006	0.799339	0.749250	0.375000	0.020699	discard	Restore the recovered compact props8 sibling after recent local mapping showed the props7 shelf is saturated across top_move_candidates=5..16, beam_size=4 is an exact no-op, beam_size=2 is slightly worse, beam_size=1 is much worse, both hybrid acceptance gates are exact-flat down to 125.0, event_window_radius=1..2, segment_board_drop_worst_frames=0, and secondary_peak_ratio=0.98 are exact no-ops on the adjacent props7 shelf, secondary_min_event_separation=2 is worse there, and min_event_separation=8 and 6 are both worse than 7 there. On the compact props8 top4 anchor, top_board_candidates=2..4 are exact no-ops, top_move_candidates=4 is exact-flat while 5 is worse, secondary_min_event_separation=2 is worse, and raising min_event_separation from 7 to 8 opened a lower-noise shelf that remained exact-flat at 9 before breaking sharply at 10. On that minsep8 shelf, top_move_candidates=3 is exact-flat, 2 and 1 only slightly weaken secondary metrics, top_board_candidates=2..4 are exact-flat, top_board_candidates=1 is harmful, beam_size=2 is slightly worse, secsep2 is worse, and event_window_radius=1..2, segment_board_drop_worst_frames=0, and secondary_peak_ratio=0.98 are exact no-ops. Lowering min_score_gain_per_added_move from 150.0 to 137.5 increased false changes and weakened secondaries, while raising it from 150.0 to 162.5, 175.0, 187.5, 200.0, 212.5, 225.0, 237.5, 250.0, 262.5, 275.0, 287.5, and 300.0 were exact no-ops and lowering min_total_score_gain from 150.0 down to 87.5 was also exact-flat. Lowering only min_score_gain_per_added_move to 143.75, 142.96875, 142.578125, and 142.3828125 were exact no-ops, while 142.33932495117188, 142.33856201171875, 142.3370361328125, 142.333984375, 142.28515625, and 142.1875 again increased false changes and weakened secondaries, so the lower edge lies between 142.33932495117188 and 142.33970642089844. This run restores the stable minsep8 shelf anchor and raises only min_score_gain_per_added_move from 142.33932495117188 to 142.33951568603516 to continue binary-searching that lower edge.
autoresearch/snapshots/20260419T153725Z_hybrid_lookahead_segmental_drop1_boardcands2_ratio95_props8_top4_detect10_lwindow3_minsep8_secsep1_thresh3_total150_permove142p33942031860352_lmargin9p935836791992188_m9p8957061767578125_r0_beam3_v854.py	0.071006	0.799339	0.749250	0.375000	0.020699	discard	Restore the recovered compact props8 sibling after recent local mapping showed the props7 shelf is saturated across top_move_candidates=5..16, beam_size=4 is an exact no-op, beam_size=2 is slightly worse, beam_size=1 is much worse, both hybrid acceptance gates are exact-flat down to 125.0, event_window_radius=1..2, segment_board_drop_worst_frames=0, and secondary_peak_ratio=0.98 are exact no-ops on the adjacent props7 shelf, secondary_min_event_separation=2 is worse there, and min_event_separation=8 and 6 are both worse than 7 there. On the compact props8 top4 anchor, top_board_candidates=2..4 are exact no-ops, top_move_candidates=4 is exact-flat while 5 is worse, secondary_min_event_separation=2 is worse, and raising min_event_separation from 7 to 8 opened a lower-noise shelf that remained exact-flat at 9 before breaking sharply at 10. On that minsep8 shelf, top_move_candidates=3 is exact-flat, 2 and 1 only slightly weaken secondary metrics, top_board_candidates=2..4 are exact-flat, top_board_candidates=1 is harmful, beam_size=2 is slightly worse, secsep2 is worse, and event_window_radius=1..2, segment_board_drop_worst_frames=0, and secondary_peak_ratio=0.98 are exact no-ops. Lowering min_score_gain_per_added_move from 150.0 to 137.5 increased false changes and weakened secondaries, while raising it from 150.0 to 162.5, 175.0, 187.5, 200.0, 212.5, 225.0, 237.5, 250.0, 262.5, 275.0, 287.5, and 300.0 were exact no-ops and lowering min_total_score_gain from 150.0 down to 87.5 was also exact-flat. Lowering only min_score_gain_per_added_move to 143.75, 142.96875, 142.578125, and 142.3828125 were exact no-ops, while 142.33932495117188, 142.33856201171875, 142.3370361328125, 142.333984375, 142.28515625, and 142.1875 again increased false changes and weakened secondaries, so the lower edge lies between 142.33932495117188 and 142.33951568603516. This run restores the stable minsep8 shelf anchor and raises only min_score_gain_per_added_move from 142.33932495117188 to 142.33942031860352 to continue binary-searching that lower edge.
autoresearch/snapshots/20260419T153855Z_hybrid_lookahead_segmental_drop1_boardcands2_ratio95_props8_top4_detect10_lwindow3_minsep8_secsep1_thresh3_total150_permove142p3393726348877_lmargin9p935836791992188_m9p8957061767578125_r0_beam3_v855.py	0.071006	0.789778	0.739821	0.375000	0.024580	discard	Restore the recovered compact props8 sibling after recent local mapping showed the props7 shelf is saturated across top_move_candidates=5..16, beam_size=4 is an exact no-op, beam_size=2 is slightly worse, beam_size=1 is much worse, both hybrid acceptance gates are exact-flat down to 125.0, event_window_radius=1..2, segment_board_drop_worst_frames=0, and secondary_peak_ratio=0.98 are exact no-ops on the adjacent props7 shelf, secondary_min_event_separation=2 is worse there, and min_event_separation=8 and 6 are both worse than 7 there. On the compact props8 top4 anchor, top_board_candidates=2..4 are exact no-ops, top_move_candidates=4 is exact-flat while 5 is worse, secondary_min_event_separation=2 is worse, and raising min_event_separation from 7 to 8 opened a lower-noise shelf that remained exact-flat at 9 before breaking sharply at 10. On that minsep8 shelf, top_move_candidates=3 is exact-flat, 2 and 1 only slightly weaken secondary metrics, top_board_candidates=2..4 are exact-flat, top_board_candidates=1 is harmful, beam_size=2 is slightly worse, secsep2 is worse, and event_window_radius=1..2, segment_board_drop_worst_frames=0, and secondary_peak_ratio=0.98 are exact no-ops. Lowering min_score_gain_per_added_move from 150.0 to 137.5 increased false changes and weakened secondaries, while raising it from 150.0 to 162.5, 175.0, 187.5, 200.0, 212.5, 225.0, 237.5, 250.0, 262.5, 275.0, 287.5, and 300.0 were exact no-ops and lowering min_total_score_gain from 150.0 down to 87.5 was also exact-flat. Lowering only min_score_gain_per_added_move to 143.75, 142.96875, 142.578125, and 142.3828125 were exact no-ops, while 142.33942031860352, 142.33932495117188, 142.33856201171875, 142.3370361328125, 142.333984375, 142.28515625, and 142.1875 again increased false changes and weakened secondaries, so the lower edge lies between 142.33932495117188 and 142.33942031860352. This run restores the stable minsep8 shelf anchor and raises only min_score_gain_per_added_move from 142.33932495117188 to 142.3393726348877 to continue binary-searching that lower edge.
autoresearch/snapshots/20260419T154025Z_hybrid_lookahead_segmental_drop1_boardcands2_ratio95_props8_top4_detect10_lwindow3_minsep8_secsep1_thresh3_total150_permove142p3393964767456_lmargin9p935836791992188_m9p8957061767578125_r0_beam3_v856.py	0.071006	0.799339	0.749250	0.375000	0.020699	discard	Restore the recovered compact props8 sibling after recent local mapping showed the props7 shelf is saturated across top_move_candidates=5..16, beam_size=4 is an exact no-op, beam_size=2 is slightly worse, beam_size=1 is much worse, both hybrid acceptance gates are exact-flat down to 125.0, event_window_radius=1..2, segment_board_drop_worst_frames=0, and secondary_peak_ratio=0.98 are exact no-ops on the adjacent props7 shelf, secondary_min_event_separation=2 is worse there, and min_event_separation=8 and 6 are both worse than 7 there. On the compact props8 top4 anchor, top_board_candidates=2..4 are exact no-ops, top_move_candidates=4 is exact-flat while 5 is worse, secondary_min_event_separation=2 is worse, and raising min_event_separation from 7 to 8 opened a lower-noise shelf that remained exact-flat at 9 before breaking sharply at 10. On that minsep8 shelf, top_move_candidates=3 is exact-flat, 2 and 1 only slightly weaken secondary metrics, top_board_candidates=2..4 are exact-flat, top_board_candidates=1 is harmful, beam_size=2 is slightly worse, secsep2 is worse, and event_window_radius=1..2, segment_board_drop_worst_frames=0, and secondary_peak_ratio=0.98 are exact no-ops. Lowering min_score_gain_per_added_move from 150.0 to 137.5 increased false changes and weakened secondaries, while raising it from 150.0 to 162.5, 175.0, 187.5, 200.0, 212.5, 225.0, 237.5, 250.0, 262.5, 275.0, 287.5, and 300.0 were exact no-ops and lowering min_total_score_gain from 150.0 down to 87.5 was also exact-flat. Lowering only min_score_gain_per_added_move to 143.75, 142.96875, 142.578125, and 142.3828125 were exact no-ops, while 142.3393726348877, 142.33932495117188, 142.33856201171875, 142.3370361328125, 142.333984375, 142.28515625, and 142.1875 again increased false changes and weakened secondaries, so the lower edge lies between 142.3393726348877 and 142.33942031860352. This run restores the stable minsep8 shelf anchor and raises only min_score_gain_per_added_move from 142.3393726348877 to 142.3393964767456 to continue binary-searching that lower edge.
autoresearch/snapshots/20260419T154152Z_hybrid_lookahead_segmental_drop1_boardcands2_ratio95_props8_top4_detect10_lwindow3_minsep8_secsep1_thresh3_total150_permove142p33938455581665_lmargin9p935836791992188_m9p8957061767578125_r0_beam3_v857.py	0.071006	0.799339	0.749250	0.375000	0.020699	discard	Restore the recovered compact props8 sibling after recent local mapping showed the props7 shelf is saturated across top_move_candidates=5..16, beam_size=4 is an exact no-op, beam_size=2 is slightly worse, beam_size=1 is much worse, both hybrid acceptance gates are exact-flat down to 125.0, event_window_radius=1..2, segment_board_drop_worst_frames=0, and secondary_peak_ratio=0.98 are exact no-ops on the adjacent props7 shelf, secondary_min_event_separation=2 is worse there, and min_event_separation=8 and 6 are both worse than 7 there. On the compact props8 top4 anchor, top_board_candidates=2..4 are exact no-ops, top_move_candidates=4 is exact-flat while 5 is worse, secondary_min_event_separation=2 is worse, and raising min_event_separation from 7 to 8 opened a lower-noise shelf that remained exact-flat at 9 before breaking sharply at 10. On that minsep8 shelf, top_move_candidates=3 is exact-flat, 2 and 1 only slightly weaken secondary metrics, top_board_candidates=2..4 are exact-flat, top_board_candidates=1 is harmful, beam_size=2 is slightly worse, secsep2 is worse, and event_window_radius=1..2, segment_board_drop_worst_frames=0, and secondary_peak_ratio=0.98 are exact no-ops. Lowering min_score_gain_per_added_move from 150.0 to 137.5 increased false changes and weakened secondaries, while raising it from 150.0 to 162.5, 175.0, 187.5, 200.0, 212.5, 225.0, 237.5, 250.0, 262.5, 275.0, 287.5, and 300.0 were exact no-ops and lowering min_total_score_gain from 150.0 down to 87.5 was also exact-flat. Lowering only min_score_gain_per_added_move to 143.75, 142.96875, 142.578125, and 142.3828125 were exact no-ops, while 142.3393964767456, 142.3393726348877, 142.33932495117188, 142.33856201171875, 142.3370361328125, 142.333984375, 142.28515625, and 142.1875 again increased false changes and weakened secondaries, so the lower edge lies between 142.3393726348877 and 142.3393964767456. This run restores the stable minsep8 shelf anchor and raises only min_score_gain_per_added_move from 142.3393726348877 to 142.33938455581665 to continue binary-searching that lower edge.
autoresearch/snapshots/20260419T154328Z_hybrid_lookahead_segmental_drop1_boardcands2_ratio95_props8_top4_detect10_lwindow3_minsep8_secsep1_thresh3_total150_permove142p33937859535217_lmargin9p935836791992188_m9p8957061767578125_r0_beam3_v858.py	0.071006	0.789778	0.739821	0.375000	0.024580	discard	Restore the recovered compact props8 sibling after recent local mapping showed the props7 shelf is saturated across top_move_candidates=5..16, beam_size=4 is an exact no-op, beam_size=2 is slightly worse, beam_size=1 is much worse, both hybrid acceptance gates are exact-flat down to 125.0, event_window_radius=1..2, segment_board_drop_worst_frames=0, and secondary_peak_ratio=0.98 are exact no-ops on the adjacent props7 shelf, secondary_min_event_separation=2 is worse there, and min_event_separation=8 and 6 are both worse than 7 there. On the compact props8 top4 anchor, top_board_candidates=2..4 are exact no-ops, top_move_candidates=4 is exact-flat while 5 is worse, secondary_min_event_separation=2 is worse, and raising min_event_separation from 7 to 8 opened a lower-noise shelf that remained exact-flat at 9 before breaking sharply at 10. On that minsep8 shelf, top_move_candidates=3 is exact-flat, 2 and 1 only slightly weaken secondary metrics, top_board_candidates=2..4 are exact-flat, top_board_candidates=1 is harmful, beam_size=2 is slightly worse, secsep2 is worse, and event_window_radius=1..2, segment_board_drop_worst_frames=0, and secondary_peak_ratio=0.98 are exact no-ops. Lowering min_score_gain_per_added_move from 150.0 to 137.5 increased false changes and weakened secondaries, while raising it from 150.0 to 162.5, 175.0, 187.5, 200.0, 212.5, 225.0, 237.5, 250.0, 262.5, 275.0, 287.5, and 300.0 were exact no-ops and lowering min_total_score_gain from 150.0 down to 87.5 was also exact-flat. Lowering only min_score_gain_per_added_move to 143.75, 142.96875, 142.578125, and 142.3828125 were exact no-ops, while 142.3393726348877, 142.33932495117188, 142.33856201171875, 142.3370361328125, 142.333984375, 142.28515625, and 142.1875 again increased false changes and weakened secondaries, so the lower edge lies between 142.3393726348877 and 142.33938455581665. This run restores the stable minsep8 shelf anchor and raises only min_score_gain_per_added_move from 142.3393726348877 to 142.33937859535217 to continue binary-searching that lower edge.
autoresearch/snapshots/20260419T154523Z_hybrid_lookahead_segmental_drop1_boardcands2_ratio95_props8_top4_detect10_lwindow3_minsep8_secsep1_thresh3_total150_permove142p3393815755844_lmargin9p935836791992188_m9p8957061767578125_r0_beam3_v859.py	0.071006	0.799339	0.749250	0.375000	0.020699	discard	Restore the recovered compact props8 sibling after recent local mapping showed the props7 shelf is saturated across top_move_candidates=5..16, beam_size=4 is an exact no-op, beam_size=2 is slightly worse, beam_size=1 is much worse, both hybrid acceptance gates are exact-flat down to 125.0, event_window_radius=1..2, segment_board_drop_worst_frames=0, and secondary_peak_ratio=0.98 are exact no-ops on the adjacent props7 shelf, secondary_min_event_separation=2 is worse there, and min_event_separation=8 and 6 are both worse than 7 there. On the compact props8 top4 anchor, top_board_candidates=2..4 are exact no-ops, top_move_candidates=4 is exact-flat while 5 is worse, secondary_min_event_separation=2 is worse, and raising min_event_separation from 7 to 8 opened a lower-noise shelf that remained exact-flat at 9 before breaking sharply at 10. On that minsep8 shelf, top_move_candidates=3 is exact-flat, 2 and 1 only slightly weaken secondary metrics, top_board_candidates=2..4 are exact-flat, top_board_candidates=1 is harmful, beam_size=2 is slightly worse, secsep2 is worse, and event_window_radius=1..2, segment_board_drop_worst_frames=0, and secondary_peak_ratio=0.98 are exact no-ops. Lowering min_score_gain_per_added_move from 150.0 to 137.5 increased false changes and weakened secondaries, while raising it from 150.0 to 162.5, 175.0, 187.5, 200.0, 212.5, 225.0, 237.5, 250.0, 262.5, 275.0, 287.5, and 300.0 were exact no-ops and lowering min_total_score_gain from 150.0 down to 87.5 was also exact-flat. Lowering only min_score_gain_per_added_move to 143.75, 142.96875, 142.578125, and 142.3828125 were exact no-ops, while 142.33937859535217, 142.3393726348877, 142.33932495117188, 142.33856201171875, 142.3370361328125, 142.333984375, 142.28515625, and 142.1875 again increased false changes and weakened secondaries, so the lower edge lies between 142.33937859535217 and 142.33938455581665. This run restores the stable minsep8 shelf anchor and raises only min_score_gain_per_added_move from 142.33937859535217 to 142.3393815755844 to continue binary-searching that lower edge.
autoresearch/snapshots/20260419T154659Z_hybrid_lookahead_segmental_drop1_boardcands2_ratio95_props8_top4_detect10_lwindow3_minsep8_secsep1_thresh3_total150_permove142p3393800854683_lmargin9p935836791992188_m9p8957061767578125_r0_beam3_v860.py	0.071006	0.789778	0.739821	0.375000	0.024580	discard	Restore the recovered compact props8 sibling after recent local mapping showed the props7 shelf is saturated across top_move_candidates=5..16, beam_size=4 is an exact no-op, beam_size=2 is slightly worse, beam_size=1 is much worse, both hybrid acceptance gates are exact-flat down to 125.0, event_window_radius=1..2, segment_board_drop_worst_frames=0, and secondary_peak_ratio=0.98 are exact no-ops on the adjacent props7 shelf, secondary_min_event_separation=2 is worse there, and min_event_separation=8 and 6 are both worse than 7 there. On the compact props8 top4 anchor, top_board_candidates=2..4 are exact no-ops, top_move_candidates=4 is exact-flat while 5 is worse, secondary_min_event_separation=2 is worse, and raising min_event_separation from 7 to 8 opened a lower-noise shelf that remained exact-flat at 9 before breaking sharply at 10. On that minsep8 shelf, top_move_candidates=3 is exact-flat, 2 and 1 only slightly weaken secondary metrics, top_board_candidates=2..4 are exact-flat, top_board_candidates=1 is harmful, beam_size=2 is slightly worse, secsep2 is worse, and event_window_radius=1..2, segment_board_drop_worst_frames=0, and secondary_peak_ratio=0.98 are exact no-ops. Lowering min_score_gain_per_added_move from 150.0 to 137.5 increased false changes and weakened secondaries, while raising it from 150.0 to 162.5, 175.0, 187.5, 200.0, 212.5, 225.0, 237.5, 250.0, 262.5, 275.0, 287.5, and 300.0 were exact no-ops and lowering min_total_score_gain from 150.0 down to 87.5 was also exact-flat. Lowering only min_score_gain_per_added_move to 143.75, 142.96875, 142.578125, and 142.3828125 were exact no-ops, while 142.33937859535217, 142.3393726348877, 142.33932495117188, 142.33856201171875, 142.3370361328125, 142.333984375, 142.28515625, and 142.1875 again increased false changes and weakened secondaries, so the lower edge lies between 142.33937859535217 and 142.3393815755844. This run restores the stable minsep8 shelf anchor and raises only min_score_gain_per_added_move from 142.33937859535217 to 142.3393800854683 to continue binary-searching that lower edge.
autoresearch/snapshots/20260419T154836Z_hybrid_lookahead_segmental_drop1_boardcands2_ratio95_props8_top4_detect10_lwindow3_minsep8_secsep1_thresh3_total150_permove142p33938083052635_lmargin9p935836791992188_m9p8957061767578125_r0_beam3_v861.py	0.071006	0.789778	0.739821	0.375000	0.024580	discard	Restore the recovered compact props8 sibling after recent local mapping showed the props7 shelf is saturated across top_move_candidates=5..16, beam_size=4 is an exact no-op, beam_size=2 is slightly worse, beam_size=1 is much worse, both hybrid acceptance gates are exact-flat down to 125.0, event_window_radius=1..2, segment_board_drop_worst_frames=0, and secondary_peak_ratio=0.98 are exact no-ops on the adjacent props7 shelf, secondary_min_event_separation=2 is worse there, and min_event_separation=8 and 6 are both worse than 7 there. On the compact props8 top4 anchor, top_board_candidates=2..4 are exact no-ops, top_move_candidates=4 is exact-flat while 5 is worse, secondary_min_event_separation=2 is worse, and raising min_event_separation from 7 to 8 opened a lower-noise shelf that remained exact-flat at 9 before breaking sharply at 10. On that minsep8 shelf, top_move_candidates=3 is exact-flat, 2 and 1 only slightly weaken secondary metrics, top_board_candidates=2..4 are exact-flat, top_board_candidates=1 is harmful, beam_size=2 is slightly worse, secsep2 is worse, and event_window_radius=1..2, segment_board_drop_worst_frames=0, and secondary_peak_ratio=0.98 are exact no-ops. Lowering min_score_gain_per_added_move from 150.0 to 137.5 increased false changes and weakened secondaries, while raising it from 150.0 to 162.5, 175.0, 187.5, 200.0, 212.5, 225.0, 237.5, 250.0, 262.5, 275.0, 287.5, and 300.0 were exact no-ops and lowering min_total_score_gain from 150.0 down to 87.5 was also exact-flat. Lowering only min_score_gain_per_added_move to 143.75, 142.96875, 142.578125, and 142.3828125 were exact no-ops, while 142.3393800854683, 142.33937859535217, 142.3393726348877, 142.33932495117188, 142.33856201171875, 142.3370361328125, 142.333984375, 142.28515625, and 142.1875 again increased false changes and weakened secondaries, so the lower edge lies between 142.3393800854683 and 142.3393815755844. This run restores the stable minsep8 shelf anchor and raises only min_score_gain_per_added_move from 142.3393800854683 to 142.33938083052635 to continue binary-searching that lower edge.
