snapshot	board_exact	non_empty_accuracy	macro_f1	move_recall	false_change_rate	status	description
autoresearch/snapshots/20260419T051042Z_hybrid_lookahead_segmental_drop0_boardcands2_ratio95_props14_top4_detect10_lwindow1_minsep4_secsep1_thresh3_total150_permove125_lmargin9p5_m9p8957061767578125_r0_beam4_v539.py	0.074556	0.787970	0.745742	0.218750	0.011643	discard	Hybrid decoder keeps the baseline lookahead path unless a conservative board-only segmental pass wins the current score-gain gates, while following up the kept window1 branch after lowering lookahead window from 2 to 1 on the 9.5-margin baseline opened a lower-false-change but lower-recall tradeoff, lowering only max_event_proposals from 16 to 15 on the restored plain window1 branch improved recall and secondary metrics but worsened false-change, additionally narrowing top-board breadth from 4 to 3 recovered the lower false-change without hurting recall, lowering only max_event_proposals one step further from 15 to 14 on that boardcands3 plain props branch kept that recovered tradeoff, lowering segment_board_drop_worst_frames from 1 to 0 on that stronger props14 branch produced a new kept low-noise / lower-recall tradeoff, lowering secondary minimum event separation from 2 to 1 improved that tradeoff again, raising max_event_proposals from 14 to 15 on the new secsep1 branch was worse, and raising top-board breadth from 3 to 4 was an exact no-op, and lowering only top-board breadth from 3 to 2 on the new secsep1 best branch to test whether boardcands3 is still the local lower-edge sweet spot there or whether the secsep1 branch stays flat across 2..4.
autoresearch/snapshots/20260419T051144Z_hybrid_lookahead_segmental_drop0_boardcands3_ratio95_props14_top4_detect10_lwindow1_minsep4_secsep1_thresh3_total150_permove125_lmargin9p5_m9p8957061767578125_r0_beam5_v540.py	0.074556	0.795204	0.755567	0.218750	0.011643	discard	Hybrid decoder keeps the baseline lookahead path unless a conservative board-only segmental pass wins the current score-gain gates, while following up the kept window1 branch after lowering lookahead window from 2 to 1 on the 9.5-margin baseline opened a lower-false-change but lower-recall tradeoff, lowering only max_event_proposals from 16 to 15 on the restored plain window1 branch improved recall and secondary metrics but worsened false-change, additionally narrowing top-board breadth from 4 to 3 recovered the lower false-change without hurting recall, lowering only max_event_proposals one step further from 15 to 14 on that boardcands3 plain props branch kept that recovered tradeoff, lowering segment_board_drop_worst_frames from 1 to 0 on that stronger props14 branch produced a new kept low-noise / lower-recall tradeoff, lowering secondary minimum event separation from 2 to 1 improved that tradeoff again, raising max_event_proposals from 14 to 15 on the new secsep1 branch was worse, raising top-board breadth from 3 to 4 was an exact no-op, and lowering top-board breadth from 3 to 2 was worse, and raising only beam size from 4 to 5 on the new secsep1 best branch to test whether beam4 is still the local optimum there or whether the improved secsep1 branch opens an upper-beam plateau.
autoresearch/snapshots/20260419T051243Z_hybrid_lookahead_segmental_drop0_boardcands3_ratio95_props14_top4_detect10_lwindow1_minsep4_secsep1_thresh3_total150_permove125_lmargin9p5_m9p8957061767578125_r0_beam6_v541.py	0.074556	0.794326	0.751242	0.218750	0.011643	discard	Hybrid decoder keeps the baseline lookahead path unless a conservative board-only segmental pass wins the current score-gain gates, while following up the kept window1 branch after lowering lookahead window from 2 to 1 on the 9.5-margin baseline opened a lower-false-change but lower-recall tradeoff, lowering only max_event_proposals from 16 to 15 on the restored plain window1 branch improved recall and secondary metrics but worsened false-change, additionally narrowing top-board breadth from 4 to 3 recovered the lower false-change without hurting recall, lowering only max_event_proposals one step further from 15 to 14 on that boardcands3 plain props branch kept that recovered tradeoff, lowering segment_board_drop_worst_frames from 1 to 0 on that stronger props14 branch produced a new kept low-noise / lower-recall tradeoff, lowering secondary minimum event separation from 2 to 1 improved that tradeoff again, raising max_event_proposals from 14 to 15 on the new secsep1 branch was worse, raising top-board breadth from 3 to 4 was an exact no-op, lowering top-board breadth from 3 to 2 was worse, and raising beam size from 4 to 5 was an exact no-op, and raising only beam size from 4 to 6 on the new secsep1 best branch to test whether the improved branch opens a broader upper-beam plateau or whether beam5 was just a one-step no-op.
autoresearch/snapshots/20260419T051348Z_hybrid_lookahead_segmental_drop0_boardcands3_ratio95_props13_top4_detect10_lwindow1_minsep4_secsep1_thresh3_total150_permove125_lmargin9p5_m9p8957061767578125_r0_beam4_v542.py	0.074556	0.773087	0.729665	0.218750	0.020699	discard	Hybrid decoder keeps the baseline lookahead path unless a conservative board-only segmental pass wins the current score-gain gates, while following up the kept window1 branch after lowering lookahead window from 2 to 1 on the 9.5-margin baseline opened a lower-false-change but lower-recall tradeoff, lowering only max_event_proposals from 16 to 15 on the restored plain window1 branch improved recall and secondary metrics but worsened false-change, additionally narrowing top-board breadth from 4 to 3 recovered the lower false-change without hurting recall, lowering only max_event_proposals one step further from 15 to 14 on that boardcands3 plain props branch kept that recovered tradeoff, lowering segment_board_drop_worst_frames from 1 to 0 on that stronger props14 branch produced a new kept low-noise / lower-recall tradeoff, lowering secondary minimum event separation from 2 to 1 improved that tradeoff again, raising max_event_proposals from 14 to 15 on the new secsep1 branch was worse, raising top-board breadth from 3 to 4 was an exact no-op, lowering top-board breadth from 3 to 2 was worse, raising beam size from 4 to 5 was an exact no-op, and raising beam size from 4 to 6 was worse, and lowering only max_event_proposals from 14 to 13 on the new secsep1 best branch to test whether the improved low-noise tradeoff has a useful lower proposal side or whether 14 is already its local floor.
autoresearch/snapshots/20260419T051439Z_hybrid_lookahead_segmental_drop0_boardcands3_ratio95_props14_top1_detect10_lwindow1_minsep4_secsep1_thresh3_total150_permove125_lmargin9p5_m9p8957061767578125_r0_beam4_v543.py	0.074556	0.795204	0.755567	0.218750	0.011643	discard	Hybrid decoder keeps the baseline lookahead path unless a conservative board-only segmental pass wins the current score-gain gates, while following up the kept window1 branch after lowering lookahead window from 2 to 1 on the 9.5-margin baseline opened a lower-false-change but lower-recall tradeoff, lowering only max_event_proposals from 16 to 15 on the restored plain window1 branch improved recall and secondary metrics but worsened false-change, additionally narrowing top-board breadth from 4 to 3 recovered the lower false-change without hurting recall, lowering only max_event_proposals one step further from 15 to 14 on that boardcands3 plain props branch kept that recovered tradeoff, lowering segment_board_drop_worst_frames from 1 to 0 on that stronger props14 branch produced a new kept low-noise / lower-recall tradeoff, lowering secondary minimum event separation from 2 to 1 improved that tradeoff again, raising max_event_proposals from 14 to 15 was worse, raising top-board breadth from 3 to 4 was an exact no-op, lowering top-board breadth from 3 to 2 was worse, raising beam size from 4 to 5 was an exact no-op, raising beam size from 4 to 6 was worse, and lowering max_event_proposals from 14 to 13 was sharply worse, and lowering only top-move breadth from 4 to 1 on the new secsep1 best branch to test whether the improved branch still sits on the same move-width plateau as the older drop0 surfaces or whether move breadth became active again after the secsep1 shift.
autoresearch/snapshots/20260419T051600Z_hybrid_lookahead_segmental_drop0_boardcands3_ratio95_props14_top4_detect10_lwindow1_minsep4_secsep1_thresh3_total150_permove125_lmargin9p5_m9p8957061767578125_r0_beam3_v544.py	0.074556	0.815720	0.784846	0.203125	0.012937	discard	Hybrid decoder keeps the baseline lookahead path unless a conservative board-only segmental pass wins the current score-gain gates, while following up the kept window1 branch after lowering lookahead window from 2 to 1 on the 9.5-margin baseline opened a lower-false-change but lower-recall tradeoff, lowering only max_event_proposals from 16 to 15 on the restored plain window1 branch improved recall and secondary metrics but worsened false-change, additionally narrowing top-board breadth from 4 to 3 recovered the lower false-change without hurting recall, lowering only max_event_proposals one step further from 15 to 14 on that boardcands3 plain props branch kept that recovered tradeoff, lowering segment_board_drop_worst_frames from 1 to 0 on that stronger props14 branch produced a new kept low-noise / lower-recall tradeoff, lowering secondary minimum event separation from 2 to 1 improved that tradeoff again, raising max_event_proposals from 14 to 15 was worse, raising top-board breadth from 3 to 4 was an exact no-op, lowering top-board breadth from 3 to 2 was worse, raising beam size from 4 to 5 was an exact no-op, raising beam size from 4 to 6 was worse, lowering max_event_proposals from 14 to 13 was sharply worse, and lowering top-move breadth from 4 to 1 was an exact no-op, and lowering only beam size from 4 to 3 on the new secsep1 best branch to test whether beam4 is a true local optimum there or whether the improved branch also survives on the cheaper side.
autoresearch/snapshots/20260419T051743Z_hybrid_lookahead_segmental_drop1_boardcands3_ratio95_props14_top4_detect10_lwindow1_minsep4_secsep1_thresh3_total150_permove125_lmargin9p5_m9p8957061767578125_r0_beam4_v545.py	0.074556	0.792672	0.751719	0.234375	0.009056	keep	Hybrid decoder keeps the baseline lookahead path unless a conservative board-only segmental pass wins the current score-gain gates, while following up the kept window1 branch after lowering lookahead window from 2 to 1 on the 9.5-margin baseline opened a lower-false-change but lower-recall tradeoff, lowering only max_event_proposals from 16 to 15 on the restored plain window1 branch improved recall and secondary metrics but worsened false-change, additionally narrowing top-board breadth from 4 to 3 recovered the lower false-change without hurting recall, lowering only max_event_proposals one step further from 15 to 14 on that boardcands3 plain props branch kept that recovered tradeoff, lowering segment_board_drop_worst_frames from 1 to 0 on that stronger props14 branch produced a new kept low-noise / lower-recall tradeoff, lowering secondary minimum event separation from 2 to 1 improved that tradeoff again, raising max_event_proposals from 14 to 15 was worse, raising top-board breadth from 3 to 4 was an exact no-op, lowering top-board breadth from 3 to 2 was worse, raising beam size from 4 to 5 was an exact no-op, raising beam size from 4 to 6 was worse, lowering max_event_proposals from 14 to 13 was sharply worse, and lowering top-move breadth from 4 to 1 was an exact no-op, and raising only segment_board_drop_worst_frames from 0 back to 1 on the new secsep1 best branch to test whether the secsep1 gain survives restoring one-frame suppression or whether drop0 remains essential to the improved low-noise tradeoff.
autoresearch/snapshots/20260419T051853Z_hybrid_lookahead_segmental_drop1_boardcands1_ratio95_props14_top4_detect10_lwindow1_minsep4_secsep1_thresh3_total150_permove125_lmargin9p5_m9p8957061767578125_r0_beam4_v546.py	0.074556	0.742597	0.698299	0.250000	0.019405	discard	Hybrid decoder keeps the baseline lookahead path unless a conservative board-only segmental pass wins the current score-gain gates, while following up the kept window1 branch after lowering lookahead window from 2 to 1 on the 9.5-margin baseline opened a lower-false-change but lower-recall tradeoff, lowering only max_event_proposals from 16 to 15 on the restored plain window1 branch improved recall and secondary metrics but worsened false-change, additionally narrowing top-board breadth from 4 to 3 recovered the lower false-change without hurting recall, lowering only max_event_proposals one step further from 15 to 14 on that boardcands3 plain props branch kept that recovered tradeoff, lowering segment_board_drop_worst_frames from 1 to 0 on that stronger props14 branch produced a new kept low-noise / lower-recall tradeoff, lowering secondary minimum event separation from 2 to 1 improved that tradeoff again, raising max_event_proposals from 14 to 15 was worse, raising top-board breadth from 3 to 4 was an exact no-op, lowering top-board breadth from 3 to 2 was worse, raising beam size from 4 to 5 was an exact no-op, raising beam size from 4 to 6 was worse, lowering max_event_proposals from 14 to 13 was sharply worse, lowering top-move breadth from 4 to 1 was an exact no-op, and restoring segment_board_drop_worst_frames from 0 back to 1 on the secsep1 branch improved the tradeoff again, and lowering only top-board breadth from 3 to 1 on that new secsep1 + drop1 best branch to test whether boardcands3 remains the true lower-edge sweet spot there or whether the branch tolerates a more aggressive board-width collapse than the weaker boardcands2 result suggested.
autoresearch/snapshots/20260419T051957Z_hybrid_lookahead_segmental_drop1_boardcands3_ratio95_props14_top4_detect10_lwindow1_minsep4_secsep1_thresh3_total150_permove125_lmargin9p5_m9p8957061767578125_r0_beam3_v547.py	0.074556	0.815720	0.784846	0.218750	0.011643	discard	Hybrid decoder keeps the baseline lookahead path unless a conservative board-only segmental pass wins the current score-gain gates, while following up the kept window1 branch after lowering lookahead window from 2 to 1 on the 9.5-margin baseline opened a lower-false-change but lower-recall tradeoff, lowering only max_event_proposals from 16 to 15 on the restored plain window1 branch improved recall and secondary metrics but worsened false-change, additionally narrowing top-board breadth from 4 to 3 recovered the lower false-change without hurting recall, lowering only max_event_proposals one step further from 15 to 14 on that boardcands3 plain props branch kept that recovered tradeoff, lowering segment_board_drop_worst_frames from 1 to 0 on that stronger props14 branch produced a new kept low-noise / lower-recall tradeoff, lowering secondary minimum event separation from 2 to 1 improved that tradeoff again, raising max_event_proposals from 14 to 15 was worse, raising top-board breadth from 3 to 4 was an exact no-op, lowering top-board breadth from 3 to 2 was worse, raising beam size from 4 to 5 was an exact no-op, raising beam size from 4 to 6 was worse, lowering max_event_proposals from 14 to 13 was sharply worse, lowering top-move breadth from 4 to 1 was an exact no-op, and restoring segment_board_drop_worst_frames from 0 back to 1 improved the tradeoff again, and lowering only beam size from 4 to 3 on that new secsep1 + drop1 best branch to test whether beam4 is a true local optimum there or whether the improved branch also survives on the cheaper side.
autoresearch/snapshots/20260419T052814Z_hybrid_lookahead_segmental_drop1_boardcands2_ratio95_props14_top4_detect10_lwindow1_minsep4_secsep1_thresh3_total150_permove125_lmargin9p5_m9p8957061767578125_r0_beam4_v548.py	0.074556	0.791794	0.744073	0.234375	0.009056	discard	Hybrid decoder keeps the baseline lookahead path unless a conservative board-only segmental pass wins the current score-gain gates, while following up the kept window1 branch after lowering lookahead window from 2 to 1 on the 9.5-margin baseline opened a lower-false-change but lower-recall tradeoff, lowering only max_event_proposals from 16 to 15 on the restored plain window1 branch improved recall and secondary metrics but worsened false-change, additionally narrowing top-board breadth from 4 to 3 recovered the lower false-change without hurting recall, lowering only max_event_proposals one step further from 15 to 14 on that boardcands3 plain props branch kept that recovered tradeoff, lowering segment_board_drop_worst_frames from 1 to 0 on that stronger props14 branch produced a new kept low-noise / lower-recall tradeoff, lowering secondary minimum event separation from 2 to 1 improved that tradeoff again, raising max_event_proposals from 14 to 15 was worse, raising top-board breadth from 3 to 4 was an exact no-op, raising beam size from 4 to 5 was an exact no-op, raising beam size from 4 to 6 was worse, lowering max_event_proposals from 14 to 13 was sharply worse, lowering top-move breadth from 4 to 1 was an exact no-op, and restoring segment_board_drop_worst_frames from 0 back to 1 improved the tradeoff again, and lowering only top-board breadth from 3 to 2 on that new secsep1 + drop1 best branch to test whether boardcands3 is the true local sweet spot there or whether the improved branch still tolerates modest board-width narrowing.
autoresearch/snapshots/20260419T052923Z_hybrid_lookahead_segmental_drop2_boardcands3_ratio95_props14_top4_detect10_lwindow1_minsep4_secsep1_thresh3_total150_permove125_lmargin9p5_m9p8957061767578125_r0_beam4_v549.py	0.067456	0.763475	0.720790	0.265625	0.021992	discard	Hybrid decoder keeps the baseline lookahead path unless a conservative board-only segmental pass wins the current score-gain gates, while following up the kept window1 branch after lowering lookahead window from 2 to 1 on the 9.5-margin baseline opened a lower-false-change but lower-recall tradeoff, lowering only max_event_proposals from 16 to 15 on the restored plain window1 branch improved recall and secondary metrics but worsened false-change, additionally narrowing top-board breadth from 4 to 3 recovered the lower false-change without hurting recall, lowering only max_event_proposals one step further from 15 to 14 on that boardcands3 plain props branch kept that recovered tradeoff, lowering segment_board_drop_worst_frames from 1 to 0 on that stronger props14 branch produced a new kept low-noise / lower-recall tradeoff, lowering secondary minimum event separation from 2 to 1 improved that tradeoff again, raising max_event_proposals from 14 to 15 was worse, raising top-board breadth from 3 to 4 was an exact no-op, lowering top-board breadth from 3 to 2 was worse, raising beam size from 4 to 5 was an exact no-op, raising beam size from 4 to 6 was worse, lowering max_event_proposals from 14 to 13 was sharply worse, lowering top-move breadth from 4 to 1 was an exact no-op, and restoring segment_board_drop_worst_frames from 0 back to 1 improved the tradeoff again, and raising only segment_board_drop_worst_frames from 1 to 2 on that new secsep1 + drop1 best branch to test whether stronger worst-frame suppression improves the branch again or whether drop1 is already the local optimum.
autoresearch/snapshots/20260419T053035Z_hybrid_lookahead_segmental_drop1_boardcands3_ratio95_props15_top4_detect10_lwindow1_minsep4_secsep1_thresh3_total150_permove125_lmargin9p5_m9p8957061767578125_r0_beam4_v550.py	0.074556	0.765128	0.722163	0.250000	0.018111	discard	Hybrid decoder keeps the baseline lookahead path unless a conservative board-only segmental pass wins the current score-gain gates, while following up the kept window1 branch after lowering lookahead window from 2 to 1 on the 9.5-margin baseline opened a lower-false-change but lower-recall tradeoff, lowering only max_event_proposals from 16 to 15 on the restored plain window1 branch improved recall and secondary metrics but worsened false-change, additionally narrowing top-board breadth from 4 to 3 recovered the lower false-change without hurting recall, lowering only max_event_proposals one step further from 15 to 14 on that boardcands3 plain props branch kept that recovered tradeoff, lowering segment_board_drop_worst_frames from 1 to 0 on that stronger props14 branch produced a new kept low-noise / lower-recall tradeoff, lowering secondary minimum event separation from 2 to 1 improved that tradeoff again, raising max_event_proposals from 14 to 15 was worse, raising top-board breadth from 3 to 4 was an exact no-op, lowering top-board breadth from 3 to 2 was worse, raising beam size from 4 to 5 was an exact no-op, raising beam size from 4 to 6 was worse, lowering max_event_proposals from 14 to 13 was sharply worse, and lowering top-move breadth from 4 to 1 was an exact no-op, and restoring segment_board_drop_worst_frames from 0 back to 1 improved the tradeoff again, and raising only max_event_proposals from 14 to 15 on that new secsep1 + drop1 best branch to test whether the stronger drop1 branch tolerates a slightly broader proposal budget better than the weaker drop0 secsep1 surface did, or whether 14 remains the local optimum.
