snapshot	board_exact	non_empty_accuracy	macro_f1	move_recall	false_change_rate	status	description
autoresearch/snapshots/20260419T081214Z_hybrid_lookahead_segmental_drop1_boardcands2_ratio95_props14_top4_detect10_lwindow2_minsep4_secsep5_thresh3_total150_permove137p5_lmargin9p5_m9p8957061767578125_r0_beam3_v631.py	0.074556	0.764095	0.714832	0.328125	0.021992	discard	Hybrid decoder keeps the baseline lookahead path unless a conservative board-only segmental pass wins the current score-gain gates. The recent lower-beam sweep on the kept v545 branch established beam3 as the last usable lower-beam side branch, while beam2 and beam1 both degrade sharply. On beam3, raising LOOKAHEAD_WINDOW from 1 to 2 reopened a much higher-recall and noisier tradeoff, and tightening min_score_gain_per_added_move from 125.0 to 137.5 reduced that noise materially while preserving most of the recall gain. Narrowing board breadth from 3 to 2 then preserved board_exact while improving recall and false-change at the cost of weaker secondary metrics, while follow-up margin probes localized that narrower-board branch to the same 9.5..9.75 plateau and drop0/event-radius follow-ups were non-improving. Raising secondary_min_event_separation from 1 to 2 on that branch reopened a much noisier higher-recall tradeoff, and secsep3/4 matched each other while giving back some of that recall. This run keeps the recovered boardcands2 + lwindow2 + permove137.5 branch and raises only secondary_min_event_separation from 4 to 5 to test whether secsep3/4 were already the full upper shelf or whether the narrower-board branch stays flat further up.
autoresearch/snapshots/20260419T081344Z_hybrid_lookahead_segmental_drop1_boardcands2_ratio95_props14_top4_detect10_lwindow2_minsep4_secsep6_thresh3_total150_permove137p5_lmargin9p5_m9p8957061767578125_r0_beam3_v632.py	0.074556	0.764095	0.714832	0.328125	0.021992	discard	Hybrid decoder keeps the baseline lookahead path unless a conservative board-only segmental pass wins the current score-gain gates. The recent lower-beam sweep on the kept v545 branch established beam3 as the last usable lower-beam side branch, while beam2 and beam1 both degrade sharply. On beam3, raising LOOKAHEAD_WINDOW from 1 to 2 reopened a much higher-recall and noisier tradeoff, and tightening min_score_gain_per_added_move from 125.0 to 137.5 reduced that noise materially while preserving most of the recall gain. Narrowing board breadth from 3 to 2 then preserved board_exact while improving recall and false-change at the cost of weaker secondary metrics, while follow-up margin probes localized that narrower-board branch to the same 9.5..9.75 plateau and drop0/event-radius follow-ups were non-improving. Raising secondary_min_event_separation from 1 to 2 on that branch reopened a much noisier higher-recall tradeoff, and secsep3/4/5 all matched while giving back some of that recall. This run keeps the recovered boardcands2 + lwindow2 + permove137.5 branch and raises only secondary_min_event_separation from 5 to 6 to test whether that upper secsep shelf is already saturated or still extends one step further.
autoresearch/snapshots/20260419T081521Z_hybrid_lookahead_segmental_drop1_boardcands2_ratio95_props14_top4_detect10_lwindow2_minsep4_secsep1_thresh3_total150_permove137p5_lmargin9p5_m9p8957061767578125_r2_beam3_v633.py	0.074556	0.789158	0.738431	0.312500	0.011643	discard	Hybrid decoder keeps the baseline lookahead path unless a conservative board-only segmental pass wins the current score-gain gates. The recent lower-beam sweep on the kept v545 branch established beam3 as the last usable lower-beam side branch, while beam2 and beam1 both degrade sharply. On beam3, raising LOOKAHEAD_WINDOW from 1 to 2 reopened a much higher-recall and noisier tradeoff, and tightening min_score_gain_per_added_move from 125.0 to 137.5 reduced that noise materially while preserving most of the recall gain. Narrowing board breadth from 3 to 2 then preserved board_exact while improving recall and false-change at the cost of weaker secondary metrics, while follow-up margin probes localized that narrower-board branch to the same 9.5..9.75 plateau. An r1 follow-up on that narrower-board branch was a true no-op, while secondary-spacing and drop0 follow-ups were non-improving. This run keeps the recovered boardcands2 + lwindow2 + permove137.5 branch and raises only event_window_radius from 0 to 2 to test whether the full allowed proposal neighborhood is still a no-op there or whether the broader temporal radius changes the narrower-board branch.
autoresearch/snapshots/20260419T081721Z_hybrid_lookahead_segmental_drop1_boardcands2_ratio95_props14_top4_detect10_lwindow2_minsep4_secsep1_thresh3_total150_permove150_lmargin9p5_m9p8957061767578125_r0_beam3_v634.py	0.074556	0.789158	0.738431	0.312500	0.011643	discard	Hybrid decoder keeps the baseline lookahead path unless a conservative board-only segmental pass wins the current score-gain gates. The recent lower-beam sweep on the kept v545 branch established beam3 as the last usable lower-beam side branch, while beam2 and beam1 both degrade sharply. On beam3, raising LOOKAHEAD_WINDOW from 1 to 2 reopened a much higher-recall and noisier tradeoff, and tightening min_score_gain_per_added_move from 125.0 to 137.5 reduced that noise materially while preserving most of the recall gain. Narrowing board breadth from 3 to 2 then preserved board_exact while improving recall and false-change at the cost of weaker secondary metrics, while follow-up margin probes localized that narrower-board branch to the same 9.5..9.75 plateau and event-radius follow-ups stayed true no-ops. Secondary-spacing and drop0 follow-ups were non-improving there. This run keeps the recovered boardcands2 + lwindow2 branch and raises only min_score_gain_per_added_move from 137.5 to 150.0 to test whether the narrower-board branch still sits on the same upper gate plateau as the broader recovered branch or whether a stricter per-move gate changes this local tradeoff.
autoresearch/snapshots/20260419T082231Z_hybrid_lookahead_segmental_drop1_boardcands2_ratio95_props14_top4_detect10_lwindow2_minsep3_secsep1_thresh3_total150_permove137p5_lmargin9p5_m9p8957061767578125_r0_beam3_v635.py	0.042604	0.759651	0.704791	0.281250	0.023286	discard	Hybrid decoder keeps the baseline lookahead path unless a conservative board-only segmental pass wins the current score-gain gates. The recent lower-beam sweep on the kept v545 branch established beam3 as the last usable lower-beam side branch, while beam2 and beam1 both degrade sharply. On beam3, raising LOOKAHEAD_WINDOW from 1 to 2 reopened a much higher-recall and noisier tradeoff, and tightening min_score_gain_per_added_move from 125.0 to 137.5 reduced that noise materially while preserving most of the recall gain. Narrowing board breadth from 3 to 2 then preserved board_exact while improving recall and false-change at the cost of weaker secondary metrics, while follow-up margin probes localized that narrower-board branch to the same 9.5..9.75 plateau and event-radius, drop, and upper gate follow-ups were non-improving. This run keeps the recovered boardcands2 + lwindow2 + permove137.5 branch and lowers only min_event_separation from 4 to 3 to test whether the narrower-board branch shifts the primary-spacing optimum or whether minsep4 remains locally required there.
autoresearch/snapshots/20260419T082501Z_hybrid_lookahead_segmental_drop1_boardcands2_ratio95_props14_top4_detect10_lwindow3_minsep4_secsep1_thresh3_total150_permove137p5_lmargin9p5_m9p8957061767578125_r0_beam3_v636.py	0.049704	0.765490	0.706758	0.343750	0.025873	discard	Hybrid decoder keeps the baseline lookahead path unless a conservative board-only segmental pass wins the current score-gain gates. The recent lower-beam sweep on the kept v545 branch established beam3 as the last usable lower-beam side branch, while beam2 and beam1 both degrade sharply. On beam3, raising LOOKAHEAD_WINDOW from 1 to 2 reopened a much higher-recall and noisier tradeoff, and tightening min_score_gain_per_added_move from 125.0 to 137.5 reduced that noise materially while preserving most of the recall gain. Narrowing board breadth from 3 to 2 then preserved board_exact while improving recall and false-change at the cost of weaker secondary metrics, while follow-up margin probes localized that narrower-board branch to the same 9.5..9.75 plateau and event-radius, drop, and upper gate follow-ups were non-improving. Lowering min_event_separation from 4 to 3 then regressed sharply, so minsep4 still looks locally required. This run keeps the recovered boardcands2 + beam3 + minsep4 branch and raises only LOOKAHEAD_WINDOW from 2 to 3 to test whether longer baseline temporal context opens a new recovered branch there or whether lwindow2 was already the useful edge.
autoresearch/snapshots/20260419T082712Z_hybrid_lookahead_segmental_drop1_boardcands2_ratio95_props14_top4_detect10_lwindow3_minsep4_secsep1_thresh3_total150_permove150_lmargin9p5_m9p8957061767578125_r0_beam3_v637.py	0.049704	0.765490	0.706758	0.343750	0.025873	discard	Hybrid decoder keeps the baseline lookahead path unless a conservative board-only segmental pass wins the current score-gain gates. The recent lower-beam sweep on the kept v545 branch established beam3 as the last usable lower-beam side branch, while beam2 and beam1 both degrade sharply. On beam3, raising LOOKAHEAD_WINDOW from 1 to 2 reopened a much higher-recall and noisier tradeoff, and tightening min_score_gain_per_added_move from 125.0 to 137.5 reduced that noise materially while preserving most of the recall gain. Narrowing board breadth from 3 to 2 then preserved board_exact while improving recall and false-change at the cost of weaker secondary metrics, while follow-up margin probes localized that narrower-board branch to the same 9.5..9.75 plateau and event-radius, drop, and upper gate follow-ups were non-improving. Lowering min_event_separation from 4 to 3 regressed sharply, but raising LOOKAHEAD_WINDOW from 2 to 3 reopened an even higher-recall and much noisier branch. This run keeps that lwindow3 + boardcands2 branch and raises only min_score_gain_per_added_move from 137.5 to 150.0 to test whether a stricter hybrid handoff can recover some of the added noise without collapsing the new recall gain.
autoresearch/snapshots/20260419T082937Z_hybrid_lookahead_segmental_drop1_boardcands2_ratio95_props14_top4_detect10_lwindow3_minsep4_secsep1_thresh3_total150_permove150_lmargin10_m9p8957061767578125_r0_beam3_v638.py	0.049704	0.773862	0.717580	0.296875	0.025873	discard	Hybrid decoder keeps the baseline lookahead path unless a conservative board-only segmental pass wins the current score-gain gates. The recent lower-beam sweep on the kept v545 branch established beam3 as the last usable lower-beam side branch, while beam2 and beam1 both degrade sharply. On beam3, raising LOOKAHEAD_WINDOW from 1 to 2 reopened a much higher-recall and noisier tradeoff, and tightening min_score_gain_per_added_move from 125.0 to 137.5 reduced that noise materially while preserving most of the recall gain. Narrowing board breadth from 3 to 2 then preserved board_exact while improving recall and false-change at the cost of weaker secondary metrics, while follow-up margin probes localized that narrower-board branch to the same 9.5..9.75 plateau and event-radius, drop, and upper gate follow-ups were non-improving. Lowering min_event_separation from 4 to 3 regressed sharply, while raising LOOKAHEAD_WINDOW from 2 to 3 reopened an even higher-recall and much noisier branch, and tightening min_score_gain_per_added_move from 137.5 to 150.0 was an exact no-op there. This run keeps that lwindow3 + boardcands2 branch and raises only LOOKAHEAD_MARGIN from 9.5 to 10.0 to test whether a more conservative baseline lookahead path can trim the new noise without collapsing the recovered recall.
autoresearch/snapshots/20260419T083150Z_hybrid_lookahead_segmental_drop1_boardcands2_ratio95_props14_top4_detect10_lwindow3_minsep4_secsep1_thresh3_total150_permove150_lmargin9p75_m9p8957061767578125_r0_beam3_v639.py	0.050888	0.766007	0.705801	0.343750	0.031048	discard	Hybrid decoder keeps the baseline lookahead path unless a conservative board-only segmental pass wins the current score-gain gates. The recent lower-beam sweep on the kept v545 branch established beam3 as the last usable lower-beam side branch, while beam2 and beam1 both degrade sharply. On beam3, raising LOOKAHEAD_WINDOW from 1 to 2 reopened a much higher-recall and noisier tradeoff, and tightening min_score_gain_per_added_move from 125.0 to 137.5 reduced that noise materially while preserving most of the recall gain. Narrowing board breadth from 3 to 2 then preserved board_exact while improving recall and false-change at the cost of weaker secondary metrics, while follow-up margin probes localized that narrower-board branch to the same 9.5..9.75 plateau and event-radius, drop, and upper gate follow-ups were non-improving. Lowering min_event_separation from 4 to 3 regressed sharply, while raising LOOKAHEAD_WINDOW from 2 to 3 reopened an even higher-recall and much noisier branch, and tightening min_score_gain_per_added_move from 137.5 to 150.0 was an exact no-op there. Raising LOOKAHEAD_MARGIN from 9.5 to 10.0 on that lwindow3 branch gave back recall without improving false-change. This run keeps that lwindow3 + boardcands2 branch and lowers only LOOKAHEAD_MARGIN from 10.0 to 9.75 to test whether the margin transition is already active below 10.0 or whether 10.0 was the first shifted point.
autoresearch/snapshots/20260419T083249Z_hybrid_lookahead_segmental_drop1_boardcands2_ratio95_props14_top4_detect10_lwindow3_minsep4_secsep1_thresh3_total150_permove150_lmargin9p875_m9p8957061767578125_r0_beam3_v640.py	0.050888	0.769418	0.711542	0.343750	0.031048	discard	Hybrid decoder keeps the baseline lookahead path unless a conservative board-only segmental pass wins the current score-gain gates. The recent lower-beam sweep on the kept v545 branch established beam3 as the last usable lower-beam side branch, while beam2 and beam1 both degrade sharply. On beam3, raising LOOKAHEAD_WINDOW from 1 to 2 reopened a much higher-recall and noisier tradeoff, and tightening min_score_gain_per_added_move from 125.0 to 137.5 reduced that noise materially while preserving most of the recall gain. Narrowing board breadth from 3 to 2 then preserved board_exact while improving recall and false-change at the cost of weaker secondary metrics, while follow-up margin probes localized that narrower-board branch to the same 9.5..9.75 plateau and event-radius, drop, and upper gate follow-ups were non-improving. Lowering min_event_separation from 4 to 3 regressed sharply, while raising LOOKAHEAD_WINDOW from 2 to 3 reopened an even higher-recall and much noisier branch, and tightening min_score_gain_per_added_move from 137.5 to 150.0 was an exact no-op there. On that lwindow3 branch, LOOKAHEAD_MARGIN=10.0 gave back recall without improving false changes, while 9.75 kept the higher recall but made false changes even worse. This run keeps that lwindow3 + boardcands2 branch and sets only LOOKAHEAD_MARGIN to 9.875 to test whether the lwindow3 margin surface has an intermediate shelf between those two points.
autoresearch/snapshots/20260419T083349Z_hybrid_lookahead_segmental_drop1_boardcands2_ratio95_props14_top4_detect10_lwindow3_minsep4_secsep1_thresh3_total150_permove150_lmargin9p625_m9p8957061767578125_r0_beam3_v641.py	0.050888	0.766007	0.705801	0.343750	0.031048	discard	Hybrid decoder keeps the baseline lookahead path unless a conservative board-only segmental pass wins the current score-gain gates. The recent lower-beam sweep on the kept v545 branch established beam3 as the last usable lower-beam side branch, while beam2 and beam1 both degrade sharply. On beam3, raising LOOKAHEAD_WINDOW from 1 to 2 reopened a much higher-recall and noisier tradeoff, and tightening min_score_gain_per_added_move from 125.0 to 137.5 reduced that noise materially while preserving most of the recall gain. Narrowing board breadth from 3 to 2 then preserved board_exact while improving recall and false-change at the cost of weaker secondary metrics, while follow-up margin probes localized that narrower-board branch to the same 9.5..9.75 plateau and event-radius, drop, and upper gate follow-ups were non-improving. Lowering min_event_separation from 4 to 3 regressed sharply, while raising LOOKAHEAD_WINDOW from 2 to 3 reopened an even higher-recall and much noisier branch, and tightening min_score_gain_per_added_move from 137.5 to 150.0 was an exact no-op there. On that lwindow3 branch, LOOKAHEAD_MARGIN=9.75 and 9.875 both matched the higher-noise surface, while 10.0 gave back recall without improving false changes. This run keeps that lwindow3 + boardcands2 branch and sets only LOOKAHEAD_MARGIN to 9.625 to localize where the false-change jump first appears between 9.5 and 9.75.
autoresearch/snapshots/20260419T083450Z_hybrid_lookahead_segmental_drop1_boardcands2_ratio95_props14_top4_detect10_lwindow3_minsep4_secsep1_thresh3_total150_permove150_lmargin9p5625_m9p8957061767578125_r0_beam3_v642.py	0.050888	0.764095	0.705361	0.343750	0.032342	discard	Hybrid decoder keeps the baseline lookahead path unless a conservative board-only segmental pass wins the current score-gain gates. The recent lower-beam sweep on the kept v545 branch established beam3 as the last usable lower-beam side branch, while beam2 and beam1 both degrade sharply. On beam3, raising LOOKAHEAD_WINDOW from 1 to 2 reopened a much higher-recall and noisier tradeoff, and tightening min_score_gain_per_added_move from 125.0 to 137.5 reduced that noise materially while preserving most of the recall gain. Narrowing board breadth from 3 to 2 then preserved board_exact while improving recall and false-change at the cost of weaker secondary metrics, while follow-up margin probes localized that narrower-board branch to the same 9.5..9.75 plateau and event-radius, drop, and upper gate follow-ups were non-improving. Lowering min_event_separation from 4 to 3 regressed sharply, while raising LOOKAHEAD_WINDOW from 2 to 3 reopened an even higher-recall and much noisier branch, and tightening min_score_gain_per_added_move from 137.5 to 150.0 was an exact no-op there. On that lwindow3 branch, LOOKAHEAD_MARGIN=9.625, 9.75, and 9.875 all matched the higher-noise surface, while 10.0 gave back recall without improving false changes. This run keeps that lwindow3 + boardcands2 branch and sets only LOOKAHEAD_MARGIN to 9.5625 to localize whether the false-change jump starts immediately above 9.5 or only later in the 9.5..9.625 interval.
autoresearch/snapshots/20260419T083605Z_hybrid_lookahead_segmental_drop1_boardcands2_ratio95_props14_top4_detect10_lwindow3_minsep4_secsep1_thresh3_total150_permove150_lmargin9p5_m9p8957061767578125_r1_beam3_v643.py	0.049704	0.765490	0.706758	0.343750	0.025873	discard	Hybrid decoder keeps the baseline lookahead path unless a conservative board-only segmental pass wins the current score-gain gates. The recent lower-beam sweep on the kept v545 branch established beam3 as the last usable lower-beam side branch, while beam2 and beam1 both degrade sharply. On beam3, raising LOOKAHEAD_WINDOW from 1 to 2 reopened a much higher-recall and noisier tradeoff, and tightening min_score_gain_per_added_move from 125.0 to 137.5 reduced that noise materially while preserving most of the recall gain. Narrowing board breadth from 3 to 2 then preserved board_exact while improving recall and false-change at the cost of weaker secondary metrics, while follow-up margin probes localized that narrower-board branch to the same 9.5..9.75 plateau and event-radius, drop, and upper gate follow-ups were non-improving. Lowering min_event_separation from 4 to 3 regressed sharply, while raising LOOKAHEAD_WINDOW from 2 to 3 reopened an even higher-recall and much noisier branch, and tightening min_score_gain_per_added_move from 137.5 to 150.0 was an exact no-op there. On that lwindow3 branch, 9.5625..9.875 all sit on the higher-noise shelf, while 10.0 gives back recall without improving false changes, so 9.5 remains the useful edge. This run keeps that lwindow3 + boardcands2 branch and raises only event_window_radius from 0 to 1 to test whether a small proposal neighborhood is flat there too or changes the new high-recall noisy surface.
