snapshot	board_exact	non_empty_accuracy	macro_f1	move_recall	false_change_rate	status	description
autoresearch/snapshots/20260419T073243Z_hybrid_lookahead_segmental_drop1_boardcands3_ratio95_props14_top4_detect10_lwindow2_minsep4_secsep1_thresh3_total150_permove137p5_lmargin10_m9p8957061767578125_r0_beam3_v615.py	0.074556	0.815979	0.785788	0.281250	0.014230	discard	Hybrid decoder keeps the baseline lookahead path unless a conservative board-only segmental pass wins the current score-gain gates. The recent lower-beam sweep on the kept v545 branch established beam3 as the last usable lower-beam side branch, while beam2 and beam1 both degrade sharply. Follow-up beam3 probes on secondary spacing, primary spacing, and event radius did not improve that branch, but raising LOOKAHEAD_WINDOW from 1 to 2 reopened a much higher-recall and much noisier tradeoff, and tightening min_score_gain_per_added_move from 125.0 to 137.5 reduced that noise materially while preserving most of the recall gain, while further gate tightening and narrowing top_move_candidates to 1 were exact no-ops. This run keeps that beam3 + lwindow2 + permove137.5 branch and raises only LOOKAHEAD_MARGIN from 9.5 to 10.0 to test whether a slightly more conservative lookahead baseline can shave false changes without giving back the recovered recall.
autoresearch/snapshots/20260419T073404Z_hybrid_lookahead_segmental_drop1_boardcands3_ratio95_props14_top4_detect10_lwindow2_minsep4_secsep1_thresh3_total150_permove137p5_lmargin9p75_m9p8957061767578125_r0_beam3_v616.py	0.074556	0.814428	0.783465	0.296875	0.014230	discard	Hybrid decoder keeps the baseline lookahead path unless a conservative board-only segmental pass wins the current score-gain gates. The recent lower-beam sweep on the kept v545 branch established beam3 as the last usable lower-beam side branch, while beam2 and beam1 both degrade sharply. Raising LOOKAHEAD_WINDOW from 1 to 2 reopened a much higher-recall and noisier beam3 tradeoff, tightening min_score_gain_per_added_move from 125.0 to 137.5 reduced that noise materially, and further gate tightening plus top_move_candidates=1 were exact no-ops. Raising LOOKAHEAD_MARGIN from 9.5 to 10.0 on that branch preserved the lower false-change while giving up some recall. This run keeps beam3 + lwindow2 + permove137.5 and moves only LOOKAHEAD_MARGIN to 9.75 to test whether that recall/noise tradeoff is smooth between 9.5 and 10.0 or whether 10.0 was already a discrete jump.
autoresearch/snapshots/20260419T073530Z_hybrid_lookahead_segmental_drop1_boardcands3_ratio95_props14_top4_detect10_lwindow2_minsep4_secsep1_thresh3_total150_permove137p5_lmargin9p875_m9p8957061767578125_r0_beam3_v617.py	0.074556	0.815979	0.785788	0.281250	0.014230	discard	Hybrid decoder keeps the baseline lookahead path unless a conservative board-only segmental pass wins the current score-gain gates. The recent lower-beam sweep on the kept v545 branch established beam3 as the last usable lower-beam side branch, while beam2 and beam1 both degrade sharply. Raising LOOKAHEAD_WINDOW from 1 to 2 reopened a much higher-recall and noisier beam3 tradeoff, and tightening min_score_gain_per_added_move from 125.0 to 137.5 reduced that noise materially while preserving most of the recall gain. On that recovered-recall branch, LOOKAHEAD_MARGIN=9.75 was an exact no-op versus 9.5, while 10.0 preserved the lower false-change but gave up some recall. This run keeps beam3 + lwindow2 + permove137.5 and moves only LOOKAHEAD_MARGIN to 9.875 to test whether the margin transition is still flat above 9.75 or whether the branch starts shifting before 10.0.
autoresearch/snapshots/20260419T073654Z_hybrid_lookahead_segmental_drop1_boardcands3_ratio95_props14_top4_detect10_lwindow2_minsep5_secsep1_thresh3_total150_permove137p5_lmargin9p5_m9p8957061767578125_r0_beam3_v618.py	0.048521	0.782802	0.749258	0.312500	0.024580	discard	Hybrid decoder keeps the baseline lookahead path unless a conservative board-only segmental pass wins the current score-gain gates. The recent lower-beam sweep on the kept v545 branch established beam3 as the last usable lower-beam side branch, while beam2 and beam1 both degrade sharply. Raising LOOKAHEAD_WINDOW from 1 to 2 reopened a much higher-recall and noisier beam3 tradeoff, and tightening min_score_gain_per_added_move from 125.0 to 137.5 reduced that noise materially while preserving most of the recall gain. Margin probes then showed 9.75 is an exact no-op versus 9.5, while 9.875 and 10.0 shift to a slightly lower-recall variant at the same false-change rate. This run keeps the recovered beam3 + lwindow2 + permove137.5 branch and raises only min_event_separation from 4 to 5 to test whether stricter primary spacing can cut the extra detections without collapsing the recovered recall surface.
autoresearch/snapshots/20260419T073809Z_hybrid_lookahead_segmental_drop1_boardcands4_ratio95_props14_top4_detect10_lwindow2_minsep4_secsep1_thresh3_total150_permove137p5_lmargin9p5_m9p8957061767578125_r0_beam3_v619.py	0.074556	0.814428	0.783465	0.296875	0.014230	discard	Hybrid decoder keeps the baseline lookahead path unless a conservative board-only segmental pass wins the current score-gain gates. The recent lower-beam sweep on the kept v545 branch established beam3 as the last usable lower-beam side branch, while beam2 and beam1 both degrade sharply. Raising LOOKAHEAD_WINDOW from 1 to 2 reopened a much higher-recall and noisier beam3 tradeoff, and tightening min_score_gain_per_added_move from 125.0 to 137.5 reduced that noise materially while preserving most of the recall gain. Margin probes then localized the best recovered-recall variant to the 9.5..9.75 plateau, with 9.875 and 10.0 shifting to the lower-recall shelf. This run keeps that beam3 + lwindow2 + permove137.5 branch and raises only top_board_candidates from 3 to 4 to test whether broader board breadth changes the recovered branch or is another no-op at beam3.
autoresearch/snapshots/20260419T074919Z_hybrid_lookahead_segmental_drop1_boardcands2_ratio95_props14_top4_detect10_lwindow2_minsep4_secsep1_thresh3_total150_permove137p5_lmargin9p5_m9p8957061767578125_r0_beam3_v620.py	0.074556	0.789158	0.738431	0.312500	0.011643	discard	Hybrid decoder keeps the baseline lookahead path unless a conservative board-only segmental pass wins the current score-gain gates. The recent lower-beam sweep on the kept v545 branch established beam3 as the last usable lower-beam side branch, while beam2 and beam1 both degrade sharply. On beam3, raising LOOKAHEAD_WINDOW from 1 to 2 reopened a much higher-recall and noisier tradeoff, and tightening min_score_gain_per_added_move from 125.0 to 137.5 reduced that noise materially while preserving most of the recall gain. Follow-up probes showed stricter gates, top1, and boardcands4 are exact no-ops on that recovered branch, while margin probes localized the best variant to the 9.5..9.75 plateau. This run keeps the recovered beam3 + lwindow2 + permove137.5 branch and lowers only top_board_candidates from 3 to 2 to test whether narrower board breadth can trim noise or whether board breadth is also saturated downward on this branch.
autoresearch/snapshots/20260419T075137Z_hybrid_lookahead_segmental_drop1_boardcands1_ratio95_props14_top4_detect10_lwindow2_minsep4_secsep1_thresh3_total150_permove137p5_lmargin9p5_m9p8957061767578125_r0_beam3_v621.py	0.074556	0.766524	0.729637	0.328125	0.019405	discard	Hybrid decoder keeps the baseline lookahead path unless a conservative board-only segmental pass wins the current score-gain gates. The recent lower-beam sweep on the kept v545 branch established beam3 as the last usable lower-beam side branch, while beam2 and beam1 both degrade sharply. On beam3, raising LOOKAHEAD_WINDOW from 1 to 2 reopened a much higher-recall and noisier tradeoff, and tightening min_score_gain_per_added_move from 125.0 to 137.5 reduced that noise materially while preserving most of the recall gain. Follow-up probes showed stricter gates, top1, and boardcands4 are exact no-ops on that recovered branch, while margin probes localized the best variant to the 9.5..9.75 plateau. Narrowing board breadth from 3 to 2 then preserved board_exact, improved recall and false-change, and weakened only the secondary metrics. This run keeps that recovered beam3 + lwindow2 + permove137.5 branch and lowers only top_board_candidates from 2 to 1 to test whether the narrower-board tradeoff can be pushed further or whether boardcands2 was already the useful lower edge.
autoresearch/snapshots/20260419T075426Z_hybrid_lookahead_segmental_drop1_boardcands2_ratio95_props14_top4_detect10_lwindow2_minsep4_secsep1_thresh3_total150_permove137p5_lmargin10_m9p8957061767578125_r0_beam3_v622.py	0.074556	0.790708	0.740754	0.296875	0.011643	discard	Hybrid decoder keeps the baseline lookahead path unless a conservative board-only segmental pass wins the current score-gain gates. The recent lower-beam sweep on the kept v545 branch established beam3 as the last usable lower-beam side branch, while beam2 and beam1 both degrade sharply. On beam3, raising LOOKAHEAD_WINDOW from 1 to 2 reopened a much higher-recall and noisier tradeoff, and tightening min_score_gain_per_added_move from 125.0 to 137.5 reduced that noise materially while preserving most of the recall gain. Follow-up probes showed stricter gates, top1, and boardcands4 are exact no-ops on that recovered branch, while margin probes localized the boardcands3 branch to a 9.5..9.75 plateau with a lower-recall shelf at 9.875/10.0. Narrowing board breadth from 3 to 2 then preserved board_exact while improving recall and false-change at the cost of weaker secondary metrics. This run keeps that recovered boardcands2 branch and raises only LOOKAHEAD_MARGIN from 9.5 to 10.0 to test whether the narrower-board tradeoff inherits the same margin shelf or opens a better recall/noise balance.
autoresearch/snapshots/20260419T075650Z_hybrid_lookahead_segmental_drop1_boardcands2_ratio95_props14_top4_detect10_lwindow2_minsep4_secsep1_thresh3_total150_permove137p5_lmargin9p875_m9p8957061767578125_r0_beam3_v623.py	0.074556	0.790708	0.740754	0.296875	0.011643	discard	Hybrid decoder keeps the baseline lookahead path unless a conservative board-only segmental pass wins the current score-gain gates. The recent lower-beam sweep on the kept v545 branch established beam3 as the last usable lower-beam side branch, while beam2 and beam1 both degrade sharply. On beam3, raising LOOKAHEAD_WINDOW from 1 to 2 reopened a much higher-recall and noisier tradeoff, and tightening min_score_gain_per_added_move from 125.0 to 137.5 reduced that noise materially while preserving most of the recall gain. Follow-up probes showed stricter gates, top1, and boardcands4 are exact no-ops on that recovered branch. Narrowing board breadth from 3 to 2 then preserved board_exact while improving recall and false-change at the cost of weaker secondary metrics, while raising LOOKAHEAD_MARGIN from 9.5 to 10.0 on that narrower-board branch reduced recall back to the 0.296875 shelf without improving false changes. This run keeps the recovered boardcands2 branch and raises only LOOKAHEAD_MARGIN from 9.5 to 9.875 to test whether the transition happens before 10.0 or whether 10.0 was already the first shifted point.
autoresearch/snapshots/20260419T075858Z_hybrid_lookahead_segmental_drop1_boardcands2_ratio95_props14_top4_detect10_lwindow2_minsep4_secsep1_thresh3_total150_permove137p5_lmargin9p75_m9p8957061767578125_r0_beam3_v624.py	0.074556	0.789158	0.738431	0.312500	0.011643	discard	Hybrid decoder keeps the baseline lookahead path unless a conservative board-only segmental pass wins the current score-gain gates. The recent lower-beam sweep on the kept v545 branch established beam3 as the last usable lower-beam side branch, while beam2 and beam1 both degrade sharply. On beam3, raising LOOKAHEAD_WINDOW from 1 to 2 reopened a much higher-recall and noisier tradeoff, and tightening min_score_gain_per_added_move from 125.0 to 137.5 reduced that noise materially while preserving most of the recall gain. Follow-up probes showed stricter gates, top1, and boardcands4 are exact no-ops on that recovered branch. Narrowing board breadth from 3 to 2 then preserved board_exact while improving recall and false-change at the cost of weaker secondary metrics, while raising LOOKAHEAD_MARGIN from 9.5 to 9.875 or 10.0 on that narrower-board branch reduced recall back to the 0.296875 shelf without improving false changes. This run keeps the recovered boardcands2 branch and raises only LOOKAHEAD_MARGIN from 9.5 to 9.75 to test whether the transition already starts below 9.875 or whether 9.75 remains on the higher-recall plateau.
autoresearch/snapshots/20260419T080138Z_hybrid_lookahead_segmental_drop1_boardcands2_ratio95_props14_top4_detect10_lwindow2_minsep4_secsep2_thresh3_total150_permove137p5_lmargin9p5_m9p8957061767578125_r0_beam3_v625.py	0.074556	0.762751	0.710473	0.343750	0.020699	discard	Hybrid decoder keeps the baseline lookahead path unless a conservative board-only segmental pass wins the current score-gain gates. The recent lower-beam sweep on the kept v545 branch established beam3 as the last usable lower-beam side branch, while beam2 and beam1 both degrade sharply. On beam3, raising LOOKAHEAD_WINDOW from 1 to 2 reopened a much higher-recall and noisier tradeoff, and tightening min_score_gain_per_added_move from 125.0 to 137.5 reduced that noise materially while preserving most of the recall gain. Narrowing board breadth from 3 to 2 then preserved board_exact while improving recall and false-change at the cost of weaker secondary metrics, and margin follow-ups localized that narrower-board branch to the same 9.5..9.75 plateau with a lower-recall shelf by 9.875. This run keeps the recovered boardcands2 + lwindow2 + permove137.5 branch and raises only secondary_min_event_separation from 1 to 2 to test whether the narrower-board branch still has an active secondary-spacing tradeoff or whether secsep1 is already the local temporal optimum there.
autoresearch/snapshots/20260419T080355Z_hybrid_lookahead_segmental_drop1_boardcands2_ratio95_props14_top4_detect10_lwindow2_minsep4_secsep1_thresh3_total150_permove137p5_lmargin9p5_m9p8957061767578125_r1_beam3_v626.py	0.074556	0.789158	0.738431	0.312500	0.011643	discard	Hybrid decoder keeps the baseline lookahead path unless a conservative board-only segmental pass wins the current score-gain gates. The recent lower-beam sweep on the kept v545 branch established beam3 as the last usable lower-beam side branch, while beam2 and beam1 both degrade sharply. On beam3, raising LOOKAHEAD_WINDOW from 1 to 2 reopened a much higher-recall and noisier tradeoff, and tightening min_score_gain_per_added_move from 125.0 to 137.5 reduced that noise materially while preserving most of the recall gain. Narrowing board breadth from 3 to 2 then preserved board_exact while improving recall and false-change at the cost of weaker secondary metrics, while follow-up margin probes localized that narrower-board branch to the same 9.5..9.75 plateau and secsep2 reopened a much noisier higher-recall tradeoff. This run keeps the recovered boardcands2 + lwindow2 + permove137.5 branch and raises only event_window_radius from 0 to 1 to test whether a small proposal neighborhood can help that narrower-board branch without reopening the broader secsep2-style noise regime.
autoresearch/snapshots/20260419T080641Z_hybrid_lookahead_segmental_drop1_boardcands2_ratio98_props14_top4_detect10_lwindow2_minsep4_secsep2_thresh3_total150_permove137p5_lmargin9p5_m9p8957061767578125_r0_beam3_v627.py	0.074556	0.762751	0.710473	0.343750	0.020699	discard	Hybrid decoder keeps the baseline lookahead path unless a conservative board-only segmental pass wins the current score-gain gates. The recent lower-beam sweep on the kept v545 branch established beam3 as the last usable lower-beam side branch, while beam2 and beam1 both degrade sharply. On beam3, raising LOOKAHEAD_WINDOW from 1 to 2 reopened a much higher-recall and noisier tradeoff, and tightening min_score_gain_per_added_move from 125.0 to 137.5 reduced that noise materially while preserving most of the recall gain. Narrowing board breadth from 3 to 2 then preserved board_exact while improving recall and false-change at the cost of weaker secondary metrics, and follow-up margin probes localized that narrower-board branch to the same 9.5..9.75 plateau with a lower-recall shelf by 9.875. Raising secondary_min_event_separation from 1 to 2 on that branch reopened a much noisier higher-recall tradeoff. This run keeps that boardcands2 + secsep2 branch and raises only secondary_peak_ratio from 0.95 to 0.98 to test whether stricter secondary-peak acceptance can trim the extra detections without giving up the recall gain.
autoresearch/snapshots/20260419T080827Z_hybrid_lookahead_segmental_drop0_boardcands2_ratio95_props14_top4_detect10_lwindow2_minsep4_secsep1_thresh3_total150_permove137p5_lmargin9p5_m9p8957061767578125_r0_beam3_v628.py	0.074556	0.814428	0.783243	0.296875	0.014230	discard	Hybrid decoder keeps the baseline lookahead path unless a conservative board-only segmental pass wins the current score-gain gates. The recent lower-beam sweep on the kept v545 branch established beam3 as the last usable lower-beam side branch, while beam2 and beam1 both degrade sharply. On beam3, raising LOOKAHEAD_WINDOW from 1 to 2 reopened a much higher-recall and noisier tradeoff, and tightening min_score_gain_per_added_move from 125.0 to 137.5 reduced that noise materially while preserving most of the recall gain. Narrowing board breadth from 3 to 2 then preserved board_exact while improving recall and false-change at the cost of weaker secondary metrics, while follow-up margin probes localized that narrower-board branch to the same 9.5..9.75 plateau and event-radius follow-up stayed a true no-op. This run keeps the recovered boardcands2 + lwindow2 + permove137.5 branch and lowers only segment_board_drop_worst_frames from 1 to 0 to test whether the narrower-board branch inherits the useful drop0 temporal tradeoff seen elsewhere or whether drop1 remains locally optimal here.
autoresearch/snapshots/20260419T080948Z_hybrid_lookahead_segmental_drop1_boardcands2_ratio95_props14_top4_detect10_lwindow2_minsep4_secsep3_thresh3_total150_permove137p5_lmargin9p5_m9p8957061767578125_r0_beam3_v629.py	0.074556	0.764095	0.714832	0.328125	0.021992	discard	Hybrid decoder keeps the baseline lookahead path unless a conservative board-only segmental pass wins the current score-gain gates. The recent lower-beam sweep on the kept v545 branch established beam3 as the last usable lower-beam side branch, while beam2 and beam1 both degrade sharply. On beam3, raising LOOKAHEAD_WINDOW from 1 to 2 reopened a much higher-recall and noisier tradeoff, and tightening min_score_gain_per_added_move from 125.0 to 137.5 reduced that noise materially while preserving most of the recall gain. Narrowing board breadth from 3 to 2 then preserved board_exact while improving recall and false-change at the cost of weaker secondary metrics, while follow-up margin probes localized that narrower-board branch to the same 9.5..9.75 plateau and drop0/event-radius follow-ups were non-improving. Raising secondary_min_event_separation from 1 to 2 on that branch reopened a much noisier higher-recall tradeoff. This run keeps the recovered boardcands2 + lwindow2 + permove137.5 branch and raises only secondary_min_event_separation from 1 to 3 to test whether the narrower-board branch inherits a secsep upper shelf or whether secsep2 was already the whole transition.
autoresearch/snapshots/20260419T081107Z_hybrid_lookahead_segmental_drop1_boardcands2_ratio95_props14_top4_detect10_lwindow2_minsep4_secsep4_thresh3_total150_permove137p5_lmargin9p5_m9p8957061767578125_r0_beam3_v630.py	0.074556	0.764095	0.714832	0.328125	0.021992	discard	Hybrid decoder keeps the baseline lookahead path unless a conservative board-only segmental pass wins the current score-gain gates. The recent lower-beam sweep on the kept v545 branch established beam3 as the last usable lower-beam side branch, while beam2 and beam1 both degrade sharply. On beam3, raising LOOKAHEAD_WINDOW from 1 to 2 reopened a much higher-recall and noisier tradeoff, and tightening min_score_gain_per_added_move from 125.0 to 137.5 reduced that noise materially while preserving most of the recall gain. Narrowing board breadth from 3 to 2 then preserved board_exact while improving recall and false-change at the cost of weaker secondary metrics, while follow-up margin probes localized that narrower-board branch to the same 9.5..9.75 plateau and drop0/event-radius follow-ups were non-improving. Raising secondary_min_event_separation from 1 to 2 on that branch reopened a much noisier higher-recall tradeoff, and secsep3 stayed noisy while giving back some of that recall. This run keeps the recovered boardcands2 + lwindow2 + permove137.5 branch and raises only secondary_min_event_separation from 3 to 4 to test whether secsep3 was already the full upper transition or whether a broader secsep upper shelf exists on the narrower-board branch.
