snapshot	board_exact	non_empty_accuracy	macro_f1	move_recall	false_change_rate	status	description
autoresearch/snapshots/20260420T042832Z_hybrid_p8_m8_w3_v1239.py	0.071006	0.799339	0.749250	0.375000	0.020699	discard	Restore the compact props8 + minsep8 hybrid shelf anchored at lwindow3, beam3, top4, boardcands2, secsep1, radius0, drop1, props8, total150, and lmargin9.935836791992188. The latest executed bracket is harmful at 142.3393809000651089036182384006679058074951171874999999999999999999999999999999999999999999999999999999999999999999996096893979361704451415867688527213084866387751188587482439341136737133360031190594500410816111067705895823385742864725369550267762271391726605009078780307432758816630022379902398288464837605715729296207427978515625 and exact-flat at 142.3393809000651089036182384006679058074951171875000000000000000000000000000000000000000000000000000000000000000000021132263621063447968292051326580163595930438464489299074243210227829327716938972967169816895131955904158574594154108426512867789792961217540124447741608209447809600290368081177728998287790318499901331961154937744140625. This run re-prepares their midpoint, 142.33938090006510890361823840066790580749511718750000000000000000000000000000000000000000000000000000000000000000000086145788002125762098539595075536883403984131078389432783412756822832305384850817808351138556215118050271989899484865759412090287776163046333647284101942584402842084601952305400636433763139621078153140842914581298828125, with a short experiment name to avoid filename-too-long failures.
autoresearch/snapshots/20260420T042937Z_hybrid_p8_m8_w3_v1240.py	0.071006	0.799339	0.749250	0.375000	0.020699	discard	Restore the compact props8 + minsep8 hybrid shelf anchored at lwindow3, beam3, top4, boardcands2, secsep1, radius0, drop1, props8, total150, and lmargin9.935836791992188. The latest executed bracket is harmful at 142.3393809000651089036182384006679058074951171874999999999999999999999999999999999999999999999999999999999999999999996096893979361704451415867688527213084866387751188587482439341136737133360031190594500410816111067705895823385742864725369550267762271391726605009078780307432758816630022379902398288464837605715729296207427978515625 and exact-flat at 142.33938090006510890361823840066790580749511718750000000000000000000000000000000000000000000000000000000000000000000086145788002125762098539595075536883403984131078389432783412756822832305384850817808351138556215118050271989899484865759412090287776163046333647284101942584402842084601952305400636433763139621078153140842914581298828125. This run re-prepares their midpoint, 142.339380900065108903618238400667905807495117187500000000000000000000000000000000000000000000000000000000000000000000235573638978714033063491359804045071263240042951376538039030840951018194925813618766776233586628975546151118784567565065537964826994384817998486874448728293652151254510880522123096592057578391177230514585971832275390625, with a short experiment name to avoid filename-too-long failures.
autoresearch/snapshots/20260420T043044Z_hybrid_p8_m8_w3_v1241.py	0.071006	0.789778	0.739821	0.375000	0.024580	discard	Restore the compact props8 + minsep8 hybrid shelf anchored at lwindow3, beam3, top4, boardcands2, secsep1, radius0, drop1, props8, total150, and lmargin9.935836791992188. The latest executed bracket is harmful at 142.3393809000651089036182384006679058074951171874999999999999999999999999999999999999999999999999999999999999999999996096893979361704451415867688527213084866387751188587482439341136737133360031190594500410816111067705895823385742864725369550267762271391726605009078780307432758816630022379902398288464837605715729296207427978515625 and exact-flat at 142.339380900065108903618238400667905807495117187500000000000000000000000000000000000000000000000000000000000000000000235573638978714033063491359804045071263240042951376538039030840951018194925813618766776233586628975546151118784567565065537964826994384817998486874448728293652151254510880522123096592057578391177230514585971832275390625. This run re-prepares their midpoint, 142.3393809000651089036182384006679058074951171874999999999999999999999999999999999999999999999999999999999999999999999226315184574422391025390643283831898749394090351176431414824773123657654644663391084086575988678730678667286794270188012464958016107619953294938911633795184640164587565592561814627192706694813750800676643848419189453125, with a short experiment name to avoid filename-too-long failures.
autoresearch/snapshots/20260420T043147Z_hybrid_p8_m8_w3_v1242.py	0.071006	0.799339	0.749250	0.375000	0.020699	discard	Restore the compact props8 + minsep8 hybrid shelf anchored at lwindow3, beam3, top4, boardcands2, secsep1, radius0, drop1, props8, total150, and lmargin9.935836791992188. The latest executed bracket is harmful at 142.3393809000651089036182384006679058074951171874999999999999999999999999999999999999999999999999999999999999999999999226315184574422391025390643283831898749394090351176431414824773123657654644663391084086575988678730678667286794270188012464958016107619953294938911633795184640164587565592561814627192706694813750800676643848419189453125 and exact-flat at 142.339380900065108903618238400667905807495117187500000000000000000000000000000000000000000000000000000000000000000000235573638978714033063491359804045071263240042951376538039030840951018194925813618766776233586628975546151118784567565065537964826994384817998486874448728293652151254510880522123096592057578391177230514585971832275390625. This run re-prepares their midpoint, 142.33938090006510890361823840066790580749511718750000000000000000000000000000000000000000000000000000000000000000000007910257871807813608301521206621413056908972599324709059025665913169198019513997893759244559274842430700892373199729193339223031430257340666399038280605390605808385663371988915227965566412393627615529112517833709716796875, with a short experiment name to avoid filename-too-long failures.
autoresearch/snapshots/20260420T043250Z_hybrid_p8_m8_w3_v1243.py	0.071006	0.799339	0.749250	0.375000	0.020699	discard	Restore the compact props8 + minsep8 hybrid shelf anchored at lwindow3, beam3, top4, boardcands2, secsep1, radius0, drop1, props8, total150, and lmargin9.935836791992188. The latest executed bracket is harmful at 142.3393809000651089036182384006679058074951171874999999999999999999999999999999999999999999999999999999999999999999999226315184574422391025390643283831898749394090351176431414824773123657654644663391084086575988678730678667286794270188012464958016107619953294938911633795184640164587565592561814627192706694813750800676643848419189453125 and exact-flat at 142.33938090006510890361823840066790580749511718750000000000000000000000000000000000000000000000000000000000000000000007910257871807813608301521206621413056908972599324709059025665913169198019513997893759244559274842430700892373199729193339223031430257340666399038280605390605808385663371988915227965566412393627615529112517833709716796875. This run re-prepares their midpoint, 142.339380900065108903618238400667905807495117187500000000000000000000000000000000000000000000000000000000000000000000000867048587760187592777138197298660222014567514182366865869568222028872829803159023000551595808148687437826205712155367319363057956667700996742136984716712261050157695139572666871187467396708825617679394781589508056640625, with a short experiment name to avoid filename-too-long failures.
autoresearch/snapshots/20260420T043354Z_hybrid_p8_m8_w3_v1244.py	0.071006	0.789778	0.739821	0.375000	0.024580	discard	Restore the compact props8 + minsep8 hybrid shelf anchored at lwindow3, beam3, top4, boardcands2, secsep1, radius0, drop1, props8, total150, and lmargin9.935836791992188. The latest executed bracket is harmful at 142.3393809000651089036182384006679058074951171874999999999999999999999999999999999999999999999999999999999999999999999226315184574422391025390643283831898749394090351176431414824773123657654644663391084086575988678730678667286794270188012464958016107619953294938911633795184640164587565592561814627192706694813750800676643848419189453125 and exact-flat at 142.339380900065108903618238400667905807495117187500000000000000000000000000000000000000000000000000000000000000000000000867048587760187592777138197298660222014567514182366865869568222028872829803159023000551595808148687437826205712155367319363057956667700996742136984716712261050157695139572666871187467396708825617679394781589508056640625. This run re-prepares their midpoint, 142.3393809000651089036182384006679058074951171874999999999999999999999999999999999999999999999999999999999999999999999617492835226012133476581012628409250484769882746500050036760227671973191471347490657046045973380108776522774425695870842829294297837148481631180140740481153625333082258494144241669533690330951003488735295832157135009765625, with a short experiment name to avoid filename-too-long failures.
autoresearch/snapshots/20260420T043459Z_hybrid_p8_m8_w3_v1245.py	0.071006	0.789778	0.739821	0.375000	0.024580	discard	Restore the compact props8 + minsep8 hybrid shelf anchored at lwindow3, beam3, top4, boardcands2, secsep1, radius0, drop1, props8, total150, and lmargin9.935836791992188. The latest executed bracket is harmful at 142.3393809000651089036182384006679058074951171874999999999999999999999999999999999999999999999999999999999999999999999617492835226012133476581012628409250484769882746500050036760227671973191471347490657046045973380108776522774425695870842829294297837148481631180140740481153625333082258494144241669533690330951003488735295832157135009765625 and exact-flat at 142.339380900065108903618238400667905807495117187500000000000000000000000000000000000000000000000000000000000000000000000867048587760187592777138197298660222014567514182366865869568222028872829803159023000551595808148687437826205712155367319363057956667700996742136984716712261050157695139572666871187467396708825617679394781589508056640625. This run re-prepares their midpoint, 142.33938090006510890361823840066790580749511718749999999999999999999999999999999999999999999999999999999999999999999998130816605518070047021761973006979263524577789441618593477279549461309598846895404435257809657307978254505182414087122580114624387019127457993007552938241381179173296049449354551907041821490196298327646218240261077880859375, with a short experiment name to avoid filename-too-long failures.
autoresearch/snapshots/20260420T043611Z_hybrid_p8_m8_w3_v1246.py	0.071006	0.789778	0.739821	0.375000	0.024580	discard	Restore the compact props8 + minsep8 hybrid shelf anchored at lwindow3, beam3, top4, boardcands2, secsep1, radius0, drop1, props8, total150, and lmargin9.935836791992188. The latest executed bracket is harmful at 142.33938090006510890361823840066790580749511718749999999999999999999999999999999999999999999999999999999999999999999998130816605518070047021761973006979263524577789441618593477279549461309598846895404435257809657307978254505182414087122580114624387019127457993007552938241381179173296049449354551907041821490196298327646218240261077880859375 and exact-flat at 142.339380900065108903618238400667905807495117187500000000000000000000000000000000000000000000000000000000000000000000000867048587760187592777138197298660222014567514182366865869568222028872829803159023000551595808148687437826205712155367319363057956667700996742136984716712261050157695139572666871187467396708825617679394781589508056640625. This run re-prepares their midpoint, 142.339380900065108903618238400667905807495117187499999999999999999999999999999999999999999999999999999999999999999999991087607321470444031497378963684226428630172704299276400321181858320984409136056533676564846190614234991439014926513296560254650913429487788336106257049563036420945327817033106195128942805805394300477928481996059417724609375, with a short experiment name to avoid filename-too-long failures.
autoresearch/snapshots/20260420T043713Z_hybrid_p8_m8_w3_v1247.py	0.071006	0.789778	0.739821	0.375000	0.024580	discard	Restore the compact props8 + minsep8 hybrid shelf anchored at lwindow3, beam3, top4, boardcands2, secsep1, radius0, drop1, props8, total150, and lmargin9.935836791992188. The latest executed bracket is harmful at 142.339380900065108903618238400667905807495117187499999999999999999999999999999999999999999999999999999999999999999999991087607321470444031497378963684226428630172704299276400321181858320984409136056533676564846190614234991439014926513296560254650913429487788336106257049563036420945327817033106195128942805805394300477928481996059417724609375 and exact-flat at 142.339380900065108903618238400667905807495117187500000000000000000000000000000000000000000000000000000000000000000000000867048587760187592777138197298660222014567514182366865869568222028872829803159023000551595808148687437826205712155367319363057956667700996742136984716712261050157695139572666871187467396708825617679394781589508056640625. This run re-prepares their midpoint, 142.3393809000651089036182384006679058074951171874999999999999999999999999999999999999999999999999999999999999999999999959773279546153158121372585804914433253223701092408216330953750401749286194696077783385582209993814612146326103193343319398088544350485943925391216208831376487355515114783028865331582051012571099590786616317927837371826171875, with a short experiment name to avoid filename-too-long failures.
autoresearch/snapshots/20260420T043820Z_hybrid_p8_m8_w3_v1248.py	0.071006	0.789778	0.739821	0.375000	0.024580	discard	Restore the compact props8 + minsep8 hybrid shelf anchored at lwindow3, beam3, top4, boardcands2, secsep1, radius0, drop1, props8, total150, and lmargin9.935836791992188. The latest executed bracket is harmful at 142.3393809000651089036182384006679058074951171874999999999999999999999999999999999999999999999999999999999999999999999959773279546153158121372585804914433253223701092408216330953750401749286194696077783385582209993814612146326103193343319398088544350485943925391216208831376487355515114783028865331582051012571099590786616317927837376171875 and exact-flat at 142.339380900065108903618238400667905807495117187500000000000000000000000000000000000000000000000000000000000000000000000867048587760187592777138197298660222014567514182366865869568222028872829803159023000551595808148687437826205712155367319363057956667700996742136984716712261050157695139572666871187467396708825617679394781589508056640625. This run re-prepares their midpoint, 142.33938090006510890361823840066790580749511718749999999999999999999999999999999999999999999999999999999999999999999999842218827118775170245719838889505177366846881171159424948247163110190072463638340066955490840376507432622940801574484962958595619585814769464062930279992495489285460330893777670217283624898296778837902820669114589691162109375, with a short experiment name to avoid filename-too-long failures.
autoresearch/snapshots/20260420T043931Z_hybrid_p8_m8_w3_v1249.py	0.071006	0.789778	0.739821	0.375000	0.024580	discard	Restore the compact props8 + minsep8 hybrid shelf anchored at lwindow3, beam3, top4, boardcands2, secsep1, radius0, drop1, props8, total150, and lmargin9.935836791992188. The latest executed bracket is harmful at 142.33938090006510890361823840066790580749511718749999999999999999999999999999999999999999999999999999999999999999999999842218827118775170245719838889505177366846881171159424948247163110190072463638340066955490840376507432622940801574484962958595619585814769464062930279992495489285460330893777670217283624898296778837902820669114589691162109375 and exact-flat at 142.339380900065108903618238400667905807495117187500000000000000000000000000000000000000000000000000000000000000000000000867048587760187592777138197298660222014567514182366865869568222028872829803159023000551595808148687437826205712155367319363057956667700996742136984716712261050157695139572666871187467396708825617679394781589508056640625. This run re-prepares their midpoint, 142.339380900065108903618238400667905807495117187499999999999999999999999999999999999999999999999999999999999999999999999644618429473969647617168293096855997841518162946980557676019926565386777219771211835053252105956880882027806863950108474474507076262924345691383143758318607971506149224255221786680151822845896703029211494140326976776123046875, with a short experiment name to avoid filename-too-long failures.
autoresearch/snapshots/20260420T044057Z_hybrid_p8_m8_w3_v1250.py	0.071006	0.789778	0.739821	0.375000	0.024580	discard	Restore the compact props8 + minsep8 hybrid shelf anchored at lwindow3, beam3, top4, boardcands2, secsep1, radius0, drop1, props8, total150, and lmargin9.935836791992188. The latest executed bracket is harmful at 142.33938090006510890361823840066790580749511718749999999999999999999999999999999999999999999999999999999999999999999999842218827118775170245719838889505177366846881171159424948247163110190072463638340066955490840376507432622940801574484962958595619585814769464062930279992495489285460330893777670217283624898296778837902820669114589691162109375 and exact-flat at 142.339380900065108903618238400667905807495117187500000000000000000000000000000000000000000000000000000000000000000000000867048587760187592777138197298660222014567514182366865869568222028872829803159023000551595808148687437826205712155367319363057956667700996742136984716712261050157695139572666871187467396708825617679394781589508056640625. This run re-prepares their midpoint, 142.339380900065108903618238400667905807495117187499999999999999999999999999999999999999999999999999999999999999999999999644618429473969647617168293096855997841518162946980557676019926565386777219771211835053252105956880882027806863950108474474507076262924345691383143758318607971506149224255221786680151822845896703029211494140326976776123046875, with a short experiment name to avoid filename-too-long failures.
autoresearch/snapshots/20260420T044220Z_hybrid_p8_m8_w3_v1251.py	0.071006	0.799339	0.749250	0.375000	0.020699	discard	Restore the compact props8 + minsep8 hybrid shelf anchored at lwindow3, beam3, top4, boardcands2, secsep1, radius0, drop1, props8, total150, and lmargin9.935836791992188. The latest executed bracket is harmful at 142.339380900065108903618238400667905807495117187499999999999999999999999999999999999999999999999999999999999999999999999644618429473969647617168293096855997841518162946980557676019926565386777219771211835053252105956880882027806863950108474474507076262924345691383143758318607971506149224255221786680151822845896703029211494140326976776123046875 and exact-flat at 142.339380900065108903618238400667905807495117187500000000000000000000000000000000000000000000000000000000000000000000000867048587760187592777138197298660222014567514182366865869568222028872829803159023000551595808148687437826205712155367319363057956667700996742136984716712261050157695139572666871187467396708825617679394781589508056640625. This run re-prepares their midpoint, 142.3393809000651089036182384006679058074951171875000000000000000000000000000000000000000000000000000000000000000000000002558335086170786201971532451977581099280428385646737117727940742971298035114651174178024239570527841599270062880527378969187825164653126712167600642375154345108319221819139443289338096097773611603543031378649175167083740234375, with a short experiment name to avoid filename-too-long failures.
autoresearch/snapshots/20260420T044328Z_hybrid_p8_m8_w3_v1252.py	0.071006	0.789778	0.739821	0.375000	0.024580	discard	Restore the compact props8 + minsep8 hybrid shelf anchored at lwindow3, beam3, top4, boardcands2, secsep1, radius0, drop1, props8, total150, and lmargin9.935836791992188. The latest executed bracket is harmful at 142.339380900065108903618238400667905807495117187499999999999999999999999999999999999999999999999999999999999999999999999644618429473969647617168293096855997841518162946980557676019926565386777219771211835053252105956880882027806863950108474474507076262924345691383143758318607971506149224255221786680151822845896703029211494140326976776123046875 and exact-flat at 142.3393809000651089036182384006679058074951171875000000000000000000000000000000000000000000000000000000000000000000000002558335086170786201971532451977581099280428385646737117727940742971298035114651174178024239570527841599270062880527378969187825164653126712167600642375154345108319221819139443289338096097773611603543031378649175167083740234375. This run re-prepares their midpoint, 142.33938090006510890361823840066790580749511718749999999999999999999999999999999999999999999999999999999999999999999999995022596904552413390716076914730705388478050075582713472440700043125829036561816462642783803150483252097740657600142318569664479636411850845407160399791702124116903570308458305780698071631162893169175731600262224674224853515625, with a short experiment name to avoid filename-too-long failures.
