snapshot	board_exact	non_empty_accuracy	macro_f1	move_recall	false_change_rate	status	description
autoresearch/snapshots/20260417T022859Z_hybrid_lookahead_segmental_drop1_boardcands3_ratio95_props16_top10_detect10_minsep2_thresh3_total150_permove50_m9p8957061767578125_r0_v148.py	0.134911	0.858147	0.832719	0.515625	0.025873	discard	Hybrid decoder keeps the baseline lookahead path unless a conservative board-only segmental pass wins the current score-gain gates, while following up v120-v147 by returning to the strongest low-false-change props16 + boardcands3 branch after zeroing only the total-gain gate was a no-op and zeroing only the per-added-move gate was catastrophic, and lowering only the per-added-move score-gain gate from 125 to 50 to localize the real selection boundary between the known-safe and clearly harmful regimes in this branch.
autoresearch/snapshots/20260417T022954Z_hybrid_lookahead_segmental_drop1_boardcands3_ratio95_props16_top10_detect10_minsep2_thresh3_total150_permove75_m9p8957061767578125_r0_v149.py	0.168047	0.865898	0.835716	0.484375	0.023286	discard	Hybrid decoder keeps the baseline lookahead path unless a conservative board-only segmental pass wins the current score-gain gates, while following up v120-v148 by returning to the strongest low-false-change props16 + boardcands3 branch after zeroing only the total-gain gate was a no-op and lowering the per-added-move gate to 50 was already catastrophic, and setting only the per-added-move score-gain gate to 75 to localize the real selection boundary between the known-safe 100+ regime and the clearly harmful low-threshold regime in this branch.
autoresearch/snapshots/20260417T023044Z_hybrid_lookahead_segmental_drop1_boardcands3_ratio95_props16_top10_detect10_minsep2_thresh3_total150_permove87p5_m9p8957061767578125_r0_v150.py	0.168047	0.865898	0.835716	0.484375	0.023286	discard	Hybrid decoder keeps the baseline lookahead path unless a conservative board-only segmental pass wins the current score-gain gates, while following up v120-v149 by returning to the strongest low-false-change props16 + boardcands3 branch after localizing the per-added-move gate boundary between the safe 100 regime and the harmful 75 regime, and lowering only the per-added-move score-gain gate to 87.5 to bisect that remaining selection threshold and see whether any headroom exists below 100 without falling back into the bad always-segmental regime.
autoresearch/snapshots/20260417T023134Z_hybrid_lookahead_segmental_drop1_boardcands3_ratio95_props16_top10_detect10_minsep2_thresh3_total150_permove93p75_m9p8957061767578125_r0_v151.py	0.254438	0.884089	0.855756	0.500000	0.016818	discard	Hybrid decoder keeps the baseline lookahead path unless a conservative board-only segmental pass wins the current score-gain gates, while following up v120-v150 by returning to the strongest low-false-change props16 + boardcands3 branch after localizing the per-added-move gate cliff between the safe 100 regime and the harmful 87.5 regime, and lowering only the per-added-move score-gain gate to 93.75 to bisect that remaining boundary and see whether any headroom exists below 100 without re-entering the degraded selection regime.
autoresearch/snapshots/20260417T023225Z_hybrid_lookahead_segmental_drop1_boardcands3_ratio95_props16_top10_detect10_minsep2_thresh3_total150_permove90p625_m9p8957061767578125_r0_v152.py	0.168047	0.865898	0.835716	0.484375	0.023286	discard	Hybrid decoder keeps the baseline lookahead path unless a conservative board-only segmental pass wins the current score-gain gates, while following up v120-v151 by returning to the strongest low-false-change props16 + boardcands3 branch after localizing the per-added-move gate cliff between the safe 93.75 regime and the harmful 87.5 regime, and lowering only the per-added-move score-gain gate to 90.625 to bisect that remaining boundary and determine whether any headroom exists below 93.75 without re-entering the degraded selection regime.
autoresearch/snapshots/20260417T023319Z_hybrid_lookahead_segmental_drop1_boardcands3_ratio95_props16_top10_detect10_minsep2_thresh3_total150_permove92p1875_m9p8957061767578125_r0_v153.py	0.254438	0.884089	0.855756	0.500000	0.016818	discard	Hybrid decoder keeps the baseline lookahead path unless a conservative board-only segmental pass wins the current score-gain gates, while following up v120-v152 by returning to the strongest low-false-change props16 + boardcands3 branch after localizing the per-added-move gate cliff between the safe 93.75 regime and the harmful 90.625 regime, and lowering only the per-added-move score-gain gate to 92.1875 to bisect that remaining boundary and determine whether any headroom exists below 93.75 without re-entering the degraded selection regime.
autoresearch/snapshots/20260417T023410Z_hybrid_lookahead_segmental_drop1_boardcands3_ratio95_props16_top10_detect10_minsep2_thresh3_total150_permove91p40625_m9p8957061767578125_r0_v154.py	0.168047	0.865898	0.835716	0.484375	0.023286	discard	Hybrid decoder keeps the baseline lookahead path unless a conservative board-only segmental pass wins the current score-gain gates, while following up v120-v153 by returning to the strongest low-false-change props16 + boardcands3 branch after localizing the per-added-move gate cliff between the safe 92.1875 regime and the harmful 90.625 regime, and lowering only the per-added-move score-gain gate to 91.40625 to bisect that remaining boundary and determine whether any headroom exists below 92.1875 without re-entering the degraded selection regime.
autoresearch/snapshots/20260417T023501Z_hybrid_lookahead_segmental_drop1_boardcands3_ratio95_props16_top10_detect10_minsep2_thresh3_total150_permove91p796875_m9p8957061767578125_r0_v155.py	0.254438	0.884089	0.855756	0.500000	0.016818	discard	Hybrid decoder keeps the baseline lookahead path unless a conservative board-only segmental pass wins the current score-gain gates, while following up v120-v154 by returning to the strongest low-false-change props16 + boardcands3 branch after localizing the per-added-move gate cliff between the safe 92.1875 regime and the harmful 91.40625 regime, and lowering only the per-added-move score-gain gate to 91.796875 to bisect that remaining boundary and determine whether any headroom exists below 92.1875 without re-entering the degraded selection regime.
autoresearch/snapshots/20260417T023554Z_hybrid_lookahead_segmental_drop1_boardcands3_ratio95_props16_top10_detect10_minsep2_thresh3_total150_permove91p6015625_m9p8957061767578125_r0_v156.py	0.168047	0.865898	0.835716	0.484375	0.023286	discard	Hybrid decoder keeps the baseline lookahead path unless a conservative board-only segmental pass wins the current score-gain gates, while following up v120-v155 by returning to the strongest low-false-change props16 + boardcands3 branch after localizing the per-added-move gate cliff between the safe 91.796875 regime and the harmful 91.40625 regime, and lowering only the per-added-move score-gain gate to 91.6015625 to bisect that remaining boundary and determine whether any headroom exists below 91.796875 without re-entering the degraded selection regime.
autoresearch/snapshots/20260417T023645Z_hybrid_lookahead_segmental_drop1_boardcands3_ratio95_props16_top10_detect10_minsep2_thresh3_total150_permove91p50390625_m9p8957061767578125_r0_v157.py	0.168047	0.865898	0.835716	0.484375	0.023286	discard	Hybrid decoder keeps the baseline lookahead path unless a conservative board-only segmental pass wins the current score-gain gates, while following up v120-v156 by returning to the strongest low-false-change props16 + boardcands3 branch after localizing the per-added-move gate cliff between the safe 91.6015625 regime and the harmful 91.40625 regime, and lowering only the per-added-move score-gain gate to 91.50390625 to bisect that remaining boundary and determine whether any headroom exists below 91.6015625 without re-entering the degraded selection regime.
autoresearch/snapshots/20260417T023739Z_hybrid_lookahead_segmental_drop1_boardcands3_ratio95_props16_top10_detect10_minsep2_thresh3_total150_permove91p650390625_m9p8957061767578125_r0_v158.py	0.168047	0.865898	0.835716	0.484375	0.023286	discard	Hybrid decoder keeps the baseline lookahead path unless a conservative board-only segmental pass wins the current score-gain gates, while following up v120-v157 by returning to the strongest low-false-change props16 + boardcands3 branch after localizing the per-added-move gate cliff between the safe 91.796875 regime and the harmful 91.50390625 regime, and lowering only the per-added-move score-gain gate to 91.650390625 to bisect that remaining boundary and determine whether any headroom exists below 91.796875 without re-entering the degraded selection regime.
autoresearch/snapshots/20260417T023832Z_hybrid_lookahead_segmental_drop1_boardcands3_ratio95_props16_top10_detect10_minsep2_thresh3_total150_permove91p7236328125_m9p8957061767578125_r0_v159.py	0.168047	0.865898	0.835716	0.484375	0.023286	discard	Hybrid decoder keeps the baseline lookahead path unless a conservative board-only segmental pass wins the current score-gain gates, while following up v120-v158 by returning to the strongest low-false-change props16 + boardcands3 branch after localizing the per-added-move gate cliff between the safe 91.796875 regime and the harmful 91.650390625 regime, and lowering only the per-added-move score-gain gate to 91.7236328125 to bisect that remaining boundary and determine whether any headroom exists below 91.796875 without re-entering the degraded selection regime.
autoresearch/snapshots/20260417T024335Z_hybrid_lookahead_segmental_drop1_boardcands3_ratio95_props16_top10_detect10_minsep2_thresh3_total150_permove91p76025390625_m9p8957061767578125_r0_v160.py	0.254438	0.884089	0.855756	0.500000	0.016818	discard	Hybrid decoder keeps the baseline lookahead path unless a conservative board-only segmental pass wins the current score-gain gates, while following up v120-v159 by returning to the strongest low-false-change props16 + boardcands3 branch after localizing the per-added-move gate cliff between the safe 91.796875 regime and the harmful 91.7236328125 regime, and lowering only the per-added-move score-gain gate to 91.76025390625 to bisect that remaining boundary and determine whether any headroom exists below 91.796875 without re-entering the degraded selection regime.
autoresearch/snapshots/20260417T024423Z_hybrid_lookahead_segmental_drop1_boardcands3_ratio95_props16_top10_detect10_minsep2_thresh3_total150_permove91p741943359375_m9p8957061767578125_r0_v161.py	0.254438	0.884089	0.855756	0.500000	0.016818	discard	Hybrid decoder keeps the baseline lookahead path unless a conservative board-only segmental pass wins the current score-gain gates, while following up v120-v160 by returning to the strongest low-false-change props16 + boardcands3 branch after localizing the per-added-move gate cliff between the safe 91.76025390625 regime and the harmful 91.7236328125 regime, and lowering only the per-added-move score-gain gate to 91.741943359375 to bisect that remaining boundary and determine whether any headroom exists below 91.76025390625 without re-entering the degraded selection regime.
autoresearch/snapshots/20260417T024511Z_hybrid_lookahead_segmental_drop1_boardcands3_ratio95_props16_top10_detect10_minsep2_thresh3_total150_permove91p7327880859375_m9p8957061767578125_r0_v162.py	0.168047	0.865898	0.835716	0.484375	0.023286	discard	Hybrid decoder keeps the baseline lookahead path unless a conservative board-only segmental pass wins the current score-gain gates, while following up v120-v161 by returning to the strongest low-false-change props16 + boardcands3 branch after localizing the per-added-move gate cliff between the safe 91.741943359375 regime and the harmful 91.7236328125 regime, and lowering only the per-added-move score-gain gate to 91.7327880859375 to bisect that remaining boundary and determine whether any headroom exists below 91.741943359375 without re-entering the degraded selection regime.
autoresearch/snapshots/20260417T024600Z_hybrid_lookahead_segmental_drop1_boardcands3_ratio95_props16_top10_detect10_minsep2_thresh3_total150_permove91p73736572265625_m9p8957061767578125_r0_v163.py	0.254438	0.884089	0.855756	0.500000	0.016818	discard	Hybrid decoder keeps the baseline lookahead path unless a conservative board-only segmental pass wins the current score-gain gates, while following up v120-v162 by returning to the strongest low-false-change props16 + boardcands3 branch after localizing the per-added-move gate cliff between the safe 91.741943359375 regime and the harmful 91.7327880859375 regime, and lowering only the per-added-move score-gain gate to 91.73736572265625 to bisect that remaining boundary and determine whether any headroom exists below 91.741943359375 without re-entering the degraded selection regime.
autoresearch/snapshots/20260417T024650Z_hybrid_lookahead_segmental_drop1_boardcands3_ratio95_props16_top10_detect10_minsep2_thresh3_total150_permove91p735076904296875_m9p8957061767578125_r0_v164.py	0.254438	0.884089	0.855756	0.500000	0.016818	discard	Hybrid decoder keeps the baseline lookahead path unless a conservative board-only segmental pass wins the current score-gain gates, while following up v120-v163 by returning to the strongest low-false-change props16 + boardcands3 branch after localizing the per-added-move gate cliff between the safe 91.73736572265625 regime and the harmful 91.7327880859375 regime, and lowering only the per-added-move score-gain gate to 91.735076904296875 to bisect that remaining boundary and determine whether any headroom exists below 91.73736572265625 without re-entering the degraded selection regime.
autoresearch/snapshots/20260417T024740Z_hybrid_lookahead_segmental_drop1_boardcands3_ratio95_props16_top10_detect10_minsep2_thresh3_total150_permove91p7339324951171875_m9p8957061767578125_r0_v165.py	0.168047	0.865898	0.835716	0.484375	0.023286	discard	Hybrid decoder keeps the baseline lookahead path unless a conservative board-only segmental pass wins the current score-gain gates, while following up v120-v164 by returning to the strongest low-false-change props16 + boardcands3 branch after localizing the per-added-move gate cliff between the safe 91.735076904296875 regime and the harmful 91.7327880859375 regime, and lowering only the per-added-move score-gain gate to 91.7339324951171875 to bisect that remaining boundary and determine whether any headroom exists below 91.735076904296875 without re-entering the degraded selection regime.
autoresearch/snapshots/20260417T024828Z_hybrid_lookahead_segmental_drop1_boardcands3_ratio95_props16_top10_detect10_minsep2_thresh3_total150_permove91p73450469970703125_m9p8957061767578125_r0_v166.py	0.254438	0.884089	0.855756	0.500000	0.016818	discard	Hybrid decoder keeps the baseline lookahead path unless a conservative board-only segmental pass wins the current score-gain gates, while following up v120-v165 by returning to the strongest low-false-change props16 + boardcands3 branch after localizing the per-added-move gate cliff between the safe 91.735076904296875 regime and the harmful 91.7339324951171875 regime, and lowering only the per-added-move score-gain gate to 91.73450469970703125 to bisect that remaining boundary and determine whether any headroom exists below 91.735076904296875 without re-entering the degraded selection regime.
autoresearch/snapshots/20260417T024916Z_hybrid_lookahead_segmental_drop1_boardcands3_ratio95_props16_top10_detect10_minsep2_thresh3_total150_permove91p734218597412109375_m9p8957061767578125_r0_v167.py	0.168047	0.865898	0.835716	0.484375	0.023286	discard	Hybrid decoder keeps the baseline lookahead path unless a conservative board-only segmental pass wins the current score-gain gates, while following up v120-v166 by returning to the strongest low-false-change props16 + boardcands3 branch after localizing the per-added-move gate cliff between the safe 91.73450469970703125 regime and the harmful 91.7339324951171875 regime, and lowering only the per-added-move score-gain gate to 91.734218597412109375 to bisect that remaining boundary and determine whether any headroom exists below 91.73450469970703125 without re-entering the degraded selection regime.
autoresearch/snapshots/20260417T025037Z_hybrid_lookahead_segmental_drop1_boardcands3_ratio95_props16_top10_detect10_minsep2_thresh3_total150_permove91p7343616485595703125_m9p8957061767578125_r0_v168.py	0.254438	0.884089	0.855756	0.500000	0.016818	discard	Hybrid decoder keeps the baseline lookahead path unless a conservative board-only segmental pass wins the current score-gain gates, while following up v120-v167 by returning to the strongest low-false-change props16 + boardcands3 branch after localizing the per-added-move gate cliff between the safe 91.73450469970703125 regime and the harmful 91.734218597412109375 regime, and lowering only the per-added-move score-gain gate to 91.7343616485595703125 to bisect that remaining boundary and determine whether any headroom exists below 91.73450469970703125 without re-entering the degraded selection regime.
autoresearch/snapshots/20260417T025127Z_hybrid_lookahead_segmental_drop1_boardcands3_ratio95_props16_top10_detect10_minsep2_thresh3_total150_permove91p73429012298583984375_m9p8957061767578125_r0_v169.py	0.254438	0.884089	0.855756	0.500000	0.016818	discard	Hybrid decoder keeps the baseline lookahead path unless a conservative board-only segmental pass wins the current score-gain gates, while following up v120-v168 by returning to the strongest low-false-change props16 + boardcands3 branch after localizing the per-added-move gate cliff between the safe 91.7343616485595703125 regime and the harmful 91.734218597412109375 regime, and lowering only the per-added-move score-gain gate to 91.73429012298583984375 to bisect that remaining boundary and determine whether any headroom exists below 91.7343616485595703125 without re-entering the degraded selection regime.
autoresearch/snapshots/20260417T025222Z_hybrid_lookahead_segmental_drop1_boardcands3_ratio95_props16_top10_detect10_minsep2_thresh3_total150_permove91p734254360198974609375_m9p8957061767578125_r0_v170.py	0.168047	0.865898	0.835716	0.484375	0.023286	discard	Hybrid decoder keeps the baseline lookahead path unless a conservative board-only segmental pass wins the current score-gain gates, while following up v120-v169 by returning to the strongest low-false-change props16 + boardcands3 branch after localizing the per-added-move gate cliff between the safe 91.73429012298583984375 regime and the harmful 91.734218597412109375 regime, and lowering only the per-added-move score-gain gate to 91.734254360198974609375 to bisect that remaining boundary and determine whether any headroom exists below 91.73429012298583984375 without re-entering the degraded selection regime.
autoresearch/snapshots/20260417T025317Z_hybrid_lookahead_segmental_drop1_boardcands3_ratio95_props16_top10_detect10_minsep2_thresh3_total150_permove91p7342722415924072265625_m9p8957061767578125_r0_v171.py	0.254438	0.884089	0.855756	0.500000	0.016818	discard	Hybrid decoder keeps the baseline lookahead path unless a conservative board-only segmental pass wins the current score-gain gates, while following up v120-v170 by returning to the strongest low-false-change props16 + boardcands3 branch after localizing the per-added-move gate cliff between the safe 91.73429012298583984375 regime and the harmful 91.734254360198974609375 regime, and lowering only the per-added-move score-gain gate to 91.7342722415924072265625 to bisect that remaining boundary and determine whether any headroom exists below 91.73429012298583984375 without re-entering the degraded selection regime.
autoresearch/snapshots/20260417T025411Z_hybrid_lookahead_segmental_drop1_boardcands3_ratio95_props16_top10_detect10_minsep2_thresh3_total150_permove91p73426330089569091796875_m9p8957061767578125_r0_v172.py	0.168047	0.865898	0.835716	0.484375	0.023286	discard	Hybrid decoder keeps the baseline lookahead path unless a conservative board-only segmental pass wins the current score-gain gates, while following up v120-v171 by returning to the strongest low-false-change props16 + boardcands3 branch after localizing the per-added-move gate cliff between the safe 91.7342722415924072265625 regime and the harmful 91.734254360198974609375 regime, and lowering only the per-added-move score-gain gate to 91.73426330089569091796875 to bisect that remaining boundary and determine whether any headroom exists below 91.7342722415924072265625 without re-entering the degraded selection regime.
autoresearch/snapshots/20260417T025502Z_hybrid_lookahead_segmental_drop1_boardcands3_ratio95_props16_top10_detect10_minsep2_thresh3_total150_permove91p734267771244049072265625_m9p8957061767578125_r0_v173.py	0.168047	0.865898	0.835716	0.484375	0.023286	discard	Hybrid decoder keeps the baseline lookahead path unless a conservative board-only segmental pass wins the current score-gain gates, while following up v120-v172 by returning to the strongest low-false-change props16 + boardcands3 branch after localizing the per-added-move gate cliff between the safe 91.7342722415924072265625 regime and the harmful 91.73426330089569091796875 regime, and lowering only the per-added-move score-gain gate to 91.734267771244049072265625 to bisect that remaining boundary and determine whether any headroom exists below 91.7342722415924072265625 without re-entering the degraded selection regime.
