snapshot	board_exact	non_empty_accuracy	macro_f1	move_recall	false_change_rate	status	description
autoresearch/snapshots/20260420T003739Z_hybrid_p8_m8_w3_g142p3393809000651089036182384006679058074951171875000000000000000000000000050782529491751717276670192875878155697488740721995925261276812351047574178755476814739466817627544514834880828857421875_v1093.py	0.071006	0.799339	0.749250	0.375000	0.020699	discard	Restore the compact props8 + minsep8 hybrid shelf anchored at lwindow3, beam3, top4, boardcands2, secsep1, radius0, drop1, props8, total150, and lmargin9.935836791992188. The latest executed bracket is harmful at 142.3393809000651089036182384006679058074951171874999999999999999999999999999978617882319262434830875708262788144969478424959159610416304500062716810872102957130636013971525244414806365966796875 and exact-flat at 142.339380900065108903618238400667905807495117187500000000000000000000000000012294717666424099972246467748896816642549905648483224010624912463937833748540799649884291966372984461486339569091796875, so this run restores the same shelf anchor and raises only min_score_gain_per_added_move to 142.3393809000651089036182384006679058074951171875000000000000000000000000000050782529491751717276670192875878155697488740721995925261276812351047574178755476814739466817627544514834880828857421875 to continue binary-searching that lower edge. The experiment name remains shortened to avoid the filename-too-long failure seen with long autogenerated names.
autoresearch/snapshots/20260420T003908Z_hybrid_p8_m8_w3_g142p33938090006510890361823840066790580749511718750000000000000000000000000147002059055070760537729505693331503334835828405777678387906562068821925254292169726877403945763944648206233978271484375_v1094.py	0.071006	0.799339	0.749250	0.375000	0.020699	discard	Restore the compact props8 + minsep8 hybrid shelf anchored at lwindow3, beam3, top4, boardcands2, secsep1, radius0, drop1, props8, total150, and lmargin9.935836791992188. The latest executed bracket is harmful at 142.3393809000651089036182384006679058074951171874999999999999999999999999999978617882319262434830875708262788144969478424959159610416304500062716810872102957130636013971525244414806365966796875 and exact-flat at 142.3393809000651089036182384006679058074951171875000000000000000000000000000050782529491751717276670192875878155697488740721995925261276812351047574178755476814739466817627544514834880828857421875, so this run restores the same shelf anchor and raises only min_score_gain_per_added_move to 142.33938090006510890361823840066790580749511718750000000000000000000000000000147002059055070760537729505693331503334835828405777678387906562068821925254292169726877403945763944648206233978271484375 to continue binary-searching that lower edge. The experiment name remains shortened to avoid the filename-too-long failure seen with long autogenerated names.
autoresearch/snapshots/20260420T004035Z_hybrid_p8_m8_w3_g142p339380900065108903618238400667905807495117187499999999999999999999999999665904411238475544232432941606064765148100389986868912754757813479950169876608705166187718305081943981349468231201171875_v1095.py	0.071006	0.789778	0.739821	0.375000	0.024580	discard	Restore the compact props8 + minsep8 hybrid shelf anchored at lwindow3, beam3, top4, boardcands2, secsep1, radius0, drop1, props8, total150, and lmargin9.935836791992188. The latest executed bracket is harmful at 142.3393809000651089036182384006679058074951171874999999999999999999999999999978617882319262434830875708262788144969478424959159610416304500062716810872102957130636013971525244414806365966796875 and exact-flat at 142.33938090006510890361823840066790580749511718750000000000000000000000000000147002059055070760537729505693331503334835828405777678387906562068821925254292169726877403945763944648206233978271484375, so this run restores the same shelf anchor and raises only min_score_gain_per_added_move to 142.339380900065108903618238400667905807495117187499999999999999999999999999999665904411238475544232432941606064765148100389986868912754757813479950169876608705166187718305081943981349468231201171875 to continue binary-searching that lower edge. The experiment name remains shortened to avoid the filename-too-long failure seen with long autogenerated names.
autoresearch/snapshots/20260420T004204Z_hybrid_p8_m8_w3_g142p3393809000651089036182384006679058074951171875000000000000000000000000005679625008945915748048639992696898992482293370223228483169117170840847112097652012174808788813606952317059040069580078125_v1096.py	0.071006	0.799339	0.749250	0.375000	0.020699	discard	Restore the compact props8 + minsep8 hybrid shelf anchored at lwindow3, beam3, top4, boardcands2, secsep1, radius0, drop1, props8, total150, and lmargin9.935836791992188. The latest executed bracket is harmful at 142.339380900065108903618238400667905807495117187499999999999999999999999999999665904411238475544232432941606064765148100389986868912754757813479950169876608705166187718305081943981349468231201171875 and exact-flat at 142.33938090006510890361823840066790580749511718750000000000000000000000000000147002059055070760537729505693331503334835828405777678387906562068821925254292169726877403945763944648206233978271484375, so this run restores the same shelf anchor and raises only min_score_gain_per_added_move to 142.3393809000651089036182384006679058074951171875000000000000000000000000000005679625008945915748048639992696898992482293370223228483169117170840847112097652012174808788813606952317059040069580078125 to continue binary-searching that lower edge. The experiment name remains shortened to avoid the filename-too-long failure seen with long autogenerated names.
autoresearch/snapshots/20260420T004920Z_hybrid_p8_m8_w3_g142p33938090006510890361823840066790580749511718750000000000000000000000000011693345606653355951864847043787733219816486350459588053583476528201744054318695319183429859322131960652768611907958984375_v1097.py	0.071006	0.799339	0.749250	0.375000	0.020699	discard	Restore the compact props8 + minsep8 hybrid shelf anchored at lwindow3, beam3, top4, boardcands2, secsep1, radius0, drop1, props8, total150, and lmargin9.935836791992188. The latest executed bracket is harmful at 142.339380900065108903618238400667905807495117187499999999999999999999999999999665904411238475544232432941606064765148100389986868912754757813479950169876608705166187718305081943981349468231201171875 and exact-flat at 142.3393809000651089036182384006679058074951171875000000000000000000000000000005679625008945915748048639992696898992482293370223228483169117170840847112097652012174808788813606952317059040069580078125, so this run restores the same shelf anchor and raises only min_score_gain_per_added_move to 142.33938090006510890361823840066790580749511718750000000000000000000000000000011693345606653355951864847043787733219816486350459588053583476528201744054318695319183429859322131960652768611907958984375 to continue binary-searching that lower edge. The experiment name remains shortened to avoid the filename-too-long failure seen with long autogenerated names.
autoresearch/snapshots/20260420T005021Z_hybrid_p8_m8_w3_g142p339380900065108903618238400667905807495117187499999999999999999999999999891418933652504551875540706021971048673132626745732396645296289380983805209897829179011008449151631793938577175140380859375_v1098.py	0.071006	0.789778	0.739821	0.375000	0.024580	discard	Restore the compact props8 + minsep8 hybrid shelf anchored at lwindow3, beam3, top4, boardcands2, secsep1, radius0, drop1, props8, total150, and lmargin9.935836791992188. The latest executed bracket is harmful at 142.339380900065108903618238400667905807495117187499999999999999999999999999999665904411238475544232432941606064765148100389986868912754757813479950169876608705166187718305081943981349468231201171875 and exact-flat at 142.33938090006510890361823840066790580749511718750000000000000000000000000000011693345606653355951864847043787733219816486350459588053583476528201744054318695319183429859322131960652768611907958984375, so this run restores the same shelf anchor and raises only min_score_gain_per_added_move to 142.339380900065108903618238400667905807495117187499999999999999999999999999999891418933652504551875540706021971048673132626745732396645296289380983805209897829179011008449151631793938577175140380859375 to continue binary-searching that lower edge. The experiment name remains shortened to avoid the filename-too-long failure seen with long autogenerated names.
autoresearch/snapshots/20260420T005128Z_hybrid_p8_m8_w3_g142p3393809000651089036182384006679058074951171875000000000000000000000000000041761948595190556970945882299241904356487451251641385905655273315006228765423911854226535211864757002331316471099853515625_v1099.py	0.071006	0.799339	0.749250	0.375000	0.020699	discard	Restore the compact props8 + minsep8 hybrid shelf anchored at lwindow3, beam3, top4, boardcands2, secsep1, radius0, drop1, props8, total150, and lmargin9.935836791992188. The latest executed bracket is harmful at 142.339380900065108903618238400667905807495117187499999999999999999999999999999891418933652504551875540706021971048673132626745732396645296289380983805209897829179011008449151631793938577175140380859375 and exact-flat at 142.33938090006510890361823840066790580749511718750000000000000000000000000000011693345606653355951864847043787733219816486350459588053583476528201744054318695319183429859322131960652768611907958984375, so this run restores the same shelf anchor and raises only min_score_gain_per_added_move to 142.3393809000651089036182384006679058074951171875000000000000000000000000000000041761948595190556970945882299241904356487451251641385905655273315006228765423911854226535211864757002331316471099853515625 to continue binary-searching that lower edge. The experiment name remains shortened to avoid the filename-too-long failure seen with long autogenerated names.
autoresearch/snapshots/20260420T005229Z_hybrid_p8_m8_w3_g142p33938090006510890361823840066790580749511718749999999999999999999999999994779756425601180378631764712594761955439068593544826761793090835624221404322011018221683098516905374708585441112518310546875_v1100.py	0.071006	0.789778	0.739821	0.375000	0.024580	discard	Restore the compact props8 + minsep8 hybrid shelf anchored at lwindow3, beam3, top4, boardcands2, secsep1, radius0, drop1, props8, total150, and lmargin9.935836791992188. The latest executed bracket is harmful at 142.339380900065108903618238400667905807495117187499999999999999999999999999999891418933652504551875540706021971048673132626745732396645296289380983805209897829179011008449151631793938577175140380859375 and exact-flat at 142.3393809000651089036182384006679058074951171875000000000000000000000000000000041761948595190556970945882299241904356487451251641385905655273315006228765423911854226535211864757002331316471099853515625, so this run restores the same shelf anchor and raises only min_score_gain_per_added_move to 142.33938090006510890361823840066790580749511718749999999999999999999999999999994779756425601180378631764712594761955439068593544826761793090835624221404322011018221683098516905374708585441112518310546875 to continue binary-searching that lower edge. The experiment name remains shortened to avoid the filename-too-long failure seen with long autogenerated names.
autoresearch/snapshots/20260420T005331Z_hybrid_p8_m8_w3_g142p339380900065108903618238400667905807495117187499999999999999999999999999975986879557765429741706117677935904995019715530306203104248217843871418459881250683819742253177764723659493029117584228515625_v1101.py	0.071006	0.789778	0.739821	0.375000	0.024580	discard	Restore the compact props8 + minsep8 hybrid shelf anchored at lwindow3, beam3, top4, boardcands2, secsep1, radius0, drop1, props8, total150, and lmargin9.935836791992188. The latest executed bracket is harmful at 142.33938090006510890361823840066790580749511718749999999999999999999999999999994779756425601180378631764712594761955439068593544826761793090835624221404322011018221683098516905374708585441112518310546875 and exact-flat at 142.3393809000651089036182384006679058074951171875000000000000000000000000000000041761948595190556970945882299241904356487451251641385905655273315006228765423911854226535211864757002331316471099853515625, so this run restores the same shelf anchor and raises only min_score_gain_per_added_move to 142.339380900065108903618238400667905807495117187499999999999999999999999999999975986879557765429741706117677935904995019715530306203104248217843871418459881250683819742253177764723659493029117584228515625 to continue binary-searching that lower edge. The experiment name remains shortened to avoid the filename-too-long failure seen with long autogenerated names.
autoresearch/snapshots/20260420T005437Z_hybrid_p8_m8_w3_g142p3393809000651089036182384006679058074951171874999999999999999999999999999900815372086422427194003529539300477153342303277351708474068725876860206682118209346211978871821202119463123381137847900390625_v1102.py	0.071006	0.789778	0.739821	0.375000	0.024580	discard	Restore the compact props8 + minsep8 hybrid shelf anchored at lwindow3, beam3, top4, boardcands2, secsep1, radius0, drop1, props8, total150, and lmargin9.935836791992188. The latest executed bracket is harmful at 142.339380900065108903618238400667905807495117187499999999999999999999999999999975986879557765429741706117677935904995019715530306203104248217843871418459881250683819742253177764723659493029117584228515625 and exact-flat at 142.3393809000651089036182384006679058074951171875000000000000000000000000000000041761948595190556970945882299241904356487451251641385905655273315006228765423911854226535211864757002331316471099853515625, so this run restores the same shelf anchor and raises only min_score_gain_per_added_move to 142.3393809000651089036182384006679058074951171874999999999999999999999999999999900815372086422427194003529539300477153342303277351708474068725876860206682118209346211978871821202119463123381137847900390625 to continue binary-searching that lower edge. The experiment name remains shortened to avoid the filename-too-long failure seen with long autogenerated names.
autoresearch/snapshots/20260420T005545Z_hybrid_p8_m8_w3_g142p33938090006510890361823840066790580749511718749999999999999999999999999999712886603408064920824747059192711907549148772644965471898619995959332177237710606002192570418429795608972199261188507080078125_v1103.py	0.071006	0.789778	0.739821	0.375000	0.024580	discard	Restore the compact props8 + minsep8 hybrid shelf anchored at lwindow3, beam3, top4, boardcands2, secsep1, radius0, drop1, props8, total150, and lmargin9.935836791992188. The latest executed bracket is harmful at 142.3393809000651089036182384006679058074951171874999999999999999999999999999999900815372086422427194003529539300477153342303277351708474068725876860206682118209346211978871821202119463123381137847900390625 and exact-flat at 142.3393809000651089036182384006679058074951171875000000000000000000000000000000041761948595190556970945882299241904356487451251641385905655273315006228765423911854226535211864757002331316471099853515625, so this run restores the same shelf anchor and raises only min_score_gain_per_added_move to 142.33938090006510890361823840066790580749511718749999999999999999999999999999999712886603408064920824747059192711907549148772644965471898619995959332177237710606002192570418429795608972199261188507080078125 to continue binary-searching that lower edge. The experiment name remains shortened to avoid the filename-too-long failure seen with long autogenerated names.
autoresearch/snapshots/20260420T005652Z_hybrid_p8_m8_w3_g142p339380900065108903618238400667905807495117187500000000000000000000000000000652530446799852452671029410925654755570116425806896654775863645546972324459748622722289612685386828161426819860935211181640625_v1104.py	0.071006	0.799339	0.749250	0.375000	0.020699	discard	Restore the compact props8 + minsep8 hybrid shelf anchored at lwindow3, beam3, top4, boardcands2, secsep1, radius0, drop1, props8, total150, and lmargin9.935836791992188. The latest executed bracket is harmful at 142.33938090006510890361823840066790580749511718749999999999999999999999999999999712886603408064920824747059192711907549148772644965471898619995959332177237710606002192570418429795608972199261188507080078125 and exact-flat at 142.3393809000651089036182384006679058074951171875000000000000000000000000000000041761948595190556970945882299241904356487451251641385905655273315006228765423911854226535211864757002331316471099853515625, so this run restores the same shelf anchor and raises only min_score_gain_per_added_move to 142.339380900065108903618238400667905807495117187500000000000000000000000000000000652530446799852452671029410925654755570116425806896654775863645546972324459748622722289612685386828161426819860935211181640625 to continue binary-searching that lower edge. The experiment name remains shortened to avoid the filename-too-long failure seen with long autogenerated names.
autoresearch/snapshots/20260420T005800Z_hybrid_p8_m8_w3_g142p3393809000651089036182384006679058074951171874999999999999999999999999999988906982404402508304592500014263869155308020761282756868810318025701470484184273413721076584348423921255744062364101409912109375_v1105.py	0.071006	0.789778	0.739821	0.375000	0.024580	discard	Restore the compact props8 + minsep8 hybrid shelf anchored at lwindow3, beam3, top4, boardcands2, secsep1, radius0, drop1, props8, total150, and lmargin9.935836791992188. The latest executed bracket is harmful at 142.33938090006510890361823840066790580749511718749999999999999999999999999999999712886603408064920824747059192711907549148772644965471898619995959332177237710606002192570418429795608972199261188507080078125 and exact-flat at 142.339380900065108903618238400667905807495117187500000000000000000000000000000000652530446799852452671029410925654755570116425806896654775863645546972324459748622722289612685386828161426819860935211181640625, so this run restores the same shelf anchor and raises only min_score_gain_per_added_move to 142.3393809000651089036182384006679058074951171874999999999999999999999999999999988906982404402508304592500014263869155308020761282756868810318025701470484184273413721076584348423921255744062364101409912109375 to continue binary-searching that lower edge. The experiment name remains shortened to avoid the filename-too-long failure seen with long autogenerated names.
autoresearch/snapshots/20260420T005902Z_hybrid_p8_m8_w3_g142p33938090006510890361823840066790580749511718749999999999999999999999999999977161434362005164156513970617602083555045925096758617082844772405855968643908798204719863556011461014350061304867267608642578125_v1106.py	0.071006	0.789778	0.739821	0.375000	0.024580	discard	Restore the compact props8 + minsep8 hybrid shelf anchored at lwindow3, beam3, top4, boardcands2, secsep1, radius0, drop1, props8, total150, and lmargin9.935836791992188. The latest executed bracket is harmful at 142.3393809000651089036182384006679058074951171874999999999999999999999999999999988906982404402508304592500014263869155308020761282756868810318025701470484184273413721076584348423921255744062364101409912109375 and exact-flat at 142.339380900065108903618238400667905807495117187500000000000000000000000000000000652530446799852452671029410925654755570116425806896654775863645546972324459748622722289612685386828161426819860935211181640625, so this run restores the same shelf anchor and raises only min_score_gain_per_added_move to 142.33938090006510890361823840066790580749511718749999999999999999999999999999999977161434362005164156513970617602083555045925096758617082844772405855968643908798204719863556011461014350061304867267608642578125 to continue binary-searching that lower edge. The experiment name remains shortened to avoid the filename-too-long failure seen with long autogenerated names.
autoresearch/snapshots/20260420T010010Z_hybrid_p8_m8_w3_g142p339380900065108903618238400667905807495117187500000000000000000000000000000212072395209952047118084558550837795560287838387241412802155684802766005449418302384744124122750719152463716454803943634033203125_v1107.py	0.071006	0.799339	0.749250	0.375000	0.020699	discard	Restore the compact props8 + minsep8 hybrid shelf anchored at lwindow3, beam3, top4, boardcands2, secsep1, radius0, drop1, props8, total150, and lmargin9.935836791992188. The latest executed bracket is harmful at 142.33938090006510890361823840066790580749511718749999999999999999999999999999999977161434362005164156513970617602083555045925096758617082844772405855968643908798204719863556011461014350061304867267608642578125 and exact-flat at 142.339380900065108903618238400667905807495117187500000000000000000000000000000000652530446799852452671029410925654755570116425806896654775863645546972324459748622722289612685386828161426819860935211181640625, so this run restores the same shelf anchor and raises only min_score_gain_per_added_move to 142.339380900065108903618238400667905807495117187500000000000000000000000000000000212072395209952047118084558550837795560287838387241412802155684802766005449418302384744124122750719152463716454803943634033203125 to continue binary-searching that lower edge. The experiment name remains shortened to avoid the filename-too-long failure seen with long autogenerated names.
