snapshot	board_exact	non_empty_accuracy	macro_f1	move_recall	false_change_rate	status	description
autoresearch/snapshots/20260419T092215Z_hybrid_lookahead_segmental_drop1_boardcands2_ratio95_props14_top4_detect10_lwindow4_minsep8_secsep1_thresh3_total150_permove150_lmargin9p5_m9p8957061767578125_r0_beam3_v673.py	0.029586	0.763061	0.727415	0.406250	0.027167	discard	Hybrid decoder keeps the baseline lookahead path unless a conservative board-only segmental pass wins the current score-gain gates. The recent lower-beam sweep on the kept v545 branch established beam3 as the last usable lower-beam side branch, while beam2 and beam1 both degrade sharply. On beam3, raising LOOKAHEAD_WINDOW from 1 to 2 reopened a much higher-recall and noisier tradeoff, and tightening min_score_gain_per_added_move from 125.0 to 137.5 reduced that noise materially while preserving most of the recall gain. Narrowing board breadth from 3 to 2 then preserved board_exact while improving recall and false-change at the cost of weaker secondary metrics, while follow-up margin probes localized that narrower-board branch to the same 9.5..9.75 plateau and event-radius, drop, and upper gate follow-ups were non-improving. Lowering min_event_separation from 4 to 3 regressed sharply, while raising LOOKAHEAD_WINDOW from 2 to 3 reopened an even higher-recall and much noisier branch. On that lwindow3 branch, tightening min_score_gain_per_added_move and sweeping event_window_radius across 0..2 were exact no-ops; secsep3 opened a shifted upper shelf, secsep4/5/6 plus secondary_peak_ratio=0.98 matched it exactly, and drop0 was harmful. Raising min_event_separation from 4 to 5 on that upper shelf then preserved board_exact, recovered the higher recall, and reduced false changes; 6 was an exact no-op, 7 opened a much stronger higher-recall branch, 8 improved it again, and 9 was an exact no-op, while 10 was worse. On that stronger minsep8 branch, LOOKAHEAD_MARGIN=9.5625, 9.75, and 10.0 were all worse than 9.5, and lowering secondary_min_event_separation from 3 to 1 improved false changes slightly without hurting recall. On the secsep1 branch, minsep9 was still an exact no-op versus minsep8, minsep10 regressed sharply, minsep7 gave back board_exact and recall while improving false-change further, minsep5..6 collapsed back to the original lwindow3 lower shelf, raising secsep back to 2 at minsep7 reverted to the older noisier surface, event_window_radius remained flat across 0..2 on the stronger secsep1 minsep8 branch, and LOOKAHEAD_MARGIN=9.5625 confirmed that 9.5 remains the unique useful edge there. This run keeps that stronger secsep1 minsep8 branch and raises only LOOKAHEAD_WINDOW from 3 to 4 to test whether one more step of temporal context improves the branch further or simply pushes it into a noisier, slower regime.
autoresearch/snapshots/20260419T092341Z_hybrid_lookahead_segmental_drop1_boardcands2_ratio95_props14_top4_detect10_lwindow4_minsep7_secsep1_thresh3_total150_permove150_lmargin9p5_m9p8957061767578125_r0_beam3_v674.py	0.029586	0.763061	0.727415	0.406250	0.027167	discard	Hybrid decoder keeps the baseline lookahead path unless a conservative board-only segmental pass wins the current score-gain gates. The recent lower-beam sweep on the kept v545 branch established beam3 as the last usable lower-beam side branch, while beam2 and beam1 both degrade sharply. On beam3, raising LOOKAHEAD_WINDOW from 1 to 2 reopened a much higher-recall and noisier tradeoff, and tightening min_score_gain_per_added_move from 125.0 to 137.5 reduced that noise materially while preserving most of the recall gain. Narrowing board breadth from 3 to 2 then preserved board_exact while improving recall and false-change at the cost of weaker secondary metrics, while follow-up margin probes localized that narrower-board branch to the same 9.5..9.75 plateau and event-radius, drop, and upper gate follow-ups were non-improving. Lowering min_event_separation from 4 to 3 regressed sharply, while raising LOOKAHEAD_WINDOW from 2 to 3 reopened an even higher-recall and much noisier branch. On that lwindow3 branch, tightening min_score_gain_per_added_move and sweeping event_window_radius across 0..2 were exact no-ops; secsep3 opened a shifted upper shelf, secsep4/5/6 plus secondary_peak_ratio=0.98 matched it exactly, and drop0 was harmful. Raising min_event_separation from 4 to 5 on that upper shelf then preserved board_exact, recovered the higher recall, and reduced false changes; 6 was an exact no-op, 7 opened a much stronger higher-recall branch, 8 improved it again, and 9 was an exact no-op, while 10 was worse. On that stronger minsep8 branch, LOOKAHEAD_MARGIN=9.5625, 9.75, and 10.0 were all worse than 9.5, and lowering secondary_min_event_separation from 3 to 1 improved false changes slightly without hurting recall. On the secsep1 branch, minsep9 was still an exact no-op versus minsep8, minsep10 regressed sharply, minsep7 gave back board_exact and recall while improving false-change further, minsep5..6 collapsed back to the original lwindow3 lower shelf, raising secsep back to 2 at minsep7 reverted to the older noisier surface, event_window_radius remained flat across 0..2 on the stronger secsep1 minsep8 branch, and LOOKAHEAD_MARGIN=9.5625 confirmed that 9.5 remains the unique useful edge there. Raising LOOKAHEAD_WINDOW from 3 to 4 with minsep8 then collapsed board_exact sharply below baseline while not improving recall. This run keeps the same lwindow4 branch and lowers only min_event_separation from 8 to 7 to test whether the extra temporal context simply needs tighter event spacing or whether lwindow4 itself is locally unusable.
autoresearch/snapshots/20260419T092504Z_hybrid_lookahead_segmental_drop1_boardcands2_ratio95_props14_top4_detect10_lwindow4_minsep6_secsep1_thresh3_total150_permove150_lmargin9p5_m9p8957061767578125_r0_beam3_v675.py	0.017751	0.746008	0.690131	0.359375	0.027167	discard	Hybrid decoder keeps the baseline lookahead path unless a conservative board-only segmental pass wins the current score-gain gates. The recent lower-beam sweep on the kept v545 branch established beam3 as the last usable lower-beam side branch, while beam2 and beam1 both degrade sharply. On beam3, raising LOOKAHEAD_WINDOW from 1 to 2 reopened a much higher-recall and noisier tradeoff, and tightening min_score_gain_per_added_move from 125.0 to 137.5 reduced that noise materially while preserving most of the recall gain. Narrowing board breadth from 3 to 2 then preserved board_exact while improving recall and false-change at the cost of weaker secondary metrics, while follow-up margin probes localized that narrower-board branch to the same 9.5..9.75 plateau and event-radius, drop, and upper gate follow-ups were non-improving. Lowering min_event_separation from 4 to 3 regressed sharply, while raising LOOKAHEAD_WINDOW from 2 to 3 reopened an even higher-recall and much noisier branch. On that lwindow3 branch, tightening min_score_gain_per_added_move and sweeping event_window_radius across 0..2 were exact no-ops; secsep3 opened a shifted upper shelf, secsep4/5/6 plus secondary_peak_ratio=0.98 matched it exactly, and drop0 was harmful. Raising min_event_separation from 4 to 5 on that upper shelf then preserved board_exact, recovered the higher recall, and reduced false changes; 6 was an exact no-op, 7 opened a much stronger higher-recall branch, 8 improved it again, and 9 was an exact no-op, while 10 was worse. On that stronger minsep8 branch, LOOKAHEAD_MARGIN=9.5625, 9.75, and 10.0 were all worse than 9.5, and lowering secondary_min_event_separation from 3 to 1 improved false changes slightly without hurting recall. On the secsep1 branch, minsep9 was still an exact no-op versus minsep8, minsep10 regressed sharply, minsep7 gave back board_exact and recall while improving false-change further, minsep5..6 collapsed back to the original lwindow3 lower shelf, raising secsep back to 2 at minsep7 reverted to the older noisier surface, event_window_radius remained flat across 0..2 on the stronger secsep1 minsep8 branch, and LOOKAHEAD_MARGIN=9.5625 confirmed that 9.5 remains the unique useful edge there. Raising LOOKAHEAD_WINDOW from 3 to 4 with minsep8 then collapsed board_exact sharply below baseline while not improving recall, and lowering min_event_separation from 8 to 7 on that lwindow4 branch was an exact no-op. This run keeps the same lwindow4 branch and lowers only min_event_separation from 7 to 6 to test whether the extra temporal context has any surviving lower-spacing shelf left or whether the lwindow4 regime is uniformly bad in this local neighborhood.
autoresearch/snapshots/20260419T092630Z_hybrid_lookahead_segmental_drop1_boardcands2_ratio95_props14_top4_detect10_lwindow4_minsep8_secsep3_thresh3_total150_permove150_lmargin9p5_m9p8957061767578125_r0_beam3_v676.py	0.029586	0.762958	0.727295	0.406250	0.028461	discard	Hybrid decoder keeps the baseline lookahead path unless a conservative board-only segmental pass wins the current score-gain gates. The recent lower-beam sweep on the kept v545 branch established beam3 as the last usable lower-beam side branch, while beam2 and beam1 both degrade sharply. On beam3, raising LOOKAHEAD_WINDOW from 1 to 2 reopened a much higher-recall and noisier tradeoff, and tightening min_score_gain_per_added_move from 125.0 to 137.5 reduced that noise materially while preserving most of the recall gain. Narrowing board breadth from 3 to 2 then preserved board_exact while improving recall and false-change at the cost of weaker secondary metrics, while follow-up margin probes localized that narrower-board branch to the same 9.5..9.75 plateau and event-radius, drop, and upper gate follow-ups were non-improving. Lowering min_event_separation from 4 to 3 regressed sharply, while raising LOOKAHEAD_WINDOW from 2 to 3 reopened an even higher-recall and much noisier branch. On that lwindow3 branch, tightening min_score_gain_per_added_move and sweeping event_window_radius across 0..2 were exact no-ops; secsep3 opened a shifted upper shelf, secsep4/5/6 plus secondary_peak_ratio=0.98 matched it exactly, and drop0 was harmful. Raising min_event_separation from 4 to 5 on that upper shelf then preserved board_exact, recovered the higher recall, and reduced false changes; 6 was an exact no-op, 7 opened a much stronger higher-recall branch, 8 improved it again, and 9 was an exact no-op, while 10 was worse. On that stronger minsep8 branch, LOOKAHEAD_MARGIN=9.5625, 9.75, and 10.0 were all worse than 9.5, and lowering secondary_min_event_separation from 3 to 1 improved false changes slightly without hurting recall. On the secsep1 branch, minsep9 was still an exact no-op versus minsep8, minsep10 regressed sharply, minsep7 gave back board_exact and recall while improving false-change further, minsep5..6 collapsed back to the original lwindow3 lower shelf, raising secsep back to 2 at minsep7 reverted to the older noisier surface, event_window_radius remained flat across 0..2 on the stronger secsep1 minsep8 branch, and LOOKAHEAD_MARGIN=9.5625 confirmed that 9.5 remains the unique useful edge there. Raising LOOKAHEAD_WINDOW from 3 to 4 with secsep1 then collapsed board_exact sharply below baseline, and lowering min_event_separation from 8 to 7 was an exact no-op while 6 was even worse. This run keeps the lwindow4 minsep8 branch and raises only secondary_min_event_separation from 1 to 3 to test whether the extra temporal context specifically fails on the secsep1 surface or whether the older secsep3 upper shelf also collapses there.
autoresearch/snapshots/20260419T092822Z_hybrid_lookahead_segmental_drop1_boardcands2_ratio95_props14_top4_detect10_lwindow4_minsep7_secsep3_thresh3_total150_permove150_lmargin9p5_m9p8957061767578125_r0_beam3_v677.py	0.029586	0.762958	0.727295	0.406250	0.028461	discard	Hybrid decoder keeps the baseline lookahead path unless a conservative board-only segmental pass wins the current score-gain gates. The recent lower-beam sweep on the kept v545 branch established beam3 as the last usable lower-beam side branch, while beam2 and beam1 both degrade sharply. On beam3, raising LOOKAHEAD_WINDOW from 1 to 2 reopened a much higher-recall and noisier tradeoff, and tightening min_score_gain_per_added_move from 125.0 to 137.5 reduced that noise materially while preserving most of the recall gain. Narrowing board breadth from 3 to 2 then preserved board_exact while improving recall and false-change at the cost of weaker secondary metrics, while follow-up margin probes localized that narrower-board branch to the same 9.5..9.75 plateau and event-radius, drop, and upper gate follow-ups were non-improving. Lowering min_event_separation from 4 to 3 regressed sharply, while raising LOOKAHEAD_WINDOW from 2 to 3 reopened an even higher-recall and much noisier branch. On that lwindow3 branch, tightening min_score_gain_per_added_move and sweeping event_window_radius across 0..2 were exact no-ops; secsep3 opened a shifted upper shelf, secsep4/5/6 plus secondary_peak_ratio=0.98 matched it exactly, and drop0 was harmful. Raising min_event_separation from 4 to 5 on that upper shelf then preserved board_exact, recovered the higher recall, and reduced false changes; 6 was an exact no-op, 7 opened a much stronger higher-recall branch, 8 improved it again, and 9 was an exact no-op, while 10 was worse. On that stronger minsep8 branch, LOOKAHEAD_MARGIN=9.5625, 9.75, and 10.0 were all worse than 9.5, and lowering secondary_min_event_separation from 3 to 1 improved false changes slightly without hurting recall. On the secsep1 branch, minsep9 was still an exact no-op versus minsep8, minsep10 regressed sharply, minsep7 gave back board_exact and recall while improving false-change further, minsep5..6 collapsed back to the original lwindow3 lower shelf, raising secsep back to 2 at minsep7 reverted to the older noisier surface, event_window_radius remained flat across 0..2 on the stronger secsep1 minsep8 branch, and LOOKAHEAD_MARGIN=9.5625 confirmed that 9.5 remains the unique useful edge there. Raising LOOKAHEAD_WINDOW from 3 to 4 collapsed badly on both the secsep1 and secsep3 minsep8 surfaces, while lowering min_event_separation to 7 and 6 on the lwindow4 secsep1 branch did not rescue it. This run keeps the lwindow4 secsep3 branch and lowers only min_event_separation from 8 to 7 to test whether the older upper shelf shifts downward under the extra lookahead context or whether lwindow4 is uniformly bad across the nearby spacing shelf as well.
autoresearch/snapshots/20260419T092933Z_hybrid_lookahead_segmental_drop1_boardcands2_ratio95_props14_top4_detect10_lwindow4_minsep7_secsep3_thresh3_total150_permove150_lmargin9p5_m9p8957061767578125_r0_beam3_v677.py	0.029586	0.762958	0.727295	0.406250	0.028461	discard	Hybrid decoder keeps the baseline lookahead path unless a conservative board-only segmental pass wins the current score-gain gates. The recent lower-beam sweep on the kept v545 branch established beam3 as the last usable lower-beam side branch, while beam2 and beam1 both degrade sharply. On beam3, raising LOOKAHEAD_WINDOW from 1 to 2 reopened a much higher-recall and noisier tradeoff, and tightening min_score_gain_per_added_move from 125.0 to 137.5 reduced that noise materially while preserving most of the recall gain. Narrowing board breadth from 3 to 2 then preserved board_exact while improving recall and false-change at the cost of weaker secondary metrics, while follow-up margin probes localized that narrower-board branch to the same 9.5..9.75 plateau and event-radius, drop, and upper gate follow-ups were non-improving. Lowering min_event_separation from 4 to 3 regressed sharply, while raising LOOKAHEAD_WINDOW from 2 to 3 reopened an even higher-recall and much noisier branch. On that lwindow3 branch, tightening min_score_gain_per_added_move and sweeping event_window_radius across 0..2 were exact no-ops; secsep3 opened a shifted upper shelf, secsep4/5/6 plus secondary_peak_ratio=0.98 matched it exactly, and drop0 was harmful. Raising min_event_separation from 4 to 5 on that upper shelf then preserved board_exact, recovered the higher recall, and reduced false changes; 6 was an exact no-op, 7 opened a much stronger higher-recall branch, 8 improved it again, and 9 was an exact no-op, while 10 was worse. On that stronger minsep8 branch, LOOKAHEAD_MARGIN=9.5625, 9.75, and 10.0 were all worse than 9.5, and lowering secondary_min_event_separation from 3 to 1 improved false changes slightly without hurting recall. On the secsep1 branch, minsep9 was still an exact no-op versus minsep8, minsep10 regressed sharply, minsep7 gave back board_exact and recall while improving false-change further, minsep5..6 collapsed back to the original lwindow3 lower shelf, raising secsep back to 2 at minsep7 reverted to the older noisier surface, event_window_radius remained flat across 0..2 on the stronger secsep1 minsep8 branch, and LOOKAHEAD_MARGIN=9.5625 confirmed that 9.5 remains the unique useful edge there. Raising LOOKAHEAD_WINDOW from 3 to 4 collapsed badly on both the secsep1 and secsep3 minsep8 surfaces, while lowering min_event_separation to 7 and 6 on the lwindow4 secsep1 branch did not rescue it. This run keeps the lwindow4 secsep3 branch and lowers only min_event_separation from 8 to 7 to test whether the older upper shelf shifts downward under the extra lookahead context or whether lwindow4 is uniformly bad across the nearby spacing shelf as well.
autoresearch/snapshots/20260419T093057Z_hybrid_lookahead_segmental_drop1_boardcands2_ratio95_props14_top4_detect10_lwindow4_minsep6_secsep3_thresh3_total150_permove150_lmargin9p5_m9p8957061767578125_r0_beam3_v678.py	0.017751	0.742701	0.689067	0.359375	0.027167	discard	Hybrid decoder keeps the baseline lookahead path unless a conservative board-only segmental pass wins the current score-gain gates. The recent lower-beam sweep on the kept v545 branch established beam3 as the last usable lower-beam side branch, while beam2 and beam1 both degrade sharply. On beam3, raising LOOKAHEAD_WINDOW from 1 to 2 reopened a much higher-recall and noisier tradeoff, and tightening min_score_gain_per_added_move from 125.0 to 137.5 reduced that noise materially while preserving most of the recall gain. Narrowing board breadth from 3 to 2 then preserved board_exact while improving recall and false-change at the cost of weaker secondary metrics, while follow-up margin probes localized that narrower-board branch to the same 9.5..9.75 plateau and event-radius, drop, and upper gate follow-ups were non-improving. Lowering min_event_separation from 4 to 3 regressed sharply, while raising LOOKAHEAD_WINDOW from 2 to 3 reopened an even higher-recall and much noisier branch. On that lwindow3 branch, tightening min_score_gain_per_added_move and sweeping event_window_radius across 0..2 were exact no-ops; secsep3 opened a shifted upper shelf, secsep4/5/6 plus secondary_peak_ratio=0.98 matched it exactly, and drop0 was harmful. Raising min_event_separation from 4 to 5 on that upper shelf then preserved board_exact, recovered the higher recall, and reduced false changes; 6 was an exact no-op, 7 opened a much stronger higher-recall branch, 8 improved it again, and 9 was an exact no-op, while 10 was worse. On that stronger minsep8 branch, LOOKAHEAD_MARGIN=9.5625, 9.75, and 10.0 were all worse than 9.5, and lowering secondary_min_event_separation from 3 to 1 improved false changes slightly without hurting recall. On the secsep1 branch, minsep9 was still an exact no-op versus minsep8, minsep10 regressed sharply, minsep7 gave back board_exact and recall while improving false-change further, minsep5..6 collapsed back to the original lwindow3 lower shelf, raising secsep back to 2 at minsep7 reverted to the older noisier surface, event_window_radius remained flat across 0..2 on the stronger secsep1 minsep8 branch, and LOOKAHEAD_MARGIN=9.5625 confirmed that 9.5 remains the unique useful edge there. Raising LOOKAHEAD_WINDOW from 3 to 4 collapsed badly on both the secsep1 and secsep3 minsep8 surfaces, while lowering min_event_separation to 7 and 6 on the lwindow4 secsep1 branch did not rescue it, and lowering only minsep from 8 to 7 on the lwindow4 secsep3 branch was also an exact no-op. This run keeps the lwindow4 secsep3 branch and lowers only min_event_separation from 7 to 6 to test whether that older upper shelf has any surviving lower-spacing point under extra lookahead or whether the whole lwindow4 neighborhood is uniformly collapsed.
