snapshot	board_exact	non_empty_accuracy	macro_f1	move_recall	false_change_rate	status	description
autoresearch/snapshots/20260420T020204Z_hybrid_p8_m8_w3_v1143.py	0.071006	0.799339	0.749250	0.375000	0.020699	discard	Restore the compact props8 + minsep8 hybrid shelf anchored at lwindow3, beam3, top4, boardcands2, secsep1, radius0, drop1, props8, total150, and lmargin9.935836791992188. The latest executed bracket is harmful at 142.3393809000651089036182384006679058074951171874999999999999999999999999999999999999999998556673702644510590384067175026582512558413193288173626144326230952322398480580794433655375495745132785859799785799228999394472339190542697906494140625 and exact-flat at 142.339380900065108903618238400667905807495117187500000000000000000000000000000000000000000470980160189686017874672816570273074849359905347389802588796073762975230960442056553228245890862114564614170596212883168618645868264138698577880859375. This run re-prepares their midpoint, 142.33938090006510890361823840066790580749511718750000000000000000000000000000000000000000016332376522706853845653976703646566305260061233810358260161434842910373540425006799829689172021831392160007528739640303427904655109159648418426513671875, with a short experiment name to avoid filename-too-long failures.
autoresearch/snapshots/20260420T020349Z_hybrid_p8_m8_w3_v1144.py	0.071006	0.799339	0.749250	0.375000	0.020699	discard	Restore the compact props8 + minsep8 hybrid shelf anchored at lwindow3, beam3, top4, boardcands2, secsep1, radius0, drop1, props8, total150, and lmargin9.935836791992188. The latest executed bracket is harmful at 142.3393809000651089036182384006679058074951171874999999999999999999999999999999999999999998556673702644510590384067175026582512558413193288173626144326230952322398480580794433655375495745132785859799785799228999394472339190542697906494140625 and exact-flat at 142.33938090006510890361823840066790580749511718750000000000000000000000000000000000000000016332376522706853845653976703646566305260061233810358260161434842910373540425006799829689172021831392160007528739640303427904655109159648418426513671875. This run re-prepares their midpoint, 142.339380900065108903618238400667905807495117187500000000000000000000000000000000000000000009495567745759798747473242269561957154220965833460472608023485762167987626154073720831214634896413600093027632988162967109246892505325376987457275390625, with a short experiment name to avoid filename-too-long failures.
autoresearch/snapshots/20260420T020848Z_hybrid_p8_m8_w3_v1145.py	0.071006	0.789778	0.739821	0.375000	0.024580	discard	Restore the compact props8 + minsep8 hybrid shelf anchored at lwindow3, beam3, top4, boardcands2, secsep1, radius0, drop1, props8, total150, and lmargin9.935836791992188. The latest executed bracket is harmful at 142.3393809000651089036182384006679058074951171874999999999999999999999999999999999999999998556673702644510590384067175026582512558413193288173626144326230952322398480580794433655375495745132785859799785799228999394472339190542697906494140625 and exact-flat at 142.339380900065108903618238400667905807495117187500000000000000000000000000000000000000000009495567745759798747473242269561957154220965833460472608023485762167987626154073720831214634896413600093027632988162967109246892505325376987457275390625. This run re-prepares their midpoint, 142.3393809000651089036182384006679058074951171874999999999999999999999999999999999999999999325814690051054288929399798861101042050311425811389176112280544287001137371060765820983760922354634393395038057840429335243470632121898233890533447265625, with a short experiment name to avoid filename-too-long failures.
autoresearch/snapshots/20260420T021056Z_hybrid_p8_m8_w3_v1146.py	0.071006	0.789778	0.739821	0.375000	0.024580	discard	Restore the compact props8 + minsep8 hybrid shelf anchored at lwindow3, beam3, top4, boardcands2, secsep1, radius0, drop1, props8, total150, and lmargin9.935836791992188. The latest executed bracket is harmful at 142.3393809000651089036182384006679058074951171874999999999999999999999999999999999999999999325814690051054288929399798861101042050311425811389176112280544287001137371060765820983760922354634393395038057840429335243470632121898233890533447265625 and exact-flat at 142.339380900065108903618238400667905807495117187500000000000000000000000000000000000000000009495567745759798747473242269561957154220965833460472608023485762167987626154073720831214634896413600093027632988162967109246892505325376987457275390625. This run re-prepares their midpoint, 142.33938090006510890361823840066790580749511718749999999999999999999999999999999999999999997103851837543261382020661107783603067962605420729969510962577009543405068163007515146479536356593851971626571938610295031679697785875760018825531005859375, with a short experiment name to avoid filename-too-long failures.
autoresearch/snapshots/20260420T021306Z_hybrid_p8_m8_w3_v1147.py	0.071006	0.789778	0.739821	0.375000	0.024580	discard	Restore the compact props8 + minsep8 hybrid shelf anchored at lwindow3, beam3, top4, boardcands2, secsep1, radius0, drop1, props8, total150, and lmargin9.935836791992188. The latest executed bracket is harmful at 142.33938090006510890361823840066790580749511718749999999999999999999999999999999999999999997103851837543261382020661107783603067962605420729969510962577009543405068163007515146479536356593851971626571938610295031679697785875760018825531005859375 and exact-flat at 142.339380900065108903618238400667905807495117187500000000000000000000000000000000000000000009495567745759798747473242269561957154220965833460472608023485762167987626154073720831214634896413600093027632988162967109246892505325376987457275390625. This run re-prepares their midpoint, 142.339380900065108903618238400667905807495117187499999999999999999999999999999999999999999990267043060596206283839926673698993916923510020380083858824627928801019153892074436148004999231176059904646676187132958713021935182041488587856292724609375, with a short experiment name to avoid filename-too-long failures.
autoresearch/snapshots/20260420T021517Z_hybrid_p8_m8_w3_v1148.py	0.071006	0.789778	0.739821	0.375000	0.024580	discard	Restore the compact props8 + minsep8 hybrid shelf anchored at lwindow3, beam3, top4, boardcands2, secsep1, radius0, drop1, props8, total150, and lmargin9.935836791992188. The latest executed bracket is harmful at 142.339380900065108903618238400667905807495117187499999999999999999999999999999999999999999990267043060596206283839926673698993916923510020380083858824627928801019153892074436148004999231176059904646676187132958713021935182041488587856292724609375 and exact-flat at 142.339380900065108903618238400667905807495117187500000000000000000000000000000000000000000009495567745759798747473242269561957154220965833460472608023485762167987626154073720831214634896413600093027632988162967109246892505325376987457275390625. This run re-prepares their midpoint, 142.3393809000651089036182384006679058074951171874999999999999999999999999999999999999999999998813054031780025156565844716304755355722379269202782334240568454845033900230740784896098170637948299988371545876479629111344138436834327876567840576171875, with a short experiment name to avoid filename-too-long failures.
autoresearch/snapshots/20260420T021734Z_hybrid_p8_m8_w3_v1149.py	0.071006	0.799339	0.749250	0.375000	0.020699	discard	Restore the compact props8 + minsep8 hybrid shelf anchored at lwindow3, beam3, top4, boardcands2, secsep1, radius0, drop1, props8, total150, and lmargin9.935836791992188. The latest executed bracket is harmful at 142.3393809000651089036182384006679058074951171874999999999999999999999999999999999999999999998813054031780025156565844716304755355722379269202782334240568454845033900230740784896098170637948299988371545876479629111344138436834327876567840576171875 and exact-flat at 142.339380900065108903618238400667905807495117187500000000000000000000000000000000000000000009495567745759798747473242269561957154220965833460472608023485762167987626154073720831214634896413600093027632988162967109246892505325376987457275390625. This run re-prepares their midpoint, 142.33938090006510890361823840066790580749511718750000000000000000000000000000000000000000000468843657446890063156491337059621634489660188019037542072377130382624550808857389966041222598010421504593239378790546501019065317450440488755702972412109375, with a short experiment name to avoid filename-too-long failures.
autoresearch/snapshots/20260420T021947Z_hybrid_p8_m8_w3_v1150.py	0.071006	0.799339	0.749250	0.375000	0.020699	discard	Restore the compact props8 + minsep8 hybrid shelf anchored at lwindow3, beam3, top4, boardcands2, secsep1, radius0, drop1, props8, total150, and lmargin9.935836791992188. The latest executed bracket is harmful at 142.3393809000651089036182384006679058074951171874999999999999999999999999999999999999999999998813054031780025156565844716304755355722379269202782334240568454845033900230740784896098170637948299988371545876479629111344138436834327876567840576171875 and exact-flat at 142.33938090006510890361823840066790580749511718750000000000000000000000000000000000000000000468843657446890063156491337059621634489660188019037542072377130382624550808857389966041222598010421504593239378790546501019065317450440488755702972412109375. This run re-prepares their midpoint, 142.339380900065108903618238400667905807495117187500000000000000000000000000000000000000000002284870988823451573610748921113345940234419903555326827073914074655374449055823989075011021521949522522384774187776713960662533509093918837606906890869140625, with a short experiment name to avoid filename-too-long failures.
autoresearch/snapshots/20260420T022204Z_hybrid_p8_m8_w3_v1151.py	0.071006	0.799339	0.749250	0.375000	0.020699	discard	Restore the compact props8 + minsep8 hybrid shelf anchored at lwindow3, beam3, top4, boardcands2, secsep1, radius0, drop1, props8, total150, and lmargin9.935836791992188. The latest executed bracket is harmful at 142.3393809000651089036182384006679058074951171874999999999999999999999999999999999999999999998813054031780025156565844716304755355722379269202782334240568454845033900230740784896098170637948299988371545876479629111344138436834327876567840576171875 and exact-flat at 142.339380900065108903618238400667905807495117187500000000000000000000000000000000000000000002284870988823451573610748921113345940234419903555326827073914074655374449055823989075011021521949522522384774187776713960662533509093918837606906890869140625. This run re-prepares their midpoint, 142.3393809000651089036182384006679058074951171875000000000000000000000000000000000000000000010830881960007270446336666963719107379033289152378025302489854600699389195394490337823104192928721762606109643877123384358984736763886758126318454742431640625, with a short experiment name to avoid filename-too-long failures.
autoresearch/snapshots/20260420T022418Z_hybrid_p8_m8_w3_v1152.py	0.071006	0.799339	0.749250	0.375000	0.020699	discard	Restore the compact props8 + minsep8 hybrid shelf anchored at lwindow3, beam3, top4, boardcands2, secsep1, radius0, drop1, props8, total150, and lmargin9.935836791992188. The latest executed bracket is harmful at 142.3393809000651089036182384006679058074951171874999999999999999999999999999999999999999999998813054031780025156565844716304755355722379269202782334240568454845033900230740784896098170637948299988371545876479629111344138436834327876567840576171875 and exact-flat at 142.3393809000651089036182384006679058074951171875000000000000000000000000000000000000000000010830881960007270446336666963719107379033289152378025302489854600699389195394490337823104192928721762606109643877123384358984736763886758126318454742431640625. This run re-prepares their midpoint, 142.33938090006510890361823840066790580749511718750000000000000000000000000000000000000000000048219679958936478014512558400119313673778342107904038183652115277722115478126155613596011817833350312972405948768015067351644376003605430014431476593017578125, with a short experiment name to avoid filename-too-long failures.
autoresearch/snapshots/20260420T022631Z_hybrid_p8_m8_w3_v1153.py	0.071006	0.799339	0.749250	0.375000	0.020699	discard	Restore the compact props8 + minsep8 hybrid shelf anchored at lwindow3, beam3, top4, boardcands2, secsep1, radius0, drop1, props8, total150, and lmargin9.935836791992188. The latest executed bracket is harmful at 142.3393809000651089036182384006679058074951171874999999999999999999999999999999999999999999998813054031780025156565844716304755355722379269202782334240568454845033900230740784896098170637948299988371545876479629111344138436834327876567840576171875 and exact-flat at 142.33938090006510890361823840066790580749511718750000000000000000000000000000000000000000000048219679958936478014512558400119313673778342107904038183652115277722115478126155613596011817833350312972405948768015067351644376003605430014431476593017578125. This run re-prepares their midpoint, 142.339380900065108903618238400667905807495117187500000000000000000000000000000000000000000000181751101383683647900855027815834336155010673999659307630288999130862272402167817312784967621064166564280607037664056792325428801859743543900549411773681640625, with a short experiment name to avoid filename-too-long failures.
autoresearch/snapshots/20260420T022847Z_hybrid_p8_m8_w3_v1154.py	0.071006	0.799339	0.749250	0.375000	0.020699	discard	Restore the compact props8 + minsep8 hybrid shelf anchored at lwindow3, beam3, top4, boardcands2, secsep1, radius0, drop1, props8, total150, and lmargin9.935836791992188. The latest executed bracket is harmful at 142.3393809000651089036182384006679058074951171874999999999999999999999999999999999999999999998813054031780025156565844716304755355722379269202782334240568454845033900230740784896098170637948299988371545876479629111344138436834327876567840576171875 and exact-flat at 142.339380900065108903618238400667905807495117187500000000000000000000000000000000000000000000181751101383683647900855027815834336155010673999659307630288999130862272402167817312784967621064166564280607037664056792325428801859743543900549411773681640625. This run re-prepares their midpoint, 142.3393809000651089036182384006679058074951171875000000000000000000000000000000000000000000000315282522808430817787197497231549358636243004599687705271729223076828312126209479011973923424294982815588808126560098517299213227715881657786667346954345703125, with a short experiment name to avoid filename-too-long failures.
autoresearch/snapshots/20260420T023108Z_hybrid_p8_m8_w3_v1155.py	0.071006	0.789778	0.739821	0.375000	0.024580	discard	Restore the compact props8 + minsep8 hybrid shelf anchored at lwindow3, beam3, top4, boardcands2, secsep1, radius0, drop1, props8, total150, and lmargin9.935836791992188. The latest executed bracket is harmful at 142.3393809000651089036182384006679058074951171874999999999999999999999999999999999999999999998813054031780025156565844716304755355722379269202782334240568454845033900230740784896098170637948299988371545876479629111344138436834327876567840576171875 and exact-flat at 142.3393809000651089036182384006679058074951171875000000000000000000000000000000000000000000000315282522808430817787197497231549358636243004599687705271729223076828312126209479011973923424294982815588808126560098517299213227715881657786667346954345703125. This run re-prepares their midpoint, 142.33938090006510890361823840066790580749511718749999999999999999999999999999999999999999999995641682772942279871765211067681523571793111369012350197561488389609311061784751319540360470311216414019801770015198638143216758322751047671772539615631103515625, with a short experiment name to avoid filename-too-long failures.
autoresearch/snapshots/20260420T023324Z_hybrid_p8_m8_w3_v1156.py	0.071006	0.789778	0.739821	0.375000	0.024580	discard	Restore the compact props8 + minsep8 hybrid shelf anchored at lwindow3, beam3, top4, boardcands2, secsep1, radius0, drop1, props8, total150, and lmargin9.935836791992188. The latest executed bracket is harmful at 142.33938090006510890361823840066790580749511718749999999999999999999999999999999999999999999995641682772942279871765211067681523571793111369012350197561488389609311061784751319540360470311216414019801770015198638143216758322751047671772539615631103515625 and exact-flat at 142.3393809000651089036182384006679058074951171875000000000000000000000000000000000000000000000315282522808430817787197497231549358636243004599687705271729223076828312126209479011973923424294982815588808126560098517299213227715881657786667346954345703125. This run re-prepares their midpoint, 142.339380900065108903618238400667905807495117187499999999999999999999999999999999999999999999993972540005132940248185930199985085790777707075046136251393903101887970915234230548300498522770831210878449256403998116581044452999549321248196065425872802734375, with a short experiment name to avoid filename-too-long failures.
autoresearch/snapshots/20260420T023540Z_hybrid_p8_m8_w3_v1157.py	0.071006	0.799339	0.749250	0.375000	0.020699	discard	Restore the compact props8 + minsep8 hybrid shelf anchored at lwindow3, beam3, top4, boardcands2, secsep1, radius0, drop1, props8, total150, and lmargin9.935836791992188. The latest executed bracket is harmful at 142.339380900065108903618238400667905807495117187499999999999999999999999999999999999999999999993972540005132940248185930199985085790777707075046136251393903101887970915234230548300498522770831210878449256403998116581044452999549321248196065425872802734375 and exact-flat at 142.3393809000651089036182384006679058074951171875000000000000000000000000000000000000000000000315282522808430817787197497231549358636243004599687705271729223076828312126209479011973923424294982815588808126560098517299213227715881657786667346954345703125. This run re-prepares their midpoint, 142.3393809000651089036182384006679058074951171875000000000000000000000000000000000000000000000127503961429880110134528399615700108272010037675074533892834127047854010639275892247489454326001647462186650345300039841554828878855687435134314000606536865234375, with a short experiment name to avoid filename-too-long failures.
autoresearch/snapshots/20260420T023752Z_hybrid_p8_m8_w3_v1158.py	0.071006	0.799339	0.749250	0.375000	0.020699	discard	Restore the compact props8 + minsep8 hybrid shelf anchored at lwindow3, beam3, top4, boardcands2, secsep1, radius0, drop1, props8, total150, and lmargin9.935836791992188. The latest executed bracket is harmful at 142.339380900065108903618238400667905807495117187499999999999999999999999999999999999999999999993972540005132940248185930199985085790777707075046136251393903101887970915234230548300498522770831210878449256403998116581044452999549321248196065425872802734375 and exact-flat at 142.3393809000651089036182384006679058074951171875000000000000000000000000000000000000000000000127503961429880110134528399615700108272010037675074533892834127047854010639275892247489454326001647462186650345300039841554828878855687435134314000606536865234375. This run re-prepares their midpoint, 142.33938090006510890361823840066790580749511718750000000000000000000000000000000000000000000000336146807406047563081938508077754830898935542127679482033865790333668598958090988652472197768549797854855714546700105036826367044255903238081373274326324462890625, with a short experiment name to avoid filename-too-long failures.
autoresearch/snapshots/20260420T023858Z_hybrid_p8_m8_w3_v1159.py	0.071006	0.789778	0.739821	0.375000	0.024580	discard	Restore the compact props8 + minsep8 hybrid shelf anchored at lwindow3, beam3, top4, boardcands2, secsep1, radius0, drop1, props8, total150, and lmargin9.935836791992188. The latest executed bracket is harmful at 142.339380900065108903618238400667905807495117187499999999999999999999999999999999999999999999993972540005132940248185930199985085790777707075046136251393903101887970915234230548300498522770831210878449256403998116581044452999549321248196065425872802734375 and exact-flat at 142.33938090006510890361823840066790580749511718750000000000000000000000000000000000000000000000336146807406047563081938508077754830898935542127679482033865790333668598958090988652472197768549797854855714546700105036826367044255903238081373274326324462890625. This run re-prepares their midpoint, 142.339380900065108903618238400667905807495117187499999999999999999999999999999999999999999999998667004039596707939502657640381317049883531248161465535866280502612328452407570217412610250228164594713503200935499583474654061721054176814504899084568023681640625, with a short experiment name to avoid filename-too-long failures.
autoresearch/snapshots/20260420T024000Z_hybrid_p8_m8_w3_v1160.py	0.071006	0.799339	0.749250	0.375000	0.020699	discard	Restore the compact props8 + minsep8 hybrid shelf anchored at lwindow3, beam3, top4, boardcands2, secsep1, radius0, drop1, props8, total150, and lmargin9.935836791992188. The latest executed bracket is harmful at 142.339380900065108903618238400667905807495117187499999999999999999999999999999999999999999999998667004039596707939502657640381317049883531248161465535866280502612328452407570217412610250228164594713503200935499583474654061721054176814504899084568023681640625 and exact-flat at 142.33938090006510890361823840066790580749511718750000000000000000000000000000000000000000000000336146807406047563081938508077754830898935542127679482033865790333668598958090988652472197768549797854855714546700105036826367044255903238081373274326324462890625. This run re-prepares their midpoint, 142.3393809000651089036182384006679058074951171875000000000000000000000000000000000000000000000010142360568285917851610213605794326794364433347191301781024692029745072209942400519686661139568312866310301732012503169214588660818066045976593159139156341552734375, with a short experiment name to avoid filename-too-long failures.
