snapshot	board_exact	non_empty_accuracy	macro_f1	move_recall	false_change_rate	status	description
autoresearch/snapshots/20260419T040742Z_hybrid_lookahead_segmental_drop1_boardcands2_ratio95_props14_top4_detect10_lwindow1_minsep4_thresh3_total150_permove125_lmargin9p5_m9p8957061767578125_r0_beam4_v488.py	0.074556	0.763992	0.714168	0.265625	0.019405	discard	Hybrid decoder keeps the baseline lookahead path unless a conservative board-only segmental pass wins the current score-gain gates, while following up the kept window1 branch after lowering lookahead window from 2 to 1 on the 9.5-margin baseline opened a lower-false-change but lower-recall tradeoff, many nearby margin, handoff, move-width, board-width, temporal-radius, and upper-side beam probes on that branch stayed exact, and lowering only max_event_proposals from 16 to 15 on the restored plain window1 branch improved recall and secondary metrics but worsened false-change, while additionally narrowing top-board breadth from 4 to 3 recovered the lower false-change without hurting recall, lowering only max_event_proposals one step further from 15 to 14 on that boardcands3 plain props branch kept that recovered tradeoff, lowering top-move breadth from 4 to 1 there was an exact no-op, and restoring top-board breadth from 3 back to 4 reopened the worse false-change regime without improving recall, and lowering only top-board breadth from 3 to 2 on the stronger props14 branch to test whether boardcands2 preserves the recovered recall and false-change tradeoff while changing only secondary metrics.
autoresearch/snapshots/20260419T040844Z_hybrid_lookahead_segmental_drop1_boardcands1_ratio95_props14_top4_detect10_lwindow1_minsep4_thresh3_total150_permove125_lmargin9p5_m9p8957061767578125_r0_beam4_v489.py	0.074556	0.740220	0.689657	0.250000	0.019405	discard	Hybrid decoder keeps the baseline lookahead path unless a conservative board-only segmental pass wins the current score-gain gates, while following up the kept window1 branch after lowering lookahead window from 2 to 1 on the 9.5-margin baseline opened a lower-false-change but lower-recall tradeoff, many nearby margin, handoff, move-width, board-width, temporal-radius, and upper-side beam probes on that branch stayed exact, and lowering only max_event_proposals from 16 to 15 on the restored plain window1 branch improved recall and secondary metrics but worsened false-change, while additionally narrowing top-board breadth from 4 to 3 recovered the lower false-change without hurting recall, lowering only max_event_proposals one step further from 15 to 14 on that boardcands3 plain props branch kept that recovered tradeoff, lowering top-move breadth from 4 to 1 there was an exact no-op, and the follow-up props14 board-width probes showed boardcands3 remained best while boardcands4 reopened worse false-change and boardcands2 weakened secondaries, and lowering only top-board breadth from 3 to 1 on the stronger props14 branch to complete the local board-width curve and confirm whether boardcands3 is the true sweet spot there.
autoresearch/snapshots/20260419T040935Z_hybrid_lookahead_segmental_drop1_boardcands3_ratio95_props14_top4_detect10_lwindow1_minsep4_thresh3_total150_permove125_lmargin9p5_m9p8957061767578125_r0_beam3_v490.py	0.074556	0.787918	0.755149	0.250000	0.021992	discard	Hybrid decoder keeps the baseline lookahead path unless a conservative board-only segmental pass wins the current score-gain gates, while following up the kept window1 branch after lowering lookahead window from 2 to 1 on the 9.5-margin baseline opened a lower-false-change but lower-recall tradeoff, many nearby margin, handoff, move-width, board-width, temporal-radius, and upper-side beam probes on that branch stayed exact, lowering only max_event_proposals from 16 to 15 on the restored plain window1 branch improved recall and secondary metrics but worsened false-change, additionally narrowing top-board breadth from 4 to 3 recovered the lower false-change without hurting recall, lowering only max_event_proposals one step further from 15 to 14 on that boardcands3 plain props branch kept that recovered tradeoff, and follow-up props14 probes showed top1 was an exact no-op and boardcands3 remained the local board-width sweet spot, and lowering only beam size from 4 to 3 on that stronger props14 branch to test whether the recovered tradeoff survives at a cheaper beam or still depends on beam4.
autoresearch/snapshots/20260419T041025Z_hybrid_lookahead_segmental_drop1_boardcands3_ratio95_props14_top4_detect10_lwindow1_minsep4_thresh3_total150_permove125_lmargin9p5_m9p8957061767578125_r0_beam5_v491.py	0.074556	0.764870	0.721875	0.265625	0.019405	discard	Hybrid decoder keeps the baseline lookahead path unless a conservative board-only segmental pass wins the current score-gain gates, while following up the kept window1 branch after lowering lookahead window from 2 to 1 on the 9.5-margin baseline opened a lower-false-change but lower-recall tradeoff, lowering only max_event_proposals from 16 to 15 on the restored plain window1 branch improved recall and secondary metrics but worsened false-change, additionally narrowing top-board breadth from 4 to 3 recovered the lower false-change without hurting recall, lowering only max_event_proposals one step further from 15 to 14 on that boardcands3 plain props branch kept that recovered tradeoff, and follow-up props14 probes showed top1 was an exact no-op, boardcands3 was the local board-width sweet spot, and beam3 was worse, and raising only beam size from 4 to 5 on that stronger props14 branch to test whether the recovered tradeoff is asymmetric around beam4 and whether a slightly wider beam preserves recall while improving secondaries or false-change.
autoresearch/snapshots/20260419T041115Z_hybrid_lookahead_segmental_drop1_boardcands3_ratio95_props14_top4_detect10_lwindow1_minsep4_thresh3_total150_permove125_lmargin9p5_m9p8957061767578125_r0_beam6_v492.py	0.074556	0.764870	0.721875	0.265625	0.019405	discard	Hybrid decoder keeps the baseline lookahead path unless a conservative board-only segmental pass wins the current score-gain gates, while following up the kept window1 branch after lowering lookahead window from 2 to 1 on the 9.5-margin baseline opened a lower-false-change but lower-recall tradeoff, lowering only max_event_proposals from 16 to 15 on the restored plain window1 branch improved recall and secondary metrics but worsened false-change, additionally narrowing top-board breadth from 4 to 3 recovered the lower false-change without hurting recall, lowering only max_event_proposals one step further from 15 to 14 on that boardcands3 plain props branch kept that recovered tradeoff, and follow-up props14 probes showed top1 was an exact no-op, boardcands3 was the local board-width sweet spot, beam3 was worse, and beam5 was an exact no-op, and raising only beam size from 4 to 6 on that stronger props14 branch to test whether the recovered tradeoff sits on an upper beam plateau or whether the no-op at beam5 was only a narrow coincidence.
autoresearch/snapshots/20260419T041200Z_hybrid_lookahead_segmental_drop1_boardcands3_ratio95_props14_top4_detect10_lwindow1_minsep4_thresh3_total150_permove125_lmargin9p5_m9p8957061767578125_r0_beam7_v493.py	0.074556	0.764870	0.721875	0.265625	0.019405	discard	Hybrid decoder keeps the baseline lookahead path unless a conservative board-only segmental pass wins the current score-gain gates, while following up the kept window1 branch after lowering lookahead window from 2 to 1 on the 9.5-margin baseline opened a lower-false-change but lower-recall tradeoff, lowering only max_event_proposals from 16 to 15 on the restored plain window1 branch improved recall and secondary metrics but worsened false-change, additionally narrowing top-board breadth from 4 to 3 recovered the lower false-change without hurting recall, lowering only max_event_proposals one step further from 15 to 14 on that boardcands3 plain props branch kept that recovered tradeoff, and follow-up props14 probes showed top1 was an exact no-op, boardcands3 was the local board-width sweet spot, beam3 was worse, and beam5 and beam6 were exact no-ops, and raising only beam size from 4 to 7 on that stronger props14 branch to test whether the recovered tradeoff continues across the upper beam range or whether the no-op plateau ends before beam7.
autoresearch/snapshots/20260419T041247Z_hybrid_lookahead_segmental_drop1_boardcands3_ratio95_props14_top4_detect10_lwindow1_minsep4_thresh3_total150_permove125_lmargin9p5_m9p8957061767578125_r0_beam8_v494.py	0.074556	0.750969	0.698171	0.265625	0.019405	discard	Hybrid decoder keeps the baseline lookahead path unless a conservative board-only segmental pass wins the current score-gain gates, while following up the kept window1 branch after lowering lookahead window from 2 to 1 on the 9.5-margin baseline opened a lower-false-change but lower-recall tradeoff, lowering only max_event_proposals from 16 to 15 on the restored plain window1 branch improved recall and secondary metrics but worsened false-change, additionally narrowing top-board breadth from 4 to 3 recovered the lower false-change without hurting recall, lowering only max_event_proposals one step further from 15 to 14 on that boardcands3 plain props branch kept that recovered tradeoff, and follow-up props14 probes showed top1 was an exact no-op, boardcands3 was the local board-width sweet spot, beam3 was worse, and beam5 through beam7 were exact no-ops, and raising only beam size from 4 to 8 on that stronger props14 branch to test whether the recovered tradeoff stays flat through the full allowed upper beam range.
autoresearch/snapshots/20260419T041342Z_hybrid_lookahead_segmental_drop1_boardcands3_ratio95_props14_top8_detect10_lwindow1_minsep4_thresh3_total150_permove125_lmargin9p5_m9p8957061767578125_r0_beam4_v495.py	0.074556	0.764870	0.721875	0.265625	0.019405	discard	Hybrid decoder keeps the baseline lookahead path unless a conservative board-only segmental pass wins the current score-gain gates, while following up the kept window1 branch after lowering lookahead window from 2 to 1 on the 9.5-margin baseline opened a lower-false-change but lower-recall tradeoff, lowering only max_event_proposals from 16 to 15 on the restored plain window1 branch improved recall and secondary metrics but worsened false-change, additionally narrowing top-board breadth from 4 to 3 recovered the lower false-change without hurting recall, lowering only max_event_proposals one step further from 15 to 14 on that boardcands3 plain props branch kept that recovered tradeoff, and follow-up props14 probes showed top1 was an exact no-op, boardcands3 was the local board-width sweet spot, beam3 was worse, beam5 through beam7 were exact no-ops, and beam8 degraded secondaries, and raising only top-move breadth from 4 to 8 on that stronger props14 branch to test whether the recovered tradeoff also sits on an upper move-width plateau or whether wider move breadth reopens a different branch.
autoresearch/snapshots/20260419T041432Z_hybrid_lookahead_segmental_drop1_boardcands3_ratio95_props14_top16_detect10_lwindow1_minsep4_thresh3_total150_permove125_lmargin9p5_m9p8957061767578125_r0_beam4_v496.py	0.074556	0.787918	0.754927	0.265625	0.020699	discard	Hybrid decoder keeps the baseline lookahead path unless a conservative board-only segmental pass wins the current score-gain gates, while following up the kept window1 branch after lowering lookahead window from 2 to 1 on the 9.5-margin baseline opened a lower-false-change but lower-recall tradeoff, lowering only max_event_proposals from 16 to 15 on the restored plain window1 branch improved recall and secondary metrics but worsened false-change, additionally narrowing top-board breadth from 4 to 3 recovered the lower false-change without hurting recall, lowering only max_event_proposals one step further from 15 to 14 on that boardcands3 plain props branch kept that recovered tradeoff, and follow-up props14 probes showed top1 was an exact no-op, boardcands3 was the local board-width sweet spot, beam3 was worse, beam5 through beam7 were exact no-ops, beam8 degraded secondaries, and raising only top-move breadth from 4 to 8 was also an exact no-op, and raising only top-move breadth from 8 to 16 on that stronger props14 branch to test whether the recovered tradeoff stays flat through the full allowed move-width range.
autoresearch/snapshots/20260419T041521Z_hybrid_lookahead_segmental_drop1_boardcands3_ratio95_props14_top12_detect10_lwindow1_minsep4_thresh3_total150_permove125_lmargin9p5_m9p8957061767578125_r0_beam4_v497.py	0.074556	0.764870	0.721875	0.265625	0.019405	discard	Hybrid decoder keeps the baseline lookahead path unless a conservative board-only segmental pass wins the current score-gain gates, while following up the kept window1 branch after lowering lookahead window from 2 to 1 on the 9.5-margin baseline opened a lower-false-change but lower-recall tradeoff, lowering only max_event_proposals from 16 to 15 on the restored plain window1 branch improved recall and secondary metrics but worsened false-change, additionally narrowing top-board breadth from 4 to 3 recovered the lower false-change without hurting recall, lowering only max_event_proposals one step further from 15 to 14 on that boardcands3 plain props branch kept that recovered tradeoff, and follow-up props14 probes showed top1 was an exact no-op, boardcands3 was the local board-width sweet spot, beam3 was worse, beam5 through beam7 were exact no-ops, beam8 degraded secondaries, top8 was an exact no-op, and top16 reopened the worse false-change regime, and raising only top-move breadth from 8 to 12 on that stronger props14 branch to localize where the upper move-width cliff begins.
autoresearch/snapshots/20260419T041612Z_hybrid_lookahead_segmental_drop1_boardcands3_ratio95_props14_top14_detect10_lwindow1_minsep4_thresh3_total150_permove125_lmargin9p5_m9p8957061767578125_r0_beam4_v498.py	0.074556	0.787918	0.754927	0.265625	0.020699	discard	Hybrid decoder keeps the baseline lookahead path unless a conservative board-only segmental pass wins the current score-gain gates, while following up the kept window1 branch after lowering lookahead window from 2 to 1 on the 9.5-margin baseline opened a lower-false-change but lower-recall tradeoff, lowering only max_event_proposals from 16 to 15 on the restored plain window1 branch improved recall and secondary metrics but worsened false-change, additionally narrowing top-board breadth from 4 to 3 recovered the lower false-change without hurting recall, lowering only max_event_proposals one step further from 15 to 14 on that boardcands3 plain props branch kept that recovered tradeoff, and follow-up props14 probes showed top1 was an exact no-op, boardcands3 was the local board-width sweet spot, beam3 was worse, beam5 through beam7 were exact no-ops, beam8 degraded secondaries, top8 and top12 were exact no-ops, and top16 reopened the worse false-change regime, and raising only top-move breadth from 12 to 14 on that stronger props14 branch to continue localizing where the upper move-width cliff begins.
autoresearch/snapshots/20260419T041658Z_hybrid_lookahead_segmental_drop1_boardcands3_ratio95_props14_top13_detect10_lwindow1_minsep4_thresh3_total150_permove125_lmargin9p5_m9p8957061767578125_r0_beam4_v499.py	0.074556	0.764870	0.721875	0.265625	0.019405	discard	Hybrid decoder keeps the baseline lookahead path unless a conservative board-only segmental pass wins the current score-gain gates, while following up the kept window1 branch after lowering lookahead window from 2 to 1 on the 9.5-margin baseline opened a lower-false-change but lower-recall tradeoff, lowering only max_event_proposals from 16 to 15 on the restored plain window1 branch improved recall and secondary metrics but worsened false-change, additionally narrowing top-board breadth from 4 to 3 recovered the lower false-change without hurting recall, lowering only max_event_proposals one step further from 15 to 14 on that boardcands3 plain props branch kept that recovered tradeoff, and follow-up props14 probes showed top1 was an exact no-op, boardcands3 was the local board-width sweet spot, beam3 was worse, beam5 through beam7 were exact no-ops, beam8 degraded secondaries, top8 and top12 were exact no-ops, and top14 and top16 reopened the worse false-change regime, and raising only top-move breadth from 12 to 13 on that stronger props14 branch to localize the upper move-width cliff more precisely.
autoresearch/snapshots/20260419T041809Z_hybrid_lookahead_segmental_drop1_boardcands3_ratio95_props14_top4_detect10_lwindow1_minsep4_thresh3_total150_permove125_lmargin9p5_m9p8957061767578125_r1_beam4_v500.py	0.074556	0.764870	0.721875	0.265625	0.019405	discard	Hybrid decoder keeps the baseline lookahead path unless a conservative board-only segmental pass wins the current score-gain gates, while following up the kept window1 branch after lowering lookahead window from 2 to 1 on the 9.5-margin baseline opened a lower-false-change but lower-recall tradeoff, lowering only max_event_proposals from 16 to 15 on the restored plain window1 branch improved recall and secondary metrics but worsened false-change, additionally narrowing top-board breadth from 4 to 3 recovered the lower false-change without hurting recall, lowering only max_event_proposals one step further from 15 to 14 on that boardcands3 plain props branch kept that recovered tradeoff, and follow-up props14 probes showed top1 through top13 were exact no-ops while top14 and above reopened the worse false-change regime, boardcands3 was the local board-width sweet spot, beam5 through beam7 were exact no-ops while beam3 and beam8 were worse, and adding only segmental event window radius 1 on that stronger props14 branch to test whether a little extra local temporal context changes the otherwise-saturated recovered tradeoff.
autoresearch/snapshots/20260419T041931Z_hybrid_lookahead_segmental_drop0_boardcands3_ratio95_props14_top4_detect10_lwindow1_minsep4_thresh3_total150_permove125_lmargin9p5_m9p8957061767578125_r0_beam4_v501.py	0.074556	0.795101	0.755456	0.218750	0.012937	keep	Hybrid decoder keeps the baseline lookahead path unless a conservative board-only segmental pass wins the current score-gain gates, while following up the kept window1 branch after lowering lookahead window from 2 to 1 on the 9.5-margin baseline opened a lower-false-change but lower-recall tradeoff, lowering only max_event_proposals from 16 to 15 on the restored plain window1 branch improved recall and secondary metrics but worsened false-change, additionally narrowing top-board breadth from 4 to 3 recovered the lower false-change without hurting recall, lowering only max_event_proposals one step further from 15 to 14 on that boardcands3 plain props branch kept that recovered tradeoff, and follow-up props14 probes showed top1 through top13 were exact no-ops while top14 and above reopened the worse false-change regime, boardcands3 was the local board-width sweet spot, beam5 through beam7 were exact no-ops while beam3 and beam8 were worse, and event_window_radius=1 was an exact no-op, and lowering only segment_board_drop_worst_frames from 1 to 0 on that stronger props14 branch to test whether the tighter proposal budget changes the earlier drop0 recall-versus-noise tradeoff.
autoresearch/snapshots/20260419T042029Z_hybrid_lookahead_segmental_drop0_boardcands2_ratio95_props14_top4_detect10_lwindow1_minsep4_thresh3_total150_permove125_lmargin9p5_m9p8957061767578125_r0_beam4_v502.py	0.074556	0.787866	0.745631	0.218750	0.012937	discard	Hybrid decoder keeps the baseline lookahead path unless a conservative board-only segmental pass wins the current score-gain gates, while following up the kept window1 branch after lowering lookahead window from 2 to 1 on the 9.5-margin baseline opened a lower-false-change but lower-recall tradeoff, lowering only max_event_proposals from 16 to 15 on the restored plain window1 branch improved recall and secondary metrics but worsened false-change, additionally narrowing top-board breadth from 4 to 3 recovered the lower false-change without hurting recall, lowering only max_event_proposals one step further from 15 to 14 on that boardcands3 plain props branch kept that recovered tradeoff, follow-up props14 probes showed top1 through top13 were exact no-ops while top14 and above reopened the worse false-change regime, boardcands3 was the local board-width sweet spot, beam5 through beam7 were exact no-ops while beam3 and beam8 were worse, event_window_radius=1 was an exact no-op, and lowering segment_board_drop_worst_frames from 1 to 0 on that stronger props14 branch produced a new kept low-noise / lower-recall tradeoff, and lowering only top-board breadth from 3 to 2 on that new drop0 + props14 branch to test whether the tighter board menu can recover some recall while preserving the improved false-change.
