snapshot	board_exact	non_empty_accuracy	macro_f1	move_recall	false_change_rate	status	description
autoresearch/snapshots/20260419T211448Z_hybrid_p8_m8_w3_g142p3393809000651089036182384006679058074951171888552527156068805425093160010874271392822265625_v991.py	0.071006	0.799339	0.749250	0.375000	0.020699	discard	Restore the compact props8 + minsep8 hybrid shelf anchored at lwindow3, beam3, top4, boardcands2, secsep1, radius0, drop1, props8, total150, and lmargin9.935836791992188. The latest executed bracket is harmful at 142.3393809000651089036182384006679058074951171766579782751449556599254719913005828857421875 and exact-flat at 142.339380900065108903618238400667905807495117201052527156068805425093160010874271392822265625, so this run restores the same shelf anchor and raises only min_score_gain_per_added_move to 142.3393809000651089036182384006679058074951171888552527156068805425093160010874271392822265625 to continue binary-searching that lower edge. The experiment name remains shortened to avoid the filename-too-long failure seen with long autogenerated names.
autoresearch/snapshots/20260419T211658Z_hybrid_p8_m8_w3_g142p33938090006510890361823840066790580749511718275661549537591810121739399619400501251220703125_v992.py	0.071006	0.789778	0.739821	0.375000	0.024580	discard	Restore the compact props8 + minsep8 hybrid shelf anchored at lwindow3, beam3, top4, boardcands2, secsep1, radius0, drop1, props8, total150, and lmargin9.935836791992188. The latest executed bracket is harmful at 142.3393809000651089036182384006679058074951171766579782751449556599254719913005828857421875 and exact-flat at 142.3393809000651089036182384006679058074951171888552527156068805425093160010874271392822265625, so this run restores the same shelf anchor and raises only min_score_gain_per_added_move to 142.33938090006510890361823840066790580749511718275661549537591810121739399619400501251220703125 to continue binary-searching that lower edge. The experiment name remains shortened to avoid the filename-too-long failure seen with long autogenerated names.
autoresearch/snapshots/20260419T211909Z_hybrid_p8_m8_w3_g142p339380900065108903618238400667905807495117185805934105491399321863354998640716075897216796875_v993.py	0.071006	0.789778	0.739821	0.375000	0.024580	discard	Restore the compact props8 + minsep8 hybrid shelf anchored at lwindow3, beam3, top4, boardcands2, secsep1, radius0, drop1, props8, total150, and lmargin9.935836791992188. The latest executed bracket is harmful at 142.33938090006510890361823840066790580749511718275661549537591810121739399619400501251220703125 and exact-flat at 142.3393809000651089036182384006679058074951171888552527156068805425093160010874271392822265625, so this run restores the same shelf anchor and raises only min_score_gain_per_added_move to 142.339380900065108903618238400667905807495117185805934105491399321863354998640716075897216796875 to continue binary-searching that lower edge. The experiment name remains shortened to avoid the filename-too-long failure seen with long autogenerated names.
autoresearch/snapshots/20260419T212124Z_hybrid_p8_m8_w3_g142p3393809000651089036182384006679058074951171873305934105491399321863354998640716075897216796875_v994.py	0.071006	0.789778	0.739821	0.375000	0.024580	discard	Restore the compact props8 + minsep8 hybrid shelf anchored at lwindow3, beam3, top4, boardcands2, secsep1, radius0, drop1, props8, total150, and lmargin9.935836791992188. The latest executed bracket is harmful at 142.339380900065108903618238400667905807495117185805934105491399321863354998640716075897216796875 and exact-flat at 142.3393809000651089036182384006679058074951171888552527156068805425093160010874271392822265625, so this run restores the same shelf anchor and raises only min_score_gain_per_added_move to 142.3393809000651089036182384006679058074951171873305934105491399321863354998640716075897216796875 to continue binary-searching that lower edge. The experiment name remains shortened to avoid the filename-too-long failure seen with long autogenerated names.
autoresearch/snapshots/20260419T212342Z_hybrid_p8_m8_w3_g142p33938090006510890361823840066790580749511718809292306307801023734782575047574937343597412109375_v995.py	0.071006	0.799339	0.749250	0.375000	0.020699	discard	Restore the compact props8 + minsep8 hybrid shelf anchored at lwindow3, beam3, top4, boardcands2, secsep1, radius0, drop1, props8, total150, and lmargin9.935836791992188. The latest executed bracket is harmful at 142.3393809000651089036182384006679058074951171873305934105491399321863354998640716075897216796875 and exact-flat at 142.3393809000651089036182384006679058074951171888552527156068805425093160010874271392822265625, so this run restores the same shelf anchor and raises only min_score_gain_per_added_move to 142.33938090006510890361823840066790580749511718809292306307801023734782575047574937343597412109375 to continue binary-searching that lower edge. The experiment name remains shortened to avoid the filename-too-long failure seen with long autogenerated names.
autoresearch/snapshots/20260419T212552Z_hybrid_p8_m8_w3_g142p339380900065108903618238400667905807495117187711758236813575084767080625169910490512847900390625_v996.py	0.071006	0.799339	0.749250	0.375000	0.020699	discard	Restore the compact props8 + minsep8 hybrid shelf anchored at lwindow3, beam3, top4, boardcands2, secsep1, radius0, drop1, props8, total150, and lmargin9.935836791992188. The latest executed bracket is harmful at 142.3393809000651089036182384006679058074951171873305934105491399321863354998640716075897216796875 and exact-flat at 142.33938090006510890361823840066790580749511718809292306307801023734782575047574937343597412109375, so this run restores the same shelf anchor and raises only min_score_gain_per_added_move to 142.339380900065108903618238400667905807495117187711758236813575084767080625169910490512847900390625 to continue binary-searching that lower edge. The experiment name remains shortened to avoid the filename-too-long failure seen with long autogenerated names.
autoresearch/snapshots/20260419T212810Z_hybrid_p8_m8_w3_g142p3393809000651089036182384006679058074951171875211758236813575084767080625169910490512847900390625_v997.py	0.071006	0.799339	0.749250	0.375000	0.020699	discard	Restore the compact props8 + minsep8 hybrid shelf anchored at lwindow3, beam3, top4, boardcands2, secsep1, radius0, drop1, props8, total150, and lmargin9.935836791992188. The latest executed bracket is harmful at 142.3393809000651089036182384006679058074951171873305934105491399321863354998640716075897216796875 and exact-flat at 142.339380900065108903618238400667905807495117187711758236813575084767080625169910490512847900390625, so this run restores the same shelf anchor and raises only min_score_gain_per_added_move to 142.3393809000651089036182384006679058074951171875211758236813575084767080625169910490512847900390625 to continue binary-searching that lower edge. The experiment name remains shortened to avoid the filename-too-long failure seen with long autogenerated names.
autoresearch/snapshots/20260419T213027Z_hybrid_p8_m8_w3_g142p33938090006510890361823840066790580749511718742588461711524872033152178119053132832050323486328125_v998.py	0.071006	0.789778	0.739821	0.375000	0.024580	discard	Restore the compact props8 + minsep8 hybrid shelf anchored at lwindow3, beam3, top4, boardcands2, secsep1, radius0, drop1, props8, total150, and lmargin9.935836791992188. The latest executed bracket is harmful at 142.3393809000651089036182384006679058074951171873305934105491399321863354998640716075897216796875 and exact-flat at 142.3393809000651089036182384006679058074951171875211758236813575084767080625169910490512847900390625, so this run restores the same shelf anchor and raises only min_score_gain_per_added_move to 142.33938090006510890361823840066790580749511718742588461711524872033152178119053132832050323486328125 to continue binary-searching that lower edge. The experiment name remains shortened to avoid the filename-too-long failure seen with long autogenerated names.
autoresearch/snapshots/20260419T213241Z_hybrid_p8_m8_w3_g142p339380900065108903618238400667905807495117187473530220398303114404114921853761188685894012451171875_v999.py	0.071006	0.789778	0.739821	0.375000	0.024580	discard	Restore the compact props8 + minsep8 hybrid shelf anchored at lwindow3, beam3, top4, boardcands2, secsep1, radius0, drop1, props8, total150, and lmargin9.935836791992188. The latest executed bracket is harmful at 142.33938090006510890361823840066790580749511718742588461711524872033152178119053132832050323486328125 and exact-flat at 142.3393809000651089036182384006679058074951171875211758236813575084767080625169910490512847900390625, so this run restores the same shelf anchor and raises only min_score_gain_per_added_move to 142.339380900065108903618238400667905807495117187473530220398303114404114921853761188685894012451171875 to continue binary-searching that lower edge. The experiment name remains shortened to avoid the filename-too-long failure seen with long autogenerated names.
autoresearch/snapshots/20260419T213455Z_hybrid_p8_m8_w3_g142p3393809000651089036182384006679058074951171874973530220398303114404114921853761188685894012451171875_v1000.py	0.071006	0.789778	0.739821	0.375000	0.024580	discard	Restore the compact props8 + minsep8 hybrid shelf anchored at lwindow3, beam3, top4, boardcands2, secsep1, radius0, drop1, props8, total150, and lmargin9.935836791992188. The latest executed bracket is harmful at 142.339380900065108903618238400667905807495117187473530220398303114404114921853761188685894012451171875 and exact-flat at 142.3393809000651089036182384006679058074951171875211758236813575084767080625169910490512847900390625, so this run restores the same shelf anchor and raises only min_score_gain_per_added_move to 142.3393809000651089036182384006679058074951171874973530220398303114404114921853761188685894012451171875 to continue binary-searching that lower edge. The experiment name remains shortened to avoid the filename-too-long failure seen with long autogenerated names.
autoresearch/snapshots/20260419T213722Z_hybrid_p8_m8_w3_g142p33938090006510890361823840066790580749511718750926442286059390995855977735118358395993709564208984375_v1001.py	0.071006	0.799339	0.749250	0.375000	0.020699	discard	Restore the compact props8 + minsep8 hybrid shelf anchored at lwindow3, beam3, top4, boardcands2, secsep1, radius0, drop1, props8, total150, and lmargin9.935836791992188. The latest executed bracket is harmful at 142.3393809000651089036182384006679058074951171874973530220398303114404114921853761188685894012451171875 and exact-flat at 142.3393809000651089036182384006679058074951171875211758236813575084767080625169910490512847900390625, so this run restores the same shelf anchor and raises only min_score_gain_per_added_move to 142.33938090006510890361823840066790580749511718750926442286059390995855977735118358395993709564208984375 to continue binary-searching that lower edge. The experiment name remains shortened to avoid the filename-too-long failure seen with long autogenerated names.
autoresearch/snapshots/20260419T213941Z_hybrid_p8_m8_w3_g142p339380900065108903618238400667905807495117187503308722450212110699485634768279851414263248443603515625_v1002.py	0.071006	0.799339	0.749250	0.375000	0.020699	discard	Restore the compact props8 + minsep8 hybrid shelf anchored at lwindow3, beam3, top4, boardcands2, secsep1, radius0, drop1, props8, total150, and lmargin9.935836791992188. The latest executed bracket is harmful at 142.3393809000651089036182384006679058074951171874973530220398303114404114921853761188685894012451171875 and exact-flat at 142.33938090006510890361823840066790580749511718750926442286059390995855977735118358395993709564208984375, so this run restores the same shelf anchor and raises only min_score_gain_per_added_move to 142.339380900065108903618238400667905807495117187503308722450212110699485634768279851414263248443603515625 to continue binary-searching that lower edge. The experiment name remains shortened to avoid the filename-too-long failure seen with long autogenerated names.
autoresearch/snapshots/20260419T214203Z_hybrid_p8_m8_w3_g142p3393809000651089036182384006679058074951171875003308722450212110699485634768279851414263248443603515625_v1003.py	0.071006	0.799339	0.749250	0.375000	0.020699	discard	Restore the compact props8 + minsep8 hybrid shelf anchored at lwindow3, beam3, top4, boardcands2, secsep1, radius0, drop1, props8, total150, and lmargin9.935836791992188. The latest executed bracket is harmful at 142.3393809000651089036182384006679058074951171874973530220398303114404114921853761188685894012451171875 and exact-flat at 142.339380900065108903618238400667905807495117187503308722450212110699485634768279851414263248443603515625, so this run restores the same shelf anchor and raises only min_score_gain_per_added_move to 142.3393809000651089036182384006679058074951171875003308722450212110699485634768279851414263248443603515625 to continue binary-searching that lower edge. The experiment name remains shortened to avoid the filename-too-long failure seen with long autogenerated names.
autoresearch/snapshots/20260419T214435Z_hybrid_p8_m8_w3_g142p33938090006510890361823840066790580749511718749884194714242576125518002783110205200500786304473876953125_v1004.py	0.071006	0.789778	0.739821	0.375000	0.024580	discard	Restore the compact props8 + minsep8 hybrid shelf anchored at lwindow3, beam3, top4, boardcands2, secsep1, radius0, drop1, props8, total150, and lmargin9.935836791992188. The latest executed bracket is harmful at 142.3393809000651089036182384006679058074951171874973530220398303114404114921853761188685894012451171875 and exact-flat at 142.3393809000651089036182384006679058074951171875003308722450212110699485634768279851414263248443603515625, so this run restores the same shelf anchor and raises only min_score_gain_per_added_move to 142.33938090006510890361823840066790580749511718749884194714242576125518002783110205200500786304473876953125 to continue binary-searching that lower edge. The experiment name remains shortened to avoid the filename-too-long failure seen with long autogenerated names.
autoresearch/snapshots/20260419T214658Z_hybrid_p8_m8_w3_g142p339380900065108903618238400667905807495117187499586409693723486162564295653965018573217093944549560546875_v1005.py	0.071006	0.789778	0.739821	0.375000	0.024580	discard	Restore the compact props8 + minsep8 hybrid shelf anchored at lwindow3, beam3, top4, boardcands2, secsep1, radius0, drop1, props8, total150, and lmargin9.935836791992188. The latest executed bracket is harmful at 142.33938090006510890361823840066790580749511718749884194714242576125518002783110205200500786304473876953125 and exact-flat at 142.3393809000651089036182384006679058074951171875003308722450212110699485634768279851414263248443603515625, so this run restores the same shelf anchor and raises only min_score_gain_per_added_move to 142.339380900065108903618238400667905807495117187499586409693723486162564295653965018573217093944549560546875 to continue binary-searching that lower edge. The experiment name remains shortened to avoid the filename-too-long failure seen with long autogenerated names.
autoresearch/snapshots/20260419T214925Z_hybrid_p8_m8_w3_g142p3393809000651089036182384006679058074951171874999586409693723486162564295653965018573217093944549560546875_v1006.py	0.071006	0.789778	0.739821	0.375000	0.024580	discard	Restore the compact props8 + minsep8 hybrid shelf anchored at lwindow3, beam3, top4, boardcands2, secsep1, radius0, drop1, props8, total150, and lmargin9.935836791992188. The latest executed bracket is harmful at 142.339380900065108903618238400667905807495117187499586409693723486162564295653965018573217093944549560546875 and exact-flat at 142.3393809000651089036182384006679058074951171875003308722450212110699485634768279851414263248443603515625, so this run restores the same shelf anchor and raises only min_score_gain_per_added_move to 142.3393809000651089036182384006679058074951171874999586409693723486162564295653965018573217093944549560546875 to continue binary-searching that lower edge. The experiment name remains shortened to avoid the filename-too-long failure seen with long autogenerated names.
autoresearch/snapshots/20260419T215144Z_hybrid_p8_m8_w3_g142p33938090006510890361823840066790580749511718750014475660719677984310249652111224349937401711940765380859375_v1007.py	0.071006	0.799339	0.749250	0.375000	0.020699	discard	Restore the compact props8 + minsep8 hybrid shelf anchored at lwindow3, beam3, top4, boardcands2, secsep1, radius0, drop1, props8, total150, and lmargin9.935836791992188. The latest executed bracket is harmful at 142.3393809000651089036182384006679058074951171874999586409693723486162564295653965018573217093944549560546875 and exact-flat at 142.3393809000651089036182384006679058074951171875003308722450212110699485634768279851414263248443603515625, so this run restores the same shelf anchor and raises only min_score_gain_per_added_move to 142.33938090006510890361823840066790580749511718750014475660719677984310249652111224349937401711940765380859375 to continue binary-searching that lower edge. The experiment name remains shortened to avoid the filename-too-long failure seen with long autogenerated names.
autoresearch/snapshots/20260419T215403Z_hybrid_p8_m8_w3_g142p339380900065108903618238400667905807495117187500051698788284564229679463043254372678347863256931304931640625_v1008.py	0.071006	0.799339	0.749250	0.375000	0.020699	discard	Restore the compact props8 + minsep8 hybrid shelf anchored at lwindow3, beam3, top4, boardcands2, secsep1, radius0, drop1, props8, total150, and lmargin9.935836791992188. The latest executed bracket is harmful at 142.3393809000651089036182384006679058074951171874999586409693723486162564295653965018573217093944549560546875 and exact-flat at 142.33938090006510890361823840066790580749511718750014475660719677984310249652111224349937401711940765380859375, so this run restores the same shelf anchor and raises only min_score_gain_per_added_move to 142.339380900065108903618238400667905807495117187500051698788284564229679463043254372678347863256931304931640625 to continue binary-searching that lower edge. The experiment name remains shortened to avoid the filename-too-long failure seen with long autogenerated names.
autoresearch/snapshots/20260419T215626Z_hybrid_p8_m8_w3_g142p3393809000651089036182384006679058074951171875000051698788284564229679463043254372678347863256931304931640625_v1009.py	0.071006	0.799339	0.749250	0.375000	0.020699	discard	Restore the compact props8 + minsep8 hybrid shelf anchored at lwindow3, beam3, top4, boardcands2, secsep1, radius0, drop1, props8, total150, and lmargin9.935836791992188. The latest executed bracket is harmful at 142.3393809000651089036182384006679058074951171874999586409693723486162564295653965018573217093944549560546875 and exact-flat at 142.339380900065108903618238400667905807495117187500051698788284564229679463043254372678347863256931304931640625, so this run restores the same shelf anchor and raises only min_score_gain_per_added_move to 142.3393809000651089036182384006679058074951171875000051698788284564229679463043254372678347863256931304931640625 to continue binary-searching that lower edge. The experiment name remains shortened to avoid the filename-too-long failure seen with long autogenerated names.
autoresearch/snapshots/20260419T215849Z_hybrid_p8_m8_w3_g142p33938090006510890361823840066790580749511718749998190542410040251961218793486096956257824786007404327392578125_v1010.py	0.071006	0.789778	0.739821	0.375000	0.024580	discard	Restore the compact props8 + minsep8 hybrid shelf anchored at lwindow3, beam3, top4, boardcands2, secsep1, radius0, drop1, props8, total150, and lmargin9.935836791992188. The latest executed bracket is harmful at 142.3393809000651089036182384006679058074951171874999586409693723486162564295653965018573217093944549560546875 and exact-flat at 142.3393809000651089036182384006679058074951171875000051698788284564229679463043254372678347863256931304931640625, so this run restores the same shelf anchor and raises only min_score_gain_per_added_move to 142.33938090006510890361823840066790580749511718749998190542410040251961218793486096956257824786007404327392578125 to continue binary-searching that lower edge. The experiment name remains shortened to avoid the filename-too-long failure seen with long autogenerated names.
autoresearch/snapshots/20260419T220123Z_hybrid_p8_m8_w3_g142p339380900065108903618238400667905807495117187499993537651464429471290067119593203415206517092883586883544921875_v1011.py	0.071006	0.789778	0.739821	0.375000	0.024580	discard	Restore the compact props8 + minsep8 hybrid shelf anchored at lwindow3, beam3, top4, boardcands2, secsep1, radius0, drop1, props8, total150, and lmargin9.935836791992188. The latest executed bracket is harmful at 142.33938090006510890361823840066790580749511718749998190542410040251961218793486096956257824786007404327392578125 and exact-flat at 142.3393809000651089036182384006679058074951171875000051698788284564229679463043254372678347863256931304931640625, so this run restores the same shelf anchor and raises only min_score_gain_per_added_move to 142.339380900065108903618238400667905807495117187499993537651464429471290067119593203415206517092883586883544921875 to continue binary-searching that lower edge. The experiment name remains shortened to avoid the filename-too-long failure seen with long autogenerated names.
