snapshot	board_exact	non_empty_accuracy	macro_f1	move_recall	false_change_rate	status	description
autoresearch/snapshots/20260420T052217Z_hybrid_p8_m8_w3_v1281.py	0.071006	0.789778	0.739821	0.375000	0.024580	discard	Restore the compact props8 + minsep8 hybrid shelf anchored at lwindow3, beam3, top4, boardcands2, secsep1, radius0, drop1, props8, total150, and lmargin9.935836791992188. The latest executed bracket is harmful at 142.33938090006510890361823840066790580749511718749999999999999999999999999999999999999999999999999999999999999999999999999999997447028217163452001938826603990943428492222025826006215007472007717723113987726506578854834896768475973683474528657158542278638021961122996853418096566894584152185987703687836404691172880474375182869380303263273646052766707725822925567626953125 and exact-flat at 142.339380900065108903618238400667905807495117187500000000000000000000000000000000000000000000000000000000000000000000000000000020009354263743617006932635148951580497270910560758190720450620623768440483824281184460231708940512140475927529222135553726904554549189236647754449131674320819954349283924970117638036277339156765981719224810342350195924154832027852535247802734375. This run prepares their exact midpoint, 142.3393809000651089036182384006679058074951171874999999999999999999999999999999999999999999999999999999999999999999999999999999972398182176890685131604505944305073910965654095091264352626703504728358118507731251243900289540984501063811372543535695748454673844002333081443150486716333307381045804809242408424740030719502589052065139214875433282259109546430408954620361328125, with a short experiment name to avoid filename-too-long failures.
autoresearch/snapshots/20260420T052330Z_hybrid_p8_m8_w3_v1282.py	0.071006	0.799339	0.749250	0.375000	0.020699	discard	Restore the compact props8 + minsep8 hybrid shelf anchored at lwindow3, beam3, top4, boardcands2, secsep1, radius0, drop1, props8, total150, and lmargin9.935836791992188. The latest executed bracket is harmful at 142.3393809000651089036182384006679058074951171874999999999999999999999999999999999999999999999999999999999999999999999999999999972398182176890685131604505944305073910965654095091264352626703504728358118507731251243900289540984501063811372543535695748454673844002333081443150486716333307381045804809242408424740030719502589052065139214875433282259109546430408954620361328125 and exact-flat at 142.339380900065108903618238400667905807495117187500000000000000000000000000000000000000000000000000000000000000000000000000000020009354263743617006932635148951580497270910560758190720450620623768440483824281184460231708940512140475927529222135553726904554549189236647754449131674320819954349283924970117638036277339156765981719224810342350195924154832027852535247802734375. This run prepares their exact midpoint, 142.33938090006510890361823840066790580749511718750000000000000000000000000000000000000000000000000000000000000000000000000000000862458624071634276004654287169104394418373798513365857785664548712063814783752715479231086894730529529115433323824456165087501096679473497794938209017297707534622693220294717924025514020555351244346286936591494676207503289333544671535491943359375, with a short experiment name to avoid filename-too-long failures.
autoresearch/snapshots/20260420T052454Z_hybrid_p8_m8_w3_v1283.py	0.071006	0.799339	0.749250	0.375000	0.020699	discard	Restore the compact props8 + minsep8 hybrid shelf anchored at lwindow3, beam3, top4, boardcands2, secsep1, radius0, drop1, props8, total150, and lmargin9.935836791992188. The latest executed bracket is harmful at 142.3393809000651089036182384006679058074951171874999999999999999999999999999999999999999999999999999999999999999999999999999999972398182176890685131604505944305073910965654095091264352626703504728358118507731251243900289540984501063811372543535695748454673844002333081443150486716333307381045804809242408424740030719502589052065139214875433282259109546430408954620361328125 and exact-flat at 142.33938090006510890361823840066790580749511718750000000000000000000000000000000000000000000000000000000000000000000000000000000862458624071634276004654287169104394418373798513365857785664548712063814783752715479231086894730529529115433323824456165087501096679473497794938209017297707534622693220294717924025514020555351244346286936591494676207503289333544671535491943359375. This run prepares their exact midpoint, 142.339380900065108903618238400667905807495117187500000000000000000000000000000000000000000000000000000000000000000000000000000002932202229202705636603496733060775667640151697321392506559657918796736979844150139958350448950701872698767735246299065612860239175597484143046848569422305203042165756341935710041364571638751885674334691643701245045150471923989243805408477783203125, with a short experiment name to avoid filename-too-long failures.
autoresearch/snapshots/20260420T052636Z_hybrid_p8_m8_w3_v1284.py	0.071006	0.799339	0.749250	0.375000	0.020699	discard	Restore the compact props8 + minsep8 hybrid shelf anchored at lwindow3, beam3, top4, boardcands2, secsep1, radius0, drop1, props8, total150, and lmargin9.935836791992188. The latest executed bracket is harmful at 142.3393809000651089036182384006679058074951171874999999999999999999999999999999999999999999999999999999999999999999999999999999972398182176890685131604505944305073910965654095091264352626703504728358118507731251243900289540984501063811372543535695748454673844002333081443150486716333307381045804809242408424740030719502589052065139214875433282259109546430408954620361328125 and exact-flat at 142.339380900065108903618238400667905807495117187500000000000000000000000000000000000000000000000000000000000000000000000000000002932202229202705636603496733060775667640151697321392506559657918796736979844150139958350448950701872698767735246299065612860239175597484143046848569422305203042165756341935710041364571638751885674334691643701245045150471923989243805408477783203125. This run prepares their exact midpoint, 142.3393809000651089036182384006679058074951171875000000000000000000000000000000000000000000000000000000000000000000000000000000000860102234458870748819736637456415293683585534152594709111641346347863958474616325413702389524001614025744362503263175938528532799988587255955818090469692668901351684114299754419192873553510722897706027825943941866881914393161423504352569580078125, with a short experiment name to avoid filename-too-long failures.
autoresearch/snapshots/20260420T052752Z_hybrid_p8_m8_w3_v1285.py	0.071006	0.789778	0.739821	0.375000	0.024580	discard	Restore the compact props8 + minsep8 hybrid shelf anchored at lwindow3, beam3, top4, boardcands2, secsep1, radius0, drop1, props8, total150, and lmargin9.935836791992188. The latest executed bracket is harmful at 142.3393809000651089036182384006679058074951171874999999999999999999999999999999999999999999999999999999999999999999999999999999972398182176890685131604505944305073910965654095091264352626703504728358118507731251243900289540984501063811372543535695748454673844002333081443150486716333307381045804809242408424740030719502589052065139214875433282259109546430408954620361328125 and exact-flat at 142.3393809000651089036182384006679058074951171875000000000000000000000000000000000000000000000000000000000000000000000000000000000860102234458870748819736637456415293683585534152594709111641346347863958474616325413702389524001614025744362503263175938528532799988587255955818090469692668901351684114299754419192873553510722897706027825943941866881914393161423504352569580078125. This run prepares their exact midpoint, 142.33938090006510890361823840066790580749511718749999999999999999999999999999999999999999999999999999999999999999999999999999999866291422056747779402121212908807446023246198146219295308691724255381110384911737883288013395324930575447778675233994358434916033219954601686994842885930129881411987444617710814219664521365066559748855835204096875745705119697959162294864654541015625, with a short experiment name to avoid filename-too-long failures.
autoresearch/snapshots/20260420T052906Z_hybrid_p8_m8_w3_v1286.py	0.071006	0.789778	0.739821	0.375000	0.024580	discard	Restore the compact props8 + minsep8 hybrid shelf anchored at lwindow3, beam3, top4, boardcands2, secsep1, radius0, drop1, props8, total150, and lmargin9.935836791992188. The latest executed bracket is harmful at 142.33938090006510890361823840066790580749511718749999999999999999999999999999999999999999999999999999999999999999999999999999999866291422056747779402121212908807446023246198146219295308691724255381110384911737883288013395324930575447778675233994358434916033219954601686994842885930129881411987444617710814219664521365066559748855835204096875745705119697959162294864654541015625 and exact-flat at 142.3393809000651089036182384006679058074951171875000000000000000000000000000000000000000000000000000000000000000000000000000000000860102234458870748819736637456415293683585534152594709111641346347863958474616325413702389524001614025744362503263175938528532799988587255955818090469692668901351684114299754419192873553510722897706027825943941866881914393161423504352569580078125. This run prepares their exact midpoint, 142.339380900065108903618238400667905807495117187499999999999999999999999999999999999999999999999999999999999999999999999999999999374462222006682434451592896416857994800410267438726211999040688594298749848289505687125186452824733578526111501333130589101006806099202371232765118953135282852127521428803541792057966284500868943629580567317681472072621318147866986691951751708984375, with a short experiment name to avoid filename-too-long failures.
autoresearch/snapshots/20260420T053023Z_hybrid_p8_m8_w3_v1287.py	0.071006	0.789778	0.739821	0.375000	0.024580	discard	Restore the compact props8 + minsep8 hybrid shelf anchored at lwindow3, beam3, top4, boardcands2, secsep1, radius0, drop1, props8, total150, and lmargin9.935836791992188. The latest executed bracket is harmful at 142.339380900065108903618238400667905807495117187499999999999999999999999999999999999999999999999999999999999999999999999999999999374462222006682434451592896416857994800410267438726211999040688594298749848289505687125186452824733578526111501333130589101006806099202371232765118953135282852127521428803541792057966284500868943629580567317681472072621318147866986691951751708984375 and exact-flat at 142.3393809000651089036182384006679058074951171875000000000000000000000000000000000000000000000000000000000000000000000000000000000860102234458870748819736637456415293683585534152594709111641346347863958474616325413702389524001614025744362503263175938528532799988587255955818090469692668901351684114299754419192873553510722897706027825943941866881914393161423504352569580078125. This run prepares their exact midpoint, 142.3393809000651089036182384006679058074951171874999999999999999999999999999999999999999999999999999999999999999999999999999999997302362227262847546667832800812497620843844104269928414551024116145425728478755691142477127026124474905502738758297240914769300430490305484141734640000522748711313449201167586169886268199259706167000916749560378293804063787320046685636043548583984375, with a short experiment name to avoid filename-too-long failures.
autoresearch/snapshots/20260420T053138Z_hybrid_p8_m8_w3_v1288.py	0.071006	0.789778	0.739821	0.375000	0.024580	discard	Restore the compact props8 + minsep8 hybrid shelf anchored at lwindow3, beam3, top4, boardcands2, secsep1, radius0, drop1, props8, total150, and lmargin9.935836791992188. The latest executed bracket is harmful at 142.3393809000651089036182384006679058074951171874999999999999999999999999999999999999999999999999999999999999999999999999999999997302362227262847546667832800812497620843844104269928414551024116145425728478755691142477127026124474905502738758297240914769300430490305484141734640000522748711313449201167586169886268199259706167000916749560378293804063787320046685636043548583984375 and exact-flat at 142.3393809000651089036182384006679058074951171875000000000000000000000000000000000000000000000000000000000000000000000000000000000860102234458870748819736637456415293683585534152594709111641346347863958474616325413702389524001614025744362503263175938528532799988587255955818090469692668901351684114299754419192873553510722897706027825943941866881914393161423504352569580078125. This run prepares their exact midpoint, 142.33938090006510890361823840066790580749511718749999999999999999999999999999999999999999999999999999999999999999999999999999999990812322308608591477437847191344564572637148192112615618313327312466448434766860082780897582750630444656235506307802084266489166152394463700487763652351077088063325666577336702945395708763852145323534722877521600803429890902407350949943065643310546875, with a short experiment name to avoid filename-too-long failures.
autoresearch/snapshots/20260420T053301Z_hybrid_p8_m8_w3_v1289.py	0.071006	0.789778	0.739821	0.375000	0.024580	discard	Restore the compact props8 + minsep8 hybrid shelf anchored at lwindow3, beam3, top4, boardcands2, secsep1, radius0, drop1, props8, total150, and lmargin9.935836791992188. The latest executed bracket is harmful at 142.3393809000651089036182384006679058074951171874999999999999999999999999999999999999999999999999999999999999999999999999999999997302362227262847546667832800812497620843844104269928414551024116145425728478755691142477127026124474905502738758297240914769300430490305484141734640000522748711313449201167586169886268199259706167000916749560378293804063787320046685636043548583984375 and exact-flat at 142.3393809000651089036182384006679058074951171875000000000000000000000000000000000000000000000000000000000000000000000000000000000860102234458870748819736637456415293683585534152594709111641346347863958474616325413702389524001614025744362503263175938528532799988587255955818090469692668901351684114299754419192873553510722897706027825943941866881914393161423504352569580078125. This run prepares their exact midpoint, 142.33938090006510890361823840066790580749511718749999999999999999999999999999999999999999999999999999999999999999999999999999999990812322308608591477437847191344564572637148192112615618313327312466448434766860082780897582750630444656235506307802084266489166152394463700487763652351077088063325666577336702945395708763852145323534722877521600803429890902407350949943065643310546875, with a short experiment name to avoid filename-too-long failures.
autoresearch/snapshots/20260420T053749Z_hybrid_p8_m8_w3_v1290.py	0.071006	0.789778	0.739821	0.375000	0.024580	discard	Restore the compact props8 + minsep8 hybrid shelf anchored at lwindow3, beam3, top4, boardcands2, secsep1, radius0, drop1, props8, total150, and lmargin9.935836791992188. The latest executed bracket is harmful at 142.33938090006510890361823840066790580749511718749999999999999999999999999999999999999999999999999999999999999999999999999999999990812322308608591477437847191344564572637148192112615618313327312466448434766860082780897582750630444656235506307802084266489166152394463700487763652351077088063325666577336702945395708763852145323534722877521600803429890902407350949943065643310546875 and exact-flat at 142.3393809000651089036182384006679058074951171875000000000000000000000000000000000000000000000000000000000000000000000000000000000860102234458870748819736637456415293683585534152594709111641346347863958474616325413702389524001614025744362503263175938528532799988587255955818090469692668901351684114299754419192873553510722897706027825943941866881914393161423504352569580078125. This run prepares their exact midpoint, 142.339380900065108903618238400667905807495117187499999999999999999999999999999999999999999999999999999999999999999999999999999999997066723265986494828176067829543587547365017668192813547148703879725440097565116684589607389953232924568395656702169218258872470761401681300229722785240018885384212538601671235686622221494796871502975005684805097361245174170107929967343807220458984375, with a short experiment name to avoid filename-too-long failures.
autoresearch/snapshots/20260420T053848Z_hybrid_p8_m8_w3_v1291.py	0.071006	0.799339	0.749250	0.375000	0.020699	discard	Restore the compact props8 + minsep8 hybrid shelf anchored at lwindow3, beam3, top4, boardcands2, secsep1, radius0, drop1, props8, total150, and lmargin9.935836791992188. The latest executed bracket is harmful at 142.339380900065108903618238400667905807495117187499999999999999999999999999999999999999999999999999999999999999999999999999999999997066723265986494828176067829543587547365017668192813547148703879725440097565116684589607389953232924568395656702169218258872470761401681300229722785240018885384212538601671235686622221494796871502975005684805097361245174170107929967343807220458984375 and exact-flat at 142.3393809000651089036182384006679058074951171875000000000000000000000000000000000000000000000000000000000000000000000000000000000860102234458870748819736637456415293683585534152594709111641346347863958474616325413702389524001614025744362503263175938528532799988587255955818090469692668901351684114299754419192873553510722897706027825943941866881914393161423504352569580078125. This run prepares their exact midpoint, 142.3393809000651089036182384006679058074951171875000000000000000000000000000000000000000000000000000000000000000000000000000000000415384733559367848550748657875925584578617855417261422291564192572559179725133746129799231711766971635714159535142434060558628753801302034479057659161046428877596904750158233388029547884229345806367888941395996420247183067431251402013003826141357421875, with a short experiment name to avoid filename-too-long failures.
autoresearch/snapshots/20260420T053954Z_hybrid_p8_m8_w3_v1292.py	0.071006	0.799339	0.749250	0.375000	0.020699	discard	Restore the compact props8 + minsep8 hybrid shelf anchored at lwindow3, beam3, top4, boardcands2, secsep1, radius0, drop1, props8, total150, and lmargin9.935836791992188. The latest executed bracket is harmful at 142.339380900065108903618238400667905807495117187499999999999999999999999999999999999999999999999999999999999999999999999999999999997066723265986494828176067829543587547365017668192813547148703879725440097565116684589607389953232924568395656702169218258872470761401681300229722785240018885384212538601671235686622221494796871502975005684805097361245174170107929967343807220458984375 and exact-flat at 142.3393809000651089036182384006679058074951171875000000000000000000000000000000000000000000000000000000000000000000000000000000000415384733559367848550748657875925584578617855417261422291564192572559179725133746129799231711766971635714159535142434060558628753801302034479057659161046428877596904750158233388029547884229345806367888941395996420247183067431251402013003826141357421875. This run prepares their exact midpoint, 142.33938090006510890361823840066790580749511718750000000000000000000000000000000000000000000000000000000000000000000000000000000001930259831096163984162546680856807300261340160495947788815256156849067903503924564878476528056496504406990580510820631215736767307076594237406774435067233088657195150680874728724478850495886572606988194991220236969298174045661653508432209491729736328125, with a short experiment name to avoid filename-too-long failures.
autoresearch/snapshots/20260420T054100Z_hybrid_p8_m8_w3_v1293.py	0.071006	0.799339	0.749250	0.375000	0.020699	discard	Restore the compact props8 + minsep8 hybrid shelf anchored at lwindow3, beam3, top4, boardcands2, secsep1, radius0, drop1, props8, total150, and lmargin9.935836791992188. The latest executed bracket is harmful at 142.339380900065108903618238400667905807495117187499999999999999999999999999999999999999999999999999999999999999999999999999999999997066723265986494828176067829543587547365017668192813547148703879725440097565116684589607389953232924568395656702169218258872470761401681300229722785240018885384212538601671235686622221494796871502975005684805097361245174170107929967343807220458984375 and exact-flat at 142.33938090006510890361823840066790580749511718750000000000000000000000000000000000000000000000000000000000000000000000000000000001930259831096163984162546680856807300261340160495947788815256156849067903503924564878476528056496504406990580510820631215736767307076594237406774435067233088657195150680874728724478850495886572606988194991220236969298174045661653508432209491729736328125. This run prepares their exact midpoint, 142.339380900065108903618238400667905807495117187500000000000000000000000000000000000000000000000000000000000000000000000000000000008184660788474067334900767319055830274989209636576145717650632724108059566302181166687186335259098984319150730905187765208120071916083811837148733567956174885978082022705209261465705363226831298786428477798503733527113457313362232525832951068878173828125, with a short experiment name to avoid filename-too-long failures.
