snapshot	board_exact	non_empty_accuracy	macro_f1	move_recall	false_change_rate	status	description
autoresearch/snapshots/20260419T193009Z_hybrid_lookahead_segmental_drop1_boardcands2_ratio95_props8_top4_detect10_lwindow3_minsep8_secsep1_thresh3_total150_permove142p339380900065108903618238400667858123779296875_lmargin9p935836791992188_m9p8957061767578125_r0_beam3_v945.py	0.071006	0.789778	0.739821	0.375000	0.024580	discard	Restore the compact props8 + minsep8 hybrid shelf anchored at lwindow3, beam3, top4, boardcands2, secsep1, radius0, drop1, props8, total150, and lmargin9.935836791992188. The latest executed bracket is harmful at 142.339380900065108903618238400667572021484375 and exact-flat at 142.33938090006510890361823840066814422607421875, so this run restores the same shelf anchor and raises only min_score_gain_per_added_move to 142.339380900065108903618238400667858123779296875 to continue binary-searching that lower edge.
autoresearch/snapshots/20260419T193132Z_hybrid_lookahead_segmental_drop1_boardcands2_ratio95_props8_top4_detect10_lwindow3_minsep8_secsep1_thresh3_total150_permove142p3393809000651089036182384006680011749267578125_lmargin9p935836791992188_m9p8957061767578125_r0_beam3_v946.py	0.071006	0.799339	0.749250	0.375000	0.020699	discard	Restore the compact props8 + minsep8 hybrid shelf anchored at lwindow3, beam3, top4, boardcands2, secsep1, radius0, drop1, props8, total150, and lmargin9.935836791992188. The latest executed bracket is harmful at 142.339380900065108903618238400667858123779296875 and exact-flat at 142.33938090006510890361823840066814422607421875, so this run restores the same shelf anchor and raises only min_score_gain_per_added_move to 142.3393809000651089036182384006680011749267578125 to continue binary-searching that lower edge.
autoresearch/snapshots/20260419T193247Z_hybrid_lookahead_segmental_drop1_boardcands2_ratio95_props8_top4_detect10_lwindow3_minsep8_secsep1_thresh3_total150_permove142p33938090006510890361823840066792964935302734375_lmargin9p935836791992188_m9p8957061767578125_r0_beam3_v947.py	0.071006	0.799339	0.749250	0.375000	0.020699	discard	Restore the compact props8 + minsep8 hybrid shelf anchored at lwindow3, beam3, top4, boardcands2, secsep1, radius0, drop1, props8, total150, and lmargin9.935836791992188. The latest executed bracket is harmful at 142.339380900065108903618238400667858123779296875 and exact-flat at 142.3393809000651089036182384006680011749267578125, so this run restores the same shelf anchor and raises only min_score_gain_per_added_move to 142.33938090006510890361823840066792964935302734375 to continue binary-searching that lower edge.
autoresearch/snapshots/20260419T193434Z_hybrid_lookahead_segmental_drop1_boardcands2_ratio95_props8_top4_detect10_lwindow3_minsep8_secsep1_thresh3_total150_permove142p33938090006510890361823840066792964935302734375_lmargin9p935836791992188_m9p8957061767578125_r0_beam3_v947.py	0.071006	0.799339	0.749250	0.375000	0.020699	discard	Restore the compact props8 + minsep8 hybrid shelf anchored at lwindow3, beam3, top4, boardcands2, secsep1, radius0, drop1, props8, total150, and lmargin9.935836791992188. The latest executed bracket is harmful at 142.339380900065108903618238400667858123779296875 and exact-flat at 142.3393809000651089036182384006680011749267578125, so this run restores the same shelf anchor and raises only min_score_gain_per_added_move to 142.33938090006510890361823840066792964935302734375 to continue binary-searching that lower edge.
autoresearch/snapshots/20260419T193711Z_hybrid_p8_m8_w3_g142p339380900065108903618238400667893886566162109375_v948.py	0.071006	0.789778	0.739821	0.375000	0.024580	discard	Restore the compact props8 + minsep8 hybrid shelf anchored at lwindow3, beam3, top4, boardcands2, secsep1, radius0, drop1, props8, total150, and lmargin9.935836791992188. The latest executed bracket is harmful at 142.339380900065108903618238400667858123779296875 and exact-flat at 142.33938090006510890361823840066792964935302734375, so this run restores the same shelf anchor and raises only min_score_gain_per_added_move to 142.339380900065108903618238400667893886566162109375 to continue binary-searching that lower edge. The experiment name is shortened to avoid the filename-too-long failure seen on the prior unexecuted attempt.
autoresearch/snapshots/20260419T193822Z_hybrid_p8_m8_w3_g142p3393809000651089036182384006679117679595947265625_v949.py	0.071006	0.799339	0.749250	0.375000	0.020699	discard	Restore the compact props8 + minsep8 hybrid shelf anchored at lwindow3, beam3, top4, boardcands2, secsep1, radius0, drop1, props8, total150, and lmargin9.935836791992188. The latest executed bracket is harmful at 142.339380900065108903618238400667893886566162109375 and exact-flat at 142.33938090006510890361823840066792964935302734375, so this run restores the same shelf anchor and raises only min_score_gain_per_added_move to 142.3393809000651089036182384006679117679595947265625 to continue binary-searching that lower edge. The experiment name remains shortened to avoid the filename-too-long failure seen with long autogenerated names.
autoresearch/snapshots/20260419T193956Z_hybrid_p8_m8_w3_g142p33938090006510890361823840066790282726287841796875_v950.py	0.071006	0.789778	0.739821	0.375000	0.024580	discard	Restore the compact props8 + minsep8 hybrid shelf anchored at lwindow3, beam3, top4, boardcands2, secsep1, radius0, drop1, props8, total150, and lmargin9.935836791992188. The latest executed bracket is harmful at 142.339380900065108903618238400667893886566162109375 and exact-flat at 142.3393809000651089036182384006679117679595947265625, so this run restores the same shelf anchor and raises only min_score_gain_per_added_move to 142.33938090006510890361823840066790282726287841796875 to continue binary-searching that lower edge. The experiment name remains shortened to avoid the filename-too-long failure seen with long autogenerated names.
autoresearch/snapshots/20260419T194115Z_hybrid_p8_m8_w3_g142p339380900065108903618238400667907297611236572265625_v951.py	0.071006	0.799339	0.749250	0.375000	0.020699	discard	Restore the compact props8 + minsep8 hybrid shelf anchored at lwindow3, beam3, top4, boardcands2, secsep1, radius0, drop1, props8, total150, and lmargin9.935836791992188. The latest executed bracket is harmful at 142.33938090006510890361823840066790282726287841796875 and exact-flat at 142.3393809000651089036182384006679117679595947265625, so this run restores the same shelf anchor and raises only min_score_gain_per_added_move to 142.339380900065108903618238400667907297611236572265625 to continue binary-searching that lower edge. The experiment name remains shortened to avoid the filename-too-long failure seen with long autogenerated names.
autoresearch/snapshots/20260419T194239Z_hybrid_p8_m8_w3_g142p3393809000651089036182384006679050624370574951171875_v952.py	0.071006	0.789778	0.739821	0.375000	0.024580	discard	Restore the compact props8 + minsep8 hybrid shelf anchored at lwindow3, beam3, top4, boardcands2, secsep1, radius0, drop1, props8, total150, and lmargin9.935836791992188. The latest executed bracket is harmful at 142.33938090006510890361823840066790282726287841796875 and exact-flat at 142.339380900065108903618238400667907297611236572265625, so this run restores the same shelf anchor and raises only min_score_gain_per_added_move to 142.3393809000651089036182384006679050624370574951171875 to continue binary-searching that lower edge. The experiment name remains shortened to avoid the filename-too-long failure seen with long autogenerated names.
autoresearch/snapshots/20260419T194355Z_hybrid_p8_m8_w3_g142p33938090006510890361823840066790618002414703369140625_v953.py	0.071006	0.799339	0.749250	0.375000	0.020699	discard	Restore the compact props8 + minsep8 hybrid shelf anchored at lwindow3, beam3, top4, boardcands2, secsep1, radius0, drop1, props8, total150, and lmargin9.935836791992188. The latest executed bracket is harmful at 142.3393809000651089036182384006679050624370574951171875 and exact-flat at 142.339380900065108903618238400667907297611236572265625, so this run restores the same shelf anchor and raises only min_score_gain_per_added_move to 142.33938090006510890361823840066790618002414703369140625 to continue binary-searching that lower edge. The experiment name remains shortened to avoid the filename-too-long failure seen with long autogenerated names.
autoresearch/snapshots/20260419T194508Z_hybrid_p8_m8_w3_g142p339380900065108903618238400667905621230602264404296875_v954.py	0.071006	0.789778	0.739821	0.375000	0.024580	discard	Restore the compact props8 + minsep8 hybrid shelf anchored at lwindow3, beam3, top4, boardcands2, secsep1, radius0, drop1, props8, total150, and lmargin9.935836791992188. The latest executed bracket is harmful at 142.3393809000651089036182384006679050624370574951171875 and exact-flat at 142.33938090006510890361823840066790618002414703369140625, so this run restores the same shelf anchor and raises only min_score_gain_per_added_move to 142.339380900065108903618238400667905621230602264404296875 to continue binary-searching that lower edge. The experiment name remains shortened to avoid the filename-too-long failure seen with long autogenerated names.
autoresearch/snapshots/20260419T194645Z_hybrid_p8_m8_w3_g142p3393809000651089036182384006679059006273746490478515625_v955.py	0.071006	0.799339	0.749250	0.375000	0.020699	discard	Restore the compact props8 + minsep8 hybrid shelf anchored at lwindow3, beam3, top4, boardcands2, secsep1, radius0, drop1, props8, total150, and lmargin9.935836791992188. The latest executed bracket is harmful at 142.339380900065108903618238400667905621230602264404296875 and exact-flat at 142.33938090006510890361823840066790618002414703369140625, so this run restores the same shelf anchor and raises only min_score_gain_per_added_move to 142.3393809000651089036182384006679059006273746490478515625 to continue binary-searching that lower edge. The experiment name remains shortened to avoid the filename-too-long failure seen with long autogenerated names.
autoresearch/snapshots/20260419T194757Z_hybrid_p8_m8_w3_g142p33938090006510890361823840066790576092898845672607421875_v956.py	0.071006	0.789778	0.739821	0.375000	0.024580	discard	Restore the compact props8 + minsep8 hybrid shelf anchored at lwindow3, beam3, top4, boardcands2, secsep1, radius0, drop1, props8, total150, and lmargin9.935836791992188. The latest executed bracket is harmful at 142.339380900065108903618238400667905621230602264404296875 and exact-flat at 142.3393809000651089036182384006679059006273746490478515625, so this run restores the same shelf anchor and raises only min_score_gain_per_added_move to 142.33938090006510890361823840066790576092898845672607421875 to continue binary-searching that lower edge. The experiment name remains shortened to avoid the filename-too-long failure seen with long autogenerated names.
autoresearch/snapshots/20260419T194908Z_hybrid_p8_m8_w3_g142p339380900065108903618238400667905691079795360565185546875_v957.py	0.071006	0.789778	0.739821	0.375000	0.024580	discard	Restore the compact props8 + minsep8 hybrid shelf anchored at lwindow3, beam3, top4, boardcands2, secsep1, radius0, drop1, props8, total150, and lmargin9.935836791992188. The latest executed bracket is harmful at 142.339380900065108903618238400667905621230602264404296875 and exact-flat at 142.33938090006510890361823840066790576092898845672607421875, so this run restores the same shelf anchor and raises only min_score_gain_per_added_move to 142.339380900065108903618238400667905691079795360565185546875 to continue binary-searching that lower edge. The experiment name remains shortened to avoid the filename-too-long failure seen with long autogenerated names.
autoresearch/snapshots/20260419T195037Z_hybrid_p8_m8_w3_g142p3393809000651089036182384006679057958535850048065185546875_v958.py	0.071006	0.789778	0.739821	0.375000	0.024580	discard	Restore the compact props8 + minsep8 hybrid shelf anchored at lwindow3, beam3, top4, boardcands2, secsep1, radius0, drop1, props8, total150, and lmargin9.935836791992188. The latest executed bracket is harmful at 142.339380900065108903618238400667905691079795360565185546875 and exact-flat at 142.3393809000651089036182384006679059006273746490478515625, so this run restores the same shelf anchor and raises only min_score_gain_per_added_move to 142.3393809000651089036182384006679057958535850048065185546875 to continue binary-searching that lower edge. The experiment name remains shortened to avoid the filename-too-long failure seen with long autogenerated names.
autoresearch/snapshots/20260419T195212Z_hybrid_p8_m8_w3_g142p33938090006510890361823840066790584824047982692718505859375_v959.py	0.071006	0.799339	0.749250	0.375000	0.020699	discard	Restore the compact props8 + minsep8 hybrid shelf anchored at lwindow3, beam3, top4, boardcands2, secsep1, radius0, drop1, props8, total150, and lmargin9.935836791992188. The latest executed bracket is harmful at 142.3393809000651089036182384006679057958535850048065185546875 and exact-flat at 142.3393809000651089036182384006679059006273746490478515625, so this run restores the same shelf anchor and raises only min_score_gain_per_added_move to 142.33938090006510890361823840066790584824047982692718505859375 to continue binary-searching that lower edge. The experiment name remains shortened to avoid the filename-too-long failure seen with long autogenerated names.
autoresearch/snapshots/20260419T195659Z_hybrid_p8_m8_w3_g142p339380900065108903618238400667905822047032415866851806640625_v960.py	0.071006	0.799339	0.749250	0.375000	0.020699	discard	Restore the compact props8 + minsep8 hybrid shelf anchored at lwindow3, beam3, top4, boardcands2, secsep1, radius0, drop1, props8, total150, and lmargin9.935836791992188. The latest executed bracket is harmful at 142.3393809000651089036182384006679057958535850048065185546875 and exact-flat at 142.33938090006510890361823840066790584824047982692718505859375, so this run restores the same shelf anchor and raises only min_score_gain_per_added_move to 142.339380900065108903618238400667905822047032415866851806640625 to continue binary-searching that lower edge. The experiment name remains shortened to avoid the filename-too-long failure seen with long autogenerated names.
autoresearch/snapshots/20260419T195915Z_hybrid_p8_m8_w3_g142p3393809000651089036182384006679058089503087103366851806640625_v961.py	0.071006	0.799339	0.749250	0.375000	0.020699	discard	Restore the compact props8 + minsep8 hybrid shelf anchored at lwindow3, beam3, top4, boardcands2, secsep1, radius0, drop1, props8, total150, and lmargin9.935836791992188. The latest executed bracket is harmful at 142.3393809000651089036182384006679057958535850048065185546875 and exact-flat at 142.339380900065108903618238400667905822047032415866851806640625, so this run restores the same shelf anchor and raises only min_score_gain_per_added_move to 142.3393809000651089036182384006679058089503087103366851806640625 to continue binary-searching that lower edge. The experiment name remains shortened to avoid the filename-too-long failure seen with long autogenerated names.
autoresearch/snapshots/20260419T200125Z_hybrid_p8_m8_w3_g142p33938090006510890361823840066790580240194685757160186767578125_v962.py	0.071006	0.789778	0.739821	0.375000	0.024580	discard	Restore the compact props8 + minsep8 hybrid shelf anchored at lwindow3, beam3, top4, boardcands2, secsep1, radius0, drop1, props8, total150, and lmargin9.935836791992188. The latest executed bracket is harmful at 142.3393809000651089036182384006679057958535850048065185546875 and exact-flat at 142.3393809000651089036182384006679058089503087103366851806640625, so this run restores the same shelf anchor and raises only min_score_gain_per_added_move to 142.33938090006510890361823840066790580240194685757160186767578125 to continue binary-searching that lower edge. The experiment name remains shortened to avoid the filename-too-long failure seen with long autogenerated names.
autoresearch/snapshots/20260419T200337Z_hybrid_p8_m8_w3_g142p339380900065108903618238400667905805676127783954143524169921875_v963.py	0.071006	0.789778	0.739821	0.375000	0.024580	discard	Restore the compact props8 + minsep8 hybrid shelf anchored at lwindow3, beam3, top4, boardcands2, secsep1, radius0, drop1, props8, total150, and lmargin9.935836791992188. The latest executed bracket is harmful at 142.33938090006510890361823840066790580240194685757160186767578125 and exact-flat at 142.3393809000651089036182384006679058089503087103366851806640625, so this run restores the same shelf anchor and raises only min_score_gain_per_added_move to 142.339380900065108903618238400667905805676127783954143524169921875 to continue binary-searching that lower edge. The experiment name remains shortened to avoid the filename-too-long failure seen with long autogenerated names.
autoresearch/snapshots/20260419T200552Z_hybrid_p8_m8_w3_g142p3393809000651089036182384006679058073132182471454143524169921875_v964.py	0.071006	0.789778	0.739821	0.375000	0.024580	discard	Restore the compact props8 + minsep8 hybrid shelf anchored at lwindow3, beam3, top4, boardcands2, secsep1, radius0, drop1, props8, total150, and lmargin9.935836791992188. The latest executed bracket is harmful at 142.339380900065108903618238400667905805676127783954143524169921875 and exact-flat at 142.3393809000651089036182384006679058089503087103366851806640625, so this run restores the same shelf anchor and raises only min_score_gain_per_added_move to 142.3393809000651089036182384006679058073132182471454143524169921875 to continue binary-searching that lower edge. The experiment name remains shortened to avoid the filename-too-long failure seen with long autogenerated names.
autoresearch/snapshots/20260419T200803Z_hybrid_p8_m8_w3_g142p33938090006510890361823840066790580813176347874104976654052734375_v965.py	0.071006	0.799339	0.749250	0.375000	0.020699	discard	Restore the compact props8 + minsep8 hybrid shelf anchored at lwindow3, beam3, top4, boardcands2, secsep1, radius0, drop1, props8, total150, and lmargin9.935836791992188. The latest executed bracket is harmful at 142.3393809000651089036182384006679058073132182471454143524169921875 and exact-flat at 142.3393809000651089036182384006679058089503087103366851806640625, so this run restores the same shelf anchor and raises only min_score_gain_per_added_move to 142.33938090006510890361823840066790580813176347874104976654052734375 to continue binary-searching that lower edge. The experiment name remains shortened to avoid the filename-too-long failure seen with long autogenerated names.
autoresearch/snapshots/20260419T201017Z_hybrid_p8_m8_w3_g142p339380900065108903618238400667905807722490862943232059478759765625_v966.py	0.071006	0.799339	0.749250	0.375000	0.020699	discard	Restore the compact props8 + minsep8 hybrid shelf anchored at lwindow3, beam3, top4, boardcands2, secsep1, radius0, drop1, props8, total150, and lmargin9.935836791992188. The latest executed bracket is harmful at 142.3393809000651089036182384006679058073132182471454143524169921875 and exact-flat at 142.33938090006510890361823840066790580813176347874104976654052734375, so this run restores the same shelf anchor and raises only min_score_gain_per_added_move to 142.339380900065108903618238400667905807722490862943232059478759765625 to continue binary-searching that lower edge. The experiment name remains shortened to avoid the filename-too-long failure seen with long autogenerated names.
autoresearch/snapshots/20260419T201235Z_hybrid_p8_m8_w3_g142p3393809000651089036182384006679058075178545550443232059478759765625_v967.py	0.071006	0.799339	0.749250	0.375000	0.020699	discard	Restore the compact props8 + minsep8 hybrid shelf anchored at lwindow3, beam3, top4, boardcands2, secsep1, radius0, drop1, props8, total150, and lmargin9.935836791992188. The latest executed bracket is harmful at 142.3393809000651089036182384006679058073132182471454143524169921875 and exact-flat at 142.339380900065108903618238400667905807722490862943232059478759765625, so this run restores the same shelf anchor and raises only min_score_gain_per_added_move to 142.3393809000651089036182384006679058075178545550443232059478759765625 to continue binary-searching that lower edge. The experiment name remains shortened to avoid the filename-too-long failure seen with long autogenerated names.
autoresearch/snapshots/20260419T201453Z_hybrid_p8_m8_w3_g142p33938090006510890361823840066790580741553640109486877918243408203125_v968.py	0.071006	0.789778	0.739821	0.375000	0.024580	discard	Restore the compact props8 + minsep8 hybrid shelf anchored at lwindow3, beam3, top4, boardcands2, secsep1, radius0, drop1, props8, total150, and lmargin9.935836791992188. The latest executed bracket is harmful at 142.3393809000651089036182384006679058073132182471454143524169921875 and exact-flat at 142.3393809000651089036182384006679058075178545550443232059478759765625, so this run restores the same shelf anchor and raises only min_score_gain_per_added_move to 142.33938090006510890361823840066790580741553640109486877918243408203125 to continue binary-searching that lower edge. The experiment name remains shortened to avoid the filename-too-long failure seen with long autogenerated names.
