snapshot	board_exact	non_empty_accuracy	macro_f1	move_recall	false_change_rate	status	description
autoresearch/snapshots/20260420T071255Z_hybrid_p8_m8_w3_v1352.py	0.071006	0.799339	0.749250	0.375000	0.020699	discard	Restore the compact props8 + minsep8 hybrid shelf anchored at lwindow3, beam3, top4, boardcands2, secsep1, radius0, drop1, props8, total150, and lmargin9.935836791992188. The true executed harmful/flat bracket is now harmful at 142.3393809000651089036182384006679058074951171874999999999999999999999999999999999999999999999999999999999999999999999999999999999999999999999999977686953799876667956333579136737640156310666917831474368286933458207840867005436993656268790593347168001217667054092358154923776195063164677018998929981793630498547764354579014992556048538732021248053852895391981956990264953722483506460312541381553474995058650165447033941745758056640625 and flat at 142.3393809000651089036182384006679058074951171875000000000000000000000000000000000000000000000000000000000000000000000000000000000000000000000002971447528479226985007815401858321213312927121937331398980406481439921428971320579782989038344482713660891773865906295976586713028041950679368148607547255876164406266895458013208596283248889981276199350048789400863723516493994434865425580949795970886473384098280803300440311431884765625. This run prepares their exact midpoint, 142.33938090006510890361823840066790580749511718750000000000000000000000000000000000000000000000000000000000000000000000000000000000000000000000014745672411395518264820744904975294267346188944275814366743467074490646349191630083883226535675380304144464957664801941673708184021185069220225838032386188348974524073299062961117944196487143566487237019508423964228402533794740786744660206311686762199741895784654843737371265888214111328125, with a short experiment name to avoid filename-too-long failures.
autoresearch/snapshots/20260420T071401Z_hybrid_p8_m8_w3_v1353.py	0.071006	0.799339	0.749250	0.375000	0.020699	discard	Restore the compact props8 + minsep8 hybrid shelf anchored at lwindow3, beam3, top4, boardcands2, secsep1, radius0, drop1, props8, total150, and lmargin9.935836791992188. The true executed harmful/flat bracket is now harmful at 142.3393809000651089036182384006679058074951171874999999999999999999999999999999999999999999999999999999999999999999999999999999999999999999999999977686953799876667956333579136737640156310666917831474368286933458207840867005436993656268790593347168001217667054092358154923776195063164677018998929981793630498547764354579014992556048538732021248053852895391981956990264953722483506460312541381553474995058650165447033941745758056640625 and flat at 142.33938090006510890361823840066790580749511718750000000000000000000000000000000000000000000000000000000000000000000000000000000000000000000000014745672411395518264820744904975294267346188944275814366743467074490646349191630083883226535675380304144464957664801941673708184021185069220225838032386188348974524073299062961117944196487143566487237019508423964228402533794740786744660206311686762199741895784654843737371265888214111328125. This run prepares their exact midpoint, 142.339380900065108903618238400667905807495117187500000000000000000000000000000000000000000000000000000000000000000000000000000000000000000000000072612709746971424721920403481713353344546478067270645552131682045363623789308422269098946117906568879122385671676714326276287108915678504334980140108430031426397547754713043756339348784862654433498587790186889420239862182221390057898624047185502888672459231855782491038553416728973388671875, with a short experiment name to avoid filename-too-long failures.
autoresearch/snapshots/20260420T071512Z_hybrid_p8_m8_w3_v1354.py	0.071006	0.799339	0.749250	0.375000	0.020699	discard	Restore the compact props8 + minsep8 hybrid shelf anchored at lwindow3, beam3, top4, boardcands2, secsep1, radius0, drop1, props8, total150, and lmargin9.935836791992188. The true executed harmful/flat bracket is now harmful at 142.3393809000651089036182384006679058074951171874999999999999999999999999999999999999999999999999999999999999999999999999999999999999999999999999977686953799876667956333579136737640156310666917831474368286933458207840867005436993656268790593347168001217667054092358154923776195063164677018998929981793630498547764354579014992556048538732021248053852895391981956990264953722483506460312541381553474995058650165447033941745758056640625 and flat at 142.339380900065108903618238400667905807495117187500000000000000000000000000000000000000000000000000000000000000000000000000000000000000000000000072612709746971424721920403481713353344546478067270645552131682045363623789308422269098946117906568879122385671676714326276287108915678504334980140108430031426397547754713043756339348784862654433498587790186889420239862182221390057898624047185502888672459231855782491038553416728973388671875. This run prepares their exact midpoint, 142.3393809000651089036182384006679058074951171875000000000000000000000000000000000000000000000000000000000000000000000000000000000000000000000000351907025634795457587768806976935586800887723795268964944801876955922039380044829842322864984829517979612537191910617810458897432675924104013410200007141053947237012655742508289193021948582638178116965877382143092177806043583811531246350392198205220099793688603995178709737956523895263671875, with a short experiment name to avoid filename-too-long failures.
autoresearch/snapshots/20260420T071618Z_hybrid_p8_m8_w3_v1355.py	0.071006	0.799339	0.749250	0.375000	0.020699	discard	Restore the compact props8 + minsep8 hybrid shelf anchored at lwindow3, beam3, top4, boardcands2, secsep1, radius0, drop1, props8, total150, and lmargin9.935836791992188. The true executed harmful/flat bracket is now harmful at 142.3393809000651089036182384006679058074951171874999999999999999999999999999999999999999999999999999999999999999999999999999999999999999999999999977686953799876667956333579136737640156310666917831474368286933458207840867005436993656268790593347168001217667054092358154923776195063164677018998929981793630498547764354579014992556048538732021248053852895391981956990264953722483506460312541381553474995058650165447033941745758056640625 and flat at 142.3393809000651089036182384006679058074951171875000000000000000000000000000000000000000000000000000000000000000000000000000000000000000000000000351907025634795457587768806976935586800887723795268964944801876955922039380044829842322864984829517979612537191910617810458897432675924104013410200007141053947237012655742508289193021948582638178116965877382143092177806043583811531246350392198205220099793688603995178709737956523895263671875. This run prepares their exact midpoint, 142.33938090006510890361823840066790580749511718750000000000000000000000000000000000000000000000000000000000000000000000000000000000000000000000001647969897173360627720511930568366134785991953565502196565444052070649401235251334179895668877114325738068774294823550843069106044354936343452145994685614237888677802100485436520927889985606850996825098651387675370673981542687670073764053523697933867873943736270803128718398511409759521484375, with a short experiment name to avoid filename-too-long failures.
autoresearch/snapshots/20260420T071730Z_hybrid_p8_m8_w3_v1356.py	0.071006	0.799339	0.749250	0.375000	0.020699	discard	Restore the compact props8 + minsep8 hybrid shelf anchored at lwindow3, beam3, top4, boardcands2, secsep1, radius0, drop1, props8, total150, and lmargin9.935836791992188. The true executed harmful/flat bracket is now harmful at 142.3393809000651089036182384006679058074951171874999999999999999999999999999999999999999999999999999999999999999999999999999999999999999999999999977686953799876667956333579136737640156310666917831474368286933458207840867005436993656268790593347168001217667054092358154923776195063164677018998929981793630498547764354579014992556048538732021248053852895391981956990264953722483506460312541381553474995058650165447033941745758056640625 and flat at 142.33938090006510890361823840066790580749511718750000000000000000000000000000000000000000000000000000000000000000000000000000000000000000000000001647969897173360627720511930568366134785991953565502196565444052070649401235251334179895668877114325738068774294823550843069106044354936343452145994685614237888677802100485436520927889985606850996825098651387675370673981542687670073764053523697933867873943736270803128718398511409759521484375. This run prepares their exact midpoint, 142.339380900065108903618238400667905807495117187500000000000000000000000000000000000000000000000000000000000000000000000000000000000000000000000007124197175860636536419238609678712681745493113719084701241566933263639049526528520582291783915238987090404754826822372123091719031527839951111679919927160870968316398720156133354267252354970856046528185901707975951219420961124474544143283245558747013119471613862287995289079844951629638671875, with a short experiment name to avoid filename-too-long failures.
autoresearch/snapshots/20260420T071853Z_hybrid_p8_m8_w3_v1357.py	0.071006	0.799339	0.749250	0.375000	0.020699	discard	Restore the compact props8 + minsep8 hybrid shelf anchored at lwindow3, beam3, top4, boardcands2, secsep1, radius0, drop1, props8, total150, and lmargin9.935836791992188. The true executed harmful/flat bracket is now harmful at 142.3393809000651089036182384006679058074951171874999999999999999999999999999999999999999999999999999999999999999999999999999999999999999999999999977686953799876667956333579136737640156310666917831474368286933458207840867005436993656268790593347168001217667054092358154923776195063164677018998929981793630498547764354579014992556048538732021248053852895391981956990264953722483506460312541381553474995058650165447033941745758056640625 and flat at 142.339380900065108903618238400667905807495117187500000000000000000000000000000000000000000000000000000000000000000000000000000000000000000000000007124197175860636536419238609678712681745493113719084701241566933263639049526528520582291783915238987090404754826822372123091719031527839951111679919927160870968316398720156133354267252354970856046528185901707975951219420961124474544143283245558747013119471613862287995289079844951629638671875. This run prepares their exact midpoint, 142.3393809000651089036182384006679058074951171875000000000000000000000000000000000000000000000000000000000000000000000000000000000000000000000000024464462779241516660262982616762383486882799027511160690351301395422115681135361099739593314872868519452632607661158039692920483255170782094067899064626701170090855875778070174267614286044220290856667855956235870734592237282483614473946572498484511803094887394394163493416272103786468505859375, with a short experiment name to avoid filename-too-long failures.
autoresearch/snapshots/20260420T071952Z_hybrid_p8_m8_w3_v1358.py	0.071006	0.799339	0.749250	0.375000	0.020699	discard	Restore the compact props8 + minsep8 hybrid shelf anchored at lwindow3, beam3, top4, boardcands2, secsep1, radius0, drop1, props8, total150, and lmargin9.935836791992188. The true executed harmful/flat bracket is now harmful at 142.3393809000651089036182384006679058074951171874999999999999999999999999999999999999999999999999999999999999999999999999999999999999999999999999977686953799876667956333579136737640156310666917831474368286933458207840867005436993656268790593347168001217667054092358154923776195063164677018998929981793630498547764354579014992556048538732021248053852895391981956990264953722483506460312541381553474995058650165447033941745758056640625 and flat at 142.339380900065108903618238400667905807495117187500000000000000000000000000000000000000000000000000000000000000000000000000000000000000000000000007124197175860636536419238609678712681745493113719084701241566933263639049526528520582291783915238987090404754826822372123091719031527839951111679919927160870968316398720156133354267252354970856046528185901707975951219420961124474544143283245558747013119471613862287995289079844951629638671875. This run prepares their exact midpoint, 142.3393809000651089036182384006679058074951171875000000000000000000000000000000000000000000000000000000000000000000000000000000000000000000000000024464462779241516660262982616762383486882799027511160690351301395422115681135361099739593314872868519452632607661158039692920483255170782094067899064626701170090855875778070174267614286044220290856667855956235870734592237282483614473946572498484511803094887394394163493416272103786468505859375, with a short experiment name to avoid filename-too-long failures.
autoresearch/snapshots/20260420T072104Z_hybrid_p8_m8_w3_v1359.py	0.071006	0.789778	0.739821	0.375000	0.024580	discard	Restore the compact props8 + minsep8 hybrid shelf anchored at lwindow3, beam3, top4, boardcands2, secsep1, radius0, drop1, props8, total150, and lmargin9.935836791992188. The true executed harmful/flat bracket is now harmful at 142.339380900065108903618238400667905807495117187499999999999999999999999999999999999999999999999999999999999999999999999999999999999999999999999698392637912052635090485175641515406699969421189833154975616738547649425276269029420432349923670398067511066146820188873972313452434817564998588939031270771109659082863325114482138882884818748276629675765700138310019046403591301010158733967528679222047660601901952759362757205963134765625 and flat at 142.3393809000651089036182384006679058074951171875000000000000000000000000000000000000000000000000000000000000000000000000000000000000000000000000024464462779241516660262982616762383486882799027511160690351301395422115681135361099739593314872868519452632607661158039692920483255170782094067899064626701170090855875778070174267614286044220290856667855956235870734592237282483614473946572498484511803094887394394163493416272103786468505859375. This run prepares their exact midpoint, 142.33938090006510890361823840066790580749511718749999999999999999999999999999999999999999999999999999999999999999999999999999999999999999999999985041954209498839337825573695159582252432885054629213552232593434359581842219128276520315462757884245972816470379315233897080275038016732160399786446886672061333408422545146074978282215671158515285767127564788094854625281365977468580306431238926383661398504532069608785604941658675670623779296875, with a short experiment name to avoid filename-too-long failures.
autoresearch/snapshots/20260420T072339Z_hybrid_p8_m8_w3_v1360.py	0.071006	0.789778	0.739821	0.375000	0.024580	discard	Restore the compact props8 + minsep8 hybrid shelf anchored at lwindow3, beam3, top4, boardcands2, secsep1, radius0, drop1, props8, total150, and lmargin9.935836791992188. The true executed harmful/flat bracket is now harmful at 142.33938090006510890361823840066790580749511718749999999999999999999999999999999999999999999999999999999999999999999999999999999999999999999999985041954209498839337825573695159582252432885054629213552232593434359581842219128276520315462757884245972816470379315233897080275038016732160399786446886672061333408422545146074978282215671158515285767127564788094854625281365977468580306431238926383661398504532069608785604941658675670623779296875 and flat at 142.3393809000651089036182384006679058074951171875000000000000000000000000000000000000000000000000000000000000000000000000000000000000000000000000024464462779241516660262982616762383486882799027511160690351301395422115681135361099739593314872868519452632607661158039692920483255170782094067899064626701170090855875778070174267614286044220290856667855956235870734592237282483614473946572498484511803094887394394163493416272103786468505859375. This run prepares their exact midpoint, 142.339380900065108903618238400667905807495117187499999999999999999999999999999999999999999999999999999999999999999999999999999999999999999999999926432994186456272522141017606636030436508565224521625795680532241569014995152409437588556979533064655836713982279634071470047399352842199906702327187664695365171584906514633883604791792658003590971669030621752267809856018694011523625229484819556143897147267030067752102695521898567676544189453125, with a short experiment name to avoid filename-too-long failures.
autoresearch/snapshots/20260420T072501Z_hybrid_p8_m8_w3_v1361.py	0.071006	0.789778	0.739821	0.375000	0.024580	discard	Restore the compact props8 + minsep8 hybrid shelf anchored at lwindow3, beam3, top4, boardcands2, secsep1, radius0, drop1, props8, total150, and lmargin9.935836791992188. The true executed harmful/flat bracket is now harmful at 142.339380900065108903618238400667905807495117187499999999999999999999999999999999999999999999999999999999999999999999999999999999999999999999999926432994186456272522141017606636030436508565224521625795680532241569014995152409437588556979533064655836713982279634071470047399352842199906702327187664695365171584906514633883604791792658003590971669030621752267809856018694011523625229484819556143897147267030067752102695521898567676544189453125 and flat at 142.3393809000651089036182384006679058074951171875000000000000000000000000000000000000000000000000000000000000000000000000000000000000000000000000024464462779241516660262982616762383486882799027511160690351301395422115681135361099739593314872868519452632607661158039692920483255170782094067899064626701170090855875778070174267614286044220290856667855956235870734592237282483614473946572498484511803094887394394163493416272103786468505859375. This run prepares their exact midpoint, 142.3393809000651089036182384006679058074951171874999999999999999999999999999999999999999999999999999999999999999999999999999999999999999999999999644397202321902120940836579341561343925984225636363709323578311905556132816329727737812581555101757538909886215228749377196697238391796390580545585470636827410903352470462204505157766106312128100286679081086879274416576212111299425363120710347022975387283778847535842260185745544731616973876953125, with a short experiment name to avoid filename-too-long failures.
autoresearch/snapshots/20260420T072622Z_hybrid_p8_m8_w3_v1362.py	0.071006	0.789778	0.739821	0.375000	0.024580	discard	Restore the compact props8 + minsep8 hybrid shelf anchored at lwindow3, beam3, top4, boardcands2, secsep1, radius0, drop1, props8, total150, and lmargin9.935836791992188. The true executed harmful/flat bracket is now harmful at 142.3393809000651089036182384006679058074951171874999999999999999999999999999999999999999999999999999999999999999999999999999999999999999999999999644397202321902120940836579341561343925984225636363709323578311905556132816329727737812581555101757538909886215228749377196697238391796390580545585470636827410903352470462204505157766106312128100286679081086879274416576212111299425363120710347022975387283778847535842260185745544731616973876953125 and flat at 142.3393809000651089036182384006679058074951171875000000000000000000000000000000000000000000000000000000000000000000000000000000000000000000000000024464462779241516660262982616762383486882799027511160690351301395422115681135361099739593314872868519452632607661158039692920483255170782094067899064626701170090855875778070174267614286044220290856667855956235870734592237282483614473946572498484511803094887394394163493416272103786468505859375. This run prepares their exact midpoint, 142.33938090006510890361823840066790580749511718749999999999999999999999999999999999999999999999999999999999999999999999999999999999999999999999998344308325505718188005497809791618637064335123319374350069648066504891242487325444187760874349873130291812594114449537084448088608234835863373067422676317642904971041731201373397126901961781741955716734685215575725755842246968915199185336414227537435951893331209650028768010088242590427398681640625, with a short experiment name to avoid filename-too-long failures.
autoresearch/snapshots/20260420T072737Z_hybrid_p8_m8_w3_v1363.py	0.071006	0.789778	0.739821	0.375000	0.024580	discard	Restore the compact props8 + minsep8 hybrid shelf anchored at lwindow3, beam3, top4, boardcands2, secsep1, radius0, drop1, props8, total150, and lmargin9.935836791992188. The true executed harmful/flat bracket is now harmful at 142.33938090006510890361823840066790580749511718749999999999999999999999999999999999999999999999999999999999999999999999999999999999999999999999998344308325505718188005497809791618637064335123319374350069648066504891242487325444187760874349873130291812594114449537084448088608234835863373067422676317642904971041731201373397126901961781741955716734685215575725755842246968915199185336414227537435951893331209650028768010088242590427398681640625 and flat at 142.3393809000651089036182384006679058074951171875000000000000000000000000000000000000000000000000000000000000000000000000000000000000000000000000024464462779241516660262982616762383486882799027511160690351301395422115681135361099739593314872868519452632607661158039692920483255170782094067899064626701170090855875778070174267614286044220290856667855956235870734592237282483614473946572498484511803094887394394163493416272103786468505859375. This run prepares their exact midpoint, 142.339380900065108903618238400667905807495117187499999999999999999999999999999999999999999999999999999999999999999999999999999999999999999999999992944764766490666773040638179796212359665815567972429784865805402295561996493395275925784037493009077431694600955305587406886467203932718421568732066612923273029398002444910375699015224111119724321417066223889672165508823098968756719624010696061912769914211025767958318510864046402275562286376953125, with a short experiment name to avoid filename-too-long failures.
