snapshot	board_exact	non_empty_accuracy	macro_f1	move_recall	false_change_rate	status	description
autoresearch/snapshots/20260419T155022Z_hybrid_lookahead_segmental_drop1_boardcands2_ratio95_props8_top4_detect10_lwindow3_minsep8_secsep1_thresh3_total150_permove142p33938120305538_lmargin9p935836791992188_m9p8957061767578125_r0_beam3_v862.py	0.071006	0.799339	0.749250	0.375000	0.020699	discard	Restore the recovered compact props8 sibling after recent local mapping showed the props7 shelf is saturated across top_move_candidates=5..16, beam_size=4 is an exact no-op, beam_size=2 is slightly worse, beam_size=1 is much worse, both hybrid acceptance gates are exact-flat down to 125.0, event_window_radius=1..2, segment_board_drop_worst_frames=0, and secondary_peak_ratio=0.98 are exact no-ops on the adjacent props7 shelf, secondary_min_event_separation=2 is worse there, and min_event_separation=8 and 6 are both worse than 7 there. On the compact props8 top4 anchor, top_board_candidates=2..4 are exact no-ops, top_move_candidates=4 is exact-flat while 5 is worse, secondary_min_event_separation=2 is worse, and raising min_event_separation from 7 to 8 opened a lower-noise shelf that remained exact-flat at 9 before breaking sharply at 10. On that minsep8 shelf, top_move_candidates=3 is exact-flat, 2 and 1 only slightly weaken secondary metrics, top_board_candidates=2..4 are exact-flat, top_board_candidates=1 is harmful, beam_size=2 is slightly worse, secsep2 is worse, and event_window_radius=1..2, segment_board_drop_worst_frames=0, and secondary_peak_ratio=0.98 are exact no-ops. Lowering min_score_gain_per_added_move from 150.0 to 137.5 increased false changes and weakened secondaries, while raising it from 150.0 to 162.5, 175.0, 187.5, 200.0, 212.5, 225.0, 237.5, 250.0, 262.5, 275.0, 287.5, and 300.0 were exact no-ops and lowering min_total_score_gain from 150.0 down to 87.5 was also exact-flat. Lowering only min_score_gain_per_added_move to 143.75, 142.96875, 142.578125, and 142.3828125 were exact no-ops, while 142.33938083052635, 142.3393800854683, 142.33937859535217, 142.3393726348877, 142.33932495117188, 142.33856201171875, 142.3370361328125, 142.333984375, 142.28515625, and 142.1875 again increased false changes and weakened secondaries, so the lower edge lies between 142.33938083052635 and 142.3393815755844. This run restores the stable minsep8 shelf anchor and raises only min_score_gain_per_added_move from 142.33938083052635 to 142.33938120305538 to continue binary-searching that lower edge.
autoresearch/snapshots/20260419T155203Z_hybrid_lookahead_segmental_drop1_boardcands2_ratio95_props8_top4_detect10_lwindow3_minsep8_secsep1_thresh3_total150_permove142p33938101679087_lmargin9p935836791992188_m9p8957061767578125_r0_beam3_v863.py	0.071006	0.799339	0.749250	0.375000	0.020699	discard	Restore the recovered compact props8 sibling after recent local mapping showed the props7 shelf is saturated across top_move_candidates=5..16, beam_size=4 is an exact no-op, beam_size=2 is slightly worse, beam_size=1 is much worse, both hybrid acceptance gates are exact-flat down to 125.0, event_window_radius=1..2, segment_board_drop_worst_frames=0, and secondary_peak_ratio=0.98 are exact no-ops on the adjacent props7 shelf, secondary_min_event_separation=2 is worse there, and min_event_separation=8 and 6 are both worse than 7 there. On the compact props8 top4 anchor, top_board_candidates=2..4 are exact no-ops, top_move_candidates=4 is exact-flat while 5 is worse, secondary_min_event_separation=2 is worse, and raising min_event_separation from 7 to 8 opened a lower-noise shelf that remained exact-flat at 9 before breaking sharply at 10. On that minsep8 shelf, top_move_candidates=3 is exact-flat, 2 and 1 only slightly weaken secondary metrics, top_board_candidates=2..4 are exact-flat, top_board_candidates=1 is harmful, beam_size=2 is slightly worse, secsep2 is worse, and event_window_radius=1..2, segment_board_drop_worst_frames=0, and secondary_peak_ratio=0.98 are exact no-ops. Lowering min_score_gain_per_added_move from 150.0 to 137.5 increased false changes and weakened secondaries, while raising it from 150.0 to 162.5, 175.0, 187.5, 200.0, 212.5, 225.0, 237.5, 250.0, 262.5, 275.0, 287.5, and 300.0 were exact no-ops and lowering min_total_score_gain from 150.0 down to 87.5 was also exact-flat. Lowering only min_score_gain_per_added_move to 143.75, 142.96875, 142.578125, and 142.3828125 were exact no-ops, while 142.33938083052635, 142.3393800854683, 142.33937859535217, 142.3393726348877, 142.33932495117188, 142.33856201171875, 142.3370361328125, 142.333984375, 142.28515625, and 142.1875 again increased false changes and weakened secondaries, so the lower edge lies between 142.33938083052635 and 142.33938120305538. This run restores the stable minsep8 shelf anchor and raises only min_score_gain_per_added_move from 142.33938083052635 to 142.33938101679087 to continue binary-searching that lower edge.
autoresearch/snapshots/20260419T155354Z_hybrid_lookahead_segmental_drop1_boardcands2_ratio95_props8_top4_detect10_lwindow3_minsep8_secsep1_thresh3_total150_permove142p3393809236586_lmargin9p935836791992188_m9p8957061767578125_r0_beam3_v864.py	0.071006	0.799339	0.749250	0.375000	0.020699	discard	Restore the recovered compact props8 sibling after recent local mapping showed the props7 shelf is saturated across top_move_candidates=5..16, beam_size=4 is an exact no-op, beam_size=2 is slightly worse, beam_size=1 is much worse, both hybrid acceptance gates are exact-flat down to 125.0, event_window_radius=1..2, segment_board_drop_worst_frames=0, and secondary_peak_ratio=0.98 are exact no-ops on the adjacent props7 shelf, secondary_min_event_separation=2 is worse there, and min_event_separation=8 and 6 are both worse than 7 there. On the compact props8 top4 anchor, top_board_candidates=2..4 are exact no-ops, top_move_candidates=4 is exact-flat while 5 is worse, secondary_min_event_separation=2 is worse, and raising min_event_separation from 7 to 8 opened a lower-noise shelf that remained exact-flat at 9 before breaking sharply at 10. On that minsep8 shelf, top_move_candidates=3 is exact-flat, 2 and 1 only slightly weaken secondary metrics, top_board_candidates=2..4 are exact-flat, top_board_candidates=1 is harmful, beam_size=2 is slightly worse, secsep2 is worse, and event_window_radius=1..2, segment_board_drop_worst_frames=0, and secondary_peak_ratio=0.98 are exact no-ops. Lowering min_score_gain_per_added_move from 150.0 to 137.5 increased false changes and weakened secondaries, while raising it from 150.0 to 162.5, 175.0, 187.5, 200.0, 212.5, 225.0, 237.5, 250.0, 262.5, 275.0, 287.5, and 300.0 were exact no-ops and lowering min_total_score_gain from 150.0 down to 87.5 was also exact-flat. Lowering only min_score_gain_per_added_move to 143.75, 142.96875, 142.578125, and 142.3828125 were exact no-ops, while 142.33938083052635, 142.3393800854683, 142.33937859535217, 142.3393726348877, 142.33932495117188, 142.33856201171875, 142.3370361328125, 142.333984375, 142.28515625, and 142.1875 again increased false changes and weakened secondaries, so the lower edge lies between 142.33938083052635 and 142.33938101679087. This run restores the stable minsep8 shelf anchor and raises only min_score_gain_per_added_move from 142.33938083052635 to 142.3393809236586 to continue binary-searching that lower edge.
autoresearch/snapshots/20260419T155551Z_hybrid_lookahead_segmental_drop1_boardcands2_ratio95_props8_top4_detect10_lwindow3_minsep8_secsep1_thresh3_total150_permove142p33938087709248_lmargin9p935836791992188_m9p8957061767578125_r0_beam3_v865.py	0.071006	0.789778	0.739821	0.375000	0.024580	discard	Restore the recovered compact props8 sibling after recent local mapping showed the props7 shelf is saturated across top_move_candidates=5..16, beam_size=4 is an exact no-op, beam_size=2 is slightly worse, beam_size=1 is much worse, both hybrid acceptance gates are exact-flat down to 125.0, event_window_radius=1..2, segment_board_drop_worst_frames=0, and secondary_peak_ratio=0.98 are exact no-ops on the adjacent props7 shelf, secondary_min_event_separation=2 is worse there, and min_event_separation=8 and 6 are both worse than 7 there. On the compact props8 top4 anchor, top_board_candidates=2..4 are exact no-ops, top_move_candidates=4 is exact-flat while 5 is worse, secondary_min_event_separation=2 is worse, and raising min_event_separation from 7 to 8 opened a lower-noise shelf that remained exact-flat at 9 before breaking sharply at 10. On that minsep8 shelf, top_move_candidates=3 is exact-flat, 2 and 1 only slightly weaken secondary metrics, top_board_candidates=2..4 are exact-flat, top_board_candidates=1 is harmful, beam_size=2 is slightly worse, secsep2 is worse, and event_window_radius=1..2, segment_board_drop_worst_frames=0, and secondary_peak_ratio=0.98 are exact no-ops. Lowering min_score_gain_per_added_move from 150.0 to 137.5 increased false changes and weakened secondaries, while raising it from 150.0 to 162.5, 175.0, 187.5, 200.0, 212.5, 225.0, 237.5, 250.0, 262.5, 275.0, 287.5, and 300.0 were exact no-ops and lowering min_total_score_gain from 150.0 down to 87.5 was also exact-flat. Lowering only min_score_gain_per_added_move to 143.75, 142.96875, 142.578125, and 142.3828125 were exact no-ops, while 142.33938083052635, 142.3393800854683, 142.33937859535217, 142.3393726348877, 142.33932495117188, 142.33856201171875, 142.3370361328125, 142.333984375, 142.28515625, and 142.1875 again increased false changes and weakened secondaries, so the lower edge lies between 142.33938083052635 and 142.3393809236586. This run restores the stable minsep8 shelf anchor and raises only min_score_gain_per_added_move from 142.33938083052635 to 142.33938087709248 to continue binary-searching that lower edge.
autoresearch/snapshots/20260419T155743Z_hybrid_lookahead_segmental_drop1_boardcands2_ratio95_props8_top4_detect10_lwindow3_minsep8_secsep1_thresh3_total150_permove142p33938090037555_lmargin9p935836791992188_m9p8957061767578125_r0_beam3_v866.py	0.071006	0.799339	0.749250	0.375000	0.020699	discard	Restore the recovered compact props8 sibling after recent local mapping showed the props7 shelf is saturated across top_move_candidates=5..16, beam_size=4 is an exact no-op, beam_size=2 is slightly worse, beam_size=1 is much worse, both hybrid acceptance gates are exact-flat down to 125.0, event_window_radius=1..2, segment_board_drop_worst_frames=0, and secondary_peak_ratio=0.98 are exact no-ops on the adjacent props7 shelf, secondary_min_event_separation=2 is worse there, and min_event_separation=8 and 6 are both worse than 7 there. On the compact props8 top4 anchor, top_board_candidates=2..4 are exact no-ops, top_move_candidates=4 is exact-flat while 5 is worse, secondary_min_event_separation=2 is worse, and raising min_event_separation from 7 to 8 opened a lower-noise shelf that remained exact-flat at 9 before breaking sharply at 10. On that minsep8 shelf, top_move_candidates=3 is exact-flat, 2 and 1 only slightly weaken secondary metrics, top_board_candidates=2..4 are exact-flat, top_board_candidates=1 is harmful, beam_size=2 is slightly worse, secsep2 is worse, and event_window_radius=1..2, segment_board_drop_worst_frames=0, and secondary_peak_ratio=0.98 are exact no-ops. Lowering min_score_gain_per_added_move from 150.0 to 137.5 increased false changes and weakened secondaries, while raising it from 150.0 to 162.5, 175.0, 187.5, 200.0, 212.5, 225.0, 237.5, 250.0, 262.5, 275.0, 287.5, and 300.0 were exact no-ops and lowering min_total_score_gain from 150.0 down to 87.5 was also exact-flat. Lowering only min_score_gain_per_added_move to 143.75, 142.96875, 142.578125, and 142.3828125 were exact no-ops, while 142.33938087709248, 142.33938083052635, 142.3393800854683, 142.33937859535217, 142.3393726348877, 142.33932495117188, 142.33856201171875, 142.3370361328125, 142.333984375, 142.28515625, and 142.1875 again increased false changes and weakened secondaries, so the lower edge lies between 142.33938087709248 and 142.3393809236586. This run restores the stable minsep8 shelf anchor and raises only min_score_gain_per_added_move from 142.33938087709248 to 142.33938090037555 to continue binary-searching that lower edge.
autoresearch/snapshots/20260419T160411Z_hybrid_lookahead_segmental_drop1_boardcands2_ratio95_props8_top4_detect10_lwindow3_minsep8_secsep1_thresh3_total150_permove142p339380888734_lmargin9p935836791992188_m9p8957061767578125_r0_beam3_v867.py	0.071006	0.789778	0.739821	0.375000	0.024580	discard	Restore the recovered compact props8 sibling after recent local mapping showed the props7 shelf is saturated across top_move_candidates=5..16, beam_size=4 is an exact no-op, beam_size=2 is slightly worse, beam_size=1 is much worse, both hybrid acceptance gates are exact-flat down to 125.0, event_window_radius=1..2, segment_board_drop_worst_frames=0, and secondary_peak_ratio=0.98 are exact no-ops on the adjacent props7 shelf, secondary_min_event_separation=2 is worse there, and min_event_separation=8 and 6 are both worse than 7 there. On the compact props8 top4 anchor, top_board_candidates=2..4 are exact no-ops, top_move_candidates=4 is exact-flat while 5 is worse, secondary_min_event_separation=2 is worse, and raising min_event_separation from 7 to 8 opened a lower-noise shelf that remained exact-flat at 9 before breaking sharply at 10. On that minsep8 shelf, top_move_candidates=3 is exact-flat, 2 and 1 only slightly weaken secondary metrics, top_board_candidates=2..4 are exact-flat, top_board_candidates=1 is harmful, beam_size=2 is slightly worse, secsep2 is worse, and event_window_radius=1..2, segment_board_drop_worst_frames=0, and secondary_peak_ratio=0.98 are exact no-ops. Lowering min_score_gain_per_added_move from 150.0 to 137.5 increased false changes and weakened secondaries, while raising it from 150.0 to 162.5, 175.0, 187.5, 200.0, 212.5, 225.0, 237.5, 250.0, 262.5, 275.0, 287.5, and 300.0 were exact no-ops and lowering min_total_score_gain from 150.0 down to 87.5 was also exact-flat. Lowering only min_score_gain_per_added_move to 143.75, 142.96875, 142.578125, and 142.3828125 were exact no-ops, while 142.33938090037555, 142.33938087709248, 142.33938083052635, 142.3393800854683, 142.33937859535217, 142.3393726348877, 142.33932495117188, 142.33856201171875, 142.3370361328125, 142.333984375, 142.28515625, and 142.1875 again increased false changes and weakened secondaries, so the lower edge lies between 142.33938087709248 and 142.33938090037555. This run restores the stable minsep8 shelf anchor and raises only min_score_gain_per_added_move from 142.33938087709248 to 142.339380888734 to continue binary-searching that lower edge.
autoresearch/snapshots/20260419T160650Z_hybrid_lookahead_segmental_drop1_boardcands2_ratio95_props8_top4_detect10_lwindow3_minsep8_secsep1_thresh3_total150_permove142p33938089455478_lmargin9p935836791992188_m9p8957061767578125_r0_beam3_v868.py	0.071006	0.789778	0.739821	0.375000	0.024580	discard	Restore the recovered compact props8 sibling after recent local mapping showed the props7 shelf is saturated across top_move_candidates=5..16, beam_size=4 is an exact no-op, beam_size=2 is slightly worse, beam_size=1 is much worse, both hybrid acceptance gates are exact-flat down to 125.0, event_window_radius=1..2, segment_board_drop_worst_frames=0, and secondary_peak_ratio=0.98 are exact no-ops on the adjacent props7 shelf, secondary_min_event_separation=2 is worse there, and min_event_separation=8 and 6 are both worse than 7 there. On the compact props8 top4 anchor, top_board_candidates=2..4 are exact no-ops, top_move_candidates=4 is exact-flat while 5 is worse, secondary_min_event_separation=2 is worse, and raising min_event_separation from 7 to 8 opened a lower-noise shelf that remained exact-flat at 9 before breaking sharply at 10. On that minsep8 shelf, top_move_candidates=3 is exact-flat, 2 and 1 only slightly weaken secondary metrics, top_board_candidates=2..4 are exact-flat, top_board_candidates=1 is harmful, beam_size=2 is slightly worse, secsep2 is worse, and event_window_radius=1..2, segment_board_drop_worst_frames=0, and secondary_peak_ratio=0.98 are exact no-ops. Lowering min_score_gain_per_added_move from 150.0 to 137.5 increased false changes and weakened secondaries, while raising it from 150.0 to 162.5, 175.0, 187.5, 200.0, 212.5, 225.0, 237.5, 250.0, 262.5, 275.0, 287.5, and 300.0 were exact no-ops and lowering min_total_score_gain from 150.0 down to 87.5 was also exact-flat. Lowering only min_score_gain_per_added_move to 143.75, 142.96875, 142.578125, and 142.3828125 were exact no-ops, while 142.339380888734, 142.33938087709248, 142.33938083052635, 142.3393800854683, 142.33937859535217, 142.3393726348877, 142.33932495117188, 142.33856201171875, 142.3370361328125, 142.333984375, 142.28515625, and 142.1875 again increased false changes and weakened secondaries, so the lower edge lies between 142.339380888734 and 142.33938090037555. This run restores the stable minsep8 shelf anchor and raises only min_score_gain_per_added_move from 142.339380888734 to 142.33938089455478 to continue binary-searching that lower edge.
autoresearch/snapshots/20260419T160938Z_hybrid_lookahead_segmental_drop1_boardcands2_ratio95_props8_top4_detect10_lwindow3_minsep8_secsep1_thresh3_total150_permove142p33938089746516_lmargin9p935836791992188_m9p8957061767578125_r0_beam3_v869.py	0.071006	0.789778	0.739821	0.375000	0.024580	discard	Restore the recovered compact props8 sibling after recent local mapping showed the props7 shelf is saturated across top_move_candidates=5..16, beam_size=4 is an exact no-op, beam_size=2 is slightly worse, beam_size=1 is much worse, both hybrid acceptance gates are exact-flat down to 125.0, event_window_radius=1..2, segment_board_drop_worst_frames=0, and secondary_peak_ratio=0.98 are exact no-ops on the adjacent props7 shelf, secondary_min_event_separation=2 is worse there, and min_event_separation=8 and 6 are both worse than 7 there. On the compact props8 top4 anchor, top_board_candidates=2..4 are exact no-ops, top_move_candidates=4 is exact-flat while 5 is worse, secondary_min_event_separation=2 is worse, and raising min_event_separation from 7 to 8 opened a lower-noise shelf that remained exact-flat at 9 before breaking sharply at 10. On that minsep8 shelf, top_move_candidates=3 is exact-flat, 2 and 1 only slightly weaken secondary metrics, top_board_candidates=2..4 are exact-flat, top_board_candidates=1 is harmful, beam_size=2 is slightly worse, secsep2 is worse, and event_window_radius=1..2, segment_board_drop_worst_frames=0, and secondary_peak_ratio=0.98 are exact no-ops. Lowering min_score_gain_per_added_move from 150.0 to 137.5 increased false changes and weakened secondaries, while raising it from 150.0 to 162.5, 175.0, 187.5, 200.0, 212.5, 225.0, 237.5, 250.0, 262.5, 275.0, 287.5, and 300.0 were exact no-ops and lowering min_total_score_gain from 150.0 down to 87.5 was also exact-flat. Lowering only min_score_gain_per_added_move to 143.75, 142.96875, 142.578125, and 142.3828125 were exact no-ops, while 142.33938089455478, 142.339380888734, 142.33938087709248, 142.33938083052635, 142.3393800854683, 142.33937859535217, 142.3393726348877, 142.33932495117188, 142.33856201171875, 142.3370361328125, 142.333984375, 142.28515625, and 142.1875 again increased false changes and weakened secondaries, so the lower edge lies between 142.33938089455478 and 142.33938090037555. This run restores the stable minsep8 shelf anchor and raises only min_score_gain_per_added_move from 142.33938089455478 to 142.33938089746516 to continue binary-searching that lower edge.
