snapshot	board_exact	non_empty_accuracy	macro_f1	move_recall	false_change_rate	status	description
autoresearch/snapshots/20260419T070035Z_hybrid_lookahead_segmental_drop1_boardcands2_ratio95_props14_top14_detect10_lwindow1_minsep4_secsep1_thresh3_total150_permove125_lmargin9p5_m9p8957061767578125_r0_beam4_v598.py	0.074556	0.791794	0.744073	0.234375	0.009056	discard	Hybrid decoder keeps the baseline lookahead path unless a conservative board-only segmental pass wins the current score-gain gates, while following up the kept window1 branch after lowering lookahead window from 2 to 1 on the 9.5-margin baseline opened a lower-false-change but lower-recall tradeoff, lowering only max_event_proposals from 16 to 15 on the restored plain window1 branch improved recall and secondary metrics but worsened false-change, additionally narrowing top-board breadth from 4 to 3 recovered the lower false-change without hurting recall, lowering only max_event_proposals one step further from 15 to 14 on that boardcands3 plain props branch kept that recovered tradeoff, lowering segment_board_drop_worst_frames from 1 to 0 on that stronger props14 branch produced a new kept low-noise / lower-recall tradeoff, lowering secondary minimum event separation from 2 to 1 improved that tradeoff again, raising max_event_proposals from 14 to 15 was worse, lowering max_event_proposals from 14 to 13 was sharply worse, lowering top-move breadth from 4 to 1 was an exact no-op, raising beam size from 4 to 5, 6, and 7 were exact no-ops, beam8 was worse, raising event_window_radius from 0 to 1 and 2 were exact no-ops, raising LOOKAHEAD_WINDOW from 1 back to 2 was worse, min_event_separation 3 and 5 were both worse, raising secondary_min_event_separation from 1 to 2 and 3 was worse, raising secondary_peak_ratio from 0.95 to 0.98 was an exact no-op, lowering it through 0.92857666015625 stayed exact no-op while 0.928570556640625 reopened the noisier higher-recall tradeoff, lowering LOOKAHEAD_MARGIN from 9.5 to 9.0 was an exact no-op, raising it to 10.0 was also an exact no-op, lowering min_score_gain_per_added_move from 125.0 to 115.625 was worse, raising it to 137.5 was an exact no-op, lowering min_total_score_gain from 150.0 to 140.0 was an exact no-op, raising it to 175.0 was also an exact no-op, raising move_score_margin from 9.8957061767578125 to 10.0 and lowering it to 9.75 were exact no-ops, raising top_move_candidates from 4 to 8, 12, and 13 were exact no-ops, while 14 and 16 reopened the same slightly noisier higher-secondary tradeoff, beam5 with top14 collapsed back to the main branch, and beam3 with top14 opened a distinct lower-recall side variant, and narrowing only top_board_candidates from 3 to 2 while keeping top_move_candidates=14 on that widened move-menu branch to test whether the widened-menu tradeoff depends on effective board breadth or persists even when board candidates are explicitly constrained.
autoresearch/snapshots/20260419T071105Z_hybrid_lookahead_segmental_drop1_boardcands4_ratio95_props14_top14_detect10_lwindow1_minsep4_secsep1_thresh3_total150_permove125_lmargin9p5_m9p8957061767578125_r0_beam4_v599.py	0.074556	0.815720	0.784624	0.234375	0.010349	discard	Hybrid decoder keeps the baseline lookahead path unless a conservative board-only segmental pass wins the current score-gain gates, while following up the kept window1 branch after lowering lookahead window from 2 to 1 on the 9.5-margin baseline opened a lower-false-change but lower-recall tradeoff, lowering only max_event_proposals from 16 to 15 on the restored plain window1 branch improved recall and secondary metrics but worsened false-change, additionally narrowing top-board breadth from 4 to 3 recovered the lower false-change without hurting recall, lowering only max_event_proposals one step further from 15 to 14 on that boardcands3 plain props branch kept that recovered tradeoff, lowering segment_board_drop_worst_frames from 1 to 0 on that stronger props14 branch produced a new kept low-noise / lower-recall tradeoff, lowering secondary minimum event separation from 2 to 1 improved that tradeoff again, raising max_event_proposals from 14 to 15 was worse, lowering max_event_proposals from 14 to 13 was sharply worse, lowering top-move breadth from 4 to 1 was an exact no-op, raising beam size from 4 to 5, 6, and 7 were exact no-ops, beam8 was worse, raising event_window_radius from 0 to 1 and 2 were exact no-ops, raising LOOKAHEAD_WINDOW from 1 back to 2 was worse, min_event_separation 3 and 5 were both worse, raising secondary_min_event_separation from 1 to 2 and 3 was worse, raising secondary_peak_ratio from 0.95 to 0.98 was an exact no-op, lowering it through 0.92857666015625 stayed exact no-op while 0.928570556640625 reopened the noisier higher-recall tradeoff, lowering LOOKAHEAD_MARGIN from 9.5 to 9.0 was an exact no-op, raising it to 10.0 was also an exact no-op, lowering min_score_gain_per_added_move from 125.0 to 115.625 was worse, raising it to 137.5 was an exact no-op, lowering min_total_score_gain from 150.0 to 140.0 was an exact no-op, raising it to 175.0 was also an exact no-op, raising move_score_margin from 9.8957061767578125 to 10.0 and lowering it to 9.75 were exact no-ops, raising top_move_candidates from 4 to 8, 12, and 13 were exact no-ops, while 14 and 16 reopened the same slightly noisier higher-secondary tradeoff, beam5 with top14 collapsed back to the main branch, beam3 with top14 opened the same lower-recall side variant as the older boardcands4 beam3 branch, and narrowing board breadth to 2 with top14 weakened secondaries back toward the main branch, and raising only top_board_candidates from 3 to 4 while keeping top_move_candidates=14 on that widened move-menu branch to test whether the widened-menu tradeoff is literally the older beam4 boardcands4 side branch or only a coincidental metric match.
autoresearch/snapshots/20260419T071235Z_hybrid_lookahead_segmental_drop1_boardcands3_ratio95_props14_top14_detect10_lwindow1_minsep4_secsep1_thresh3_total150_permove137p5_lmargin9p5_m9p8957061767578125_r0_beam4_v600.py	0.074556	0.815720	0.784624	0.234375	0.010349	discard	Hybrid decoder keeps the baseline lookahead path unless a conservative board-only segmental pass wins the current score-gain gates. On the kept v545 branch, raising top_move_candidates from 4 to 14 reopened a higher-secondary but slightly noisier beam4 side branch, beam5 collapsed back to the main branch, beam3 shifted to a lower-recall variant, boardcands2 collapsed toward the main branch, and boardcands4 reproduced the same side-branch metrics exactly. This run keeps top_move_candidates=14 and raises only min_score_gain_per_added_move from 125.0 to 137.5 to test whether a stricter hybrid acceptance gate can preserve the widened-menu branch's stronger secondary metrics while suppressing its extra false changes.
autoresearch/snapshots/20260419T071400Z_hybrid_lookahead_segmental_drop1_boardcands3_ratio95_props14_top14_detect10_lwindow1_minsep4_secsep1_thresh3_total150_permove125_lmargin9p5_m9p8957061767578125_r0_beam2_v601.py	0.074556	0.786264	0.753251	0.234375	0.020699	discard	Hybrid decoder keeps the baseline lookahead path unless a conservative board-only segmental pass wins the current score-gain gates. On the kept v545 branch, raising top_move_candidates from 4 to 14 reopened the beam4 higher-secondary side branch, beam5 collapsed back to the main branch, beam3 shifted to the lower-recall side variant, boardcands2 weakened toward the main branch, and boardcands4 reproduced the beam4 side-branch metrics exactly. This run keeps top_move_candidates=14 and lowers only beam_size from 4 to 2 to test whether that widened-menu side family persists below beam3 or whether beam3 is already its lower support edge.
autoresearch/snapshots/20260419T071524Z_hybrid_lookahead_segmental_drop1_boardcands3_ratio95_props14_top4_detect10_lwindow1_minsep4_secsep1_thresh3_total150_permove125_lmargin9p5_m9p8957061767578125_r0_beam2_v602.py	0.074556	0.786264	0.753251	0.234375	0.020699	discard	Hybrid decoder keeps the baseline lookahead path unless a conservative board-only segmental pass wins the current score-gain gates. On the kept v545 branch, the recent top14 branch mapping showed beam4 routes into the higher-secondary boardcands4-style side branch, beam5 collapses back to the main branch, beam3 matches the known beam3 lower-recall branch, and beam2 with top14 becomes a much noisier tradeoff. This run lowers only beam_size from 4 to 2 on the plain top4 kept branch to test whether that beam2 failure mode is inherent to the beam reduction itself or only appears when the move menu is widened.
autoresearch/snapshots/20260419T071620Z_hybrid_lookahead_segmental_drop1_boardcands3_ratio95_props14_top4_detect10_lwindow1_minsep4_secsep1_thresh3_total150_permove125_lmargin9p5_m9p8957061767578125_r0_beam1_v603.py	0.074556	0.780838	0.737598	0.171875	0.018111	discard	Hybrid decoder keeps the baseline lookahead path unless a conservative board-only segmental pass wins the current score-gain gates. On the kept v545 branch, the recent lower-beam sweep showed beam3 falls onto a lower-recall side variant, while beam2 produces the same much noisier tradeoff on both the plain top4 branch and the widened top14 branch. This run lowers only beam_size from 4 to 1 on the plain kept branch to complete the lower-beam edge check and confirm whether beam2 was the cliff or whether the whole <=2 regime shares the same failure mode.
autoresearch/snapshots/20260419T071803Z_hybrid_lookahead_segmental_drop1_boardcands3_ratio95_props14_top4_detect10_lwindow1_minsep4_secsep2_thresh3_total150_permove125_lmargin9p5_m9p8957061767578125_r0_beam3_v604.py	0.074556	0.787918	0.755149	0.250000	0.021992	discard	Hybrid decoder keeps the baseline lookahead path unless a conservative board-only segmental pass wins the current score-gain gates. The recent lower-beam sweep on the kept v545 branch established beam3 as the last usable lower-beam side branch, while beam2 and beam1 both degrade sharply and top14 does not change the beam3 branch. This run keeps beam_size=3 and raises only secondary_min_event_separation from 1 to 2 to test whether the beam3 branch still depends on the aggressive secsep1 setting or can recover a better recall/noise tradeoff once secondary proposals are spaced slightly farther apart.
autoresearch/snapshots/20260419T071941Z_hybrid_lookahead_segmental_drop1_boardcands3_ratio95_props14_top4_detect10_lwindow1_minsep4_secsep3_thresh3_total150_permove125_lmargin9p5_m9p8957061767578125_r0_beam3_v605.py	0.074556	0.787918	0.755149	0.234375	0.023286	discard	Hybrid decoder keeps the baseline lookahead path unless a conservative board-only segmental pass wins the current score-gain gates. The recent lower-beam sweep on the kept v545 branch established beam3 as the last usable lower-beam side branch, while beam2 and beam1 both degrade sharply. A first temporal follow-up on beam3 showed that raising secondary_min_event_separation from 1 to 2 reopens a much noisier higher-recall tradeoff. This run keeps beam_size=3 and raises only secondary_min_event_separation from 1 to 3 to test whether beam3 inherits the same upper secsep shelf as the main branch or whether secsep2 was already the whole transition.
autoresearch/snapshots/20260419T072049Z_hybrid_lookahead_segmental_drop1_boardcands3_ratio95_props14_top4_detect10_lwindow1_minsep3_secsep1_thresh3_total150_permove125_lmargin9p5_m9p8957061767578125_r0_beam3_v606.py	0.042604	0.784146	0.748413	0.203125	0.025873	discard	Hybrid decoder keeps the baseline lookahead path unless a conservative board-only segmental pass wins the current score-gain gates. The recent lower-beam sweep on the kept v545 branch established beam3 as the last usable lower-beam side branch, while beam2 and beam1 both degrade sharply, and follow-up secsep2/secsep3 probes on beam3 only reopened noisier tradeoffs. This run keeps beam_size=3 and lowers only min_event_separation from 4 to 3 to test whether the beam3 branch's recall loss is mainly coming from the primary spacing constraint rather than from beam reduction itself.
autoresearch/snapshots/20260419T072150Z_hybrid_lookahead_segmental_drop1_boardcands3_ratio95_props14_top4_detect10_lwindow1_minsep4_secsep1_thresh3_total150_permove125_lmargin9p5_m9p8957061767578125_r1_beam3_v607.py	0.074556	0.815720	0.784846	0.218750	0.011643	discard	Hybrid decoder keeps the baseline lookahead path unless a conservative board-only segmental pass wins the current score-gain gates. The recent lower-beam sweep on the kept v545 branch established beam3 as the last usable lower-beam side branch, while beam2 and beam1 both degrade sharply, and follow-up beam3 probes on secondary spacing and primary spacing only reopened noisier or weaker tradeoffs. This run keeps beam_size=3 and raises only event_window_radius from 0 to 1 to test whether a small temporal proposal neighborhood can recover some beam3 recall without reopening the much noisier beam2-style failure mode.
autoresearch/snapshots/20260419T072315Z_hybrid_lookahead_segmental_drop1_boardcands3_ratio95_props14_top4_detect10_lwindow2_minsep4_secsep1_thresh3_total150_permove125_lmargin9p5_m9p8957061767578125_r0_beam3_v608.py	0.074556	0.785954	0.756042	0.312500	0.024580	discard	Hybrid decoder keeps the baseline lookahead path unless a conservative board-only segmental pass wins the current score-gain gates. The recent lower-beam sweep on the kept v545 branch established beam3 as the last usable lower-beam side branch, while beam2 and beam1 both degrade sharply, and follow-up beam3 probes on secondary spacing, primary spacing, and event radius did not improve that branch. This run keeps beam_size=3 and raises only LOOKAHEAD_WINDOW from 1 to 2 to test whether a longer baseline lookahead path can recover some recall on the beam3 branch without falling back into the clearly worse beam4 lwindow2 behavior.
autoresearch/snapshots/20260419T072419Z_hybrid_lookahead_segmental_drop1_boardcands3_ratio95_props14_top4_detect10_lwindow2_minsep4_secsep1_thresh3_total150_permove137p5_lmargin9p5_m9p8957061767578125_r0_beam3_v609.py	0.074556	0.814428	0.783465	0.296875	0.014230	discard	Hybrid decoder keeps the baseline lookahead path unless a conservative board-only segmental pass wins the current score-gain gates. The recent lower-beam sweep on the kept v545 branch established beam3 as the last usable lower-beam side branch, while beam2 and beam1 both degrade sharply. Follow-up beam3 probes on secondary spacing, primary spacing, and event radius did not improve that branch, but raising LOOKAHEAD_WINDOW from 1 to 2 reopened a much higher-recall and much noisier tradeoff. This run keeps that beam3 + lwindow2 branch and raises only min_score_gain_per_added_move from 125.0 to 137.5 to test whether a stricter hybrid acceptance gate can retain some of the recovered recall while suppressing the extra false changes.
autoresearch/snapshots/20260419T072531Z_hybrid_lookahead_segmental_drop1_boardcands3_ratio95_props14_top4_detect10_lwindow2_minsep4_secsep1_thresh3_total175_permove137p5_lmargin9p5_m9p8957061767578125_r0_beam3_v610.py	0.074556	0.814428	0.783465	0.296875	0.014230	discard	Hybrid decoder keeps the baseline lookahead path unless a conservative board-only segmental pass wins the current score-gain gates. The recent lower-beam sweep on the kept v545 branch established beam3 as the last usable lower-beam side branch, while beam2 and beam1 both degrade sharply. Follow-up beam3 probes on secondary spacing, primary spacing, and event radius did not improve that branch, but raising LOOKAHEAD_WINDOW from 1 to 2 reopened a much higher-recall and much noisier tradeoff, and then tightening min_score_gain_per_added_move from 125.0 to 137.5 reduced that noise materially while preserving most of the recall gain. This run keeps that beam3 + lwindow2 + permove137.5 branch and raises only min_total_score_gain from 150.0 to 175.0 to test whether a stricter total-gain gate can shave additional false changes without collapsing the recovered recall.
autoresearch/snapshots/20260419T072642Z_hybrid_lookahead_segmental_drop1_boardcands3_ratio95_props14_top4_detect10_lwindow2_minsep4_secsep1_thresh3_total150_permove150_lmargin9p5_m9p8957061767578125_r0_beam3_v611.py	0.074556	0.814428	0.783465	0.296875	0.014230	discard	Hybrid decoder keeps the baseline lookahead path unless a conservative board-only segmental pass wins the current score-gain gates. The recent lower-beam sweep on the kept v545 branch established beam3 as the last usable lower-beam side branch, while beam2 and beam1 both degrade sharply. Follow-up beam3 probes on secondary spacing, primary spacing, and event radius did not improve that branch, but raising LOOKAHEAD_WINDOW from 1 to 2 reopened a much higher-recall and much noisier tradeoff, and tightening min_score_gain_per_added_move from 125.0 to 137.5 reduced that noise materially while preserving most of the recall gain, while min_total_score_gain 175.0 was an exact no-op there. This run keeps that beam3 + lwindow2 branch and raises only min_score_gain_per_added_move from 137.5 to 150.0 to test whether the local per-move acceptance optimum is still on the tighter side or whether 137.5 was already the useful edge.
autoresearch/snapshots/20260419T072755Z_hybrid_lookahead_segmental_drop1_boardcands3_ratio95_props14_top4_detect10_lwindow2_minsep4_secsep1_thresh3_total150_permove175_lmargin9p5_m9p8957061767578125_r0_beam3_v612.py	0.074556	0.814428	0.783465	0.296875	0.014230	discard	Hybrid decoder keeps the baseline lookahead path unless a conservative board-only segmental pass wins the current score-gain gates. The recent lower-beam sweep on the kept v545 branch established beam3 as the last usable lower-beam side branch, while beam2 and beam1 both degrade sharply. Follow-up beam3 probes on secondary spacing, primary spacing, and event radius did not improve that branch, but raising LOOKAHEAD_WINDOW from 1 to 2 reopened a much higher-recall and much noisier tradeoff, and tightening min_score_gain_per_added_move from 125.0 to 137.5 reduced that noise materially while preserving most of the recall gain, while 150.0 was an exact no-op. This run keeps that beam3 + lwindow2 branch and raises only min_score_gain_per_added_move from 150.0 to 175.0 to test whether the upper side of the per-move acceptance plateau is still flat or whether the branch finally starts to collapse at a meaningfully stricter handoff gate.
autoresearch/snapshots/20260419T072928Z_hybrid_lookahead_segmental_drop1_boardcands3_ratio95_props14_top4_detect10_lwindow2_minsep4_secsep1_thresh3_total150_permove137p5_lmargin9p5_m9p8957061767578125_r1_beam3_v613.py	0.074556	0.814428	0.783465	0.296875	0.014230	discard	Hybrid decoder keeps the baseline lookahead path unless a conservative board-only segmental pass wins the current score-gain gates. The recent lower-beam sweep on the kept v545 branch established beam3 as the last usable lower-beam side branch, while beam2 and beam1 both degrade sharply. Follow-up beam3 probes on secondary spacing, primary spacing, and event radius did not improve that branch, but raising LOOKAHEAD_WINDOW from 1 to 2 reopened a much higher-recall and much noisier tradeoff, and tightening min_score_gain_per_added_move from 125.0 to 137.5 reduced that noise materially while preserving most of the recall gain, while 150.0 and 175.0 were exact no-ops. This run keeps that beam3 + lwindow2 + permove137.5 branch and raises only event_window_radius from 0 to 1 to test whether a small temporal proposal neighborhood can recover a bit more recall without reopening the earlier high-noise surface.
autoresearch/snapshots/20260419T073056Z_hybrid_lookahead_segmental_drop1_boardcands3_ratio95_props14_top1_detect10_lwindow2_minsep4_secsep1_thresh3_total150_permove137p5_lmargin9p5_m9p8957061767578125_r0_beam3_v614.py	0.074556	0.814428	0.783465	0.296875	0.014230	discard	Hybrid decoder keeps the baseline lookahead path unless a conservative board-only segmental pass wins the current score-gain gates. The recent lower-beam sweep on the kept v545 branch established beam3 as the last usable lower-beam side branch, while beam2 and beam1 both degrade sharply. Follow-up beam3 probes on secondary spacing, primary spacing, and event radius did not improve that branch, but raising LOOKAHEAD_WINDOW from 1 to 2 reopened a much higher-recall and much noisier tradeoff, and tightening min_score_gain_per_added_move from 125.0 to 137.5 reduced that noise materially while preserving most of the recall gain, while stricter per-move and total-gain gates above that were exact no-ops. This run keeps that beam3 + lwindow2 + permove137.5 branch and lowers only top_move_candidates from 4 to 1 to test whether the recovered-recall branch actually needs a wider move menu or whether the same tradeoff survives with the cheapest move search width.
