snapshot	board_exact	non_empty_accuracy	macro_f1	move_recall	false_change_rate	status	description
autoresearch/snapshots/20260420T063319Z_hybrid_p8_m8_w3_v1330.py	0.071006	0.799339	0.749250	0.375000	0.020699	discard	Restore the compact props8 + minsep8 hybrid shelf anchored at lwindow3, beam3, top4, boardcands2, secsep1, radius0, drop1, props8, total150, and lmargin9.935836791992188. The latest executed bracket is harmful at 142.33938090006510890361823840066790580749511718749999999999999999999999999999999999999999999999999999999999999999999999999999999999999999974688861809368262427713709800499209242259277384005154530691379388916699428684022734373393423109288251301684396856674864262421623186895511362298581647286125323404284085588076615709522269825654802898931335123847164641870093918068171411679980151251356801367364823818206787109375 and exact-flat at 142.339380900065108903618238400667905807495117187500000000000000000000000000000000000000000000000000000000000000000000000000000000000000000688644264600174955692909479127624257464474450621609691191937154032508986494861333893374153681414611420911606325597043121044435785832335690404415592618501289744165287004565540540992889254107201490617256459210198523580866041323459922091766953911474047345109283924102783203125. This run prepares their exact midpoint, 142.339380900065108903618238400667905807495117187500000000000000000000000000000000000000000000000000000000000000000000000000000000000000000217766441346928789985023288566308174943533612230830618249425473960837990390850780618554043956253746966964225147081895881834326008850645402013700704545681271489104063930223153349044055976181874759803284905224335084999783490252070818104283377711993807679391466081142425537109375, with a short experiment name to avoid filename-too-long failures.
autoresearch/snapshots/20260420T063445Z_hybrid_p8_m8_w3_v1331.py	0.071006	0.799339	0.749250	0.375000	0.020699	discard	Restore the compact props8 + minsep8 hybrid shelf anchored at lwindow3, beam3, top4, boardcands2, secsep1, radius0, drop1, props8, total150, and lmargin9.935836791992188. The latest executed bracket is harmful at 142.33938090006510890361823840066790580749511718749999999999999999999999999999999999999999999999999999999999999999999999999999999999999999974688861809368262427713709800499209242259277384005154530691379388916699428684022734373393423109288251301684396856674864262421623186895511362298581647286125323404284085588076615709522269825654802898931335123847164641870093918068171411679980151251356801367364823818206787109375 and exact-flat at 142.339380900065108903618238400667905807495117187500000000000000000000000000000000000000000000000000000000000000000000000000000000000000000688644264600174955692909479127624257464474450621609691191937154032508986494861333893374153681414611420911606325597043121044435785832335690404415592618501289744165287004565540540992889254107201490617256459210198523580866041323459922091766953911474047345109283924102783203125. This run prepares their exact midpoint, 142.339380900065108903618238400667905807495117187500000000000000000000000000000000000000000000000000000000000000000000000000000000000000000217766441346928789985023288566308174943533612230830618249425473960837990390850780618554043956253746966964225147081895881834326008850645402013700704545681271489104063930223153349044055976181874759803284905224335084999783490252070818104283377711993807679391466081142425537109375, with a short experiment name to avoid filename-too-long failures.
autoresearch/snapshots/20260420T063606Z_hybrid_p8_m8_w3_v1332.py	0.071006	0.789778	0.739821	0.375000	0.024580	discard	Restore the compact props8 + minsep8 hybrid shelf anchored at lwindow3, beam3, top4, boardcands2, secsep1, radius0, drop1, props8, total150, and lmargin9.935836791992188. The latest executed bracket is harmful at 142.33938090006510890361823840066790580749511718749999999999999999999999999999999999999999999999999999999999999999999999999999999999999999974688861809368262427713709800499209242259277384005154530691379388916699428684022734373393423109288251301684396856674864262421623186895511362298581647286125323404284085588076615709522269825654802898931335123847164641870093918068171411679980151251356801367364823818206787109375 and exact-flat at 142.339380900065108903618238400667905807495117187500000000000000000000000000000000000000000000000000000000000000000000000000000000000000000217766441346928789985023288566308174943533612230830618249425473960837990390850780618554043956253746966964225147081895881834326008850645402013700704545681271489104063930223153349044055976181874759803284905224335084999783490252070818104283377711993807679391466081142425537109375. This run prepares their exact midpoint, 142.3393809000651089036182384006679058074951171874999999999999999999999999999999999999999999999999999999999999999999999999999999999999999999823275297203057071310801932856501336830631930354410817781696339250024923388455039811439890936733147399905345578243222622292711203598002578183432605092712623615734523930519597530696393372192113943962991282314033657092422147163762661105415896122536878465325571596622467041015625, with a short experiment name to avoid filename-too-long failures.
autoresearch/snapshots/20260420T063738Z_hybrid_p8_m8_w3_v1332.py	0.071006	0.799339	0.749250	0.375000	0.020699	discard	Restore the compact props8 + minsep8 hybrid shelf anchored at lwindow3, beam3, top4, boardcands2, secsep1, radius0, drop1, props8, total150, and lmargin9.935836791992188. The latest executed bracket is harmful at 142.3393809000651089036182384006679058074951171874999999999999999999999999999999999999999999999999999999999999999999999999999999999999999988051329715871902928613647168823599273807110970584933994218904337458250020788191207940937147807711536051220816115364541642039966779055745368415560403272212167239203947071959917731975561424058945673613702432667447692565358370379035061418326491135530886822380125522613525390625 and exact-flat at 142.339380900065108903618238400667905807495117187500000000000000000000000000000000000000000000000000000000000000000000000000000000000000217766441346928789985023288566308174943533612230830618249425473960837990390850780618554043956253746966964225147081895881834326008850645402013700704545681271489104063930223153349044055976181874759803284905224335084999783490252070818104283377711993807679391466081142425537109375. This run prepares their exact midpoint, 142.33938090006510890361823840066790580749511718750000000000000000000000000000000000000000000000000000000000000000000000000000000000000010828578715925799013894232664159526743545716166394455582442368219729190769646479986967406883551725906028467361434671616799926500276427548827527113029300424635291399216246517467040862676616214032718532313773380091488452001304455436080521260518055368038403685204684734344482421875, with a short experiment name to avoid filename-too-long failures.
autoresearch/snapshots/20260420T064412Z_hybrid_p8_m8_w3_v1333.py	0.071006	0.799339	0.749250	0.375000	0.020699	discard	Restore the compact props8 + minsep8 hybrid shelf anchored at lwindow3, beam3, top4, boardcands2, secsep1, radius0, drop1, props8, total150, and lmargin9.935836791992188. The true executed harmful/flat bracket is now harmful at 142.3393809000651089036182384006679058074951171874999999999999999999999999999999999999999999999999999999999999999999999999999999999999999999823275297203057071310801932856501336830631930354410817781696339250024923388455039811439890936733147399905345578243222622292711203598002578183432605092712623615734523930519597530696393372192113943962991282314033657092422147163762661105415896122536878465325571596622467041015625 and flat at 142.3393809000651089036182384006679058074951171875000000000000000000000000000000000000000000000000000000000000000000000000000000000000000000608071669291800680823945583792028141032199994339042606019215806036143250228472628602806740478667921489817647542435134687642894165234153058834624085214079320707503229054423576183944448835400991828652943872290472721394226398949411167751221856455003944574855268001556396484375. This run prepares their exact midpoint, 142.33938090006510890361823840066790580749511718750000000000000000000000000000000000000000000000000000000000000000000000000000000000000000002156734832474288760673737583242647389314159623467267119004560726430840868084638342071233157077005344448614965603391786549678026844160778185090283451533959721616188764924715868573204211037965528863079675773022531892433242730565869144283188762887704115200904197990894317626953125, with a short experiment name to avoid filename-too-long failures.
autoresearch/snapshots/20260420T064522Z_hybrid_p8_m8_w3_v1334.py	0.071006	0.799339	0.749250	0.375000	0.020699	discard	Restore the compact props8 + minsep8 hybrid shelf anchored at lwindow3, beam3, top4, boardcands2, secsep1, radius0, drop1, props8, total150, and lmargin9.935836791992188. The true executed harmful/flat bracket is now harmful at 142.3393809000651089036182384006679058074951171874999999999999999999999999999999999999999999999999999999999999999999999999999999999999999999823275297203057071310801932856501336830631930354410817781696339250024923388455039811439890936733147399905345578243222622292711203598002578183432605092712623615734523930519597530696393372192113943962991282314033657092422147163762661105415896122536878465325571596622467041015625 and flat at 142.33938090006510890361823840066790580749511718750000000000000000000000000000000000000000000000000000000000000000000000000000000000000000002156734832474288760673737583242647389314159623467267119004560726430840868084638342071233157077005344448614965603391786549678026844160778185090283451533959721616188764924715868573204211037965528863079675773022531892433242730565869144283188762887704115200904197990894317626953125. This run prepares their exact midpoint, 142.339380900065108903618238400667905807495117187500000000000000000000000000000000000000000000000000000000000000000000000000000000000000000001947439022524297368908784559038303788102394635056876484107620594655450509845943700928160332221684092238342106929120063863025694400704019834623047512305429788867670021149559219400840723799433341513547942980814342316787321011017478776686738620565364499270799569785594940185546875, with a short experiment name to avoid filename-too-long failures.
autoresearch/snapshots/20260420T064628Z_hybrid_p8_m8_w3_v1335.py	0.071006	0.789778	0.739821	0.375000	0.024580	discard	Restore the compact props8 + minsep8 hybrid shelf anchored at lwindow3, beam3, top4, boardcands2, secsep1, radius0, drop1, props8, total150, and lmargin9.935836791992188. The true executed harmful/flat bracket is now harmful at 142.3393809000651089036182384006679058074951171874999999999999999999999999999999999999999999999999999999999999999999999999999999999999999999823275297203057071310801932856501336830631930354410817781696339250024923388455039811439890936733147399905345578243222622292711203598002578183432605092712623615734523930519597530696393372192113943962991282314033657092422147163762661105415896122536878465325571596622467041015625 and flat at 142.339380900065108903618238400667905807495117187500000000000000000000000000000000000000000000000000000000000000000000000000000000000000000001947439022524297368908784559038303788102394635056876484107620594655450509845943700928160332221684092238342106929120063863025694400704019834623047512305429788867670021149559219400840723799433341513547942980814342316787321011017478776686738620565364499270799569785594940185546875. This run prepares their exact midpoint, 142.3393809000651089036182384006679058074951171874999999999999999999999999999999999999999999999999999999999999999999999999999999999999999999921374843714150022499944889223442187355827938352489791311386272598289714243457238410360747129474994161144383323767211630461484073802521388264831540107883460752205612071007594862352400305093223679549235356061088540130147678636968724436141641164095261729016783647239208221435546875, with a short experiment name to avoid filename-too-long failures.
autoresearch/snapshots/20260420T064740Z_hybrid_p8_m8_w3_v1336.py	0.071006	0.789778	0.739821	0.375000	0.024580	discard	Restore the compact props8 + minsep8 hybrid shelf anchored at lwindow3, beam3, top4, boardcands2, secsep1, radius0, drop1, props8, total150, and lmargin9.935836791992188. The true executed harmful/flat bracket is now harmful at 142.3393809000651089036182384006679058074951171874999999999999999999999999999999999999999999999999999999999999999999999999999999999999999999921374843714150022499944889223442187355827938352489791311386272598289714243457238410360747129474994161144383323767211630461484073802521388264831540107883460752205612071007594862352400305093223679549235356061088540130147678636968724436141641164095261729016783647239208221435546875 and flat at 142.339380900065108903618238400667905807495117187500000000000000000000000000000000000000000000000000000000000000000000000000000000000000000001947439022524297368908784559038303788102394635056876484107620594655450509845943700928160332221684092238342106929120063863025694400704019834623047512305429788867670021149559219400840723799433341513547942980814342316787321011017478776686738620565364499270799569785594940185546875. This run prepares their exact midpoint, 142.33938090006510890361823840066790580749511718749999999999999999999999999999999999999999999999999999999999999999999999999999999999999999999704246169696964980945163674069126126184259423515292780762312392724221096709583377098211752258459175417639021965292061345458705089047807933055310076154688793204411561412515935281804037715437785473423573929346159816490104443735717561015045136848744533608623896725475788116455078125, with a short experiment name to avoid filename-too-long failures.
autoresearch/snapshots/20260420T064853Z_hybrid_p8_m8_w3_v1337.py	0.071006	0.789778	0.739821	0.375000	0.024580	discard	Restore the compact props8 + minsep8 hybrid shelf anchored at lwindow3, beam3, top4, boardcands2, secsep1, radius0, drop1, props8, total150, and lmargin9.935836791992188. The true executed harmful/flat bracket is now harmful at 142.33938090006510890361823840066790580749511718749999999999999999999999999999999999999999999999999999999999999999999999999999999999999999999704246169696964980945163674069126126184259423515292780762312392724221096709583377098211752258459175417639021965292061345458705089047807933055310076154688793204411561412515935281804037715437785473423573929346159816490104443735717561015045136848744533608623896725475788116455078125 and flat at 142.339380900065108903618238400667905807495117187500000000000000000000000000000000000000000000000000000000000000000000000000000000000000000001947439022524297368908784559038303788102394635056876484107620594655450509845943700928160332221684092238342106929120063863025694400704019834623047512305429788867670021149559219400840723799433341513547942980814342316787321011017478776686738620565364499270799569785594940185546875. This run prepares their exact midpoint, 142.339380900065108903618238400667905807495117187499999999999999999999999999999999999999999999999999999999999999999999999999999999999999999999494950359746973589180210649864782524972494435104902145865372260948830738470888735955138927403137923207366163291020338658806372645591049582588074136926158860455892817637359286109440550476905598123891841137137970240844182724187327193418594994526404917678519268520176410675048828125, with a short experiment name to avoid filename-too-long failures.
autoresearch/snapshots/20260420T065001Z_hybrid_p8_m8_w3_v1338.py	0.071006	0.799339	0.749250	0.375000	0.020699	discard	Restore the compact props8 + minsep8 hybrid shelf anchored at lwindow3, beam3, top4, boardcands2, secsep1, radius0, drop1, props8, total150, and lmargin9.935836791992188. The true executed harmful/flat bracket is now harmful at 142.339380900065108903618238400667905807495117187499999999999999999999999999999999999999999999999999999999999999999999999999999999999999999999494950359746973589180210649864782524972494435104902145865372260948830738470888735955138927403137923207366163291020338658806372645591049582588074136926158860455892817637359286109440550476905598123891841137137970240844182724187327193418594994526404917678519268520176410675048828125 and flat at 142.339380900065108903618238400667905807495117187500000000000000000000000000000000000000000000000000000000000000000000000000000000000000000001947439022524297368908784559038303788102394635056876484107620594655450509845943700928160332221684092238342106929120063863025694400704019834623047512305429788867670021149559219400840723799433341513547942980814342316787321011017478776686738620565364499270799569785594940185546875. This run prepares their exact midpoint, 142.3393809000651089036182384006679058074951171875000000000000000000000000000000000000000000000000000000000000000000000000000000000000000000007211946911356354790444976044515431565374445350808893149864964278021406241584162184416496298124110077228541351100702012609160335231475347086055608246157943246617814193934592527551406371381694698187198920589761562788157518676024029850526668075458847084746594191528856754302978515625, with a short experiment name to avoid filename-too-long failures.
autoresearch/snapshots/20260420T065113Z_hybrid_p8_m8_w3_v1339.py	0.071006	0.799339	0.749250	0.375000	0.020699	discard	Restore the compact props8 + minsep8 hybrid shelf anchored at lwindow3, beam3, top4, boardcands2, secsep1, radius0, drop1, props8, total150, and lmargin9.935836791992188. The true executed harmful/flat bracket is now harmful at 142.339380900065108903618238400667905807495117187499999999999999999999999999999999999999999999999999999999999999999999999999999999999999999999494950359746973589180210649864782524972494435104902145865372260948830738470888735955138927403137923207366163291020338658806372645591049582588074136926158860455892817637359286109440550476905598123891841137137970240844182724187327193418594994526404917678519268520176410675048828125 and flat at 142.3393809000651089036182384006679058074951171875000000000000000000000000000000000000000000000000000000000000000000000000000000000000000000007211946911356354790444976044515431565374445350808893149864964278021406241584162184416496298124110077228541351100702012609160335231475347086055608246157943246617814193934592527551406371381694698187198920589761562788157518676024029850526668075458847084746594191528856754302978515625. This run prepares their exact midpoint, 142.33938090006510890361823840066790580749511718750000000000000000000000000000000000000000000000000000000000000000000000000000000000000000000010807252544130453411235412715816284075496948509289573042593434437548568131465247719839427860777446546511014920054526995986120308436929214559681748077097659255883711851540926943229059380753753397130586659805706325982996729589486508923563090103614481307658934383653104305267333984375, with a short experiment name to avoid filename-too-long failures.
autoresearch/snapshots/20260420T065232Z_hybrid_p8_m8_w3_v1340.py	0.071006	0.789778	0.739821	0.375000	0.024580	discard	Restore the compact props8 + minsep8 hybrid shelf anchored at lwindow3, beam3, top4, boardcands2, secsep1, radius0, drop1, props8, total150, and lmargin9.935836791992188. The true executed harmful/flat bracket is now harmful at 142.339380900065108903618238400667905807495117187499999999999999999999999999999999999999999999999999999999999999999999999999999999999999999999494950359746973589180210649864782524972494435104902145865372260948830738470888735955138927403137923207366163291020338658806372645591049582588074136926158860455892817637359286109440550476905598123891841137137970240844182724187327193418594994526404917678519268520176410675048828125 and flat at 142.33938090006510890361823840066790580749511718750000000000000000000000000000000000000000000000000000000000000000000000000000000000000000000010807252544130453411235412715816284075496948509289573042593434437548568131465247719839427860777446546511014920054526995986120308436929214559681748077097659255883711851540926943229059380753753397130586659805706325982996729589486508923563090103614481307658934383653104305267333984375. This run prepares their exact midpoint, 142.339380900065108903618238400667905807495117187499999999999999999999999999999999999999999999999999999999999999999999999999999999999999999999801511442594139061646282388511472682863731960098898938145653302662158209892770606576766603005456194336238156245782804309333787864980170864092445808848567726507364968076384277770865572142221566047598853867597516750337075010041096141327112947781274865377554306178353726863861083984375, with a short experiment name to avoid filename-too-long failures.
