snapshot	board_exact	non_empty_accuracy	macro_f1	move_recall	false_change_rate	status	description
autoresearch/snapshots/20260419T151427Z_hybrid_lookahead_segmental_drop1_boardcands2_ratio95_props8_top4_detect10_lwindow3_minsep8_secsep1_thresh3_total150_permove142p28515625_lmargin9p935836791992188_m9p8957061767578125_r0_beam3_v844.py	0.071006	0.789778	0.739821	0.375000	0.024580	discard	Restore the recovered compact props8 sibling after recent local mapping showed the props7 shelf is saturated across top_move_candidates=5..16, beam_size=4 is an exact no-op, beam_size=2 is slightly worse, beam_size=1 is much worse, both hybrid acceptance gates are exact-flat down to 125.0, event_window_radius=1..2, segment_board_drop_worst_frames=0, and secondary_peak_ratio=0.98 are exact no-ops on the adjacent props7 shelf, secondary_min_event_separation=2 is worse there, and min_event_separation=8 and 6 are both worse than 7 there. On the compact props8 top4 anchor, top_board_candidates=2..4 are exact no-ops, top_move_candidates=4 is exact-flat while 5 is worse, secondary_min_event_separation=2 is worse, and raising min_event_separation from 7 to 8 opened a lower-noise shelf that remained exact-flat at 9 before breaking sharply at 10. On that minsep8 shelf, top_move_candidates=3 is exact-flat, 2 and 1 only slightly weaken secondary metrics, top_board_candidates=2..4 are exact-flat, top_board_candidates=1 is harmful, beam_size=2 is slightly worse, secsep2 is worse, and event_window_radius=1..2, segment_board_drop_worst_frames=0, and secondary_peak_ratio=0.98 are exact no-ops. Lowering min_score_gain_per_added_move from 150.0 to 137.5 increased false changes and weakened secondaries, while raising it from 150.0 to 162.5, 175.0, 187.5, 200.0, 212.5, 225.0, 237.5, 250.0, 262.5, 275.0, 287.5, and 300.0 were exact no-ops and lowering min_total_score_gain from 150.0 down to 87.5 was also exact-flat. Lowering only min_score_gain_per_added_move to 143.75, 142.96875, 142.578125, and 142.3828125 were exact no-ops, while 142.1875 again increased false changes and weakened secondaries, so the lower edge lies between 142.1875 and 142.3828125. This run restores the stable minsep8 shelf anchor and lowers only min_score_gain_per_added_move from 142.3828125 to 142.28515625 to continue binary-searching that lower edge.
autoresearch/snapshots/20260419T151651Z_hybrid_lookahead_segmental_drop1_boardcands2_ratio95_props8_top4_detect10_lwindow3_minsep8_secsep1_thresh3_total150_permove142p333984375_lmargin9p935836791992188_m9p8957061767578125_r0_beam3_v845.py	0.071006	0.789778	0.739821	0.375000	0.024580	discard	Restore the recovered compact props8 sibling after recent local mapping showed the props7 shelf is saturated across top_move_candidates=5..16, beam_size=4 is an exact no-op, beam_size=2 is slightly worse, beam_size=1 is much worse, both hybrid acceptance gates are exact-flat down to 125.0, event_window_radius=1..2, segment_board_drop_worst_frames=0, and secondary_peak_ratio=0.98 are exact no-ops on the adjacent props7 shelf, secondary_min_event_separation=2 is worse there, and min_event_separation=8 and 6 are both worse than 7 there. On the compact props8 top4 anchor, top_board_candidates=2..4 are exact no-ops, top_move_candidates=4 is exact-flat while 5 is worse, secondary_min_event_separation=2 is worse, and raising min_event_separation from 7 to 8 opened a lower-noise shelf that remained exact-flat at 9 before breaking sharply at 10. On that minsep8 shelf, top_move_candidates=3 is exact-flat, 2 and 1 only slightly weaken secondary metrics, top_board_candidates=2..4 are exact-flat, top_board_candidates=1 is harmful, beam_size=2 is slightly worse, secsep2 is worse, and event_window_radius=1..2, segment_board_drop_worst_frames=0, and secondary_peak_ratio=0.98 are exact no-ops. Lowering min_score_gain_per_added_move from 150.0 to 137.5 increased false changes and weakened secondaries, while raising it from 150.0 to 162.5, 175.0, 187.5, 200.0, 212.5, 225.0, 237.5, 250.0, 262.5, 275.0, 287.5, and 300.0 were exact no-ops and lowering min_total_score_gain from 150.0 down to 87.5 was also exact-flat. Lowering only min_score_gain_per_added_move to 143.75, 142.96875, 142.578125, and 142.3828125 were exact no-ops, while 142.28515625 and 142.1875 again increased false changes and weakened secondaries, so the lower edge lies between 142.28515625 and 142.3828125. This run restores the stable minsep8 shelf anchor and raises only min_score_gain_per_added_move from 142.28515625 to 142.333984375 to continue binary-searching that lower edge.
autoresearch/snapshots/20260419T151920Z_hybrid_lookahead_segmental_drop1_boardcands2_ratio95_props8_top4_detect10_lwindow3_minsep8_secsep1_thresh3_total150_permove142p3583984375_lmargin9p935836791992188_m9p8957061767578125_r0_beam3_v846.py	0.071006	0.799339	0.749250	0.375000	0.020699	discard	Restore the recovered compact props8 sibling after recent local mapping showed the props7 shelf is saturated across top_move_candidates=5..16, beam_size=4 is an exact no-op, beam_size=2 is slightly worse, beam_size=1 is much worse, both hybrid acceptance gates are exact-flat down to 125.0, event_window_radius=1..2, segment_board_drop_worst_frames=0, and secondary_peak_ratio=0.98 are exact no-ops on the adjacent props7 shelf, secondary_min_event_separation=2 is worse there, and min_event_separation=8 and 6 are both worse than 7 there. On the compact props8 top4 anchor, top_board_candidates=2..4 are exact no-ops, top_move_candidates=4 is exact-flat while 5 is worse, secondary_min_event_separation=2 is worse, and raising min_event_separation from 7 to 8 opened a lower-noise shelf that remained exact-flat at 9 before breaking sharply at 10. On that minsep8 shelf, top_move_candidates=3 is exact-flat, 2 and 1 only slightly weaken secondary metrics, top_board_candidates=2..4 are exact-flat, top_board_candidates=1 is harmful, beam_size=2 is slightly worse, secsep2 is worse, and event_window_radius=1..2, segment_board_drop_worst_frames=0, and secondary_peak_ratio=0.98 are exact no-ops. Lowering min_score_gain_per_added_move from 150.0 to 137.5 increased false changes and weakened secondaries, while raising it from 150.0 to 162.5, 175.0, 187.5, 200.0, 212.5, 225.0, 237.5, 250.0, 262.5, 275.0, 287.5, and 300.0 were exact no-ops and lowering min_total_score_gain from 150.0 down to 87.5 was also exact-flat. Lowering only min_score_gain_per_added_move to 143.75, 142.96875, 142.578125, and 142.3828125 were exact no-ops, while 142.333984375, 142.28515625, and 142.1875 again increased false changes and weakened secondaries, so the lower edge lies between 142.333984375 and 142.3828125. This run restores the stable minsep8 shelf anchor and raises only min_score_gain_per_added_move from 142.333984375 to 142.3583984375 to continue binary-searching that lower edge.
autoresearch/snapshots/20260419T152151Z_hybrid_lookahead_segmental_drop1_boardcands2_ratio95_props8_top4_detect10_lwindow3_minsep8_secsep1_thresh3_total150_permove142p34619140625_lmargin9p935836791992188_m9p8957061767578125_r0_beam3_v847.py	0.071006	0.799339	0.749250	0.375000	0.020699	discard	Restore the recovered compact props8 sibling after recent local mapping showed the props7 shelf is saturated across top_move_candidates=5..16, beam_size=4 is an exact no-op, beam_size=2 is slightly worse, beam_size=1 is much worse, both hybrid acceptance gates are exact-flat down to 125.0, event_window_radius=1..2, segment_board_drop_worst_frames=0, and secondary_peak_ratio=0.98 are exact no-ops on the adjacent props7 shelf, secondary_min_event_separation=2 is worse there, and min_event_separation=8 and 6 are both worse than 7 there. On the compact props8 top4 anchor, top_board_candidates=2..4 are exact no-ops, top_move_candidates=4 is exact-flat while 5 is worse, secondary_min_event_separation=2 is worse, and raising min_event_separation from 7 to 8 opened a lower-noise shelf that remained exact-flat at 9 before breaking sharply at 10. On that minsep8 shelf, top_move_candidates=3 is exact-flat, 2 and 1 only slightly weaken secondary metrics, top_board_candidates=2..4 are exact-flat, top_board_candidates=1 is harmful, beam_size=2 is slightly worse, secsep2 is worse, and event_window_radius=1..2, segment_board_drop_worst_frames=0, and secondary_peak_ratio=0.98 are exact no-ops. Lowering min_score_gain_per_added_move from 150.0 to 137.5 increased false changes and weakened secondaries, while raising it from 150.0 to 162.5, 175.0, 187.5, 200.0, 212.5, 225.0, 237.5, 250.0, 262.5, 275.0, 287.5, and 300.0 were exact no-ops and lowering min_total_score_gain from 150.0 down to 87.5 was also exact-flat. Lowering only min_score_gain_per_added_move to 143.75, 142.96875, 142.578125, and 142.3828125 were exact no-ops, while 142.333984375, 142.28515625, and 142.1875 again increased false changes and weakened secondaries, so the lower edge lies between 142.333984375 and 142.3583984375. This run restores the stable minsep8 shelf anchor and raises only min_score_gain_per_added_move from 142.333984375 to 142.34619140625 to continue binary-searching that lower edge.
autoresearch/snapshots/20260419T152431Z_hybrid_lookahead_segmental_drop1_boardcands2_ratio95_props8_top4_detect10_lwindow3_minsep8_secsep1_thresh3_total150_permove142p340087890625_lmargin9p935836791992188_m9p8957061767578125_r0_beam3_v848.py	0.071006	0.799339	0.749250	0.375000	0.020699	discard	Restore the recovered compact props8 sibling after recent local mapping showed the props7 shelf is saturated across top_move_candidates=5..16, beam_size=4 is an exact no-op, beam_size=2 is slightly worse, beam_size=1 is much worse, both hybrid acceptance gates are exact-flat down to 125.0, event_window_radius=1..2, segment_board_drop_worst_frames=0, and secondary_peak_ratio=0.98 are exact no-ops on the adjacent props7 shelf, secondary_min_event_separation=2 is worse there, and min_event_separation=8 and 6 are both worse than 7 there. On the compact props8 top4 anchor, top_board_candidates=2..4 are exact no-ops, top_move_candidates=4 is exact-flat while 5 is worse, secondary_min_event_separation=2 is worse, and raising min_event_separation from 7 to 8 opened a lower-noise shelf that remained exact-flat at 9 before breaking sharply at 10. On that minsep8 shelf, top_move_candidates=3 is exact-flat, 2 and 1 only slightly weaken secondary metrics, top_board_candidates=2..4 are exact-flat, top_board_candidates=1 is harmful, beam_size=2 is slightly worse, secsep2 is worse, and event_window_radius=1..2, segment_board_drop_worst_frames=0, and secondary_peak_ratio=0.98 are exact no-ops. Lowering min_score_gain_per_added_move from 150.0 to 137.5 increased false changes and weakened secondaries, while raising it from 150.0 to 162.5, 175.0, 187.5, 200.0, 212.5, 225.0, 237.5, 250.0, 262.5, 275.0, 287.5, and 300.0 were exact no-ops and lowering min_total_score_gain from 150.0 down to 87.5 was also exact-flat. Lowering only min_score_gain_per_added_move to 143.75, 142.96875, 142.578125, and 142.3828125 were exact no-ops, while 142.333984375, 142.28515625, and 142.1875 again increased false changes and weakened secondaries, so the lower edge lies between 142.333984375 and 142.34619140625. This run restores the stable minsep8 shelf anchor and raises only min_score_gain_per_added_move from 142.333984375 to 142.340087890625 to continue binary-searching that lower edge.
autoresearch/snapshots/20260419T152702Z_hybrid_lookahead_segmental_drop1_boardcands2_ratio95_props8_top4_detect10_lwindow3_minsep8_secsep1_thresh3_total150_permove142p3370361328125_lmargin9p935836791992188_m9p8957061767578125_r0_beam3_v849.py	0.071006	0.789778	0.739821	0.375000	0.024580	discard	Restore the recovered compact props8 sibling after recent local mapping showed the props7 shelf is saturated across top_move_candidates=5..16, beam_size=4 is an exact no-op, beam_size=2 is slightly worse, beam_size=1 is much worse, both hybrid acceptance gates are exact-flat down to 125.0, event_window_radius=1..2, segment_board_drop_worst_frames=0, and secondary_peak_ratio=0.98 are exact no-ops on the adjacent props7 shelf, secondary_min_event_separation=2 is worse there, and min_event_separation=8 and 6 are both worse than 7 there. On the compact props8 top4 anchor, top_board_candidates=2..4 are exact no-ops, top_move_candidates=4 is exact-flat while 5 is worse, secondary_min_event_separation=2 is worse, and raising min_event_separation from 7 to 8 opened a lower-noise shelf that remained exact-flat at 9 before breaking sharply at 10. On that minsep8 shelf, top_move_candidates=3 is exact-flat, 2 and 1 only slightly weaken secondary metrics, top_board_candidates=2..4 are exact-flat, top_board_candidates=1 is harmful, beam_size=2 is slightly worse, secsep2 is worse, and event_window_radius=1..2, segment_board_drop_worst_frames=0, and secondary_peak_ratio=0.98 are exact no-ops. Lowering min_score_gain_per_added_move from 150.0 to 137.5 increased false changes and weakened secondaries, while raising it from 150.0 to 162.5, 175.0, 187.5, 200.0, 212.5, 225.0, 237.5, 250.0, 262.5, 275.0, 287.5, and 300.0 were exact no-ops and lowering min_total_score_gain from 150.0 down to 87.5 was also exact-flat. Lowering only min_score_gain_per_added_move to 143.75, 142.96875, 142.578125, and 142.3828125 were exact no-ops, while 142.333984375, 142.28515625, and 142.1875 again increased false changes and weakened secondaries, so the lower edge lies between 142.333984375 and 142.340087890625. This run restores the stable minsep8 shelf anchor and raises only min_score_gain_per_added_move from 142.333984375 to 142.3370361328125 to continue binary-searching that lower edge.
autoresearch/snapshots/20260419T152930Z_hybrid_lookahead_segmental_drop1_boardcands2_ratio95_props8_top4_detect10_lwindow3_minsep8_secsep1_thresh3_total150_permove142p33856201171875_lmargin9p935836791992188_m9p8957061767578125_r0_beam3_v850.py	0.071006	0.789778	0.739821	0.375000	0.024580	discard	Restore the recovered compact props8 sibling after recent local mapping showed the props7 shelf is saturated across top_move_candidates=5..16, beam_size=4 is an exact no-op, beam_size=2 is slightly worse, beam_size=1 is much worse, both hybrid acceptance gates are exact-flat down to 125.0, event_window_radius=1..2, segment_board_drop_worst_frames=0, and secondary_peak_ratio=0.98 are exact no-ops on the adjacent props7 shelf, secondary_min_event_separation=2 is worse there, and min_event_separation=8 and 6 are both worse than 7 there. On the compact props8 top4 anchor, top_board_candidates=2..4 are exact no-ops, top_move_candidates=4 is exact-flat while 5 is worse, secondary_min_event_separation=2 is worse, and raising min_event_separation from 7 to 8 opened a lower-noise shelf that remained exact-flat at 9 before breaking sharply at 10. On that minsep8 shelf, top_move_candidates=3 is exact-flat, 2 and 1 only slightly weaken secondary metrics, top_board_candidates=2..4 are exact-flat, top_board_candidates=1 is harmful, beam_size=2 is slightly worse, secsep2 is worse, and event_window_radius=1..2, segment_board_drop_worst_frames=0, and secondary_peak_ratio=0.98 are exact no-ops. Lowering min_score_gain_per_added_move from 150.0 to 137.5 increased false changes and weakened secondaries, while raising it from 150.0 to 162.5, 175.0, 187.5, 200.0, 212.5, 225.0, 237.5, 250.0, 262.5, 275.0, 287.5, and 300.0 were exact no-ops and lowering min_total_score_gain from 150.0 down to 87.5 was also exact-flat. Lowering only min_score_gain_per_added_move to 143.75, 142.96875, 142.578125, and 142.3828125 were exact no-ops, while 142.3370361328125, 142.333984375, 142.28515625, and 142.1875 again increased false changes and weakened secondaries, so the lower edge lies between 142.3370361328125 and 142.340087890625. This run restores the stable minsep8 shelf anchor and raises only min_score_gain_per_added_move from 142.3370361328125 to 142.33856201171875 to continue binary-searching that lower edge.
autoresearch/snapshots/20260419T153201Z_hybrid_lookahead_segmental_drop1_boardcands2_ratio95_props8_top4_detect10_lwindow3_minsep8_secsep1_thresh3_total150_permove142p33932495117188_lmargin9p935836791992188_m9p8957061767578125_r0_beam3_v851.py	0.071006	0.789778	0.739821	0.375000	0.024580	discard	Restore the recovered compact props8 sibling after recent local mapping showed the props7 shelf is saturated across top_move_candidates=5..16, beam_size=4 is an exact no-op, beam_size=2 is slightly worse, beam_size=1 is much worse, both hybrid acceptance gates are exact-flat down to 125.0, event_window_radius=1..2, segment_board_drop_worst_frames=0, and secondary_peak_ratio=0.98 are exact no-ops on the adjacent props7 shelf, secondary_min_event_separation=2 is worse there, and min_event_separation=8 and 6 are both worse than 7 there. On the compact props8 top4 anchor, top_board_candidates=2..4 are exact no-ops, top_move_candidates=4 is exact-flat while 5 is worse, secondary_min_event_separation=2 is worse, and raising min_event_separation from 7 to 8 opened a lower-noise shelf that remained exact-flat at 9 before breaking sharply at 10. On that minsep8 shelf, top_move_candidates=3 is exact-flat, 2 and 1 only slightly weaken secondary metrics, top_board_candidates=2..4 are exact-flat, top_board_candidates=1 is harmful, beam_size=2 is slightly worse, secsep2 is worse, and event_window_radius=1..2, segment_board_drop_worst_frames=0, and secondary_peak_ratio=0.98 are exact no-ops. Lowering min_score_gain_per_added_move from 150.0 to 137.5 increased false changes and weakened secondaries, while raising it from 150.0 to 162.5, 175.0, 187.5, 200.0, 212.5, 225.0, 237.5, 250.0, 262.5, 275.0, 287.5, and 300.0 were exact no-ops and lowering min_total_score_gain from 150.0 down to 87.5 was also exact-flat. Lowering only min_score_gain_per_added_move to 143.75, 142.96875, 142.578125, and 142.3828125 were exact no-ops, while 142.33856201171875, 142.3370361328125, 142.333984375, 142.28515625, and 142.1875 again increased false changes and weakened secondaries, so the lower edge lies between 142.33856201171875 and 142.340087890625. This run restores the stable minsep8 shelf anchor and raises only min_score_gain_per_added_move from 142.33856201171875 to 142.33932495117188 to continue binary-searching that lower edge.
autoresearch/snapshots/20260419T153433Z_hybrid_lookahead_segmental_drop1_boardcands2_ratio95_props8_top4_detect10_lwindow3_minsep8_secsep1_thresh3_total150_permove142p33970642089844_lmargin9p935836791992188_m9p8957061767578125_r0_beam3_v852.py	0.071006	0.799339	0.749250	0.375000	0.020699	discard	Restore the recovered compact props8 sibling after recent local mapping showed the props7 shelf is saturated across top_move_candidates=5..16, beam_size=4 is an exact no-op, beam_size=2 is slightly worse, beam_size=1 is much worse, both hybrid acceptance gates are exact-flat down to 125.0, event_window_radius=1..2, segment_board_drop_worst_frames=0, and secondary_peak_ratio=0.98 are exact no-ops on the adjacent props7 shelf, secondary_min_event_separation=2 is worse there, and min_event_separation=8 and 6 are both worse than 7 there. On the compact props8 top4 anchor, top_board_candidates=2..4 are exact no-ops, top_move_candidates=4 is exact-flat while 5 is worse, secondary_min_event_separation=2 is worse, and raising min_event_separation from 7 to 8 opened a lower-noise shelf that remained exact-flat at 9 before breaking sharply at 10. On that minsep8 shelf, top_move_candidates=3 is exact-flat, 2 and 1 only slightly weaken secondary metrics, top_board_candidates=2..4 are exact-flat, top_board_candidates=1 is harmful, beam_size=2 is slightly worse, secsep2 is worse, and event_window_radius=1..2, segment_board_drop_worst_frames=0, and secondary_peak_ratio=0.98 are exact no-ops. Lowering min_score_gain_per_added_move from 150.0 to 137.5 increased false changes and weakened secondaries, while raising it from 150.0 to 162.5, 175.0, 187.5, 200.0, 212.5, 225.0, 237.5, 250.0, 262.5, 275.0, 287.5, and 300.0 were exact no-ops and lowering min_total_score_gain from 150.0 down to 87.5 was also exact-flat. Lowering only min_score_gain_per_added_move to 143.75, 142.96875, 142.578125, and 142.3828125 were exact no-ops, while 142.33932495117188, 142.33856201171875, 142.3370361328125, 142.333984375, 142.28515625, and 142.1875 again increased false changes and weakened secondaries, so the lower edge lies between 142.33932495117188 and 142.340087890625. This run restores the stable minsep8 shelf anchor and raises only min_score_gain_per_added_move from 142.33932495117188 to 142.33970642089844 to continue binary-searching that lower edge.
