snapshot	board_exact	non_empty_accuracy	macro_f1	move_recall	false_change_rate	status	description
autoresearch/snapshots/20260419T220359Z_hybrid_p8_m8_w3_g142p3393809000651089036182384006679058074951171874999993537651464429471290067119593203415206517092883586883544921875_v1012.py	0.071006	0.789778	0.739821	0.375000	0.024580	discard	Restore the compact props8 + minsep8 hybrid shelf anchored at lwindow3, beam3, top4, boardcands2, secsep1, radius0, drop1, props8, total150, and lmargin9.935836791992188. The latest executed bracket is harmful at 142.339380900065108903618238400667905807495117187499993537651464429471290067119593203415206517092883586883544921875 and exact-flat at 142.3393809000651089036182384006679058074951171875000051698788284564229679463043254372678347863256931304931640625, so this run restores the same shelf anchor and raises only min_score_gain_per_added_move to 142.3393809000651089036182384006679058074951171874999993537651464429471290067119593203415206517092883586883544921875 to continue binary-searching that lower edge. The experiment name remains shortened to avoid the filename-too-long failure seen with long autogenerated names.
autoresearch/snapshots/20260419T220632Z_hybrid_p8_m8_w3_g142p33938090006510890361823840066790580749511718750000226182198744968504847650814237880467771901749074459075927734375_v1013.py	0.071006	0.799339	0.749250	0.375000	0.020699	discard	Restore the compact props8 + minsep8 hybrid shelf anchored at lwindow3, beam3, top4, boardcands2, secsep1, radius0, drop1, props8, total150, and lmargin9.935836791992188. The latest executed bracket is harmful at 142.3393809000651089036182384006679058074951171874999993537651464429471290067119593203415206517092883586883544921875 and exact-flat at 142.3393809000651089036182384006679058074951171875000051698788284564229679463043254372678347863256931304931640625, so this run restores the same shelf anchor and raises only min_score_gain_per_added_move to 142.33938090006510890361823840066790580749511718750000226182198744968504847650814237880467771901749074459075927734375 to continue binary-searching that lower edge. The experiment name remains shortened to avoid the filename-too-long failure seen with long autogenerated names.
autoresearch/snapshots/20260419T220910Z_hybrid_p8_m8_w3_g142p339380900065108903618238400667905807495117187500000807793566946316088741610050849573099185363389551639556884765625_v1014.py	0.071006	0.799339	0.749250	0.375000	0.020699	discard	Restore the compact props8 + minsep8 hybrid shelf anchored at lwindow3, beam3, top4, boardcands2, secsep1, radius0, drop1, props8, total150, and lmargin9.935836791992188. The latest executed bracket is harmful at 142.3393809000651089036182384006679058074951171874999993537651464429471290067119593203415206517092883586883544921875 and exact-flat at 142.33938090006510890361823840066790580749511718750000226182198744968504847650814237880467771901749074459075927734375, so this run restores the same shelf anchor and raises only min_score_gain_per_added_move to 142.339380900065108903618238400667905807495117187500000807793566946316088741610050849573099185363389551639556884765625 to continue binary-searching that lower edge. The experiment name remains shortened to avoid the filename-too-long failure seen with long autogenerated names.
autoresearch/snapshots/20260419T221155Z_hybrid_p8_m8_w3_g142p3393809000651089036182384006679058074951171875000000807793566946316088741610050849573099185363389551639556884765625_v1015.py	0.071006	0.799339	0.749250	0.375000	0.020699	discard	Restore the compact props8 + minsep8 hybrid shelf anchored at lwindow3, beam3, top4, boardcands2, secsep1, radius0, drop1, props8, total150, and lmargin9.935836791992188. The latest executed bracket is harmful at 142.3393809000651089036182384006679058074951171874999993537651464429471290067119593203415206517092883586883544921875 and exact-flat at 142.339380900065108903618238400667905807495117187500000807793566946316088741610050849573099185363389551639556884765625, so this run restores the same shelf anchor and raises only min_score_gain_per_added_move to 142.3393809000651089036182384006679058074951171875000000807793566946316088741610050849573099185363389551639556884765625 to continue binary-searching that lower edge. The experiment name remains shortened to avoid the filename-too-long failure seen with long autogenerated names.
autoresearch/snapshots/20260419T221438Z_hybrid_p8_m8_w3_g142p33938090006510890361823840066790580749511718749999971727225156878936894043648220264941528512281365692615509033203125_v1016.py	0.071006	0.789778	0.739821	0.375000	0.024580	discard	Restore the compact props8 + minsep8 hybrid shelf anchored at lwindow3, beam3, top4, boardcands2, secsep1, radius0, drop1, props8, total150, and lmargin9.935836791992188. The latest executed bracket is harmful at 142.3393809000651089036182384006679058074951171874999993537651464429471290067119593203415206517092883586883544921875 and exact-flat at 142.3393809000651089036182384006679058074951171875000000807793566946316088741610050849573099185363389551639556884765625, so this run restores the same shelf anchor and raises only min_score_gain_per_added_move to 142.33938090006510890361823840066790580749511718749999971727225156878936894043648220264941528512281365692615509033203125 to continue binary-searching that lower edge. The experiment name remains shortened to avoid the filename-too-long failure seen with long autogenerated names.
autoresearch/snapshots/20260419T221727Z_hybrid_p8_m8_w3_g142p339380900065108903618238400667905807495117187499999899025804131710488907298743643803362601829576306045055389404296875_v1017.py	0.071006	0.789778	0.739821	0.375000	0.024580	discard	Restore the compact props8 + minsep8 hybrid shelf anchored at lwindow3, beam3, top4, boardcands2, secsep1, radius0, drop1, props8, total150, and lmargin9.935836791992188. The latest executed bracket is harmful at 142.33938090006510890361823840066790580749511718749999971727225156878936894043648220264941528512281365692615509033203125 and exact-flat at 142.3393809000651089036182384006679058074951171875000000807793566946316088741610050849573099185363389551639556884765625, so this run restores the same shelf anchor and raises only min_score_gain_per_added_move to 142.339380900065108903618238400667905807495117187499999899025804131710488907298743643803362601829576306045055389404296875 to continue binary-searching that lower edge. The experiment name remains shortened to avoid the filename-too-long failure seen with long autogenerated names.
autoresearch/snapshots/20260419T222003Z_hybrid_p8_m8_w3_g142p3393809000651089036182384006679058074951171874999999899025804131710488907298743643803362601829576306045055389404296875_v1018.py	0.071006	0.789778	0.739821	0.375000	0.024580	discard	Restore the compact props8 + minsep8 hybrid shelf anchored at lwindow3, beam3, top4, boardcands2, secsep1, radius0, drop1, props8, total150, and lmargin9.935836791992188. The latest executed bracket is harmful at 142.339380900065108903618238400667905807495117187499999899025804131710488907298743643803362601829576306045055389404296875 and exact-flat at 142.3393809000651089036182384006679058074951171875000000807793566946316088741610050849573099185363389551639556884765625, so this run restores the same shelf anchor and raises only min_score_gain_per_added_move to 142.3393809000651089036182384006679058074951171874999999899025804131710488907298743643803362601829576306045055389404296875 to continue binary-searching that lower edge. The experiment name remains shortened to avoid the filename-too-long failure seen with long autogenerated names.
autoresearch/snapshots/20260419T222256Z_hybrid_p8_m8_w3_g142p33938090006510890361823840066790580749511718750000003534096855390132888244543972466882308935964829288423061370849609375_v1019.py	0.071006	0.799339	0.749250	0.375000	0.020699	discard	Restore the compact props8 + minsep8 hybrid shelf anchored at lwindow3, beam3, top4, boardcands2, secsep1, radius0, drop1, props8, total150, and lmargin9.935836791992188. The latest executed bracket is harmful at 142.3393809000651089036182384006679058074951171874999999899025804131710488907298743643803362601829576306045055389404296875 and exact-flat at 142.3393809000651089036182384006679058074951171875000000807793566946316088741610050849573099185363389551639556884765625, so this run restores the same shelf anchor and raises only min_score_gain_per_added_move to 142.33938090006510890361823840066790580749511718750000003534096855390132888244543972466882308935964829288423061370849609375 to continue binary-searching that lower edge. The experiment name remains shortened to avoid the filename-too-long failure seen with long autogenerated names.
autoresearch/snapshots/20260419T222529Z_hybrid_p8_m8_w3_g142p339380900065108903618238400667905807495117187500000012621774483536188886587657044524579674771302961744368076324462890625_v1020.py	0.071006	0.799339	0.749250	0.375000	0.020699	discard	Restore the compact props8 + minsep8 hybrid shelf anchored at lwindow3, beam3, top4, boardcands2, secsep1, radius0, drop1, props8, total150, and lmargin9.935836791992188. The latest executed bracket is harmful at 142.3393809000651089036182384006679058074951171874999999899025804131710488907298743643803362601829576306045055389404296875 and exact-flat at 142.33938090006510890361823840066790580749511718750000003534096855390132888244543972466882308935964829288423061370849609375, so this run restores the same shelf anchor and raises only min_score_gain_per_added_move to 142.339380900065108903618238400667905807495117187500000012621774483536188886587657044524579674771302961744368076324462890625 to continue binary-searching that lower edge. The experiment name remains shortened to avoid the filename-too-long failure seen with long autogenerated names.
autoresearch/snapshots/20260419T223135Z_hybrid_p8_m8_w3_g142p3393809000651089036182384006679058074951171875000000012621774483536188886587657044524579674771302961744368076324462890625_v1021.py	0.071006	0.799339	0.749250	0.375000	0.020699	discard	Restore the compact props8 + minsep8 hybrid shelf anchored at lwindow3, beam3, top4, boardcands2, secsep1, radius0, drop1, props8, total150, and lmargin9.935836791992188. The latest executed bracket is harmful at 142.3393809000651089036182384006679058074951171874999999899025804131710488907298743643803362601829576306045055389404296875 and exact-flat at 142.339380900065108903618238400667905807495117187500000012621774483536188886587657044524579674771302961744368076324462890625, so this run restores the same shelf anchor and raises only min_score_gain_per_added_move to 142.3393809000651089036182384006679058074951171875000000012621774483536188886587657044524579674771302961744368076324462890625 to continue binary-searching that lower edge. The experiment name remains shortened to avoid the filename-too-long failure seen with long autogenerated names.
autoresearch/snapshots/20260419T223345Z_hybrid_p8_m8_w3_g142p33938090006510890361823840066790580749511718749999999558237893076233388969432003441639711383004396338947117328643798828125_v1022.py	0.071006	0.789778	0.739821	0.375000	0.024580	discard	Restore the compact props8 + minsep8 hybrid shelf anchored at lwindow3, beam3, top4, boardcands2, secsep1, radius0, drop1, props8, total150, and lmargin9.935836791992188. The latest executed bracket is harmful at 142.3393809000651089036182384006679058074951171874999999899025804131710488907298743643803362601829576306045055389404296875 and exact-flat at 142.3393809000651089036182384006679058074951171875000000012621774483536188886587657044524579674771302961744368076324462890625, so this run restores the same shelf anchor and raises only min_score_gain_per_added_move to 142.33938090006510890361823840066790580749511718749999999558237893076233388969432003441639711383004396338947117328643798828125 to continue binary-searching that lower edge. The experiment name remains shortened to avoid the filename-too-long failure seen with long autogenerated names.
autoresearch/snapshots/20260419T223555Z_hybrid_p8_m8_w3_g142p339380900065108903618238400667905807495117187499999998422278189557976389176542869434427540653587129781953990459442138671875_v1023.py	0.071006	0.789778	0.739821	0.375000	0.024580	discard	Restore the compact props8 + minsep8 hybrid shelf anchored at lwindow3, beam3, top4, boardcands2, secsep1, radius0, drop1, props8, total150, and lmargin9.935836791992188. The latest executed bracket is harmful at 142.33938090006510890361823840066790580749511718749999999558237893076233388969432003441639711383004396338947117328643798828125 and exact-flat at 142.3393809000651089036182384006679058074951171875000000012621774483536188886587657044524579674771302961744368076324462890625, so this run restores the same shelf anchor and raises only min_score_gain_per_added_move to 142.339380900065108903618238400667905807495117187499999998422278189557976389176542869434427540653587129781953990459442138671875 to continue binary-searching that lower edge. The experiment name remains shortened to avoid the filename-too-long failure seen with long autogenerated names.
autoresearch/snapshots/20260419T223811Z_hybrid_p8_m8_w3_g142p3393809000651089036182384006679058074951171874999999998422278189557976389176542869434427540653587129781953990459442138671875_v1024.py	0.071006	0.789778	0.739821	0.375000	0.024580	discard	Restore the compact props8 + minsep8 hybrid shelf anchored at lwindow3, beam3, top4, boardcands2, secsep1, radius0, drop1, props8, total150, and lmargin9.935836791992188. The latest executed bracket is harmful at 142.339380900065108903618238400667905807495117187499999998422278189557976389176542869434427540653587129781953990459442138671875 and exact-flat at 142.3393809000651089036182384006679058074951171875000000012621774483536188886587657044524579674771302961744368076324462890625, so this run restores the same shelf anchor and raises only min_score_gain_per_added_move to 142.3393809000651089036182384006679058074951171874999999998422278189557976389176542869434427540653587129781953990459442138671875 to continue binary-searching that lower edge. The experiment name remains shortened to avoid the filename-too-long failure seen with long autogenerated names.
autoresearch/snapshots/20260419T224025Z_hybrid_p8_m8_w3_g142p33938090006510890361823840066790580749511718750000000055220263365470826378820999569795036077124450457631610333919525146484375_v1025.py	0.071006	0.799339	0.749250	0.375000	0.020699	discard	Restore the compact props8 + minsep8 hybrid shelf anchored at lwindow3, beam3, top4, boardcands2, secsep1, radius0, drop1, props8, total150, and lmargin9.935836791992188. The latest executed bracket is harmful at 142.3393809000651089036182384006679058074951171874999999998422278189557976389176542869434427540653587129781953990459442138671875 and exact-flat at 142.3393809000651089036182384006679058074951171875000000012621774483536188886587657044524579674771302961744368076324462890625, so this run restores the same shelf anchor and raises only min_score_gain_per_added_move to 142.33938090006510890361823840066790580749511718750000000055220263365470826378820999569795036077124450457631610333919525146484375 to continue binary-searching that lower edge. The experiment name remains shortened to avoid the filename-too-long failure seen with long autogenerated names.
autoresearch/snapshots/20260419T224238Z_hybrid_p8_m8_w3_g142p339380900065108903618238400667905807495117187500000000197215226305252951352932141320696557418301608777255751192569732666015625_v1026.py	0.071006	0.799339	0.749250	0.375000	0.020699	discard	Restore the compact props8 + minsep8 hybrid shelf anchored at lwindow3, beam3, top4, boardcands2, secsep1, radius0, drop1, props8, total150, and lmargin9.935836791992188. The latest executed bracket is harmful at 142.3393809000651089036182384006679058074951171874999999998422278189557976389176542869434427540653587129781953990459442138671875 and exact-flat at 142.33938090006510890361823840066790580749511718750000000055220263365470826378820999569795036077124450457631610333919525146484375, so this run restores the same shelf anchor and raises only min_score_gain_per_added_move to 142.339380900065108903618238400667905807495117187500000000197215226305252951352932141320696557418301608777255751192569732666015625 to continue binary-searching that lower edge. The experiment name remains shortened to avoid the filename-too-long failure seen with long autogenerated names.
autoresearch/snapshots/20260419T224452Z_hybrid_p8_m8_w3_g142p3393809000651089036182384006679058074951171875000000000197215226305252951352932141320696557418301608777255751192569732666015625_v1027.py	0.071006	0.799339	0.749250	0.375000	0.020699	discard	Restore the compact props8 + minsep8 hybrid shelf anchored at lwindow3, beam3, top4, boardcands2, secsep1, radius0, drop1, props8, total150, and lmargin9.935836791992188. The latest executed bracket is harmful at 142.3393809000651089036182384006679058074951171874999999998422278189557976389176542869434427540653587129781953990459442138671875 and exact-flat at 142.339380900065108903618238400667905807495117187500000000197215226305252951352932141320696557418301608777255751192569732666015625, so this run restores the same shelf anchor and raises only min_score_gain_per_added_move to 142.3393809000651089036182384006679058074951171875000000000197215226305252951352932141320696557418301608777255751192569732666015625 to continue binary-searching that lower edge. The experiment name remains shortened to avoid the filename-too-long failure seen with long autogenerated names.
autoresearch/snapshots/20260419T224705Z_hybrid_p8_m8_w3_g142p33938090006510890361823840066790580749511718749999999993097467079316146702647375053775620490359443692796048708260059356689453125_v1028.py	0.071006	0.789778	0.739821	0.375000	0.024580	discard	Restore the compact props8 + minsep8 hybrid shelf anchored at lwindow3, beam3, top4, boardcands2, secsep1, radius0, drop1, props8, total150, and lmargin9.935836791992188. The latest executed bracket is harmful at 142.3393809000651089036182384006679058074951171874999999998422278189557976389176542869434427540653587129781953990459442138671875 and exact-flat at 142.3393809000651089036182384006679058074951171875000000000197215226305252951352932141320696557418301608777255751192569732666015625, so this run restores the same shelf anchor and raises only min_score_gain_per_added_move to 142.33938090006510890361823840066790580749511718749999999993097467079316146702647375053775620490359443692796048708260059356689453125 to continue binary-searching that lower edge. The experiment name remains shortened to avoid the filename-too-long failure seen with long autogenerated names.
autoresearch/snapshots/20260419T224919Z_hybrid_p8_m8_w3_g142p339380900065108903618238400667905807495117187499999999975348096711843381080883482334912930322712298902843031100928783416748046875_v1029.py	0.071006	0.789778	0.739821	0.375000	0.024580	discard	Restore the compact props8 + minsep8 hybrid shelf anchored at lwindow3, beam3, top4, boardcands2, secsep1, radius0, drop1, props8, total150, and lmargin9.935836791992188. The latest executed bracket is harmful at 142.33938090006510890361823840066790580749511718749999999993097467079316146702647375053775620490359443692796048708260059356689453125 and exact-flat at 142.3393809000651089036182384006679058074951171875000000000197215226305252951352932141320696557418301608777255751192569732666015625, so this run restores the same shelf anchor and raises only min_score_gain_per_added_move to 142.339380900065108903618238400667905807495117187499999999975348096711843381080883482334912930322712298902843031100928783416748046875 to continue binary-searching that lower edge. The experiment name remains shortened to avoid the filename-too-long failure seen with long autogenerated names.
autoresearch/snapshots/20260419T225136Z_hybrid_p8_m8_w3_g142p3393809000651089036182384006679058074951171874999999999975348096711843381080883482334912930322712298902843031100928783416748046875_v1030.py	0.071006	0.789778	0.739821	0.375000	0.024580	discard	Restore the compact props8 + minsep8 hybrid shelf anchored at lwindow3, beam3, top4, boardcands2, secsep1, radius0, drop1, props8, total150, and lmargin9.935836791992188. The latest executed bracket is harmful at 142.339380900065108903618238400667905807495117187499999999975348096711843381080883482334912930322712298902843031100928783416748046875 and exact-flat at 142.3393809000651089036182384006679058074951171875000000000197215226305252951352932141320696557418301608777255751192569732666015625, so this run restores the same shelf anchor and raises only min_score_gain_per_added_move to 142.3393809000651089036182384006679058074951171874999999999975348096711843381080883482334912930322712298902843031100928783416748046875 to continue binary-searching that lower edge. The experiment name remains shortened to avoid the filename-too-long failure seen with long autogenerated names.
